,ID,event_id,article_title,article_link,article_content,publishing_date,article_image,article_keywords,article_relevance,category
32,32,FL-2021-000025-AUS,Floods pile pressure on Australia to rethink climate adaptation - Thomson Reuters Foundation,https://news.trust.org/item/20210325225707-a7fl6/,"As climate change impacts worsen, Australia's population is exposed to more severe floods, droughts and bushfires, while action to protect people and their homes lags

* Severe floods have pummelled several parts of the country

* Climate change hiking threats fast, including from bushfires

* Government now working on new climate resilience plan

By Michael Taylor

March 26 (Thomson Reuters Foundation) - Australia, now battling its worst floods in more than half a century, has failed to adapt fast enough to the growing threats it faces from the impacts of climate change, with its people now suffering the effects of ""wilful ignorance"", analysts warned.

Heavy rains hit several parts of the country this week, sweeping away houses, roads and livestock and cutting off entire towns in the east. Dangerous flash floods killed two people and more than 40,000 people were forced to flee their homes.

""They call Australia 'disaster alley' because we've got a bit of everything,"" said Karl Mallon, CEO of Sydney-based Climate Valuation, which advises homeowners and buyers on climate and extreme weather risks.

As global warming accelerates, it is bringing fiercer storms, floods and heatwaves, more severe droughts and a growing risk of bushfires to Australia.

""It's a shame on us that we haven't tackled this already... We've got every incentive and the money to do it, it's just that we're not looking at it,"" Mallon told the Thomson Reuters Foundation.

Despite knowing about climate change since the 1980s, Australia continues to build homes in floodplains, he noted.

The problem is often rooted in ""wilful ignorance"", he said, citing government reliance on land taxes, builders and developers putting profits before safety from climate threats, and homeowners seeking to minimise insurance payments.

Property buyers are given little information on flood risks, either by local government or banks and insurers, Mallon said.

""Sometimes the first time they find out is when they get hit - and they say 'I didn't know I was in a flood zone',"" he added.

Richie Merzian, climate and energy programme director at think-tank The Australia Institute, said so far the approach to adapting to climate change impacts has been disjointed between federal, state and council levels, curbing resilience.

""The federal government seems allergic to any mention of climate change which hampers smart policy responses,"" he said.

'SELF-COMBUSTING MANURE'

Last year's bushfires - which Prime Minister Scott Morrison dubbed Australia's ""black summer"" - killed more than 30 people, destroyed wildlife and razed over 24 million hectares (59 million acres).

When the crisis hit, Morrison's deputy was reported to have partly blamed ""self-combusting piles of manure"".

Meanwhile, the health of Australia's Great Barrier Reef, the world's most extensive and spectacular coral reef ecosystem, is in a critical state and deteriorating as climate change heats up the waters where it lies, conservation groups say.

""The first thing is to acknowledge that climate impacts will get worse and that 'one-in-100-years' type events will become more common, and we need to plan for that reality,"" said Cam Walker, campaigns coordinator at Friends of the Earth Australia.

To deal with the risks, a region-based approach to adaptation should be crafted that allows for joined-up responses between different levels of government and communities, he said.

Mallon said government, mortgage lenders and insurers needed to offer homeowners incentives to upgrade and better protect their properties, ensuring roofs are stronger against storms and flood barriers built around high-risk buildings.

At a municipal level, increased drainage, better sea walls and modern fire-fighting equipment would help, he added.

To reduce damage from bushfires, he advised at-risk property owners to clear guttering of flammable materials, install sprinklers and shutters that keep out embers, and use fire-retardant paint.

NATIONAL ADAPTATION PLAN

Australia has sophisticated weather monitoring systems and has been able to issue flood warnings and evacuate those in harm's way, potentially saving thousands of lives, said Merzian at The Australia Institute.

But despite the country's vulnerability to climate impacts, the government has been slow to conduct a national climate assessment or prepare a National Adaptation Plan, he said.

In January, Australia's environment minister committed to produce a new climate resilience and adaptation strategy this year, which it is due to publish before the COP26 U.N. climate talks in November.

As part of the initiative, Canberra said it would invest an initial A$12.9 million ($9.8 million) to prepare for disasters.

Protecting and restoring wetlands, mangroves and forests would help shield communities from floods and storms, while more trees in cities would also ease the effects of heat, green groups say.

Changing crops and tilling practices, and introducing livestock breeds that can tolerate drier conditions, are other options to combat droughts, said Will Steffen, a climate scientist at the Australian National University.

But conservative governments have been reluctant to change well-established practices in the agriculture and construction sectors, he said, adding that climate change has become ""a partisan political issue"".

BAND-AIDS ON BULLET-HOLES

Environmentalists say Australia is its own worst enemy due to its continued reliance on coal-fired power, which makes it one of the world's largest carbon-emitters per capita.

Green groups have long lobbied the government to ditch fossil fuels and set a goal to become carbon-neutral by 2050 - so far with little success.

""The government's failure to significantly cut emissions puts Australia and the Pacific region at risk of more fires, floods and cyclones,"" said Martin Zavan, campaigner at Greenpeace Australia Pacific.

""When it comes to adaptation, you can't put a band-aid on a bullet-hole and expect it to get better,"" he added.

Friends of the Earth's Walker noted that Australia had produced 240 reports on natural disasters since 1920, but citizens were still suffering the consequences.

""Adaptation without (emissions) mitigation means surrender on the issue of climate change,"" he said.

($1 = 1.3153 Australian dollars)

Read more:

The 86-year-old nun backing Australia's teen-led climate suit

Pandemic delays leave many nations facing climate action catch-up in 2021

Climate change lengthens Australian summers by 50% - study

(Reporting by Michael Taylor @MickSTaylor; editing by Megan Rowling. Please credit the Thomson Reuters Foundation, the charitable arm of Thomson Reuters, that covers the lives of people around the world who struggle to live freely or fairly. Visit http://news.trust.org)

Our Standards: The Thomson Reuters Trust Principles.","Fri, 26 Mar 2021 07:00:00 GMT","https://d8zcwdvc14g2e.cloudfront.net/contentAsset/image/badd9ace-55e5-46d4-9017-a87929f178a4/image/byInode/1/filter/Resize,Jpeg/jpeg_q/70/resize_w/1100","['change', 'climate', 'thomson', 'floods', 'adaptation', 'australia', 'rethink', 'bushfires', 'million', 'pile', 'australias', 'impacts', 'pressure']",,flood
33,33,FL-2021-000025-AUS,Australia floods: Thousands evacuated across New South Wales as heavy rains continue - The Independent,https://www.independent.co.uk/news/world/australasia/floods-australia-new-south-wales-sydney-b1820360.html,"About 18,000 people have been evacuated across New South Wales as heavy rains continue to pound the east coast of Australia, causing the floods to worsen.

Addressing parliament on Monday, the prime minister, Scott Morrison, said that “Australia is being tested once again”.

“The east coast of Australia, predominantly New South Wales but also in southeast Queensland, has experienced an extraordinary deluge over recent days,” he said.

Rains are expected for at least the next 24 and 48 hours, Mr Morrison said. “Some parts of New South Wales are experiencing the worst flooding in 50 years, from Penrith to the north of Port Macquarie,” he said.

Jane Golding, an official at the bureau of meteorology, warned that heavy rains will hit large parts of the east coast from Monday “due to the combination of a tropical low over northern Western Australia and a coastal trough off New South Wales”.

Rains also caused dams and rivers to overflow around Sydney and southeast Queensland. Warragamba Dam, Sydney's main water source, spilled over on Saturday, adding to swollen rivers.

Widespread destruction has been reported in the affected areas as floods damaged roads, swept away houses and disrupted power supply.

Read more:

New South Wales premier Gladys Berejiklian said 38 regions have been declared disaster zones. “I don’t know any time in a state history where we have had these extreme weather conditions in such quick succession in the middle of a pandemic,” she said.

Emergency services have received more than 8,000 calls for help since the rains began on Thursday and have rescued hundreds of people from floodwaters.

New South Wales State Emergency Service commander Michael Ward said several affected people don’t know what to do. “We have a number of concerns for welfare, so we’re working through those. What obviously happens is that everyone relies on the mobile phone. And when they haven’t had power for two days, they stop working,” he told ABC News.

The extreme weather conditions have also affected Australia’s drive to vaccinate its population against Covid-19. The national government has warned of delays over the coming days across New South Wales.","Mon, 22 Mar 2021 07:00:00 GMT",https://static.independent.co.uk/2021/03/22/04/AP_21081101654875.jpg?width=1200&auto=webp&quality=75,"['continue', 'weather', 'floods', 'days', 'heavy', 'evacuated', 'affected', 'coast', 'wales', 'working', 'australia', 'rains', 'thousands', 'east', 'south']",,flood
34,34,FL-2021-000025-AUS,The world sees the climate crisis in Australia's floods. Do we? - The Interpreter,https://www.lowyinstitute.org/the-interpreter/world-sees-climate-crisis-australia-s-floods-do-we,"In the late 1980s, while I was a reporter covering one of the mega-cyclones to hit Bangladesh, a government official in Dhaka confided in me that he was fed up with seeing his nation only make the global headlines as a result of the disasters that befell it.

Australia is fast catching up in that regard.

In the past 18 months, the driest continent on the planet has made global news for unprecedented bushfires that left 33 people dead and more than 17 million hectares in ash. This was followed by the great floods of 2020, which left hundreds homeless and drenched the eastern part of the country with more than 700 millimetres of water in a week.

Come March of 2021 and Australia is in the global headlines yet again. The descriptions are as similar as they are familiar.

Worst floods in decades. One-in-a-hundred-year event. Greatest concern. News reporters and politicians appear to have run out of adjectives, recycling the same phrases used in previous disasters. Gone are the days when Australia was famous across the world for stories of cuddly koalas, boxing kangaroos or surfers versus sharks. Australia is now well and truly at the forefront of the climate crisis.

Compounding this challenge is a view of a government out of step with the world to act in response.

It was not always thus. Consider the case of the hole in the ozone layer, when after its discovery in 1985, Australia played an outstanding role in the creation of the Montreal Protocol, which became known as the “world's most successful environmental agreement”.

Notions of isolation and relative safety have long been a mainstay for global views of Australia. In 2021, it may well be the reverse.

That success only makes for a more striking contrast with Australia’s contemporary international reputation for the approach it has adopted to climate change, particularly under the Liberal-National Coalition government in power since 2013. People are regularly reminded that Prime Minister Scott Morrison once brandished a lump of coal in the country’s parliament, that the Coalition dismantled the carbon tax and struggled over a renewable energy target, and has consistently ignored the pleas of business groups, environmental organisations and climate scientists for firm action.

It’s not that Australia has been without recommendations. The Garnaut Climate Change Review, for example, commissioned in 2007 by then–Labor leader Kevin Rudd, argued that it was in Australia’s national interest to seek an international agreement for holding carbon dioxide equivalent concentrations at 450 parts per million (ppm) or lower, and for Australia to offer in advance to play its full proportionate part in such an agreement. The report also said the cost of action to the Australian economy of tackling climate change was far less than the cost of inaction. But today the Garnaut report is hardly mentioned and has all but disappeared from public discourse.

Instead Australia appears trapped in a turgid political contest where critics are dismissed as “woke inner-city greenies” and the attempts to discuss the cause of regular crises are deflected as “not the right time”.

All of this can’t help but be noted around the world as the country first burned and then drowned. Even former finance minister Mattias Cormann’s campaign to become chief of the Organisation for Economic Cooperation and Development was dogged by criticism of Australia’s climate stance, and while this did not prevent him winning the gig, will such questions continue to mount and in future hold Australia back?

The author at the causeway on the road to home (Edmond Roy)

As I write this from home the rain has been steadily falling for the past week. So far, in the small hamlet of Marlee, on the mid-north coast of New South Wales, we have received 820 millimetres of rain. The creeks around our property have inundated paddocks, created rivers out of streams and uprooted 30-metre-tall gum trees. The roads into our area have been wiped out, causeways and bridges destroyed. Landslides block access to many properties, livestock washed downstream and drowned, communication systems are down, electricity and water supplies cut.

Supplies are running low, and with every passing hour the ground is getting more sodden. The State Emergency Service and the Rural Fire Service, both voluntary organisations, have been run off their feet. Evacuation centres are swelling, roads are closed, and flood waters continue to rise.

We’ve been through all of this before. Australia is a land of extremes. We all know that. And we also know the national storylines of a people who are resilient and stoic and tough. But that reputation is at risk of being overwhelmed without the leadership to act.

In 1957, Nevil Shute wrote his nightmarish vision of waiting to die in a nuclear catastrophe, On the Beach. He set it in Australia, the last place on earth to receive the radioactive fallout that would wipe out life on earth. That notion of isolation and relative safety has long been a mainstay for global views of Australia. In 2021, it may well be the reverse. It’s in Australia where it all begins – the bellwether of inaction on climate change.","Wed, 24 Mar 2021 07:00:00 GMT",https://www.lowyinstitute.org/sites/default/files/GettyImages-1308702459.jpg,"['change', 'climate', 'water', 'world', '2021', 'floods', 'global', 'sees', 'service', 'views', 'crisis', 'australia', 'australias']",,flood
35,35,FL-2021-000025-AUS,This kangaroo was spotted swimming through treacherous flood waters in Australia - USA TODAY,https://www.usatoday.com/videos/news/have-you-seen/2021/03/24/kangaroo-spotted-swimming-through-flood-waters-australia/6980619002/,"This kangaroo was spotted swimming through treacherous flood waters in Australia

This kangaroo was spotted swimming through treacherous flood waters to dry land in Moree, New South Wales.","Wed, 24 Mar 2021 07:00:00 GMT","https://www.gannett-cdn.com/presto/2021/03/24/USAT/9e7a98f6-aaed-4f09-8ffa-084dbce102ee-VPC_KANGAROO_SWIMS_TO_SAFETY_IN_FLOOD_WATES_DESK_THUMB.jpg?crop=1911,1075,x4,y0&width=1911&height=1075&format=pjpg&auto=webp","['spotted', 'treacherous', 'kangaroo', 'moree', 'land', 'swimming', 'wales', 'waters', 'australia', 'flood', 'south']",,none
36,36,FL-2021-000025-AUS,NSW floods: evacuated Sydney residents told to stay away as water recedes and cleanup begins - The Guardian,https://www.theguardian.com/australia-news/2021/mar/28/nsw-floods-evacuated-sydney-residents-told-to-stay-away-as-water-recedes-and-cleanup-begins,"Evacuation orders remain in place for seven north-west Sydney towns impacted by last week’s flooding as New South Wales’s cleanup effort begins in earnest.

The State Emergency Service said evacuated residents of Pitt Town North, Pitt Town Bottoms, Cornwallis, North Richmond, Agnes Banks, Gronos Point and Freemans Reach should not return until authorities give the all-clear.

“Even as flood waters recede, utilities will continue to be impacted and there will likely be extensive debris including hazardous materials and potentially unsafe roads,” the SES said in a statement on Sunday.

The SES warned flood water can contain sewage, debris and dead animals so locals must avoid entering it, playing in it or driving through it.

Workers clear debris on Saturday from the new Windsor Bridge, which was under water during the recent floods. Photograph: James Gourley/AAP

Evacuation orders on the NSW mid-north coast and near Moree have now lifted, with eight “all clear” return notices issued as river levels fall.

Rapid damage assessments were taking place through western and north-west Sydney in areas such as Penrith, The Hills and Hawkesbury. Some 3,500 assessments have been carried out to date.

“The teams out in the field are working closely with the community and local services to begin the recovery process,” Allison Flaxman of the SES said.

On Sunday, a major flood warning remained in place for the Barwon River in north-west NSW, as well as moderate flood warnings for the Bogan River in the state’s central west and the Macintyre and Weir Rivers near the Queensland border.

The SES has received more than 23,000 calls for help from the public, and volunteers have attended more than 13,000 jobs since the floods began.

Brown surf contains silt from the recent floods, hay bales and debris carried by the Manning River and washed up at Old Bar Beach east of Taree on the NSW coast. Photograph: Mike Bowers/The Guardian

Grants and bank loans will be made available to businesses in flood-affected areas to fund their recovery, the prime minister, Scott Morrison, announced.

Morrison said on Saturday that a loan scheme would be extended to flood-affected small and medium businesses.

He said the federal government would underwrite 80% of bank loans of up to $5m for small and medium businesses in the flood-affected areas, with repayments to start two years into the loan.

The measure is an extension of a support program available for Covid-affected firms.

“This is about backing the businesses and producers that are backing themselves to get back on their feet,” Morrison said.

The loans are on top of a recovery grants program jointly funded by the federal and NSW governments. Small businesses can get up to $50,000 and primary producers up to $75,000 if they’ve been affected by floods.

As tens of thousands of people across NSW returned to their homes over the weekend, an emergency services taskforce was tackling the cleanup, including Australian defence force personnel, the NSW Rural Fire Service and Fire and Rescue NSW.

The Australian Red Cross warned of a lack of access to mental health help, and urged people affected by the floods to take steps to protect their psychological wellbeing as well as their physical health.

Meanwhile, the search for an elderly woman continued after police pulled her empty car from the swollen Barrington River on Thursday.

Tourists urged to keep NSW Easter plans

Tourism operators hit by recent heavy rain are hoping the upcoming Easter break gives them a much-needed boost.

At the Discovery Park at Forster on the mid-north coast of NSW, which was inundated by this past week’s “rain bomb”, manager Jane Ticehurst said they are gearing up for the holiday.

Ticehurst said she was expecting a full house for the Easter break, which means accommodating about 1,000 guests.

All of this past week’s guests had to be cancelled and rebooked so staff could concentrate on cleaning up after flooding.

The property sits above the Wallamba River, and while some locals said the waterway was at its highest level in memory, the park’s infrastructure escaped relatively undamaged.

Despite some facilities like the boardwalk going under water, Ticehurst said she was feeling fortunate.

“Our team has been impacted in a whole number of ways, from a housekeeper who has lost everything in her property, to most of the team who were landlocked and couldn’t get to work,” Ticehurst said.

“We did have to cancel Easter for everyone last year because of Covid. We’re certainly hoping not to impact Easter this time round.

“The whole of this area has been impacted heavily in the last 18 months, fires followed by Covid and the flooding.

“I guess we can look forward to getting back up and running.”

The NSW Tourism Industry Council executive manager, Greg Binskin, said while some caravan parks along rivers had been hard hit, most operators were pushing ahead with Easter plans.

“[The floods] have been another setback in what’s been a pretty tough 24 months [but] a lot of them are confident they will get cleaned up and ready to be welcoming visitors again,” he said.

He said while the past two years have been tough for operators, domestic tourism has also prompted an uptake in visitors, with international borders still shut.

Binskin said with the jobkeeper wage subsidy ending, programs like the NSW government’s Dine and Discover hospitality voucher scheme – which gives patrons money towards meals and entertainment – would help businesses get back on their feet.

The tourism boss urged people to continue with their Easter plans.

“It’s always a great extended long weekend. We’d urge people to continue to head into regional areas and support your fellow Aussies,” he said.","Sun, 28 Mar 2021 07:00:00 GMT",https://i.guim.co.uk/img/media/3ced13829603869c5c942b7f0306832ec07ee580/126_0_3906_2345/master/3906.jpg?width=1200&height=630&quality=85&auto=format&fit=crop&overlay-align=bottom%2Cleft&overlay-width=100p&overlay-base64=L2ltZy9zdGF0aWMvb3ZlcmxheXMvdGctZGVmYXVsdC5wbmc&enable=upscale&s=0b0a40a8dc6ec77133ff2a3858e42533,"['water', 'nsw', 'residents', 'recedes', 'told', 'floods', 'river', 'stay', 'evacuated', 'sydney', 'easter', 'impacted', 'areas', 'ses', 'debris', 'businesses', 'flood', 'cleanup']",,flood
37,37,FL-2021-000025-AUS,Australian Orchard Owner Fears for Family Farm as Flood Waters Rise - U.S. News & World Report,https://www.usnews.com/news/world/articles/2021-03-23/australian-orchard-owner-fears-for-family-farm-as-flood-waters-rise,"By Jill Gralow

SACKVILLE, Australia (Reuters) - At Ken Anderson's orchard near the banks of the Hawkesbury River in the outer Sydney suburb of Sackville, another few inches of flood water could spell the end for much of this season's orange and mandarin harvest - and possibly the trees as well.

As torrential rains pummel Australia's east, causing the worst floods in half a century, those living near major river systems are suffering the most, with homes, roads and livestock being washed away.

The lower-lying areas are most at risk, Anderson told Reuters at his orchard, which he said had been in the family for 170 years.

""I'll lose a fair bit, because if the water stays on there too much, the fruit will just drop,"" said Anderson, who at 66 is the fourth generation of his family to run the property.

Political Cartoons on World Leaders View All 91 Images

In parts of the orchard, only the top branches of the fruit trees were visible above the water.

""Down in the other section over there, it takes a while for the water to come off so I'll end up losing the fruit there and probably might lose the trees too,"" added Anderson stoically, holding a blue-and-yellow striped umbrella against the pouring rain.

In the state of New South Wales, where the flooding is most severe, a deluge is forecast overnight on Tuesday in some areas despite clearer weather in Sydney.

While damage to properties and livelihoods is widespread, there have been no recorded fatalities from the floods.

Anderson said it had been a difficult few days, working non-stop for the past couple of nights.

""I'm all over it now,"" said the farmer with a slight chuckle. ""I'm coming down with a cold, I think actually, I've been wet a few days.""

(Reporting by Jill Gralow; Writing by Jonathan Barrett; Editing by Karishma Singh)","Tue, 23 Mar 2021 07:00:00 GMT",https://www.usnews.com/dims4/USNEWS/4c1768c/2147483647/thumbnail/970x647/quality/85/?url=http%3A%2F%2Fmedia.beam.usnews.com%2F5f%2Fc4c5dc623a5d5061e80bacaf9e601d%2Ftag%3Areuters.com%2C2021%3Anewsml_LYNXMPEH2M0IY%3A12021-03-23T090836Z_1_LYNXMPEH2M0IY_RTROPTP_3_AUSTRALIA-WEATHER.JPG,"['fruit', 'water', 'near', 'rise', 'australian', 'river', 'lose', 'owner', 'farm', 'fears', 'family', 'anderson', 'waters', 'trees', 'flood', 'jill', 'orchard']",,flood
