,ID,event_id,article_title,article_link,article_content,publishing_date,article_image,article_keywords,article_relevance,category
16,16,FL-2021-000025-AUS,"Australia endures droughts, fires, floods and marauding mice - ABC News",https://abcnews.go.com/Technology/wireStory/australia-endures-droughts-fires-floods-marauding-mice-76697017,"WELLINGTON, New Zealand -- Rob Costigan bought a rugged farm in rural Australia three years ago with the dream of building it into something he could leave to his kids.

One year later, he was needing to truck in water to battle an extreme drought. Then Australia's deadly wildfires raged perilously close in late 2019, forcing Costigan to spend day after day stamping out embers and running sprinklers on his roof to save his home, in an eerie atmosphere he likens to Armageddon.

Then last week, on the day his daughter Eva was supposed to be celebrating her 11th birthday, came the floods. Thankfully, the family had already left to stay at his brother's home.

The water roared through with such force it lifted both Costigan's farmhouse and a second home where his father-in-law lived from their foundations, destroying both. The family is still picking up toys and clothes strewn far and wide — they even found their gas barbecue bottle stuck in a tree.

“Just disbelief,” said Costigan. “It feels like the world's against us. You work your guts out and then to have it all just washed away in the blink of an eye.”

Costigan, 40, a road maintenance worker whose farm is in the Hollisdale community about a five-hour drive north of Sydney, said he's thankful that so far he's managed to avoid yet another disaster — the plague of mice that is affecting some farms in the region. Maybe, he hopes, the floods will help wash them away.

Australia has always been a land of harsh weather, where droughts and fires form part of the nation's psyche. But experts say that global warming is likely making recent weather events more extreme. The raging wildfires that burned through until early last year killed at least 33 people and destroyed more than 3,000 homes.

“These events are expected,” said Sarah Perkins-Kirkpatrick, a climate scientist at the University of New South Wales. “But climate change has put them on steroids.”

She explained that, paradoxically, a warming atmosphere can worsen both droughts and floods. The extra heat can suck more moisture from the ground during droughts. But warmer air can also hold more moisture, she said, so that when it does rain, it pours.

Some towns in New South Wales have set 50- or 100-year records for rainfall over the past week. The floods have killed two men in separate incidents, both of whom were trapped in their cars, and have forced more than 20,000 people from their homes.

Dale Ward this week was trying to clean out the rental apartment she owns, and where her daughter and their family live, in the town of Windsor. She said she was mopping up sludge after about 1 foot (30 centimeters) of water coursed through, destroying a box of photos and other memorabilia.

“It's like someone dropped three tons of dirt in your house, and then dropped a bucket of water over the top,” she said.

Ward estimates it will take at least a month to get the place habitable again, with plumbers and electricians needed to get everything fixed.

Elsewhere, people are still dealing with the plague of mice. Last year in eastern Australia, months of rain doused wildfires and ended a drought that had crippled the region for more than two years. That led to bumper crops on many farms, and an explosion in the mouse population.

Pompy Singh, the manager of the Spar supermarket in the town of Gulargambone, said they started to notice the number of mice increasing before Christmas. They used to set one or two traps a day, he said. They started buying much larger traps and setting many more of them until they had 20 set all the time.

Suddenly they were catching 100 or 200 mice each day. The critters began eating through everything, getting into the lettuce, the potato chips, the dog food, even the tobacco. Singh said they started storing everything in refrigerators or sealed containers.

Still, he said, the mice kept coming. Some days, they were catching up to 600. Even the fridges kept breaking down as the mice chewed through the wiring. Singh said the numbers of mice seem to have decreased somewhat since the floods hit, although they're still catching plenty.

And Australia's troubles may not yet be done. Some experts have been warning people to check their shoes and clothes for deadly spiders, as swarms of them seek refuge from the floodwaters by moving into residential homes.

Meanwhile, Costigan said he intends to rebuild. He’s spent too much time putting up fences on his farm — many of which survived the flooding — and making other improvements to give up now. He adds that he moved his small herd of cattle to higher ground before the floods hit and they all survived.

Costigan said he feels lucky his farmhouse is insured and is also thankful to family members and neighbors who have contributed to an online fund to help his family rebuild.

He said these kind of troubles all come with living in Australia, and even perhaps explain why the British initially treated the continent as a place to send their prisoners.

“They thought it was hell on earth,"" he said. “What they didn't realize is that it's a beautiful part of the world.”","Fri, 26 Mar 2021 07:00:00 GMT",https://s.abcnews.com/images/Technology/WireAP_94fb7eca957440c28d72df319da5f71a_16x9_992.jpg,"['water', 'week', 'droughts', 'costigan', 'singh', 'floods', 'marauding', 'australia', 'endures', 'family', 'day', 'mice', 'fires', 'wildfires', 'started']",,flood_and_drought
17,17,FL-2021-000025-AUS,Australia’s Worst Floods in Decades Quicken Concerns About Climate Change - Seattle Times,https://www.seattletimes.com/nation-world/australias-worst-floods-in-decades-quicken-concerns-about-climate-change/,,"Mon, 22 Mar 2021 07:00:00 GMT",,[],,flood
18,18,FL-2021-000025-AUS,How much is climate change affecting flooding in Australia? | World Economic Forum - World Economic Forum,https://www.weforum.org/agenda/2021/03/the-effects-of-climate-change-on-australia-extreme-weather-explained/,"While Australia's natural rainfall patterns are highly variable, climate change is expected to make flooding more frequent and more extreme.

This has been shown during the recent flooding crisis of New South Wales, writes climate scientist Joelle Gergis.

The extreme weather can be mostly attributed to greenhouse gas emissions caused by human activity, which disrupt the water cycle and increase atmospheric pressure.

More research needs to be done to improve climate risk assessment; the further analysis of historical weather data can increase understanding.

Over the past three years, I’ve been working on the forthcoming report by the United Nations’ Intergovernmental Panel on Climate Change. I’m a climate scientist who contributed to the chapter on global water cycle changes. It’s concerning to think some theoretical impacts described in this report may be coming to life – yet again – in Australia.

The recent flooding in New South Wales is consistent with what we might expect as climate change continues.

Australia’s natural rainfall patterns are highly variable. This means the influence climate change has on any single weather event is difficult to determine; the signal is buried in the background of a lot of climatic “noise”.

But as our planet warms, the water-holding capacity of the lower atmosphere increases by around 7% for every 1℃ of warming. This can cause heavier rainfall, which in turn increases flood risk.

The oceans are also warming, especially at the surface. This drives up both evaporation rates and the transport of moisture into weather systems. This makes wet seasons and wet events wetter than usual.

So while Australia has always experienced floods, disasters like the one unfolding in NSW are likely to become more frequent and intense as climate change continues.

Understanding the basics

To understand how a warming world is influencing the water cycle, it’s helpful to return to the theory.

From year to year, Australia’s climate is subject to natural variability generated by the surrounding Pacific, Indian and Southern oceans. The dominant drivers for a given year set up the background climate conditions that influence rainfall and temperature.

It is a combination of these natural climate drivers that makes Australia the land of drought and flooding rains.

However, Australia’s climate variability is no longer influenced by natural factors alone. Australia’s climate has warmed by 1.4℃ since national records began in 1910, with most of the warming occurring since 1970. Human-caused greenhouse emissions have influenced Australian temperatures in our region since 1950.

This warming trend influences the background conditions under which both extremes of the rainfall cycle will operate as the planet continues to warm. A warmer atmosphere can hold more moisture (higher water vapour content), which can lead to more extreme rainfall events.

A warmer atmosphere can hold more moisture which can lead to more extreme rainfall events. Image: Climate Council

Since the winter of 2020, Australia has been influenced by the La Niña phase of the El Niño–Southern Oscillation (ENSO). Historically, sustained La Niña conditions, sometimes with the help of a warmer than average Indian Ocean, have set the scene for severe flooding in eastern Australia.

During these events, easterly winds intensify and oceans around Australia warm. This is associated with the Walker Circulation – a giant seesaw of atmospheric pressure that influences the distribution of warm ocean waters across the Pacific Ocean.

The ocean and atmospheric conditions associated with La Niña conditions. Image: Bureau of Meteorology

The last La Niña occurred in 2010–2012. It led to widespread flooding across eastern Australia, with particularly devastating effects in Queensland. The event caused the wettest two-year period in the Australian rainfall record, ending the 1997–2009 Millennium Drought.

Oceanographers from UNSW studied the exceptional event. They demonstrated how a warmer ocean increased the likelihood of extreme rain during that event, primarily through increased transport of moist air along the coast.

Their analysis highlighted how long‐term ocean warming can modify rain-producing systems, increasing the probability of extreme rainfall during La Niña events.

It is important to point out that changes in large-scale atmospheric circulation patterns are still not as well understood as fundamental changes in thermodynamics. However, because regional rainfall changes will be influenced by both factors, it will take researchers time to tease everything out.

NSW rainfall totals for the week ending March 22, 2021 Image: Bureau of Meteorology

What’s interesting about the 2020–2021 La Niña is that it was weak compared with historical events. The relationship between La Niña and rainfall is generally weaker in coastal NSW than further inland. However, it’s concerning that this weak La Niña caused flooding comparable to the iconic floods of the 1950s and 1970s.

The rainfall totals for the current floods are yet to be analysed. However, early figures reveal the enormity of the downpours. For example, over the week to March 23, the town of Comboyne, southwest of Port Macquarie, recorded an extraordinary 935mm of rainfall. This included three successive days with more than 200mm.

The NSW coast is no stranger to extreme rainfall – there have been five events in the past decade with daily totals exceeding 400mm. However, the current event is unusual because of its duration and geographic extent.

It’s also worth noting the current extreme rainfall in NSW was associated with a coastal trough, not an East Coast Low. Many of the region’s torrential rainfall events in the past have resulted from East Coast Lows, although their rainfall is normally more localised than has been the case in this widespread event.

Remember that as the air warms, its water-holding capacity increases, particularly over the oceans. Current ocean temperatures around eastern and northern Australia are about 1℃ warmer than the long-term average, and closer to 1.5℃ warmer than average off the NSW coast. These warmer conditions are likely to be fuelling the systems driving the extreme rainfall and associated flooding in NSW.

Sea surface temperature anomalies along the NSW coast Image: Bureau of Meteorology

A nation exposed

Weather and climate are not the only influences on extreme flood events. Others factors include the shape and size of water catchments, the presence of hard surfaces in urban areas (which cant’t absorb water), and the density of human settlement in flood-prone areas.

The Hawkesbury–Nepean region in Western Sydney, currently experiencing major flooding, is a prime example. Five major tributaries, including the Warragamba and Nepean Rivers, flow into this extensively urbanised valley.

Improving our understanding of historical weather data may help improve future climate change risk assessment. For example, past floods in the Hawkesbury–Nepean have been a lot worse than the current disaster. In 1867, the Hawkesbury River at Windsor reached 19.7 metres above normal, and in 1961 peaked at 14.5 metres. This is worse than the 13.12 metres above normal recorded at Freemans Reach on March 23.

It’s sobering to think the Hawkesbury River once peaked 6 metres higher than what we’re seeing right now. Imagine the potential future flooding caused by an East Coast Low during strong La Niña conditions.","Fri, 26 Mar 2021 07:00:00 GMT",https://assets.weforum.org/editor/PSHqY5NQqntMNQwxnj5hNfTqkhIrFVt7Yprgxyf8a4I.png,"['change', 'climate', 'conditions', 'water', 'niña', 'warmer', 'events', 'floods', 'rainfall', 'going', 'expert', 'la', 'australias', 'flooding', 'extreme']",,flood
19,19,FL-2021-000025-AUS,Eastern Australia Is Facing Worst Floods In Decades 2 Years After Bush Fires - NPR,https://www.npr.org/2021/03/23/980462499/eastern-australia-is-facing-worst-floods-in-decades-2-years-after-bush-fires,"Eastern Australia Is Facing Worst Floods In Decades 2 Years After Bush Fires

NPR's Ailsa Chang speaks with reporter Laura Chung of the Sydney Morning Herald on how eastern Australia is coping with the worst flooding in decades less than two years after devastating bush fires.

AILSA CHANG, HOST:

Less than two years after bushfires blazed across Australia, the country's east coast is seeing its worst flooding in decades. Some areas accumulated over a yard of rainfall since downpours started last Thursday. Tens of thousands have been ordered to evacuate. On Sunday alone, 500 gigaliters of water, the same volume of water in Sydney Harbor - spilled out of Sydney's largest dam. Even as rain subsides, the floodwater will still pose trouble for weeks to come. We're joined now by Laura Chung, who has been reporting on all of this for the Sydney Morning Herald.

Welcome.

LAURA CHUNG: Thank you for having me.

CHANG: Thank you for being with us. So what are you hearing from people on the ground there? Can you talk about the scope of the damage that they've seen so far?

CHUNG: Of course. So unlike the bushfires, we don't actually have a clear image of how much has just been damaged and destroyed. We know it's a significant part of the state. But what we do know is there has been water everywhere. We've heard and seen houses just being picked up and floating down rivers that used to be farms and paddocks. We've heard of livestock just being completely washed away. There are videos of cows and horses just trying to make it through these really heavy floodwaters. And what used to be streets and paddocks are just now, yeah, completely flooded with water right up to where the power lines are.

CHANG: Wow.

CHUNG: So if you can imagine that, it is a very striking image.

CHANG: What about people who didn't or weren't able to evacuate and are now stranded? I mean, how are rescue operations going right now?

CHUNG: For a lot of people who live in these low-lying plains, floods aren't anything new to them. They've lived with them before. They know how to prepare for them. But there are a lot of people who were just not quite ready for how quickly the water would come up. So we've got thousands of volunteers from the State Emergency Service who are out there along with police and interstate help as well, who are rescuing people in boats. We've also seen helicopters being deployed to try and airlift people out of certain areas. And you know, not only are volunteers having to deal with the really intense flooding conditions. They're also having to deal with the wildlife that's coming their way as well. So there's this story of these volunteers who were rescuing this family, trekking over several kilometers to get to the family. And as they're returning, they got a message over the radio that they have to be aware of snakes. And they reported snakes kind of shimmying up the side of the boat and taking refuge with them just to...

CHANG: Oh, goodness.

CHUNG: ...Get out of that floodwater.

CHANG: Well, Laura, we spoke to you back in December 2019 when the bushfires were spreading across the area. And I'm curious - how do you think recovery from that disaster has affected recovery from this disaster? I mean, we're talking about communities that were just starting to rebuild, right?

CHUNG: Exactly. And they've gone through the bushfires and then - last year - and then immediately after that, there was a first round of floods, and then they were hit by the pandemic and now these floods again. So it's just been crisis after crisis and compounding their loss. Now, one farmer I spoke to had gone through, you know, all these crises. And he said, you know, what the fires didn't take, the floods have taken. And this sentiment has been repeated to me by so many people in that they've already suffered so many losses that this time around, they don't really have anything else to lose. There is this sense of, what next? You know, it's just hit us again and again and again.

CHANG: Well, I understand that much of the rain has dissipated now. Can I just ask you, what is it like to finally see some blue skies and some sunshine where you are right now?

CHUNG: It is a very welcome sight (laughter) - a very strange sight after about seven days of rain.

CHANG: Yeah.

CHUNG: But I think the message that we've constantly heard is the danger is not over. For many people, the flood and the cleanup has only just started. And many residents are saying, well, yes, while we've survived the floods, we've got months of trying to get our lives back on track.

CHANG: Laura Chung of the Sydney Morning Herald, thank you so much for your reporting. And stay safe.

CHUNG: Thank you for having me.

Copyright © 2021 NPR. All rights reserved. Visit our website terms of use and permissions pages at www.npr.org for further information.

NPR transcripts are created on a rush deadline by Verb8tm, Inc., an NPR contractor, and produced using a proprietary transcription process developed with NPR. This text may not be in its final form and may be updated or revised in the future. Accuracy and availability may vary. The authoritative record of NPR’s programming is the audio record.","Tue, 23 Mar 2021 07:00:00 GMT",https://media.npr.org/include/images/facebook-default-wide.jpg?s=1400,"['laura', 'chung', 'water', 'having', 'decades', 'know', 'worst', 'thank', 'floods', 'facing', 'eastern', 'bush', 'australia', 'weve', 'theyve', 'sydney', 'fires']",,flood
20,20,FL-2021-000025-AUS,Australia floods: The town 'smashed' as water levels rose 40ft in hours - Sky News,https://news.sky.com/story/australia-floods-the-town-smashed-as-water-levels-rose-40ft-in-hours-12254412,"Reporter David Richardson shares how people desperately try to save their homes from being destroyed by the torrential rain and floods in Windsor, Sydney.

For nine days the heavens just opened and stayed open.

I have lived in Sydney for more than 30 years. We do get bouts of long wet weather but this was something extraordinary - a constant heavy rain which showed no signs of going anywhere.

Image: Hundreds of people have been rescued from the floods. Pic: AP

As I watched the rain pour down in my area on Sydney's northern beaches I considered changing my name to Noah - it seemed such a biblical event.

Then to visit some of the worst-hit areas closer to Sydney, an area called Windsor. It was the first small settlement outside old Sydney town to be populated by British settlers after the arrival of the first fleet.

Advertisement

It boasts the oldest pub in New South Wales, built in 1813 (although some would argue that). And it maintains the only true Memorial Square to settlement on the continent.

Yet all that history looked certain to be washed away in a deluge of water unprecedented in this area for 60 years.

Image: Paul Luckman lost his home in the floods

Few people here remember the floods of 1961 - thought to be the worst of all time. That record was about to be smashed for all the wrong reasons.

Nestled on the Hawkesbury River about an hours drive northwest of Sydney, Windsor was literally smashed as the river rose 13 metres, more than 40 feet, not in days, in hours.

Paul Luckman moved with his family from Liverpool in England attracted by the sunny climate and small-town friendliness of Windsor. He bought a home on the banks of the Hawkesbury but far enough away to avoid flooding. Or so he thought.

In a matter of hours, Mr Luckman watched a surge of water rise towards his home, eating 20 yards off the backyard, before entering his house.

Image: Mr Luckman bought a home on the banks of the Hawkesbury thinking it would be far enough to avoid flooding

He was moving furniture as furiously as he could - but the water was winning the battle. Eventually, having done all he could, he left for dryer ground and prayed he'd survive the worst.

When he returned today to see the damage the water had reached his front gate. It was just 3ft from the street. He had never seen anything like this before, but was strangely sanguine about what had occurred.

It appears he's adopted some of that Aussie battler spirit with his move to Australia. After what's happened he'll need it.

Image: Heavy rainfall has been forecast to ease across Australia's east coast but floods are expected to linger. Pic: AP

The facts and figures from this deluge are quite startling. The crisis literally stretches from the Queensland border in the north to Victoria in the south. It goes from the east coast inland for more than 100 miles.

It has swollen every major river and catchment in that area, with all waterways spilling water in the lands nearby. The total flood area is twice the size of the UK.

They're sobering statistics even for someone like myself who has covered calamity and natural disasters for most of my adult life.

Tonight as I finished with my last live cross to Sky News the sun popped out, welcome but somehow a stranger after nine days being absent. It's a sign for locals, or so they believe, that the worst is somehow behind them.

Image: Around 18,000 residents have evacuated their homes. Pic: AP

Yet even with the sun shining, humidity rising with the temperature, so oddly are the water levels - an inch in just one hour before sunset tonight. As I write this fresh warnings have been issued in areas so far thought safe.

Water pouring from swollen rivers into their tributaries flooding fresh lands, threatening more homes, sandbags piling outside even more businesses.

In a country that has suffered drought, hellish bushfires, a pandemic, then this flood on a mass scale, many people are wondering when it is all going to stop.

Please use Chrome browser for a more accessible video player More flood warnings issued in Australia

Perhaps that's just the price we have to pay to live in the so-called ""Lucky Country"".

I might reserve that name Noah just in case.","Tue, 23 Mar 2021 07:00:00 GMT",https://e3.365dm.com/21/03/1600x900/skynews-flood-australia_5314903.jpg?20210323111810,"['luckman', 'water', 'area', 'windsor', 'rain', 'floods', 'river', 'sydney', 'levels', 'pic', 'rose', '40ft', 'hours', 'australia', 'smashed', 'homes', 'town']",,flood
