,ID,event_id,article_title,article_link,article_content,publishing_date,article_image,article_keywords,article_relevance,category
38,38,FL-2021-000025-AUS,Australia floods: Entire New South Wales towns resembling an 'inland sea' after widespread flooding - Stuff.co.nz,https://www.stuff.co.nz/world/australia/300259243/australia-floods-entire-new-south-wales-towns-resembling-an-inland-sea-after-widespread-flooding,"The New South Wales Rural Fire Service helicopter has captured dramatic imagery of Sydney's north-west appearing to be like an inland sea.

The footage, which covers the general vicinity of Windsor and Richmond, shows entire blocks and paddocks underwater as the Hawkesbury River bursts its banks due to extreme rainfall.

In one shot, an entire earthmover is underwater, its orange light still flashing as water rushes over the cabin.

NSW RFS NSW's State Emergency Service has confirmed that major flooding of the Hawkesbury River.

The Windsor bridge, which was built just last year, went underwater late yesterday after having been closed to traffic for hours.

READ MORE:

* Thousands could be evacuated as western Sydney residents forced to flee

* Australia floods: NSW braces for more days of rain, wild weather

* NSW Floods: Evacuations as state hit with 'record-breaking' amount of rain



NSW's State Emergency Service has confirmed that major flooding of the Hawkesbury River – particularly at the nearby suburb of North Richmond – is likely to be higher than the historic 1961 flooding event.

“The Hawkesbury River at North Richmond (WPS) is currently at 13.16 metres and falling with major flooding. Renewed rises are possible with forecast rainfall,” the Bureau of Meteorology advised.

“The Hawkesbury River at Windsor (WPS) may peak near 13.00 metres Monday evening with major flooding. This level is similar to the April 1988 and July 1990 flood events.”

A severe weather warning remains for much of NSW's coast, with damaging winds, heavy rainfall, abnormally high tides and damaging surf forecast.

“A strong high pressure system over the southern Tasman Sea continues to drive widespread and persistent rain onto the New South Wales coast. This is expected to continue today, particularly about the Mid North Coast and Northern Rivers,” the Bureau advises.

NSW RFS Firefighters record vision of NSW's 'inland sea'

“Meanwhile, a low pressure trough in the state's west is deepening, bringing rain areas to the northern inland today. In this area, heavy rain is possible from the morning, becoming more likely in the afternoon and evening, extending to areas of the southeast over Tuesday.

“On Tuesday, as the trough reaches the Tasman Sea, a low pressure system may form, bringing increased rainfall, strong winds, damaging surf and abnormally high tides to the east and south.""

The entire state is unlikely to experience a reprieve from the wet weather until late Wednesday.

This story was originally published on Nine News and is republished with permission.","Mon, 22 Mar 2021 07:00:00 GMT",https://resources.stuff.co.nz/content/dam/images/4/y/r/l/i/k/image.related.StuffLandscapeSixteenByNine.1420x800.4yrlij.png/1616399655225.jpg,"['windsor', 'river', 'underwater', 'hawkesbury', 'resembling', 'floods', 'widespread', 'entire', 'flooding', 'state', 'rain', 'inland', 'wales', 'south', 'sea', 'weather', 'towns', 'major', 'service']",,flood
39,39,FL-2021-000025-AUS,"Nightmare floods, rain moving further south as Victoria braces for storms - NEWS.com.au",https://www.news.com.au/technology/environment/nightmare-floods-rain-moving-further-south-as-victoria-braces-for-storms/news-story/474d66be314e9b4ddf43a4b8e22ffe91,"Defence and aerial support is on standby to be sent to New South Wales where a deluge of rain has triggered 38 disaster declarations. Today a second wet weather event will bring more heavy rainfall before a reprieve tomorrow, but the flooding will linger much longer. Approximately 18,000 evacuations have been conducted and on Monday evening rain fell in every town across NSW. In Penrith the Nepean River peaked above levels dating back to 1961 and in Windsor the Hawkesbury river is expected to peak at 13 metres. Frustration has been expressed by some over the management of Warragamba dam which is spilling 450 gigalitres per day, a figure equivalent to a Sydney harbour's worth of water.

Defence and aerial support is on standby to be sent to New South Wales where a deluge of rain has triggered 38 disaster declarations. Today a second wet weather event will bri...

Heavy rainfall and damaging winds are expected to hit Victoria on Tuesday as a nightmare weather system wreaking havoc in NSW dips further south.

A severe weather and flood warning has been issued by the weather bureau for parts of eastern and southern Victoria.

“A deepening low pressure system will move southeast across NSW (on Tuesday), reaching the southern NSW coast late tonight then becoming slow moving over eastern Bass Strait on Wednesday,” the bureau said.

“Peak gusts to 110km/h are possible about the southern Gippsland coast.”

Locations likely to be affected include Wonthaggi, Mallacoota, Cann River, Chandlers Creek, Combienbar and Bonang.

The bureau said heavy rainfall could lead to flash flooding during Tuesday afternoon and evening.

Senior meteorologist Richard Russell said the system would bring increasing rainfall across east Gippsland before spreading into southern Gippsland, particularly the Strzelecki Ranges, and the Otway Ranges.

“(On Tuesday) we‘re looking at this low pressure system rapidly intensifying across NSW and it will track quite quickly towards the south coast of NSW by late Tuesday afternoon and early evening,” he said.

“It will intensify further and then move over the East Gippsland coastal waters where it sit for most of Wednesday before finally moving away.”

He said from midday Tuesday through to Wednesday night, localised rainfall totals of 80-120mm were possible east of Orbost, with 150-200mm possible about the Strzelecki Ranges and Wilsons Promontory, and 100-150mm possible about the Otway Ranges.

“The heavy rainfall that we’re looking at could also lead to some localised flooding, so that’s rapid water rises not just involving rivers but gullies, creeks and areas that don’t generally get a flood warning associated with it,” Mr Russell said.

“We have some quite significant winds around that low pressure system that will intensify late (on Tuesday) with some potential for some damaging wind gusts across much of the Gippsland coast.”

He said Melbourne had “missed the worst of it” with just patchy showers through until Wednesday afternoon.

“If that low centre does unfortunately move west of the Prom, the impacts will be much higher in Melbourne, but having said that the expectation for rainfall in Melbourne is around 5-15mm,” he said.

Mr Russell reassured Victorians the impact in the state wouldn’t be anywhere near that of NSW and Queensland.

“The quite humid tropical air mass feeding across eastern Australia is more intense and feeding onto the NSW and Queensland ranges so the orientation of the Great Divide plays a big role,” he said.

“Also the position of the high pressure system for much of the week over the southern Tasman Sea has kept most of that activity further north from us.”

A flood watch has been issued for the Bemm, Cann, Genoa and Snowy River catchments, with a minor flood warning current for the Snowy River.

The State Emergency Service warned residents in affected areas to avoid dangerous hazards, such as floodwater, mud, debris, damaged roads and fallen trees and to stay inside away from windows if possible.

jack.paynter@news.com.au","Tue, 23 Mar 2021 07:00:00 GMT",https://cdn.newsapi.com.au/image/v1/2d92ed7d493ec12a1519bc33111b4878?width=1280,"['nsw', 'victoria', 'system', 'gippsland', 'weather', 'moves', 'floods', 'river', 'set', 'rainfall', 'pressure', 'low', 'soaking', 'qld', 'australia', 'possible', 'south', 'southern']",,flood
40,40,FL-2021-000025-AUS,"Australia weather live updates: Sydney, NSW and Qld flood warnings, residents told to prepare to evacuate as roads, schools and public transport close - NEWS.com.au",https://www.news.com.au/technology/environment/australia-weather-live-updates-sydney-evacuations-nsw-mid-north-coast-flooding/live-coverage/4134f058c9021a43918f834ed40ec691,"Major flooding is occurring along the Wollombi Brook at Bulga and along the Severn River at Ashford, where the water is rising.

Rainfall totals of 80-120 mm have been recorded in the last 24 hours in the Upper Macintyre and Severn Rivers, according to the Bureau of Meteorology.

Very heavy rainfall in the past 36 hours in the Gwydir catchment has caused significant river level rises in the Gwydir River, where major flooding is occurring at Moree on Tuesday night and people in low-lying areas have been ordered to evacuate.

Major flooding is also likely along the Gwydir River at Gravesend and Yarraman and along the Mehi River, which is currently at 9.04 metres at Moree, with rises to 10.4 metres possible on Wednesday.

Major flooding at Texas is likely overnight with showers and thunderstorms forecast for the remainder of Tuesday and Wednesday. Major flooding is expected to continue all week for the Upper Macintyre River at North Richmond and Windsor, with warnings also current downstream on the Colo River and Nepean River at Menagle.

Major flooding is occurring along the Hawkesbury River at North Richmond, Windsor, Sackville and Lower Portland, with major flooding expected at Wisemans Ferry in the next few hours.

Warragamba Dam began spilling around 3pm Saturday and is expected to continue spilling for the next few days.","Wed, 24 Mar 2021 07:00:00 GMT",https://www.news.com.au/wp-content/themes/newscorpau-nca/assets/dist/img/common/favicon/apple-touch-icon-180x180.png,"['windsor', 'river', 'warnings', 'gwydir', 'qld', 'flooding', 'roads', 'told', 'transport', 'upper', 'spilling', 'updates', 'expected', 'residents', 'weather', 'severn', 'schools', 'sydney', 'major', 'occurring']",,flood
41,41,FL-2021-000025-AUS,"One-in-100-years' flood talk disastrously misleading and should change, risk experts say - ABC News",https://www.abc.net.au/news/2021-03-28/one-in-100-years-flood-talk-misleading/100030144,,"Sat, 27 Mar 2021 07:00:00 GMT",,[],,flood
42,42,FL-2021-000025-AUS,"Morning mail: NSW floods worsen, Australia exports 'negative climate policy', Trump returns - The Guardian",https://www.theguardian.com/australia-news/2021/mar/22/morning-mail-nsw-floods-worsen-australia-exports-negative-climate-policy-trump-returns,"Good morning, it’s Monday 22 March, and this is Imogen Dewey with the main stories today: extreme rain and floods are still wreaking havoc in New South Wales, the pandemic is surging again in Europe, and Trump might be returning to social media.

Horses and livestock were seen floating along rivers and washing up on beaches yesterday, as the mid-north coast faced a once-in-a-lifetime deluge. Hundreds of houses were damaged and thousands of residents evacuated as several dams spilled over (now the subject of “bitter dispute”). The downpour is expected to head inland today, and premier Gladys Berejiklian has warned thousands more people could be displaced in coming days. The state’s emergency service has said it will be working beyond Easter on the post-flood clean-up effort and restoration of key services; the as-yet-untallied bill looms on the horizon. “It’s devastating,” said one local in Raymond Terrace, north of Newcastle. “I’ve never ever seen anything like this.” Communities along the Hawkesbury River in NSW are bracing for once-in-a-generation flooding that could displace residents and disrupt utilities for months.

As Australia’s miners urge Europe to define nuclear power and fossil fuels with carbon capture as “sustainable”, the Minerals Council of Australia has been accused of trying to export its “negative approach to climate policy”. The Royal Swedish Academy of Science has meanwhile warned that measures for a healthier, more resilient planet – including reducing fossil fuel emissions – are being jeopardised by fake news on social media about climate change and biodiversity loss. In Canada, the main Conservative party has voted not to recognise the climate crisis as real.

As the Therapeutic Goods Administration approves Australian manufacturing of the AstraZeneca vaccine, a senior health official has said Australia will consider shortening the length of hotel quarantine for international arrivals – or shifting towards home quarantine once more people are vaccinated. Britain’s vaccine program is facing a two-month delay in the event of an EU export ban, derailing plans to reopen as its infection rate stalls. Cases are rising again across Europe, with Germany and Belgium poised to tighten their lockdowns and leaders cancelling plans to meet in person.

Australia

The Australian governments’ procurement policies have caused an ‘explosion’ in Indigenous businesses, most of which are majority owned and controlled by Aboriginal people. Photograph: Mike Bowers/The Guardian

Indigenous entrepreneurs are being urged to verify their businesses in order to weed out businesses engaging in “black-cladding” to secure contracts under government procurement policies.

Labor has questioned if Scott Morrison should allow Christian Porter to return “on a full-time salary but doing the part-time work”. Kristina Keneally has drawn the pointed comparison with the government’s advice victims of domestic violence should use their own super to escape dangerous relationships.

The British royal family (and ours, technically) are considering appointing a diversity tsar under new plans to modernise the monarchy. After reviewing policies and procedures, Buckingham Palace has acknowledged that “more needs to be done”.

The world

Recently Donald Trump has released short, combative statements that many observers have likened to his tweets of old. Photograph: John Raoux/AP

Donald Trump will soon use “his own platform” to return to social media, an adviser said on Sunday, months after the former president was banned from Twitter for inciting the US Capitol riot.

After the director of the FBI said the shootings in Atlanta – in which eight people were killed, including six women of Asian descent – did not appear to have been racially motivated, Georgia senator Raphael Warnock said on Sunday: “We all know hate when we see it.”

Joe Biden has joined European leaders in condemning Turkey’s withdrawal from a landmark international accord designed to protect women from violence. The country also faces a currency crisis, after president Recep Tayyip Erdoğan sacked the country’s central bank chief.

Philippine troops have killed a leader of the Abu Sayyaf kidnap-for-ransom group and rescued four Indonesian hostages held since last year, the military said yesterday.

Recommended reads

‘The eshay scourge is pure invention, a way to sell advertising, with no thought given to the context or consequences.’ Composite: MD9

The eshays moral panic shows how lazy the Australian media can be, writes Alex McClintock. “My nerdy 12-year-old self would probably be surprised to learn that he would one day write an article defending his rat-tailed tormentors, but he also had no idea how vapid, unimaginative and spiteful the commercial media of 2021 would be. They drove me to it, dude.”

“It’s recycled but is it recyclable?” I asked my colleague. “No,” she said, “it’ll end up in landfill.” Demand for sustainable activewear is soaring but without technological improvement, marketing appeal will outstrip environmental benefit, writes Lucianne Tonti. “In the meantime, is polyester something we should be wearing at all?”

The Productivity Commission is currently inquiring on the right to repair in Australia, and how easy it is for consumers to get their phone fixed by anyone other than Apple, Samsung or any of the other device manufacturers. So, asks Josh Taylor: if your screen smashes or your phone won’t charge anymore, what options do you have?

Freaks and Geeks launched the careers of Judd Apatow, James Franco and and Busy Philipps. But this late-90s comedy, “criminally axed after just one season”, is so much more than just a springboard for big names, writes Giselle Au-Nhien Nguyen. “Growing up is a lonely business. Films and television shows have unpacked the agony of adolescence for years, but few have captured it as beautifully or authentically.”

Listen

More than 300 Covid vaccine candidates are in development and more than 400m doses have been administered. But those people are overwhelmingly found in just a few of the world’s richest countries. As the Guardian’s international correspondent Michael Safi tells Anushka Asthana on Full Story, this huge economic global divide means some are facing a wait of up to three years, if they can get a jab at all.

Full Story The great global vaccine divide Sorry your browser does not support audio - but you can download here and listen https://audio.guim.co.uk/2020/05/05-61553-gnl.fw.200505.jf.ch7DW.mp3 00:00:00 00:26:48

Full Story is Guardian Australia’s daily news podcast. Subscribe for free on Apple Podcasts, Spotify or any other podcasting app.

Sport

Neither Adelaide nor Sydney, two clubs in varying stages of rebuild, will likely be contending for the 2021 AFL premiership, but their remarkable round-one triumphs “said as much about the teams they defeated as it did of their own states of being”, writes Scott Heinrich. “More to the point, they provided a blueprint going forward that any team worth their salt would be mad to ignore.”

El Salvador’s top surfer, who had been preparing for the sport’s Olympic debut this summer, has been struck and killed by lightning during a training session.

“A competition beset by overthinking has, for years, found itself unable simply to experience. This season is bucking that trend,” writes Jonathan Howcroft. “Liberated by a lack of expectation, sensation has quelled thought and the result is joyous. Approaching the halfway mark, season 2021 seems destined to be ranked among the most entertaining in A-League history.”

Media roundup

Dfat is assisting two Australians detained under house arrest after attempting to leave Myanmar on a relief flight, the ABC reports. The Greens have told the Sydney Morning Herald they’re betting voters will embrace a hung parliament, if it means getting rid of Scott Morrison. There are calls to change visa rules so undocumented workers in Australia don’t miss out on a Covid vaccine – which would also pose a risk to the efficacy of the rollout, reports the Age.

Coming up

Plans for this year’s Anzac Day services will be revealed today.

Tonight, Four Corners investigates the Brittany Higgins story – “who knew what, when”.

And if you’ve read this far …

Think of this as your sign not to give up. Six years after it was illegally bulldozed, a London pub has been rebuilt brick by brick, thanks to a dogged campaign by locals. “People said it was impossible,” said Polly Robertson, a leading member of Rebuild the Carlton Tavern. “Many people said, ‘Polly, it’s not worth it, nothing’s going to happen’. And I just thought, no – I’m not going to let it lie.”

Sign up

If you would like to receive the Guardian Australia morning mail to your email inbox every weekday, sign up here.","Sun, 21 Mar 2021 07:00:00 GMT",https://i.guim.co.uk/img/media/72ddb0c4f51fe31a576cf63feefd1cd1050b93a3/0_80_1200_720/master/1200.jpg?width=1200&height=630&quality=85&auto=format&fit=crop&overlay-align=bottom%2Cleft&overlay-width=100p&overlay-base64=L2ltZy9zdGF0aWMvb3ZlcmxheXMvdGctZGVmYXVsdC5wbmc&enable=upscale&s=b992d7764eb421318decccd865b4b8bc,"['exports', 'worsen', 'mail', 'returns', 'social', 'nsw', 'floods', 'media', 'vaccine', 'morning', 'thought', 'season', 'plans', 'negative', 'trump', 'policy', 'australia', 'writes', 'scott']",,flood
43,43,FL-2021-000025-AUS,How a Vet Hospital on Wheels Rescued Australian Wildlife During Floods - Atlas Obscura,https://www.atlasobscura.com/articles/wildlife-rescue-australia-floods,"A providence petrel goes onto the X-ray machine. Some traumatized animals, including a tiny Gould’s long-eared microbat, are swaddled in towels. An echidna, or spiny anteater, has a tube attached to its long beaky nose. All these animals injured during the recent historic floods in New South Wales, Australia, and their care was in the hands of an expert veterinarian team at the Byron Bay Wildlife Hospital.



Days of relentless and heavy rains caused the worst flooding in decades on parts of Australia’s eastern coast. It has not only upended the lives of thousands of human residents, but non-human ones as well. “There are the clearly devastating problems for burrowing and ground-dwelling animals like wombats and echidnas that can quickly become trapped by flood waters,” Evan Quartermain, the Australian head of programs and disaster response for the Humane Society International, told The Guardian. “And aquatic animals such as platypus and turtles face major run-off issues and can easily be swept far from their territories.... The wild weather also creates havoc for birds that will struggle for shelter and have nests blown from trees.”

An echidna was found injured beside a road as it fled flood waters. James D. Morgan/Getty Images

Creatures fleeing the rising waters to seek shelter can also be injured or killed in road accidents. The echidna with the tube “sustained horrific injuries” after being hit by a car along Broken Head Road in the Byron Bay region, according to the hospital’s social media account. Bree Talbot, the leading veterinarian at the mobile hospital at Byron Bay, used ultrasound to assess the condition of the creature, which sustained a wound under its porcupine-like spines.

Byron Bay Wildlife Hospital is not an ordinary vet office—it has a dedicated wildlife urgent care center on wheels. In fact, many wheels: The 22-wheel semi-trailer, more than 60 feet long, is Australia’s largest mobile wildlife hospital. Self-sufficient and furnished with state-of-the-art medical equipment, the trailer can be taken anywhere that Australia’s distinctive fauna need help.

The current crisis has it situated at Australia’s eastern-most point, where the veterinarian team are seeing increasing numbers of animals with injuries from the floods. “Treating injured and traumatized wildlife requires expert knowledge of their anatomy and physiology in order to triage and identify the problem, and provide appropriate treatment,” Talbot writes. “During a disaster like floods or bushfires, demand for services like ours is great, while the resources to source expensive medicines, supplies, and equipment needed to do our job is scarce.” Since the nonprofit hospital opened in October 2020, it has provided care, free of charge, for more than 500 creatures, and this flood will certainly increase that count, especially as clean-up and recovery from the disaster begins. Byron Bay Wildlife Hospital has been asked the public to be vigilant on the road and keep an eye out for injured or shaken wildlife, but “never drive through floodwater and never place yourself at risk or in danger attempting to reach wildlife in distress.” That could mean another rescue.

A Gould’s long-eared microbat was found injured on the ground after heavy rain. James D. Morgan/Getty Images

An Australian fig bird getting attention from vets. James D. Morgan/Getty Images

The echidna had a serious wound, likely from a car strike, under its spines. James D. Morgan/Getty Images","Mon, 29 Mar 2021 07:00:00 GMT",https://assets.atlasobscura.com/media/W1siZiIsInVwbG9hZHMvYXNzZXRzLzZmNzc5NzFkOGM0ODE3ZDljNV9CeXJvbiBCYXkgV2lsZGxpZmUgTW9iaWxlIEhvc3BpdGFsX0F1c3RyYWxpYSBmbG9vZHMgcmVzY3VlX0dldHR5SW1hZ2VzLTEzMDg3NTUyMDguanBnIl0sWyJwIiwiY29udmVydCIsIiJdLFsicCIsImNvbnZlcnQiLCItcXVhbGl0eSA4MSAtYXV0by1vcmllbnQiXSxbInAiLCJ0aHVtYiIsIjYwMHg-Il1d/Byron%20Bay%20Wildlife%20Mobile%20Hospital_Australia%20floods%20rescue_GettyImages-1308755208.jpg,"['vet', 'wheels', 'australian', 'floods', 'injured', 'hospital', 'animals', 'echidna', 'd', 'bay', 'james', 'morgangetty', 'wildlife', 'road', 'rescued']",,flood
