id,caption,comments_count,like_count,media_type,media_url,permalink,timestamp
17909358409875781,"INONDATIONS] CHANTIER AU SEUIL DU VERTEIL 
La lutte contre les inondations est une priorité. La Ville, trop fréquemment touchée par les fortes pluies torrentielles par le passé, se mobilise pour que des aménagements soient réalisés dans les meilleurs délais. 

👉 Après les travaux d’entretien et de désencombrement effectués sur le fleuve par le Syndicat Mixte de l’Argens, dont le Maire, Jean Cayron, agit en qualité de vice-président, c’est le syndicat des Eaux du Var-Est (SEVE), en étroite collaboration avec la Ville de Roquebrune, qui va œuvrer du côté du chemin rural du Ressard.

👉 [Un important chantier va ainsi être engagé afin de procéder à l’abaissement et l’élargissement du seuil de Verteil et à la création d’un nouveau dispositif de franchissement.

Des travaux d’intérêt général qui vont ainsi permettre de contrôler la montée des eaux, lutter contre les inondations et participer à la préservation des ressources en eau pour la station de pompage exploitée par la société Véolia.

⚠️ Les travaux se dérouleront du 31 Mai ou 29 octobre. À cet effet, la Ville informe la population que des dérogations exceptionnelles seront données pour le passage des camions de plus de 12T dans le centre-ville.
Ces aménagements sont primordiaux pour garantir la sécurité de la population.

#inondation #travaux #enrochement #securite #var_en_images #prévention",1,28,IMAGE,https://scontent-sea1-1.cdninstagram.com/v/t51.29350-15/193561116_940607356715481_1197983761335148441_n.jpg?_nc_cat=109&ccb=1-3&_nc_sid=8ae9d6&_nc_ohc=vc4ACshshoYAX90Dw-Q&_nc_ht=scontent-sea1-1.cdninstagram.com&oh=e6afebe5adf14b55bac354422ae8b450&oe=60B925C2,https://www.instagram.com/p/CPiZLo_hC5X/,2021-05-31T12:30:36+0000
17918725894710494,"Flash 🔴| La Banque mondiale au chevet du Sénégal

Lire la suite sur Www.actu221.net

#Actu221 #Sénégal #MackySall #OusmaneSonko #AdjiSarr #FreeSenegal #DigitalEyes #A221TV #Afrique #Hivernage  #Inondation #Dakar #BanqueMondiale",0,7,IMAGE,https://scontent-sea1-1.cdninstagram.com/v/t51.29350-15/195139369_857985281512120_6862741093515852268_n.jpg?_nc_cat=102&ccb=1-3&_nc_sid=8ae9d6&_nc_ohc=exMfobNJ45QAX9V2jgO&_nc_ht=scontent-sea1-1.cdninstagram.com&oh=8a2c5d2acd58eb714e38c1e9c9aef97f&oe=60B96090,https://www.instagram.com/p/CPiBbG3ji09/,2021-05-31T09:03:00+0000
17888129594229884,"Dans cette vidéo, je vous fais visiter un appartement pour vous montrer ce qu'il faudrait faire et ce qu'il faudrait éviter en termes d'aménagement intérieur pour être prêt en cas de secousse sismique.

🤔  Dites-moi si ce genre ""d'analyse préventive"" de lieux vous intéresse dans les commentaires ! Et si c'est le cas, quel lieu voudriez-vous que je traite ? 

#ocean #guadeloupe #lampe #antilles #nouvellecaledonie #proteger #caraïbes #securite #secours #ffp2 #inondation #magnitude #inondations #sauverdesvies #preventif #consciencecollective #lampefrontale #monteedeseaux #préventif #decoration #seisme #risque #secousse #deco",3,17,VIDEO,https://video-sea1-1.cdninstagram.com/v/t50.16885-16/10000000_1210308006085941_434527366183481629_n.mp4?_nc_cat=110&vs=17898247223055480_2721265148&_nc_vs=HBksFQAYJEdJQ1dtQUExaGNYS3hFd0VBQjF4alZwV3dBY0didlZCQUFBRhUAAsgBABUAGCRHTk52cGd2YktKNzJRdDhCQU5ZbWIzbFg5NkpZYnZWQkFBQUYVAgLIAQAoABgAGwGIB3VzZV9vaWwBMRUAACaegsaM4s32PxUCKAJDMywXQG%2FKp%2B%2Bdsi0YEmRhc2hfYmFzZWxpbmVfMV92MREAdewHAA%3D%3D&ccb=1-3&_nc_sid=59939d&efg=eyJ2ZW5jb2RlX3RhZyI6InZ0c192b2RfdXJsZ2VuLjcyMC5pZ3R2In0%3D&_nc_ohc=XedwoUOTIKAAX9GhPzG&_nc_ht=video-sea1-1.cdninstagram.com&oh=7cc1b9495044a409524f8088d849b81b&oe=60BAB8A0&_nc_rid=0c26e6c4fd,https://www.instagram.com/tv/CPg12cCILeY/,2021-05-30T22:03:26+0000
