,ID,event_id,article_title,article_link,article_content,publishing_date,article_image,article_keywords,article_relevance,category
50,50,Drought_Indonesia,Short Story: The view from a moving bus - The Jakarta Post - Jakarta Post,https://www.thejakartapost.com/life/2017/08/28/short-story-the-view-from-a-moving-bus.html,"It was the day that would forever change her life, but the Village Girl could not see anything would go wrong. Instead, she was bursting with excitement.

“Ma… Why are the trees running? Where will they go?”

The Village Girl could not stop staring at the outside, flattening her forehead, nose and lips against the window. It was her first experience riding in a car. Having lived her whole life corralled by green hills and sandy beaches in a very remote area of Sukabumi had limited her chances of witnessing modern developments. Even though her village is located some five-hours away from Jakarta, one of the world’s most popular megacities. This was where she was heading. She was so happy when Ma took her to the city while her other siblings were left at home with Granny.

Before the Village Girl and Ma left the house this early morning, Granny wrapped her arms around her small body and hugged her so tightly she could not breathe. Granny’s eyes grew misty and the Village Girl thought it was funny the way her grandmother was staring at her as if for the last time.

“Granny, why are you so sad? You used to love it when I was not around to bother you,” said the Village Girl mockingly. Granny had always yelled her for being too noisy around the house, especially when the Village Girl was playing with her siblings.

“You little brat,” Granny nagged at her, but her eyes had become wet and her voice was hoarse.

“It’s already five, we have to go!” Ma said. She folded her arms, while tapping her right foot against the floor. She watched with disdain as her daughter, the Village Girl, was trying to part with the grandmother.

“I know what time it is… don’t you dare pressure me!” the sound of Granny’s voice startled the Village Girl. Both her mother and Granny were giving each other ‘the look’ — the kind you’d throw at people you didn’t like. The younger woman quickly grabbed the Village Girl’s hand and dragged her away from the older woman’s presence.

Ma never mentioned why they went to Jakarta; neither what would they do once they got there. But she guessed that Ma was missing Pa terribly and that they would meet him there. The Village Girl had repeatedly asked Ma to meet Pa — a man of whom she knew nothing, even his name. Granny told her that Pa left the family to earn more money when he found out that Ma was pregnant again; the Village Girl was barely one-year old at the time. Pa complained that their small village had nothing to offer except vast paddy fields which were always dry due to the long drought and terrible irrigation. That was Granny’s version — the version about her father’s leaving that the Village Girl had come to believe. Ma refused to mention anything about Pa.

Nina, her favorite playmate, told her, “Your father is a jerk. That’s what Mom told me.”

The Village Girl did not really understand what Nina meant, but she was sure it was pretty bad. She remembered how Nina had called her own father a jerk after a particular incidence — one in which he refused to buy her new shoes for the Eid celebration.

The Village Girl swore to herself she would never call her father names no matter what he had done. Feeling his presence would have been enough. Sure, it was hard not to have her father around, but The Village Girl noticed it must have been harder for Ma. Since Pa left the family, or as far as she remembered, the Village Girl never saw Ma smile at anyone. Now that they were on the bus to Jakarta, the Village Girl wished she would see the smile on Ma’s face again. But Ma’s mind seemed to have wandered far away. Ma was gazing straight at the worn gray seat in front of her.

“Ma, why are the trees outside running? I wonder where they want to go. Are they following us?” the Village Girl wiggled her mom’s thigh, demanding an explanation.

“Yes, the trees are running to their new place. Don’t you know that everything is changing in this world? Just like your little brother: he was helpless when he was just born. Now he can crawl and sit by himself. And you, you will grow and you can be anything you want to be if you behave.”

“Really? I want to be Sailor Moon! How can I be Sailor Moon, Ma? My hair is long like Sailor Moon, but it is dark, not yellow,” she touched the tip of her fishtail braided hair, inhaling the scent. Ma washed her hair this morning with strawberry shampoo. She never ate a strawberry, but she knew the picture from her older sister’s school book cover where she saw a very pretty young lady with pink hair covered by a strawberry hat.

“Ma, can I be Sailor Moon by wearing a strawberry hat?” The Village Girl shook Ma’s skinny hands, which were holding her shabby brown canvas tote bag tightly.

“What did I just tell you, eh? You can be anything as long as you behave well.” In a normal situation, every time she said, “You have to behave well,” Ma’s tone was sharp, cold and mean. But not this time. There was none of that.

The Village Girl tried to enjoy her first bus trip, but the bumpy road made dizzy. There was no AC on the bus. Throughout the journey, the Village Girl wiped the sweat across her forehead using her shirt sleeve. Even worse was the mixture of rotten smell hanging in the air which came from fish, people’s feet, sweat, and the pungent odor of cheap perfumes. But she did not let them ruin her day. The running trees were no longer visible to her. Had they discovered the places they wanted to go to?

After the trees, the Village Girl saw so many houses moving and running as well. She pondered whether the houses were running with their occupants too. Otherwise, where would they sleep once they discovered their houses had left them? She then thought of their old house which was always there every time she went home after helping Ma selling fried sweet potatoes. It was normal for the Village Girl and her mother to walk around the village for six straight hours (or more if there were sweet potatoes were not selling as fast as they should). Ma insisted that if the Village Girl helped her sell the cake, more people would want to buy the fried sweet potatoes. If they managed to sell all the fried potatoes on any given day — which was very rare — Ma would let the Village Girl play at Nina’s house. Nina lived in the largest house in the village, and if the Village Girl was lucky, when she arrived at the house Sailor Moon would be playing on TV.

Besides the running houses, she saw many other running cars racing each other as if they were pulled hard by invisible ropes. The deafening sound of those cars, boisterously and clamorously, was such a great contrast from her daily life. Usually, the loudest sound she would hear came from petrol chainsaws chopping down the coconut trees that grew abundantly in her village. But what surprised her most was to see the way some cars would leave thick black clouds behind them, hovering low above the ground.

“Maaa… Can I touch the black clouds over there?”

“What black clouds?” Ma’s attention was now drawn to her.

“Look at them! They are scattered around the cars!”

The Village Girl had always dreamed of touching the white clouds across the blue sky. Now that the dream was coming true, the Village Girl tried not to blink her eyes very often, thinking she could not witness this miracle again anytime soon. And also, the realization of how clouds were formed stirred her eagerness to go back home right away to tell her playmates that she knew how clouds were made.

The new knowledge triggered her another question: why did the color change from black to white once the cloud was up in the sky? This question was quickly forgotten as soon as the running houses were gone. What was in front of her now were very tall buildings pressing against each other like tiny bristles on her blue toothbrush. The lean buildings looked so fragile as if they would collapse easily once the wind came and blew them off. Ma could sense her anxiety. Ma squeezed her hand.

“We will get off the bus soon. Collect your belonging now,” Ma’s voice was hoarse like there was a roll of hay clogged in her throat. The Village Girl reluctantly grabbed her worn-out cuddly baby doll and a bottle of water. Her braided hair was no longer neat, her ironed cloth was crumpled and wet with sweat. Ma helped her tighten the braid before they got off.

When the bus left them at a stop, the Village Girl could not blink at all seeing the big city in front of her. No more bus window separated her view from the real tall buildings that still looked intimidating to her. Now she could see clearly the endless range of buses, cars, and motorbikes. She squinted her eyes for the blazing sun was not only burning her skin, but also blinding her sight. She trusted Ma to lead her by her hand with her eyes half closed.

Ma took her inside a food stall where a long line of dishes made her mouth water and her stomach growl like a mad bear’s. She waggled her two hands to seize all the food aromas toward her: dried beef curry, grilled chicken, tilapia soup, pan fried shrimp and many others that the Village girl had never seen before. But Ma disrupted her pleasure and asked her to sit and wait on the wooden chair. When Ma came and brought her a plate of warm rice and a fried egg, she unwillingly took the plate. She chewed the rice slowly while closing her eyes, imagining that what she had for lunch was a slice of dried beef curry.

“Why, you don’t like it?” Ma glared at her. The Village Girl knew she better say nothing or Ma would repeat her mantra: “Behave well!”

While eating at the table by the large window, the Village Girl observed the world outside. Besides the long heavy traffic, she noticed there were many street children by the traffic light. When the red light was on, they took over the entire street by singing, wiping car windows, selling newspapers, selling snacks or just begging for alms. There were also children close to her age whose clothes were torn and who seemed to be in need of a good shower.

“Ma, what are they doing?” the Village Girl pointed toward something.

Without directing her gaze to what the Village Girl was pointing at, Ma answered shortly while eating. “They are earning money so they can eat,” she said.

“Where are their parents? I also earn money with you.”

Ma stopped chewing. The wrinkles on her forehead were getting thicker as she stared at the Village Girl. “They would not do that if their parents had already enough money. Now, stop looking at them and finish your lunch!”

The Village Girl’s plate was still full while Ma’s plate was already empty. She tried to hasten but her little mouth could only take in half a spoon every time she scooped the rice.

After a few moments, Ma cleared her throat and spoke to the Village Girl. “Listen, I want you to know that no matter what people say, you have to keep in mind that I have been trying to do the best for us. You understand that, eh?” For the first time today, Ma initiated a conversation. Not only that, Ma seemed to really mean it.

“I know, Ma.”

“Listen, I have to go somewhere where children aren’t allowed to come.”

“Why Ma? Don’t leave me alone!”

“Remember I told you to behave, okay? No, it will not take a long time. You don’t have to worry, though, my friend will come and pick you up so you will not be alone waiting for me. Hush.. Hush… No more crying!” Ma took some tissues from a box on the dining table and wiped away her tears.

“Promise me that you will behave, okay? My friend will arrive soon and he will take you to a water park while waiting for me. You told me once that Nina went there last month. Now it is your time to have fun in the park,” Ma smiled lightly.

“Water Park?” The thought of playing all day long at the water park soothed the Village Girl’s cry by itself. “But, but, we will meet there soon, right?” She felt herself torn between excitement and sadness.

“Oh, sure... You are such a well-behaved daughter. See you there soon, okay? Bye!” Ma kissed her left cheek and hugged her for a moment. The Village Girl followed Ma’s steps with her eyes until her shadow disappeared. Not long after Ma had left, a tall thin man appeared. She could not see his face since it was covered with a bushy mustache and round sunglasses. A strong smell of tobacco came from his black leather jacket.

The man cleared his throat intentionally to catch her attention when the Village Girl looked down on her plate with a perplexed gaze.

“So, are you ready to go to the water park?”

The Village Girl said nothing, tears began to well up in her eyes. Don’t cry, she told herself. After a while, the man took her hand and led her outside. Again, the fiery blazing sun blinded her so she kept on tripping behind the man. But even though her teary eyes were half closed, the Village Girl was sure she saw Ma on a running bus, watching her for a moment, before eventually turning away from her.

***

The writer is an English lecturer and Fulbright scholar. Her previous story also appeared in The Jakarta Post.","Mon, 28 Aug 2017 07:00:00 GMT",https://img.jakpost.net/c/2017/08/28/2017_08_28_31600_1503885571._large.jpg,"['mas', 'running', 'short', 'bus', 'view', 'ma', 'long', 'village', 'girl', 'left', 'moving', 'trees', 'eyes']", ,none
51,51,Drought_Indonesia,'An Inconvenient Sequel' presents Truth To Power - Environment - Jakarta Post,https://www.thejakartapost.com/life/2017/08/25/an-inconvenient-sequel-presents-truth-to-power.html,"When An Inconvenient Truth was released in 2006, the documentary, which centers on former United States vice president Al Gore’s campaign to educate the public on global warming, sent shockwaves around the world with its warnings of imminent environmental catastrophe brought by climate change.

Gore followed his gut and his heart, putting everything he had into an issue that had long lit a fire within him ­— confronting the increasingly alarming prospect of a global climate crisis that could literally signal the end of human civilization.

At that time, the climate crisis itself was at a crossroads, with scientific consensus coalescing around the costs to mankind, the global economy and the planet if zero efforts were made to cut down on man-made greenhouse gas emissions, which cause climate change. Then, the scope of the threat was just breaking through to the public and the fossil fuel industry was putting up strong resistance.

The inspiring film, directed by Davis Guggenheim, won two Oscars and contributed to taking the issue of climate change into popular culture, propelling Gore to being named a co-winner of the Nobel Peace Prize alongside the United Nation’s panel of climate scientists in 2007.

Its sequel, An Inconvenient Sequel: Truth to Power, which hits theaters here on Aug. 25, shows how far the battle to reverse the effects of climate change has come in 10 years. It serves as the next chapter of the story as people see not just accelerating change, but also the emergence of new battles. Simply put, if the first movie was the wakeup call, millions of people are now wide awake.

An Inconvenient Sequel: Truth to Power (Paramount Pictures/File)

Directed by Bonni Cohen and Jon Shenk, the sequel sets off in a new direction. It follows Gore as he continues his tireless fight, traveling around the world training an army of climate leaders while influencing international climate policy.

The award-winning directors (The Island President; Audrie & Daisy) offer a fresh perspective and sense of warmth to the sequel, bringing in their skilled eyes for cinematography to make the story, which may not be easy to tell, entertaining.

Cameras follow Gore behind the scenes in a direct cinema style, connecting the audience to the subject while revealing the complexity of human relations in a manner as electrifying and dramatic as fiction.

The sequel reveals both private and public moments as well as funny, poignant and unscripted, off-the-cuff moments, as Gore explains that, while the stakes have never been higher, the perils of climate change can be overcome with human ingenuity and passion.

Cameras also shadow Gore on his journey across Greenland, India, Europe, Asia and the US, navigating through corridors of power as well as “in the trenches” with survivors, scientists, unlikely leaders and ordinary people moved to take extraordinary actions.

Unexpected scenes intimately show Gore’s day-to-day efforts — he peels off his soggy socks after wading through ocean-flooded Miami; he escapes traffic by taking a crowded Paris subway; he engages in power-brokering roles with top officials such as New York Attorney General Eric Schneiderman, Secretary of State John Kerry and UN Climate Chief Christiana Figueres; and he listens to heart-wrenching stories from typhoon survivors in Tacloban, Philippines.

The film also allows viewers to “be there” with Gore as he visits the Swiss Camp research station in Greenland that monitors the movement of ice sheets. There, he learns the station itself has collapsed several times over the last decade because the ice on which it is anchored is melting so precipitously.

Climate talk: Al Gore discusses efforts to reverse the effects of climate change in An Inconvenient Sequel: Truth to Power. (Paramount Pictures/File)

One moving scene at Russell Glacier in Greenland shows Gore standing, his face in awe, while taking in what he sees — ice cracks off into a river that leads to the ocean, then says he can see that the glacier is in worse condition compared to last time he visited.

The film shows images of the climate change impacts splashed in the media — in the US alone, Louisianans in their cars are saved from drowning in a flood; ocean fish swim in Florida streets; and sci-fi-like “rain bombs” deluge Arizona. In India, a woman falls into a melting road. These scenes show that the urgency to solve the climate crisis is as great as ever.

Throughout the film, there is a sense of urgency and optimism, as well as a sense of connection with Gore’s passion, courage, resilience, heart and, most of all, his unique ability to inspire others.

While the first film may have caused deep concern, the sequel, while still pointing to extreme droughts, record-breaking downpours, melting Arctic ice and worrying scientific facts as evidence of climate change, has a more hopeful message in the world’s ability to solve the crisis.

Heart-warming scenes show, in the past 10 years, a low-carbon economy is emerging at an unprecedented pace, driven by innovative technologies and growing economic upsides. In fact, the year 2016 marked an all-time high in investments in renewable energy across the globe.

The sequel points out some huge climate success stories, including cities around the world achieving the goal of using 100 percent renewable electricity and how global investments in renewable electricity generation now exceed fossil fuels with markets increasingly turning away from them.

The film’s message is clear. There is hope that, together, we can solve the climate crisis. While economics alone do not paint the entire picture, the trends put the writing on the wall: the future belongs to renewables.

Just like the first film, the sequel delivers a powerful message for the world to hear. As Gore says: “The next generation, if they live in a world of floods and storms and rising seas and droughts and refugees by the millions escaping unlivable conditions, destabilizing countries around the world, they would be well justified in looking back and asking, ‘What were you thinking?’”

__________________________________________

An Inconvenient Sequel: Truth to Power

(Paramount Pictures, Participant Media; 98 minutes)

Directed by Bonni Cohen, Jon Shenk

Cast: Al Gore, John Kerry, Angela Merkel, Barack Obama, Donald J. Trump, George W. Bush.","Fri, 25 Aug 2017 07:00:00 GMT",https://img.jakpost.net/c/2017/08/25/2017_08_25_31526_1503628312._large.jpg,"['gore', 'change', 'sequel', 'presents', 'world', 'truth', 'power', 'film', 'scenes', 'inconvenient', 'climate']", ,flood_and_drought
52,52,Drought_Indonesia,The heat is on: 'Lucifer' heat wave has southern Europe sweltering - Deutsche Welle,https://www.dw.com/en/the-heat-is-on-lucifer-heat-wave-has-southern-europe-sweltering/a-39977626,"At least two people were reported to have died from the heat - one in Romania and one in Poland - and many more have been taken to hospital suffering from sunstroke and other heat-related conditions.

Italy, the Balkans and parts of France and Spain are among the most affected countries, with the extreme weather resulting in wildfires and damaging crops throughout the region. Wine growers in Italy started gathering the grape harvest weeks earlier than usual due to the extreme heat.

Bosnian officials said the heat wave and drought had nearly halved the country's agricultural output, which accounts for 10 percent of the country's economic production. Neighboring Serbia reported a similar situation, and experts said drought could slash corn and soybean production by a third.

Wildfires rage through Southeast Europe Too close for comfort Smoke and flames rise from a fire in the Croatian village of Podstrana, near the Adriatic coastal town of Split, on July 18, 2017. In Croatia, the blazes have spread over several locations along the coast and onto the islands, engulfing pine forests and low shrubbery in extremely dry and windy weather.

Wildfires rage through Southeast Europe Hope for the best While there were no reports of casualties and the fires only reached a few homes, some people could only stand by and watch as the flames razed everything in their path, especially nature. Fires between the Croatian town of Omis and Split have reportedly destroyed 4,500 hectares of forest.

Wildfires rage through Southeast Europe Desperate times Forest fires are common in southern Europe each summer, and can sometimes be caused by reckless tourists. However, there have also been cases where speculators have deliberately set fire to properties seeking new land to build on. Croatian news media are already speculating about arson, as fires started in more than 20 sites in Croatia alone.

Wildfires rage through Southeast Europe All hands on deck Firefighters used aircraft to try to tackle the flames, which continued overnight in both Croatia and neighboring Montenegro. With fires raging on the mainland as well as on islands such as Pag and Vir, the military was also called in to help in both countries. Montenegro also requested NATO's assistance.

Wildfires rage through Southeast Europe Situation mostly under control Fires that have raged for days in neighboring Montenegro have been brought under control, with soldiers helping to put out blazes on the Lustica peninsula near the town of Tivat. Some remote areas of Montenegro continue to be affected.

Wildfires rage through Southeast Europe Full picture of damage yet to emerge More than 100 tourists had to be brought to safety in Montenegro alone, as wildfires came threatening close to human habitats. The full extent of the damage remains unknown, as there is still some work to do to stop the fires and prevent future blayes in coming days, as temperatures are expected to soar.

Wildfires rage through Southeast Europe Large parts of southern Europe affected Europe has been experiencing an unusual heatwave this summer, with temperatures approaching record levels in many places. Southern Italy had to deal with its own wildfires less than a week earlier. The blames consumed swathes of land in the provinces of Cosenza (pictured here) and Salerno as well as parts of Sicily. Portugal was also affected by wildfires a month ago.



Official restrictions

Authorities in some areas issued traffic restrictions and banned work in the open during the hottest part of the day, as temperatures surpassed 40 degrees Celsius (104 Fahrenheit).

Spain's national weather service was among those issuing an emergency high temperature warning for 31 of the country's 50 provinces. Italian authorities issued weather risk warnings for 26 cities, including the tourist hubs of Venice and Rome, where many fountains have been turned off due to drought.

Authorities in other countries urged people to stay indoors and drink water.

ss/cl (AP, Reuters)","Sat, 05 Aug 2017 07:00:00 GMT",https://static.dw.com/image/19554433_6.jpg,"['heat', 'lucifer', 'europe', 'southeast', 'wildfires', 'town', 'wave', 'fires', 'temperatures', 'weather', 'sweltering', 'rage', 'southern', 'montenegro']", ,drought
