,ID,event_id,article_title,article_link,article_content,publishing_date,article_image,article_keywords,article_relevance,category
78,78,Drought_Indonesia,Did tiny algae fell mighty dinosaurs? - Science Magazine,https://www.sciencemag.org/news/2017/08/did-tiny-algae-fell-mighty-dinosaurs,"Did tiny algae fell mighty dinosaurs?

Seventy million years ago, they all came to drink in the rapidly drying river: long-necked sauropods, fierce theropods, crocodiles, lizards, and raven-sized birds. They never left. The giant and the tiny were entombed together in the riverbed, forming what is now a spectacular series of mass graves in northwestern Madagascar. Last week, researchers proposed a culprit behind this ancient mystery: harmful algal blooms (HABs), in the very water that had lured the animals.

The remains of such algal blooms “should be more common in the fossil record,” says vertebrate paleontologist Nicholas Pyenson of the Smithsonian Institution in Washington, D.C., who was not part of the study. But he cautions that they are tough to prove.

Bone beds always come with a mystery: Why did so many animals die at once? Floods and volcanoes are sometimes invoked, and for years researchers suspected that drought killed the animals whose fossils accumulated in the Maevarano Formation of Madagascar. Torrential rains punctuating periods of drought might have created turbulent rivers choked with sediment that buried skeletons intact.

One chunk of this formation “is the most fossiliferous package of rock I’ve ever seen,” says Raymond Rogers, a geologist at Macalester College in St. Paul, who has been studying the site for 2 decades. He and his colleagues have so far cataloged nearly 1200 specimens from a single bed a third the size of a tennis court.

Over time, the team grew skeptical of drought as the only explanation. Large and small animals nestle against each other, suggesting that the bodies were buried where they died and that the killer struck all kinds of animals without discrimination. In addition, whatever killed these animals “was fast-acting,” Rogers says, “dropping birds in their tracks.” And it happened again and again, creating multiple layers of bone beds.

Last week, at the annual meeting of the Society of Vertebrate Paleontology here, Rogers noted the arched-back posture of the dead, which suggests neck convulsions; an unusual carbonate crust, similar to those left by algae in other sediments; and the sheer number of dead birds. Taken together, he says, these clues suggest that the killer was “almost certainly harmful algal blooms,” which can develop repeatedly in the same place in late summer.

HABs have been implicated in mass deaths before. In 1878, a Nature paper noted a peculiar hyperextended neck posture—similar to the postures of the Maevarano creatures—in dead livestock near a lake; testing confirmed that the animals had ingested toxic cyanobacteria. And in a 2014 paper in the Proceedings of the Royal Society B, Pyenson and others suggested that toxic algae periodically killed hundreds of whales and other marine animals off the coast of what is now Chile, starting 11 million years ago.

Algae even might be implicated at Germany’s famous Messel Pit, says paleontologist Wighart von Koenigswald of the University of Bonn in Germany, who was not involved in the new study. That series of Eocene mass graves is full of birds and bats, he notes, making one explanation—sudden carbon dioxide degassing from an ancient lake—unlikely. Moreover, the beds include turtles caught in the act of copulation as well as pregnant mares, suggesting that the deaths happened during mating season across different years. years. Toxic algae are “the most plausible explanation,” Von Koenigswald says.

In Madagascar and elsewhere the smoking gun—direct evidence of algae—is still missing, Rogers acknowledges. He plans to hunt for chemical traces or biomarkers of algae in the rocks and fossils. If such evidence is found in Madagascar, says Smithsonian vertebrate paleontologist Kay Behrensmeyer, this “very provocative” idea might help explain other fossil troves. “It opens up a possibility that we probably have not been considering seriously enough.”","Tue, 29 Aug 2017 07:00:00 GMT",https://www.sciencemag.org/sites/default/files/styles/article_main_large/public/bone%20beds.jpg?itok=bUIXzBy6,"['toxic', 'mighty', 'tiny', 'paleontologist', 'rogers', 'killed', 'birds', 'dinosaurs', 'mass', 'algae', 'fell', 'madagascar', 'vertebrate', 'animals']", ,flood_and_drought
79,79,Drought_Indonesia,Farmers meet to share drought lessons - Namibian,https://www.namibian.com.na/57579/read/Farmers-meet-to-share-drought-lessons,"Register

Please enter your details here:

Name *

Surname

Email *

Age Select your Age -18 18 19 20 21 22 23 24 25 26 27 28 29 30 31 32 33 34 35 36 37 38 39 40 41 42 43 44 45 46 47 48 49 50 51 52 53 54 55 56 57 58 59 60 61 62 63 64 65 66 67 68 69 70 71 72 73 74 75 76 77 78 79 80 81 82 83 84 85 86 87 88 89 90 91 92 93 94 95 96 97 98 99 100 *

Gender Select your Gender Female Male

Country Select a value Afghanistan Albania Algeria American Samoa Andorra Angola Anguilla Antigua and Barbuda Argentina Armenia Aruba Australia Austria Azerbaijan Bahamas Bahrain Bangladesh Barbados Belarus Belgium Belize Benin Bermuda Bhutan Bolivia Bosnia and Herzegovina Botswana Brazil Brunei Bulgaria Burkina Faso Burundi Cambodia Cameroon Canada Cape Verde Cayman Islands Central African Republic Chad Chile China Colombia Comoros Congo Cook Islands Costa Rica Cote d'Ivoire Croatia Cuba Cyprus Czech Republic D.P.R. Korea Denmark Djibouti Dominica Dominican Republic Ecuador Egypt El Salvador Equatorial Guinea Eritrea Estonia Ethiopia Falkland Islands (Malvinas) Faroe Islands Fiji Finland France French Guiana French Polynesia French Southern Territories Gabon Gambia Georgia Germany Ghana Gibraltar Greece Grenada Guadaloupe Guam Guatemala Guinea Guinea-Bissau Guyana Haiti Holy See (Vatican City State) Honduras Hong Kong Hungary Iceland India Indonesia Iran Iraq Ireland Israel / West Bank and Gaza Italy Jamaica Japan Jordan Kazakhstan Kenya Kiribati Kuwait Kyrgyzstan Laos Latvia Lebanon Lesotho Liberia Libya Liechtenstein Lithuania Luxembourg Macau Macedonia Madagascar Malawi Malaysia Maldives Mali Malta Marshall Islands Martinique Mauritania Mauritius Mexico Micronesia (Federated States of) Moldova Monaco Mongolia Montserrat Morocco Mozambique Myanmar Namibia Nauru Nepal Netherlands Netherlands Antilles New Caledonia New Zealand Nicaragua Niger Nigeria Niue Norway Oman Pakistan Palau Palestine Panama Papua New Guinea Paraguay Peru Philippines Poland Portugal Puerto Rico Qatar Republic of Korea Reunion Romania Russian Federation Rwanda Saint Christopher and Nevis Saint Helena Saint Lucia Saint Pierre and Miquelon Saint Vincent and the Grenadines Samoa San Marino Sao Tome and Principe Saudi Arabia Senegal Seychelles Sierra Leone Singapore Slovakia Slovenia Solomon Islands Somalia South Africa Spain Sri Lanka Sudan Suriname Swaziland Sweden Switzerland Syrian Arab Republic Taiwan Tajikistan Tanzania, United Republic of Thailand Togo Tokelau Tonga Trinidad and Tobago Tunisia Turkey Turkmenistan Turks and Caicos Islands Tuvalu Uganda Ukraine United Arab Emirates United Kingdom United States Uruguay Uzbekistan Vanuatu Venezuela Viet Nam Virgin Islands (British) Virgin Islands (U.S.) Wallis and Futuna Islands Yemen Yugoslavia Zaire Zambia Zimbabwe *

Town *

Password

Confirm Password

Id

* Compulsory fields","Fri, 04 Aug 2017 07:00:00 GMT",https://www.namibian.com.na/images/logo_small.jpg,"['select', 'guinea', 'united', 'states', 'samoa', 'virgin', 'republic', 'islands', 'saint', 'namibian', 'french']", ,none
80,80,Drought_Indonesia,10 Artists on What Climate Change Actually Looks Like - Outside,https://www.outsideonline.com/2229726/these-artists-are-trying-make-climate-change-feel-visceral,"Climate change data has its problems: It is often lofty and complicated, hard to digest, and even harder to conjure into feelings of urgency. But artists are stepping in to marry data with their crafts, bridging the gap between scientific information and human connection. Recognizing that people often act by heart rather than logic, these ten artists aim to help viewers understand the data while developing an emotional attachment that convinces them to do something about it—now.

Zaria Forman

Amid the dire reality of melting ice sheets and subsequent rising sea levels, Zaria Forman opts to spotlight the beauty: “A bombardment of terrifying news is paralyzing, but focusing on the positive is empowering.” Forman’s staggeringly realistic paintings capture the majesty and fragility of the icebergs. Look closer and you’ll see the finely painted ice fjords crackling, crumbling, and melting. Still, Forman’s message always leans toward hope and action. “I try to celebrate what is still here; to give viewers the sense that it is still possible to do something to protect this Earth that sustains us.”

Sean “Hula” Yoro

Growing up in Hawaii, Sean “Hula” Yoro was raised to respect nature. The surfer and self-taught artist creates murals usually involving portraits on hard-to-reach locales like ship docks and dams to illustrate the changing landscape. In some cases, he paints on natural surfaces like icebergs or forest trees, letting the figures rapidly melt or get washed away by natural forces to create a sense of urgency. “The idea of my art not lasting adds another depth to the message and feels more real,” says Yoro.

Jill Pelto

Previous Next (Courtesy of Jill Pelto) (Courtesy of Jill Pelto) (Courtesy of Jill Pelto)

At 24, painter and environmental science student Jill Pelto is already establishing a new kind of art informed by scientific data and inspired by early 20th-century explorers like Edward Adrian Wilson. Pelto knows that her generation and those that follow are the ones inheriting the issues and that the research isn’t always simple to digest. “I also find that many people just don’t pay attention,” she says. Her illustrations depict the same kind of graphs you might find in a textbook (decline in glacier mass balance; ocean acidification; deforestation) overlaid with watercolor paintings of the affected natural wonders, bringing the research to life.

PangeaSeed

Previous Next (Courtesy of PangeaSeed) (Courtesy of PangeaSeed) (Courtesy of PangeaSeed)

Murals can transform cities and inspire change. Photographer Tre’ Packard, who founded PangeaSeed with his wife to promote environmental activism through art and education, applies the same concept to ocean conservation. The organization’s Sea Walls festivals, hosted in cities around the world, unite artists with scientists to create abstract street art that encourages dialogue. “I’m not delusional,” says Packard. “I know we are not going to change the world, but small efforts add up. We want to lead by example.”

Courtney Mattison

One of the challenges in communicating the scope of environmental change is that we mostly can’t see it. With coral reefs, though, the impact is clear: The water gets warmer, the corals bleach, and unless the temperature is stabilized, they deteriorate. “It’s like a city going bankrupt and letting the buildings fall apart,” says former marine biology student and sculptor Courtney Mattison. Her thousand-pound ceramic reef renderings show this process starkly, with white corals mixed into the vibrantly painted and meticulously detailed pieces. She lets her fingerprints show on the stoneware and porcelain corals, speaking to our potential role in recovering the fragile ecosystems by emphasizing the human element of the work. “If people see evidence of my hands in the work, they may relate more closely,” says Mattison. “I don’t want it to be too literal, because the point is to spark curiosity.”

Tamiko Thiel

Tamiko Thiel uses technology to illustrate the impact we have on the planet. Her Gardens of the Anthropocene virtual reality installation first appeared in Seattle Art Museum’s Olympic Sculpture Park and depicts a world overtaken by mutated versions of regional drought-resistant plants that feed on everything in sight—phones included. As an engineer, Thiel felt compelled to include factual data, but as an artist she wanted to complete the picture and pick up where the science (which she notes is couched in conditionals) stops. The series, now on view at Stanford University, is meant to entertain while stealthily urging viewers to do their part. “Humans only change when they see no other alternative in order to survive,” says Thiel.

Justin Guariglia

Justin Brice Guariglia became one of the first artists in a decade to work with NASA when he joined the group on survey flights for Operation IceBridge as an independent artist in 2015. The aerial images obtained are impressive, but Guariglia takes it a step further by transforming the photos into topographical prints that pop off the canvas through a printing process he developed. His work will be presented in West Palm Beach, Florida’s Norton Museum of Art in September. This year, Guariglia also launched After Ice, a selfie app with a filter that shows how high sea levels will rise by 2080 in New York. (Spoiler alert: If you’re near the city, you’ll be swimming with the fishies.)

Eve Mosher

In 2007, artist Eve Mosher took to the streets of Brooklyn with a baseball field chalker to trace a 70-mile line around the city marking the projected reach of a flood that could hit the coast within three to 20 years. Mosher’s HighWaterLine project simplified complex data down to a clear-cut line that hit way too close to the literal home of thousands of New Yorkers. It got attention. Then Hurricane Sandy came along and proved the predictions true. Now, HWL has grown to include workshops, community outreach, and other public art installations in cities from South Florida to England. “Art can create the space needed to go from grief and shock of what is coming to action.”

Hannah Rothstein

“I have been worried about climate change for a long time, and when I saw the systems designed to fight it being dismantled, I felt my time to pull out the art guns had come,” says illustrator Hannah Rothstein. She drew from some of the most iconic images in U.S. history—vintage National Park posters—and reimagined seven of them to resemble their fated decline for 2050, only 33 years away. Although she stays away from politics, Rothstein has been pleasantly surprised to see people sending postcards of the prints to senators. “Instead of deepening our divisions,” she says. “I hope this project will inspire our country’s policymakers to put politics aside and focus on the greater good.”

Lisa Murray

Photojournalist Lisa Murray has seen firsthand how new weather patterns affect rural communities. She’s seen women in Kenya walk hours to get water for their families following periods of intense drought; healthy villages in South Sudan going hungry after flash floods wipe away the harvest; fishing communities in Indonesia disappearing due to erosion and rising sea levels. “In the West, climate change doesn’t impact on our lives the same way it does in the global South,” she says. “It’s easy for people to ignore it.” Murray launched Faces of Change to document how environmental issues impact the lives of real people without sensationalizing or harping on the negative. “Showing the impact climate change has on everyday people and everyday life enables us to understand the consequences of a warming planet on a human level,” says Murray.","Thu, 03 Aug 2017 07:00:00 GMT",https://www.outsideonline.com/sites/default/files/styles/full-page/public/2017/07/26/climate-change-art-lead_h.jpg?itok=dxzbq0Yd,"['data', 'change', 'looks', 'pelto', 'work', 'sea', 'jill', 'artists', 'actually', 'environmental', 'courtesy', 'impact', 'art', 'climate']", ,flood_and_drought
81,81,Drought_Indonesia,Global warming could cause yield of sorghum crops to drop 'substantially' - eco-business.com,https://www.eco-business.com/news/global-warming-could-cause-yield-of-sorghum-crops-to-drop-substantially/,"Sorghum is the fifth most economically important cereal in the world and is grown in some of the most arid parts of Africa and South Asia, where it is a staple food for half a billion people.

The new research finds that for every degree of warming above a 1985 to 2014 average, sorghum crop yields could drop by around 10 per cent. This suggests the hardy cereal may be more vulnerable to heat stress caused by climate change than previously thought, the authors tell Carbon Brief.

However, the indirect impacts of temperature might actually be a larger driver of future sorghum yield declines, another scientist tells Carbon Brief. It is likely that environmental factors, such as humidity, will have significant role in crop productivity, he says.

“ While I do not doubt the ultimate importance of tolerance to direct effects of high temperature, this is a consequence of “shock effects” of high temperature at specific development stages. Graeme Hammer, director of plant science, University of Queensland

Why is sorghum so hardy?

Sorghum is a tall cereal grain that is grown for food in arid parts of Africa and South Asia, and for animal fodder (and sometimes biofuel) in many developed and developing countries.

According to the UN Food and Agriculture Organisation, the US is the world’s largest producer of sorghum, followed by Mexico, Nigeria, Sudan and India.

Farmers started growing sorghum in north-eastern Africa around 8,000 years ago. Through thousands of years of selective breeding, the crop has evolved to be more resilient to harsh environmental conditions than other cereals, such as maize and wheat.

Sorghum is particularly hardy in dry conditions because it has large fibrous roots which can reach far down into the earth to extract water. It has also adjusted its reproductive system to withstand high temperatures.

As a result, sorghum has even been suggested as an alternative crop for wheat and maize farmers facing falling yields due to climate change.

However, the new study, published in the Proceedings of the National Academy of Sciences, suggests that sorghum yields will be severely dented by rises in temperature.

The researchers find that sorghum yields will decline “substantially” at temperatures higher than 33C. Lead authors Jesse Tack and Krishna Jagadish from Kansas State University explain to Carbon Brief in a joint interview:

“We studied 30 years of sorghum production in Kansas and found that the crop is vulnerable to additional heat stress should average temperatures rise. Our results indicate that climatic change will likely produce an average yield loss of 10 per cent for each degree Celsius of warming.”

The graph below shows how exposure to temperatures causes negative changes to sorghum yield. The red line shows the results for managed field trials at 11 locations across Kansas, while the orange line shows results for data taken from the National Agricultural Statistics Service (NASS).

Growing problems

Using data from 9,000 observations collected over the course of the 11 trials and 30 years, the researchers developed a model to simulate how rises in temperature could affect sorghum yields.

The chart below shows the projected drop in yield for each degree of temperature rise above a 1985-2014 average. So, for example, 2C of warming (roughly equivalent to 2.6C above pre-industrial) could cause sorghum crop yields to drop by 17 per cent. Losses increase to 57 per cent for the highest scenario of 5C.

Warming affects the productivity of sorghum by causing heat stress at key points in its reproductive cycle, say Tack and Jagadish:

“We show that pre-flowering [when reproductive parts are developed] and post flowering stages [when seeds are produced] to be equally impacted by stress. We can do this because we observe planting and flowering dates for every single observation, another valuable aspect of our data.”

However, falling crop yields may also be impacted by temperature-dependent factors other than heat stress, says Prof Graeme Hammer, director of plant science at the University of Queensland, who was not involved in the research.

In his research, he has shown that rising temperature can have a number of indirect effects on the growth and development of cereal plants.

For example, unusually warm temperatures can affect the vapour pressure deficit (VPD) – this is the difference between the water vapour contained in the leaf’s interior and in the air surrounding it.

Hot weather causes increases in VPD (pdf), upping the rate of transpiration – the process by which plant moisture is released into the atmosphere.

In order to readjust this balance and prevent moisture escaping, a plant will close its pores. This restricts how much CO2 the plant can absorb and use to grow through photosynthesis.

Hammer believes that this indirect effect of temperature on plant growth has a larger impact on crop yield than heat stress:

“While I do not doubt the ultimate importance of tolerance to direct effects of high temperature, this is a consequence of “shock effects” of high temperature at specific development stages. The gradual effects of “heat stress” reside in consequences they bring on the dynamic of crop growth and development over the season.”

Finding a solution

Whether the impacts of temperature rise on sorghum yields are predominantly direct or indirect, the need to help farmers adapt is still there.

One solution for US farmers might be to grow sorghum in cooler environments, such as the US corn belt, researchers say.

However, similar options are not necessarily available in hotter, drier countries, such as Chad, where sorghum is a staple food for thousands of subsistence farmers.

Instead, scientists will need to hunt for new genes that promote resistance to heat extremes and incorporate them into sorghum breeding programmes, say Tack and Jagadish:

“Our particular focus was on the potential to adapt using currently available seed varieties. We find limited scope in this regard. However, breeding programmes can likely introduce new genetic material from sorghum plants existing in nature in order to boost heat resilience.”

In addition to developing new heat-resistant breeds, researchers will also have to develop new crop management strategies that address how warming affects the VPD, says Hammer:

“Some attention to adaptation of phenology (time to flowering) of cultivars [plant breeds] and adjustment of crop management (to deal with changes in water balance) would likely moderate much of the effect observed.”

This story was published with permission from Carbon Brief.","Tue, 15 Aug 2017 07:00:00 GMT",https://eco-business.imgix.net/uploads/ebmedia/fileuploads/6119493226_a5aaf6d795_z.jpg?fit=crop&h=801&ixlib=django-1.2.0&q=85&w=1200,"['high', 'crops', 'cause', 'global', 'yields', 'substantially', 'yield', 'crop', 'plant', 'effects', 'temperature', 'stress', 'warming', 'sorghum', 'drop', 'heat']", ,none
82,82,Drought_Indonesia,"US to Give Additional $169 Million in Aid to Ethiopia, Kenya - Voice of America",https://www.voanews.com/africa/us-give-additional-169-million-aid-ethiopia-kenya,"The administration of U.S. President Donald Trump announced Thursday it will provide an additional $169 million in humanitarian aid to the drought-stricken African countries of Ethiopia and Kenya.

The U.S. Agency for International Development (USAID) said the funds, over $136 million for Ethiopia and almost $33 million for Kenya, would be used for emergency food aid, nutrition supplies and health services.

USAID said nearly 8 million Ethiopians are in need of urgent humanitarian aid. Without it, the agency said ""food insecurity could reach catastrophic levels for some families in the worst-affected areas"" and result in ""the displacement of affected populations.""

In Kenya, USAID said some 2.6 million people are ""acutely food-insecure"" as drought conditions continue.

The latest round of humanitarian aid increases to $458 million the amount of assistance the U.S. has provided to Ethiopia and Kenya this fiscal year.

Last month, the U.S. pledged nearly $640 million in urgent food assistance to Nigeria, Somalia, South Sudan and Yemen.

In addition to drought-caused food shortages, the countries have had to grapple with armed conflicts and economic turmoil that caused reductions in medical care, shelter and safety and sanitation services.

In this photo taken April 11, 2017, a woman walks FILE - In this photo taken April 11, 2017, a woman walks back to her home after receiving food distributed by the Red Cross in South Sudan. FILE - In this photo taken April 11, 2017, a woman walks back to her home after receiving food distributed by the Red Cross in South Sudan.

The United Nations previously warned of mass starvation in Nigeria, Somalia, South Sudan and Yemen. Last month it said many people in South Sudan continue to suffer from hunger, but that famine conditions in parts of the country had eased.

The United Nations reports 795 million people are undernourished throughout the world, primarily in developing countries.","Thu, 03 Aug 2017 07:00:00 GMT",https://im-media.voltron.voanews.com/Drupal/01live-166/2019-04/8CAFCE94-18D7-4413-8E71-2925D9D15CC5.jpg,"['aid', 'woman', 'sudan', 'humanitarian', 'food', 'ethiopia', 'taken', 'million', 'walks', 'kenya', 'additional', 'south', '169']", ,drought
