,ID,event_id,article_title,article_link,article_content,publishing_date,article_image,article_keywords,article_relevance,category
20,20,Drought_Indonesia,Malaysia apologizes for showing Indonesia's flag as Poland's - Taiwan News,https://www.taiwannews.com.tw/en/news/3235760,"Indonesia's national flag, printed upside down on a local newspaper infographic chart for the 29th South East Asian Games, is seen in Kuala Lumpur, Ma... Indonesia's national flag, printed upside down on a local newspaper infographic chart for the 29th South East Asian Games, is seen in Kuala Lumpur, Malaysia Sunday, Aug. 20, 2017. Indonesia has accused the Malaysian organizers of the Southeast Asian Games of negligence after the Indonesian flag was printed upside down in a souvenir guidebook. (AP Photo/Daniel Chan)

Malaysian Youth and Sports Minister Khairy Jamaluddin, left, shakes hand with Indonesian Youth And Sports Minister Imam Nahrawi, right, as Jamaluddin ... Malaysian Youth and Sports Minister Khairy Jamaluddin, left, shakes hand with Indonesian Youth And Sports Minister Imam Nahrawi, right, as Jamaluddin apologized to Indonesia for the mistake, which makes the red-and-white Indonesian flag resemble Poland's on a guidebook, in a press conference in Kuala Lumpur, Malaysia on Sunday, Aug. 20, 2017. Indonesia accused the Malaysian organizers of the Southeast Asian Games of negligence after the Indonesian flag was printed upside down in a souvenir guidebook. (AP Photo/Daniel Chan)

Indonesia's athletes parade during the opening ceremony of the 29th Southeast Asian Games in Kuala Lumpur, Malaysia on Saturday, Aug. 19, 2017. (AP Ph... Indonesia's athletes parade during the opening ceremony of the 29th Southeast Asian Games in Kuala Lumpur, Malaysia on Saturday, Aug. 19, 2017. (AP Photo/Adrian Hoe)

Indonesia's athletes parade during the opening ceremony of the 29th Southeast Asian Games in Kuala Lumpur, Malaysia on Saturday, Aug. 19, 2017. (AP Ph... Indonesia's athletes parade during the opening ceremony of the 29th Southeast Asian Games in Kuala Lumpur, Malaysia on Saturday, Aug. 19, 2017. (AP Photo/Adrian Hoe)

Indonesia's athletes parade during the opening ceremony of the 29th Southeast Asian Games in Kuala Lumpur, Malaysia on Saturday, Aug. 19, 2017. (AP Ph... Indonesia's athletes parade during the opening ceremony of the 29th Southeast Asian Games in Kuala Lumpur, Malaysia on Saturday, Aug. 19, 2017. (AP Photo/Vincent Phoon)

FILE - In this Aug. 17, 2017 file photo, flag bearers hoist the national red and white flag during a ceremony marking the 72nd anniversary of the coun... FILE - In this Aug. 17, 2017 file photo, flag bearers hoist the national red and white flag during a ceremony marking the 72nd anniversary of the country's Independence, at Merdeka Palace in Jakarta. Indonesia is accusing the Malaysian organizers of the Southeast Asian Games of negligence after the Indonesian flag was printed upside down in a souvenir guidebook. The mistake, which makes the red-and-white Indonesian flag resemble Poland's, has caused anger in Indonesia where ""shameonyoumalaysia"" has become the most popular hashtag on Twitter. (AP Photo/Dita Alangkara)

Malaysian Youth and Sports Minister Khairy Jamaluddin, left, and Indonesian Youth And Sports Minister Imam Nahrawi, right, attend a press conference ... Malaysian Youth and Sports Minister Khairy Jamaluddin, left, and Indonesian Youth And Sports Minister Imam Nahrawi, right, attend a press conference in which Jamaluddin apologized to Indonesia for the mistake, which makes the red-and-white Indonesian flag resemble Poland's on a guidebook, in a press conference in Kuala Lumpur, Malaysia on Sunday, Aug. 20, 2017. Indonesia accused the Malaysian organizers of the Southeast Asian Games of negligence after the Indonesian flag was printed upside down in a souvenir guidebook. (AP Photo/Daniel Chan)

Indonesia's national flag, printed upside down, is seen on the guidebook of the Opening Ceremony of the 29th South East Asian Games in Kuala Lumpur, ... Indonesia's national flag, printed upside down, is seen on the guidebook of the Opening Ceremony of the 29th South East Asian Games in Kuala Lumpur, Malaysia on Sunday, Aug. 20, 2017. Indonesia has accused the Malaysian organizers of the Southeast Asian Games of negligence after the Indonesian flag was printed upside down in a souvenir guidebook. (AP Photo/Yau)

Malaysian Youth and Sports Minister Khairy Jamaluddin, center left, and Indonesian Youth And Sports Minister Imam Nahrawi, center right, pose together... Malaysian Youth and Sports Minister Khairy Jamaluddin, center left, and Indonesian Youth And Sports Minister Imam Nahrawi, center right, pose together as Jamaluddin apologized to Indonesia for the mistake, which makes the red-and-white Indonesian flag resemble Poland's on a guidebook, in a press conference in Kuala Lumpur, Malaysia on Sunday, Aug. 20, 2017. Indonesia accused the Malaysian organizers of the Southeast Asian Games of negligence after the Indonesian flag was printed upside down in a souvenir guidebook. (AP Photo/Daniel Chan)

KUALA LUMPUR, Malaysia (AP) — Malaysia has apologized to Indonesia for an ""unintentional"" mistake in printing the Indonesian flag upside down in a souvenir guidebook for the Southeast Asian Games.

The error made the red-and-white Indonesian flag resemble Poland's and has caused anger in Indonesia, where ""shameonyoumalaysia"" has become the most popular hashtag on Twitter and prompted President Joko ""Jokowi"" Widodo to demand an apology.

Malaysian Youth and Sports Minister Khairy Jamaluddin met his Indonesian counterpart Imam Nahrawi to personally apologize. After a brief private meeting Sunday, the two ministers shook hands at a news conference.

Khairy says the guidebooks will be corrected and reprinted.","Sun, 20 Aug 2017 07:00:00 GMT",https://tnimage.s3.hicloud.net.tw/photos/shares/AP/20170820/72a56b64e1e3415ea126f9f6418dadd9.jpg,"['youth', 'minister', 'malaysia', 'kuala', 'southeast', 'apologizes', 'games', 'polands', 'lumpur', 'indonesias', 'indonesian', 'flag', 'showing', 'asian']", ,none
21,21,Drought_Indonesia,Peer-to-peer lending bears risk of bad debt: Economist - Jakarta Post,https://www.thejakartapost.com/news/2017/08/25/peer-to-peer-lending-bears-risk-of-bad-debt-economist.html,"Share this article Whatsapp

Facebook

Twitter

Linkedin Anton Hermansyah (The Jakarta Post) Jakarta ● Fri, August 25, 2017 17:38 1377 4065a5a8898c7cc661d4adf97adfe2e6 1 Business peer-to-peer-lending,bad-debt,risk,business Free

Despite the rising trend of peer-to-peer (P2P) lending in Indonesia, an economist believes that online-based businesses have increased risk of bad debt if the lenders ignore the importance of supervision.

The credit application mechanism in P2P lending is risky. There is no integrated costumer blacklist data-base like in the banking industry, said Samuel Aset Manajemen economist Lana Soelistianingsih said in Jakarta on Friday.

She said applicants for loans just presented their legal documents such as identity cards and vehicle ownership certificates to get loans.

""If you apply for a loan at banks or in pawnshops, they will hold your physical documents, but in P2P lending, we do not know whether or not the same scanned documents are being used for other loan applications,"" Lana said at the Indonesia Stock Exchange (IDX) building in Jakarta on Friday.

Moreover, she said P2P lending offered annual interest rates of up to 18.5 percent to investors, adding that such aggressive offers could increase the risk of business failure.

She also said the Indonesia Deposit Insurance Corporation (LPS) did not guarantee deposits in P2P lending and in addition to the risk, the data for P2P lending is not covered by the Financial Service Authority (OJK).

""This is a risky business and unfortunately our people love risky things. The OJK must regulate this soon,"" she said. (bbn)","Fri, 25 Aug 2017 07:00:00 GMT",https://img.jakpost.net/c/2017/08/25/2017_08_25_31539_1503653019._large.jpg,"['bad', 'p2p', 'risky', 'loan', 'lana', 'lending', 'risk', 'business', 'economist', 'jakarta', 'documents', 'debt', 'peertopeer', 'indonesia', 'bears']", ,none
22,22,Drought_Indonesia,Successful prediction of multi-year US droughts and wildfire risk: Longer-term forecasts will benefit agriculture and natural resource management - Science Daily,https://www.sciencedaily.com/releases/2017/08/170801094509.htm,"The next mega-droughts and subsequent active wildfire seasons for the western U.S. might be predictable a full year in advance, extending well beyond the current seasonal forecast and helping segments of the economy related to agriculture, water management and forestry.

The new model, developed by an international team of scientists from the U.S., South Korea and U.K., and led by Utah State University climate scientist Yoshimitsu Chikamoto, was reported in the July 26 edition of Scientific Reports.

The source of this improved predictability is based on a combination of factors, including tropical climate variability, global climate change and the natural filtering effects of soils. To mitigate drought-induced socioeconomic risks, water resource managers require detailed drought forecasts as far in advance as possible. Climate prediction centers generate and routinely disseminate seasonal drought outlooks. However, predicting multi-year droughts that reach well beyond seasonal timescales is challenging for climate scientists.

Over the past 15 years, parts of the western U.S. have experienced severe drought conditions and an increasing number of wildfires that take a toll on people and ecosystems. The team's research shows that in addition to contributions from natural forcings and global warming, temperature differences between the Atlantic and Pacific oceans play a role in causing drought and increasing wildfire risks. The new findings show that a warm Atlantic and a relatively cold Pacific enhance the risk for drought and wildfire in the southwestern U.S.

""According to our study, the Atlantic/Pacific temperature difference shows pronounced variations on timescales of more than 5 years,"" explained Chikamoto, USU associate professor in the department of Plants, Soils and Climate. ""Like swings of a very slow pendulum, this implies that there is predictability in the large-scale atmosphere/ocean system, which we expect will have a substantial societal benefit.""

The new findings of successful multi-year drought/fire predictions are based on a series of computer modeling experiments, using the state-of-the-art earth system model, the most detailed data on current ocean temperature and salinity conditions, and the climate responses to natural and human-linked radiative forcing. The results of the experiments are presented in the online Scientific Reports.

""We found that, even 10-months after the starting prediction, the model was tracking the observation-based soil water conditions very well,"" Chikamoto said. ""This implies that drought and fire conditions in the next water year can be predicted from the previous winter.""

""This is a surprising result,"" said co-author Lowell Stott from the University of South California. ""The atmospheric river is an important source for California water resources, but its predictability is limited to the atmospheric short memory of 2 weeks. Of course, we cannot predict an exact location, duration and timing of each drought event beyond several weeks. However, our result of multi-year drought predictability suggests that the annual frequency of atmospheric river water supply is controlled by large-scale climate variability and change. This frequency change in drought condition is much more predictable beyond several seasons.""

""There are three predictable processes,"" explained co-author Axel Timmermann, director of the Institute for Basic Science Center for Climate Physics, Pusan National University in South Korea. ""At first, tropical ocean temperature contrast between Pacific and Atlantic causes slow climate variability due to its large thermodynamical inertia, and then affects the atmospheric high-pressure ridge off the California coast via global teleconnections. Secondly, the slow variation in this high-pressure ridge is enhanced by filtering out the atmospheric noise through land soil processes. Thirdly, global climate change contributes to the long-term drying trend in the West. A combination of these three processes explains the recent southwestern U.S. drought event for 2011-2014.""

The application of this findings is anticipated to be in great demand. ""Our study clearly demonstrates a new possibility of international, ongoing, decadal forecasting activities, said co-author Magdalena Balmaseda from the European Centre for Medium-Range Weather Forecasts. ""We anticipate that multi-year drought predictions will be available soon by collaborating with operational forecast centers.""","Tue, 01 Aug 2017 07:00:00 GMT",https://www.sciencedaily.com/images/scidaily-icon.png,"['successful', 'change', 'predictability', 'prediction', 'forecasts', 'multiyear', 'global', 'longerterm', 'atmospheric', 'wildfire', 'resource', 'climate', 'natural', 'conditions', 'water', 'risk', 'management', 'temperature', 'drought']", ,drought
23,23,Drought_Indonesia,"The key to drought-tolerant crops may be in the leaves: Leaf wax acts as the equivalent of 'lip balm' for plants, protecting them from the harmful effects of drought - Science Daily",https://www.sciencedaily.com/releases/2017/08/170815145836.htm,"A solution to help farmers to grow crops in dry areas or during stretches of drought may depend on breeding and cultivating plants that protect themselves with a thicker layer of leaf wax, a new study shows.

Sarah Feakins, a scientist at USC who has studied leaf wax in the context of climate change, teamed up recently with researchers at Texas A&M University to research and develop drought-resistant crops. During tests with growing winter wheat, a type harvested for yeast-based breads and other such products, the team found that the cultivars in a high and dry area of Texas generated more protective wax on their leaves as a measure to protect themselves against more extreme conditions.

The results mimicked what scientists have found in leaves in natural ecosystems: Those that survive in dry climates have higher concentrations of wax.

""Water conservation depends on innovation, and in this case, we are hoping to find one solution by identifying the traits in this important food crop that would enable the wheat plants to tolerate drought and still produce plenty for harvest,"" said Feakins, a co-lead author of the study and an associate professor of earth sciences at the USC Dornsife College of Letters, Arts and Sciences.

The study was published in the journal Organic Geochemistry on Aug. 14.

Dry vs. regular moist conditions

All plants produce wax that helps their leaves repel water and shield the plant from insects and the elements, said Feakins, who has studied climate history of the Earth through the geochemistry of leaf wax in sediments.

advertisement

Feakins said this latest study marks the first time she has applied her expertise to agricultural production. The United States is currently the top exporter of wheat in the world, according to the U.S. Department of Agriculture's Economic Research Service. Winter wheat is largely grown for bread products and ingredients, such as all-purpose flour.

For the study, the researchers grew test plots of winter wheat in two different areas of Texas: the high plains of Amarillo and a farming area known as Winter Garden, Uvalde.

At each location, scientists grew 10 cultivars, or plant varieties, of winter wheat that received regular irrigation and another 10 cultivars that received 13 percent to 25 percent less irrigation. The team compared the leaf wax of all the plots to gauge their drought tolerance.

The plot set to receive 25 percent less irrigation in Winter Garden ended up receiving 13 percent less because of greater-than-expected rainfall. But a similar plot grown with 25 percent less water in the most arid area, Amarillo, generated 50 percent more paraffin on its leaves than the other cultivars in all the other plots, which enabled the plants to tolerate their dry conditions.

""We see a strong effect in the higher and drier location,"" Feakins said. ""We see the plants adapt to their environment and to better protect their leaves, allowing them to respond well to reduced irrigation.""

The lower available water was tracked through carbon isotopes in the plant leaves and in the waxes themselves, tools that are used to reconstruct climates of the past from ancient waxes in sediments.

advertisement

""This is part of an effort to breed crops that are more drought-resistant. In the world that we are in today, with warming reducing available water, there will be more demand for crops that are drought-resistant,"" Feakins said.

Feakins said the team will next consider which of their cultivated wheat crop offers the best resilience and are able to generate high yields with low irrigation or precipitation.

Other authors of the study were lead co-author Xiuwei Liu, Xuejun Dong (also corresponding author), Qingwu Xue, Thomas Marek, Daniel I. Leskovar, Clark B. Neely and Amir M. H. Ibrahim, all of Texas A&M University.

The study was funded by grants from Texas A&M AgriLife Research and the Texas Wheat Producers Board.","Tue, 15 Aug 2017 07:00:00 GMT",https://www.sciencedaily.com/images/scidaily-icon.png,"['feakins', 'plants', 'wheat', 'harmful', 'effects', 'winter', 'water', 'key', 'equivalent', 'protecting', 'wax', 'lip', 'study', 'leaf', 'leaves', 'texas']", ,drought
24,24,Drought_Indonesia,UN sanctions could send North Korean economy plunging as much as 5% - Nikkei Asian Review,https://asia.nikkei.com/Economy/UN-sanctions-could-send-North-Korean-economy-plunging-as-much-as-5,"TOKYO -- North Korea is in for a plunge in economic activity, following new economic sanctions by the United Nations, on top of tumbling trade with China and the worst drought since 2001.

Despite its rapid progress in ballistic missile capabilities, much of the North Korean economy remains undeveloped and mired in poverty, with few sources of economic growth other than mining and agriculture.

The new economic sanctions, introduced Saturday by the U.N. Security Council, have eliminated the sources of what growth is left in the economy -- coal, iron ore and other minerals exports.

North Korea's economy is likely to shrink around 5% in 2017, according to Rajiv Biswas, Asia-Pacific chief economist for IHS Markit.

Such a contraction would be by far the worst in recent years. North Korea's economy recorded negative growth in five of the last 11 years, but the scale of contraction was usually around 1%, according to data from the Bank of Korea.

The North Korean economy shrank 4.4% in 1995, when the country was hit by one of the worst famines in its history, which left more than 2 million people dead.

The new sanctions came as the U.N. Food and Agriculture Organization warned July 20 of the worst drought since 2001 and of a severe food shortage over the next few months in North Korea.

According to the FAO, early season crop production is down 30% compared to last year.

A brewing economic crisis follows a rare expansion of 3.9% in 2016, the fastest in 17 years, on the back of surging coal exports to China.

North Korea depends on China for some 90% of its trade, following a sharp reduction in trade with neighboring South Korea.

Since mid-February, however, China has sharply curtailed its coal imports from North Korea, in line with U.N. sanctions introduced in November limiting the country's exports of coal -- its main export item -- to 7.5 million tons a year.

This has resulted in a drop of more than 50% in Chinese imports from North Korea in March-May from the preceding three-month period and sharply increased North Korea's trade deficit with China, according to data from China's General Administration of Customs.

The U.N. Security Council further tightened the sanctions Saturday, introducing a complete ban on North Korean exports of coal and iron ore as well as seafood exports.

According to Bank of Korea data, mining accounted for 13% of the economy, and agriculture and fishing about 22%. The two sectors accounted for much of the 3.9% growth in 2016, with other sectors showing little growth.

""With both mining and agriculture expected to contract in 2017, around 34% of the total economy of North Korea will be experiencing output declines,"" Biswas said.

""If the drought continues to impact the main crop, then the negative impact on agriculture could widen further,"" he added.

IHS Markit estimates North Korea's gross domestic product per capital at $1,355 for 2016, one of the lowest in Asia.

North Korea's poverty is striking, given its prowess in missile technology and the fact that it is surrounded by successful economies such as China, South Korea and Taiwan.

North Korea's leadership shows little sign of learning from its neighbors. ""They are not interested in anyone,"" Biswas said.

""Basically all the benefits have flown to a small group of people and to sustaining their military and weapons program.""

In a region where 3-6% growth is the norm, North Korea's growth has rarely exceeded 1%. The country is still unable to feed its own people and depends on China for help.

The question will be how long China is willing to allow North Korea to keep running trade deficits, with more money owed to China, without ever paying its bills.

The implementation of sanctions on Saturday has closed other avenues for foreign exchange for North Korea, by banning countries from increasing the number of North Korean guest workers. This will result in North Korea quickly depleting its foreign exchange reserves.

The deficit North Korea is running with China may not be large in the huge scale of China's wealth, but ""China doesn't want to be indefinitely paying for all these things"" -- and may put more pressure on Pyongyang to end its military provocations, he said.","Mon, 07 Aug 2017 07:00:00 GMT",https://www.ft.com/__origami/service/image/v2/images/raw/https%253A%252F%252Fs3-ap-northeast-1.amazonaws.com%252Fpsh-ex-ftnikkei-3937bb4%252Fimages%252F2%252F2%252F8%252F2%252F632822-8-eng-GB%252F20170807_northkorea1.jpg?width=1024&height=512&fit=cover&gravity=faces&source=nar-cms,"['economy', 'send', 'korean', 'korea', 'growth', 'economic', 'koreas', 'china', 'coal', 'plunging', 'north', 'trade', 'sanctions']", ,drought
25,25,Drought_Indonesia,Taiwanese soldiers' contribution to Indonesian independence recognized - Taiwan News,https://www.taiwannews.com.tw/en/news/3231674,"TAIPEI (Taiwan News) – Indonesia will commemorate its 72nd anniversary of freedom from Dutch rule and Taiwanese soldiers are being recognized for their contribution to the victory.

One of them, Li Po-ching (李柏青), was born in 1922 in Tainan and voluntarily joined the Japanese Army under the Japanese name as Eiji Miyahara. He was then posted to Indonesia during the Second World War over 70 years ago.

After the Japan surrendered, around 1,000 soldiers from the Japanese Army deserted and stayed behind to join Indonesians in their fight for independence from their Dutch colonial rulers. Among these soldiers included men from Taiwan.

After the war, Li and approximately 300 of his comrades decided to stay in Indonesia for different reasons.

In an earlier interview with Li, he was concerned that he might be imprisoned when he made a trip to Taiwan in 1974, when the island was under the rule of martial law, as he also fought in the Japanese army against China's ""National Revolutionary Army"" in Myanmar. Li left Taiwan in a hurry after a brief meeting with his parents.

While living in Indonesia, he has contributed to promoting friendship between Indonesia and Japan by establishing the Yayasan Warga Persahabatan foundation and received many visitors from Japan as well as Taiwan. Japanese Prime Minister Shinzo Abe also came to visit him three times and paid his respects at Li’s foundation.

He is also a man who never forgot his roots, according to Poppy, a worker at the foundation. He said that even though Li usually communicated in Indonesian, he taught his children to be fluent in Chinese.

His dedication and service during and after the war was recognized by Indonesian government. In 2005, Li was invited to attend a ceremony marking Indonesia’s 60th Independence Day and was awarded a hero's medal by President Susilo Bambang Yudhoyono, making him the first foreigner to receive such an honor.



Another Taiwanese contributor, Chen Chih-hsiung (陳智雄), who was given honorary citizenship by the first president of Indonesia, Sukarno, also served in the Japanese Army in Indonesia during WWII.

Chen stayed in Indonesia after the war and sided with Sukarno in the subsequent Indonesian National Revolution and was imprisoned by the Dutch for a year.

Chen went back to Taiwan but was imprisoned in 1962 by the Taiwan Garrison Command and executed in 1963 for his involvement in promoting Taiwan independence.","Mon, 14 Aug 2017 07:00:00 GMT",https://tnimage.s3.hicloud.net.tw/photos/shares/5991395aede58.jpg,"['war', 'recognized', 'contribution', 'li', 'japan', 'taiwan', 'indonesian', 'independence', 'soldiers', 'indonesia', 'japanese', 'taiwanese', 'army']", ,non
