,ID,event_id,article_title,article_link,article_content,publishing_date,article_image,article_keywords,article_relevance,category
0,0,Drought_Indonesia,"Worsening drought, clean water scarcity affect millions in Indonesia - The Straits Times",https://www.straitstimes.com/asia/se-asia/worsening-drought-clean-water-scarcity-hit-regions-in-indonesia,"JAKARTA (THE JAKARTA POST/ASIA NEWS NETWORK) - Millions of people across Indonesia are facing failed harvests and a shortage of clean water as a result of worsening drought conditions.

The Meteorology, Climatology and Geophysics Agency (BMKG) has predicted that this year's dry season may last until September.

In Central Java, it is estimated that 1,235 villages in 266 districts will endure clean-water shortages during the dry season, according to the Central Java Disaster Mitigation Agency (BPBD).

At least three reservoirs in the province have dried up and six others have very low water levels, cutting supplies of water for irrigation and clean water for domestic use.

Water volumes in the reservoirs have steadily declined since the dry season arrived in the province in July.

The dried-up reservoirs are in Gebyar and Botok in Sragen regency, as well as Uling in Wonogiri regency.

""The six reservoirs that have very low water levels are in Kembangan and Brambang in Sragen, Krisak in Wonogiri, Cacaban in Tegal, Gunungrowo in Pati as well as Lodan in Rembang,"" Central Java Water Resources Management (PSDA) Agency head Prasetyo Budhie Yuwono said on Monday (Aug 28).

However, the provincial administration has downplayed the situation, claiming that the overall water volume of all the reservoirs in the province was still sufficient.

The administration previously expected a minimum water volume of 1.0 billion cubic meters in all 41 reservoirs in the province during the dry season. As of Monday, the volume was 1.2 billion cubic meters, said Prasetyo.

Nuswantoro SP, the secretary of the Central Java Plantation, Agriculture and Dissemination Coordination Agency, said the impact of the dry season in August was still manageable.

""We've received reports of drought from Temanggung, Demak and Tegal regencies. A total area of 13 hectares suffered light drought conditions while a moderate drought is reported to have hit 39 ha of and severe drought in 14 ha,"" he said, adding that farmers had reported failed harvests. In Tegal, for example, 10 ha of rice failed.

BPBD Central Java has earmarked Rp 600 million (S$60,876) for the distribution of clean water to 46 villages in 22 districts.

In East Nusa Tenggara (NTT), acting Sabu Raijua regent Nikodemi Rihi Heke has issued a decree to cope with the ""drought emergency"" in six districts.

""The six districts are Hawu Mehara, Raijua, West Sabu, Sabu Liae, Central Sabu and East Sabu,"" BPBD Sabu Raijua chief Pither Mara Rohi told reporters in Kupang.

Pither said that based on agency monitoring, almost all districts in the regencies had suffered from water scarcity and drought since July.

The agency has started to distribute clean water to residents in 63 villages in six districts, using 335 water tankers.

However, Pither said supplies were still inadequate to compensate for the drought.

On average, one village would only get supplies from five to six water tankers per day, each only sufficient to cover the needs of 10 to 12 families.

Therefore, for a long-term solution, the Sabu Raijua administration plans to build embung (artificial lakes) in every village in the regency.

""There are currently two big embung in Sabu Raijua, which can only supply a few villages around them,"" Pither said.

Drought and water scarcity are also reported in other areas, such as Karawang, Cianjur and Sukabumi in West Java; Bantul in Yogyakarta; and Bima in West Nusa Tenggara (NTB).","Wed, 30 Aug 2017 07:00:00 GMT",https://static.straitstimes.com.sg/s3fs-public/styles/x_large/public/articles/2017/08/30/lwx300817_indo.jpg?itok=2Xksecz4,"['worsening', 'agency', 'sabu', 'reservoirs', 'season', 'central', 'water', 'java', 'millions', 'dry', 'raijua', 'affect', 'drought', 'indonesia', 'clean', 'scarcity']", ,drought
1,1,Drought_Indonesia,How Indonesia's President monitors food security - GovInsider,https://govinsider.asia/inclusive-gov/pulse-lab-jakarta-indonesia-derval-usher/,"Indonesia is under threat of food insecurity and undernutrition, and faces “alarmingly high” stunting levels. In 2007, an estimated 7.7 million children under five were stunted, according to the Food Security Portal.

And when climate change is in the picture, things become much more complex.

To keep abreast of what’s happening, the President has a platform in his situation room that tracks drought and its effects on agriculture in real time. It was developed by Pulse Lab Jakarta (PLJ), a big data analytics lab which emerged from a partnership between the United Nations and the Government of Indonesia.

Derval Usher, PLJ’s Head of Office, hopes to support development and urbanisation efforts through “better use of data and new digital data sources”. “People are starting to understand the use of evidence for policymaking, and the better use of new data sources for solving inherent problems,” she says.

Usher shares with GovInsider four ways PLJ is using big data analytics to help Indonesia and other countries address development issues.

1. Getting ahead of drought

Over 22 million Indonesians rely on agriculture for their livelihood, according to the UN, and the El Niño climatic event, which brings oscillating extreme temperatures, led to drought in several districts last year.

PLJ joined forces with the World Food Programme (WFP) and the Food and Agricultural Organisation to develop a platform that identifies affected communities in need of help, says Usher. The VAMPIRE visualisation tool combines data in several layers: users can view where food-insecure and agriculture-dependant communities live; data on rainfall anomalies and vegetation health; and crowdsourced prices of staple foods in these areas.

The Indonesian government can take a closer look at how drought is affecting crops, and adjust their response accordingly, Usher explains. “You start to see that it hasn’t rained in some time, and food prices are going up.”

“You start to see that it hasn’t rained in some time, and food prices are going up.”

She adds that VAMPIRE, which is installed in the President’s situation room, is “an early warning system” for authorities to manage food security and better allocate resources. Following VAMPIRE’s success in Indonesia, WFP is now in discussions with the Sri Lankan government to have it installed there too, Usher shares.

2. Haze be gone

Environmental issues are another area where data analytics can help, especially when these issues are transborder ones. The annual blight of the haze is a sore spot for Indonesia – and its often-disgruntled neighbours.

PLJ set out to use data to help locate the agricultural fires that are to blame. “We’ve developed a platform [which] started off as a social media project to see whether we could capture, map out instances of fires in Indonesia,” Usher explains.

Essentially, the Haze Gazer platform helps disaster management authorities to provide quicker responses, Usher says. It is also installed in the Indonesian President’s situation room, she adds, “so you’ve got the citizens reporting directly into the President’s situation room”.

The PLJ team drew from various sources of publicly-available social media data, such as tweets, Instagram posts and Youtube feeds, and combined them with satellite imagery to create a dynamic visualisation tool. They also trawled the internet for the keywords kabut asap (haze in Bahasa Indonesia) and if they were used together with phrases related to poor health or not going to school. “You can get the citizen impact of haze,” Usher explains.

3. Crowdsourcing translations

Data analytics can help governments speed up their response in the event of a disaster. Translator Gator is an online language game – a “brainchild of our data science team”, Usher says – that invites people to create taxonomies, or collections of keywords, in lesser-known languages and dialects.

Eventually, these crowdsourced taxonomies can be used to better understand how affected populations are responding to a disaster on social media and other channels, according to a PLJ blog post on the UN Global Pulse website. Response teams will also be able to better communicate with them. This is particularly important for countries such as Indonesia, where there are several local dialects and even slang.

How it works is that users can choose to translate disaster-related keywords and phrases from English to their native language; evaluate others’ translations; suggest alternative words or phrases; or classify words and phrases into categories, says Usher. “It was a playful game where we were incentivising people and offering them phone credit for every translation that they gave us.”

Translator Gator proved so successful that PLJ extended the initiative to ten ASEAN countries and Sri Lanka, according to Usher. The second phase just wrapped up this year, and at last count, there were over 1.8 million activities across the 11 countries, she adds.

The project has caught the attention of other countries in the region as well. Thanks to the “overwhelming success” of Translator Gator in Vietnam, PLJ has been approached by UN colleagues in Vietnam to extend the competition, and include more ethnic languages than originally planned on, Usher shares.

4. Data for better transport

Jakarta is the “tweeting capital of the world”, and all of that social media data poses interesting possibilities for unconventional use. PLJ is working with the Jakarta Smart City Unit to analyse publicly-available tweets of commuters taking TransJakarta buses, which can help improve on urban planning and decision-making around transport, Usher says.

“We are looking at better optimisation of the buses based on where people are getting on the buses in the morning; where they are starting off their journey; where are they getting off; what are peak times for people to travel,” Usher explains.

Interestingly, the Indonesia Institute of Statistics carried out a study in 2014 that looked at the origins and destinations of commuters in Jakarta, and “the official statistics are very similar to what came through on Twitter,” Usher notes.

Certainly, mining tweets is “a lot cheaper than doing a costly survey”, she believes, and in a “fast-moving” city like Jakarta, the situation could turn out very differently in the five years before the next survey.

All things considered, “big data can give you a ‘snapshot’ of what’s happening on the ground this time, rather than relying on data collected maybe five years ago,” concludes Usher, and “complement the traditional statistics” that are already available.

“Big data can give you a ‘snapshot’ of what’s happening on the ground.”

With data, governments can respond faster and more efficiently to drought, haze, and other issues as they are happening. As Indonesia urbanises, data is likely to be an essential part of its development journey.

Innovation Labs World will be hosting a dedicated data stream on 26 September 2017 for government officials to share lessons and best practices. Register today.

Images from Pulse Lab Jakarta","Thu, 24 Aug 2017 07:00:00 GMT",https://govinsider.asia/wp-content/uploads/2017/08/D-Usher-e1503036525501.jpg,"['data', 'better', 'usher', 'help', 'haze', 'monitors', 'indonesia', 'plj', 'president', 'jakarta', 'security', 'food', 'indonesias', 'situation']", ,drought
2,2,Drought_Indonesia,Amazing facts about Indonesia - Telegraph.co.uk,https://www.telegraph.co.uk/travel/destinations/asia/indonesia/articles/indonesia-facts/,"Indonesia is celebrating 72 years of independence today. So why not learn a little more about the world's fourth biggest country?

1. It covers a lot of ground

This vast place extends 5,120 kilometres from east to west. That's longer than the distance (as the crow flies) from London to Tehran (4,403km).

Indonesia dwarfs Europe

2. And is made up of 18,307 islands

That’s according to a 2002 survey by the National Institute of Aeronautics and Space (the CIA World Factbook seems to think it’s 17,508, however, while a more recent survey, by a different agency, put the figure at 13,466). Only Canada, Norway, Sweden and Finland have more.

3. It’s heaven for animal lovers

According to Conservation International, just 17 countries are considered ""megadiverse"". Each possesses a vast number of different species – many found nowhere else. And Indonesia is one.

4. And home to the world’s largest lizard

The Komodo dragon lives on just five Indonesian islands – Komodo, Rinca, Flores, Gili Motang, and Padar. They are truly fearsome, weighing up to 150lbs and possessing toxic bites, allowing them to hunt and kill far bigger animals – even humans.

Don't mess with these lizards

Stanley Stewart visited the islands for Telegraph Travel last year. He wrote: “Our guide Harry Christensen, a proper ocker Aussie who has been sailing these waters for years, told us how the Komodo’s venom induces shock and heart failure in its victims, how it dislocates its jaws like a snake to devour large prey, how it is a miniature replica of a much larger Jurassic ancestor. ‘AMAZING!’ Harry raved, flapping his arms like a man trying to escape his own body. ‘These dragons inspired the legends of King Kong!’”

5. Indonesian airlines have a chequered history

Since 2001, there have been at least 45 air accidents on Indonesian soil that resulted in fatalities, according to the website aviation-safety.net. They include Indonesia AirAsia Flight 8501, which crashed into the Java Sea in 2014, killing 162 people, and a Trigana Air Service crash in 2015 that killed 54. By comparison, there have been just six on UK soil during that time – all involving small jets with fewer than six individuals on board.

Due to safety concerns, the EU currently permits just seven Indonesian airlines (Airfast Indonesia, Premiair, Garuda Indonesia, Citilink, Batik Air, Lion Air and Indonesia AirAsia), to fly within its airspace. That leaves 55 on its banned list.

6. But they are expanding fast

Lion Air, a budget Indonesian operation that flies predominantly in and around South-East Asia, is set to quintuple the size of its fleet. It has 443 aircraft on order, to add to its current stock of 113. No airline in the world is waiting on so many planes.

Lion Air might be the biggest airline you've never heard of Credit: 2014 Bloomberg/Bloomberg

7. It has 139 volcanoes

Indonesia has the third most volcanoes in the world, behind the US and Russia, according to the National Museum of Natural History’s Global Volcanism Program.

The volcanic island of Krakatoa, between Java and Sumatra, is perhaps the most famous. It was responsible for one of the world's biggest modern eruptions; when it blew in 1883, it unleashed two huge tsunamis that killed more than 36,000 people and emitted what is considered to be the loudest sound ever heard.

8. Some of which you can climb

A base for trips to the summit of Mount Bromo, Cemoro Lawang appears to sit on the edge of the world. The landscapes are spectacular – many say the most spectacular in Indonesia – and the region is home to the fascinating Hindu Tengger community, distinct from the predominantly Muslim lowland Javanese. Hike, admire the scenery or visit during the annual Kasada ceremony, when the Tengger climb to the crater's edge to cast offerings into the hissing, seething inner crater.

Cemoro Lawang Credit: ASAWA PHOTOGRAPHY/ASAWA BOONYANETR

9. There are eight Indonesian World Heritage Sites

Komodo National Park we’ve touched on, but others include the rainforests of Sumatra, home to scores of orangutans…

Sumatra's most famous residents Credit: Catalin Petolea/Catalin Petolea

...and the spectacular temple complex of Borobudur.

Indonesia's most spectacular temple Credit: happystock - Fotolia

10. It is the world’s shortest country

The map below shows 98 nations colour-coded according to the average height of its male residents (no reliable data is available for those countries that appear in grey). The Netherlands, where the average adult male is 1.838m tall, tops the table. Indonesia props up the rest, with an average height of just 1.58m.

11. But has a very tall mountain

Lorentz National Park, another of the country’s Unesco World Heritage sites, on the island of Papua, is vast – covering 9,674 square miles – and home to a huge array of ecosystems, including mangroves, rainforest, alpine tundra and equatorial glaciers. Its highest point, Puncak Jaya, is the tallest mountain between the Himalayas and the Andes.

A post shared by Zeal Optics (@zealoptics) on Apr 29, 2017 at 11:47am PDT

There are 123 mammalian species and 630 species of bird, including many that are endemic to the region. But much of the park remains unexplored – so scientists believe more are waiting to be discovered.

12. And a very large flower

Rafflesia arnoldi, endemic to Sumatra, is noted for producing the largest individual flower on Earth. But don’t pick one for your lover – it is said to smell like decaying flesh, earning it the nickname ""corpse flower"".

13. There’s a lot of coastline

Love to be beside the seaside? Then you won't be disappointed in the destinations that appear in darker colours on the map below - they can boast the longest coastlines in the world. Indonesia is second overall, with a staggering 54,716km.

Indonesia has beaches galore Credit: Credit: robertharding / Alamy Stock Photo/robertharding / Alamy Stock Photo

14. And a lot of people

261.1m people call Indonesia home, making it the fourth most populous country on the planet. It is also home to the world’s biggest Muslim population (around 225m).

15. It still has the death penalty

Indonesia still enforces the death penalty - by firing squad. In 2015 it executed eight drug traffickers, including two Australians, in a case that triggered an international outcry, while Lindsay Sandiford, a British woman, is currently on death row after being found guilty of smuggling cocaine into Bali in 2012. Her case is particularly baffling: she claims she was coerced into carrying the drugs by a criminal gang, and helped police with a sting operation to catch her accomplices. She was then sentenced to death while others involved were only given jail time.

Indonesia is by no means alone. More than 50 countries still have the death penalty, including Vietnam, one of the world’s biggest executioners, according to Amnesty International (429 prisoners were killed there between August 2013 and June 2016), Thailand, Barbados, Guyana, and Trinidad and Tobago.

16. There’s an eerie abandoned hotel

The French photographer Romain Veillon recently explored the remains of the abandoned PI Bedugul Taman Rekreasi Resort in Bali to capture these images.

The best hotels in Bali

17. Its capital is the most Instagrammed on Earth

Instagram recently revealed that Jakarta is the city most frequently geotagged in its Stories format.

“10 million people call this metropolis home and another 8 million pour into the city to work every day,” writes Simon Parker in his guide to Jakarta. “The traffic and vastness of Jakarta might seem daunting, but this is a melting pot of cultures and cuisines - seeking them out is part of its allure. The old town of Batavia will transport you to Indonesia’s Dutch colonial past while the fashionable Menteng district is a hive of live music venues, exclusive restaurants and hip hotels. World-renowned restaurants, bars and nightclubs perch on top of towering skyscrapers, while shoppers can choose from dozens of gargantuan shopping malls.”

The sprawling capital Credit: Credit: RooM the Agency / Alamy Stock Photo/RooM the Agency / Alamy Stock Photo

18. The flag might catch you out

Monaco, Poland and Indonesia have very similar flags. Do you know which is which?

Nope, that's Poland

This is actually Monaco's flag

This is Indonesia's flag – the same as Monaco, just a little wider

19. Best of all - it’s cheap

The biennial World Economic Forum (WEF) Travel and Tourism Competitiveness Report was released earlier this summer. Based on factors including safety, infrastructure, health and cultural resources, Spain is the greatest destination, it says, followed by France and Germany. But the top 20 for ""price competitiveness"" is very different. Indonesia is fifth best value, behind only Algeria, Malaysia, Egypt and Iran.","Thu, 17 Aug 2017 07:00:00 GMT",https://www.telegraph.co.uk/content/dam/Travel/Destinations/Asia/Indonesia/indonesia-bali-mushroom.jpg?impolicy=logo-overlay,"['including', 'biggest', 'amazing', 'credit', 'worlds', 'stock', 'death', 'haven', 'world', 'confusing', 'air', 'indonesian', '19', 'flag', 'indonesia', 'facts', 'wildlife']", ,none
