id,caption,comments_count,like_count,media_type,media_url,permalink,timestamp,keyword
17874823064438915,"Sua casa ou seu carro foram atingidos pela enchente decorrente das fortes chuvas que atingiram a capital e cidades da Grande São Paulo?

Perdeu bens, móveis, eletrodomésticos? Seu carro teve perda total? É possível reclamar? O que fazer?

Quem não tem seguro de casa ou de carro terá de arcar com o prejuízo, mas poderá entrar na Justiça contra Prefeitura, governo estadual e até mesmo a União, para tentar obter alguma indenização. “É um processo demorado, mas o cidadão precisa lutar pelos seus direitos, já que paga impostos e precisa cobrar as melhorias do poder público.

Para entrar com ação é preciso reunir o máximo de provas como fotografias da casa, carro, móveis, eletrodomésticos destruídos, juntar reportagens dos jornais. “As pessoas ficam nervosas e se esquecem de fazer prova de tudo o que aconteceu. E sem provas, não adianta entrar com o processo, pois vai perder.” Na dúvida procure um Advogado, ele é indispensável à administração da justiça!

Fique atentos aos seus direitos.

Se você está gostando dos conteúdos postados compartilhe e me siga no Instagram drleonardolab .

 #direitos #chuvas #chuvaemsãopaulo #terradagaroa #garoa  #enchente #alagamentos #prefeito #justiça  #prefeituradesaopaulo #prefeitura #danomoral #inundação #indenização  #direitodoconsumidor  #consumidor  #consumidores #verdade #direitocivil  #processocivil #constituiçãofederal #direitosfundamentais #cnj #advogado #advogada #lei #jurisprudência #brasil #sãopaulo #drleonardolab",2,15,IMAGE,https://scontent-sea1-1.cdninstagram.com/v/t51.29350-15/197380830_4706448162703053_5841905029768962289_n.jpg?_nc_cat=108&ccb=1-3&_nc_sid=8ae9d6&_nc_ohc=l5y8EjqzSD0AX-rf11s&_nc_ht=scontent-sea1-1.cdninstagram.com&oh=00cf8266991d9c887013df3388ddda24&oe=60C371C3,https://www.instagram.com/p/CP0k_eHLizp/,2021-06-07T14:00:08+0000,none
