,ID,event_id,article_title,article_link,article_content,publishing_date,article_image,article_keywords,article_relevance
22,22,FL-2013-000155-IDN,Farmer urges range of measures to aid women battling climate change - eco-business.com,https://www.eco-business.com/news/farmer-urges-range-measures-aid-women-battling-climate-change/,"In Zambia, the weather is changing — the rainy season begins later in the year than it once did, and its duration is now unpredictable, creating confusion about the best time for planting, a U.S.-based farmer told delegates during a presentation delivered on the sidelines of the recent U.N. climate talks in Warsaw, Poland.

“I often speak with women farmers around the world, and if I ask them what’s going on with climate change in their area, they give a puzzled look as if to say: ‘What does that mean?’” said Susan Carlson, chair of the World Farmers’ Organization (WFO) women’s committee.

“But the minute I ask them: ‘Has your weather changed?’ then I receive exuding responses.”

For example, the lack of a local forecasting or weather alert system for farmers in Zambia is emblematic of the great gaps that exist between the global research and development agenda and the farmer community, she said.

Women farmers in developing countries often face economic difficulties in part because they lack access to technology and technological know-how that can help them adapt to climate change, said Carlson, formerly a dairy farmer in the state of Wisconsin who now farms in the state of North Dakota in the northern United States with her husband, Robert.

At the global level, U.N. climate talks tend to be dominated by politicians, researchers, scientists, professors and academic scholars — there could be up to 600 people in a room making decisions for farmers, and yet they don’t really know what we need, Carlson said.

Women produce more than 50 percent of the world’s food, but earn only 10 percent of its income, she said. They own less than 2 percent of property, and receive a disproportionately low percentage of bank loans.

Women want to adapt to new ways of farming, but often lack access to technology and sufficient expertise to find out how they can benefit from it. Their traditional means of weather forecasting for planting and harvesting are no longer working as they once did.

A Zambian farmer told Carlson that she learns about new farm methods or marketing techniques from her credit facilitator when she visits him to take out a loan.

Women often struggle with poor literacy skills, which makes it impossible for them to apply for loans, as farm records are needed to secure credit. Carlson said. “Many need visual, simple explanations,” she added.

Seeking solutions

If one or two women farmers in a given region are shown how to adapt practices on their farms, and it proves successful it will be picked up by other farmers.

Changes in weather patterns have been so drastic in Zambia that the Zambian farmer said she had to move her vegetable production to higher ground as the area traditionally used was being flooded, Carlson said, adding that new insect varieties have also emerged.

Other examples of practices she has adopted to improve her yield include drip irrigation, incorporating manure and organic matter into her soil, reducing tillage, and planting more fruit and nut trees.

“Not only is she adapting to climate change, this Zambian farmer is mitigating the results of climate change by incorporating these practices,” Carlson said.

The difficulty of transporting crops to markets due to poor road conditions, the lack of storage and refrigeration, as well as the lack of capacity to process or preserve perishable crops when they are not sold at market, also make life challenging for many farmers, Carlson said

But with technology transfer, information sharing, and investments in farmers, particularly women farmers, these challenges can be overcome, she said, adding that policymakers, researchers, scientists, professors, academic scholars should listen to what women farmers have to say and respond to their needs while being mindful of their cultures.

“As science and understanding helps increase our knowledge we make changes to better improve our farming systems,” Carlson said.

Expert extension agents should be made available, and farm organizations helmed by women — and individual women — can help provide educational opportunities and empower women.

“We must look at our farms as a whole system not just production-focused and we change our systems as they need adjusting,” she said.

“The bottom line is that everyone wants a profit and farmers are no different. We shouldn’t apologize when we make a profit. To be a commercial farmer is not a bad thing — it comes at a cost, and everyone benefits from the food security we provide — remember, no farmers, no food, no future.”","Tue, 24 Dec 2013 08:00:00 GMT",https://eco-business.imgix.net/uploads/ebmedia/fileuploads/shutterstock_120755029.jpg?fit=crop&h=801&ixlib=django-1.2.0&q=85&w=1200,"['urges', 'climate', 'zambia', 'change', 'range', 'women', 'farmer', 'measures', 'carlson', 'weather', 'lack', 'farmers', 'zambian', 'battling', 'aid']", 
23,23,FL-2013-000155-IDN,Copywriter dies after tweeting about working 30 hours and energy drinks blamed - Daily Mail,https://www.dailymail.co.uk/news/article-2525584/Copywriter-dies-tweeting-working-30-hours-energy-drinks-blamed.html,"Copywriter dies after tweeting about working 30 hours and energy drinks blamed

Mita Duran, 24, often tweeted about working extremely long hours

She considered getting home before midnight a small victory

She died after working more than a whole day without sleep - her coworkers blamed Thai Red Bull

A young woman literally worked herself to death shortly after bragging online about how long she had been in her office.

Mita Duran, 24, of Jakarta, Indonesia, died after tweeting ’30 hours of work and still going strooong,’ last Saturday night. Coworkers of her’s blamed energy drinks for her death.

It was one of many tweets Mr Duran sent out describing the long hours she worked as a copywriter for WPP-owned Young & Rubicam, an ad agency in the country’s capital.

Zafrul Sjahrial, the stepfather of Pradnya Paramita who died after a 30 hour shift, has defended the advertising industry saying Paramita knew what it took to succeed

Ms Duran was a hard-working, dedicated copywriter, so much so that she wrote on Tumblr about her exhausting workload.

'Tonight, I carry the keys to the office for the eighth day running,’ she lamented. ‘I’m still here. I have no life. Someone please take me out for drinks, kicks and giggles.’

The determined 24-year-old also made frequent posts to Twitter about her long hours.

‘Home before midnight after three long, exhausting weeks. MISSION ACCOMPLISHED,’ the overworked woman tweeted November 18.



A few days earlier she showed signs she was having trouble keeping up with the demands of her bosses.

Paramita, who went under the name Mita Diran on Twitter, frequently posted about her long hours online and collapsed while having dinner with friends just hours after this message

Paramita worked for advertising agency Young & Rubicam whose clients include Dell and Xerox

The copy writer slipped into a coma late on Saturday night and was pronounced dead on Sunday

Sjahrial said her tweets showed she was passionate about her job and was 'a girl ready for the next step'

‘Sweetest sleep I've had in a long time. It's a shame I'm supposed to wake up uh, ONE HOUR earlier. Slept through 3 phone calls and 3 alarms!’ She tweeted November 14.

That might have been a result of the long hours she worked the prior week.

‘Alright, one full week of going home past 2am from the office. Ladies and gentlemen, I believe we just broke a record,’ Ms Diran tweeted November 8.

She also pondered sleeping in the office.

‘The more you spend time at the office, the more you consider moving your bed here. Preferably next to the fan. #AgencyLife,’ Ms Diran tweeted October 29.

Sjahrial, an advertising creative director with 35 years' experience, said long hours were expected

Energy drink: A friend of Duran's later wrote ‘She died because too much of overtime working, and too much kratingdaeng attacks her heart.’ Krating Daeng is the name for Red Bull in Thailand, where the original version of the energy drink comes from



Sjahrial confirmed that he would not be pressing charges against the company saying that if people wanted somebody to blame, they should blame the entire industry

The copyrighter’s mother took to Path before her death to tell of her heartache - a posting noted by BuzzFeed.

‘Hi everyone, since last night and until now my daughter who is a copyrighter in Y&R lay in coma in RSPP,’ Yani Syahial wrote.

‘Chances not very good. She collapsed after continuous working overtime for 3 days last night,’ she continued. ‘Working over the limit. I have not slept since then.’

Ms Diran died within the hour.

‘An hour after this msg [sic]… her daughter died,’ Shalini wrote in a comment to the original post. ‘She died because too much of overtime working, and too much kratingdaeng attacks her heart.’

‘May she rest in peace.’

Stepfather also said reports of continuous 30-hour shift were 'overblown' saying there must have been breaks for food or opportunities to walk around the office

Kratingdaeng is Thai for Red Bull, where the original version of the energy drink comes from.

Ms Diran tweeted at least once about staying up all night working with help from the energy drink.

‘Spent half the night writing copy and finishing up a 23-page deck with a glass of vodka/red bull mix and now I can't sleep. SO BEAR WITH ME.

Y&R posted on its Facebook page about the death. After expressing condolences and wishing their dead employee’s family well, they announced the office would close this week in order to give employees time to grieve - for one day.

Shalini had one final plea.","Thu, 19 Dec 2013 08:00:00 GMT",https://i.dailymail.co.uk/i/pix/2013/12/18/article-2525584-1A2B2CB800000578-925_636x382.jpg,"['diran', 'dies', 'tweeting', 'working', 'tweeted', 'hours', 'night', 'office', '30', 'energy', 'died', 'blamed', 'drinks', 'worked', 'long', 'copywriter']", 
24,24,FL-2013-000155-IDN,"SYRIA - LEBANON For Caritas Lebanon, ""thousands of Syrian refugees could die from the cold and the snow"" - AsiaNews.it","http://www.asianews.it/news-en/For-Caritas-Lebanon,-thousands-of-Syrian-refugees-could-die-from-the-cold-and-the-snow-29826.html","The refugee situation in the Bekaa Valley (eastern Lebanon) is ""terrible, said Mgr Simon Faddoul, president of Caritas Lebanon. In addition to cold and hunger, people could die from fires caused by makeshift stoves. Yesterday, a one-year-old child died in a fire in a refugee camp in southern Lebanon. Caritas calls on people to remember at Christmas Syria's more than 1.3 million war refugees.

Beirut (AsiaNews) - ""The situation in the Bekaa Valley is terrible,"" said Mgr Simon Faddoul, president of Caritas Lebanon. ""Many people are dying because of the exceptionally cold weather. Refugees have only tents and shacks to protect themselves from the cold and the snow.""

Now, the more than 800,000 Syrian refugees stranded in camps on the border with Syria are having to cope with Alexa, an intense storm that has battered the Middle East with snow and rain, causing whiteout conditions and floods across the region.

""Together with other non-governmental organisations and the United Nations, Caritas has tried to help refugees,"" Mgr Faddoul said. ""In recent weeks, we have handed out thousands of blankets, mattresses, kerosene heaters, winter clothing, plastic sheeting and fuel coupons in the hope of averting the worst, but our efforts are not enough. There is a daily exodus (from Syria) and the number of people who cross the border is now huge.""

In view of the situation, the clergyman has urged Western countries and all Christians to send money and aid to the Syrian people.

In the Bekaa Valley alone, there are about 430 makeshift camps. Better off families have been able to build huts using wooden planks, jute bags and metal sheets, which have become a luxury item.

Meanwhile, the latest arrivals have tried to find shelter with other families, but the huts are small and families are big. For many people, the only alternative is sleeping in tents made ​​of plastic sheeting, cardboard, tires and other junk.

For Mgr Faddoul, winter this year has turned an already serious humanitarian situation into a catastrophe for the refugees.

""Mothers are trying to keep their children warm by building bonfires inside the huts. This is highly risky. Last night, in a camp in southern Lebanon, a small fire spread from one hut to the entire camp, killing a one-year-old baby, and injuring a number of people. Such accidents can happen any day.""

An ""emergency of this kind can only be met with the charity,"" the priest said, ""by giving aid and remembering, especially at Christmas, the fate of hundreds of thousands of people who lost family and home in the past three years and are now in danger of dying from cold and hunger.""

Yet, in spite of the serious situation, many refugee families, Muslims and Christians, are preparing for Christmas. To help them, Caritas is organising a number of activities over the next few days for the children living in the refugee camps.

""With the help of our volunteers, we are preparing games and carols to bring a little hope and joy, at least for the little ones,"" Mgr Faddoul said.","Mon, 16 Dec 2013 08:00:00 GMT",http://www.asianews.it/./files/img/size3/SIRIA_(f)_1216_-_Rifugiati_inverno.jpg,"['refugee', 'families', 'valley', 'thousands', 'snow', 'refugees', 'faddoul', 'lebanon', 'caritas', 'mgr', 'syrian', 'cold', 'situation', 'die']", 
25,25,FL-2013-000155-IDN,"Father Christmas, elves and costumed merrymakers flood streets for SantaCon 2013 - Baltimore Sun",https://darkroom.baltimoresun.com/2013/12/father-christmas-elves-and-costumed-merrymakers-flood-streets-for-santacon-2013/,,"Sat, 14 Dec 2013 08:00:00 GMT",,[], 
26,26,FL-2013-000155-IDN,Nigella Lawson's personal assistants cleared of fraud after gripping trial - ABC Local,https://www.abc.net.au/news/2013-12-21/nigella-lawson-personal-assistants-cleared-of-fraud/5170836,,"Fri, 20 Dec 2013 08:00:00 GMT",,[], 
27,27,FL-2013-000155-IDN,The ACT's food environment plan is good – here's why - The Conversation,https://theconversation.com/the-acts-food-environment-plan-is-good-heres-why-20344,"The Australian Capital Territory (ACT) government has introduced a Healthy Weight Action Plan aimed at curbing the number of obese people in the territory. As its name suggests, the plan seeks to create a healthier food environment for local people.

Acknowledging the multiple domains of influence on food choice, the initiative is aimed at promoting food environments supportive of healthy choices and to enhance the skills and resources of people to make best use of those environments.

Understanding the food environment

We’re exposed to a vast range of food stores, products, advertisements and other promotions every day. In fact, on a typical day, we have access to food stores near our home as well as near our workplace or school and during commutes in between.

Supermarkets are flooded with food promotions. And at sporting venues and events, food is prominent through stalls, advertising, and sponsorship. Fundraising efforts for schools and community groups involve the sale of food items, and food and beverage advertisements dominate commercial television breaks.

Of these seemingly endless exposures to food over the course of a typical week, how many are to healthy food? Very few, in most places. Most people, most of the time, are exposed to a disproportionate number of unhealthy foods on a regular basis.

This exposure to food constitutes our food environment.

The food environment doesn’t force us to make unhealthy choices, but unbalanced and repeated exposure to unhealthy food is likely to influence food purchasing decisions.

We are all influenced by the fact that the unhealthy choice has become the easy choice in our society. Indeed, researchers have observed higher rates of obesity in people who have greater access to unhealthy food, such as what is commonly sold in fast-food stores.

While much of the research in this area to date has been concerned with residential neighbourhoods, it’s increasingly recognised that factors in other places where we spend our time may also be important. We now know that the availability of fresh fruit near workplaces, for instance, may encourage consumption of these items.

What’s the plan?

The ACT government initiative represents a positive step towards the reversal of the obesity-promoting food environment.

Fridy/flickr

Its plan is to increase the supply and promotion of healthy foods and reduce the supply and promotion of unhealthy foods. Importantly, it appears to recognise that these actions need to be rolled out in a range of environments, including schools and workplaces.

There’s even a plan to enact a mandatory code for supermarkets to have at least one checkout aisle free of energy-dense, nutrient poor-foods. Research shows this is currently rare within Australian supermarkets.

Perhaps the most ambitious part of the proposal is to “explore options” for regulating the sale of sugar-sweetened drinks.

A plan by the mayor of New York to limit the size of sugary drinks sold in the city was rejected earlier this year by courts in the country; a decision applauded by the American Beverage Association.

By proposing to regulate sugar-sweetened drink sales, the ACT government should expect to face similar battles to those faced by New York city.

Knowledge, values and skills also play a key role in food choices, and this is reflected in the plan which includes strategies aimed at improving food-related skills, awareness and capabilities of local people.

Healthy eating education sessions will be provided for people with low income, and those from culturally and linguistically diverse backgrounds.

The intention here is to enable people to identify and prepare healthy foods. And research has shown that greater attention to the planning and organising of meals is associated with healthier eating.

In essence, the ACT proposal is aiming to make the healthy choice the easier choice. Opponents are likely to continue to invoke the “nanny state” argument, as objections to such proposals often do.

But the Territory’s goals are based on a solid and ever-growing body of evidence that acknowledges the environment plays a strong role in determining eating behaviours and health.","Thu, 12 Dec 2013 08:00:00 GMT",https://images.theconversation.com/files/37556/original/rtwgz9hs-1386818372.jpg?ixlib=rb-1.1.0&q=45&auto=format&w=1356&h=668&fit=crop,"['foods', 'heres', 'food', 'good', 'research', 'skills', 'environment', 'acts', 'healthy', 'choice', 'near', 'plan', 'act', 'unhealthy']", 
28,28,FL-2013-000155-IDN,90 Years On: the legend of The Mad Eight - ABC Local,https://www.abc.net.au/news/rural/rural-news/2013-12-18/the-mad-eight/5162878,,"Tue, 17 Dec 2013 08:00:00 GMT",,[], 
29,29,FL-2013-000155-IDN,"""Superweeds” - Union of Concerned Scientists",https://www.ucsusa.org/about/news/superweeds,,"Wed, 11 Dec 2013 08:00:00 GMT",,[], 
30,30,FL-2013-000155-IDN,'Moral cop' Vasant Dhoble shifted to Mumbai crime branch - indiatvnews.com,https://www.indiatvnews.com/news/india/latest-news-moral-cop-vasant-dhoble-mumbai-crime-branch-31658.html,"moral cop vasant dhoble shifted to mumbai crime branch

‘Moral cop' Vasant Dhoble shifted to Mumbai crime branch

Mumbai: Assistant Commissioner of Police Vasant Dhoble, who had hit the headlines for his controversial crackdown against bars and restaurants in the city, was yesterday transferred to the crime branch of the Mumbai police.“Dhoble, who was with the control room of late, has been brought to the crime branch,” a senior police official said.The ACP, who, armed with his trademark hockey stick, raided bars and restaurants which stayed open beyond the permissible time, had invited mixed reactions.The media berated Dhoble for his “high-handed” style and for curtailing the city's night life but residents in the vicinity of bars and pubs welcomed his tough stand.Police Commissioner Satyapal Singh, soon after taking over, had ordered Dhoble to report to the crime branch instead of the Commissioner directly.Two women, detained by a police team led by Dhoble during a raid on restaurant for alleged human trafficking racket, had also dragged him to court, seeking compensation for alleged defamation.But the Bombay High Court refused to pass any directions against the police.Recently the Crime Investigation Department (CID) of the Maharashtra police gave him a clean-chit in a case related to hawker's death during eviction drive of police in Vakola area, which fell under his jurisdiction as ACP. The hawker died of heart attack.

Latest India News","Thu, 19 Dec 2013 08:00:00 GMT",https://resize.indiatvnews.com/en/resize/newbucket/715_-/mainnational/Moral-cop31658.jpg,"['branch', 'commissioner', 'cop', 'mumbai', 'crime', 'moral', 'bars', 'vasant', 'court', 'restaurants', 'dhoble', 'shifted']", 
31,31,FL-2013-000155-IDN,LEBANON - SYRIA Syrian refugees without shelter and under the snow - AsiaNews.it,http://www.asianews.it/news-en/Syrian-refugees-without-shelter-and-under-the-snow-29790.html,"Temperatures below zero and 10 cm of snow. Extraordinary distribution of blankets and fuel coupons. Many camps are makeshift, made of wood and plastic sheeting .

Beirut ( AsiaNews / Agencies) - Hundreds of thousands of Syrian refugees have been affected by the storm "" Alexa "" that has brought snow and sub-zero temperatures throughout the Middle East.



In Lebanon, more than 800 thousand refugees - but many say a million - spread over 200 makeshift camps are living in tents or shacks made ​​of plastic sheeting stretched over wooden frames .



In Akkar and the Bekaa , the areas bordering with Syria, yesterday the temperatures dropped below freezing making life increasingly difficult. The United Nations High Commissioner for Refugees (UNHCR) , the Lebanese army and the Ministry of Social Affairs have started to distribute blankets, money to buy fuel for heating and basic goods, but their efforts are not enough to meet the needs . Many refugees complain of not having enough heat and some who confess to burning even their shoes to make a little fire.



Wafik Khalaf , a member of the municipal council of Ersal , says that ""water has seeped into tents raining from the roof and spreading from the ground, causing small floods ."" The refugees live in the damp and mud. Because of ""Alexa"" , the soil around it is covered with 10 cm of snow .



Lisa Abou Khaled , a spokesman for the UNHCR expresses concern especially ""for the refugees living in unauthorized, makeshift camps"".","Thu, 12 Dec 2013 08:00:00 GMT",http://www.asianews.it/./files/img/size3/SYRIA_Refugee_under_snow.jpg,"['camps', 'sheeting', 'living', 'plastic', 'snow', 'tents', 'refugees', 'makeshift', 'syrian', 'temperatures', 'unhcr', 'shelter']", 
32,32,FL-2013-000155-IDN,Run for Unity held in MP - indiatvnews.com,https://www.indiatvnews.com/news/india/latest-news-run-for-unity-held-in-mp-31810.html,"run for unity held in mp

Bhopal: The “Run for Unity” for garnering support for construction of the “world's tallest” statue of Sardar Vallabhbhai Patel in Gujarat was organised across Madhya Pradesh yesterday.

In the main function held here, the Leader of Opposition in Lok Sabha, Sushma Swaraj flagged-off the run from TT Nagar Stadium where chief minister Shivraj Singh Chouhan also joined in.“For constructing the statue of Sardar Patel, iron pieces will be collected from farmers in all villages of the state to fulfil the dream of Gujarat chief minister and BJP's Prime Ministerial candidate Narendra Modi,” Chouhan said on the occasion.He said the “run for unity” was an effort to unite people from Kashmir to Kanyakumari and from Bhopal to Guwahati.“In today's changing society and amid serious challenges before the nation, it is necessary to strengthen Sardar Patel's dream of unity,” the chief minister added.Swaraj said on the occasion that the Statue of Unity being established in Gujarat will be the tallest in the world.“Each and every farmer, agriculture labourers, young and old will have their own contribution in a unique manner (in the project),” she said, adding India will leave the US behind, where the Statue of Liberty is the tallest in the world at present.The run was also held in Indore, Jabalpur, Gwalior, Rewa, Shahdol, Sidhi, Morena, Shivpuri and Khargone.

Latest India News","Tue, 24 Dec 2013 08:00:00 GMT",https://resize.indiatvnews.com/en/resize/newbucket/715_-/mainnational/Run-for-Unity-h31810.jpg,"['mp', 'minister', 'gujarat', 'tallest', 'patel', 'chief', 'statue', 'unity', 'held', 'sardar', 'run']", 
33,33,FL-2013-000155-IDN,"Malaria kills 627,000 people in 2012, with estimated 207 million cases - ABC Local",https://www.abc.net.au/news/2013-12-12/an-malaria-update/5151196,,"Wed, 11 Dec 2013 08:00:00 GMT",,[], 
