,ID,event_id,article_title,article_link,article_content,publishing_date,article_image,article_keywords,article_relevance
66,66,FL-2016-000064-CHN,One lakh people under flood threat - The Daily Star,https://www.thedailystar.net/backpage/one-lakh-people-under-flood-threat-1241449,"About one lakh people are under threat of floods on the shoals and chars of the Teesta river in five upazilas in Lalmonirhat as the river is about to cross the danger level due to heavy downpour upstream across the border.

Many char areas have been flooded in the last 24 hours, bringing untold sufferings to residents of those areas. The Teesta was flowing only one centimetre below the danger level of 52.4cm at Teesta Barrage point of Doyani in Hatibandha upazila as of yesterday afternoon.

Mostafizur Rahman, executive engineer of Water Development Board (WDB) at Dalia, said all 44 gates of Teesta Barrage have been kept open since Wednesday night due to pressure of upstream water.

“The Indian Gajoldoba Barrage authorities have informed me that they kept open all the gates of the barrage due to pressure of water flowing from upstream Sikkim,” he added.

He said they have been monitoring the water level of the river. “We will alert the char and shoal people if the river crosses the danger level,” he said, warning that the water level might cross the danger level anytime.

Mobarak Hossain, 35, of Char Gaddimari village in Hatibandha said their shoal was flooded yesterday morning and they were using bamboo-made rafts to maintain connection with the mainland.

Mofazzal Hossain, chairman of Rajpur Union Parishad in Lalmonirhat Sadar, said char and shoal people always live in flood situations during the rainy season as the river overflows following normal downpour upstream.

The riverbed has lost its depth because of silt and mud settling there for years, said WDB Executive Engineer of Lalmonirhat Abu Bakkar. He added it is necessary to dredge the river so that it can capture additional water during rains.

A large area in Jalpaiguri district in West Bengal and northern Bangladesh has been flooded as excessive water has been released through the two barrages in Sikkim and West Bengal states, reports our Kolkata correspondent Subrata Acharya.

The release of water has created danger of large-scale flood in Bangladesh's northern districts.

Insiders said excessive water has been released from the Gajoldoba barrage in West Bengal due to flash flood caused by untimely rainfall. The government sources say 1,200 cusec of water has been released, but locals claim the amount would be several times higher.

It has been apprehended that low-lying areas fed by the Teesta in Bangladesh will be affected by the flash flood.

Contacted over cellphone, West Bengal Irrigation Minister Rajib Banerjee yesterday told this correspondent that the Barrage sources informed him that 1,200 cusec water was released on Tuesday.

Asked if they had considered that the water released from the barrage might affect Bangladesh, the minister said, “The water has been released by Sikkim. As Sikkim is on the upstream when water is released, it will flow downwards. However, Sikkim should have given us a note before releasing the water.”

However, Rajib Banerjee expressed sorrow over the creation of flood situations in Bangladesh. He said, “We don't want any neighbouring country to be affected due to us.”

West Bengal state government has meanwhile issued a “Yellow Alert” from Domohani at Teesta to bordering Mekhliganj since Tuesday morning.

The western districts in West Bengal have been experiencing heavy rainfall for the last one week due to a depression. The rainfall caused pressure of excessive water on Gajoldoba barrage due to flash flood.

Local people have complained that the authorities concerned released water at Gajoldoba without any prior announcement.","Sat, 18 Jun 2016 07:00:00 GMT",https://assetsds.cdnedge.bluemix.net/sites/default/files/styles/social_share/public/feature/images/teesta_river_1.jpg?itok=fcJVxfSd,"['water', 'sikkim', 'threat', 'west', 'teesta', 'lakh', 'river', 'released', 'bengal', 'barrage', 'flood', 'danger', 'level']", 
67,67,FL-2016-000064-CHN,Nepali Army personnel drain one metre water from Imja Lake - Himalayan Times,https://thehimalayantimes.com/nepal/nepali-army-personnel-drain-one-metre-water-imja-lake,"Kathmandu, June 22

The Nepali Army has drained one metre of water from Imja Glacier Lake in Solukhumbu in three weeks under the 7.2 million dollar Community Based Flood and Glacial Lake Outburst Risk Reduction Project being operated by the Department of Hydrology and Meteorology.

The project aims to reduce possible loss of human lives and infrastructure from a glacial lake outburst flooding in Solukhumbu and the downstream area of Mahottari, Siraha, Saptari and Udaypur.

NA personnel have been using excavators and other equipment to release the accumulated water in the lake since June 1. According to the NA, they had started to release the accumulated water by digging temporary outlet channel.

“As the channel outlet is helping release the reserved water, the water level in the lake has decreased by at least one metre so far,” Lieutenant Colonel Bharat Lal Shrestha, chief of field team of Nepali Army in Imja, told The Himalayan Times.

He added, “We are trying to finish work within two months by adjusting with the risky weather.” Earlier, as only little amount of water was released from the lake through natural flow, the NA had started work to prevent glacial lake outburst flood.

NA personnel have constructed a three-metre wide and 1.5-metre deep outlet channel to drain the water. As many as 40 personnel from the national security force have been deployed for the task.

The army aims to lower the water level up to three metres by October.

Besides army personnel, 62 civilians are also involved in draining the water of Imja Glacial Lake.

Despite unfavourable weather lasting almost 22 hours a day, NA personnel have been carrying out work in the snowy weather. “The weather remains friendly for just two hours in the morning,” Lieutenant Colonel Shrestha said.

He added that 40 per cent of the work has been completed. Around 10 km south from the world’s highest peak Mt Everest, Imja Lake is situated at 5,010 metres above sea level in the Khumbu region.

Due to the difficult terrain, Nepali Army had airlifted the excavator to dig the channel.

Spokesperson of Nepali Army, Tara Bahadur Karki, said it was NA’s first experience in disaster risk mitigation programme. “Though we were involved in various rescue operations earlier, this kind of work at a height of 5,010 metres was our first experience” he said.

The glacial lake is 180 metres deep, two-km long, 650-metre wide and is spread over 130 hectares. The surface area of the lake is said to have expanded from 0.4 to 1.01 square kilometres between 1984 and 2009 due to rapid melting of snow.

The programme to drain the lake water was funded by United Nations Development Programme and the Global Environment Facility.

An estimated 96,562 vulnerable people are living in the downstream areas. A total of 3,808 glaciers and 1,466 glacial lakes have been identified in Nepal.

Around 20 glacial lakes pose high risk of glacial lake outburst floods due to climate change.","Thu, 23 Jun 2016 07:00:00 GMT",https://thehimalayantimes.com/theme_himalayantimes/images/no-image.jpg,"['water', 'lake', 'work', 'weather', 'drain', 'metres', 'imja', 'outburst', 'army', 'metre', 'personnel', 'nepali', 'glacial']", 
68,68,FL-2016-000064-CHN,WATCH| Bank employees spanked for poor performance - WKYT,https://www.wkyt.com/content/news/Bank-employees-spanked-for-poor-performance--383825021.html,"During a team-building exercise, a corporate coach in China spanked 8 bank employees for their poor performance.","Tue, 21 Jun 2016 07:00:00 GMT",https://gray-wkyt-prod.cdn.arcpublishing.com/resizer/M7QdjYWOBXqjwglKs1OFIGpQGRA=/980x0/smart/cloudfront-us-east-1.images.arcpublishing.com/gray/DT5QLC7EGVOIBKTCWDXPIAOYLQ.jpg,"['bank', 'spanked', 'watch', 'teambuilding', 'poor', 'performance', 'china', 'employees', 'corporate', 'exercise', 'coach']", 
69,69,FL-2016-000064-CHN,"NSW weather: BoM predicts heavy rain, flash flooding for parts of state - ABC Online",https://www.abc.net.au/news/2016-06-18/nsw-weather-heavy-rain-flash-flooding-damaging-winds-expected/7522290,,"Fri, 17 Jun 2016 07:00:00 GMT",,[], 
70,70,FL-2016-000064-CHN,Dog eating festival protests to descend on Chinatown - New York Post,https://nypost.com/2016/06/16/dog-eating-festival-protests-to-descend-on-chinatown/,"A pair of irate Manhattan millennials are waging war against a Chinese dog eating festival – and they’re taking the fight straight to Chinatown.

Elizabeth Shafiroff, 29, and Lindsey Spielfogel, 30, plan to bring protest pooches to the enclave Friday to rally opposition against the canine cuisine conference slated for next week.

The animal rights activists with the group Global Strays say they want to raise awareness with Chinese-Americans and hope they will join their cause to ban the gathering.

Opponents have gathered more than 11 million signatures worldwide to protest the annual festival in China’s southern Yulin province.

“This is a horrible event,” Shafiroff told The Post. “So we want to do what we can here locally to fight it. There are a lot of Chinese-Americans who oppose what’s happening there.”

Shafiroff said she and her colleague plan to take out ads in local Chinese language newspapers decrying the festival.

They will also bring nearly a dozen dogs to Chinatown Friday as part of their campaign and will plaster the area with purple anti-animal abuse ribbons.

In addition, the pair are organizing a boycott of all Chinese-made pet supply products sold in local shops.

“This is a massive industry,” Spielfogel said. “They are making money off of these animals while at the same time holding an event like this. We want it to stop.”

“The largest Chinese community in America is right here in New York,” Shafiroff said. “That’s why we feel its important to get the word out locally.”

Several thousand dogs are slaughtered and served in restaurants during the annual gathering.

Proponents argue that its an honored part of Chinese heritage. Feeding on fido, they argue, is really no different than eating cows and chickens.

A small minority of Chinese actually dine on dog as the animal has increasingly become viewed as more of a protected companion than culinary target.","Thu, 16 Jun 2016 07:00:00 GMT",https://nypost.com/wp-content/uploads/sites/2/2016/06/millenials-dog.jpg?quality=90&strip=all&w=1200,"['descend', 'chinese', 'protests', 'dog', 'local', 'fight', 'chinatown', 'pair', 'protest', 'shafiroff', 'spielfogel', 'event', 'plan', 'festival', 'eating']", 
71,71,FL-2016-000064-CHN,CDC to deliver food supplies to flood-affected Moraikobai residents - Demerara Waves,https://demerarawaves.com/2016/06/17/cdc-to-deliver-food-supplies-to-flood-affected-moraikobai-residents/,"CDC to deliver food supplies to flood-affected Moraikobai residents

Last Updated on Friday, 17 June 2016, 18:10 by Denis Chabrol

Residents of Moraikobai, affected by recent flooding, will receive aid in form of food hampers through the Ministry of the Presidency from the Civil Defence Commission (CDC), the Government Information Agency (GINA) reported Friday.

Food hampers will be delivered to 160 flood affected families between Saturday and Sunday. Administrative Manager of the CDC Major Marvin Chichester, will be leading the relief mission to the Region 5 Amerindian community.

Recent heavy rains over the past week raised water levels in the Mahaicony River, resulting in severe flooding in parts of the village, affecting farmlands and crops.

Additionally, Deputy Director General of the CDC, Major Kester Craig, explained that the CDC will use the mission to locate housing for the installation of radios. The village council will be responsible for managing the communication sets.

Establishing radio communication in the village is part of the CDC’s efforts to establish early warning systems in the community The radios will be used for warnings and forecasting as part of future monitoring of flood conditions..

CDC has been establishing similar warning systems in communities vulnerable to flooding.","Fri, 17 Jun 2016 07:00:00 GMT",https://demerarawaves.com/wp-content/uploads/2016/06/cdc_moraik.jpg,"['deliver', 'residents', 'hampers', 'warning', 'food', 'village', 'cdc', 'radios', 'supplies', 'moraikobai', 'floodaffected', 'systems', 'mission', 'major', 'flooding']", 
72,72,FL-2016-000064-CHN,Warragamba Dam: Wall flood-protection plan raises environmental concerns - ABC Online,https://www.abc.net.au/news/2016-06-17/warragamba-dam-flood-protection-plan-raises-concerns/7520656,,"Fri, 17 Jun 2016 07:00:00 GMT",,[], 
