,ID,event_id,article_title,article_link,article_content,publishing_date,article_image,article_keywords,article_relevance
44,44,FL-2013-000155-IDN,UN: Opium Production in Burma Increases - Voice of America,https://www.voanews.com/east-asia-pacific/un-opium-production-burma-increases,"The United Nations says opium production in Burma continued to increase in 2013, in part because poppy farmers had few other ways to make a living.





Cultivation of opium poppies in South East Asia Cultivation of opium poppies in South East Asia Cultivation of opium poppies in South East Asia

In an annual report, the U.N. Office on Drugs and Crime estimated Burma, also known as Myanmar, produced 870 tons of opium in 2013 - the highest amount since it began keeping track in 2002.



Burma is second only to Afghanistan in growing opium poppies, a key ingredient in heroin and other illegal drugs.



In 1999, the country promised to eradicate opium production by 2014. But production has now gone up for seven straight years.



Jason Eligh, UNODC's country manager for Burma, says the idea of a drug-free Burma is a ""quite long way away.""



One of the main problems, Eligh says, is that opium poppies are the only source of adequate income for many farmers in Burma, which is Southeast Asia's poorest country.



""If a family has no money and they don't have the capacity through the environment around them to earn money, then they're going to take whatever measures they can to try and get money just to survive, just to eat, and that's what we're seeing occurring,"" he said.



Year after year, the UNODC reports find that opium production is also linked to ethnic unrest along Burma's northeast border areas.





Opium production in Burma by state, 2013 Opium production in Burma by state, 2013 Opium production in Burma by state, 2013

Most of Burma's illegal opium crops are found in Kachin and Shan states, where violence between insurgents and the army have raged on for as long as 50 years.



""That's a long period of time for local infrastructure to deteriorate and in some places disappear completely. So your options, your opportunities as a farmer are significantly restricted,"" said Eligh.



Burma's government has tried to reach peace deals with many ethnic insurgent groups, though fighting rages on in some areas.



The peace efforts are part of Burma's wider political and economic reforms and opening up, which follow decades of stifling, direct military rule.



But while the region has seen improved infrastructure, Eligh says this has provided more opportunities for criminals to benefit from the illegal drug trade.



""As you get more roads, as you get bridges crossing rivers, as you get economies that are starting to integrate better with those around them... you're seeing an environment for an increase in flow of a variety of different products, and heroin is just one of a number of products that are moved for profit,"" he said.



The U.N. report also cited rising demand for illegal drugs in nearby countries, such as China, as something that was exacerbating Burma's opium problem.","Wed, 18 Dec 2013 08:00:00 GMT",https://im-media.voltron.voanews.com/Drupal/01live-166/2019-04/E370BB65-A50B-4B71-AC8B-6BD2E4921858.jpg,"['burma', 'poppies', 'production', 'opium', 'illegal', 'burmas', 'state', 'money', 'increases', 'south', 'long']", 
45,45,FL-2013-000155-IDN,Dolphin Intelligence May Not Be as High as Previously Believed - Wall Street Journal,https://www.wsj.com/articles/SB10001424052702304866904579266183573854204,,"Wed, 18 Dec 2013 08:00:00 GMT",,[], 
46,46,FL-2013-000155-IDN,Michael Platt's BlueCrest Capital Poised for Rough Close to 2013 - Wall Street Journal,https://www.wsj.com/articles/SB10001424052702304773104579266780866050344,,"Wed, 18 Dec 2013 08:00:00 GMT",,[], 
47,47,FL-2013-000155-IDN,Pictures of the Week: December 6 - December 13 | Time - TIME - TIME,https://time.com/3805750/pictures-of-the-week-december-6-december-13/,"Please enter a valid email address.

* The request timed out and you did not successfully sign up. Please attempt to sign up again.

Sign Up Now

An unexpected error has occurred with your sign up. Please try again later.","Fri, 13 Dec 2013 08:00:00 GMT",https://api.time.com/wp-content/uploads/2013/12/454261439.jpg?quality=85&w=1200&h=628&crop=1,"['occurred', 'successfully', 'sign', 'week', 'unexpected', 'nowan', 'valid', 'timed', 'try', 'later', '13', 'request', 'pictures']", 
48,48,FL-2013-000155-IDN,Fake interpreter at Mandela memorial admitted to psychiatric hospital - ABC Local,https://www.abc.net.au/news/2013-12-19/mandela-signer-admitted-to-psychiatric-hospital/5168388,,"Thu, 19 Dec 2013 08:00:00 GMT",,[], 
49,49,FL-2013-000155-IDN,'Ned' Kelly killer gets 25 years in jail for decapitation murder - ABC News,https://www.abc.net.au/news/2013-12-13/ned-kelly-killer-gets-25-years-in-jail-for-decapitation-murder/5155218,,"Fri, 13 Dec 2013 08:00:00 GMT",,[], 
50,50,FL-2013-000155-IDN,Uttarakhand tourism on a slow road to revival - Daily Mail,https://www.dailymail.co.uk/indiahome/indianews/article-2528066/Uttarakhand-tourism-slow-road-revival.html,"Uttarakhand tourism on a slow road to revival

Christmas and New Year are just round the corner, but the Mall Roads in Nainital and Mussoorie wear a deserted look these days.



The tourism industry of India's two premier hill stations in Uttarakhand is yet to recover from the aftermath of the June floods.



The inflow of tourists into these famous hill stations received a setback. But people in the tourism business are hopeful that these places will again see a surge of tourists in the coming days.



Comeback: Nainital and Mussourie have not got the rush of Christmas tourists so far this year

Nainital attracted more than nine lakh visitors and Mussoorie over 22 lakh tourists last year.

This year, even a massive publicity campaign after the June calamity, with the state government claiming 'Uttarakhand is safe for tourists,' has failed to woo visitors.



Mussoorie is providing an added attraction in the form of 'Winterline Winter Carnival', jointly organised by the ministry of tourism of Uttarakhand and the Mussoorie municipal council, from December 27 to 30 to attract tourists.

Mussoorie Hotel Association's president R.N. Mathur said: ""Normally tourists come to Mussoorie during Christmas and New Year holidays. We are keeping our finger crossed this year too. The hotel industry here has suffered a big loss this time.



""Bengalis in large number used to come here during Durga Puja, but this year a low turnout was registered. So far, we have suffered about 80 per cent dip in the turnout.""



Nainital is in a makeover mode these days to woo visitors. A music concert is set to enthrall people during the New Year celebrations.

","Sun, 22 Dec 2013 08:00:00 GMT",https://i.dailymail.co.uk/i/pix/2013/12/22/article-2528066-1A429BF400000578-905_636x382.jpg,"['slow', 'nainital', 'tourists', 'woo', 'suffered', 'revival', 'road', 'mussoorie', 'uttarakhand', 'lakh', 'tourism', 'stations', 'visitors']", 
51,51,FL-2013-000155-IDN,Chinese surgeons reattach a man's severed hand after keeping it alive on his leg for a month - ABC Local,https://www.abc.net.au/news/2013-12-17/an-china-hand-surgery/5162990,,"Tue, 17 Dec 2013 08:00:00 GMT",,[], 
52,52,FL-2013-000155-IDN,Player Spotlight: Atlas Edson Rivera hoping for breakout 2014 - Goal.com,https://www.goal.com/en-us/news/114/mexico/2013/12/17/4484701/player-spotlight-edson-rivera-hoping-for-breakout-2014,"After leaving his home country for Europe, the young forward is back in Mexico and hoping to make an impact for a rejuvenated Atlas side.

GUADALAJARA - By his own admission, starring at the 2011 Under-20 World Cup changed Edson Rivera’s life.

The Atlas player netted twice against host nation Colombia in the quarterfinal to help Mexico to a 3-1 victory, with his second a solo effort to beat the keeper from outside the area.

Offers from Portugal, Spain, France and elsewhere flooded in for the 19-year-old forward who hadn’t yet even debuted for Atlas in the Liga MX.

After carefully thinking it over with his agent and family, Rivera opted for Braga in the Portuguese first division.

“It was a watershed moment not just for my career but also in my life,” Rivera told Goal.com recently in a Guadalajara café.

It was also a rare example of a Mexican heading to Europe at an early age.

But before he went, there was first a battle with Atlas to get the deal done, with Rivera explaining that “the gentleman’s pact doesn’t allow you to leave,” something he feels holds up other young Mexicans wanting to try their luck on the other side of the Atlantic.

Rivera pushed the move through and turned down a contract offer with Atlas, but the European adventure didn’t work out exactly as he would’ve wanted. The forward, who prefers to play as a “nine-and-a-half” but is also comfortable on the wing, did debut in Portugal’s top division but couldn’t nail down a regular spot.

“It takes a little time to adapt,” he said. “I hadn’t debuted here (in Mexico), I didn’t even know even what it was like to be in a first team squad. I arrived there and with players of that level it is a little difficult at 19.

“Apart from being intelligent, they are very strong players, they already have experience and the speed at which they play … They play more physically over there and take advantage of that. Here it is something that doesn’t have great importance.”

In November 2012, Rivera and Atlas put aside previous problems and the Rojinegros re-signed their youth product, who, at the time, said he had the opportunity to stay in Europe but preferred to try and get minutes with his hometown club.

Since then, the now 22-year-old Rivera has begun to show the talent that had European clubs drooling into actual performances for the first team.

Few players could’ve netted the kind of goal he scored against Atlante back in February, lifting the ball over a defender with his back to the goal before turning and striking a sweet volley into the corner of the net. His tearful, heartfelt celebration was because of his mother’s death weeks before.

Arguably Rivera’s best moment of his professional career so far came in November in the Copa MX final against Morelia, even if Atlas did lose on penalties.

Rivera pulled the strings for Atlas in the 3-3 draw, playing an exquisite ball for Matias Vuoso to score the Rojinegros’ second. He showed a new kind of maturity in his play to suggest he is now ready for the next step.

Coupled with his height and increased strength, Rivera has set his goal for next season as regular minutes, with the club’s greatest attacking threat Omar Bravo having left for Chivas.

In that he’ll be helped by the return of coach Tomas Boy, who seemed to favor Rivera in his last spell at the club, which has been rejuvenated by the recent sale to TV Azteca after years of financial uncertainty.



Rivera said that despite Atlas having a reputation as one of the best youth systems in Mexico and producing many international players like Pavel Pardo, Oswaldo Sanchez and Rafa Marquez, he believes there is much to improve, although he’s hoping the money coming into the club can turn that around.

“We’re happy,” Rivera said. “I don’t want to say that before we weren’t, but now there’s security and hope that good things are coming, there’ll be economic support in different aspects that they couldn’t improve before.”

As for Rivera’s longer-term goals, the national team and a potential return to Europe are the top priorities. For now though, he remains a young Mexican potentially on the brink of breaking out in a big way in 2014.

Follow GOAL.COM on","Tue, 17 Dec 2013 08:00:00 GMT",https://www.goal.com/assets/low-end/ltr/favicon-16x16.png,"['breakout', 'mexico', 'player', 'play', 'rivera', 'goal', 'europe', 'spotlight', 'forward', 'atlas', 'riveras', 'edson', 'players', 'young', 'hoping']", 
53,53,FL-2013-000155-IDN,"New Zealand's kiwi bird may have descended from an Australian bird, new research says - ABC Local",https://www.abc.net.au/news/2013-12-17/research-shows-kiwi-bird-might-have-descended-from-australia/5161940,,"Tue, 17 Dec 2013 08:00:00 GMT",,[], 
54,54,FL-2013-000155-IDN,"Britney Spears' sons fan of singing, dancing - indiatvnews.com",https://www.indiatvnews.com/entertainment/hollywood/britney-spears-sons--6244.html,"britney spears sons fan of singing dancing

Los Angeles: Pop star Britney Spears' sons have been learning how to sing and dance by watching her rehearse.

The “Perfume” singer is preparing for the start of her two-year residency in Las Vegas Dec 27 and says sons Sean Preston, eight, and Jayden James, seven, have picked up plenty from her rehearsals.""Preston, he's already dancing up a storm. He shows all my dancers how he can dance. It's really funny. (Jayden) is actually the singer. He sings a lot,” eonline.com quoted Spears as saying.Spears said one of the things that motivates her during rehearsals is when she spots one of her sons in the crowd.""I love when they're there. Last night, Preston was there and he lit me up when I saw him in the audience,” she said.","Sat, 21 Dec 2013 08:00:00 GMT",https://resize.indiatvnews.com/en/resize/newbucket/715_-/entertainmenthollywood/Britney-Spears-sons.jpg,"['spears', 'dancing', 'singer', 'singing', 'watching', 'vegas', 'britney', 'preston', 'fan', 'dance', 'jayden', 'twoyear', 'sons']", 
55,55,FL-2013-000155-IDN,Police officers to face assault charges over Taser death of Brazilian student Roberto Laudisio Curti - ABC Local,https://www.abc.net.au/news/2013-12-13/police-to-face-assault-charges-over-brazillian-student-death/5154398,,"Thu, 12 Dec 2013 08:00:00 GMT",,[], 
56,56,FL-2013-000155-IDN,Boy undergoes emergency roadside surgery after concrete truck hits van - ABC Local,https://www.abc.net.au/news/2013-12-19/roadside-surgery-for-six-year-old-injured-in-car-crash-mt-annan/5168116,,"Thu, 19 Dec 2013 08:00:00 GMT",,[], 
57,57,FL-2013-000155-IDN,Body in barrel case: father and son seek immunity before testifying - ABC Local,https://www.abc.net.au/news/2013-12-17/body-in-barrel-case3a--father-and-son-seek-immunity-before-tes/5161164,,"Tue, 17 Dec 2013 08:00:00 GMT",,[], 
58,58,FL-2013-000155-IDN,"Man survives bite from venomous death adder, one of the world's most deadly snakes - ABC Local",https://www.abc.net.au/news/2013-12-11/man-bitten-by-venomous-death-adder-recovers/5149598,,"Wed, 11 Dec 2013 08:00:00 GMT",,[], 
59,59,FL-2013-000155-IDN,Qld Museum unveils new dinosaur exhibition with 3D models in Brisbane - ABC Local,https://www.abc.net.au/news/2013-12-13/qld-museum-unveils-new-dinosaur-exhibition-brisbane/5154060,,"Thu, 12 Dec 2013 08:00:00 GMT",,[], 
60,60,FL-2013-000155-IDN,Cairns man who dissolved wife's body in acid found guilty of murder - ABC Local,https://www.abc.net.au/news/2013-12-12/cairns-man-guilty-of-murdering-wife/5152488,,"Thu, 12 Dec 2013 08:00:00 GMT",,[], 
61,61,FL-2013-000155-IDN,Former Finks bikie Dylan Jessen jailed over gun found in his girlfriend's underwear - ABC Local,https://www.abc.net.au/news/2013-12-16/former-finks-bikie-dylan-jessen-has-been-sentenced-to-three-yea/5158814,,"Mon, 16 Dec 2013 08:00:00 GMT",,[], 
