,ID,event_id,article_title,article_link,article_content,publishing_date,article_image,article_keywords,article_relevance
76,76,FL-2020-000182-CHN,We All Should Have Listened to Steve Bannon - OZY,https://www.ozy.com/news-and-politics/we-all-should-have-listened-to-steve-bannon/372539/,"Because if Trump had listened to his former chief strategist about the pandemic, our world might look a lot better.

The former White House chief strategist, now charged with fraud, was spot-on with his early warnings about the coronavirus.

But given his anti-China bent and declared propensity to “flood the zone with shit,” few took him seriously.

Until Thursday, when federal agents escorted him off a 150-foot yacht moored in Long Island Sound, the word often used to describe Steve Bannon was “irrelevant.” Oh, the former chief strategist of the Trump White House has been busy, frenetically so: He broadcasts a daily coronavirus-focused podcast War Room: Pandemic, oversees the Committee on the Present Danger: China and chairs the $100 million Rule of Law Fund, which investigates the disappearances of Chinese public figures. And still he found time to partake in We Build the Wall, a “volunteer” effort to erect a border structure not far from El Paso with $25 million in private donations, “not a penny” of which would go to anything but the wall.

Few followed his activities, especially the press. Viewed as a media whore, Bannon by 2020 was a washed-up snore: The only platforms that paid him any attention were Fox’s Sunday Morning Futures and CNBC’s Squawk Box, where he often appears, calling coronavirus “the CCP virus” — a reference to the Chinese Communist Party, which Bannon blames for obfuscating the reality about the pathogen — and warning about the dangers of Chinese-owned companies Huawei and TikTok. Even when the GOP commissioned a 57-page strategy memo that appeared to be a compilation of Bannon’s blame-China talking points and even after President Donald Trump’s Bannonesque move toward banning TikTok in the U.S., the media still yawned at mention of his name; if it came up, it was typically in reference to his directive to distract from PR woes by “flooding the zone with shit.”

That changed this week, when Bannon was arrested, hauled into federal court in Manhattan and charged with fraud for allegedly siphoning off more than a few pennies from the We Build the Wall fund. Pleading not guilty and promising to surrender his passport, he was released on a $5 million bond and strutted out of the New York courthouse, waving at the assembled cameras.

Far from appearing like someone worried that he could be facing 20 years behind bars, Bannon looked ebullient: He was back in the game, again worthy of front-page headlines.

In March, Bannon called for a complete and total shutdown, hoping to “smash the curve.”

As the Wall Street Journal reported only the day before, Bannon is also under investigation for business dealings with controversial Chinese dissident billionaire Guo Wengui — on whose yacht Bannon was arrested — and who underwrites the Rule of Law Fund and Bannon’s podcast, blasting it through China’s firewall.

Now that Bannon is spiking on the newsworthy charts, the media is having a field day, slamming him as a fraudster, shyster, liar and crook, reveling in his alleged dubious financial dealings detailed in the 35-page indictment.

Across social media, Bannon’s arrest was met with elation by Trump’s most ardent detractors — as if the charges slapped on Bannon, who as CEO of the Trump campaign in 2016 is credited with getting The Apprentice showman into office, were being slapped on the president himself.

But Bannon is not Trump: While the latter rarely appears to grasp complexities such as China and the coronavirus, Bannon has shown prescience with both. Starting in the first weeks of this year, he began loudly ringing the alarm about coronavirus, warning it would become a pandemic that could kill millions and would cripple the global supply chain and crush the world economy. Few listened, save his friend Peter Navarro, who like other White House advisers tunes into Bannon’s podcast, and who in late January wrote a memo warning of a potential coronavirus disaster, a memo which his boss didn’t bother to read.

The clue that this new disease, which Bannon’s podcast first reported on in late December, was way bigger than China was letting on, Bannon says, was when the Chinese government took the unprecedented step of canceling the Lunar New Year celebration.

Suspecting Beijing was covering up the reality of coronavirus — an act he told me constitutes a “biological Chernobyl” — he predicted that China would “vacuum up all the personal protective equipment” from the world market, worsening the fate for other countries as it spread.

Realizing that “the world wasn’t prepared,” and the press “was dropping the ball,” he tried drumming up media interest, forecasting that coronavirus, which then appeared to be contained in Wuhan, would be “the issue that 2020 pivoted on.” He interviewed epidemiologists, virologists, China experts, economists and manufacturers of personal protective equipment on his podcast. Few seemed to notice.

As architect of the Muslim travel ban, foremost defender of dropping out of the Paris climate accord, an adviser to far-right groups in Europe and a loud advocate of “the Wall,” Bannon had already flooded his own zone with so much shit that nobody was listening when this time he had news of actual importance.

In early February, Bannon flew to Los Angeles to appear on Real Time With Bill Maher, believing he would be talking about COVID-19 and what the U.S. needed to do to prepare. Once there, though, Maher wouldn’t let him touch the subject. Instead, the host pummeled his guest with combative questions about Trump, whom Bannon staunchly defended. Maher concluded by saying, “I wish we had someone on our side as evil as you, Steve.”

When the World Health Organization announced in March that the coronavirus was indeed a pandemic, and cases began spiking in the U.S., Bannon called for a complete and total shutdown — one that would have banned all international travel, travel between states, even shipment of most goods, hoping to “smash the curve.” He was laughed off as alarmist, though just this week White House coronavirus task force chief Dr. Deborah Birx said she wished the U.S. had taken such a route, as Italy did. So it’s lamentable that back when the COVID-19 pandemic could have been slowed, few heeded Bannon’s call. While his podcast has made iffy claims — among them heralding hydroxychloroquine as an effective COVID “therapeutic,” speculating that the virus escaped from a Wuhan lab and lambasting Dr. Anthony Fauci — the high-caliber guests assured that listeners could sift out informational gems.

Now that’s less likely: The podcast, while still taking aim at China — and legitimately questioning the rise of companies such as Huawei, which has become a bipartisan concern — has devolved into a cheering section for Trump and a forum to attack Joe Biden. And given Bannon’s indictment, the zone will surely be flooded with conspiracies about the so-called deep state. It’s a shame with all of that flooding, we may miss it again the next time he’s actually onto something.

Melissa Rossi writes about geopolitics, travel and larger-than-life personalities.","Sat, 22 Aug 2020 07:00:00 GMT",https://assets.ozy.com/ozy-prod/2020/08/gettyimages-1228129556.jpg?width=1200&height=630,"['zone', 'podcast', 'pandemic', 'steve', 'china', 'bannons', 'world', 'media', 'listened', 'coronavirus', 'trump', 'bannon']", 
77,77,FL-2020-000182-CHN,"Bad weather to occur more frequently, experts predict - CGTN",https://news.cgtn.com/news/2020-08-21/Bad-weather-to-occur-more-frequently-experts-predict-T8kkiWTi4o/index.html,"Extreme weather events will occur more frequently in China as a result of global warming, something the country is particularly vulnerable to, meteorologists said following a record-setting spell of rainy weather in June and July. Data from the National Climate Center show the Yangtze River Basin has seen about 54 percent more rain than average for two months, while the Huaihe River Basin had about 43 percent more. The heavy rain in June and July, which caused flooding in many parts of China, was the longest lasting among records dating back to 1961.

Flooded Huaihe River. /VCG Flooded Huaihe River. /VCG

Some regions had 30 percent of their average annual rainfall in just one day, and many places, including Lu'an in Anhui province and Poyang county in Jiangxi province, have set rainfall records in the past two months. ""In general, the climate this year is pretty extraordinary,"" said Jia Xiaolong, deputy head of the center. He said the continuous heavy rainfall occurred against the backdrop of global warming, which had caused the number of rainstorm days in China to increase by an average of 3.9 percent every 10 years for the past six decades.

This year, the Indian Ocean has seen its temperature rise above normal, causing a stronger subtropical high to affect China. Meanwhile, active cold air from the north has met warm air in the south, resulting in frequent heavy rainfall, he said.

Flooding strikes Chongqing Municipality after consecutive rainy days. /VCG Flooding strikes Chongqing Municipality after consecutive rainy days. /VCG

Wang Pengling, a senior engineer at the center, said that due to its large latitudinal span and range of landforms, China has complicated climate types and is especially vulnerable to climate change. China has witnessed a temperature rise averaging 0.24 C per decade since the 1950s, significantly higher than the global average rise during the same period, Wang said. The World Meteorological Organization said in a report released in September that the global average temperature has increased by 1.1 C since 1880.

On August 19, 2020, tea trees growing in Hangzhou City in east China's Zhejiang Province were burnt by sunlight during unusually high temperatures. /VCG On August 19, 2020, tea trees growing in Hangzhou City in east China's Zhejiang Province were burnt by sunlight during unusually high temperatures. /VCG

""China's ecologically fragile areas overlap with populous areas to a great extent, which further intensifies disaster risks brought by climate change,"" Wang said. He called for more research on how extreme weather leads to disasters to better inform the public of the risks. ""Research findings indicate that global warming will continue,"" Wang said. ""Under high emission scenarios globally, both the frequency and intensity of rainstorms in China will increase, raising the risks of floods. Low-carbon lifestyles should be encouraged worldwide, and cities need to enhance their adaptability to climate change.""

(Original editor: Li Hongyang) (Cover image via VCG) (If you want to contribute and have specific expertise, please contact us at nature@cgtn.com.)

Source(s): China Daily","Fri, 21 Aug 2020 07:00:00 GMT",https://news.cgtn.com/news/2020-08-21/Bad-weather-to-occur-more-frequently-experts-predict-T8kkiWTi4o/img/6866010fab554ed2a1961de617484b1a/6866010fab554ed2a1961de617484b1a-1280.jpeg,"['predict', 'china', 'climate', 'frequently', 'experts', 'global', 'vcg', 'rainfall', 'province', 'occur', 'weather', 'high', 'bad', 'average', 'river']", 
78,78,FL-2020-000182-CHN,Floods destroy crops worth 156 mln USD in Bangladesh - Xinhua | English.news.cn - Xinhua,http://www.xinhuanet.com/english/2020-08/20/c_139305058.htm,"Source: Xinhua| 2020-08-20 15:40:50|Editor: huaxia

Video Player Close

DHAKA, Aug. 20 (Xinhua) -- The loss of crops due to floods in Bangladesh has been put at 13.23 billion taka (about 156.4 million U.S. dollars).

Bangladeshi Agriculture Minister Abdur Razzaque told journalists on Wednesday that crops on 1.58 lakh hectares of land in 37 districts has been destroyed fully or partially, adding so far floods has hit Bangladesh for three times this year.

At least 14 districts were affected by flooding between June 25 and July 9 in the first phase when some 343,957 farmers were affected and crops worth about 3.49 billion taka damaged.

According to the minister, 37 districts were hit by flooding between July 11 and Aug. 12 again.

In the second and third phases, he said some 929,194 farmers were affected and crops worth about 9.74 billion taka damaged.

Razzaque said they have already started implementing a rehabilitation program for 239,631 farmers in the flood hit districts.

Floods triggered by heavy seasonal rains and onrush of water from hills have still continued unabated in some parts of Bangladesh, leaving a trail of death, misery and destruction in their wake.

The floods in parts of Bangladesh have killed at least 226 since June 30, authorities said Wednesday.

According to the daily flood report of the country's Health Emergency Operation Centre and Control Room on Wednesday, most victims have drowned but some died in snake bites and lightning in the flood-hit areas. (1 U.S. dollar equals about 84.6 taka) Enditem","Thu, 20 Aug 2020 07:00:00 GMT",,"['bangladesh', 'affected', 'crops', 'usd', 'xinhua', 'destroy', '156', 'worth', 'hit', 'taka', 'billion', 'floods', 'districts', 'mln', 'farmers']", 
79,79,FL-2020-000182-CHN,Mukbang: Why is China clamping down on eating influencers? - BBC News,https://www.bbc.com/news/technology-53840167,"But now some of the most successful mukbang stars in China, the ""big-stomach kings"" who eat as much food on screen as they can, are having their videos blurred on Chinese platforms, to discourage viewers.","Thu, 20 Aug 2020 07:00:00 GMT",https://ichef.bbci.co.uk/news/1024/branded_news/8087/production/_114030923_mainmukbang.png,"['having', 'viewers', 'kings', 'screen', 'videos', 'china', 'clamping', 'mukbang', 'influencers', 'food', 'successful', 'stars', 'eating', 'platforms']", 
80,80,FL-2020-000182-CHN,"Interview: 'From an Overall Safety Point of View, There is Not a Huge Concern' About Flooding at Yongbyon - Radio Free Asia",https://www.rfa.org/english/news/korea/nuclear-08212020185503.html,"The Korean peninsula has been hit by record-breaking precipitation, with state-run Korean Central News Agency (KCNA) reporting last week that floods had destroyed 40,000 hectares (154 square miles) of farmland, 16,680 homes, and 630 other buildings all over the country.

Commercial satellite imagery of the Yongbyon nuclear reactor, the country’s main nuclear facility, caught the attention of analysts at 38 North, a North-Korea analysis website funded by the Washington-based Stimson Center.

38 North reported that although the five-megawatt reactor at Yongbyon does not appear to have been recently operating, ""damage to the pumps and piping within the pump houses presents the biggest vulnerability to the reactors.""

""If the reactors were operating, for instance, the inability to cool them would require them to be shut down,"" the report said.

RFA’s Korean Service Thursday interviewed Olli Heinonen, former Deputy Director-General for Safeguards at the International Atomic Energy Agency (IAEA), and current distinguished fellow with the Stimson Center’s 38 North program.

He discussed the potential damage that the flooding could cause to Yongbyon and the Pyongsan uranium mine, another flooded facility. The interview has been edited for length and clarity.

A view of the Yongbyon Nuclear Scientific Research Center on the bank of the Kuryong River in Yongbyon, North Korea, July 22, 2020. By August 6, 2020 the area had become flooded. Airbus Defence & Space and 38 North/Pleiades via Reuters

RFA: It has been reported that the North Korean nuclear facility in Yongbyon was affected by the recent flooding. Do we have a major catastrophe on our hands?

Heinonen: As you know, I have been several times to Yongbyon, and I have also been there during flooding, and actually this flooding is about as bad as I think I saw when I was there. I think the first big flood I saw there, maybe it was in 1992, that long ago.

So I think my first reaction to these images, which also come from the organization which I now serve, the Stimson Center, … North Korea is aware of this flooding, they don’t come as a surprise, and they have taken some countermeasures in the design of these nuclear facilities to overcome any troubles. This is the first point, and I’ll return to it soon.

The second thing we need to keep in our mind is actually that these facilities are practically not operating now. So when you look at the satellite image survey, the five-megawatt reactor doesn’t operate, the experimental light-water reactor is under construction, the processing plant is far away from the river, but it still needs water in order to maintain it.

Same issue the uranium enrichment part, they need some water but the actual operation, we are not so sure how much it’s operating now. And then there are some other installations that use radioactive material. Not nuclear material, but [they conduct] radioactive experiments for medical, scientific and other purposes.

I don’t think this flooding has had much of an effect on those, so from an overall safety point of view, there is not a huge concern for the time being.

The next question: Has this flooding caused damage to the equipment there?

I don’t think there is any huge damage for the following reasons:

Let’s look now at the experimental light-water reactor and the five-megawatt reactor. I think that they can go for a while without having much water in use, or taken from the river, so they can stop the pumps… In addition to that, these kinds of installations, when they operate, they have a kind of filtering system in the front of the piping that takes the water. So it will also sieve away some of the dirt, so if they need to temporarily take some water I think they can perhaps manage it.

But certainly under current circumstances, you cannot go to long-term operations until the water level comes down, and until the front of these water-taking places are cleaned and put back in full order.

So this is my take on this, and I have seen them also designing and participating in a reactor that was built in Syria. And I was at that point in the IAEA and we have actually written some Syria reports about the water for that reactor…and it was I think, a fairly normal industrial arrangement for the water to be taken from the river, and how this system was made in such a way that it can handle also flooding.

Now we see that the intake building or the pump house in Yongbyon, particularly for the reactor, is surrounded by water, but I don’t think that it makes a huge damage on that because at least in Syria we saw that the electronics part was fairly well protected.

Then I also see that the people have not looked at the other water intake places. They are all concentrated only on water intake for the five-megawatt reactor and the experimental reactor.

On the other side of the river is a pump house which probably takes water to the river… and the situation there is pretty much the same as for the reactor, so there is a lot of water around the pump house… so that’s where we are.

So I don’t think that there is any dramatic situation. They need to do some fixing, but it’s not very likely that they are all destroyed.

There is one thing that people also need to remember. The construction of the buildings, in North Korea, their standards are not that advanced as you and I have become used to.

For example when it rains a lot, in some facilities, water can get to the cellar because of the poor isolation in the basement. So that’s another thing that is probably taking place in some of the facilities. We’re just not seeing it because satellite imagery will not show it.

What kind of damage has that caused? It’s hard to say. Most likely they just need to pump some water away and clean the premises, the cellars, and the lower levels of those buildings.

But again, I don’t think it will stop the operation of those facilities, since it didn’t do anything in the 1990s, so why would it do that today?

RFA: What is the danger of flooding at the Pyongsan uranium mine?

Heinonen: When you do the uranium mining, you use a lot of water to clean the ore, which in this case is anthracite coal in Pyongsan. So you have to clean it, you have to dissolve it, and then when you do this cleaning and this dissolution, you recover uranium, which is fine, but the same time you leave a lot of radioactive waste like radium, thorium, and then both of those, they are radioactive materials, so at one point in time, they decay to radon, which is a gas.

So, when you have these big ponds where the wastewater goes, we don’t know how well they are designed and how they deal hen there is a huge rain—whether the rain just falls into these open ponds, or whether they overflow and then this radioactive waste gets to the environment, groundwater, and then eventually either to the river, or to the drinking water of the people.

If that takes place, then it has an impact.

Also, we don’t know how well these ponds are actually made. In normal cases, actually they are like huge swimming pools. So they are not such that there is a pond or lake on a normal rice paddy or normal ground. You need to isolate this waste liquid from the rest of the ground water.

Since we don’t know how they have done that, I think that’s why when we look at this heavy rain, which was also in the Pyongsan area, that might be a matter of concern.

There is a possibility that water might overflow and get to the environment.

I’m not so worried about the milling facility itself, the one that takes the ore and separates uranium there, because they are chemical processes and they happen in piping and vessels and various tanks, so it should not impact the operations of those.

But the waste containment ponds are a different story. When you look at the image on the website, there are actually two such ponds. One is near the actual mine, up there on the mountain, and then there is a pipeline that [connects with the] milling facility, and then the liquids, which are waste from that milling facility, they cross the river in another pipe and go to a pond over there.

So those two ponds, one on the other side of the river and one up there on the mountain, I think, may have some risks when there is such a heavy rain as we have seen in the last couple of weeks.

Reported by Sangmin Lee for RFA’s Korean Service.","Fri, 21 Aug 2020 07:00:00 GMT",https://www.rfa.org/english/news/korea/nuclear-08212020185503.html/2020-08-13T050953Z_185740911_RC2TCI9FTDLV_RTRMADP_3_NORTHKOREA-NUCLEAR-FLOODS.JPG/@@images/image,"['view', 'overall', 'yongbyon', 'huge', 'uranium', 'water', 'need', 'point', 'interview', 'flooding', 'north', 'reactor', 'think', 'dont', 'safety', 'river', 'concern']", 
