,ID,event_id,article_title,article_link,article_content,publishing_date,article_image,article_keywords,article_relevance
0,0,FL-2016-000064-CHN,‘Plum Rains’ bring further flooding to southern China - Aljazeera.com,https://www.aljazeera.com/news/2016/6/14/plum-rains-bring-further-flooding-to-southern-china,"The Meiyu monsoon front is pulsing with heavy rain again over the southern provinces of China.

Every year the “Plum Rains” of May, June and July bring flooding and landslides to southern China.

The flooding regularly comes from swelling rivers but, often, locally intense thunderstorms cause flash floods and landslides.

There has been a recent resurgence of these monsoon rains in the southern provinces of Guizhou, Guangxi, Jiangxi, Guangdong and Fujian.

China’s Xinhua News Agency reported that the rains in southern Guangdong province have displaced more than 8,000 people.

Floods in Guizhou province left 29,000 people isolated following massive thunderstorms in the area. As much as 134 millimetres of rain fell in a short period on Friday, sending flood waters tearing through the villages of Jiuchao and Maogong, sweeping three people away.

Most recently, Liuzhou city in in Guangxi province has seen the Liujiang River burst its banks with dramatic force. At least 150mm of rain was recorded in a 24-hour period but 130mm of that fell in less than three hours, causing a surge of water that swept away or overturned vehicles.

According to Chinese state media, persistent rains since Saturday have caused material losses of $7.8m.

The Plum Rains, from the Meiyu monsoon front, will soon move north and swell the Yangtse River. Progress of this annual event is not smooth. There are always pulses of heavy rain, so the risk of further floods remains throughout southern China.","Tue, 14 Jun 2016 07:00:00 GMT",https://www.aljazeera.com/wp-content/uploads/2016/06/4016ec25294b4ffd92123eb7e9caedb3_18.jpeg?fit=1000%2C562,"['province', 'plum', 'provinces', 'china', 'thunderstorms', 'monsoon', 'river', 'period', 'flooding', 'rains', 'rain', 'southern', 'bring']", 
1,1,FL-2016-000064-CHN,Assam to take a leaf out of Chinas flood control measures - Business Standard,https://www.business-standard.com/article/current-affairs/assam-to-take-a-leaf-out-of-china-s-flood-control-measures-116061700862_1.html,"Dear Reader,

Business Standard has always strived hard to provide up-to-date information and commentary on developments that are of interest to you and have wider political and economic implications for the country and the world. Your encouragement and constant feedback on how to improve our offering have only made our resolve and commitment to these ideals stronger. Even during these difficult times arising out of Covid-19, we continue to remain committed to keeping you informed and updated with credible news, authoritative views and incisive commentary on topical issues of relevance.

We, however, have a request.



As we battle the economic impact of the pandemic, we need your support even more, so that we can continue to offer you more quality content. Our subscription model has seen an encouraging response from many of you, who have subscribed to our online content. More subscription to our online content can only help us achieve the goals of offering you even better and more relevant content. We believe in free, fair and credible journalism. Your support through more subscriptions can help us practise the journalism to which we are committed.



Support quality journalism and subscribe to Business Standard.



Digital Editor","Fri, 17 Jun 2016 07:00:00 GMT",http://bsmedia.business-standard.com/_media/bs/img/article/2015-09/07/full/1441616653-1422.jpg,"['measures', 'credible', 'leaf', 'offering', 'content', 'help', 'economic', 'subscription', 'journalism', 'online', 'support', 'control', 'flood', 'chinas', 'assam', 'quality']", 
2,2,FL-2016-000064-CHN,Chinese Good Samaritan rescues 10 women and children with paddleboard after bus stranded by floods - South China Morning Post,https://www.scmp.com/news/china/society/article/1980675/chinese-good-samaritan-rescues-10-women-and-children-paddleboard,Deng Wei ferries people to safety from the stranded bus on his paddleboard. Photo: SCMP Pictures,"Fri, 24 Jun 2016 07:00:00 GMT",https://cdn1.i-scmp.com/sites/default/files/styles/og_image_scmp_generic/public/images/methode/2016/06/24/8c9caad6-39c5-11e6-9a6a-3421f730b241_image_hires.jpg?itok=qIPa5-ao,"['rescues', 'chinese', 'floods', 'ferries', 'children', 'safety', 'good', 'bus', 'women', 'samaritan', 'paddleboard', 'wei', 'pictures', 'stranded', 'deng', 'scmp']", 
3,3,FL-2016-000064-CHN,"Environmental conservation efforts in China are making a positive impact, Stanford scientists say | Stanford News - Stanford University News",https://news.stanford.edu/2016/06/16/chinas-environmental-conservation-efforts-making-positive-impact-stanford-scientists-say/,"China gets a bad rap on its environmental stewardship, in large part due to the environmental damage and atmospheric pollution that result from the country’s rapid economic and infrastructure growth. But a new decade-long report, involving the work of 3,000 scientists, reveals that China’s environmental policies are making clear positive impacts.

Stanford biologist Gretchen Daily is senior author of a study of how China has increased the value of its ecosystems in part by carefully managing select agricultural activities. Here, a farmer works in a field surrounded by the steeply sloped karst mountains near Yangshuo. (Image credit: Stacie Wolny)

“China has gone further than any other country, as strange as that sounds given all the devastation that we read about on the environment front there,” said Gretchen Daily, the Bing Professor of Environmental Science at Stanford and senior author on the study. “In the face of deepening environmental crisis, China has become very ambitious and innovative in its new conservation science and policies and has implemented them on a breathtaking scale.”

The efforts are guided in part by software developed by the research team, which identifies which environmental areas should be protected or restored to provide the greatest benefit. Through this work, China has eagerly incorporated science and funded some of the most far-reaching efforts in the world, which could serve as a model for other countries, according to the study’s authors.

Daily and an international team of researchers report the results of the China ecosystem assessment, which was launched by the Chinese Academy of Sciences and China’s Ministry of Environmental Protection, in the June 17 issue of Science.

Policy born from environmental crisis

Officials in China began considering significant environmental reform following a series of natural disasters in the late 1990s that were exacerbated by human activities. In particular, in 1998, massive deforestation and erosion contributed to devastating flooding along the Yangtze River. Thousands of people were killed, and more than 13 million people were left homeless following $36 billion in property damage.

That this occurred just a year after a historic drought signaled to officials in the country that steps needed to be taken to protect and restore China’s natural capital. By 2000, China developed the Natural Forest Conservation Program and the Sloping Land Conversion Program, $50 billion projects aimed at reducing natural disaster risks by restoring forest and grassland, while also improving life conditions for 120 million poverty-stricken farmers.

Such investments can have big payoffs, said Steve Polasky, Fesler-Lampert Professor of Ecological/Environmental Economics at the University of Minnesota and a co-author of the study. “Restoring forests and grasslands can reduce flooding and sandstorms, which has large benefits for the people downstream and downwind,” he said.

The new report used InVEST, a software suite designed by The Natural Capital Project for evaluating economic and environmental tradeoffs, to assess these efforts from 2000-2010 by analyzing data from satellites, soil samples, biodiversity surveys, meteorology, hydrological studies and other types of field surveys.

The researchers found that the conservation policies improved key ecosystem services such as soil retention, water supply, carbon sequestration and sand storm prevention on a country-wide scale.

“The hope is that this can bring about a transformation in the way people think of and account for the values of nature,” said Daily, who is a senior fellow at the Stanford Woods Institute for the Environment and co-director of the Natural Capital Project.

A worldwide approach for environmental accounting

Much of China’s success in these areas can be traced to how officials incorporate assessments of the state of ecosystems and their economic values to society into decision-making processes. This approach, Daily said, is applicable anywhere on planet Earth.

For instance, forests, wetlands and other heavily vegetated places play a key role in regulating the flow of water and its quality, but these are under constant threat of conversion to farming or settlement.

“China is using science to identify and define the priority areas for protection or restoration in order to improve water security in a way that anybody could apply,” she said.

Likewise, sand storms are a significant problem in eastern cities and are the result of deforestation and dry conditions. The researchers identify the areas that should be restored to mitigate storms, and which forested areas are at future risk of contributing to sand storms, and should thus be protected.

The science can inform society’s choices, Daily said, but it can’t make the final call. Research can quantify the benefits a particular area can provide if it were used to grow food or reforested to prevent floods, but ultimately it will be up to policymakers to decide, both for that region and where the decision falls within a set of national priorities.

There are still areas where China needs improvement. Although the country has the highest rate of reforestation in the world, many of the newly planted trees are not native to the regions. These plantings are a pragmatic short-term answer to rebuilding forests efficiently, quickly and inexpensively, Daily said, but don’t fare as well in the long term. This provides a basic infrastructure for wildlife, but biodiversity continues to worsen, and will do so until there is a more natural landscape.

The assessment didn’t examine other significant challenges, such as air quality and increasing greenhouse gas emissions. These will require interventions beyond ecosystem restoration alone.

“To realize the dream of becoming the ecological civilization of the 21st century, China needs more innovation in approaches to securing both nature and human well-being,” Daily said. “This is humanity’s grand challenge – and while China is only in the first phases of transformation, its efforts are inspiring adaptation and adoption of their approaches in other countries worldwide.”

The study, titled “Improvements in ecosystem services from investments in natural capital,” is published in the June 17 issue of Science.

The Natural Capital Project is a partnership combining research innovation at Stanford and the University of Minnesota’s Institute on the Environment with the global reach of conservation science and policy at The Nature Conservancy and World Wildlife Fund.","Thu, 16 Jun 2016 07:00:00 GMT",https://news-media.stanford.edu/wp-content/uploads/2016/06/14125452/china_news.jpg,"['stanford', 'science', 'areas', 'china', 'ecosystem', 'natural', 'environmental', 'efforts', 'study', 'daily', 'say', 'capital', 'scientists', 'positive', 'impact', 'conservation', 'making']", 
4,4,FL-2016-000064-CHN,Floods leave many dead in southern Ghana - Aljazeera.com,https://www.aljazeera.com/news/2016/6/16/floods-leave-many-dead-in-southern-ghana,"Deadly downpours cause widespread flooding along the Cape Coast as the West African wet season intensifies.

Four days of heavy and steady rain has left at least 10 people dead in the south of Ghana. The streets of Accra have been left under water after the torrential downpours caused widespread flooding earlier this week.

The nation’s capital was hit bit 185mm of rain on Sunday, which is more than they would expect for the entire month of June. This is the wettest month of the year with an average rainfall of 178mm.

Since the weekend a further 50mm of rain has fallen exacerbating the severe problems already faced. President John Dramani Mahama has surveyed the areas concerned. He was reported to have driven through several neighbourhoods on a motorcycle.

Heavy downpours were also recorded 150km to the west of Accra in the Central Regional capital, Cape Coast where 10 people died in floods, Sandy Amartey, regional coordinator of the National Disaster Management organisation, told AFP.

“In all we have 10 to 12 who lost their lives during this rainy season.”

The rains come too late to save the nations struggling coca crop. The region’s Harmattan winds have been blamed for likely poor yield.

The Harmattan is the cold, dry wind that blows across West Africa from the Sahara during the winter months. It does have a tendency to sap the moisture from the soil and can spoil the cocoa seeds.

The rains finally arrived in March. Since then they have been insufficiently light and patchy until recently.

This current spell of heavy showers is set to continue well into next week.

The rainy season is not expected to ease significantly until early July.","Thu, 16 Jun 2016 07:00:00 GMT",https://www.aljazeera.com/wp-content/uploads/2016/06/e3d9862639724dcfaf919bb397bf897f_18.jpeg?fit=1000%2C562,"['weekthe', 'rainy', 'floods', 'west', 'downpours', 'widespread', 'rain', 'rains', 'nations', 'dead', 'leave', 'ghana', 'regional', 'southern', 'season']", 
5,5,FL-2016-000064-CHN,Car experiment shows extent of flood danger - ABC Online,https://www.abc.net.au/news/2016-06-18/research-shows-cars-deadly-in-floodwaters/7522798,,"Sat, 18 Jun 2016 07:00:00 GMT",,[], 
