,ID,event_id,article_title,article_link,article_content,publishing_date,article_image,article_keywords,article_relevance
54,54,FL-2017-000108-BGD,Map of the Day: Where People Have Been Forced to Flee From Their Homes in 2017 - UN Dispatch,https://www.undispatch.com/map-day-people-forced-flee-homes-2017/,"Today’s map comes from the Internal Displacement Monitoring Center, which tracks internal displacement around the world. People become “internally displaced” when they are forced to flee their homes because of violence or natural disaster, but do not cross an international border. (If they flee across a border, they can be considered refugees and can be afforded certain protections under international law that IDPs typically do not receive.)

And so far in 2017, some 9 million people have become newly displaced.

About half of the people newly displaced this year are fleeing conflict. And though the year is half over, the 4.6 million people displaced by conflict is about two-thirds of last year’s total.

According to the report, the countries with the highest new internal displacement by conflict are: Democratic Republic of Congo (DRC): 997,000; Iraq: 922,000; Syria: 692,000; the Philippines: 466,000; Ethiopia: 213,000; Central African Republic (CAR): 206,000; South Sudan: 163,000; the Gambia: 162,000; Afghanistan: 159,000; Nigeria: 142,000; Yemen: 112,000; and Somalia: 70,000.

In the DRC, many of the newly displaced come from the Kasai region, which was not a location that experienced much violence until this year when a localized dispute began spiraling out of control. This region now has the potential to become Africa’s next big conflict and many more people are likely to be displaced. In Iraq, much of the newly displaced are from Mosul and were forced to flee when Iraq forces began their liberation of the city from ISIS.

Natural disasters are another driver of displacement, accounting for nearly half of all displacements worldwide. Again, just a few disasters that struck key population centers are responsible for most of the displacements

From the report:

The two largest events of displacement by flooding in China and by Cyclone Mora in Bangladesh, Myanmar and India are stark reminders of the fact that the concentration of populations in flood plains and on hazard prone coastlines combined with high levels of vulnerability repeatedly trigger large-scale new displacements – and will continue to do so in the face of climate change. Large-scale new displacements in the Philippines, Peru and Sri Lanka also took place in the context of seasonal flooding. “This shows us that seasonal, to be expected, weather patterns still result in large numbers of new displacements year after year, clearly illustrating that we are not investing enough in reducing vulnerability and exposure. While preparedness, early warning and evacuation systems may have improved over the years, the overall risk of being forced out of your home and becoming displaced in these countries has not been reduced.” says Bina Desai, Head of Policy and Research at IDMC.

Earlier this year, I spoke with Alexanda Bilak, who directs the Internal Displacement Monitoring Center, for a Global Dispatches podcast episode. She explained that one of the key challenges facing IDPs around the world is their precarious legal status. Unlike refugees, she said, countries are under no special obligation to care for people displaced within their borders. The United Nations and other groups are trying to change this and help poorer countries that are vulnerable to disasters — manmade or otherwise — devise policies that help reduce the humanitarian fallout from these events. Progress is being made, but far too slowly.

If you have 20 minutes and want to learn more about internal displacement around the world, have a listen.","Thu, 17 Aug 2017 07:00:00 GMT",https://www.undispatch.com/un-content/uploads/2017/08/Screen-Shot-2017-08-17-at-9.05.01-AM.png,"['iraq', 'displaced', 'flee', 'countries', 'forced', 'map', 'conflict', 'displacement', 'homes', '2017', 'internal', 'day', 'displacements', 'newly', 'world', 'half']", 
55,55,FL-2017-000108-BGD,"Flood makes cow fattening costly in Pabna, Sirajganj - The Daily Star",https://www.thedailystar.net/country/flood-makes-cow-fattening-costly-pabna-sirajganj-1451173,,"Sun, 20 Aug 2017 07:00:00 GMT",,[], 
56,56,FL-2017-000108-BGD,Government spends twice as much abroad on fossil fuels as renewable energy - The Independent,https://www.independent.co.uk/climate-change/news/government-fossil-fuels-renewable-energy-uk-export-finance-climate-change-global-warming-co2-a7887376.html,"The Government has been accused of undermining its own efforts to tackle climate change after new research revealed it is investing twice as much in fossil fuel projects overseas as it is in renewables.

Almost half (46 per cent) of the money the UK spent on energy overseas went on fossil fuels while barely more than a fifth (22 per cent) was spent on renewable energy sources.

The research, commissioned by Catholic charity CAFOD and carried out by the Overseas Development Institute, analysed spending between 2010 and 2014 – the last period for which data is available.

It shows that, of the £7.5bn the UK spent on energy abroad, £1.3bn was spent on renewables and £2.9bn on fossil fuels – appearing to contradict both government ministers’ promises on climate change and the UK’s international commitments under the Paris Climate Agreement.

The treaty, signed in 2015, says countries must work towards “making finance flows consistent with a pathway towards low greenhouse gas emissions and climate-resilient development”.

The Conservative manifesto, meanwhile, promised ministers would “continue to lead international action against climate change”.

However, UK spending on fossil fuels overseas increased by more than half a billion pounds in the five-year period up to 2014 – up from £2.2bn in 2009-2013.

Only a fraction (8 per cent) of UK spending on energy in developing countries went to helping poor people access energy sources, despite ministers having committed Britain to the international Sustainable Development Goals, which aim to make sure everyone in the world has access to affordable and sustainable energy sources by 2030.

The data also reveals apparent tensions at the heart of government over whether to prioritise the UK’s climate change commitments or focus on short-term economic benefits.

Progress made by the Department for International Development means almost a third of its energy spending (32 per cent) went to renewable sources compared to 22% per cent on fossil fuels.

Is there a viable alternative to vehicles run on fossil fuels? Show all 4 1 /4 Is there a viable alternative to vehicles run on fossil fuels? Is there a viable alternative to vehicles run on fossil fuels? 362061.bin Is there a viable alternative to vehicles run on fossil fuels? 362062.bin Is there a viable alternative to vehicles run on fossil fuels? 362063.bin Is there a viable alternative to vehicles run on fossil fuels? 362064.bin

In contrast, more than 99 per cent of UK Export Finance investment, which helps British companies sell their products and services overseas, was spent on fossil fuels - suggesting environmental factors are barely a consideration when decisions over spending are made.

It means different government departments are seemingly undermining each other’s efforts, with some departments helping to fund the shift towards renewable energy sources while others are investing in the fossil fuel industries that renewable energy producers have to compete with.

And at the same time as encouraging developing countries to prioritise renewable energy, and contributing almost £6bn to its International Climate Fund, the UK Government is continuing to invest in fossil fuel industries in the very same countries.

The report authors said the Government investing in fossil fuels overseas while also spending billions trying to combat climate change was an “inconsistent” approach.

The UK must “urgently” phase out all public funding of coal, they added.

The data was released hours after Nigel Lawson, the former Conservative Chancellor and a vocal climate change denier, claimed it was ""not true"" that the UK subsidises fossil fuels.

""It's not true - we tax fossil fuels and we subsidise renewable energy,"" he told the BBC Today programme.

✕ Donald Trump doesn't believe in climate change

Green Party Co-leader Caroline Lucas said: ""These shocking figures show that Britain's overseas spending on energy is utterly skewed towards the fuels of the past. With air pollution and climate change posing a grave threat to the developing world Britain should be ploughing resources into clean energy - but instead we're paving the way for increased fossil fuel consumption and dirty air.

""Behind the Green veneer this Government has a rotten core when it comes to protecting our natural world. Britain should look to cut spending on fossil fuel projects and help communities in the global south embark on ambitious clean energy projects that empower people and provide them with power for years to come.""

Campaigners said the Government’s investment strategy was undermining international climate change efforts and attempts to help developing countries develop cleaner energy sources.

Dr Sarah Wykes, lead analyst on climate change and energy at CAFOD, said: “To tackle climate change we have to leave fossil fuels in the ground and switch rapidly to renewable sources of energy. Yet the UK carrying on a business as usual spending pattern overseas in recent years suggests a huge inconsistency in policy and a missed opportunity to promote greater investment in renewable technologies, as DFID has tried to do through its spending.

“It doesn’t make sense for there to still be any public money going into fossil fuels overseas, whether that’s through aid money, loans or export finance to support British companies operating overseas.”

“The Conservatives made manifesto commitments they would continue to lead international action against climate change and extreme poverty, but supporting fossil fuels overseas puts that leadership at risk at a time when international leadership is needed now more than ever on the Paris Agreement.”

Hannah Martin, Head of Energy at Greenpeace UK, said: ”The UK government has promised global leadership on climate change, yet it keeps using millions in taxpayers' money to bankroll fossil fuel projects all around the world. What's worse, many of these projects are in the same developing countries that are already bearing the brunt of climate change.

“This seems to be an acute case of the right hand not knowing what the left is doing, and it makes no economic or environmental sense. Renewable energy is booming, and Britain has done a lot of pioneering work on technologies like offshore wind. Instead of using public money to drive more climate change, ministers should use it to help Britain export clean technologies that can help tackle the problem while creating trading and employment opportunities that will last beyond the fossil fuel age.”

10 photographs to show to anyone who doesn't believe in climate change Show all 10 1 /10 10 photographs to show to anyone who doesn't believe in climate change 10 photographs to show to anyone who doesn't believe in climate change A group of emperor penguins face a crack in the sea ice, near McMurdo Station, Antarctica Kira Morris 10 photographs to show to anyone who doesn't believe in climate change Floods destroyed eight bridges and ruined crops such as wheat, maize and peas in the Karimabad valley in northern Pakistan, a mountainous region with many glaciers. In many parts of the world, glaciers have been in retreat, creating dangerously large lakes that can cause devastating flooding when the banks break. Climate change can also increase rainfall in some areas, while bringing drought to others. Hira Ali 10 photographs to show to anyone who doesn't believe in climate change Smoke – filled with the carbon that is driving climate change – drifts across a field in Colombia. Sandra Rondon 10 photographs to show to anyone who doesn't believe in climate change Amid a flood in Islampur, Jamalpur, Bangladesh, a woman on a raft searches for somewhere dry to take shelter. Bangladesh is one of the most vulnerable places in the world to sea level rise, which is expected to make tens of millions of people homeless by 2050. Probal Rashid 10 photographs to show to anyone who doesn't believe in climate change Sindh province in Pakistan has experienced a grim mix of two consequences of climate change. “Because of climate change either we have floods or not enough water to irrigate our crop and feed our animals,” says the photographer. “Picture clearly indicates that the extreme drought makes wide cracks in clay. Crops are very difficult to grow.” Rizwan Dharejo 10 photographs to show to anyone who doesn't believe in climate change Hanna Petursdottir examines a cave inside the Svinafellsjokull glacier in Iceland, which she said had been growing rapidly. Since 2000, the size of glaciers on Iceland has reduced by 12 per cent. Tom Schifanella 10 photographs to show to anyone who doesn't believe in climate change A river once flowed along the depression in the dry earth of this part of Bangladesh, but it has disappeared amid rising temperatures. Abrar Hossain 10 photographs to show to anyone who doesn't believe in climate change A shepherd moves his herd as he looks for green pasture near the village of Sirohi in Rajasthan, northern India. The region has been badly affected by heatwaves and drought, making local people nervous about further predicted increases in temperature. Riddhima Singh Bhati 10 photographs to show to anyone who doesn't believe in climate change A factory in China is shrouded by a haze of air pollution. The World Health Organisation has warned such pollution, much of which is from the fossil fuels that cause climate change, is a “public health emergency”. Leung Ka Wa 10 photographs to show to anyone who doesn't believe in climate change Water levels in reservoirs, like this one in Gers, France, have been getting perilously low in areas across the world affected by drought, forcing authorities to introduce water restrictions. Mahtuf Ikhsan

Of the UK money spent on fossil fuels overseas, 87 per cent (£2.5 billion) went to oil, gas or a combination of the two. A further 9 per cent (£240m) was spent on coal – the most polluting of all fuels.

The research also raises concerns about whether UK aid and investment is going to the countries that need it most.

Only 9 per cent of energy spending went to countries classed as “low-income”, while almost half (47 per cent) went to “upper middle-income” countries.

By far the biggest recipient of UK spending on energy was Brazil, where £1.6bn was spent. That was followed by Vietnam, Turkey and India. £206 million of UK money was spent on energy in Russia – the fifth biggest recipient of British energy spending.

Critics are also likely to question why more than a fifth of UK aid spending on energy is being spent on the highly polluting fuels that are responsible for climate change.

Experts said there should be no contradiction between spending on aid and investing in green energy, because renewable energy sources are generally cheaper and quicker to set up than fossil fuel sources, meaning they are of greater benefit to people living in poverty or in remote areas.

A Government spokesperson said: “The UK is a global leader in tackling climate change – we played a key role in securing the historic Paris Agreement and have helped 12 million people gain access to clean energy around the world through development assistance.

“Our priority is to help developing countries establish a secure and diverse energy supply, supporting their economic growth as part of the transition to a low carbon economy.”","Fri, 11 Aug 2017 07:00:00 GMT",https://static.independent.co.uk/s3fs-public/thumbnails/image/2016/11/04/08/oil-rig-shell.gif?width=1200&auto=webp&quality=75,"['fossil', 'spending', 'believe', 'abroad', 'spends', 'climate', 'doesnt', 'twice', 'change', 'photographs', 'uk', 'energy', 'renewable', 'fuels']", 
57,57,FL-2017-000108-BGD,"Children of Bangla, Prisoners of Partition | India's Frontier Villages - News18",https://www.news18.com/news/immersive/children-of-bangla-prisoners-of-partition-bengal.html,"[I]

[II]

One might get shot at if she ventures out night - Rehmat Bibi

[III]

CG Jora may look like a normal Indian village but this BSF manned settlement struggles to free itself from the shackles of constant scrutiny and dreams of a life beyond the shadow of cattle smugglers and not remain divided by a border fence. News18 travels deep within to unearth tales never heard before.

This place has not given us anything - Birajuddin

The government wants to relocate these dwellers to Panishala, an area 25 kms away from town which is surrounded by water bodies and forests. The flagship resettlement project is costing the government Rs 1,005 crore. “Somehow we have gotten used to living here. How will we survive when we move?” asks Shanti.Sapna says, “When we were in Bangladesh, we used to live close to the river. Every flood season, we lost children to the feisty river. Why will we want to live near a river again? …We are fine with our tin houses here. This is our home now.”It’s early in morning and Imran, a frail 14 years old, walks out of his tin house, donning a damp rugged shirt and brown trousers. He frantically searches his pocket for voter ID card. “This is first thing I check after getting up. One can forget his pant, but not the document,” he says with an animated smile.It takes about two hours to travel from Mekhligunj to Mashaldanga, another enclave settlement. Mashaldanga had been the focal point of enclave exchange in 2015. Imran and his friend agree to escort us till Chhoto Gorul Jora or CG Jora, the last Indian village on border.Cooch Behar town is dotted with enclave settlements and beyond these enclaves are a few villages, right at the border.The entry to CG Jora was an arduous task with Border Security Force (BSF) officers manning our movement. After spending hours at the BSF camp in Digaltari for permission to visit CG Jora, we were on a road both sides of which fell in Bangladesh.At first glance, CG Jora is like any other village in rural Bengal with huts that have thatched tiled roofs, banyan trees peeping from every corner and small fish ponds after every few houses. But beyond the usual flora and fauna, the barbed wire makes its presence felt.CG Jora, surrounded by Bangladesh on three sides, was fenced only a decade ago after the border fencing began in the mid-1980s. On the way to the village head’s house, a group of men sitting at the corridor of the only primary school rue about how the village has got eerily accustomed to the BSF rules.“Most of us work as contractual labourers in Bihar and Maharashtra. It is not possible to earn anything here. Most men have left the village and it’s only women, children and elderly who been left behind,” says Rahat Hussain, who works in Gaya and is at home to meet his family.The entry and exit to the village are manned by the BSF and what irks the villagers the most is the strict control over timings and food supplies. Rehmat Bibi, an octogenarian sits nonchalantly at the verandah of her mud house which overlooks a heap of meshed iron wire fencing. Married at the age of nine, she has been living at CG Jora since then.Bibi had been an expert swimmer when she was in Patgram in Bangladesh and it did help her when she came to CG Jora. “Previously there was no fencing. We could swim across to the other side or even take a boat. Fetching supplies for daily needs from Bangladesh was easier than sourcing them from Dinhata (India). But now things have changed. One might get shot at if she ventures out,” she says.Barely a few houses from Bibi’s, we see children climbing up an old dilapidated building with protruding iron rods from the bare walls. This is the secondary school of the village with two teachers and 150 students. Just next to the school is Moinudin Akram’s ration shop.Every morning Akram opens his shop along with three others in the village. But today he is a sad man. “I need to travel to Dinhata to get the supplies. Now the BSF does not allow us to purchase more than the specified limit. How long can the shop run with 5 kg sugar and 2 kg washing powder? And god forbid if we are late beyond 8 pm, then we have to spend the night outside our own village,” says Akram.BSF officials, however, say that such checks are necessary so that the essentials are not transported to Bangladesh.At Pradhan’s house we see a group of women waiting for the local physician, who doubles up as someone who can help people with government documents and approvals from the BSF. Birajuddin (name changed) looks quite unlike others from the village. Dressed in a t-shirt and jeans, the physician says the villagers are being deprived of a normal life.“Whenever someone is sick, they have to travel to Nazirhat which is 8 km away. Village gates are not opened after the official timings, sometimes even during medical emergency,” says Birajuddin.He points towards a barbed wire fence which cuts the village in two parts. Ironically, the territory on the other side is also in India but as per rules fencing is done 150 yards away from the international border. This means 80 Indian families stay on the other side of the fence.Several children, men and women often stick their heads out of the barbed fence to speak to their friends and relatives on this side. Razia Begum, who lives on the other side of the fence, usually comes on this side at permitted hours to work in her agricultural land.“Many of us have agricultural lands on the other side, but such restricted entry does not allow us to take care of our crops. Often the cattle destroy it and we are only mute spectators. Although we are Indians, every time we cross this fencing, we are made to produce identity cards and it is hell if there is an emergency at night,” says Razia.But for the BSF such restrictions are mandatory. When asked, BSF Commanding Officer Harish Kalja says often the jawans have to fight armed cattle smugglers at night. “As we cannot use weapons, we only have non-lethal means to fight them. But they attack us in huge numbers with anything from axe to knives. We can’t look the other way even for a minute,” says Kalja.Smuggling or not, the villagers feel helpless. “We hardly feel a part of India. If given a chance; we will happily relocate somewhere else. This place has not given us anything,” laments Birajuddin.","Mon, 14 Aug 2017 07:00:00 GMT",https://images.news18.com/static_news18/pix/ibnhome/news18/indias-frontier-villages/images/share/sharebengal.jpg,"['border', 'partition', 'village', 'bangla', 'prisoners', 'house', 'jora', 'cg', 'fence', 'night', 'children', 'bsf', 'fencing']", 
58,58,FL-2017-000108-BGD,The ‘Cajun Navy’ and the Spirit of Dunkirk - Wall Street Journal,https://www.wsj.com/articles/the-cajun-navy-and-the-spirit-of-dunkirk-1502403849,,"Thu, 10 Aug 2017 07:00:00 GMT",,[], 
59,59,FL-2017-000108-BGD,Ananta Jalil preaches on - Dhaka Tribune,https://www.dhakatribune.com/showtime/2017/08/16/ananta-jalil-preaches,"Famous Dhallywood actor Ananta Jalil last made headlines after his preaching antics at Dhaka’s Dhanmondi lake, on July 29. The actor was seen inviting his fans to join hands with him for the love of Islam at Rabindra Shorobar which was cut short since he did not ask for permission from relevant authorities regarding the gathering. Ananta’s sudden religious stance was also publicised by various international media outlets. However, the actor seems to be committed to Tabligji Jamaat after he recently announced his stay at a Naraynaganj mosque for the purpose of preaching Islam. Ananta confirmed on a Facebook post about his stay at the Baitul Aqsa mosque of Fatulla’s Enyaet Nagar from August 18 onwards. AJ also invited his fans to join him with a video message saying, “I am announcing the time and place of the Tablighi Jamaat for your convenience so that you can join me.” The actor also called for help for the people affected by the recent floods. “A severe flood has affected our country. Let’s help the affected people with all we have - let’s stand beside them,” he added.","Wed, 16 Aug 2017 07:00:00 GMT",https://eng-media.dhakatribune.com/?width=476&height=249&cropratio=16:9&quality=100&image=/uploads/2017/08/f30b7dd4930a00a2e61aa2e05f655b5e-5992e76c32d5c.jpg,"['islam', 'jalil', 'preaches', 'lets', 'mosque', 'join', 'jamaat', 'actor', 'stay', 'preaching', 'affected', 'help', 'ananta']", 
