,ID,event_id,article_title,article_link,article_content,publishing_date,article_image,article_keywords,article_relevance
24,24,FL-2020-000182-CHN,"Commentary: China's people-centered approach shield against floods, disasters - Xinhua | English.news.cn - Xinhua",http://www.xinhuanet.com/english/2020-08/20/c_139303100.htm,"Source: Xinhua| 2020-08-20 00:48:21|Editor: huaxia

Video Player Close

Chinese President Xi Jinping, also general secretary of the Communist Party of China Central Committee and chairman of the Central Military Commission, learns about local measures for flood control, disaster relief and post-flood production recovery at a ""zhuangtai,"" a residential structure on raised ground with higher elevation that functions as a safe haven from river floods, in Funan County in Fuyang, east China's Anhui Province, Aug. 18, 2020. (Xinhua/Ju Peng)

BEIJING, Aug. 19 (Xinhua) -- While visiting the flood-stricken residents in Funan County, east China's Anhui Province, Xi Jinping, general secretary of the Communist Party of China (CPC) Central Committee, said Tuesday that he has always been concerned about the people in flood-stricken areas.

Xi also checked the water situation of the Huaihe River and learned about local measures for flood control, disaster relief and post-flood production recovery during his inspection tour in the province.

As China experienced a particularly tough test in flood control this summer, coupled with small, scattered outbreaks of the COVID-19 epidemic, the authorities have pooled resources to concentrate efforts to safeguard people's lives and property.

Since the start of the flood season, China has allocated central budgetary funds for disaster relief totaling 1.155 billion yuan (about 167 million U.S. dollars) for regions hit by floods as of July 13.

To ensure ample manpower in the fight against the floods, the Chinese People's Liberation Army and the People's Armed Police Force joined in the flood control work, dispatching troops to 3,749 operations of flood relief and helping evacuate 137,000 residents affected by the floods as of July 28.

The key behind the country's strong actions to control the floods is its people-centered governing philosophy. In a meeting of the Standing Committee of the Political Bureau of the CPC Central Committee on July 17, Xi stressed putting people's lives and property first and taking more forceful measures to do a good job in flood control and relief work.





Rescuers help evacuate trapped people in Guanghan City, southwest China's Sichuan Province, Aug. 12, 2020. Heavy rain is continuing to wreak havoc in Sichuan Province, with tens of thousands of residents evacuated, houses damaged and roads blocked. (Xinhua)

To help flood-hit regions overcome difficulties, the country has established a mechanism that allows local authorities to apply for a part of budgetary disaster relief funds before the tallying of disaster losses is completed, making relief operations more timely and efficient.

""This can effectively reduce the number of people who die or disappear in disasters, and save people's lives and properties to a much better extent,"" said Yang Xiaodong, an official with the Ministry of Emergency Management.

Regarding flood victims in post-flood recovery, local authorities were required to enhance support for them in terms of epidemic control, life assistance, production, hygiene and compensation to restore production and life orders. Workshops and recruitment campaigns were launched by local governments to ensure those who have shaken off poverty will not fall back to poverty due to the floods.

China's governing capability combined with its people-oriented approach has acted as a double-layer shield with a great degree of strength and resilience against the threats of floods and disasters.

Statistics show that the number of people dead or missing due to the floods since July was 82 percent lower than the average for the same period of the past five years, while collapsed houses and direct economic losses dropped 78.3 percent and 5.9 percent, respectively.

During his inspection tour in Anhui, Xi stressed that the country must improve its capability to prevent and combat disasters in its effort to build a modern socialist country in an all-round way. As enhancing capacity on disaster prevention is expected to be included in more of the country's policies such as the 14th Five-Year Plan, the shield can only become stronger. ■","Thu, 20 Aug 2020 07:00:00 GMT",,"['peoples', 'chinas', 'xinhua', 'central', 'approach', 'flood', 'control', 'commentary', 'relief', 'disaster', 'local', 'disasters', 'province', 'floods', 'shield', 'xi', 'peoplecentered']", 
25,25,FL-2020-000182-CHN,"Torrential rains slam China's normally dry Gansu province, trapping over 10000 people - South China Morning Post",https://www.scmp.com/video/china/3097785/torrential-rains-slam-chinas-normally-dry-gansu-province-trapping-over-10000,,"Mon, 17 Aug 2020 07:00:00 GMT",https://cdn.i-scmp.com/sites/default/files/styles/700x400/public/d8/video/images/2020/08/18/gansumudslide.jpg?itok=XwWrwhdc,"['rains', 'torrential', 'gansu', 'slam', 'trapping', 'province', 'normally', '10000', 'dry', 'chinas']", 
26,26,FL-2020-000182-CHN,Yangtze River sees fifth flood of the year - China.org.cn,http://www.china.org.cn/china/2020-08/18/content_76609383.htm,"You are here: China

Yangtze River, China's longest, Monday recorded the fifth flood of the year in its upper reaches after a spell of heavy rainfall, the Ministry of Water Resources said.



The flood formed with a rapid increase of flow at Cuntan hydrologic station in southwest China's Chongqing Municipality. At 2 p.m. Monday, the station saw a water flow of 50,100 cubic meters per second.

The ministry has called on relevant authorities to strengthen monitoring and early-warning as well as flood prevention efforts in the Three Gorges reservoir and other main reservoirs.

The fourth flood was recorded on Aug. 14.","Tue, 18 Aug 2020 07:00:00 GMT",,"['yangtze', 'strengthen', 'recorded', 'ministry', 'station', 'chinaorgcn', 'flood', 'water', 'upper', 'flow', 'spell', 'fifth', 'sees', 'river', 'chinas']", 
27,27,FL-2020-000182-CHN,"Flooding at Home, Tensions Abroad Raise Concern for China’s Food Security - The News Lens International",https://international.thenewslens.com/article/139424,"By Shen Hua

Chinese President Xi Jinping has urged his country to take immediate actions to curb what he called its “shocking and distressing” food waste problem as the worst flooding along the Yangtze River in years threatens the country’s important rice crop.

In an instruction released last week, Xi urged the country to pay attention to the risks of food security, and highlighted the challenge the country faces as the coronavirus pandemic spurs concerns over tightening food supplies and surging prices.

Analysts who spoke to VOA say recent pressure on China’s food security is due to natural disasters at home and worsening relations with many of Beijing’s trade partners.

China’s food waste

A 2018 report by the China Academy of Science found China wasted up to 18 million tons of food served in four big cities in 2015 alone, enough to feed 30 to 50 million people annually.

The report said Chinese cities produce 25% of the world’s municipal solid waste, most of it food. Patrons of the country’s catering industry each wasted an average of 11.7 percent of their meal.

According to a 2015 estimate from the United Nations Food and Agriculture Organization (FAO), China wastes up to 35 million tons of food per year. That’s nearly 6% of the country’s annual food production.

The FAO estimates that about one-third of all food produced gets lost or is wasted during production, transportation and consumption. However the situation is different in each country.

Photo Credit: Reuters / TPG Images People dine at the Quanjude Peking roast duck restaurant, following the Covid-19 outbreak, in Beijing, Aug. 18, 2020.

Who’s wasting food in China?

In Chinese society, people usually treat others to meals in order to make new friends or enhance established relationships, and serving expensive and rare food is considered a form of respect for guests. According to a 2015 study , a formal dinner typically includes four to six cold dishes and eight to 10 hot dishes, served with soup and fruits.

Zhong Dajun, director of the Beijing Dajun Institute for Economic Observation, told VOA that the wasting of food has been increasing over the years as people gained more disposable income.

“I think compared to the general public, officials dining with public funds account for only a small proportion,” he said. “With strong spending power, Chinese people have to pay attention to frugality and saving food.”

Preparing or ordering more food than necessary has long been regarded as a symbol of hospitality in China. Zhu Qizhen, a professor at China Agricultural University, told the South China Morning Post that because of this tradition, “the amount of leftovers has become the standard for a sumptuous feast.”

Yet political commentator Heng Hei said one of the main problems with the country’s food waste problem is linked to the lavish excesses of the Chinese Communist Party.

“This level of food wasting has to do with CCP’s extravagant culture. Ordinary Chinese people don’t waste to that level,” he said.

In a survey by China’s state newspaper Beijing Youth Daily in 2013, a shocking 97.8% of respondents felt that Chinese officials were wasting public funds. Of those funds, 33.8% were used for official receptions , including extravagant dining.

President Xi subsequently launched an anti-corruption campaign as a means to curb extreme levels of corruption. Yet analysts point out this is also an effective way to get rid of his political enemies. China also launched the “Clean Your Plate Campaign” in 2013, which aimed to “put an end to officials’ extravagant feasts and receptions, according to state media Global Times.

Food security

China’s leader Xi has long tied the country’s food security to national security. In a visit to the country’s largest soybean producer — Heilongjiang province — in 2018, Xi said ""the rice bowl of the Chinese people, in any situation, must be firmly held in our own hands.""

Yet 2020 has delivered a one-two punch to the world’s second largest economy.

The country is experiencing the worst flooding in more than two decades, destroying thousands of acres of farmland along the Yangtze River. With the nickname “Land of Rice and Fish,” the broader Yangtze River basin accounts for 70% of China’s rice production.

Given how much cropland was damaged by mid-July, Chinese brokerage firm Shenwan Hongyuan estimated that China could lose 5% of its rice production compared to last year.

Photo Credit: China Daily via Reuters / TPG Images A worker wearing a face mask works on a production line manufacturing soybean-based food products at a factory in Hefei, Anhui province, China, February 4, 2020.

China’s National Food and Strategic Reserves Administration issued an announcement on August 5, pointing out the country’s wheat harvest has fallen by nearly 1000 tons compared to 2019 levels.

According to China’s National Bureau of Statistics, food prices in China climbed about 10% in July compared to a year ago, with the price of corn 20% higher compared to the same period last year. The prices for soybeans jumped by 30% compared to the end of last year.

Beijing has responded to the crisis by stabilizing supply from its strategic reserve. According to China Grain Reserves Group, Beijing has released 62.5 million tons of rice, 50 million tons of corn and over 760,000 tons of soybeans by the end of July, a level nearly double the volume released during the whole of 2019.

Meanwhile, China’s worsening relations with some of its major trade partners could create uncertainty for China’s food supply chain. For example, the country has been relying on imports from the U.S. to try to stabilize prices as well as fulfill its commitment to purchase U.S. agricultural products.

In the first six months of this year, China imported nearly 61 million tons of grain, a 21% jump from a year ago. Imports of corn, soybeans, and wheat have also increased, according to data from Chinese customs.

Analysts caution that an overdependence on food imports could hurt Beijing’s strategic interest. Meanwhile, the continuing political tensions with Western countries could lead to trade barriers such as higher taxes, raising prices and further threatening the country’s food security.

Economist Zhong Dajun said China has to import as least 100 million tons of crop every year, and “it will be pretty troublesome for Beijing to increase the production by that amount domestically.”





The News Lens has been authorized to publish this article from Voice of America.

READ NEXT: Taiwan Plans to Shift Medical Supply Chain Away from China

TNL Editor: Daphne K. Lee (@thenewslensintl)

If you enjoyed this article and want to receive more story updates in your news feed, please be sure to follow our Facebook.","Wed, 19 Aug 2020 07:00:00 GMT",https://image1.thenewslens.com/2020/8/rqufgqp1zr2pa47s26rdbktfm4t20g.jpeg?h=628&w=1200,"['tensions', 'chinese', 'countrys', 'rice', 'chinas', 'security', 'tons', 'abroad', 'china', 'compared', 'food', 'flooding', 'xi', 'raise', 'million', 'concern']", 
28,28,FL-2020-000182-CHN,China faces flood ruin as companies shut shop - WION,https://www.wionews.com/world/china-faces-flood-ruin-as-companies-shut-shop-321551,"The Chinese dream seems to be edging closer to collapse with allegedly more than two million companies shutting shop and millions being forced to leave their homes due to floods.

Amid the chaos, China could be now running short of food.

Three companies - Huawei, ZTE and Tiktok have been banned in different corners of the world and Beijing has been fighting tooth and nail against the bans. Chinese diplomats protest every week in front of the global press but they make no mention of how businesses are shutting down in China.

A report went viral on China’s favourite messaging app WeChat which claims that more than two million companies have closed down in China this year.

In Jiangsu province one out of every 10 companies has closed, similarly in Guangdong several thousand companies could have gone out of business. However, it is not the only problem that China has been trying to brush under the carpet. After the Wuhan virus, a series of environmental disasters is killing more jobs.

China is dealing with its worst flooding in decades. According to one estimate, 3.7 million people have either been displaced or have been evacuated from their homes. Northwest China is among the worst-hit regions. It is witnessing one disaster after another with floodwaters yet to recede in several parts.

A mudslide struck a village with the rain triggering landslides on freeways. The floods could lead to a food shortage, already Xi Jinping has announced a clean your plate campaign which is a frugality drive to avert a food crisis.

Restaurants in Beijing have been complying with the president’s orders. These are troubled times for China and there's another storm brewing typhoon ‘Higos’ which has been moving towards southern China even as President Xi Jinping is busy claiming foreign lands.","Tue, 18 Aug 2020 07:00:00 GMT",https://cdn.wionews.com/sites/default/files/styles/story_page/public/2020/07/18/150447-china-floods-2020.jpg,"['shut', 'ruin', 'shop', 'million', 'chinese', 'closed', 'china', 'flood', 'shutting', 'homes', 'jinping', 'food', 'faces', 'xi', 'companies']", 
29,29,FL-2020-000182-CHN,Chongqing hit by worst flood in 40 years; 250000 relocated - The Straits Times,https://www.straitstimes.com/asia/east-asia/chongqing-hit-by-worst-flood-in-40-years-250000-relocated,"CHONGQING • The Yangtze River's water level in Chongqing municipality exceeded a historical high yesterday morning, posing an unprecedented threat to the metropolis in south-west China.

Around 8am yesterday, the water level at the Cuntan hydrologic station in Chongqing reached 191.55m - 14cm higher than the record in 1981 - and was still rising.

Chongqing, located in the upper reaches of China's biggest river, upgraded its flood-control response to Level I on Tuesday, the highest rung in the country's four-tier emergency response system for floods.

At least 250,000 Chongqing residents have been relocated to safe places.

According to the Chongqing Emergency Response Bureau, the water level at Cuntan was higher than the devastating flood which left 1.5 million people homeless in 1981.

More than 8,660 sq km of arable land was flooded.

The direct economic loss caused by the floods was about two billion yuan.

Since Monday, Chongqing, which is located in the upper Yangtze watershed, has been hit by heavy flooding for the fifth time this year due to heavy downpours in the upper Yangtze region.

Meanwhile, in Hubei province - Chongqing's eastern neighbour-the authorities warned that the Three Gorges reservoir in the province would see the most severe round of floods since it started to hold water in 2003.

According to a forecast by the Changjiang Water Resources Commission of the Ministry of Water Resources, the inbound flow of water is expected to reach more than 74,000 cubic m per second after continuous heavy rain battered the upper reaches of the Yangtze River.

The river flows for 6,300km from glaciers in the Qinghai-Tibet Plateau through Chongqing, and then to Wuhan in Hubei province and Nanjing in Jiangsu province, before reaching the East China Sea at Shanghai.

The Three Gorges project is a multi-functional water-control system consisting of a 2,309m-long and 185m-high dam, a five-tier ship lock on the north and south, and 34 turbo-generators with a combined generating capacity of 22.5 million kilowatts.

The Chinese government has earmarked 460 million yuan (S$91 million) for flood relief in the Sichuan, Shaanxi, Gansu and Chongqing regions, the Ministry of Emergency Management said on Wednesday. The funds would be used for flood control, emergency rescue and post-disaster reconstruction in the affected areas.

The Chinese government has earmarked 460 million yuan (S$91 million) for flood relief in the Sichuan, Shaanxi, Gansu and Chongqing regions, said the Ministry of Emergency Management on Wednesday.

The funds would be used for flood control, emergency rescue and post-disaster reconstruction in the affected areas.

The ministry said it has sent a team of 500 disaster-relief professionals to Sichuan to aid in local flood control and emergency rescue work.

XINHUA, CHINA DAILY/ASIA NEWS NETWORK","Fri, 21 Aug 2020 07:00:00 GMT",https://static.straitstimes.com.sg/s3fs-public/styles/x_large/public/articles/2020/08/21/ST_20200821_FLOOD21_5902997.jpg?itok=F_uB4xgf,"['yangtze', 'level', 'ministry', 'chongqing', 'flood', 'water', 'hit', 'upper', '250000', 'province', 'relocated', '40', 'million', 'worst', 'emergency']", 
30,30,FL-2020-000182-CHN,Clean-up work underway in flood-hit northwest China - South China Morning Post,https://www.scmp.com/video/china/3098633/clean-operation-underway-flood-hit-village-heavy-rains-hit-northwest-china,,"Mon, 24 Aug 2020 07:00:00 GMT",https://cdn.i-scmp.com/sites/default/files/styles/700x400/public/d8/video/images/2020/08/24/web_clean_up_zhouqu.jpg?itok=OBgQ94Z0,"['northwest', 'rains', 'floodhit', 'china', 'village', 'hit', 'cleanup', 'operation', 'underway', 'heavy']", 
31,31,FL-2020-000182-CHN,China braces for heavy rains from Typhoon Higos while Yangtze River swell triggers flood alert - The Straits Times,https://www.straitstimes.com/asia/east-asia/china-braces-for-heavy-rains-from-typhoon-higos-while-yangtze-river-swell-triggers,"HAIKOU/SHANGHAI (XINHUA, REUTERS) - Typhoon Higos is expected to bring torrential downpours to regions in southern China in the following days, even as the rain-swollen Yangtze River triggers an unprecedented flood alert.

A tropical depression in the north-east of the South China Sea intensified into a typhoon at around 8am on Tuesday (Aug 18), according to the meteorological department of Hainan Province.

The typhoon will land in coastal areas on Wednesday, including locations in the western part of Guangdong and those in the north-eastern part of Hainan.

Provinces of Hainan, Guangdong, Yunnan and Guangxi Zhuang Autonomous Region will have torrential rain starting from Wednesday, the meteorological department said.

The emergency management department of Hainan has issued a typhoon alert, warning that fishing boats and other vessels should return to harbours.

Meteorologists also alerted the affected areas to take preventive measures and guard against secondary disasters. Tourists have been advised not to go out when heavy rain and gales hit the areas.

Meanwhile, China's biggest river, the Yangtze, and several of its tributaries have risen to dangerous levels after days of heavy rain, forcing tens of thousands of people from their homes and triggering an unprecedented emergency response alert.

China has seen unusually high levels of rain this flood season, with the south-west and central regions in the Yangtze River basin bearing the brunt of flooding.

The Ministry of Water Resources said on Monday that 38 tributaries on the upper reaches of the Yangtze were now higher than their warning levels, 19 dangerously so.

Related Story Beijing on standby for biggest rainstorm this summer, closing parks and tourist sites

Related Story After 500 years trying to tame fatal floods, China tries a new way

Related Story Traditional gongs, loudspeakers still effective flood warning methods in rural China

Related Story No typhoon in China in July for the first time since 1949 as long, hot summer continues

The south-western province of Sichuan, which includes a major upstream section of the Yangtze, has raised its flood emergency response to its highest level, the first time it has ever done so, with its rivers overflowing and villages and farmland inundated.

The Qingyi river, an upper Yangtze tributary, had seen its worst flooding in a century, Sichuan's flood control authority said, with the city of Ya'an forced to evacuate more than 36,000 people as the river burst its banks on Monday.

The Yangtze and Huai river basins have seen the highest level of rainfall since records began in 1961, officials have said. As many as 634 rivers throughout the country have exceeded their official flood warning levels.

By last week, 63 million people had been affected by floods, 12.7 per cent higher than the average over the past five years, said Mr Zhou Xuewen, vice-minister at the Ministry of Emergency Management.

The cost of direct economic damage reached 179 billion yuan (S$35 billion), 15.5 per cent higher than the five-year average, he added.","Tue, 18 Aug 2020 07:00:00 GMT",https://static.straitstimes.com.sg/s3fs-public/styles/x_large/public/articles/2020/08/18/tl-yangtze-a-180820.jpg?itok=fcQ9Zsty,"['yangtze', 'swell', 'rains', 'rain', 'triggers', 'heavy', 'flood', 'china', 'typhoon', 'higos', 'seen', 'levels', 'warning', 'river', 'emergency']", 
