,ID,event_id,article_title,article_link,article_content,publishing_date,article_image,article_keywords,article_relevance
24,24,FL-2016-000064-CHN,"Indonesia: Floods, landslides kill 35 in Central Java - CNN",https://www.cnn.com/2016/06/19/asia/indonesia-central-java-landslides/index.html,"Story highlights At least 25 people remain missing

Landslides and floodwater bury dozens of homes

Jakarta, Indonesia (CNN) At least 35 people have died after heavy rains and floods triggered landslides in the Indonesian province of Central Java.

The landslides buried dozens of homes, and floodwaters inundated thousands of houses, said Sutopo Purwo Nugroho, spokesman for the Indonesian Disaster Management Agency.

Of the 35 killed, 31 died in landslides and four died in the flooding. An additional 25 people remain missing, the disaster management agency said.

Indonesian villagers prepare for the funeral of a landslide victim in Banjarnegara on Sunday.

Heavy rains drenched several areas for much of Saturday, causing flooding and landslides in 16 towns and cities across the province.

The Bogowonto River in Purworejo also swelled due to floodwater.

Read More","Sun, 19 Jun 2016 07:00:00 GMT",https://cdn.cnn.com/cnnnext/dam/assets/160619135447-indonesia-central-java-floods-2-super-tease.jpg,"['indonesia', '35', 'central', 'management', 'java', 'heavy', 'landslides', 'kill', 'died', 'flooding', 'rains', 'indonesian', 'remain', 'disaster', 'dozens']", 
25,25,FL-2016-000064-CHN,China’s Internet Boom - MIT Technology Review,https://www.technologyreview.com/2016/06/21/7978/chinas-internet-boom/,"It’s tempting to portray the rapid growth of the Chinese Internet as just one more example of China’s efforts to catch up with the West: Alibaba is the eBay of China, Baidu is the Google of China, Didi is the Uber of China, and so on. But China is actually conducting some fascinating experiments with the Internet (see “The Best and Worst Internet Experience in the World""). You just need to look outside the tech sector to notice them.

The most significant innovation is happening not among Chinese Internet companies but in the country’s so-called “real” economy. Corporations in old-school sectors like construction, agriculture, transportation, and banking are pursuing new business models based on big data, social media, and the Internet of things.

These are some of the largest firms of their kind in the world, yet many are young enough to be helmed by their original owner/founders. They’re like ­Rockefeller, Ford, or Carnegie with access to smartphones.

So it’s China’s largest residential-­property developer—not a tech company—that is pioneering the integration of Internet-based technology and services into fully wired communities. Vanke wants to create urban hubs that supply residents with gardens, safe food, travel, entertainment, and medical and educational services, all enabled by the Internet.

China’s insurance and banking industries have also embraced the Internet. Firms like Ping An Insurance recognized early on the opportunity to build customized models for risk assessment based on information gleaned from 24/7 tracking of physical and online activities.

Regulatory and finance structures in the West militate against this kind of experimentation, but China’s corporate culture encourages the broad reach. Asia specializes in big-tent conglomerates with protean areas of interest: a boat maker goes into semiconductors; a snack vendor might have an automotive division. In China, every big company can be an Internet, software, or device company, too.

China’s tech companies are similarly uninhibited. Xiaomi, a handset manufacturer, has taken a global leadership position in deploying the Internet of things. Tencent founded the online-only WeBank, which analyzes data from hundreds of millions of WeChat users to assess risk and extend small consumer loans without loan officers or physical branches. Alibaba is using its unprecedented knowledge of small business to provide financial services with an information advantage that no traditional bank has.

If Google did banking, these would doubtless be called the “Chinese banks of Google.” But it doesn’t—that’s the point. Information, entertainment, retail, and communication were the easy plays for U.S. companies, the real-economy sectors that the Internet could infiltrate without too much trouble. Chinese companies will be first to bring the Internet to the other realms of life and industry.

Then the West could be playing catch-up with the East.

Edward Jung is the founder and chief technology officer of Intellectual Ventures.","Tue, 21 Jun 2016 07:00:00 GMT",https://www.technologyreview.com/2016/06/21/7978/chinas-internet-boom/static/media/favicon.1cfcdb44.ico,"['chinese', 'information', 'china', 'boom', 'west', 'services', 'companies', 'google', 'internet', 'chinas', 'tech']", 
26,26,FL-2016-000064-CHN,Chinese economy vulnerable to shocks - IMF - Deutsche Welle,https://www.dw.com/en/chinese-economy-vulnerable-to-shocks-imf/a-19328707,"Although China grew at its slowest pace in a quarter century last year, the IMF said in a report that its near-term growth outlook for the world's second largest economy had turned more buoyant due to recent policy support.

As a result, China's economy was expected to grow by around 6 percent in 2017, the global emergency lender said in its China Review published on Tuesday.

However, as China was facing weak demand at home and abroad, the IMF said the medium-term outlook was ""more uncertain"" due to ""rapidly rising credit, structural excess capacity, and the increasingly large, opaque, and interconnected financial sector.""

The review was compiled by the IMF's first deputy managing director David Lipton, who said at the end of his visit to China that Beijing must address these vulnerabilities by decisively implementing ""pro-active and comprehensive"" policies in a number of sectors.

""Corporate debt, though still manageable, is high and rising fast,"" Lipton said, adding that solving the problem was imperative to avoid serious problems in future. For that, it was necessary to harden budget constraints, especially for state-owned enterprises, as well as to restructure or liquidate weak firms. The associated social costs must be addressed by the state, he added.

Need for fiscal reforms

In its report, the IMF also highlighted the need to align local government revenue and expenditure responsibilities, expand social security, implement new budget laws and make the tax system more progressive.

The IMF suggested implementing a carbon or coal tax, which would significantly reduce China's serious air pollution problem and could prevent between four and five million premature deaths in 2030.

In addition to fiscal reform, the IMF's David Lipton said China needed to guard against growing risks in its increasingly complex financial system by increasing coordination between different regulators and markets and strengthening funding resilience for both banks and other financial institutions.

Turning to China's foreign exchange policy - a concern for many investors after a surprise yuan devaluation last year - Lipton lauded regulators, saying exchange rate policy was becoming ""more flexible and market-based"". He encouraged China to set ""a goal of achieving an effective float within the next couple of years.""

Lipton also noted China had improved its data and communication of policies to markets and the public, and said further improvement would help China with its economic transition.

uhe/jd (Reuters, IMF China Review)","Tue, 14 Jun 2016 07:00:00 GMT",https://static.dw.com/image/18619354_6.jpg,"['review', 'tax', 'chinese', 'economy', 'lipton', 'imf', 'china', 'system', 'policy', 'financial', 'weak', 'vulnerable', 'chinas', 'shocks']", 
27,27,FL-2016-000064-CHN,Groundwater Pumping Sinks Beijing Region at Increasing Rate - Circle of Blue WaterNews,https://www.circleofblue.org/2016/world/groundwater-pumping-sinks-beijing-region-increasing-rate/,"Satellite data reveal the depths of the megacity’s thirst.

By Brett Walton, Circle of Blue

Beijing, one of the world’s most water-scarce large cities, has long drawn on groundwater reserves to supply more than 20 million people. The unrelenting pressure for water, though, is causing the land to shift and sink and buckle, which puts subway and high-speed rail lines, buildings, and other infrastructure at risk of damage.

If the region’s water-related land shifts, technically known as “subsidence,” go unchecked, severe consequences could be in store. Scientists at a railway engineering laboratory at Beijing Jiaotang University concluded in a September 2015 study that groundwater pumping must be restricted near completed high-speed rail lines and that new wells near the lines should be prohibited.

The trains, which reach speeds of more than 300 kilometers (186 miles) per hour, require stable tracks to keep the cars from derailing. The high-speed lines from Beijing to Shanghai and Beijing to Tianjin, a heavily populated port city, both pass through the Chaoyang subsidence zone east of Beijing. The researchers said that continued subsidence will have a “strong impact on the safety of train operation.”

According to satellite measurements, the Beijing region is sinking at an increasing rate as the soil of the North China Plain, like a sponge wrung dry, compacts around depleted aquifers. The data were published earlier this month in the journal Remote Sensing.

A common symptom of voracious groundwater use, subsidence is taking a toll on the world’s largest urban areas. More than 50 Chinese cities are grappling with uneven soils. In Southeast Asia, Bangkok, Ho Chi Minh City, and Manila are all sinking. Parts of Jakarta, the Indonesian capital, are dropping as rapidly as Beijing’s Chaoyang district.

Subsidence is a problem in the Americas, too. Mexico City is infamous for fractured building foundations that are a hallmark of sagging land. The industrial corridor along the Mississippi River Delta outside New Orleans is settling, increasing the flood risk, according to a NASA analysis published last month. In California’s Central Valley, where aquifer levels dropped to record lows recently because of drought-induced pumping, bridges and canals are cracking under the strain of subsiding soil.

Beijing’s Unstable Ground

Subsidence is “relatively minor” in Beijing’s center, averaging 10 millimeters (0.4 inches) per year between 2003 and 2011, according to researchers. But in Beijing’s eastern, outlying districts the problem is much worse. Parts of Changping, Shunyi, and Tongzhou experienced subsidence rates that were six to eight times higher. The deepest depression is in Chaoyang, where the maximum rate reached 110 millimeters (4.3 inches) per year.

Subsidence was first documented in the Beijing region in 1935, and numerous studies since then have connected the collapsing land to a rise in groundwater pumping. As much as two-thirds of the region’s water supply comes from groundwater. The Remote Sensing study used InSAR, which is a type of radar that monitors land elevation changes, and well data to look more closely at the geological factors that result in different rates of decline.

A number of factors are at play, including tectonic fault lines, soil types, and the location of groundwater wells. The researchers found that subsidence increases closer to wells and it increases in clay soils, which are finer-grained and thus more compactable — more like Play-Doh than beach sand.

Aquifers with larger soil particles tend to be more “elastic,” meaning that subsidence can be partially reversed when more water is stored. The researchers found such an example in one of the observation wells they used to check the satellite data. The vast majority of wells, however, were not elastic. The ground is permanently altered and the water-storing capacity of the aquifer is forever diminished.

Roberto Tomas, a study co-author and an engineering professor at the University of Alicante, in Spain, told Circle of Blue that a high rate of subsidence does not necessarily cause the most damage. What is important, he said is uneven subsidence.

“If part of a building settles and the other part is stable or presents a lower settlement, then the building suffers a distortion that causes internal stresses that can damage it,” he explained.

Tomas said that his research group is now conducting an analysis of how subsidence in the Beijing region is affecting critical infrastructure. That paper should be published by the end of the year, he said.","Wed, 15 Jun 2016 07:00:00 GMT",https://www.circleofblue.org/wp-content/uploads/2016/06/2011-12-China-Beijing-Choke-Point-AJaffe-IMG_9900-1030x687.jpg,"['lines', 'water', 'sinks', 'pumping', 'subsidence', 'region', 'study', 'groundwater', 'increasing', 'beijing', 'wells', 'rate', 'data', 'land', 'researchers']", 
28,28,FL-2016-000064-CHN,Entrepreneur overcame hardships of Chinese prison - Houston Chronicle,https://www.houstonchronicle.com/business/article/Houston-businessman-overcame-hardships-of-Chinese-8313857.php,"Businessman Jude Shao spent a decade in a Chinese prison, uncertain when he'd be let go, and then was barred from leaving Shanghai for five more years.

""We were a high-profile American company selling the Chinese products, and we attracted government attention,"" he says by way of explanation.

Shao, Shanghai-born but a U.S. citizen at the time of his arrest, was not allowed to return to this country until 2013. Today, the Stanford Graduate School of Business alumnus is in Houston, where he founded Sky Blue Butane, the only American company to manufacture butane fuel canisters.

Success in the Texas venture would bring both personal and professional satisfaction for Shao.

""If I prove myself successful in business, prove myself ethical in business, I prove they were wrong,"" he said recently at the company headquarters in an industrial area near Hobby Airport.

Shao, 54, came to the United States in 1986 to study educational technology at Rhode Island College. He later earned a master's degree at Stanford and began splitting his time between San Francisco and Shanghai, where he ran a company exporting U.S. medical imaging equipment to China. He became a naturalized U.S. citizen in 1997.

He was among the first class of expatriates to try their hand at business in China, as the country's economy began to take off after years of strict central control. His business grew quickly until Shanghai officials came knocking at his door. Shao told tax auditors they could see the books, but after that he locked the door and refused to cooperate or pay a $50,000 bribe, he says.

His refusal, he says, landed him in more trouble with the authorities. They accused him of tax evasion and detained him at the Shanghai airport when he arrived on a flight from the United States.

Shao's staff called the U.S. Consulate when he didn't show up to work.

""Because I'm not white, I'm Chinese just like them, they didn't know they were holding an American citizen,"" Shao said. ""By that time it was too late. They were playing hardball.""

'A political chip'

For more than two years, Shao was held incommunicado. Eventually, he was convicted during a trial for which he couldn't prepare any defense and moved to a prison Shanghai uses for foreigners, which is separate from and nicer than the prisons for native-born Chinese inmates. There, he was able to communicate with the U.S. Consulate once a month and with his family still living in Shanghai.

His 1993 Stanford classmates began to advocate for him from the United States, completing a full Chinese audit of his company to prove the charges were meritless. Shao's case grabbed the attention of the Wall Street Journal. The State Department would occasionally tell reporters they were getting close to freeing Shao.

But every time the two countries seemed close to a deal, a setback in U.S.-China relations would stall the process. In 2001, a U.S. spy plane collided with a Chinese fighter jet, sparking an international dispute. In 2006, President George W. Bush refused to hold a state dinner for Chinese President Hu Jintao.

""I became a political chip,"" Shao said.

Shao was finally released weeks before the 2008 Olympics began, on the condition that he would stay in Shanghai for another five years and not talk to reporters about his case. Officially, he was charged with tax evasion and sentenced to 16 years in prison.

""His was one of the first really high-profile cases of a naturalized U.S. citizen of Chinese descent going back to the mainland, doing business and being detained and prosecuted,"" said Sophie Richardson, China director for Human Rights Watch. ""It was a surprise to the U.S. business community.

""The general expectation at that time was that expatriate businesspeople would be immune from the same kinds of questionable prosecutions and investigations that were rampant across the mainland. His was one of the first cases to show it didn't matter what passport you had, you could still be quite vulnerable.""

Shao's decade behind bars left him more determined than ever to succeed in business. After spending some time readjusting to American life, he began working as security analyst in Washington, D.C., where he researched Chinese manufacturing companies and monitored trends in the U.S. oil market.

Korea competitors

Around that time, Shao's friends held a dinner to welcome him back to the U.S. The meal was a traditional Chinese hot pot, whose preparation requires the use of a canister. In the midst of his work researching Chinese manufacturing, Shao noticed that the canister was made in Korea.

""That clicked,"" Shao said. ""Why are we importing Korean butane gas canisters when American oil prices are going to go down?""

As soon as oil prices slipped, Shao took action. He ran a feasibility study and set up a 14,000-square-foot factory in southeast Houston in April 2014. His Stanford classmates invested in the business.

Today, the factory employs seven workers on the butane canister line. Many of their products are made for Coleman, the camping company. They are sold across the U.S. and as close by as the local Target and Wal-Mart. Some are exported to Canada.

The pitch to buyers is simply that it costs less to produce the fuel canisters in the U.S., especially in Houston. Domestic regulations surrounding production of butane fuel canisters are more stringent than in other countries, leading to a higher quality product, Shao says. The company sources its butane gas from domestic suppliers.

Sky Blue Butane isn't aiming to take over the global butane canister market, which is dominated by three Korean companies, but to supply the relatively modest North American market. Of 500 million cans of butane gas consumed annually worldwide, the U.S. accounts for 20 million.

Right now, the plant is producing 3.6 million cans of butane gas a year, or nearly 20 percent of the U.S. market. Sky Blue Butane is planning to open a second factory in Houston within the next year.

Shao's eagerness to dive back into business after so much hardship motivates other Houston entrepreneurs.

""For the Asian community, it's inspiring,"" said Linda Toyota, president of Houston's Asian Chamber of Commerce.

Shao runs the business with help from Blake Turner, a recent Rice University graduate who serves as his chief operating officer. Turner appreciates the opportunity to help build a unique U.S. company.

""It's very rare to get the chance to help build an American manufacturing business in this day and age,"" he said.

For Shao, Sky Blue Butane is a way to succeed in a niche American market, and to show that his years behind bars didn't dull his business sense.

""I want to prove my business acumen is still there,"" Shao said. ""We're on track. If I prove the concept is right, that's my goal.""","Mon, 20 Jun 2016 07:00:00 GMT",https://s.hdnux.com/photos/47/57/36/10418088/9/rawImage.jpg,"['shanghai', 'chinese', 'business', 'butane', 'prove', 'prison', 'houston', 'company', 'began', 'american', 'overcame', 'shao', 'hardships', 'entrepreneur']", 
29,29,FL-2016-000064-CHN,Damming the Nam Tha in Northern Laos - The Diplomat,https://thediplomat.com/2016/06/damming-the-nam-tha-in-northern-laos/,"The Maya shopping mall and electric wires in Chiang Mai, northern Thailand, 2016. In Thailand, much imported electricity is used for air conditioning in shopping malls. (See Ian Baird, “Rescaling and Reordering Nature–Society Relations: The Nam Theun 2 Hydropower Dam and Laos–Thailand Electricity Networks,” for an analysis of the relationship between hydropower in Laos and air conditioning in Thai shopping malls.)

The official publicity image of the Nam Tha dam . A sign with this image was posted at the entrance to the dam access road on National Highway 3.

Girls brought in to work as prostitutes in a shop at the dam construction site, 2016. When I stopped here to ask for water, the Laotian proprietress pointed at the girls and said (in English), “Papaya, papaya,” a euphemism for sexual intercourse in Laos.

A Khmer worker hired from Cambodia to work as a cement truck driver, 2016. Similarly, in China, workers are often transported from distant provinces to work on state development projects, such as the series of dams on the upper Mekong in southwest China.

The Nam Tha flowing through a diversion tunnel so that the dam can be constructed in the river’s path, 2016.

Navigating the Nam Tha, at the dam site in 2014. The karst cliff formation on the right is visible in the following photo.

A local market on the Nam Tha, which sells goods from Thailand (downstream) and China (upstream), 2014. Solar panels were one of the most popular products at this market.

A village on the Nam Tha, 2014. Many villages in Laos are not accessible by road, but only by rivers.

Advertisement

The Nam Tha, or Tha River, begins in northern Laos near the Lao-China border and runs southwest to join the Mekong just south of Huay Xay on the Lao-Thai border. In October 2014, I traveled by motorcycle and longtail boat up the Nam Tha, starting from its mouth at Pak Tha, to investigate a dam project on the river. Work on the dam’s access roads and other infrastructure had been underway for months, but no signs of construction were visible as I traveled—the banks were thickly forested, interspersed with patches of swidden agriculture, with occasional thatch villages where I stayed along the way.

The Nam Tha dam is being built by a subsidiary of the China Southern Power Grid, and 95 percent of the electricity it generates will be sold to Thailand. Scheduled to be completed in 2017, the dam will displace over 10,000 ethnic Lao and minority peoples, and during my visit the village Ban Hadmuark was being enlarged into a resettlement town for displaced villagers. (For details on the demographic impacts of the dam, see Olivier Evrard’s article “The Silenced River.”)

In February 2016 I returned to the Nam Tha to document the progress of the dam. This time I hitchhiked with a work truck driving in on the 37 kilometer access road from National Highway 3. I was stunned to discover that this stretch of the river had been transformed into a vast industrial plain, razed flat and crowded with cement trucks, lorries, earth movers, turbine parts, and scrap metal.

This photo essay starts with the Nam Tha as I experienced it in 2014, then switches to the way I encountered it in 2016. However, these images don’t convey the sense of violence that struck me when I entered the dam site a year and a half after seeing it in a nearly pristine state—the machinery, noise, ravaged hillsides, and clouds of dust raised up by gravel crushers, seemed limitless, on a scale to dwarf human individuals, communities, and aspiration.

Still, I hope these images serve in a small way to express the experience of peoples who have no voice or agency in the face of changes imposed upon them by international corporate interests and by their own governmental elite. Any form of protest can lead to police abduction and disappearance for Lao nationals in Laos—therefore, along with the advocacy of NGOs like International Rivers, this type of documentation may currently be one of the only means of dissent against hegemonic “development” which uproots and disenfranchises many for the benefit of a privileged, autocratic few.

Enjoying this article? Click here to subscribe for full access. Just $5 a month.

Thanks to my friend Preedawan for serving as my guide and translator on the Nam Tha in 2014.

Scott Ezell is an American poet and multi-genre artist with a background in China and Southeast Asia.","Sat, 18 Jun 2016 07:00:00 GMT",https://thediplomat.com/wp-content/uploads/2016/06/sizes/td-story-s-2/thediplomat_2016-06-17_15-52-57.jpg,"['shopping', '2016', 'china', 'northern', 'site', 'work', 'tha', 'laos', 'thailand', 'access', 'nam', 'damming', 'dam']", 
30,30,FL-2016-000064-CHN,Travel disruption and floods warnings as South East hit by more rain - BBC News,https://www.bbc.co.uk/news/uk-36603508,"Students said they were meant to receive their marks on Thursday but have been told they will have to wait, while a number of their sculptures, created for the college's summer show, had been destroyed.","Thu, 23 Jun 2016 07:00:00 GMT",https://ichef.bbci.co.uk/news/1024/branded_news/727B/production/_90070392_a4124cc2-a235-4b0e-a306-fcc9b0d70684.jpg,"['students', 'east', 'number', 'floods', 'destroyed', 'wait', 'meant', 'marks', 'travel', 'disruption', 'rain', 'sculptures', 'south', 'summer', 'warnings', 'hit', 'told', 'receive']", 
