,ID,event_id,article_title,article_link,article_content,publishing_date,article_image,article_keywords,article_relevance
77,77,FL-2017-000108-BGD,Response to responsibility - Dhaka Tribune,https://www.dhakatribune.com/opinion/op-ed/2017/08/19/response-to-responsibility,"I always thought that the term “corporate social responsibility” was a least-adhered-to topic in Bangladesh.

However, it feels quite nice when I see the term and the related activities along with it are being discussed in a public forum.

In a recent workshop organised by the Centre on Budget and Policy of Dhaka University and the Asia Foundation, CSR experts sat together and opined that the government, the private sector, and charitable organisations should think of working together to ensure that CSR funds are spent efficiently so as to support communities as well as the economy.

They emphasised on the “value for money” while spending for any CSR activity. They are so right when they say this. These days, while thinking of any CSR activity, the importance of charity and philanthropy has reduced among the practitioners.

Companies around the world, in the last decade, have been considering a business link while spending for CSR. For example, a bottled water company would think of choosing a CSR activity in the water sector. It wouldn’t choose something that doesn’t connect with its core business.

The benefits of spending

However, spending for CSR in Bangladesh couldn’t yet come out of the concept of charity and philanthropy. If we look at the how the banks in Bangladesh have been spending their money which has doubled in the last decade, we’d see most of them aren’t spending those funds which are not related to their core business. The benefits of spending the money aren’t returning to the banking sector.

On the other hand, the telecom sector in the country has turned around when they think of their CSR strategy. They say that they are digital companies and they would think of doing something that would improve and benefit the digital environment of Bangladesh.

This is indeed a welcome phenomenon that they aren’t spending their money for football tournament or organising get-togethers of alumni associations. Rather, they are seen to focus on technology and education.

What would a cement company or a tobacco company do? They may certainly think of the environment and the people’s health. They wouldn’t do anything for the sake of doing. What would a beverage company do? It would mostly likely do something that raises its customers’ health consciousness.

Many may term CSR activities as voluntary work. Yes, it may be voluntary, but the necessity of running this voluntary work should come from within the companies, from their sense of responsibility that directly or indirectly connects the customers as well as the society as a whole with their core business.

As a nation, we’re still far from defining and understanding the nuances of CSR. I don’t think one consultation meeting can complete the task

And yes, the work has to be sustainable; they mustn’t do anything that they cannot do every year. If they cannot continue the activity or cannot increase the intensity of the activity, the work wouldn’t, then, be sustainable.

Remember when the rich people were spending money on charity and building schools and hospitals? They were actually spending those funds for their own children and families. If there’s no school in a village or a hospital in a town, where would their children study? Where would their family members go for treatment? They would have to travel to faraway lands for these purposes.

Corporate human responsibility

The term CSR these days has shed the word “social” and in many countries has become only “corporate responsibility.” And in a few countries, they aren’t even talking about corporate responsibility; they’re discussing “corporate human responsibility.”

The concepts aren’t being confined to the companies anymore -- they have crossed the boundary of companies, they have gone to the level of individual citizens. We, in Bangladesh, are also subconsciously thinking in the same fashion.

Look at what the citizens are doing for the flood-affected people right now. They have gone all-out in helping the victims so that they survive the calamity. This response has come from the citizens’ sense of responsibility. They understand that the government, as the biggest corporation of the country, would not be able to shoulder the responsibility alone.

Therefore, the government itself needs to realise that it alone cannot do everything for the people in need. It should develop a mechanism or a framework that could create the opportunity for the citizens to participate.

To my mind, similarly, the government should also create an opportunity for the companies to participate in social activities or human activities. However, this hasn’t been the case in our country. This realisation has led to the idea of developing a national guideline.

Now, what should the CSR guideline contain? I believe as a nation, we’re still far from defining and understanding the nuances of CSR. I don’t think one consultation meeting can complete the task of understanding CSR. I have been for a national CSR guideline for the last 20 years, yet we couldn’t develop it.

Why? Because we haven’t been talking about it, we haven’t putting proper emphasis on what CSR can achieve. The companies were seen to have a CSR department on the sidelines of their operations just because the government had asked them to do so. This practice has borne very little result in the society.

Therefore, I believe that the guideline shouldn’t be developed in haste. The planning ministry, the think-tanks, or the academics alone shouldn’t try to develop the guideline. Rather, they must include those, the companies to be specific, who are already practising CSR. We should gather all the experience, and then examine them with an open mind, and then go for a guideline.

The guideline should be able to inspire the companies to be more responsive to their responsibilities towards human beings -- their customers.

Ekram Kabir is a fiction writer.","Sat, 19 Aug 2017 07:00:00 GMT",https://eng-media.dhakatribune.com/?width=476&height=249&cropratio=16:9&quality=100&image=/uploads/2017/08/12-6.gif,"['work', 'activity', 'arent', 'think', 'responsibility', 'csr', 'guideline', 'response', 'companies', 'spending', 'money']", 
78,78,FL-2017-000108-BGD,Of vanishing forests and wildlife in Ayubia - The Express Tribune,https://tribune.com.pk/story/1480650/beautiful-ayubias-trees-animals-will-gone-not-conserved,"PHOTO: WWF

PHOTO: AFP

PHOTO: Reuters

PHOTO: WCS

PHOTO: Wikimedia commons

PHOTO: Wikimedia commons

PHOTO: Wikimedia commons

A steep uphill ride on a sturdy engine - some two hours from Islamabad - brings you to this lush, dense forest. As your ears get accustomed to all the sounds, your eyes take in the stunning landscape. Fresh, clean air fills yours lungs. You’re in Ayubia National Park.Spread over 3312 hectares in the Galliat region of Nathiagali, Khyber-Pakhtunkhwa (K-P), it is part of Pakistan’s last stretch of moist temperate forest. The park, habitat of a diverse species of wildlife, has been facing severe deforestation, water shortage, soil erosion, landslides and flash floods.Locale of 757 plant species and 203 bird species, Ayubia is part of the Western Himalayan Eco region. Besides being declared an Eco region, the park also falls under regions classified as Endemic Birds Areas of the world (EBA), recognised by BirdLife International. Eco regions are identified by their unique biogeographical characteristics, such as endemic species, environmental conditions, and ecological patterns and risk being lost forever if not conserved.To preserve the biodiversity of this region, specifically the conifer forests, Ayubia was declared a national park - a region protected by the state - in 1984.The Western Himalayan Ecoregion is the catchment area of Indus river. It is responsible for the streamflow of 70-80 per cent of water to the river. The freshwater streams and springs at the park are a significant source of water supply for the residents of the area.Over the decades, unsustainable land management practices such as fuel wood harvesting, overgrazing and urbanisation have led to deforestation, water shortage, landslides and flash floods in Ayubia National Park; the livelihoods of the locals were threatened along with the biodiversity of the region.Significant animal species in Ayubia National Park:A nocturnal hunter, with small ears, long whiskers and powerful jaw muscles; the common leopard preys on domestic animals in addition to wild animals such as foxes, wild boars and Rhesus monkeys.Although protected under all provincial laws the common leopard is critically endangered in Pakistan. It is frequently found in Ayubia and contiguous forest areas of K-P and Azad Jammu and Kashmir. Rhesus monkey is widely spread across south, southeast and east Asia . In Pakistan the Rhesus monkey is found in mountainous regions with forest cover.Frequently spotted in Ayubia, Red foxes have a very wide recorded habitat. They can survive in arctic and sub-arctic regions as well as deserts and forests. They are lone hunters who prey on rodents, rabbits and birds among other wild animals. They also feed on fruit and vegetables, fish, frogs and worms.Native to Pakistan and India, Murree vole is a nocturnal, crepuscular, herbivorous rodent . It’s common habitat is temperate forests such as the Ayubia National Park. It has a very wide assessed distribution in the area. ( Molur et al. 2005 ).Woolly flying squirrel (Eupetaurus cinereus) was once thought to be extinct. However surveys confirmed the presence as well as a sustainable population of this species in the northern areas of Pakistan. Data gathered by International Union for Conservation of Nature ( IUCN ) suggests that the species is endangered and has suffered a 50 per cent reduction in population in the last ten years. (Hasan 2008, Rao and Marwat 2003) Habitat destruction is the most immediate threat to the survival of the woolly flying squirrel according to the The Wildlife Conservation Society Pakistan. It is highly dependent upon pine needles in its diet (Zahler and Khan 2003)13-15 inches from head to tail, Kestrels are a birds of prey species that have an extremely large range.Kalij pheasant is native to Pakistan, India, Bangladesh, Bhutan, China, Myanmar; Nepal and Thailand. It is commonly found in forests and thickets, especially in the Himalayan foothills. Although three of its eastern subspecies are threatened, the Kalij pheasant is not considered vulnerable according to Birdlife International. However the population is declining due to habitat destruction/degradation and hunting. (d el Hoyo et al. 1994 ).Found in Ayubia, Koklass pheasant is native to Afghanistan, China, India and Nepal besides Pakistan. The species is decreasing in population due to habitat degradation and fragmentation resulting from pasturing and cutting of understorey to fulfill firewood requirements. ( del Hoyo et al. 1994 ).Forests are home to eighty per cent of the world’s terrestrial plants and animals. Millions of species risk losing their habitat due to deforestation. Chir pheasants are already extinct in Pakistan due to shrinkage of chir forests. Musk deer and the black bear are also on the verge of extinction in the country due to forest degradation and loss.Forests also play a crucial role in mitigating climate change. Trees soak up carbon dioxide and other greenhouse gases from the atmosphere that contribute to negative changes in climate. According to a study conducted by NASA in 2014, ""tropical forests absorb 1.4 billion metric tons of carbon dioxide out of a total global absorption of 2.5 billion"". Further the study revealed:“Forests and other land vegetation currently remove up to 30 percent of human carbon dioxide emissions from the atmosphere during photosynthesis. If the rate of absorption were to slow down, the rate of global warming would speed up in return.”Not only that, forests also protect our watersheds. They reduce stormwater runoff via infiltration and deescalate downstream flood flows that erode stream channels and are harmful to plants, animals and people. Forest cover alongside streams filters sediments during storms and contribute to stream health by removing nitrates and phosphates as well as pollutants from soil and water.Distinct tree species found in Ayubia National Park include:This is the tree that gives usseeds, widely consumed in winters throughout Pakistan. Native to Pakistan, India, Bhutan, Nepal, China and Afghanistan, the Blue Pine is a striking coniferous evergreen that can grow up to 50 metres tall, but is usually 10 to 30 metres in height . The branches of this tree are covered in blue-green needles all year round. Blue Pine is a common species listed as stable by IUCN Locally known as Deodar, Cedar is the national tree of Pakistan. It is also known as the Deodar cedar and the Himalayan cedar. A chief timber tree in the region; its wood is used in construction as well as furniture and Carpentry. Although it is currently listed as a Least Concern species by IUCN , deforestation and forest degradation may pose local threats to its population in Pakistan.Usually a prominent tree in stands Fir tree also occurs with other broad leafed conifers. The species has suffered a population decline of 25 per cent in the past three generations according to IUCN. This tree is therefore listed as Near Threatened approaching Vulnerable A2.Another endangered species, Yew forests are listed as endangered by the IUCN . Himalayan Yew has undergone a major decline within the last 25 years and the trend is ongoing. The wood from the Yew tree is commonly used for construction of houses and furniture. Local communities also use the wood for grave covering and as fuel.WWF-Pakistan has a few projects in the Western Himalayan Eco region. Keeping in line with Pakistan’s National Climate Change Strategy which calls to “promote integrated watershed management including ecological conservation practices in uphill watersheds”, In 2008 WWF initiated a programme titled: Improving Sub-watershed Management and Environmental Awareness in and around Ayubia National Park.Supported by Coca-Cola Foundation the project aimed to improve the ‘sustained flow of clean water in the region thereby conserving its biodiversity.The project’s efforts have been greatly appreciated by the beneficiaries and partners.The project mobilized the community and helped spread awareness about the significance of forests. To control landslides and protect streams and gullies from erosion the project treated landslides and land slips with bioengineering measures and constructed live brushwood check dams, flood control spurs, gabion check dams and improved vegetation cover by 4.62 per cent.It also introduced measures to reduce pressure on existing forests by providing fuel efficient stoves to some houses, solar water heaters and introduced the use of concrete RCC slabs in graves instead of the wood obtained from Taxus wallichiana. Taxus wallichiana is now being protected and annually five trees have been saved in 10 villages according to estimates.To address the issue of water availability, the project initiated water harvesting and waste management campaigns. The project has contributed to the overall health of the watershed by improving the livelihoods of people via training on agricultural practices, provision of fruit and vegetable plants as well as by establishing improvised pipe irrigation schemes.Further, the project has been able to replenish 215.06 million litres of water annually.Local, Abdul Shakoor, an activist says “Our mountains are beautiful, it is our duty to protect them. We will continue collaborating with locals and the government to protect our region.”The residents of the area hope that the government will further help the region by introducing water schemes, subsidised LPG; to be used in stoves and a system for vaccination of livestock.Government projects such as the 'Billion tree tsunami' have proved to be a triumph. In just a year it added three-quarters of a billion new trees, as part of a “tree tsunami” aimed at reversing worsening forest loss.The project aims to increase K-P’s forest area by at least two per cent. The Billion tree tsunami has been recognised by the Bonn Challenge, a global partnership which aims to restore 150 million hectares of the world's deforested and degraded lands by 2020. Here’s hoping we will see more.","Sun, 13 Aug 2017 07:00:00 GMT",https://tribune-reloaded.s3.amazonaws.com/media/images/1480650-ayubianationalparkwwfpak-1502620852/1480650-ayubianationalparkwwfpak-1502620852.jpg,"['region', 'water', 'forest', 'vanishing', 'tree', 'project', 'forests', 'wildlife', 'ayubia', 'species', 'national', 'pakistan']", 
79,79,FL-2017-000108-BGD,PM Modi Setting Agenda for Disaster Management and Risk Mitigation - Narendra Modi,https://www.narendramodi.in/pm-modi-setting-agenda-for-disaster-management-and-risk-mitigation-536536,"Modi Govt working towards the welfare of Odisha to strengthen disaster relief and disaster management capabilities

Be it Amphan or Fani or #CycloneYaas, PM Shri @narendramodi has always risen to the occasion and helped the states affected with the cyclones proactively by immediately providing relief funds. A disaster resilient Odisha is in the making under his leadership.#ModiHaiToMumkinHai pic.twitter.com/tOYkPXyZAu — Maahi Singh (@Maahis3107) May 29, 2021

I have a dream for my India:

Where politicians put the nation first.

Where politicians put public first.

Where politicians put themselves as just another citizen.

Where politicians work together with differences.

I see that in this discourse. Kudos to @Naveen_Odisha @narendramodi https://t.co/2Wl90gVAr6 — 🇮🇳pramil🇮🇳 (@DeeepFriedLife) May 28, 2021

Long term vision will help the state to fight any natural calamities in future.

Centre and State together can bring a transformative change in the state. A silent CM who knows what his people and his state wants.

Thank you PM @narendramodi ji for all ur support. 🙏 — Harshadha Shirodkar 🇮🇳 (@shirodkarharshu) May 29, 2021

Our PM Sri Narendramodiji always talks about the great culture of Odisha and he will continue working to make a modern Odisha. — Sujiv Kumar(Indian) (@SujivKumar4) May 29, 2021

Much Appreciation to you CM Of Odisha State Shri Naveen Patnaik Ji.



Odisha's disaster management had grown phenomenally - Kudos Ji.



Our PM Shri Narendra Modi Ji's top prioritised aerial survey exposes his passionate national governance - Salute Ji — Venkatesapalani Thangavelu (@Ven070670) May 29, 2021

We are very much grateful to you sir.

Honourable Shri @narendramodi sir ji🙏 https://t.co/ik8nnF2pz7 — Positive thoughts (@NimainCharanD13) May 29, 2021

👍🙏Strength of working together is useful and fruitful as shown by honest PM all the time! https://t.co/69CNmQi68P — pragati mukhopadhyay (@UniversePragati) May 29, 2021

This is a perfect example of ""Together we can"".



Great respect for @narendramodi and @Naveen_Odisha https://t.co/yTJNT0saO2 — विजय खंडेलवाल (@PALVIZOO) May 29, 2021

Sir, Thank you and @Naveen_Odisha ji for taking care of people of Odisha, who got affected by this cyclone. Working together for people is a beauty of our democracy. — Nishant🇮🇳 (@iNishant4) May 29, 2021

Modi Govt. is providing relief to the citizens during these unprecedented times

Railways delivered over 19,408 tonnes of oxygen to 39 cities in 15 states over last month @RailMinIndia @narendramodi Well Done pic.twitter.com/1VMsZ7KsaT — Ravi Gadale (@ucravigs) May 29, 2021

GST Council meet: FM announces 'Amnesty Scheme' for small taxpayers, allows filing of returns with reduced late feehttps://t.co/jlJhMSTACL pic.twitter.com/I2FEsQaeBp — V .J .Mehta Advocate (@JManavadar) May 29, 2021

India's Foreign Exchange Reserves Rise By $2.865 Billion To Reach Record High Of $592.894 Billion#ModiHaiToMumkinHai #GDP #AatmaNirbharBharat pic.twitter.com/DSXPSjMRYT — Shivam singh (@Shivam_kshtriya) May 29, 2021

Kudos to the @narendramodi lead Central government. The way the centre managed Oxygen supply over all the states is impressive. Special trains and transportation has been quickly arranged which helped many patients with liquid Oxygen. Slowly, the need for oxygen is reducing now👏 pic.twitter.com/ntD15VWDqh — Ravi Kumar Yadav (@Raviyadav_bjp) May 29, 2021","Thu, 10 Aug 2017 07:00:00 GMT",https://cdn.narendramodi.in/cmsuploads/0.72778700-1502359335-0-62419400-1502359315-pm-2520chairs-2520meeting-2520on-2520flood-2520in-2520gujarat-2520-25283-2529.JPG,"['sir', 'mitigation', 'agenda', 'ji', 'disaster', 'modi', 'setting', 'work', 'countrymen', 'country', 'corona', 'big', 'oxygen', 'yes', 'india', 'management', 'risk']", 
80,80,FL-2017-000108-BGD,Assam CM Sarbananda Sonowal seeks early completion of Indo-Bangla fencing work - The Indian Express,https://indianexpress.com/article/india/assam-cm-sarbananda-sonowal-seeks-early-completion-of-indo-bangla-fencing-work-4803135/,"Guwahati: Assam Chief Minister Sarbananda Sonowal. (Source: PTI) Guwahati: Assam Chief Minister Sarbananda Sonowal. (Source: PTI)

Assam Chief Minister Sarbananda Sonowal on Friday asked the National Buildings Construction Corporation (NBCC) and the Central Public Works Department (CPWD) to complete the ongoing fencing work along the Indo-Bangladesh border and seal it completely. Sonowal also urged the Department of Telecommunication to enhance bandwidth for seamless internet connectivity in Assam.

At a meeting with top officials of the NBCC and CPWD, Sonowal asked them to complete the task on a “war footing” so that 48.11 kms of unfenced areas of the international border could be sealed, a state government statement said.

Sonowal asked the Border Security Force to use proven technology to intensify its vigil and squeeze the alleged influx and smuggling from across the border. “Fencing of the unfenced areas of Indo-Bangla border would lead to complete sealing of the border between the two geographical entities and it will also stop illegal movements from across the border,” the chief minister said.

During the meeting, the NBCC and CPWD officials pointed out that of the 48.11 kms unfenced border between Assam and Bangladesh, fencing of 13.38 kms would be completed as soon as the flood water recedes.

However, erecting fence on the remaining areas involves enormous challenges as nearly 3-km stretch particularly in Silchar sector is full of deep gorges. Sonowal asked the NBCC and CPWD to start the fencing work right from October so that the whole process can be completed before the onset of the next monsoon, the statement said.

At a separate meeting with officials of the Department of Communication, the chief minister sought upgradation and amplification of the bandwidth in Assam to bring the internet facility at par with major cities like Delhi, Mumbai and Chennai.

“If this can be done the far-flung areas of Assam can be brought under the ambit of internet connectivity,” he said.

It will create an ambience conducive for spearheading a new paradigm of development in information technology, he said.

Sonowal underscored the need for Optical Fibre Cable connectivity through neighbouring Bangladesh’s Cox Bazar.

The chief minister urged the DoT to raise the number of mobile towers for seamless connectivity in the far-flung areas of the state.","Fri, 18 Aug 2017 07:00:00 GMT",https://images.indianexpress.com/2017/07/sonowal-7591.jpg,"['border', 'minister', 'cpwd', 'completion', 'fencing', 'work', 'areas', 'cm', 'seeks', 'nbcc', 'assam', 'connectivity', 'sonowal', 'sarbananda', 'chief', 'early', 'indobangla']", 
