GLIDEnumber,Event,Country,Date,Country Code,Location,Duration,Comments
FL-2014-000163-COL ,Flood ,Colombia ,2014/10/31 ,COL , , ,"A second rainy season started at the end of September 2014. In October, more than 52,000 people were affected and 24 were killed by events associated with increased rainfalls, such as floods, landslides and winter storms. By 24 Nov, more than 100,000 people had been affected and 44 killed. At the beginning of December, floods and landslides affected almost 9,000 people in Chocó. "
FL-2014-000162-LKA ,Flood ,Sri Lanka ,2014/12/1 ,LKA , , ,"Floods, high winds, and landslides have affected over 90,000 people in 15 of the 25 districts of the country. Seven people have died and over 12,000 are living in 96 safety centers.  "
FL-2014-000159-MAR ,Flood ,Morocco ,2014/11/24 ,MAR ,South of Morocco , ,Violent storms have caused widespread flooding and flood several wadis (river) in a large part of the south of the country.  
FL-2014-000155-HTI ,Flood ,Haiti ,2014/11/5 ,HTI , , ,"Heavy rainfall starting at the beginning of November 2014 caused flooding and landslides in Northern Haiti, killing 17 people. More than 15,000 houses were flooded, 90 were destroyed and 800 were severely damaged. Over 6,500 people were temporarily housed in emergency shelters. The floods also affected over 2,200 hectares of crops in one of the country's most fertile areas. "
FL-2014-000154-IDN ,Flood ,Indonesia ,2014/11/1 ,IDN , , ,"Continued flooding occurred from 1-3 Nov in Aceh, northern Sumatra. In Aceh Barat Daya over 46,100 people are affected and almost 6,900 people are affected in Aceh Jaya.  "
FL-2014-000152-ETH ,Flood ,Ethiopia ,2014/10/20 ,ETH , , ,"Some 72,680 people in Ethiopia's Afar, Somali and SNNP regions were affected by flooding in September and October 2014. More than 50,000 people were displaced, having partially or totally lost their homes and livelihoods. The forecasted good performance of the deyr (October-December) rains in the Somali region pose a continued risk of flooding. The Government and humanitarian partners started mobilizing resources. "
FL-2014-000150-SOM ,Flood ,Somalia ,2014/10/30 ,SOM , , ,"Starting in October 2014, heavy rains in south-central Somalia and in upper parts of the Shabelle basin in the Somali-Ethiopian border, have caused flooding along both the Shabelle and Juba Rivers. The worst-hit areas are along the Shabelle River: Beledweyne in Hiraan region, and in the Middle Shabelle region, where there have been some river breakages. Along the Juba River, Dolo in Gedo region, and Jilib and Jamame in Lower Juba have been affected. Xudur in Bakool region has also experienced heavy rains "
DR-2014-000147-BOL ,Drought ,Bolivia ,2014/10/27 ,BOL , , ,"An assessment carried out by authorities identified six municipalities in the department of Santa Cruz impacted by drought. An estimated 10,236 families are affected (about 51,180 people) as well as 20,344 hectares - 90 per cent of which is corn crops. So far, 12 municipalities have declared an emergency situation. The number of people affected is expected to rise to 150,000. "
FL-2014-000144-NIC ,Flood ,Nicaragua ,2014/10/18 ,NIC , , ,Twenty-two people have died in Nicaragua during several days of heavy rains. Nine of them were killed in the capital Managua when a wall collapsed during a torrential downpour. 
FL-2014-000136-GEO ,Flood ,Georgia ,2014/9/21 ,GEO ,Guria region ,3 ,"On 21 - 24 September heavy rains caused flooding and landslides in the Batumi, Kobuleti, and Ozurgeti, Lanchkhuti, Chokhatauri (Guria Region) municipalities of the Republic of Georgia. Houses, yards and agricultural lands have been seriously flooded. A six-magnitude storm also hit the above mentioned municipalities. "
DR-2014-000132-HND ,Drought ,Honduras ,2014/9/23 ,HND ,Honduras , ,"On 9 July 2014, the Government of Honduras declared an emergency for drought in the dry corridor with more than 186,000 families affected in 165 municipalities. Meteorological experts are predicting a 20 to 40% rainfall deficit.  "
DR-2014-000131-KEN ,Drought ,Kenya ,2014/9/24 ,KEN , , ,"Due to the poor performance of the long rains between the months of March and May 2014 in the Arid and Semi-Arid Lands in Kenya, the drought situation has continued to affect both pastoral and marginal agriculture livelihood zones (the North Western, Northern, North Eastern, South Eastern and parts of Coast). The drought situation is affecting households' food availability as well as livestock productivity. The situation has continued to worsen due to the increase in food prices which has continually eroded household purchasing power driven by increase in fuel costs, and general inflation. Through the launch of this appeal, IFRC will support the Kenya Red Cross Society to assist 649,175 persons affected by the drought situation for a period of 9 months. "
FL-2014-000130-HUN ,Flood ,Hungary ,2014/9/14 ,HUN ,South-Western part of the country.  ,10 ,"Due to the heavy and unseasonal rainfall, some of the rivers overswelled, causing floods and inland waters in different parts of Hungary starting from 14 September 2014 onwards. The General Directorate of the Water Management posted red alert on the rivers Dráva, Lajta, Mura, Rába and Zala, in total along 320 kilometres. Floods are affecting a number of 90 villages in 10 counties Vas, Zala, Gy?r-Moson-Sopron, Jász-Nagykun-Szolnok, Veszprém, Baranya, Bács-Kiskun, Nógrád and Fejér. The most affected settlements are situated in the South-Western part of the country.  "
FF-2014-000129-SRB ,Flash Flood ,Serbia ,2014/9/16 ,SRB ,"Kladovo, Majdanpek and Negotin ", ,"Massive rainfalls in the eastern parts of Serbia have caused major problems in the municipalities of Kladovo, Majdanpek and Negotin. A state of emergency was declared in these municipalities as of 16 September 2014, with the effort to save people`s lives and to reach those villages that are cut off.  "
FL-2014-000123-SSD ,Flood ,South Sudan ,2014/8/1 ,SSD , , ,"Starting in July 2014, flooding caused by seasonal rainfall started to worsen living conditions in displacement sites in parts of South Sudan. By 31 Jul, large areas of the Bentiu Protection of Civilian Sites in Unity State were under water. As of 15 Aug, over 68 per cent of the estimated 1.3 million people displaced within South Sudan were sheltering in flood-prone sites. In addition to Bentiu, displacement sites in Juba (Central Equatoria) and Malakal (Upper Nile) had also reported flooding.  "
FL-2014-000122-PAK ,Flood ,Pakistan ,2014/9/5 ,PAK , , ,Torrential monsoon rains at the beginning of September 2014 killed at least 89 people in Pakistan's most populous province Punjab and in Pakistani-administered Kashmir. The National Disaster Management Authority warned there was a high risk of flooding in three towns along the Chenab river in Punjab and asked people to leave low-lying and vulnerable areas. Troops have been mobilized for flood relief duties in eastern Punjab. The death toll was likely to rise as reports were coming in of floodwaters sweeping through villages in rural areas. 
FL-2014-000121-CMR ,Flood ,Cameroon ,2014/8/21 ,CMR ,Bibemi , ,"Since 21 August 2014, Bibemi Subdivision, located some 64 kilometres from the city of Garoua (capital of the North Region of Cameroon) has been experiencing heavy rainfall (about 180 mm) that has caused severe flooding in more than 10 villages of the Subdivision, leaving extensive damage and loss of life (a 14-year-old girl drowned) in its wake.  "
DR-2014-000120-LKA ,Drought ,Sri Lanka ,2014/8/18 ,LKA , , ,"In 2014, the failed annual northeast monsoon, which runs through February and supplies water for the agricultural production, resulted in severe crop losses and water shortages in Sri Lanka. By the end of March, over 240,000 families had been affected. By August, low rainfall had further aggravated the impact of the drought, which affected more than 1.8 million people in 16 districts. The Government allocated over $680,000 to provide drought relief, while the UN Emergency Response Coordinator approved $2 million from the Central Emergency Response Fund for food, drinking water and health. "
FL-2014-000119-KOR ,Flood ,Korea Republic ,2014/8/26 ,KOR , , ,"Flash floods brought on by heavy rain in southern South Korea have killed at least five people, officials say. "
FL-2014-000117-BGD ,Flood ,Bangladesh ,2014/8/25 ,BGD , , ,"Seasonal flooding has raised the water level along major rivers in Bangladesh, as of 25 Aug. Six districts in the northern part of the country have been affected. The Government has provided immediate relief to 27,000 households.  "
FL-2014-000117-IND ,Flood ,India ,2014/8/19 ,IND , , ,"As of 24 Aug, six states in northern India were affected by heavy flooding. The most seriously affected include Uttar Pradesh where 41 people have been killed, Uttarakhand where over 50 people have died, Bihar where 38,000 people were affected and Assam where 35,000 were displaced. "
FL-2014-000115-NER ,Flood ,Niger ,2014/8/22 ,NER , , ,"Ongoing heavy seasonal rainfall caused flooding in several parts of Niger in August 2014. As of 21 Aug, more than 36,400 people had been affected according to the Government, and 18 deaths had been reported. Tillabéry was the most affected region, followed by Dosso, Maradi and Tahoua. "
FL-2014-000113-BGR ,Flood ,Bulgaria ,2014/7/31 ,BGR ,"Sofia, Plovdiv, Montana and Vratsa ", ,"After an exceptionally dry winter, the weather in Bulgaria started becoming very wet, going to the other extreme. Since the beginning of the summer, heavy rains and hail storms have been a constant problem for the local population. In the late hours of 31 July, storms and heavy rainfalls in North-West Bulgaria caused devastating floods in the regions of Sofia, Plovdiv, Montana and Vratsa. In the region of Vratsa, extensive torrential rains resulted in two waves of flooding on 1 and 2 August 2014. After the river Skat ruptured its banks, two consecutive waves invaded the town of Mizia, Vratsa Region. The number of people directly affected was 7,247 (2,416 households ) in the region of Vratsa. Based on the ongoing assessment conducted by the responsible authorities, more than 80 houses have been totally destroyed, not suitable for living any longer, and 350 have been badly damaged. The direct results of the flood are represented by two fatalities and 800 people evacuated in Mizia, from which approximately 200 were accommodated in an evacuation center managed by the Municipality of Mizia. Furthermore, 100 per cent of the crops in the region has been destroyed and 80 per cent of the livestock is dead. Mizia, Borovan, Byala Slatina and Vratsa are among the most devastated towns and villages. The water level in the town of Mizia and in most of the affected villages reached 2.5 to 5 meters during the most critical moments.  "
FL-2014-000112-NPL ,Flood ,Nepal ,2014/8/14 ,NPL , , ,"Heavy rain continued between 14 and 16 August 2014 causing massive floods and several landslides in 18 districts throughout the country. According to the Initial Rapid Assessment (IRA) reports received from districts to date, a total of 34,760 families (173,800 people) have been affected, of which 5,936 families (29,680 people) are displaced, 100 people are still missing, 53 people confirmed dead, and 30 people were injured. The number of casualties is likely to increase. "
FL-2014-000110-LAO ,Flood ,Lao People's Democratic Republic ,2014/8/15 ,LAO ,4 provinces ,20 ,"Due to high intensity of rainfall caused flooding to the surrounding areas. The affected provinces so far include: Savanhnakhet, Saravanh, champasak and Luangphabang. In total 20 district, 450 villages are suffering from floods, 36,563.42 hectares of rice field were inundated and 147 houses were evacuate caused by monsoon rains. Bases on Data from Provincial Disaster Committee  "
DR-2014-000109-CHN ,Drought ,"China, People's Republic ",2014/8/8 ,CHN , , ,"Persistent drought has caused widespread water shortages in central and north China, affecting more than 27.5 million people, according to official figures. The result of high temperatures, lack of rainfall and inadequate water storage, central China's Henan and Hubei provinces as well as Ningxia Hui Autonomous Region and the Inner Mongolia Autonomous Region in the north saw nearly four million people in need of basic living support, a statement from the Ministry of Civil Affairs said. "
FL-2014-000107-MMR ,Flood ,Myanmar ,2014/8/5 ,MMR , , ,"The riverside town of Pegu has been affected by severe flooding after heavy downpours hit much of lower Burma in recent days, causing the Pegu River to swell and burst its banks. Hundreds of residents of the town have seen their neighborhoods flood, forcing some to leave their homes and take shelter in local monasteries, while others have to wade through deep water or use boats to move around. "
FL-2014-000104-KHM ,Flood ,Cambodia ,2014/8/3 ,KHM , , ,Floods have hit seven Cambodian provinces along the Mekong River and Tonle Sap Lake and claimed eight lives since last week. 
FL-2014-000098-SDN ,Flood ,Sudan ,2014/7/4 ,SDN , , ,"Since late June 2014, seasonal rainfall across many parts of Sudan has been above-average, with some local areas experiencing rainfall surpluses in excess of 100mm within 30 days. On 17 Jun, some 750 people were affected by heavy rain that destroyed 37 houses and a health care clinic in Tilo IDP settlement in South Kordofan's capital Kadugli. More flooding in the same area on 4 Jul affected almost 3,200 people. At least 234 houses were destroyed, another 143 damaged and 150 latrines rendered dysfunctional. The South Kordofan's State Government has requested international humanitarian organisations based in South Kordofan to support Government efforts in providing the flood-affected people with food, non-food items and shelter. "
FL-2014-000095-CHN ,Flood ,"China, People's Republic ",2014/7/10 ,CHN , , ,"The Ministry of Civil Affairs on Thursday said heavy rains have left 34 people dead and another 21 missing in south China. Severe rainfall and ensuing floods have hit the provinces of Guizhou, Hunan, Jiangxi, Hubei, Sichuan, Yunnan, Anhui and the municipality of Chongqing since July 10, affecting more than 8.82 million people, said the ministry. "
FL-2014-000092-THA ,Flood ,Thailand ,2014/7/21 ,THA , , ,"Typhoon Rammasun has caused torrential rainfall within Northeastern Thailand, with Yasothon province being the most-affected from the storm's affects. Water levels along several canals have increased drastically, overflowing the banks and inundating 500 rais of rice fields. "
FL-2014-000089-IND ,Flood ,India ,2014/6/25 ,IND , , ,"Monsoon rains have triggered river overflows in the State of Assam, north-eastern India, causing damage and evacuations. More than 24,000 people have been affected. "
FL-2014-000085-PNG ,Flood ,Papua New Guinea ,2014/7/8 ,PNG , , ,"Flooding was reported in Baimuru and Kikori district in the Gulf province following continuous heavy rains during the month of June. On 4 July 2014, Baimuru district's river Purari burst and caused floods in its surrounding areas. There were no casualties reported, but 37 house and food gardens were washed away with partially-damaged houses inundated by water. According to the National Disaster Centre and Provincial Disaster Centre, 27,017 people have been affected in Kikori and Baimuru district mostly. "
FL-2014-000084-ARG ,Flood ,Argentina ,2014/6/30 ,ARG , , ,"Flooding from days of torrential rains has forced the evacuation of some 3,000 families in Argentina. "
FL-2014-000083-BRA ,Flood ,Brazil ,2014/6/11 ,BRA , , ,"Flooding had killed 10 people in southern Brazil's Parana state by 11 June 2014, and state officials declared an emergency in 130 cities. "
FL-2014-000080-CHN ,Flood ,"China, People's Republic ",2014/6/18 ,CHN , , ,"One person was killed in heavy rain in south China's Guangxi Zhuang Autonomous Region on Tuesday, local authorities said. As of 3 p.m. Wednesday, the flood has affected 24,300 people, with 202 people relocated. "
FL-2014-000079-PHL ,Flood ,Philippines ,2014/6/13 ,PHL , , ,"Over 85,000 people affected by seasonal flooding in Maguindanao province, southern Philippines. "
FL-2014-000077-PRY ,Flood ,Paraguay ,2014/3/19 ,PRY , ,3 ,"The intense rains in Paraguay, which started in March 2014, have been unusually intense for the season, leading to severe floods in rural communities and urban areas. The effects have continued to be felt with the flooding from the rapidly rising Paraná river and Paraguay river. To date, 39,000 families (195,000 people) from five departments in the country have been affected by the flooding and require humanitarian support. The most recent rains registered in the upper basin of the Iguazú river have led to the overflowing of this riverbed and the subsequent increase of water levels in the Paraná river. This has led to the increase in the amount of water in the reservoir of the Itaipú and Yacyreta dams, which has required both dams to increase their water flow which in some cases has reached between 22,000 m?/s and 43,000 m?/s. As a consequence, the impact has been extreme for the riverside populations located in Alto Paraná, Misiones and Ñeembucú. "
FL-2014-000073-RUS ,Flood ,Russia ,2014/5/29 ,RUS , ,2 ,"Since 29 May 2014, 22,545 persons have been evacuated due to severe floods occurring in 25 municipalities within the Republics of Khakassia, Altai, Tuva and the Altai Territory, in Siberia as well as in the Republic of Adygeya in North Caucasus of Russia. According to the national emergency response centre of the Ministry of Emergency Situations (EMERCOM), severe damages have been reported with more than 4,000 houses and 12 motorwaysflooded. In addition, more than 1.500 persons are currently sheltered in evacuation centres. National rescue units representing approximately 1,700 persons are continuously mobilized to deal with the emergency. "
FL-2014-000070-LKA ,Flood ,Sri Lanka ,2014/6/1 ,LKA , , ,"Heavy rainfall on 1 Jun 2014 caused extensive flooding in western districts of Sri Lanka, killing 23 people and affecting an estimated 44,000 people. Kalutara, Colombo and Gampaha were worst hit. Over 17,000 people were displaced in Kalutara, and extensive damage to roads and bridges has hampered relief efforts. "
FL-2014-000069-BIH ,Flood ,Bosnia-Herzegovina ,2014/5/14 ,BIH ,Doboj ,15 ,"Major floods in Danube River basin, affecting mostly Bosnia Herzegovina and Serbia. "
FL-2014-000063-TJK ,Flood ,Tajikistan ,2014/5/16 ,TJK , , ,"Heavy rainfall caused flooding and flash floods on 10 and 11 May 2014 in two provinces and two Direct Ruled District districts in Tajikistan. According to figures provided by the Committee of Emergency Situation and Civil Defense and the Red Crescent Society of Tajikistan, at least 1,072 families (5,360 people) have been severely affected by the floods , and around 425 people, who lost their homes have been temporarily sheltered in kindergartens, mosques, at their relatives and in neighboring villages. The affected areas stretch from Khatlon province to Rudaki and Vahdat districts in the south of the country, and in the northern region in Gonchi district of Sughd province. Also, nine bridges were destroyed; infrastructure and water pipes were heavily damaged. The road from Khatlon province to Badakhshan was cut off after some parts of the road had been washed away, resulting in the disrupting of the connection between two provinces.  "
FL-2014-000062-CHN ,Flood ,"China, People's Republic ",2014/5/10 ,CHN , , ,"One person was killed in a rain-triggered landslide while flooding has forced the relocation of another 10,000 residents in a county in central China's Hunan Province, local authorities said Saturday. "
FF-2014-000060-AFG ,Flash Flood ,Afghanistan ,2014/4/25 ,AFG , , ,"Heavy rainfall since 24 Apr 2014 has caused flash floods across six provinces of the Northern Region of Afghanistan, reportedly killing 123 people and more still missing. Initial reports indicate that Jawzjan province is the worst affected, with some 6,000 people displaced. "
FF-2014-000059-BIH ,Flash Flood ,Bosnia-Herzegovina ,2014/5/15 ,BIH , , ,"The heaviest rains and floods in 120 years have hit Bosnia and Serbia, killing five people, forcing hundreds out of their homes and cutting off entire towns. Bosnia and Serbia declared a state of emergency in a number of municipalities. The affected municipalities include Maglaj, Doboj, Bijeljina, Zvornik, Brcko, Modrica, Bosanski Samac, Tuzla, Vares, Doboj Jug, Sekovici, Bratunac, Srebrenica, Kotor Varos, Petrovo, Sapna, Gra?anica, Grada?ac, Kakanj, Olovo, Sanski Most Breza, Visoko, Zenica, Kladanj, Banovici, Lukavac and Sarajevo Canton "
FF-2014-000059-SRB ,Flash Flood ,Serbia ,2014/4/25 ,SRB , , ,"From 16 to 17 April 2014 intense rainfalls followed with moderate snowfalls at higher altitude affected the western, eastern and southern parts of Serbia resulting in power losses and, in some places, traffic interruptions due to the collapsed road infrastructure in several villages. Starting from 18 April the temperatures increased and caused the snow to melt rapidly in some lower areas. That had an impact on the river levels, with some smaller rivers and their creeks spilling over settlements in places close to the river beds. The situation was the most critical in the municipality of Lu?ani and Kur?umlija. In Lu?ani, around 50 families were endangered by the increasing levels of river Bjelica, and one of the roads leading to Lu?ani was disconnected because of floods. On 19 April conditions got worse and an emergency situation has been declared in a few municipalities as the river levels grew above the normal defense levels. Presently, the most serious situation is in Prokuplje, Zaje?ar, ?itoradja, Kur?umlija and Doljevac municipalities where emergency evacuation took place in the lower parts where people were in danger. The situation remains critical as most of these municipalities are left without clean drinking water, since the water wells and the city water supply network are damaged. So far, 11 municipalities have declared a state of emergency but more are in danger as the weather conditions in next couple of days will lead to fast snow melting and more rainfalls which will in return have an effect on the water levels on the rivers and on the people living in the nearby communities. Several landslides have occurred but luckily not affected any households at this moment. "
FL-2014-000054-TJK ,Flood ,Tajikistan ,2014/4/18 ,TJK , , ,"Floods and landslides occurred in Vose, Shurobod, and Hamadony districts and in Kulob city in the south of Tajikistan as a result of heavy rains on 11-12 April 2014. In total, 15 people were killed, 13 of them living under one roof in Sarichashma village of Shurobod district. In addition, one person was killed in Vose district and one in Hamadoni district. According to the preliminary data received from the local branch of the State Commission for Emergency Situations and Civil Defence (CoES), some 38 people have been injured. According to the preliminary assessment, some 427 families (276 in Vose, 104 in Shurobod, 47 in Hamadoni districts) have been affected. Six houses were totally destroyed and many others were severely damaged. One medical Centre, three kilometers of roads, and 80 hectares of lands were also affected. The population also lost 301 head of livestock. Storage buildings, stocks for cooking/heating (e.g. firewood), cooking utensils and bedding/clothes of the most affected households were also damaged or lost. The affected communities are not in the position to cook but bring food from neighboring communities. Vegetable gardens of the most affected households and crop fields have also been damaged (covered with mud). The roads to the affected communities in Shurobod district had been blocked by the debris. On 13 April local authorities removed the debris from the roads.  "
FL-2014-000053-TZA ,Flood ,Tanzania ,2014/4/15 ,TZA , , ,"Heavy rainfall over Dar es Salaam, Tanzania's largest city, starting on 11 Apr 2014 caused flooding in all of the city's districts, with Kinondoni being the worst affected. The exact number of people impacted by the disaster is yet to be established; currently the estimated number stands at 20,000. As of 14 April, 19 casualties, including six children, and 465 displaced families had been reported. "
FF-2014-000048-KAZ ,Flash Flood ,Kazakhstan ,2014/4/10 ,KAZ , , ,"A flash flood triggered by a dam burst killed five people and injured nine others in Kazakhstan's northern Karaganda region (oblast). The overflowing water flooded up to 354 houses in Kokpekty village after the dam of a water storage basin had burst at 1:30 a.m. on 31 March 2014. Some 400 inhabitants were evacuated, and 5 bodies were found by rescuers as the flood water reached as high as 1.5-1.8 meters in the village. "
FL-2014-000045-SLB ,Flood ,Solomon Islands ,2014/4/3 ,SLB , , ,"Flash flooding in Solomon Islands has killed at least two people and destroyed hundreds of homes in the capital, Honiara. "
