GLIDEnumber,Event,Country,Date,Country Code,Location,Duration,Comments
FL-2017-000002-MYS ,Flood ,Malaysia ,2017/1/5 ,MYS , , ,"The seasonal heavy continuous rains in the East Coast of Malaysia from 26th December 2016 have caused flooding in two states, namely, Kelantan and Terengganu. The floods have temporarily displaced about 25,000 people and have rendered some villages inaccessible due to damaged bridges and blocked roads. Public facilities including health centres and schools were also inundated. Schools were cancelled in many of the districts as they were converted into evacuation centres. In Kelantan, three main rivers, Sungai Golok, Sungai Galas and Sungai Kelantan, have overflown and flooded several districts including Bachok, Gua Musang, Jeli, Kota Bahru, Machang, Pasir Mas, Pasir Puteh, Tanah Merah, Tumpat and Kuala Krai. Meanwhile, in Terengganu, Sungai Besut, Sungai Terengganu and Sungai Setiu have reached critical level prompting the authorities to evacuate communities from the districts along these rivers. As of yesterday, 4th January 2017, the Terengganu state flood watch online portal stated that a total of 7,752 people (2,450 families) have been moved to 101 relief centres which was an increase of 20% from the previous Information bulletin Malaysia: Seasonal Flooding MRC Terengganu helping evacuees in Kampung Tadok week. In Kelantan, almost 11,250 (3348 families) people have been moved to 125 evacuation centre. About 68 schools in the two states were closed to accommodate the evacuees. As of today, 5 th January 2017, water levels in most of the rivers are receding as the rains in the east coast has stopped for the last 24 hours. Some of the evacuees are already leaving the evacuation centres. The authorities have closed 50 out of the 125 evacuation centres in Kelantan with 1,200 families returning to their homes in the districts of Kuala Krai, Machang and Pasir Puteh. Six schools in Terengganu and seven schools in Kelantan were reopened today. The district of Tanah Merah in Kelantan is still in critical situation as flood waters from the Kelantan River in that part is receding at a very slow rate.  "
FL-2016-000152-USA ,Flood ,United States ,2016/3/8 ,USA ,"TX, LA ",5 ,"Multiple days of heavy rainfall averaging 15 to 20 inches led to widespread flooding along the Sabine River basin on the Texas and Louisiana border. This prompted numerous evacuations, high-water rescues and destruction, as more than 1,000 homes and businesses were damaged or destroyed. "
FL-2016-000149-USA ,Flood ,United States ,2016/4/17 ,USA ,TX ,2 ,"A period of extreme rainfall up to 17 inches created widespread urban flooding in Houston and surrounding suburbs. Thousands of homes and businesses were damaged and more than 1,800 high water rescues were conducted. This represents the most widespread flooding event to affect Houston since Tropical Storm Allison in 2001. "
FL-2016-000147-USA ,Flood ,United States ,2016/6/22 ,USA ,"WV, OH ",3 ,"Torrential rainfall caused destructive flooding through many West Virginia towns, damaging thousands of homes and businesses and causing considerable loss of life. Over 1,500 roads and bridges were damaged or destroyed making the impact on infrastructure comparable to the historic 2013 Colorado flood. The storm system also produced numerous tornadoes causing damage across several Ohio Valley states. "
FL-2016-000145-USA ,Flood ,United States ,2016/8/12 ,USA ,LA ,4 ,"A historic flood devastated a large area of southern Louisiana resulting from 20 to 30 inches of rainfall over several days. Watson, Louisiana received an astounding 31.39 inches of rain from the storm. Two-day rainfall totals in the hardest hit areas have a 0.2% chance of occurring in any given year: a 1 in 500 year event. More than 30,000 people were rescued from the floodwaters that damaged or destroyed over 50,000 homes, 100,000 vehicles and 20,000 businesses. This is the most damaging U.S. flood event since Superstorm Sandy impacted the Northeast in 2012. "
DR-2016-000142-MOZ ,Drought ,Mozambique ,2016/4/22 ,MOZ ,chigubo , ,"February 2016: FEWS NET estimated that from March 2016 till the next rain season, the number of food insecure people might vary from 380,000 people in case of moderate scenario to 1.8 million people in a worstcase scenario. "
DR-2016-000139-LKA ,Drought ,Sri Lanka ,2016/9/26 ,LKA , , ,"As of 17 January 2017, an estimated 644,000 people across eight provinces have been affected by drought and salt water intrusion over the past four months. Batticaloa District in Eastern province is the worst affected with 302,000 people experiencing the effects of drought. "
FL-2016-000137-ARG ,Flood ,Argentina ,2016/12/25 ,ARG , , ,"On 25 and 26 December 2016, more than 20 locations in the provinces of Buenos Aires, Córdoba and Santa Fe were affected by intense rainfall which was accompanied by hail and strong electrical activity. The fact that these were low-lying areas, the soil's saturation and the presence of crevices in basins (the most important in Argentina) caused by the constant rainfall throughout the year led to significant flooding and overflows from rivers and streams. The localities affected in this province by this emergency in this period were not affected by the rainy season in 2015 and 2016. Pergamino, a city in northern Buenos Aires province was one of the most affected by the rainfall, receiving some 220 millimetres of water in 4 hours, causing the Pergamino Stream, its tributaries and effluents, such as Chu Creek, to overflow. This led to flooding throughout the city, which is organized into 24 urban and peri-urban neighbourhoods. The flooding, mainly impacted riverside neighbourhoods (the river cuts across the city) such as 9 de Julio, Cueto, Centenario, Tocha, San Vicente, Kennedy, Centro, 27 de Noviembre, Belgrano, Martín M. de G?emes and José Hernández (the latter three are considered informal settlements); and Jorge Newbery (also an informal settlement) along Chu Creek, affecting 13,650 people, i.e. around 11 per cent of the total population. Basic services such as power, telephony, internet and water were partially interrupted for some 36 hours (completely in affected neighbourhoods), and some stretches of National Routes 8 and 9 (the main access roads to Pergamino) were blocked completely by flooding, making it difficult to mobilize assistance from outside of the city. More than 3,400 homes have been flooded (between 30 and 220 cm of water), forcing families to leave their homes as access is only possible by boat or some 4-wheel drive vehicles. According to Civil Defence reports, around 50 residents have refused to self-evacuate or be evacuated and remain on the roofs of their homes, and approximately 250 are being housed in four collective centres. At the family / individual level, in addition to some medical emergencies and health complications associated with the emergency (injuries, blood pressure issues, etc.), families have reported the loss of household items (furniture, appliances, household goods, bedding, etc.) and sanitation issues such as garbage, waterlogged structures, vermin, vectors. These issues have been exacerbated by the meteorological conditions that are typical for this time of year, such as mean temperatures above 24? C (with highs above 32? C), high humidity, unstable weather conditions and the pre-existing pollution of the Pergamino Stream. In addition to partial structural damage to dwellings and some public buildings (Primary Health Care Centres [CAPS] in G?emes and José Hernández neighbourhoods), the blocks adjacent to the Pergamino Stream have large amounts of accumulated debris and waste, which have been hard to remove because of the difficulty in accessing these streets. While the city does have a Local Response Plan, it failed to fully anticipate the storm's effects, catching a great number of families by surprise in their homes. On 25 December, the city formally declared a state alert, including a health alert, due to the level of impact suffered. In Cordoba Province, the strong storm that hit the area on 26 December caused damage to electrical and water services and forced 100 people to evacuate in Jovita. Twelve homes were damaged by hail, and electrical services were interrupted in La Cumbre and in La Falda due to high winds that damaged lamp posts. Six neighbourhoods suffered damage in Villa Dolores, 50 people had to self-evacuate and there were blocked roads and fallen lamp posts; additionally, the storm interrupted electrical and water services in Villa Giardini, Rio Ceballos, Salsipuedes, Agua de Oro, Jesús María and Colonia Caroya. More than 200 people in Santa Fe Province were forced to evacuate. The cities of Rosario and Alvarez were the most affected, as overflowing channels left half of the city cut off and hindered the evacuation efforts. Provincial authorities reported up to one metre of water in dwellings, including the Volunteer Fire Department facilities, which had to be evacuated as well. The National Society is coordinating state assistance in the form of mattresses, blankets, food, bags and tarps; relevant Ministry of Health agencies are working on site. "
FL-2016-000136-MYS ,Flood ,Malaysia ,2016/12/26 ,MYS , , ,"The seasonal heavy continuous rains in the East Coast of Malaysia from 26th December 2016 have caused flooding in two states, namely, Kelantan and Terengganu. The floods have temporarily displaced about 25,000 people and have rendered some villages inaccessible due to damaged bridges and blocked roads. "
FF-2016-000135-NPL ,Flash Flood ,Nepal ,2016/12/18 ,NPL ,Mustang district , ,"one recent disaster event that happened in mid-Northen Nepal in mountainous area on 17th December (Saturday). It was an unexpected big flash flood that swept away 7 bridges, drinking water supply system, irrigation canals and some houses and fortunately there is no loss of life. Different agencies have been asking DHM about the causes and we have to tell them the truth whether glacial lake has bursted or avalanche or anything else in the upstream. "
FL-2016-000133-VNM ,Flood ,Viet Nam ,2016/12/13 ,VNM , , ,"Heavy rainfall since 13 December has caused severe flooding in Central and South-Central Vietnam and parts of the Central Highlands. 15 people are known to have died and four people are missing. Almost 112,000 houses have been damaged. "
FL-2016-000130-VCT ,Flood ,Saint Vincent & The Grenadines ,2016/11/29 ,VCT , , ,"On Tuesday, 29 November 2016, St. Vincent and the Grenadines was impacted by heavy rains, which resulted in flooding and landslides in several communities. Sandy Bay in the north-eastern area of St. Vincent was the most severely affected community; however, the villages of Magum, Orange Hill, Overland, London, Point, Owia and Fancy in the north-east and Spring Village, Coulls Hill, Troumaca, Rose Bank, Sharpes, Fitz Hughes and Chateaubelair in the northwest of St. Vincent were also impacted. Some people suffered losses to their subsistence crops and livestock, and a they are experiencing severe psychosocial effects, access to water and sanitation issues, and financial challenges as a direct consequence of the flooding. "
FL-2016-000124-COD ,Flood ,Congo Democratic Republic ,2016/11/9 ,COD ,Gemena , ,"Since the beginning of the month of November, rains and winds have hit the town of Gemena, headquarters of the province of Sud-Ubangi. Gemena town is located 3 hours by air (979 Km) from the town of Kinshasa. with a total population of 350,511 people (source: Provincial Mayor). On 9 November 2016, rain and violent winds intensified, causing extensive floods in the Gemena neighbourhoods located on the banks of rivers Mombonga, Sukia and Labo. "
FL-2016-000123-DOM ,Flood ,Dominican Republic ,2016/11/24 ,DOM , , ,"A series of hydrometeorological events cause severe flooding and landslides in the provinces of Puerto Plata, La Vega, Espaillat, María Trinidad Sánchez, Montecristi, Santiago and Valverde.  "
FL-2016-000122-SRB ,Flood ,Serbia ,2016/11/24 ,SRB ,Kosovo , ,"?On 7 November 2016, heavy rainfall affected several areas of Kosovo* for three days with major floods. The situation is critical in the municipalities in Vushtrri, Gjakova, Rahovec, Podujeva and Malisheva. The rainfall intensity was approximately between 20 -25 mm/3h, or from 60-75 mm/24 hours. On 11 November 2016, the highest rainfall intensity recorded was 65-90 mm within 24 hours, which in total is 125-165 mm (l/m2). According to the preliminary information provided by the RCK structure operating in the flooded areas, the affected families have lost their winter food reserves and their livestock, including their home furniture and home appliances. Many families have been evacuated and some are in the process of being evacuated to schools. Power stations and water supply stations were flooded and many of the affected areas have no power and drinking water.? "
FL-2016-000121---- ,Flood ,(Non-Localized) ,2016/11/24 ,--- ,Kosovo , ,"On 7 November 2016, heavy rainfall affected several areas of Kosovo* for three days with major floods. The situation is critical in the municipalities in Vushtrri, Gjakova, Rahovec, Podujeva and Malisheva. The rainfall intensity was approximately between 20 -25 mm/3h, or from 60-75 mm/24 hours. On 11 November 2016, the highest rainfall intensity recorded was 65-90 mm within 24 hours, which in total is 125-165 mm (l/m2). According to the preliminary information provided by the RCK structure operating in the flooded areas, the affected families have lost their winter food reserves and their livestock, including their home furniture and home appliances. Many families have been evacuated and some are in the process of being evacuated to schools. Power stations and water supply stations were flooded and many of the affected areas have no power and drinking water. "
FL-2016-000120---- ,Flood ,(Non-Localized) ,2016/11/24 ,--- ,Kosovo , ,"On 7 November 2016, heavy rainfall affected several areas of Kosovo* for three days with major floods. The situation is critical in the municipalities in Vushtrri, Gjakova, Rahovec, Podujeva and Malisheva. The rainfall intensity was approximately between 20 -25 mm/3h, or from 60-75 mm/24 hours. On 11 November 2016, the highest rainfall intensity recorded was 65-90 mm within 24 hours, which in total is 125-165 mm (l/m2). According to the preliminary information provided by the RCK structure operating in the flooded areas, the affected families have lost their winter food reserves and their livestock, including their home furniture and home appliances. Many families have been evacuated and some are in the process of being evacuated to schools. Power stations and water supply stations were flooded and many of the affected areas have no power and drinking water. "
DR-2016-000118-KEN ,Drought ,Kenya ,2016/11/22 ,KEN , , ,"Available secondary source documents analyzed indicate that food security situation is wanting in 19 arid and semi-arid counties in the country. There are indications that the situation is likely to worsen further by January 2017. During the long rains season between March and May 2016, there was heavy flooding of River Tana, which washed away crops and delayed planting amongst the communities living along the river in Garissa and Tana River, resulting in reduced household level food security and dietary intake. Farming communities in marginal agricultural areas continue to have typically low income due to the recent below average agricultural season. As the lean season progresses these communities will continue to rely on the markets for food access. Short rains are the primary production season in these areas, it is expected that poor performance is likely to exacerbate household acute food insecurity with more households moving to even crisis levels.  "
FL-2016-000117-ALB ,Flood ,Albania ,2016/11/7 ,ALB , , ,"Since 7 November 2016, heavy rainfall affected Albania, especially the northern regions of the country. River flows have been rapidly increasing and worsened by illegal constructions next to river basins causing streams of water to descend into towns. The heavy rainfall has made the water levels of the Drini and Mat rivers which feed five hydroelectricity power lakes built on the rivers (Fierza, Koman, Vau i Dejes, Ulza and Shkopet). Authorities have been obliged to open the emergency gates to release the water from the lakes. The rain is nevertheless falling and the flooding is spreading to the Southern region ( Vlora and Fier areas) with the water level of the Vjosa River rising. In these areas 25 houses have been affected and the families have been evacuated from their homes. "
FL-2016-000114-EGY ,Flood ,Egypt ,2016/10/29 ,EGY ,"Heavy rains over the past few days have resulted in flooding parts of Upper Egypt and the Red Sea coast, affecting the governorates of South Sinai, Red Sea, Sohag, and Ismailiya. ", ,"Heavy rains over the past few days have resulted in flooding parts of Upper Egypt and the Red Sea coast, affecting the governorates of South Sinai, Red Sea, Sohag, and Ismailiya. According to official estimates as of 29.10.16, 26 people have been killed and 72 injured as a result of intense flooding and related hazards. The torrential rains, which began late on Wednesday, coupled with exceptionally high winds, have forced the authorities to shut four sea ports in Suez and Port Said provinces and to close some schools and main roads. Heavy rains are forecast to continue into early next week. Upper Egypt and Red Sea mountainous regions, impoverished areas with poor infrastructure, receive torrential downpours annually in late October and early November. "
DR-2016-000113-KEN ,Drought ,Kenya ,2016/11/3 ,KEN , , ,"Most ASAL counties are experiencing some degree of drought stress as the dry season draws to a close. Areas in the south-east and the coast are the most affected since they received below-average rainfall during the long rains season. One county (Kilifi) is in the alarm drought phase, while all others are in alert or normal, with a generally worsening trend. In parts of Kilifi, Garissa, Lamu, Kwale, Taita Taveta, Tana River, Makueni, Kajiado, Narok and Marsabit there are now significant shortages of pasture and water, and in some cases livestock mortality. The food insecurity situation is exacerbated by conflict in some counties, the most serious case in the previous month (September) being along the borders of Isiolo and Garissa where pastoralists' convergence is common. The prospects for the coming months will be determined by the onset and performance of the short rains season. If the season is below average, as currently forecast, or its onset is late, then the drought situation will become significantly worse, with impacts on health and nutrition, household purchasing power, and security. The implications of a poor season are particularly worrying for the marginal agricultural counties which are short rains-dependent. The NDMA in collaboration with county governments and other stakeholders has activated drought contingency plans in seven counties and is supporting all counties to coordinate their response and plan for a possible La Niña event. "
FL-2016-000103-IDN ,Flood ,Indonesia ,2016/9/20 ,IDN , , ,"Torrential rains triggered floods and landslides on the Indonesian island of Java, killing at least 20 villagers and leaving 14 others missing, an official said Wednesday, 21 September 2016. The worst-hit district was West Java's Garut, where 17 people were found dead and 13 others were missing after two rivers overflowed Tuesday night. "
FL-2016-000102-SEN ,Flood ,Senegal ,2016/9/5 ,SEN , , ,"On the nights of September 4 and 5, 2016, a heavy rain accompanied by strong winds caused significant material and human damage with a large number of affected people. In the area of St. Louis, it was estimated that there were about 1,313 affected families; especially in the department of Dagana that recorded 5 deaths and 106 injured, and destroyed houses, fields, schools, sleeping materials, household goods (chair, clothing, etc.) and walls. In addition, food stock reserves, poultry and livestock were lost in 4 towns and in the 40 villages mentioned below. "
FL-2016-000097-PRK ,Flood ,"Korea, Democratic People's Republic ",2016/8/31 ,PRK , , ,"Typhoon Lionrock, as well as a low pressure system, has triggered heavy rains over northwestern DPRK, causing the Tumen River to overflow and buildings to collapse. Early findings from the Government indicate that North Hamgyong Province has been most severely affected by extensive flooding, in particular Musan, Onsong, Kyongwon, Kyonghung, Yonsan counties as well as Hoeryong City. Flooding is known to have killed 60 people and displaced over 44,000 people. OCHA, 5 Sep 2016 "
FL-2016-000094-IND ,Flood ,India ,2016/8/25 ,IND ,"Madhya Pradesh, Bihar and Uttar Pradesh ", ,"Continuous rain in upstream Ganges basin have caused floods in Madhya Pradesh, Bihar and Uttar Pradesh. Flood waters from upstream caused 22 causalities in Bihar while affecting 23.71 lakh people. Ganga and five of its tributaries are flowing above danger level at six places - Digha ghat, Gandhi ghat, Hathidah in Patna, Bhagalpur and Kahalgaon in Bhagalpur district - and in certain points of Munger district and Buxar district. The Central Water Commission reports that water level of Ganga was flowing above danger level at Gandhi Ghat, Digha Ghat and Hathidah (Patna) by 168 cm, 79 cm and 141 cm respectively at 6 AM on 22-Aug-2016. In total 1.4 lakh persons were evacuated to safer places in addition to 1.05 lakh people are sheltered in 162 relief camps across the state. http://indianexpress.com/article/india/india-news-india/floods-recede-in-bihar-as-ganga-water-marks-decrease-2990985/ http://economictimes.indiatimes.com/news/politics-and-nation/bihar-flood-toll-climbs-to-89-over-33-lakh-people-hit/articleshow/53564598.cms http://economictimes.indiatimes.com/news/politics-and-nation/rains-floods-create-havoc-in-up/articleshow/53766065.cms http://economictimes.indiatimes.com/news/et-tv/4-states-battle-flood-fury-ndrf-teams-conduct-rescue-operations/videoshow/53821177.cms http://economictimes.indiatimes.com/news/politics-and-nation/urban-flooding-act-before-cars-and-bikes-start-floating-in-streets-again/articleshow/53779757.cms http://www.news18.com/news/india/bihar-reeling-from-floods-over-2-million-affected-1284648.html http://indianexpress.com/article/india/india-news-india/uttar-pradesh-flood-alert-2922703/ http://www.ndtv.com/india-news/in-flood-hit-uttar-pradesh-village-a-rope-turns-a-familys-lifeline-1448821?gp  "
FF-2016-000093-LAO ,Flash Flood ,Lao People's Democratic Republic ,2016/8/25 ,LAO ,Mountain area , ,"Tropical storm Dianmu formed in the South China Sea on 17 August and passed through Lao PDR around 2 days later, causing additional heavy rain which has been occurring since 11 August. Currently several districts in Luangprabang, Houaphan and Xaingabouli are affected, as indicated below.  "
FF-2016-000092-MMR ,Flash Flood ,Myanmar ,2016/8/19 ,MMR ,Mountain area , ,"Tropical storm Dianmu formed in the South China Sea on 17 August and passed through Lao PDR around 2 days later, causing additional heavy rain which has been occurring since 11 August. Currently several districts in Luangprabang, Houaphan and Xaingabouli are affected, as indicated below.  "
FL-2016-000091-NER ,Flood ,Niger ,2016/7/25 ,NER , , ,"Local authorities and the UN have been delivering food aid for the displaced people, and non-food aid is on its way. The rains are unlikely to ease the pressure on the country's food supply given the damage the flooding has wrought on crops. In 2015, as many as 103,000 people were affected by floods in Niger.  "
FL-2016-000090-SEN ,Flood ,Senegal ,2016/7/24 ,SEN , , ,"A total of 12,180 people have so far been directly affected by floods in Senegal. The Kaffrine area on 24 July received an unprecedented amount of over 175 mm of rainfall in less than a day. According to local authorities, 10,313 people were directly affected by the floods inundating their fields and sweeping away stocks of millet or other crops. Kaolack and Saint Louis also saw localised flooding earlier in July. "
FL-2016-000089-SEN ,Flood ,Senegal ,2016/7/24 ,SEN , , ,"A total of 12,180 people have so far been directly affected by floods in Senegal. The Kaffrine area on 24 July received an unprecedented amount of over 175 mm of rainfall in less than a day. According to local authorities, 10,313 people were directly affected by the floods inundating their fields and sweeping away stocks of millet or other crops. Kaolack and Saint Louis also saw localised flooding earlier in July. "
FL-2016-000085-MLI ,Flood ,Mali ,2016/7/23 ,MLI , , ,"Heavy rainfall, which started on 11 July 2016-23 July 2016 led to extensive flooding. The Gao, Mopti Ségou, and Sikasso regions have been worst affected by the rains and flooding.  "
FL-2016-000084-PHL ,Flood ,Philippines ,2016/8/18 ,PHL , , ,"Intense monsoon rains affected six regions of the country, mostly in Luzon, triggering flooding as well as landslides in some parts of Rizal province and Northern Luzon and forcing over 260,000 people to flee their homes. "
FL-2016-000081-GTM ,Flood ,Guatemala ,2016/6/21 ,GTM , , ,"As of June 2016, 8 people affected and 43 homes damaged by recent rains: The Civil Defense reported that the overflowing of the San Pedrito River damaged some 40 homes in El Milagro in the municipality of Masagua, department of Escuintla. Another sudden flood in the village of Ojo de Agua de Río Hondo, in Zacapa, caused drainage problems, minor damage to three homes and affected 18 people. ([PAHO, 21 Jun 2016] "
