GLIDEnumber,Event,Country,Date,Country Code,Location,Duration,Comments
FL-2021-000055-TJK ,Flood ,Tajikistan ,2021/5/12 ,TJK , , ,"As a result of intense rains heavy rains within May 5-12, 2021 in the territory of a number of districts of the Khatlon region and the DRS, mudflows were recorded, which, unfortunately, entailed human casualties. As a result of the disaster, damage was recorded to residential buildings, household plots, arable land, destruction of auxiliary structures, as well as erosion of the roadway. By May 12, 2021 according to last information: • 58 houses totally damaged • 123 houses partially damaged • 56 auxiliary buildings were damaged • 100 land plots were affected • 167 families evacuated Due to on-going rainy days, the scale of damages can be grown and the number of damages will be changed. "
DR-2021-000054-SOM ,Drought ,Somalia ,2021/5/1 ,SOM , , ,"On 1st May 2021, the Government of Somalia declared a National Emergency due to the Drought situation and called for support in responding to the humanitarian crisis.  "
FL-2021-000053-ETH ,Flood ,Ethiopia ,2021/4/26 ,ETH , , ,"The Early Warning Department of the National Disaster Risk Management Commission released the second issue of the National Flood Alert listing additional areas at risk of flooding and landslides, while several parts of the country continue to receive average to above average Belg/spring season rainfall since April. In Afar Region, some 27,400 persons have been displaced by flooding due to heavy rain and winds in Gulina, Ewa, and Beyalo, Dulecha, Harunka, and Mile Woredas. Livestock death was also reported. In SNNP Region, hailstorm damaged crops in Chama Hembecho and Afama Mino Kebeles of Boloso Sore Woreda in Wolayta Zone and some 250 hectares of land has been flooded in Abela Abaya Woreda. Some 11,200 households have been displaced and 8,019 households affected by flooding due to heavy Gu rains in Shabelle, Jarar, Dolo, Afder, Fafan, and Korahe Zones of Somali Region. The flooding also resulted in the death of 7,069 sheep and goats, 17 camels, 609 cows and damaged 4,049 hectares of cropland. Nine people were also reportedly killed in Dire Dawa City following the collapse of a wall due to heavy rains on 2 May 2021.  "
FL-2021-000051-SOM ,Flood ,Somalia ,2021/5/5 ,SOM , , ,"Reports indicate that at least 25 people have been killed due to the heavy rains including nine children who died after their house flooded in Banadir on 7 May, and four people killed by lightening in Puntland on 5 May. In Middle Shabelle region, riverine flooding has affected an estimated 25,000 people in 15 villages in Jowhar, "
FL-2021-000050-AFG ,Flood ,Afghanistan ,2021/5/3 ,AFG , , ,"Several provinces were affected by widespread flash flooding events since 3 May which have caused fatalities and destroyed homes. At least 37 people have died, more than 910 households were affected, dozens of homes destroyed, irrigation canals damaged and livestock lost across ten provinces in central, northern and western regions of Afghanistan, according to the Afghanistan National Disaster Management Authority. Assessments and the provision of humanitarian assistance are ongoing but slowed down by access constraints. "
FL-2021-000049-RWA ,Flood ,Rwanda ,2021/5/2 ,RWA ,"Burera, Gicumbi and Kayonza Districts ", ,"Since the beginning of January 2020, Rwanda has increasingly experienced heavy rains, thunders and strong windstorm, affecting most parts of the country. From 28 April to 2nd May 2021, extensive flooding and mudslides been reported in Burera District due to waterflows and rocks from the volcanoes. The effects of rains and windstorm is also observed in other districts including Gicumbi and Kayonza Districts. This has led to extensive destruction of houses, crops, latrines death of livestock, destruction of the roads, and loss of households’ materials and even human death.  "
FL-2021-000045-GEO ,Flood ,Georgia ,2021/4/29 ,GEO , , ,"On 29 April, heavy rain, hailstorm, and wind-affected Kakheti Region of Georgia. Agricultural lands, fruit trees, roofs got destroyed and many buildings flooded. In total, 1300 households (3900 people) were affected. "
FL-2021-000043-YEM ,Flood ,Yemen ,2021/4/15 ,YEM , , ,"Torrential rains and flooding which started in mid-April continued into May; intensified rainfall over the past few days is causing damage to infrastructure, destroying homes and shelter and causing deaths and injuries. "
FL-2021-000039-BDI ,Flood ,Burundi ,2021/4/20 ,BDI ,"Lake Tanganyika, Bugarama, Kanyenkoko, Muhuta, Nyanza-Lac, Gatumba, Rukaramu, Kibenga, Gisyo and Kabondo ", ,"Lake Tanganyika water level have been rising since February 2021. Heavy rainfall since the start of April has worsened the situation with further rainfall predicted until mid-May. As of 19 April 2021, the level of Lake Tanganyika stood at 776.4 metres above sea level compared to the normal average level of 772.7 metres. From April 12, 2021 in the province of Rumonge households near the shores were flooded. In parts of the lakes, it reported the coastline has expanded 300 to 500m. Houses are flooded, and families forced to leave to evacuation centres or host families. UNOCHA reported around 8,000 families have been affected and 2,000 displaced by flooding in lakeside communities including Bugarama, Kanyenkoko, Muhuta, Nyanza-Lac, Gatumba, Rukaramu, Kibenga, Gisyo and Kabondo. Two casualties have been recorded to date. On 20 April 2021, the Government (through the Meteorological Director General) officially declared the disaster and asked the affected populations to evacuate the flooded areas in the provinces of Rumonge, Makamba in the Nyanza-Lac Commune, Bujumbura Capital and Bujumbura Rural in the Mutimbuzi Commune in the zone of the Gatumba and Rukaramu areas. The Government has asked humanitarian actors to be mobilized to assist the affected people. Rains are expected till mid-May. As the waters continue to rise and the impact of the floods evolves continued assessment is underway by BRCS and other humanitarian partners. In addition, the Government are also considering their response in the short and long term it meets the needs of the affected population living in flood and landslide affected areas. (IFRC, 30 Apr 2021) "
FL-2021-000038-KEN ,Flood ,Kenya ,2021/4/16 ,KEN ,"West kenya, Coast, North Kenya ", ,"According to the Kenya Meteorological Department (KMD), the Climate Outlook for the 2021 March-April-May “Long Rains” season indicates that several parts of the country will experience enhanced rainfall while North Eastern parts of the country will receive below-average rainfall. Based on the state of the Ocean and the early onset, KMD has been issuing heavy rainfall advisories with the most recent being 19 April 2021 . The advisory indicated that heavy rainfall was expected over North East, South East, the Coastal Regions of Kenya, Western and Central regions including Nairobi Area. As predicted, from mid-March heavy rainfalls have been experienced in the country with the Western parts of the country being the most affected through displacement of populations and disruption of livelihoods. Tana River county has received moderate rains but some parts have been affected by flash floods due to waters from the rains upstream "
FL-2021-000035-HTI ,Flood ,Haiti ,2021/4/3 ,HTI , , ,"From 3 to 4 April heavy rains fell over the Northern regions of Haiti. According to last reports from the Civil Protection, flooding was reported in North West, North East and North Departments affecting at least 11 communes. Preliminary assessments indicate a toll of 2,676 affected households, 3 fatalities and 3 people still missing. Rapid assessments by the Ministry of Agriculture (MARNDR) and FAO estimate that 160 hectares of agricultural land have been severely affected. Important loses in livestock were also reported in North East department. Further assessments on the impact on agriculture are still to be undertaken in the departments of North and North East. "
FF-2021-000032-TMP ,Flash Flood ,East Timor ,2021/3/29 ,TMP , , ,"From 29 March to 4 April, heavy rains across the country have caused flash floods and landslides. The capital city, Dili, is the worst affected. According to preliminary official figures, a total of 2,065 households – or approximately 10,325 people - have been affected across 8 municipalities in Timor-Leste. 21 deaths were reported. "
FL-2021-000030-IDN ,Flood ,Indonesia ,2021/3/29 ,IDN , , ,"On 29 March - 1 April, several flooding and landslide events, triggered by heavy rainfall, occurred mostly in Java, Sumatra, and western Lesser Sunda Islands, resulting in about 75,506 affected people, and at least 50 displaced residents. "
FL-2021-000025-AUS ,Flood ,Australia ,2021/3/21 ,AUS , , ,"Heavy rains along Australia’s east coast over the weekend have brought the worst flooding in half a century in some areas, authorities said on Sunday, 21 March 2021, forcing thousands to evacuate and damaging hundreds of houses. "
FL-2021-000023-DZA ,Flood ,Algeria ,2021/3/6 ,DZA , , ,"Chlef Province in Algeria has experienced heavy rainfall on Saturday 06 March, causing Wadi Meknasa to flood including the area of the Oud Sly Commune, west of the city of Chlef. The floods caused severe damages to houses and infrastructures, sweeping away vehicles with its passengers, leading to the death of ten people washed away by the waterflood including three children. The Algerian Red Crescent (ARC) played a crucial role in the response through its Search and Rescue network of volunteers in support to the civil defence efforts since the beginning. "
DR-2021-000022-AFG ,Drought ,Afghanistan ,2021/3/16 ,AFG , , ,"During the second half of 2020, a moderate to strong La Niña phenomenon was registered that is causing extreme weather conditions in various parts of the world. This phenomenon, which affects temperatures, precipitation and storm patterns, is expected to continue at least until spring 2021, according to the World Meteorological Organization. In Afghanistan, this commonly results in below-average rainfall and snowfall across the country. The timing of this La Niña event coincides with the main wheat season with harvests in May-July 2021, which are critical following the lean season (January-April). The latest seasonal weather forecast suggests that Afghanistan has been experiencing below-normal rainfall from October 2020 through the first quarter of 2021. Such conditions are expected to continue through the first half of 2021 in the country according to forecasters.  "
FL-2021-000021-IND ,Flood ,India ,2021/2/7 ,IND , , ,"The glacier burst occurred on 7 February in northern Uttarakhand State (northern India), caused extensive flooding and killed at least 28 individuals, while around 206 people are still missing, according to the Government of Uttarakhand. "
FL-2021-000019-PER ,Flood ,Peru ,2021/2/15 ,PER , , ,"Heavy rain from 15 to 18 February caused a river to overflow in Madre de Dios Department (south-eastern Peru), which resulted in extensive flooding. According to UN OCHA and national authorities, more than 6,600 people have been affected and about 1,700 houses damaged or destroyed, due to the overflow of Madre de Dios River. Flooding has affected nine health centres, more than 160 km of roads, and 20 bridges and power outages and water disruptions have been reported.  "
FL-2021-000007-SYR ,Flood ,Syrian Arab Rep ,2021/1/19 ,SYR ,North West Syria , ,"A six-year-old boy has died and more than 20,000 children have been displaced by heavy flooding in North West Syria. At least 41,200 people have been affected by a heavy storm which has caused extreme flooding on Monday in northern Idlib and western Aleppo. Most of the people affected have already faced years of being uprooted from their homes due to conflict. At least 62 camps and 2,558 tents have been damaged or destroyed by the storm, often sweeping away the only possessions people had after nearly a decade of displacement. Tens of thousands of people scattered to find shelter from the ongoing storm in schools and mosques. Others were forced to sleep in the open air last night, in temperatures below zero. "
FL-2021-000005-IDN ,Flood ,Indonesia ,2021/1/18 ,IDN , , ,"Through its disaster monitoring portal, InaRisk, Indonesia’ Disaster Monitoring Agency has listed 13 districts (Balangan, Banjar, Barito Kuala, Hulu Sungai Selatan, Hulu Sungai Tengah, Hulu Sungai Utara, Kota Banjarbaru, Kota Banjarmasin, Kotabaru, Tabalong, Tanah Bumbu, Tanah Laut, and Tapin) in South Kalimantan as moderate-risk and high-risk flood areas. Moreover, Indonesia’s Meteorological, Climatological, and Geophysical Agency has also issued flood warnings for the above-mentioned districts. PMI is closely monitoring the situation and coordinating the response with relevant government agencies. At the district level, PMI volunteers in branches in the affected areas, have been deployed to the sites since the early stage of the disaster.  "
FL-2021-000004-IDN ,Flood ,Indonesia ,2021/1/16 ,IDN , , ,"Flooding and Landslides Across Indonesia, January 2021. Indonesia’s Meteorological, Climatological, and Geophysical Agency predicts the peak of La Nina to occur in December 2020 and January 2021. The peak of La Nina coincides with the peak of rainy season which usually occurs between January and February. The agency also states that this phenomenon could increase precipitation which triggers heavy rainfall across the country. During this period, Indonesia frequently suffers flood and landslides. As of January 14, 2021, several provinces in the country had reported floods and landslides since the beginning of the year. • Lhokseumawe (Aceh), 4 January 2021 • Langsa (Aceh), 4 January 2021 • Malang (East Java), 10 January 2021 • Sembakung (N. Kalimantan), 10 January 2021 • Bima, (West Nusa Tenggara), 10 January 2021 • Sumedang (West Java), 10 January 2021 • Solok (West Sumatra), 12 January 2021 • Tanah Laut (S. Kalimantan), 12 January 2021 • Banjar (S. Kalimantan), 12 January 2021 • Bandung (West Java), 13 January 2021 "
FL-2021-000001-MYS ,Flood ,Malaysia ,2021/1/4 ,MYS , , ,"Referring to the flood disaster report from NADMA, a total of 5 states (Johor, Pahang, Kelantan, Selangor, and Perak) have been affected by this disaster starting January 2, 2021. The latest report 4th January 2021 shows the impact of this disaster involving 3,880 families with 14,951 people affected by the flood. 188 evacuation centres have been opened in collaboration with the Social Welfare Department. The Malaysian Meteorological Department (MetMalaysia) has issued a bad weather warning with incessant heavy rain for several areas in Pahang and Johor on 3rd January 2021. The Malaysian Meteorological Department (MetMalaysia) has issued a bad weather warning with incessant heavy rain for several areas in Pahang and Johor. MetMalaysia in a statement said the rain has been forecast for Pekan and Rompin in Pahang, as well as Mersing in Johor. It said the districts of Raub, Bentong, Temerloh, Maran, Kuantan and Bera in Pahang as well as Segamat and Kluang in Johor, are expected to experience similar weather until 4th January 2021. Heavy rain is also expected in some areas in Kelantan, Terengganu, Pahang (Cameron Highlands, Lipis and Jerantut) and Johor (Tangkak and Muar). Meanwhile, floods in Malaysia have now affected 5 States (22 districts), with 14,951 people affected as of now. "
FL-2020-000242-COL ,Flood ,Colombia ,2020/11/16 ,COL , , ,"Landslides and flooding triggered by heavy rainfall continue to affect Antioquia Department (north-western Colombia), resulting in at least 18 fatalities and 3 missing people. Search and rescue operations are ongoing to recover the 3 missing people, after a landslide event occurred on 14 November in Dabeida, killing 5 individuals and leaving hundreds of families affected. The Colombian Meteorological Institute (IDEAM) has issued orange alerts for landslides over most of the central and western areas of Colombia and on 27-28 November, rainfall is forecast over most of central, and southern Colombia. "
FF-2020-000240-ZMB ,Flash Flood ,Zambia ,2020/12/25 ,ZMB ,Mumbwa district , ,"Heavy rainfall on 25th December 2020 resulted in the bursting of Kandesha Dam that led to flooding in Munengo, Kambobe, Katala, and Chiloweni communities of Mapona ward in Mumbwa district of Central province. The flood destroyed 261 houses and affected 500 households that need humanitarian assistance.  "
FL-2020-000237-LKA ,Flood ,Sri Lanka ,2020/12/8 ,LKA , , ,"Northeast monsoon and activation of a depression in the south-east Bay of Bengal, intensified rainfall in Sri Lanka during 2-5 December 2020. with the Northern Province as the worst affected. Two deaths were reported in Jaffna district in the Northern Province. The Government of Sri Lanka declared a local level emergency in the Northern Province from 2-5 December. Schools and institutions in the province were closed during this period. Sri Lanka’s Department of Meteorology reported maximum rainfall up to 279.8mm in Northern Province particularly in Jaffna and Kilinochchi districts following northeast monsoon rains. The continuous rains inundated most of the low lying areas in the two districts and caused damages to residential areas. As this situation intensified, agricultural lands and standing crops were also inundated and damaged as well as the infrastructure. It is expected that this heavy rainfall will continue, which will have an impact and further exacerbate the capacity of vulnerable households in the affected areas. According to the Disaster Management Centre (DMC) situation report , as of 8 December 2020, 111,659 people (33,316 families) have been affected across 14 districts. According to the report, 106 houses were fully damaged and 3,783 houses were partially damaged. A total of 15 evacuation centres were activated and 232 families were located in these centres. The DMC is coordinating the national response efforts.  "
DR-2020-000231-MDG ,Drought ,Madagascar ,2020/11/14 ,MDG ,"Regions of Anosy, Androy, Atsimo, Andrefana ", ,"Following longstanding drought and food crisis situation, the chronical crisis deteriorated from September 2020 into an acute crisis in the southern districts of the Anosy province, and the President of the Republic called for an international appeal on 14 November 2020 to all humanitarian actors to join the Government efforts in assisting the affected population in the South of Madagascar. "
FF-2020-000221-SOM ,Flash Flood ,Somalia ,2020/10/24 ,SOM ,Banadir region , ,"Flash floods triggered by Deyr seasonal rains (October-December) have affected nearly 20,000 people especially in Banadir region especially the capital of Mogadishu, Galmudug, South West and Jubaland states in the last two weeks. The floods have inundated swathes of farmland, damaged property and disrupted livelihoods at a time that Somalia is grappling with the COVID-19 pandemic and desert locusts in the northern region. "
FL-2020-000213-LAO ,Flood ,Lao People's Democratic Republic ,2020/10/21 ,LAO , , ,"The lower Mekong region (Cambodia, Lao PDR, Thailand and Viet Nam) has been experiencing prolonged heavy rain since 6 October 2020. This is due to the combination of numerous weather systems – the Inter Tropical Convergence Zone combining with cold air as well as tropical storms Linfa and Nangka as well as tropical depression INVEST 94W. The three wind systems made landfall in Viet Nam but brought along heavy rain to the rest of the lower Mekong region. Tropical storm Linfa made landfall on 11 October, tropical storm Nangka made landfall on 14 October whilst tropical depression INVEST 94W made landfall on 16 October. The rainfall brought by the wind systems exacerbated the flooding in Lao PDR and resulted in widespread flooding and landslides in southern Lao PDR. As of 20 October, 9 districts in 3 provinces were affected by the floods. The affected provinces are Salawan, Savannakhet and Sekong. "
FL-2020-000212-KHM ,Flood ,Cambodia ,2020/10/1 ,KHM , , ,"Since 1 October, Cambodia has experienced heavy rainfall across much of the country. As of 16 October, about 77,020 households in 11 provinces, including Phnom Penh, are reported to have been affected by flash floods. The worst affected are Battambang (38,890 households affected, 1,331 displaced), Pursat (18,365 households affected, 1,891 displaced) and Banteay Meanchey (8,538 households affected, 1,473 displaced). "
FL-2020-000211-VNM ,Flood ,Viet Nam ,2020/10/17 ,VNM , , ,"Vietnam has witnessed torrential rain due to a tropical depression combined with the cold air movement over the past few days in seven central provinces from Ha Tinh to Quang Ngai have witnessed torrential rain due to a tropical depression combined with the cold air movement. Constant heavy rain has caused water levels in rivers to rise rapidly. Consequently, large-scale flood appeared in the provinces from Ha Tinh to Quang Ngai province, with major floods concentrated in places from Quang Binh to Quang Nam province. Flood on medium and small rivers in Quang Binh, Quang Tri, Thua Thien Hue provinces all reached alert level 2 or 3 and even above level 3. Particularly, historical flood has happened on Hieu River (Quang Tri province) and Bo river (Thua Thien Hue province). "
FL-2020-000210-VNM ,Flood ,Viet Nam ,2020/9/18 ,VNM , , ,"On 18-21 September, several landslides triggered by flash floods occurred in the mountainous districts of Quang Nam Province (central Vietnam). Damage was reported to houses, at least 10 schools, several main roads and bridges, leaving many communities isolated. The power infrastructure and water network were damaged as well, affecting many families living in the area. Over the next 24 hours, rain and thunderstorms are expected of Quang Nam Province. "
FL-2020-000207-NGA ,Flood ,Nigeria ,2020/10/6 ,NGA ,"Jigawa, Kebbi, Kwara, Sokoto, and Zamfara states ", ,"On 6 October 2020, flood levels at the hydrological stations monitored in Niamey (Niger Republic) and Malan Ville (Benin Republic) reached the red alert zone due to the intensity of the torrential rainfall and caused flooding in Jigawa, Kebbi, Kwara, Sokoto, and Zamfara state (amongst other states) affecting 91,254 people or 15,209 households. The flood incident was caused by the intensity of the rainfalls at the peak of the flood season and the release of dams located in neighbouring Niger, Cameroon and Benin, which resulted in the Benue and Niger rivers overflowing and affecting communities living along their banks and in surrounding areas.  "
FL-2020-000206-COD ,Flood ,Congo Democratic Republic ,2020/10/1 ,COD ,"Saké, North Kivu ", ,"The heavy rains that fell on Thursday, October 1, 2020 at 2 p.m. in the city of Sake and its surroundings in the territory of Masisi, North Kivu province, has caused material damage and loss of life among the population.  "
FF-2020-000204-TUN ,Flash Flood ,Tunisia ,2020/9/12 ,TUN , , ,"Heavy rainfall began around 12 September when Monastir capital of the Monastir Governorate in the center of the country and many other towns around recorded 47.8 mm of rain in 24 hours., and Sidi Bouzid and many other towns of this governorate 58 mm. During the same period. Mahdia and all belonging localities recorded more than 40 mm of rain in 24 hours during 3 separate days. Kairouan recorded 89 mm of rain. Kef governorate registered similar amounts of rain especially in Sers locality. "
FL-2020-000203-ETH ,Flood ,Ethiopia ,2020/9/10 ,ETH ,South Gonzar , ,"On 10 September, heavy rainfall was reported in South Gondar zone in Amhara Region, with 62 mm recorded in 24 hours. The heavy and above average rain led to the backflow of Lake Tana and overflow of Gumera & Rib rivers, causing severe flooding. Across the country, heavy and prolonged Kiremt rains have led to flooding and landslide incidents in Afar, Oromia, Gambella, SNNP, Somali and Amhara regions between June and September. The latest National Disaster Risk Management Commission (NDRMC) reports indicates that close to 1,017,854 people have been affected and 292,863 people are displaced by floods across the country since the beginning of the season. The floods have killed livestock, destroyed crops and damaged homes and public infrastructure to an extent not seen in decades. Ethiopia Red Cross has been responding to those affected by the floods disasters in Afar, Oromia, and SNPRR regions. This DREF will support those displaced in Amhara region, South Gondar zone, following the latest phase of floods on 10th September as there are no other actors responding in the region.  "
FL-2020-000202-GIN ,Flood ,Guinea ,2020/9/6 ,GIN ,Kankan ,1 ,"From 6 to 7 September 2020, 26 out of the 27 districts of the urban municipality and the 12 sub-prefectures of Kankan experienced heavy rainfall causing major damage to people and their property. Based on initial assessments, 9907 households or 49536 people are affected including 23 248 men and 26 288 women, 4 371 children aged 0-5 years, 1145 pregnant women, 1238 lactating women, 135 disabled people, 946 elderly people. Some 657 houses are destroyed, with 1 363 people displaced, 551 water points destroyed, 75 host families, 744 latrines destroyed  "
FL-2020-000200-BFA ,Flood ,Burkina Faso ,2020/9/5 ,BFA , , ,"Since 5 September, heavy rain continues to affect central Burkina Faso (particularly the Centre Region, including the area of the capital Ouagadougou, and the Centre-Nord Region), triggering floods that have resulted in casualties and damage. As of 9 September, the government declared a state of national disaster. "
