,ID,event_id,article_title,article_link,article_content,publishing_date,article_image,article_keywords,article_relevance
36,36,FL-2018-000016-FRA_paris,Les rats sont-ils en train de grignoter peu à peu Paris ? - Franceinfo,https://www.francetvinfo.fr/sante/hygiene/les-rats-sont-ils-en-train-de-grignoter-peu-a-peu-paris_2574154.html,"Ils seraient près de 3,7 millions dans la capitale et leur nombre est loin de décroître. Depuis plusieurs années, ces rongeurs sont souvent observés dans les parcs parisiens. La mairie mène une campagne contre eux. Mais la lutte est difficile.

Est-ce un ""rat de marée"" ? Il n'est plus rare de tomber nez à museau avec un rongeur dans les jardins de Paris. Au square Gaston-Baty (15e arrondissement), un panneau donne le ton, sur la grille d'entrée : ""Laisser ses déchets à terre et les rongeurs prolifèrent"". Les trous de terriers constellent le sol, le long des murets. Un rat explore un emballage en papier, tandis qu'un autre traverse les allées à toute allure, avant de filer dans les buissons. Franceinfo a également constaté la présence de rats au square Emile-Chautemps (3e), mais les exemples pourraient se multiplier dans toute la ville. Quoi qu'en disent les studios Disney, le menu de Ratatouille est en réalité concocté par les Parisiens distraits.

Une population difficile à estimer

Le rattus norvegicus (ou surmulot) mesure entre 19 et 27 cm, pour environ 300 g. Sa présence est dénoncée depuis plusieurs années dans la capitale. En 2014, déjà, un journaliste du Guardian (en anglais) s'était étranglé devant ces ""vraiment gros rats"", après la publication de photos prises devant le musée du Louvre. Plus récemment, des éboueurs ont diffusé la vidéo d'une benne grouillant de rongeurs. Interrogé par Le Parisien, l'un d'eux évoquait ""une prolifération (...) dans tous les arrondissements qui bordent la Seine"". La ville de Paris, elle, rappelle que ""toutes les grandes villes (et les campagnes) sont confrontées au phénomène"". Consciente du problème, elle a tout de même lancé un plan de dératisation dont le coût est évalué à 1,5 million d'euros, en 2017.

Des rats dans les jardins du Louvre, en juillet 2014. (XAVIER FRANCOLON / SIPA)

Les rongeurs commensaux (rats et souris) sont omniprésents dans les villes. Paradoxalement, nos connaissances sont pourtant limitées sur leur biologie et leur écologie en milieu urbain. Leur nombre même fait débat. Auteur des livres Des rats et des hommes (éd. Hyform, 2013) et Le Grand guide de lutte raisonnée contre les nuisibles ou bioagresseurs urbains (éd. Lexitis, 2014), Pierre Falgayrac avance le chiffre de 1,65 rat par habitant ""dans les villes dont les égouts sont anciens et où la gestion des déchets est correctement conduite (hors grèves)"". Soit environ 3,7 millions de rats à Paris.

Ce ratio a été déduit d'une expérimentation menée à Marseille en 2009. De la nourriture est déposée dans les égouts, puis la quantité consommée est pesée, afin d'en déduire le nombre de rats sur un tronçon d'égouts. Il suffit ensuite de faire la moyenne sur tout le réseau et d'ajouter les rats de surface (évalués à 20%). ""Je n'ai pas une confiance totale dans ces estimations car elles reposent sur beaucoup d'hypothèses"", nuance toutefois Georges Salines, chef du bureau de la Santé environnementale et de l'hygiène à la mairie de Paris. Selon lui, fixer un ratio immuable n'a d'ailleurs pas grand intérêt pour évaluer l'efficacité des politiques de lutte menées par les municipalités.

L’objectif n’est pas de diminuer la quantité globale de rats dans Paris, mais de diminuer les proliférations de rats dans l’espace public. Georges Salines, chef du bureau de la Santé environnementale et de l'hygiène à la mairie à franceinfo

Ce qui est certain, c'est que la grande majorité des rats logent en sous-sol, et batifolent dans les égouts. Humidité, température tempérée, absence de prédateurs... Les conditions y sont idéales pour le petit mammifère. ""Quand la cloison des égouts n'est pas étanche, ils peuvent d'ailleurs faire un terrier dans la terre avoisinante"", ajoute Jean-Michel Michaux, de l'Institut scientifique et technique de l’animal en ville. Avec ses briques, ses moellons et son mortier, le réseau présente en effet des failles, aussitôt exploitées par les rats. ""Depuis vingt ans, il y a eu une réfection du réseau d'égouts, aujourd'hui beaucoup plus étanche"", nuance toutefois l'expert en dératisation.

Rénover les canalisations et bétonner les caves

""Tant qu’ils ne sortent pas des égouts, les rats ne posent pas de problème"", estime le spécialiste. Les rats peuvent accéder à la surface par les avaloirs, mais selon lui, le principal point noir réside dans les interstices des colonnes descendantes des eaux usées d'immeubles, parfois très abîmées. ""Paris a beaucoup de très vieux immeubles, résume l'expert en dératisation. Il faut engager un travail de réfection de ces colonnes ou opter pour la bétonnisation des sols de cave."" A Zurich (Suisse), en pointe dans ce domaine, la ville peut même obliger les particuliers à faire contrôler ces canalisations et à les faire réparer si nécessaire.

Les cités qui rénovent progressivement leur réseau d’égouts (Zurich, Budapest) constatent une disparition totale des plaintes liées à la présence de rats sur les secteurs refaits, sans avoir modifié leurs stratégies de collecte d’ordures et de nettoiement. Pierre Falgayrac, auteur des livres ""Des rats et des hommes"" et ""Le grand guide de lutte raisonnée contre les nuisibles et bioagresseurs urbains"" à franceinfo

Dans les égouts, les rats ne posent pas de problème. Ils seraient même utiles. La mairie rappelle ainsi que ces animaux peuvent manger 10% de leur poids par jour, soit 9 kg par an. En consommant 75 des 800 tonnes de déchets (comestibles) déversées quotidiennement dans les égouts de Paris, ils permettent donc de nettoyer les canalisations. Pierre Falgayrac, toutefois, est plus nuancé sur les bénéfices éventuels de leur présence. ""Il n'y a quasiment rien à manger dans les égouts – c'est d'ailleurs pour ça que les rats en sortent le soir venu.""

Les rats plébiscitent les jardins car ils y trouvent de l'eau, de la nourriture et de la terre facile à creuser. Mais pourquoi sont-ils aujourd'hui plus nombreux en surface ? ""Les Parisiens ont changé leurs habitudes. Ils mangent davantage de sandwichs, par exemple"", estime Jean-Michel Michaux, ce qui laisse davantage de restes aux rongeurs. Par ailleurs, les poubelles renforcées ont laissé place aux sacs plastique, dans le cadre du plan Vigipirate : les rats les rongent parfois pour accéder aux déchets. Les nouveaux comportements des citadins expliquent en partie cette évolution, ajoute à son tour Stéphane Bras, porte-parole de la chambre syndicale 3D (pour désinfection, désinsectisation et dératisation).

Les espaces urbains sont modifiés. Zones piétonnières, parcs… Nous vivons de plus en plus à l’extérieur. Les modes de restauration ont changé dans les villes, avec par exemple des aires de pique-nique, et le tourisme croît. Les lieux de nourriture se multiplient. Stéphane Bras, porte-parole de la chambre syndicale 3D à franceinfo

Une campagne de lutte contre les rats sur le Champ-de-Mars, le 29 septembre 2017 à Paris. (LUDOVIC MARIN / AFP)

Les grands rassemblements peuvent également attirer les rongeurs. Benoît Pisanu, du Muséum national d’histoire naturelle, évoque par exemple la ""fan zone"" de l'Euro 2016, installée au pied de la Tour Eiffel pendant les quatre semaines qu'a duré l'événement. L'afflux de spectateurs et de déchets constitue alors ""une source abondante de nourriture pour les rats qui vont localement et temporairement en profiter"". Les Amis du Champ-de-Mars, une association de riverains, a vertement mis en cause la municipalité, laquelle a dû lancer, fin 2016, des opérations de dératisation avec des fermetures partielles et successives des pelouses de la zone.

D'autres facteurs conjecturels peuvent expliquer l'afflux de rats à la surface. Lors des grands travaux, et notamment lors des destructions d'immeubles, les mâchoires des pelleteuses détruisent les terriers du sous-sol, ce qui pousse les rats à chercher d'autres espaces à coloniser. Les crues favorisent également cet afflux, car l'eau inonde les ratières et pousse les rongeurs à la fuite. Un argument saisi au bond par la maire Anne Hidalgo, qui rappelle que Paris a connu deux crues importantes (juin 2016 et janvier 2018) en dix-huit mois.

Des rats tentent de fuir la crue de la Seine, le 2 juin 2016, à Paris. (MAXPPP)

La mairie contre-attaque et appelle au ""civisme""

Les rats ne font pas de quartier et peuplent l'ensemble de la capitale. En 2016 (derniers chiffres disponibles), la mairie a réalisé 3 329 interventions après signalement de la présence de rats ou de souris : 37 % dans les parcs et 24 % dans des établissements de la petite enfance. En tête des déplacements figuraient les 19e, 18e, 13e, 14e et 20e arrondissements. Plusieurs squares ont également fait l'objet d'opérations de dératisation (Cambronne, Garibaldi, Villemin, tour Saint-Jacques...). Et cette année, des interventions sont d'ores et déjà prévues dans le square Charles-Victor-Langlois (4e arrondissement) et dans les squares de la Roquette et Richard-Lenoir (11e).

Une boîte à appâts pour lutter contre les rats, dans le square Gaston-Baty du 15e arrondissement de Paris, jeudi 1er février 2018. (F. MAGNENOU / FRANCEINFO)

Si vous jetez un œil aux bas-côtés des jardins, vous apercevrez sans doute l'une de ces boîtes à appât déployées en masse par la municipalité. La mairie prévoit également de remplacer les sacs-poubelle par trois types de dispositifs : conteneurs à roulettes, cache-conteneurs en forme de cahutes ou Moloks – des cylindres recouverts de lattes qui abritent une cuve profonde de plusieurs mètres. Et la ville de Paris entend lutter contre ce qu'elle considère comme des incivilités. Ces prochaines semaines et prochains mois, la direction de la prévention, de la sécurité et de la protection devrait dresser davantage de contraventions contre les personnes qui nourrissent les pigeons et les chats – et du même coup, les rats.

Cette campagne, toutefois, ne convainc pas tout le monde. Julien Devaux, délégué CGT aux égoutiers, y voit une tentative de la mairie de ""masquer ses propres responsabilités en la matière"" et pointe un manque de personnel.

Aujourd’hui, la moitié des bennes ne sortent pas des entrepôts, car il n’y a pas suffisamment de ripeurs. Les déchets restent plus longtemps. Julien Devaux, délégué CGT FTDNEEA à franceinfo

Pour améliorer la situation, un effort est sans doute nécessaire dans le secteur du nettoiement, d'autant que le taux d'absentéisme chez les éboueurs atteint 13,3% et jusqu'à 20% dans les 5e et 6e arrondissements, précise Le Monde. Par ailleurs, Julien Devaux regrette que le département Faune action salubrité (DFAS) de la ville ne compte en moyenne que 1,8 agent par arrondissement – la CGT en réclame au moins 4. En charge du service, Georges Salines évoque plutôt une soixantaine d'agents dans toute la capitale, tout en espérant que ses troupes soient étoffées dans le futur.

Les raticides fonctionnent moins bien

Julien Devaux pointe un autre problème dans les égouts, où 7,5 tonnes de raticides sont déposées chaque année, selon la mairie. Selon le syndicaliste, les produits sont utilisés moins fréquemment ""depuis trois ou quatre ans"", sans que les agents n'en connaissent la raison. A tel point, selon lui, que les agents prennent parfois eux-mêmes l'initiative des campagnes.

""Nous avons davantage de difficulté pour tuer les rats"", résume Georges Salines. La législation européenne (règlement ""Biocides"" UE 528/2012 de mai 2012 et règlement CLP) a en effet durci les conditions d'utilisation des raticides, ces anticoagulants qui provoquent des hémorragies internes. Auparavant déposés en granules dans les nids, les appâts doivent désormais être placés sous forme pâteuse, à l'intérieur de boîtes équipées d'un trou seulement accessible aux rats, afin d'épargner les animaux domestiques et les oiseaux. ""C'est une bonne chose pour l'environnement, résume Georges Salines, mais les rats consomment moins ces appâts, car ils n'ont plus faim"" : ils sont repus après leurs virées dans les squares.

Les rats creusent des terriers dans les parcs et jardins parisiens. (F. MAGNENOU / FRANCEINFO)

La question des rats fait l'objet de vives polémiques au Conseil de Paris. Le groupe Les Républicains estime que le phénomène ""est directement lié à la passivité de la ville de Paris"". David Belliard, coprésident du groupe EELV, évoque pour sa part un ""problème réel"" qui fait l'objet ""d'une hystérisation"" et d'une récupération politique de la part de l'opposition. Lui-même confronté à ces problèmes au square Richard-Lenoir (11e), l'élu refuse toutefois de verser dans le catastrophisme : ""Il ne faut pas imaginer qu'on va être envahis de rats.""

Par souci du bien-être animal, son groupe a voté contre une mesure du Conseil de Paris, qui a lancé une étude en partenariat avec VetAgro. L'objectif est d'adapter au plus juste le choix des anticoagulants, sans avoir systématiquement recours aux produits de 3e génération, plus efficaces mais également plus nocifs. ""Si des rats sont encore sensibles aux produits de première et deuxième génération, il faut les utiliser, explique Georges Salines, pour retarder le phénomène de résistances aux anticoagulants."" L'idée, à terme, est de réaliser des mesures sur site, pour évaluer les différences entre sous-populations de rats, et d'ajuster au mieux les produits utilisés.

""L'hiver est plutôt une période calme avec les rats, car les gens se nourrissent moins dans les parcs, résume Georges Salines, davantage préoccupé par les souris domestiques ces temps-ci. Ce problème doit être géré, mais ce n'est pas non plus le problème de santé publique numéro un.""","Thu, 08 Feb 2018 08:00:00 GMT",https://www.francetvinfo.fr/pictures/U1_6_M2WWjkRIm0PkLLUELCjDa0/1500x843/2018/02/05/phpp72uL9_1.jpg,"['la', 'train', 'à', 'et', 'dans', 'en', 'les', 'grignoter', 'rats', 'des', 'le', 'sontils', 'paris', 'peu', 'par']", 
37,37,FL-2018-000016-FRA_paris,"Grand entretien : pour Philippe Labro, ""Trump inonde la scène publique"" - Midi Libre","https://www.midilibre.fr/2018/02/11/grand-entretien-pour-philippe-labro-trump-inonde-la-scene-publique,1626143.php","Le journaliste et écrivain Philippe Labro passe au crible l’an 1 du singulier locataire de la Maison-Blanche.

Donald Trump est souvent vu comme une anomalie. N’est-il pas au contraire l’incarnation de la face sombre de l’Amérique (*), celle du repli et du mépris des autres cultures ?

On peut voir Trump comme la traduction d’un état d’esprit d’une partie de l’Amérique, la partie blanche qui se sent un peu dépassée et qui a détesté les huit ans de présidence noire d’Obama. Celle qui n’a pas beaucoup de boulot, frustrée et insatisfaite depuis longtemps et qui voit Trump comme quelqu’un qui interprète ses aigreurs, même si ses décisions économiques, financières, fiscales ne leur seront pas forcément favorables. Trump n’est pas un accident, c’est une fatalité.

Son arrivée au pouvoir a-t-elle sorti de l’apathie certains Américains, notamment sur la défense du climat ?

Une partie des gens pense qu’on peut continuer à creuser des mines, à ouvrir des puits de pétrole tant que ça consomme, que ça fonctionne. Et puis il y a des générations plus jeunes concernées par l’environnement.

Son attitude n’a fait qu’effectivement raviver la certitude d’un grand nombre de personnalités et en particulier les maires des grandes villes et le gouverneur de Californie qu’il fallait résister à ce négativisme sur l’environnement. C’est très intéressant, car c’est l’illustration de la division de la société américaine : l’État est résolu à ignorer le problème climatique, mais une partie résiste. Tout va dépendre du ou des mandats de Trump et de sa capacité à revenir sur ses déclarations. Il n’a pas complètement fermé la porte et, quand il va recevoir Macron aux États-Unis, dieu seul sait ce qu’ils vont se dire.

L’approche d’Emmanuel Macron envers Donald Trump peut-elle être payante pour les accords de Paris sur le climat ?

Oui, la force de Macron, c’est qu’il ne renonce à rien. Comme il sait qu’il y a un facteur d’imprévisibilité chez Trump, il préfère insister. Il ne peut pas, en tout cas, lui tourner le dos. L’Amérique demeure l’allié historique de la France et c’est une nation avec laquelle on doit compter. Il y a donc un réalisme de la part de Macron qui est tout à son honneur.

Après douze mois de tumulte, de fracas, de fureur, percevez-vous un fil rouge dans l’action du président américain ?

Malgré tout, oui. Le fil rouge, ce n’est pas particulièrement celui que j’aime, c’est un retour au nationalisme aigu, au conservatisme violent avec la nomination de juges qui vont à l’encontre de tout ce qui avait été fait depuis huit ans. Un conservatisme provocateur qui ouvre des pipelines pour faire passer le pétrole à travers l’Alaska, des paysages jusqu’ici inviolés. Des initiatives incongrues, sporadiques et contradictoires en matière de politique internationale. Une continuité dans le favoritisme envers les couches les plus aisées de la population. Une hostilité permanente envers les médias, l’institutionnalisation des fake news et cette insupportable et invraisemblable politique du tweet. On ne peut pas dire qu’il n’a pas fait quelque chose. Il a fait, avec sa vision. À sa manière, il impose son rythme. Il y a donc un fil rouge, c’est le “trumpisme”.

Sa politique migratoire choque au pays du melting-pot. Ne risque-t-elle pas d’affaiblir l’économie américaine ?

À moyen terme, oui. Pas à court terme. Mais là aussi il modifie un peu son discours en ce moment. Comme on dit en anglais “all talk, no show”, beaucoup de paroles, mais pas tellement de démonstrations. Le mur avec le Mexique, il ne l’a toujours pas construit.

Quels points mettriez-vous à son crédit ?

Pas grand-chose. Il a une présidence très négative, trop conservatrice à mes yeux, je ne vois pas beaucoup, pour employer un terme religieux, de qualités rédemptrices. (Rires)

Après un an au pouvoir, quelle note lui donneriez-vous ?

3/20. C’est très sévère, c’est ma subjectivité par rapport à l’homme, son comportement, sa vulgarité, sa crudité, son imprévisibilité, son incohérence, son manque d’organisation. On peut peut-être lui donner 5/20. Sauf qu’il est là, il existe, il impose son ton et son rythme. Les médias sont pendus à ses paroles, il y a du Trump partout et tout le temps. Ce faisant, il inonde la scène publique, l’opinion publique et, pour l’instant, obscurcit toute possibilité pour les démocrates de trouver un leader avec un discours et un projet précis. Et, dans ce domaine, je lui donne 20/20. Il réussit à dévaloriser les démocrates. Mais rendez-vous en novembre pour les élections de mi-mandat.

Les attentes qui ont émergé autour d’une candidature d’Oprah Winfrey confirment une dérive américaine.

C’est un petit coup de foudre médiatique d’une journée parce qu’elle a fait un beau discours, que c’est une femme et qu’elle est noire. Tout le monde s’est dit “ce serait formidable, c’est ça la réponse”. Or sa réponse à elle, c’est “no way”, “je n’y vais pas”. De toute façon, ce serait de la blague, il la battrait ! Elle n’a aucune expérience, aucun professionnalisme. Même si lui en a peu, il en a plus qu’elle.

Trump est-il aujourd’hui le VRP de l’Amérique ou de son empire ? Tous ses rendez-vous donnés dans ses hôtels interrogent.

Il y a de ça, mais il s’est mis à aimer le pouvoir. Il ne pensait pas gagner, le bouquin de Michael Wolff (Le feu et la fureur, NDLR) le raconte assez bien, mais il aime ça et je pense que ses affaires sont entre les mains de sa famille.

Ce livre de Wolff a relancé le débat sur ses facultés mentales. Vous ne le voyez pas comme un “cas psychiatrique”, mais comme quelqu’un qui ne sait pas gouverner.

Nixon et George Bush ont été aussi des “cas psychiatriques”. Attention, Trump n’est pas fou, il est mentalement désordonné. Ce bouquin ne peut être pris comme une référence objective et historique, il est plein de on-dit, rapportés par un homme qui a la réputation de déformer les faits. Il faut le prendre comme un formidable recueil d’anecdotes juteux qui fabrique le buzz.

À la lecture de ses premières décisions sur la scène internationale, diriez-vous en revanche que le locataire de la Maison-Blanche est un homme dangereux ?

Oui. Quand on agite le bouton nucléaire et les forces armées américaines, les plus grandes du monde, face à la Corée du Nord dont on ne connaît pas précisément la nature de son chef, on est sur le fil du rasoir. Mais cette escalade verbale a fait la une des journaux et aujourd’hui il ne se passe plus rien. Les Coréens du Nord et du Sud se sont mis d’accord pour aller ensemble aux JO, au grand désarroi de M. Trump qui se rend compte qu’on peut négocier tout cela sans lui. Donc beaucoup de verbe, de bruit, pour pas grand-chose.

Le Pentagone planche sur des armes nucléaires destinées à une utilisation en opérations. Doit-on craindre une relance de la prolifération nucléaire ?

Bien sûr ! Il y a aujourd’hui trois grands dangers mondiaux : la prolifération nucléaire, l’explosion démographique de l’humanité et l’environnement.

Comment imaginez-vous la suite de son mandat : abrégé par une destitution, interrompu à terme, ou renouvelé ?

Comme disait Victor Hugo à Napoléon : “L’avenir n’est à personne, l’avenir est à dieu.” Attention au prévisionnisme, aux prophéties. C’est trop tôt pour le dire, le vrai tournant, c’est les élections en novembre qui, si elles donnent des sièges supplémentaires aux démocrates au Congrès et au Sénat, peuvent vraiment faire effet de bascule. Quant à la destitution, c’est un processus lent, compliqué, il faut des preuves formelles et incriminantes d’une obstruction de la justice. Elle n’est pas probable, elle est envisageable.

On aurait tort de vouloir enterrer prématurément Trump...

Absolument, j’en suis convaincu. Il y a le souhait et le désir de ceux qui ne l’aiment pas. Et il y a la réalité.

(*) Théorie défendue par l’écrivaine pakistanaise Kamila Shamsie.","Sun, 11 Feb 2018 08:00:00 GMT",https://images.midilibre.fr/api/v1/images/view/5b28fed58fe56f3244393ec0/large/image.jpg,"['philippe', 'et', 'pour', 'une', 'publique', 'inonde', 'les', 'des', 'grand', 'à', 'scène', 'labro', 'qui', 'trump', 'la', 'entretien', 'pas', 'le', 'il']", 
