,ID,event_id,article_title,article_link,article_content,publishing_date,article_image,article_keywords,article_relevance
29,29,FL-2018-000016-FRA_paris,"L'agriculture, cause des inondations : les lecteurs de Terre-net réagissent - Terre-net",https://www.terre-net.fr/observatoire-technique-culturale/strategie-technique-culturale/article/inondations-les-agriculteurs-disent-stop-a-l-agribashing-217-134766.html,"Paroles de lecteurs Inondations : les agriculteurs disent stop à l'agribashing

Alors que les paysans ont une nouvelle fois été montrés du doigt suite aux inondations et crues ayant touché de nombreuses régions françaises, les lecteurs de Terre-net se sont défendus contre ces attaques en commentant l'article publié sur le sujet. Parfois, ils ont répondu aux accusations présentes dans les commentaires eux-mêmes. Alors qui sont les responsables : les mauvaises pratiques agricoles ou l'urbanisation ? Et si au lieu d'opposer systématiquement les agriculteurs et les citadins, tout le monde cherchait des solutions, ensemble ?

Baldin : « Les drainages n'accélèrent en rien l'évacuation de l'eau. Et un sol compacté absorbe bien plus d'eau qu'un sol qui ne l'est pas. Si l'eau s'infiltre peu ou si elle s'évacue plus vite vers les fossés, les cours d'eau gonflent plus vite. Je n'ai jamais dit que les agriculteurs sont responsables des inondations. Mais celui qui prétend que certaines pratiques agricoles n'ont pas d'effet est un menteur ou un benêt. »

Olivier T : « Moi, le paysan ""écolo"", je suis atterré de voir les paysages modifiés par mes collègues, si vite et surtout sans aucune cohérence. Chacun tire la couverture de son côté. Où sont passées les haies qui retiennent l'eau l'hiver pour l'été ? Que dire de tous ces sols drainés pour augmenter les rendements du blé, qui contient du gluten, au lieu d'adapter son système de culture au sol et au climat ? L'eau s'évacue beaucoup plus vite. Tout ça cumulé avec l'excès d'urbanisation... l'eau arrive plus vite vers les points bas. Sans compter les sols nus l'hiver : eh oui, ça existe encore. Et les labours jusqu'aux bords des routes : dans certains secteurs, si les paysans pouvaient labourer la route, ils n'hésiteraient pas, faut pas perdre quelques centimètres ! Pas de place non plus pour une haie qui, par son système racinaire, ralentirait l'eau. L'urbanisation excessive, associée aux mauvaises pratiques culturales, ne sont que le début des catastrophes. Il est grand temps de changer les logiciels d'urbanisme et agricoles. Pour produire une alimentation plus saine, pour tous ces urbains qui ont les pieds dans l'eau et ne connaissent pas le mot ""bottes"". »

Desintox : « ""Où sont passées les haies qui retiennent l'eau ?"" Depuis quand une haie a ce pouvoir ? Ce n'est pas une digue ni un barrage ! Les haies peuvent limiter l'érosion des sols par ruissellement de la terre, mais retenir l'eau certainement pas ! Je suis consterné par tous ces gens qui croient systématiquement tout ce qu'on leur raconte dans les médias sans se poser de questions. »

Le cheval de devant : « Ces commentaires de cour d'école sont stériles. Des solutions simples et économiques existent. À nos décideurs de faire abstraction de leurs ambitions personnelles pour mettre enfin en place de vrais outils de régulation de marché par exemple. L'écologie ne s'en portera que mieux si l'on admet qu'un agriculteur doit vivre de son métier sans être le jouet des holdings internationales. La course à la productivité trop libérale nous mènera vers la fin de l'agriculture familiale française. Pour produire intelligemment, il faut certes réduire l'impact sur l'environnement, mais il faut aussi que les citoyens puissent vivre dignement en ville comme à la campagne. L'opposition systématique entre les deux ne sert à rien, il faudrait plutôt chercher les bonnes solutions ensemble. »

GentilBisounours : « Le cheval de devant, tu vis dans le monde des Bisounours. Ton écologie appliquée en France ne sert à rien si ce n'est à importer des productions 10 fois plus polluantes car il ne faut pas se le cacher, l'agriculture bio (en grandes cultures) ne produit que très peu. Si les frontières restent ouvertes, les produits français seront 5 à 7 fois plus chers que ceux importés et en plus, ils ne procureront pas un revenu suffisant pour vivre, sauf si on en cultive plusieurs centaines d'hectares. L'agriculture extensive en somme... La France n'a pas un territoire extensible, pire, la bétonisation réduit les surfaces agricoles un peu plus chaque année. Vous vivez en dehors de la réalité ! »

David : «""Vous vivez en dehors de la réalité"" : c'est bien le problème de 50 % des écologistes et de 90 % des politiques. Disons-le haut et fort, les grandes villes sont des bras d'honneur à la nature et à tout principe écologique. Et si vous continuez à penser que l'agriculture est le premier pollueur, demandez-vous plutôt où vont toute la gomme de pneus laissée sur les routes, les fuites du réseau sanitaire, les polluants et les particules fines issues du diesel ou du mazout ? C'est tout de même un comble que la ville de Paris ne soit jamais responsable de ces problèmes... Vous croyez sérieusement que l'on peu entasser plus de 10 millions de personnes sur quelques centaines de kilomètres carrés sans que cela ait des graves conséquences sur l'environnement. On avait déjà pu entendre le maire accuser les agriculteurs de la Marne ""d'envoyer leurs particules fines dans la grande ville"". Bien sûr, cela ne pouvait pas être le trafic intense de la capitale. Bref, encore des politiques qui caressent leur électorat de le sens du poil en usant de la simple, mais efficace, solution de ""pointage du doigt"" sur un bouc émissaire, en l’occurrence une catégorie professionnelle très peu répandue dans les grandes villes : les agriculteurs. »

« Mieux vaut protéger la grenouille à deux têtes que les agriculteurs qui nourrissent la population ! »

Patou : « Les élus ont le droit de décider pour les autres mais aussi le devoir de savoir de quoi ils parlent. Si la c... était taxée, beaucoup de politiques et tous les écolos seraient ruinés. »

Pat 80 : « Puisque une bande en herbe autour des champs suffirait à protéger des inondations, pourquoi tous ces gens qui donnent des leçons aux paysans n'en ont pas mis à Paris, autour des maisons et des immeubles. »

Lili : « En été, les agriculteurs sont accusés d'assécher les cours d'eau. En hiver, ils sont responsables des crues. Il existe une solution pour réduire les inondations l'hiver et pouvoir irriguer l'été : créer des bassins de réserve. Or, de nombreux projets sont en suspens. Suis-je bête, cela risque de détruire la faune et la flore ! Il vaut mieux protéger la grenouille à deux têtes que les agriculteurs qui nourrissent la population ! »

Baldin : « Bah oui... et les drainages, et les sols compactés... Jamais responsables de rien les paysans ! »

Steph72 : « Bah oui... et les constructions dans les zones humides, les bétonnages et goudronnages incessants (un département disparaît tous les 10 ans)... Jamais responsables de rien ces citadins ! »

Baldin : « Bien sûr, les paysans n'ont pas besoin de routes goudronnées pour emmener leurs enfants à l'école, ni pour se faire livrer leurs tracteurs ou collecter leur lait... »

Zozzo : « Bah oui... et tous ceux qui ont bâti en zone inondable... et les routes qui ont été construites sans respecter les retenues d'eaux naturelles et les passages d'eau... et les écolos qui nous interdissent de nettoyer les rivières ou les fossés... et les citadins qui envoient des tonnes d'eau de consommation ou de pluie à l'égout. Mais bon, c'est plus facile d'attaquer les paysans que de se remettre en cause ! »



Si les rivières étaient nettoyées régulièrement, les berges entretenues, les fossés curés...

Vgor : « Baldin, les écolos sont en grande partie responsables des catastrophes actuelles : il y a 20 ans, nous avions l'obligation d'entretenir les cours d'eau et les berges, de retirer les arbres morts, de désensabler régulièrement, de curer les fossés, etc. Aujourd'hui, on risque presque la prison si on a le malheur d'approcher un godet un peu trop près du si précieux biotope. Un technicien ""vert"" disait il y a peu : ""Les crues ? c'est normal, c'est la nature et on doit la laisser faire. Lorsqu'une une rivière sort de son lit, c'est normal..."" Donc, à vous qui avez les pieds dans l'eau, qui avez perdu vos photos, vos souvenirs, vos meubles, votre voiture, sachez qu'il y a des gens payés avec vos impôts, qui applaudissent des deux mains car la nature ""reprend ses droits"". Sachez que pour pouvoir étudier le triton à poils durs, nous ne pouvons plus nettoyer ni rivières, ni fossés et que lorsque le bois mort s'amoncelle en amont d'un petit ruisseau, il y a de fortes chances que les rivières en aval sortent de leur lit en cas de fortes précipitations. Dommage que les journalistes et les élus ne parlent pas de ce scandale. Dommage qu'aucun fonctionnaire de l'Onema ne soit interrogé et ne vienne expliquer à ces gens pourquoi ils ont tout perdu... »

Jean-François : « Si les rivières étaient nettoyées, il y aurait moins d’eau dans les terres. Quand on voit, à Nogent-sur-Seine, des bancs de sable en plein milieu du fleuve... Il y a 20 ans, la Seine était nettoyée et c’était financé par l’État. Il a décidé d’arrêter et tout le monde dit que c’est la faute des agriculteurs. Faut peut-être pas pousser le bouchon trop loin... Où est donc passé l’argent public qui servait à l’entretien des rivières ? L'État a trouvé la solution : faire payer les assurances. Au final, les agriculteurs sont encore perdants car les cotisations vont certainement augmenter. »

Billyone : « Madame Célia Blauel, sortez de chez vous au lieu de raconter des bêtises ! Les terrains agricoles sont travaillés ou enherbés, donc ils absorbent l'eau. Le problème provient d'une grosse quantité d'eau tombée en peu de temps. Le sol ne peut plus l'absorber, notamment à cause de l'urbanisation, du développement des ZI, des ZA et des lotissements. Ces lieux sont bétonnés et goudronnés. »

Lolo51 : « La disparition des zones humides est un fait : deux tiers des surfaces ont disparu en 100 ans en France. La faute à qui ? À l'agriculture ? Oui, en partie mais il ne faut pas oublier que les pouvoirs publics ont subventionné la destruction des zones humides pour les mettre en culture... L'artificialisation du territoire est aussi un immense problème. Il n'y a pas une ville moyenne aujourd’hui, sans zone d'activité ou commerciale construite sur des terres agricoles ou des zones humides. Incompétence des élus locaux, égo surdimensionné de certains politiques... les inondations sont une vaste problématique, qui a des causes multiples et qui ne trouvera pas de solution sans y mettre les moyens nécessaires. J'attends avec impatience que Paris soit vraiment inondé et j'espère que ce sera l'année des JO. Une p'tite crue à 100 milliards d'euros de dégâts fera peut-être réfléchir nos représentants politiques... »

Se défendre dans les médias et sur les réseaux sociaux

Bruno : « Entre 1981 et 2012, 2 millions d'hectares agricoles ont été urbanisés, dont la moitié imperméabilisés, et cela continue à raison de 60 000 ha par an. En assénant de tels propos, Célia Blauel ne démontre que son incompétence. Quant aux agriculteurs, il serait temps qu'ils sortent de leur campagne et s'expriment ailleurs, sur des réseaux qui ne leur sont pas dédiés. Hurler au loup du fond d'une caverne est parfaitement inefficace ! »

Pifetpaf : « Moi, je suis sur twitter depuis huit ans, sur Facebook, et je suis intervenu dans plusieurs journaux généralistes papier et chaînes de télé. Mais à la louche, nous ne sommes que 400 000 agriculteurs en France et nous ne sommes pas tous connectés. Nous ne représentons donc pas grand-chose sur la toile. Et même lorsque nous nous exprimons sur les réseaux sociaux, tout le monde s'en fout royalement. »

The germs : « D'accord avec toi sur l'importance de communiquer et j'essais de poster les mêmes messages sur plusieurs sites de presse. Mais, ça prends du temps car souvent, on crée du débat et il faut répondre aux questions et aux attaques. Or, ce n'est pas notre travail. Et que faire quand les accusations sont institutionnalisées, comme dans le cas présent, ou comme l'année dernière, lorsque la préfecture de Bretagne, je crois, expliquait durant la vague d'alerte aux particules fines que celles-ci provenaient ""des épandages agricoles"" alors qu'on était en pleine période d'interdiction d'épandage... Que faire encore face à une chaîne de radio comme France Inter qui, chaque jour, passe des messages anti-agriculture et anti-élevage, tel un leitmotiv, en organisant parfois des ""débats"" qui n'en ont que le nom ! Que faire quand nous ne sommes même pas invités à nous défendre ! Que faire quand l'exclusion de l'autre, parce qu'il est agriculteur, est devenue normale ! Je lisais des articles dans la presse de ce matin encore, qui brandissent l'éternel argument du remembrement, terminé depuis 30 ans, comme cause de tous les maux, donc des inondations actuellement. Le plus incroyable : la fondation d'Athus-Bertrand exhorte à ne plus manger de viande pour diminuer les risques alors qu'il n'y a aucun rapport entre les inondations et la consommation de viande. Les zones humides, entretenues par les herbivores, diminuent sûrement plus les inondations qu'elles ne les accentuent. »

Pseudo : « De toute façon, les écolos ont décidé de tuer l'agriculture de leur pays. Une part grandissante de la population se trouve déconnectée du monde agricole et a oublié d'où elle vient. Elle sera sûrement satisfaite quand les aliments seront tous importés d'Amérique du Sud ! »

The germs : « Et la neige qui a mis la pagaille à Paris, pas de doute, c'est sûrement encore la faute des agriculteurs. J'espère que la mairie de Paris va dénoncer le lobby agro-industriel de la fédé et de la conf', responsable de cette tempête de neige !! À moins que ce soit une action des agriculteurs pour dénoncer les prix dérisoires du lait, du sucre ou encore de la farine de blé... (bref, tout ce qui est blanc et qui ressemble à de la neige). Vraiment pas sympa les agriculteurs !!! Heureusement que les Parisiens ont pu faire des stocks de pâte à tartiner... »

© Tous droits de reproduction réservés - Contactez Terre-net","Fri, 09 Feb 2018 08:00:00 GMT",https://cdn4.regie-agricole.com/ulf/TNM_Biblio/fiche_134766/fiches_Paroles_de_lecteurs_inondations.jpg,"['la', 'et', 'à', 'lecteurs', 'pas', 'en', 'réagissent', 'cause', 'qui', 'les', 'le', 'des', 'inondations', 'que', 'terrenet', 'lagriculture']", 
30,30,FL-2018-000016-FRA_paris,Jouy-le-Moutier : les questions après la décrue qui s’amorce - Le Parisien,https://www.leparisien.fr/val-d-oise-95/jouy-le-moutier-les-questions-apres-la-decrue-qui-s-amorce-04-02-2018-7541064.php,"La borne du chemin, c'est son repère. «Au plus fort, elle était entièrement sous l'eau. Ce matin, elle est quasiment dégagée. Il y a 40, 45 cm de moins », montre Fabrice, qui habite la rue de la Prairie, à Jouy-le-Moutier. La décrue est bien amorcée ce dimanche matin après une forte baisse le samedi. Un de ses voisins remonte la rue en bottes avec le sourire. «Ils viennent de remette le gaz. Mais la chaudière met du temps à tout réchauffer... » Dans la rue, l'électricité reste coupée dans une maison ainsi que le gaz dans une autre, le résident est absent. Dans la rue du Pré-aux-Moines, l'autre rue inondée de la commune, 6 maisons restent privées d'électricité, le gaz est en grande partie rétabli.

L'heure est déjà au bilan et il s'annonce désagréable. « J'ai tout perdu », poursuit Fabrice. « Maintenant, avec les assurances, c'est le parcours du combattant qui s'annonce. J'avais une voiture en réparation : 5 000 € sont sous l'eau. Des moteurs de motos de collection, l'électroménager, l'outillage... Mon atelier est noyé. » Fabrice a placé en hauteur sa Harley, perchée sur le puits. Les roues au sec, mais de justesse.

Avec la décrue, émergent les questions. «On nous a annoncé une crue du niveau de juin 2016. A l'époque, j'avais 20 cm chez moi et j'ai donc ensuite tout surélevé de 50 cm. Quand on a parlé de 2016, j'y ai cru, je ne me suis pas inquiété. Mais c'est monté largement au-dessus. Il devait y avoir un mètre, un mètre dix... Nous n'avons pas été informés de la véritable ampleur de la crue. Cela a été pire que 1995. Je ne me plains pas, j'habite au bord de l'eau, c'est à moi de faire attention. Mais je voudrais quand même savoir pourquoi cela n'a pas été prévu. On va sur Mars aujourd'hui. Il y avait moyen de mieux prévenir. »

Les pompiers ont utilisé un drone pour réaliser ses photos de crues à Jouy-le-Moutier qu’ils ont publié sur Facebook ce vendredi. Sdis 95

« C'est beaucoup plus qu'en 2016. On a pris 50 ou 60 cm de plus !, confirme le maire DVD de Jouy-le-Moutier, Jean-Christophe Veyrine. A aucun moment cela a été dit. Et nous n'avons pu que le constater. Au plus fort, cela montait d'un centimètre par heure ! »

Une «crue modérée » de l'Oise était annoncée par Vigiecrues, le 26 janvier, en évoquant toutefois des niveaux pouvant être plus importants près du confluent du fait de la hauteur de la Seine. Ce même jour, il était annoncé à Paris « une crue importante, pouvant atteindre des niveaux comparables à ceux de juin 2016. » Le 1er février, Vigiecrues prévoyait pour l'Oise une crue «modérée, plus importante sur la partie aval du tronçon. »","Mon, 05 Feb 2018 08:00:00 GMT",https://www.leparisien.fr/resizer/9Glqe7xauvqSaG1wE_SH7wlB4Rw=/1200x675/arc-anglerfish-eu-central-1-prod-leparisien.s3.amazonaws.com/public/DOAEAASUZHHYGNDLDE6MMBVI24.jpg,"['la', 'rue', 'à', 'en', 'plus', 'après', 'les', 'décrue', 'le', 'questions', 'samorce', 'jouylemoutier', 'il', 'du', 'qui', 'est', 'une']", 
31,31,FL-2018-000016-FRA_paris,INFOGRAPHIE - Inondations : les villes qui restent sous la menace des eaux - La Croix,https://www.la-croix.com/France/INFOGRAPHIE-Inondations-villes-restent-menace-eaux-2018-02-05-1200911452,"Lundi 5 février, sept départements de la vallée de la Seine et de la Marne étaient toujours en vigilance orange crue et inondation. Car, si d’après « Vigicrue », l’organisme chargé de recenser le phénomène, la décrue est amorcée sur tout le territoire, elle devrait être très lente et la situation pourrait mettre du temps avant de revenir à la normale. Tour d’horizon des différents bassins touchés.

Julien Tranié

►Villeneuve Saint Georges, la Seine en amont de Paris

Dans la commune du Val-de-Marne, deux quartiers étaient encore touchés ce lundi et la très lente décrue a obligé la mairie à prendre certaines dispositions. Ainsi, la maternelle et l’école élémentaire Paul-Bert sont délocalisés respectivement dans un centre de loisir et une autre école de la ville.

Par ailleurs, l’évacuation est encore « fortement conseillée » par le maire, pour les habitants qui ont leur maison inondée depuis plusieurs jours. « Rester dans sa maison n’est pas sans danger », rappelle-t-il. Un homme est décédé dans la commune, samedi soir, après avoir été intoxiqué au monoxyde de carbone par son groupe électrogène.

►Bry-sur-Marne, des habitants les pieds dans l’eau depuis dix jours

La Marne entame, en ce début de semaine, une très lente décrue. Résultat des courses, l’eau qui inonde les rues de Bry-sur-Marne ne s’évacue pas, et cela dur depuis dix jours. Dimanche 4 février encore, une dizaine de personnes ont dû se faire à l’idée d’une évacuation et ont quitté leur domicile.

Le maire Jean-Pierre Spilbauer se veut pourtant rassurant : « La situation est en train de se stabiliser » explique-t-il. Deux nouvelles pompes ont été mises en place « pour limiter les dégâts ». Mais les zones de rétentions d’eau étant saturées, ces dernières ne peuvent jouer leur rôle à plein.

►Paris, transports toujours perturbés

D’après les relevés de la station de Paris-Austerlitz par l’organisme Vigicrue, le niveau de la seine baisse légèrement dans la capitale mais reste toujours très élevé à 5,28 m, lundi 5 février à la mi-journée.

Si les habitations ne sont pas menacées à Paris, cette forte crue perturbe toujours les transports. Ainsi, de nombreux sous-sols aux abords des quais de Seine étaient toujours inondés d’après les services de la mairie. De ce fait, la circulation du RER C est toujours interrompue et ne reprendra pas avant le 10 février minimum, en fonction de la vitesse de décrue.

►Villennes-sur-Seine, en aval de Paris

Même situation en aval de Paris, où des passerelles en bois ont dû être installées dans la commune de Villennes-sur-Seine. La police municipale locale l’assure : « On est toujours dedans », explique un agent avec dépit. La décrue s’est ici aussi amorcée « très lentement ».

C’est d’autant plus dur, pour les habitants, que la commune avait déjà été touchée par les inondations de 2016. Ce soir, la situation devrait encore se compliquer, car en plus d’être classé en vigilances crues et inondations, les Yvelines sont classées en vigilance orange neige et verglas par Météo France jusqu’à mardi minimum.

►Saint-Aubin-lès-Elbeuf

Située en léger amont de Rouen, la commune a été choisie par le ministre de l’économie Bruno Le Maire pour un déplacement ce lundi auprès des sinistrés de la ville, toujours en partie inondée. Accompagné du secrétaire d’État, Sébastien Lecornu, le ministre a demandé aux assurances d’indemniser « sans créer de complications », indiquant également qu’il les recevrait à Bercy pour suivre le dossier.

Par ailleurs, de nombreux habitants ont exprimé leur mécontentement contre les coupures d’électricités préventives pour « raison de sécurité » effectuées par Enedis. L’entreprise a indiqué que le retour à la normale ne se fera que lorsque la Seine aura regagné son lit. Et comme partout, cela devrait prendre du temps.","Mon, 05 Feb 2018 08:00:00 GMT",https://i.la-croix.com/1400x933/smart/2018/02/05/1200911452/Villeneuve-Saint-Georges-30-janvier_0.jpg,"['la', 'restent', 'et', 'à', 'eaux', 'en', 'ont', 'villes', 'les', 'le', 'sous', 'inondations', 'infographie', 'toujours', 'qui', 'pour', 'par', 'menace']", 
