,ID,event_id,article_title,article_link,article_content,publishing_date,article_image,article_keywords,article_relevance
12,12,FL-2018-000016-FRA_paris,Inondations et canicules : quelles solutions pour y faire face en ville ? - The Conversation FR,https://theconversation.com/inondations-et-canicules-quelles-solutions-pour-y-faire-face-en-ville-91790,"Janvier 2018 : Paris boit à nouveau la tasse. La Seine et la Marne sont sorties de leur lit, obligeant certains habitants de la banlieue à regagner leur domicile en barque, tandis que le célèbre zouave du pont de l’Alma se pare d’un gilet de sauvetage. La montée des eaux a également suscité de vives inquiétudes autour de Lyon et dans les environs de Strasbourg, où le Rhin a atteint des niveaux préoccupants.

Et si cette situation devenait la norme ? D’après certaines études, le coût des dégâts liés aux inondations en Europe devrait plus que doubler en raison du réchauffement climatique pour s’établir à quelque 15 milliards d’euros.

Dans nos régions, ces inondations dévastatrices et coûteuses seront désormais monnaie courante, et ce même si nous réussissons à maintenir limiter ce réchauffement à moins de 1,5 °C, comme le recommande l’Accord de Paris.

Les villes européennes risquent dans les années à venir d’être écrasées par des vagues de chaleur qui céderont la place à des épisodes pluvieux extrêmes, donnant du fil à retordre aux urbanistes et aux services de santé. Pour éviter ces périls, les villes devront entièrement revoir leur politique. Si la réduction des émissions de gaz à effet de serre est essentielle pour ne pas aggraver les dérèglements climatiques, d’autres options s’offrent également aux municipalités pour faire face à ces aléas.

Informer la population

Il est primordial d’informer la population des vagues de chaleur à venir, par toutes les sources de communication et d’information possibles. Les applis et les réseaux sociaux tels que WhatsApp ou Facebook peuvent en effet s’avérer très pratiques, à condition d’être utilisés de façon cohérente, comme l’expliquent des spécialistes des sciences sociales chargés d’observer la réaction des réseaux sociaux aux catastrophes en Californie.

Les infrastructures du quotidien, comme les supermarchés, les pharmacies et les cafés, peuvent aussi se révéler très utiles. À Vienne, les églises ont ainsi accueilli touristes et habitants pendant les vagues de chaleur de 2015 et 2017.

Des services d’information mobiles doivent être mis en œuvre pendant les épisodes caniculaires afin d’aider les services de santé et les travailleurs sociaux à localiser les personnes âgées, souvent isolées et particulièrement vulnérables aux fortes températures. Rappelons qu’en France, la canicule de 2003 avait fait des milliers de victimes parmi ces classes d’âge.

Dans cet esprit, la Poste a lancé à l’été 2017 un projet pilote proposant à ses clients un service payant d’aide pour leurs proches isolés.

Végétaliser les espaces urbains

Les trames bleues et vertes, futures normes en matière de planification et de construction, permettent de réintroduire des éléments naturels au sein des bâtiments. Elles consistent à multiplier les étendues d’eau et à créer des zones spécifiquement inondables (dans les zones humides de la Seine, par exemple) ou des endroits où l’eau peut stagner. Ce type de solution technologique peut convenir dans les cas où les zones humides ou riveraines sont indisponibles ou totalement remblayées.

La présence de la végétation permet en effet d’affronter la chaleur et les fortes précipitations par filtration, absorption, percolation et écoulement. Les sols non artificialisés des parcs, cimetières et jardins publics remplissent parfaitement ce rôle, de même que les toits et murs végétalisés. Véritables « tampons thermiques », ils permettent de rafraîchir les zones fortement urbanisées.

C’est également le cas des immeubles écologiques et autres jardins de pluie courants à Milan ; ceux-ci se sont avérés par exemple très utiles à New York, en absorbant près de 50 % des précipitations ambiantes.

Autre option de végétalisation : les anciens terrains industriels à convertir en vastes parcs publics et espaces verts, comme ces fermes urbaines installées dans le centre de Berlin, à Édimbourg, Malmö ou encore Leipzig. Autre solution, les rigoles de drainage biologiques ; ces canaux linéaires recouverts de végétation ont été spécialement conçus pour atténuer et traiter le ruissellement des eaux pluviales.

La présence d’arbres contribue tout autant à combattre la chaleur, les fortes précipitations et les émissions dues au transport automobile (particules, oxyde d’azote).

Toutes ces techniques concourent à bâtir des villes dites « résilientes ».

S’adapter, expérimenter

Au-delà de ces considérations techniques, il faut aussi souligner la dimension politique de l’aménagement urbain au sein des villes résilientes : c’est ici l’ensemble des habitants qui doit pouvoir accéder gratuitement, dans le cadre d’un service municipal et public, aux informations nécessaires à l’atténuation du risque de catastrophe.

Élémentaires, ces méthodes compléteront des solutions écologiques plus techniques, à l’image des mesures de prévention des inondations instaurées à Vienne ou Cologne et qui ont fait leurs preuves.

En Allemagne, après les crues désastreuses de l’Elbe au cours des deux dernières décennies, les digues ont ainsi été déplacées et modifiées pour élargir la plaine inondable naturelle et laisser plus de place au fleuve. Malgré tout, le barrage a cédé il y a quatre ans.

C’est la raison pour laquelle d’autres villes appliquent la stratégie inverse : accueillir l’eau, au lieu de la retenir. C’est le cas à Hambourg, qui envisage de créer une nouvelle plaine inondable pour l’Elbe afin de rétablir « un certain équilibre naturel dans sa zone portuaire », soumise à des conditions difficiles depuis un demi-siècle en raison d’un trafic maritime intense.

S’il est certain que des rigoles de drainage ou du gazon planté le long d’une plaine inondable paraissent bien dérisoires face à une crue centennale, ces solutions peuvent néanmoins la ralentir et en réduire les pics, laissant ainsi plus de temps à la population pour réagir.

Créé en 2007, Axa Research Fund soutient plus de 500 projets à travers le monde portés par des chercheurs de 51 nationalités. Pour en savoir plus sur le travail de Dagmar Haase, rendez-vous sur le site du Axa Research Fund. Cet article a été traduit de l’anglais par Angélique Avit pour Fast for Word.","Mon, 19 Feb 2018 08:00:00 GMT",https://images.theconversation.com/files/206861/original/file-20180218-75961-7qekd0.jpg?ixlib=rb-1.1.0&q=45&auto=format&w=1356&h=668&fit=crop,"['la', 'et', 'à', 'face', 'en', 'quelles', 'faire', 'ville', 'les', 'solutions', 'des', 'le', 'inondations', 'ces', 'y', 'pour', 'par']", 
13,13,FL-2018-000016-FRA_paris,"Paris : la Seine remonte, les berges à (re) nettoyer - Le Parisien",https://www.leparisien.fr/paris-75/paris-la-seine-remonte-les-berges-a-re-nettoyer-19-02-2018-7568280.php,"La crue fait encore des siennes. Ce lundi midi, le niveau de la Seine est monté jusqu'à 4,15 m, et le fleuve a débordé en inondant deux voies sur berge : le quai du Parc Rives de Seine, sous le Pont de Bir-Hakeim (XVI e -XV e ), et sur le port de Solférino (VII e ) qui longe le musée d'Orsay. Vigicrues, le service central d'hydrométéorologie et d'appui à la prévision des inondations, explique que cette soudaine montée est due aux précipitations du week-end sur des sols déjà gorgés d'eau. Trois jours après le nettoyage complet des quais par les équipes de la mairie de Paris, cette remontée nécessitera un nouveau déblayage qui fera encore reculer la réouverture des voies submergées. Ce mardi, la Seine devrait continuer de monter et la tendance devrait s'inverser dans la soirée, selon les prévisions de Vigicrues.","Mon, 19 Feb 2018 08:00:00 GMT",https://www.leparisien.fr/resizer/3SlQib9q5vZEpLks8oYW5PDk4zY=/1200x675/arc-anglerfish-eu-central-1-prod-leparisien.s3.amazonaws.com/public/WLEC2ONZ3XXXZ6BKYY5ZQP6JPY.jpg,"['seine', 'la', 'voies', 'remonte', 'à', 'qui', 'les', 'le', 'des', 'berges', 'vigicrues', 'nettoyer', 'sur', 'paris', 'et']", 
14,14,FL-2018-000016-FRA_paris,Rivière ou fleuve : pourquoi l'Yonne a été détrônée par la Seine - L'Yonne Républicaine,https://www.lyonne.fr/auxerre-89000/actualites/riviere-ou-fleuve-pourquoi-l-yonne-a-ete-detronee-par-la-seine_12727535/,"Il n’intéressera guère les sinistrés, bien sûr, mais certains médias dont France Info ou BMF.TV se sont fait récemment l’écho d’un vieux débat, à l’heure où les inondations rythment l’actualité.

Qui de la Seine ou de l’Yonne

inonde la Normandie après l’Ile-de-France ?

En vérité, la Seine ne manque pas d’air... Car si elle a inspiré les poètes, ce n’est point elle qui coule à Paris, sous le pont Mirabeau cher à Apollinaire. Point elle qui « s’en va vers la mer, en passant comme un rêve, au milieu des mystères de Paris », n’en déplaise à Prévert.

« C'est L'Yonne qui se jette dans la Manche »

Mais c'est bien l’Yonne selon cette règle que rappelle Yves Boquet, professeur de géographie à l’Université de Bourgogne et secrétaire général de l’association des géographes français. « Quand deux cours d’eau se réunissent, c’est celui ayant le plus petit débit qui se jette dans l’autre. » Et est donc son affluent. (empty)

Or, à Montereau-Fault-Yonne, à leur confluent, « la Seine a un débit moyen de 80 m3/seconde pour un bassin-versant de 10.100 km2, et l’Yonne de 93 m3/sec pour un bassin-versant de 10.836 km2 ».

C’est donc bien l’Yonne qui « traverse Paris et se jette dans la Manche, à hauteur du Havre ». Et qui mériterait le titre de fleuve usurpé par la Seine, tandis que celle-ci devrait être un simple affluent.

La Seine affluent... de l'Aube

Non pas de l’Yonne mais de l’Aube, d’ailleurs. Car en amont, à Marcilly-sur-Seine, l’Aube aussi domine la Seine avec « un débit de 41 m3/sec contre 33 m3 », souligne le géographe.

Pourquoi alors cette injustice qu’ont dénoncés plusieurs auteurs, Henri Vincenot (Les canaux de Bourgogne), Roger Brunet (Atlas et géographie de la France moderne) comme Michel Grandin (Rivières de France, histoires et portraits) ? La faute aux méandres de l'Histoire...

La Seine était considérée comme sacrée par des druides et donc décrétée supérieure aux autres, puis la rivière Sequana (Seine) a été élevée au rang de divinité par les Romains. Pour ceux qui la contrôlaient, imposer la Seine était une manière d’asseoir leur pouvoir.

Autre explication selon Le Dictionnaire des canaux et rivières de France, « la Seine étant plus facile d’accès depuis la Saône que l’Yonne, les anciens ont baptisé Sequana un axe commercial de Chatillon-sur-Seine à Paris ».

Des bloggeurs blagueurs peuvent bien rebaptiser des départements (l’Yonne-et-Marne, l’Yonne-Maritime ou l’Yonne-Saint-Denis), la Seine peut dormir tranquille, dans ou hors de son lit : l’histoire ne sera pas réécrite...

Le saviez-vous ?

L'Yonne n'est pas le seul cours d'eau à avoir perdu som nom au profit d’un affluent. ""Loire et Allier se valent, la Garonne devrait être le Tarn, le Rhin devrait être l'Aar, le Mississippi devrait s'appeler Ohio, et le Gange, en Indedevrait être la Yamuna"", souligne le géographe Yves Boquet.

Inondations - Cinq jours de crues dans l'Yonne en images

Christophe Pacalet

christophe.pacalet@centrefrance.com","Mon, 05 Feb 2018 08:00:00 GMT",https://img.lamontagne.fr/G_Umz4pD9Te9uPMI8qdnDQl72cI6XBLUwkRntYC69jM/fit/657/438/sm/0/bG9jYWw6Ly8vMDAvMDAvMDMvNjEvNDQvMjAwMDAwMzYxNDQyNg.jpg,"['seine', 'ou', 'la', 'lyonne', 'à', 'se', 'détrônée', 'qui', 'les', 'été', 'le', 'pourquoi', 'des', 'rivière', 'fleuve', 'et', 'par']", 
15,15,FL-2018-000016-FRA_paris,Inondations en Val-de-Marne: le niveau remonte - 94 Citoyens,"https://94.citoyens.com/2018/inondations-val-de-marne-niveau-remonte,04-02-2018.html","De nouvelles évacuations ont du intervenir en bord de Marne ce weekend. Les dernières pluies ont réalimenté la crue commencée fin janvier. Le Val-de-Marne fait toujours partie des 11 départements en vigilance orange inondation depuis deux semaines.

4 centres d’hébergements sont ouverts dans le département (2 à Villeneuve-Saint-Georges, 1 à Villeneuve-Le-Roi et 1 à Nogent-sur-Marne) où environ 300 personnes sont prises en charge. Bry-sur-Marne a également ouvert le gymnase Félix Faure pour permettre aux habitants sinistrés de venir prendre une douche o une collation. Le bilan de vendredi faisait état de 466 foyers ayant eu des coupures électriques et 224 foyers ayant eu des coupures de gaz. Depuis, de nouveaux foyers ont vu leur électricité coupée par sécurité.

Détails des niveaux par cours d’eau en Val-de-Marne

A Alfortville (Seine) Après avoir atteint un pic le lundi 29 janvier vers 8h45 avec 3,39 mètres, restant inférieur à celui de la crue de juin 2016 à 3,65 m, le niveau est redescendu jusqu’à 2,83 m en milieu de semaine et est légèrement remonté jusqu’à 2,99 m dimanche matin à 6h45 avant de redescendre à 2,83m ce lundi matin (5h45).

A Créteil (Marne) Après avoir atteint un pic dimanche 28 janvier au soir avec 3,94 m, juste en deçà de celui de juin 2016 à 4,02 m, le niveau est redescendu jusqu’à 3,55 m en début de semaine avant de remonter jusqu’à 3,75 m samedi soir et de redescendre à 3,62 m ce lundi matin 6h.

Les sites Internet utiles

Vigicrue

MétéoFrance

#inondations ♒ @Nogent94130 >> Le gymnase Leclerc est ouvert toute la nuit en cas d’évacuation d’urgence. Se présenter au 2 boulevard de Strasbourg (à côté du marché). >> https://t.co/6Tjp4qLXHd — Nogent-sur-Marne (@Nogent94130) 2 février 2018

Le Quai Ferber a fortement été impacté par la hausse de la Marne. Je remercie les élus et les services municipaux qui se sont fortement mobilisés pour aider les Bryards rencontrant des difficultés. pic.twitter.com/tniliT0U69 — JP SPILBAUER (@JpSpilbauer) 3 février 2018

Le @Prefet94 sur les bords de Marne du #Perreux, touchés par les #crues. Rencontre avec les habitants. La mobilisation des services de l’Etat et de la municipalité continue pour assurer le retour à la normal. #EtatMobilisé pic.twitter.com/8hcPxjrNLS — Préfet du Val-de-Marne (@Prefet94) 2 février 2018

La Marne continue de monter.

Cette nuit à 1h31 les conduites d’évacuation d’eau pluviale ont cédé par le refoulement de la Marne.

Nos adhérents et les Nogentais sont très affectés par ce nouvel épisode. Courage et pensées pour eux#Crue2018 @AdNogentais#Inondation pic.twitter.com/HforuaBX56 — Fred Lamprecht (@FredLamprecht) 3 février 2018

la crue de la Marne – JOINVILLE 94 – ile FANAC pic.twitter.com/NMMXY6r0uq — GUY PEINTURIER (@GuyPeinturier) 28 janvier 2018","Sun, 04 Feb 2018 08:00:00 GMT",https://94.citoyens.com/wp-content/blogs.dir/2/files/2018/02/obpicu5rsat.jpeg,"['la', 'remonte', 'à', 'en', 'valdemarne', 'm', 'les', 'le', 'des', 'niveau', 'marne', 'inondations', 'et', 'par']", 
16,16,FL-2018-000016-FRA_paris,"Paris : pour eux, c’est ras le bol de l’immeuble aux malfaçons - Le Parisien",https://www.leparisien.fr/paris-75/paris-pour-eux-c-est-ras-le-bol-de-l-immeuble-aux-malfacons-04-02-2018-7540515.php,"Dans le quartier Cardinet (XVIIe), les immeubles neufs font bon effet… à l'extérieur. « J'aime beaucoup l'architecture de la façade, à l'intérieur les espaces sont très agréables… Mais c'est toute la réalisation technique qui ne suit pas », regrette Alexandre Behnam, qui habite un studio au 6e étage. Dans cet immeuble livré en 2015, pas moins d'une dizaine d'inondations dans les sous-sols se sont accumulées dans le lourd calendrier des nuisances.

LP/Eric Le Mitouard

« Cela ne s'arrête pas. A chaque fois, des eaux usées se répandent dans les caves. Et tous les problèmes s'enchaînent en cascade », racontent Nicolas Perrier et Florence de la Grange, arrivés ici avec femmes et enfants en septembre 2014, à deux étages différents. L'un au cinquième et l'autre au second.

« Quand le sous-sol est inondé, l'ascenseur tombe en panne, l'électricité est coupée dans les parties communes (notamment les escaliers dont les éclairages de secours ne fonctionnent que 6 heures) et en conséquence, nous n'avons plus de chauffage ni eau chaude »… Pas facile de vivre dans ces conditions avec un bébé. « Nous avons aussi un voisin en fauteuil roulant… Vous imaginez », ajoutent les trois locataires qui payent 2 200 € ou 2 500 € pour 80 m2 ou 860 € pour un 34 m2 vue sur la tour Eiffel.

La plupart des 40 locataires se mobilisent et ont signé une pétition. Les quatre inondations des six derniers mois, créent un vrai sentiment de ras-le-bol. D'autant plus que fin janvier, à la dernière coupure du chauffage, les techniciens ont aussi coupé l'eau tout le week-end… et que la porte d'entrée n'est plus fermée depuis le mois de novembre. « Le seul avantage, c'est que cela a créé une solidarité entre nous ».","Sun, 04 Feb 2018 08:00:00 GMT",https://www.leparisien.fr/resizer/73N1W6DnirKlDcM359zOlgPVhSg=/1200x675/arc-anglerfish-eu-central-1-prod-leparisien.s3.amazonaws.com/public/IVZUEMPYBEE4JVBUO3GRBJF4WY.jpg,"['ras', 'en', 'aux', 'que', 'et', 'cest', 'limmeuble', 'pour', 'dans', 'les', 'des', 'à', 'malfaçons', 'bol', 'eux', 'paris', 'la', 'pas', 'le']", 
17,17,FL-2018-000016-FRA_paris,Météo : les inondés redoutent désormais le gel - Le Parisien,https://www.leparisien.fr/societe/meteo-les-inondes-redoutent-desormais-le-gel-06-02-2018-7543476.php,"La Marne, qui a atteint son pic de crue samedi, entame sa lente décrue. Mais avec le grand froid qui va durer jusqu'à la fin de semaine, c'est un peu la double peine pour les sinistrés des inondations. Ainsi, à Bry-sur-Marne (Val-de-Marne), on s'inquiète : « Dans le quartier du quai Louis-Ferber, les températures négatives prévues vont être particulièrement pénibles alors que l'électricité est encore coupée, explique Valérie Authier, au cabinet du maire. Nous faisons tout notre possible pour rétablir le courant, mais certains compteurs sont sous l'eau. »

Autre problème : les passerelles installées pour permettre aux habitants de rentrer chez eux les pieds au sec sont très glissantes.

Une centaine de riverains ont été évacués de leur logement. Un service de « canoë scolaire » a été instauré pour aider les enfants à traverser la zone la plus inondée sur le chemin de l'école.

L'eau s'en va, place au verglas

A une dizaine de kilomètres à l'est, à Gournay-sur-Marne (Seine-Saint-Denis), l'eau redescend aussi lentement, mais « le mur anticrues submergé dans la nuit de jeudi à vendredi par les eaux de la Marne risque désormais d'empêcher la rivière de regagner son lit du côté de la promenade André-Ballu dans la partie est de la ville », explique Eric Schlegel, le maire (sans étiquette). Là aussi, il va falloir rétablir l'électricité vite, une quarantaine de foyers étant encore dans le noir et, surtout, sans chauffage.

Les services techniques sont débordés, ils tirent des barques et aident des habitants depuis plusieurs jours. Les quartiers où l'eau s'est retirée sont désormais recouverts par le verglas et sont transformés... en patinoire ! Il faut depuis lundi saler la chaussée, notamment devant les établissements scolaires. Autre urgence, le gel peut aussi faire exploser les tuyauteries...","Tue, 06 Feb 2018 08:00:00 GMT",https://www.leparisien.fr/resizer/aTmcpGObzB-XPMAAs9O9cbua_Wo=/1200x675/arc-anglerfish-eu-central-1-prod-leparisien.s3.amazonaws.com/public/G2AAGY435Y4GDB6IXT4CD4DIJ4.jpg,"['la', 'dans', 'à', 'sont', 'mais', 'gel', 'va', 'inondés', 'météo', 'les', 'redoutent', 'le', 'désormais', 'pour', 'leau']", 
18,18,FL-2018-000016-FRA_paris,La Seine-Maritime toujours en vigilance orange inondation - France Bleu,https://www.francebleu.fr/infos/climat-environnement/la-seine-maritime-toujours-en-vigilance-orange-inondation-1517658417,"Le département reste en vigilance orange pour un risque d'inondation sur le tronçon Seine aval. La préfecture appelle à la vigilance et au respect des consignes de sécurité.

La tendance est à la décrue, mais la Seine aval reste sous haute surveillance. C'est pour cela que la Seine-Maritime reste en vigilance orange pour risque d'inondation sur le tronçon Seine aval samedi. Des communes sont encore perturbées par les eaux.

Des habitants privés d'électricité

Encore samedi matin, quarante-neuf foyers restaient privés d'électricité à St-Aubin-les-Elbeuf . Vingt-et-un autres sont aussi touchés temporairement à La Bouille.

Du côté des routes, les CD 92 à Freneuse, 144 à Cléon, 64 entre Caumont et Bardouville ainsi que les axes de bords de Seine dans la boucle d'Elbeuf restent barrés.

La navigation toujours perturbée

Même si du côté de Rouen, on aperçoit le retour des péniches, le dispositif de régulation bateau par bateau selon le niveau de la Seine est maintenu samedi. Dimanche, la navigation reprendra son caractère normal. Concernant les bacs des boucles de la Seine, il faut rester vigilant quant aux embarquements et débarquements.

La situation anticyclonique d'hiver annoncée par Météo France et les coefficients de marées plus faibles devraient concourir à une nette amélioration. La préfecture de Seine-Maritime vous demande néanmoins de rester particulièrement vigilant.","Sat, 03 Feb 2018 08:00:00 GMT",https://cdn.radiofrance.fr/s3/cruiser-production/2018/01/8b2c4e23-9647-4676-aa16-2a4bbe83b195/870x489_inondation_elbeuf.jpg.jpg,"['seine', 'la', 'samedi', 'à', 'en', 'inondation', 'les', 'reste', 'le', 'vigilance', 'des', 'seinemaritime', 'orange', 'toujours', 'et']", 
19,19,FL-2018-000016-FRA_paris,Crue de la Seine : reportage sur le fleuve avec un bateau des pompiers de l'Eure - actu.fr,https://actu.fr/normandie/les-andelys_27016/la-seine-deborde-bateau-sur-fleuve-crue_15326349.html,,"Thu, 01 Feb 2018 08:00:00 GMT",,[], 
20,20,FL-2018-000016-FRA_paris,"Crosne : « Nous étions les premiers, nous serons les derniers inondés » - Le Parisien",https://www.leparisien.fr/essonne-91/crosne-nous-etions-les-premiers-nous-serons-les-derniers-inondes-04-02-2018-7540539.php,"La semaine dernière, Jean-Claude jouait les « taxis boat » en transportant ses voisins dans l'une de ses barques. Ce samedi matin, cet habitant de l'allée Henri-Sueur à Crosne jouait les facteurs. Alors qu'une majorité de sinistrés essonniens ont démarré le nettoyage des dégâts et commencent à respirer avec les décrues amorcées, les riverains résidant dans la zone de confluence de l'Yerres, du Réveillon et de la Seine restent encore très touchés par les inondations.

« Dans la zone de confluence, les niveaux se sont de nouveau élevés d'une dizaine de cm au cours des dernières 24 heures, avant de se stabiliser depuis le milieu de la nuit passée », indique le Syage, syndicat mixte pour l'aménagement et la gestion des eaux du bassin-versant de l'Yerres dans son bulletin d'alerte de samedi matin. Sont notamment concernés les allées Henri-Sueur, du Moulin, les rues Vieille-Cure et Balkans, ainsi que les abords du parc du moulin de Senlis à Crosne.

Les habitants de l'allée Henri-Sueur ne vont pas dire le contraire. Si le niveau est moins impressionnant qu'il y a une semaine (jusqu'aux épaules dans certaines habitations), l'eau empêche la rue de retrouver une vie normale. Ce samedi matin, le facteur se retrouve bien en peine pour la distribution de son courrier, quasiment toute la rue étant encore inondée. Jean-Claude, un septuagénaire, lui propose de le remplacer puisqu'il a déjà chaussé des bottes.

« J'habite ici depuis 1968, et c'est une des crues les plus impressionnantes que j'ai vécues, confie Jean-Claude. Celle de 2016 était la plus intense, le niveau a monté comme jamais. Mais celle-ci dure dans le temps. Nous avons été les premiers inondés, et nous serons les derniers. »

Comme les bulletins du Syage préviennent depuis plusieurs jours, « la décrue sera très lente ». « D'autant plus que le niveau a encore pris 10 cm entre la nuit de vendredi à samedi », déplore le patron d'une société de peinture située dans l'allée. Avec Jean-Claude, ils se donnent des nouvelles des autres habitants.

« Si ça se trouve, on aura toujours de l'eau en mars, craignent les deux hommes. Mais du moment qu'on a de l'électricité. La plupart des maisons sont surélevées, donc les dégâts sont limités. Cela nous oblige à déménager les caves, garages et sous-sols, mais on vit dans une zone inondable, il faut s'y faire. » Et pour eux, ces intempéries ne seront « peut-être plus aussi rares ».","Sun, 04 Feb 2018 08:00:00 GMT",https://www.leparisien.fr/resizer/wm5-D9__FQ7ghfMbxoUIQgYflrE=/1200x675/arc-anglerfish-eu-central-1-prod-leparisien.s3.amazonaws.com/public/6GCYKKKN7I5LX55NSIGWFHWEFU.jpg,"['derniers', 'la', 'dans', 'à', 'se', 'inondés', 'nous', 'les', 'le', 'premiers', 'des', 'étions', 'serons', 'et', 'crosne', 'du', 'une']", 
