,ID,event_id,article_title,article_link,article_content,publishing_date,article_image,article_keywords,article_relevance
0,0,FL-2018-000016-FRA_paris,Villeneuve-Saint-Georges : nuit tragique dans le quartier inondé - Franceinfo,https://france3-regions.francetvinfo.fr/paris-ile-de-france/val-de-marne/nuit-tragique-villeneuve-saint-georges-94-quartier-inonde-1415373.html,"Cet article date de plus de 3 ans

Villeneuve-Saint-Georges : nuit tragique dans le quartier inondé

Un homme d'environ 40 ans qui venait de mettre en route son groupe électrogène dans sa maison à Villeneuve-Saint-Georges, cernée par l'eau, est décédé par intoxication au monoxyde de carbone, dégagé par l'appareil. Son épouse, enceinte et également intoxiquée, a perdu son bébé.

L'accident s'est produit dans la nuit du samedi 3 au dimanche 4 février, dans le quartier le plus inondé de Villeneuve-Saint-Georges, chemin des Pêcheurs, en bordure de l'eau. Du fait de l'inondation et du refroidissement de la température,Des proches sans nouvelles ont appelé les secours, mais l'homme est décédé avant leur arrivée. Son épouse, 41 ans, enceinte, a elle aussi été intoxiquée. Transportée à l'hôpital, elle est dans un état stable dimanche mais a perdu l'enfant qu'elle portait.Dès ce matin, le préfet du Val-de-Marne rappelait à tous les habitants, les dangers mortels que représente le monoxyde de carbone et les précautions à prendre pour utiliser tout dispositif qui produit ce gaz :","Sun, 04 Feb 2018 08:00:00 GMT",https://france3-regions.francetvinfo.fr/image/NIN-AA3Jupz_d2eJ1-4ij7nzJRs/930x620/regions/2020/06/09/5edf492f2a186_maisons_a_villeneuve_saint-georges-3492123.jpg,"['nuit', 'dans', 'à', 'son', 'épouse', 'tragique', 'inondé', 'les', 'le', 'quartier', 'du', 'et', 'est', 'par', 'villeneuvesaintgeorges']", 
1,1,FL-2018-000016-FRA_paris,Marne : « On est une variable d'ajustement pour sauver Paris » - Le Point,https://www.lepoint.fr/societe/marne-on-est-une-variable-d-ajustement-pour-sauver-paris-03-02-2018-2191885_23.php,"Le mur anti-crues a permis de limiter les dégâts. Mais des questions se posent sur la régulation en amont de la rivière et la gestion des réservoirs d'eau.





Vendredi 2 février, les habitants de la petite ville de Gournay-sur-Marne (Seine-Saint-Denis) se sont retrouvés les pieds dans l'eau après une importante crue de la Marne dans la nuit. Il y a ceux qui le prennent avec le sourire : Charles, 67 ans, bottes au pied, sort de chez lui une bouteille de champagne de marque à la main. Ce chef d'entreprise vient d'évacuer ses bureaux. « Quitte à se noyer, autant se noyer dans l'alcool ! » rigole un de ses salariés. Dans la nuit, l'eau a peu à peu envahi le jardin de la grande maison, où se trouvent aussi les bureaux de cette entreprise de poissonnerie de gros. « Depuis 5 heures ça monte, ça monte ! On a commencé par se replier dans la véranda pour travailler, mais là ça devenait trop risqué », raconte Charles. « L'eau a envahi le garage, les cabanes de jardin, c'est le bordel. »

Lire aussi Les crues de la Seine menacent les JO

D'autres habitants, comme Jeanne, 75 ans, sont un peu plus préoccupés. « On a l'habitude, mais on est un peu inquiets quand même. » « Ce matin, j'étais en peignoir et j'ai vu l'eau monter dans la rue. » « C'est allé super vite », ajoute Éric Schlegel, maire sans étiquette de la ville. Vers 2 heures du matin l'eau a franchi le mur anti-crue et a déferlé sur la rive de la Marne, inondant caves, jardins ou garages de ces demeures cossues construites au bord de la rivière.

Pic de crue

En milieu de journée, elle avait atteint 5,60 mètres et devait continuer à monter. Le pic de crue était attendu samedi à 5,80 mètres après celui de la Seine qui a été atteint lundi. Une dizaine d'habitants qui le souhaitaient ont été évacués, « surtout des personnes âgées », explique le maire. Mais aucun arrêté d'évacuation n'a pour l'heure été pris. Environ 400 foyers sont touchés par des pannes d'électricité ou des inondations à Gournay-sur-Marne et Noisy-le-Grand, la commune voisine, selon la préfecture.

Lire aussi Crue de la Seine : le RER C fermé au moins jusqu'au 10 février

À côté du pont de Gournay, les agents du service technique s'apprêtent à évacuer ou transporter en barque les habitants coincés par les eaux. « On fait des allers-retours », raconte un agent technique. « On a amené certaines personnes manger, d'autres faire des courses. » « On est un peu comme un Uber. » Dans les rues alentour, un homme se hâte d'assembler des parpaings au pied de son portail qui donne sur une rue où l'eau monte peu à peu. D'autres ont installé bâches et sacs de sable pour colmater leur entrée.

Gérer les réservoirs d'eau

« On en a pour deux semaines avant que ça redescende », soupire Hubert, 50 ans, bottes au pied. Seule sa cave est pour l'instant inondée et les dégâts restent limités: du fait de leur proximité avec le cours d'eau, « les vieilles maisons d'ici sont surélevées, avec des caves semi-enterrées », explique-t-il. Les habitants ont aussi été tenus informés de la montée des eaux « depuis une semaine, en temps réel », ajoute Nathalie, 45 ans, qui part travailler. « J'ai eu le temps de ranger ma cave, mon garage. J'ai tout enlevé. »

Construit dans les années 80, après un important débordement en 1983, le mur anti-crues a débordé pour la première fois même s'il a permis de limiter les dégâts. « C'est monté très très vite à des moments donnés puis plus lentement, là maintenant ça monte très lentement. Alors c'est vrai que quand la Marne a passé le mur, forcément, c'est allé très vite mais après pourquoi maintenant ça monte si lentement. Le débit n'a jamais été le même. [...] Mais je pense qu'on est une variable d'ajustement de toute façon pour sauver Paris », affirme Delphine Schlegel, adjointe au maire chargée du cadre de vie.

Sans lui « on aurait été sous l'eau depuis longtemps », assure Charles. Mais des questions se posent aujourd'hui sur la régulation en amont de la rivière, la gestion des réservoirs d'eau et la densification urbaine, a dit la municipalité. Mais pour Charles et certains de ses voisins, vendredi, « il faut relativiser ». « On a la chance d'habiter en bord de Marne, dans un coin magnifique. Tous les vingt ans on a une crue, c'est la nature ! »","Sat, 03 Feb 2018 08:00:00 GMT",https://www.lepoint.fr/images/2018/02/03/13132455lpw-13133080-article-marne-jpg_4971422_540x282.jpg,"['la', 'dans', 'à', 'mais', 'se', 'variable', 'dajustement', 'les', 'est', 'le', 'sauver', 'des', 'paris', 'et', 'pour', 'marne', 'une']", 
2,2,FL-2018-000016-FRA_paris,VIDEOS - PHOTOS - Crues : Gournay-sur-Marne inondée malgré le mur anti-crue,https://www.lepoint.fr/societe/marne-on-est-une-variable-d-ajustement-pour-sauver-paris-03-02-2018-2191885_23.php,"Le mur anti-crue qui longe les bords de Marne à Gournay-sur-Marne mesure 5,55 mètres. Problème au petit matin, vers 2h30 ce vendredi, la Marne est montée et l'eau est passée par-dessus le mur. C'est ce que craignaient les riverains.

Les habitants de Gournay-sur-Marne,vont avoir les pieds dans l'eau ce vendredi. Hier, jeudi 1er février 2018, à Gournay-sur-Marne, en Seine-Saint-Denis, on enregistrait un niveau d'eau à 5,45 mètres et la préfecture a annoncé que le niveau de la Marne pourrait atteindre 5,80 mètres ce week-end.

La mairie a des barques pour évacuer les riverains qui le souhaitent. © Radio France - Marion Aquilina

""Ça commence à déborder un peu partout et ça va très très vite"" : le maire de Gournay

A Gournay-sur-Marne, le mur anti-crue, qui longe les bords de Marne, mesure 5,55 mètres. Mais ce vendredi, dans la nuit, il a suffit d'un centimètre de plus pour que l'eau passe par-dessus comme l'a confirmé ce vendredi matin sur France Bleu Paris, Eric Schlégel, le maire de Gournay. ""Pour nous, ça a débutté à 2h, 2h30 lorsque la Marne a commencé à affleurer sur le haut du mur anti-crue et depuis une bonne heure (06h00), ça commence à déborder un peu partout et ça va très très vite"".

Pour afficher ce contenu Youtube, vous devez accepter les cookies Publicité.



Ces cookies permettent à nos partenaires de vous proposer des publicités et des contenus personnalisés en fonction de votre navigation, de votre profil et de vos centres d'intérêt. J'autorise Gérer mes choix

Le maire s’inquiète. Il se demande comment va évoluer cette crue. Il indique que l'évacuation des populations proches des rives a bien sûr été envisagée. Jeudi après-midi les habitants, qui sont menacés, ont été informés.

Rue inondée à Gournay, vendredi 2 février 2018. © Radio France - Marion Aquilina

Jeudi, des dizaines de personnes étaient là pour prendre des photos ou pour regarder le spectacle. C'était le cas de Nicole qui vit à Torcy : ""C'est impressionnant, on a des amis qui vivent juste à côté, ils sont inquiets ! Ça fait quand même peur toute cette masse d'eau.""

Jeudi, l'eau était déjà à quelques centimètres du haut du mur anti-crue de Gournay.

Pour afficher ce contenu Youtube, vous devez accepter les cookies Publicité.



Ces cookies permettent à nos partenaires de vous proposer des publicités et des contenus personnalisés en fonction de votre navigation, de votre profil et de vos centres d'intérêt. J'autorise Gérer mes choix

Les arbres ont de l'eau jusqu'aux branches et les canards filent très vite sur l'eau de la Marne qui est en crue.

""On serre les fesses"" : Eric d'EDF

Eric était venu faire des relevés pour EDF, jeudi : ""Si l'eau passe le mur, elle va se propager très rapidement dans les rues"", disait-il. Ce vendredi, ses craintes sont devenues réalité, l'eau est passée par dessus le mur.

L'eau a débordé dans les rues de Gournay vendredi. © Radio France - Marion Aquilina

Jeudi, il y avait encore un peu de marge.

D'après la préfecture de Seine-Saint-Denis, la Marne pourrait atteindre 5,80 m à Gournay-sur-Marne en fin de semaine © Radio France - Marion Aquilina

Ce Gournaysien se posait beaucoup de questions jeudi : ""_Est-ce que les égouts vont refouler ? Les pompes vont-elles avoir la capacité d'évacuer l'eau rapidement ?_"" Il concluait : _""_On serre les fesses !""

Gournay-sur-Marne redoute une submersion liée à une nouvelle crue prévue en fin de semaine © Radio France - Marion Aquilina

En revanche, Jean-Christian qui habite sur les bords de Marne était sûr de lui jeudi : ""les prévisions d'inondation ont été calculées à partir de la crue de 1910"", donc pas de panique selon lui : ""Entre temps, le mur anti-crue a été construit, des bassins ont été créés en amont, donc ce n'est pas la même configuration."" Malheureusement, l'eau est beaucoup montée dans la nuit de jeudi à vendredi et le mur n'a pas été suffisant pour empêcher l'inondation.

La mairie de Gournay-sur-Marne a préparé tout un dispositif : barques, bouées, lits de camp, denrées alimentaires et la mise à disposition de trois gymnases à Noisy-le-Grand, Gagny et Neuilly-sur-Marne pour toutes les personnes qui auraient besoin ou qui voudraient être évacuées de chez elles.

Certains habitants de Gournay-sur-Marne qui vivent sur les bords de Marne se préparent à des inondations © Radio France - Marion Aquilina

Bâches et sacs de sable pour empêcher l'eau de pénétrer dans les habitations des bords de Marne de Gournay-sur-Marne © Radio France - Marion Aquilina

La préfecture de Seine-Saint-Denis a précisé jeudi que cette nouvelle crue concernait ""Noisy-le-Grand et Gournay-sur-Marne notamment"". Selon Vigicrues, le pic de cette crue est attendu samedi : il pourrait atteindre entre 5 mètres 65 et 5 mètres 75, avec une baisse qui s'amorcerait en fin de weekend.

Cette crue ne devrait pas avoir trop de conséquences sur le niveau de la Seine à Paris. Le niveau devrait remonter entre 5 mètres 45 et 5 mètres 60, soit moins que lors du pic de la crue le 29 janvier (5 mètres 88).",2018-02-01 19:00:52+01:00,https://cdn.radiofrance.fr/s3/cruiser-production/2018/02/88711d4f-9929-442f-af6b-c38c4ac156e0/870x489_fullsizerender_29.jpg,"['la', 'malgré', 'à', 'videos', 'crues', 'inondée', 'gournaysurmarne', 'anticrue', 'les', 'photos', 'le', 'des', 'qui', 'marne', 'ce', 'mur', 'et', 'leau']", 
3,3,FL-2018-000016-FRA_paris,"""C'est monté très vite"": après la crue de la Marne, des habitants les pieds dans l'eau",https://www.lepoint.fr/societe/marne-on-est-une-variable-d-ajustement-pour-sauver-paris-03-02-2018-2191885_23.php,"Vendredi, les habitants de Gournay-sur-Marne se sont retrouvés les pieds dans l'eau après une importante crue de la Marne dans la nuit.

«C'est monté très vite.» Caves, jardins ou garages inondés: les habitants de la petite ville de Gournay-sur-Marne (Seine-Saint-Denis) se sont retrouvés vendredi les pieds dans l'eau après une importante crue de la Marne dans la nuit. Il y a ceux qui le prennent avec le sourire : Charles, 67 ans, bottes au pied, sort de chez lui une bouteille de champagne de marque à la main. Ce chef d'entreprise vient d'évacuer ses bureaux. «Quitte à se noyer, autant se noyer dans l'alcool !», rigole un de ses salariés.

Dans la nuit, l'eau a peu à peu envahi le jardin de la grande maison, où se trouvent aussi les bureaux de cette entreprise de poissonnerie de gros. «Depuis 5 heures du matin, ça monte, ça monte ! On a commencé par se replier dans la véranda pour travailler, mais là ça devenait trop risqué», raconte Charles à l'AFP. «L'eau a envahi le garage, les cabanes de jardin, c'est le bordel.»

""C'est allé super vite""

D'autres habitants, comme Jeanne, 75 ans, sont un peu plus préoccupés. «On a l'habitude, mais on est un peu inquiets quand même». «Ce matin, j'étais en peignoir et j'ai vu l'eau monter dans la rue». «C'est allé super vite», ajoute Eric Schlegel, maire sans étiquette de la ville. Vers 2 heures du matin l'eau a franchi le mur anti-crue et a déferlé sur la rive de la Marne, inondant caves, jardins ou garages de ces demeures cossues construites au bord de la rivière.

En milieu de journée, elle avait atteint 5,60 mètres et devait continuer à monter. Le pic de crue était attendu samedi à 5,80 mètres après celui de la Seine qui a été atteint lundi. Une dizaine d'habitants qui le souhaitaient ont été évacués, «surtout des personnes âgées», explique le maire. Mais aucun arrêté d'évacuation n'a pour l'heure été pris. Environ 400 foyers sont touchés par des pannes d'électricité ou des inondations à Gournay-sur-Marne et Noisy-le-Grand, la commune voisine, selon la préfecture.

""On est un peu comme un Uber""

A côté du pont de Gournay, les agents du service technique s'apprêtent à évacuer ou transporter en barque les habitants coincés par les eaux. «On fait des aller-retour», raconte un agent technique. «On a amené certaines personnes manger, d'autres faire des courses». «On est un peu comme un Uber». Dans les rues alentours, un homme se hâte d'assembler des parpaings au pied de son portail qui donne sur une rue où l'eau monte peu à peu. D'autres ont installé bâches et sacs de sable pour colmater leur entrée.

«On en a pour deux semaines avant que ça redescende», soupire Hubert, 50 ans, bottes au pied. Seule sa cave est pour l'instant inondée et les dégâts restent limités: du fait de leur proximité avec le cours d'eau, «les vieilles maisons d'ici sont surélevées, avec des caves semi-enterrées», explique-t-il. Les habitants ont aussi été tenus informés de la montée des eaux «depuis une semaine, en temps réel», ajoute Nathalie, 45 ans, qui part travailler. «J'ai eu le temps de ranger ma cave, mon garage. J'ai tout enlevé».

À lire : Crue de la Marne : les naufragés d’Esbly, notre vidéo à 360

Le mur anti-crues, construit dans les années 80, après un important débordement en 1983, a lui aussi permis de limiter les dégâts. «Sans lui, on aurait été sous l'eau depuis longtemps», assure Charles. Mais des questions se posent aujourd'hui sur la régulation en amont de la rivière, la gestion des réservoirs d'eau et la densification urbaine, a dit à l'AFP la municipalité. Mais pour Charles et certains de ses voisins, vendredi, «il faut relativiser». «On à la chance d'habiter en bord de Marne, dans un coin magnifique. Tous les vingt ans on a une crue, c'est la nature !»

Toute reproduction interdite",,"https://resize-parismatch.lanmedia.fr/r/940,628/img/var/news/storage/images/paris-match/actu/societe/c-est-monte-tres-vite-apres-la-crue-de-la-marne-des-habitants-les-pieds-dans-l-eau-1452086/23870474-1-fre-FR/C-est-monte-tres-vite-apres-la-crue-de-la-Marne-des-habitants-les-pieds-dans-l-eau.jpg","['la', 'leau', 'dans', 'à', 'et', 'habitants', 'se', 'vite', 'les', 'le', 'pieds', 'des', 'très', 'monté', 'peu', 'marne']", 
4,4,FL-2018-000016-FRA_paris,Et Gournay-sur-Marne devint Gournay-sous-Marne,https://www.lepoint.fr/societe/marne-on-est-une-variable-d-ajustement-pour-sauver-paris-03-02-2018-2191885_23.php,"Virginie, riveraine des bords de Marne

null

Virginie a dû quitter sa maison (derrière elle) cernée par les eaux avec ses deux filles. LP/Sébastien Thomas

Virginie a bien du mal à cacher son inquiétude. « Nous avons quitté la maison avec mes deux filles mais on a aucune idée de notre date de retour. » Cette mère de famille habite les bords de Marne. Depuis une semaine, elle est hébergée chez des amis à Villiers-sur-Marne (Val-de-Marne). « Tous les jours, je reviens voir la maison. Jusqu’à maintenant, je pouvais entrer mais aujourd’hui (NDLR : vendredi matin), l’eau est arrivée à un tiers du portail et la pression est telle que je ne peux plus ouvrir la porte. » Sa fille aînée reste avec elle la journée depuis que son collège est fermé… de l’autre côté de la rue. « Mais j’amène la plus petite tous les matins à l’école depuis Villiers, ce n’est pas simple. » En une semaine, elle a eu le temps de s’organiser. « J’ai surélevé tous les meubles de la cave et notamment l’électroménager. J’espère juste que la chaudière ne sera pas touchée. Le plus dur, c’est de se sentir impuissant. On ne peut rien faire pour empêcher cela. » Alors certes, elle savait qu’elle était en zone inondable. « Mais je ne pouvais pas prévoir que ça prendrait de telles proportions. »",2018-02-02 23:52:38+00:00,https://www.leparisien.fr/resizer/eq2dZlkz-aEVVCmQrZaF0w_vPkk=/1200x675/arc-anglerfish-eu-central-1-prod-leparisien.s3.amazonaws.com/public/JJ4YBRV6VQIZK6IGFWD5JFLILM.jpg,"['la', 'à', 'elle', 'devint', 'gournaysousmarne', 'gournaysurmarne', 'ne', 'les', 'est', 'je', 'tous', 'que', 'et', 'mais']", 
5,5,FL-2018-000016-FRA_paris,"Inondations : la Marne atteint son pic de crue, 11 départements toujours en alerte orange",https://www.lepoint.fr/societe/marne-on-est-une-variable-d-ajustement-pour-sauver-paris-03-02-2018-2191885_23.php,"Un employé municipal aide un habitant de Gournay-sur-Marne (Seine-Saint-Denis), le 2 février. GONZALO FUENTES / REUTERS

Alors que la Seine a commencé sa décrue à Paris, les inondations se poursuivent en amont, et notamment le long d’un de ses affluents, la Marne. La ville de Gournay-sur-Marne, en Seine-Saint-Denis, s’est ainsi retrouvée les pieds dans l’eau dans la nuit de jeudi à vendredi, obligeant l’évacuation de dizaines d’habitants. Environ 400 foyers étaient touchés vendredi par des pannes d’électricité ou des inondations dans la commune ainsi qu’à Noisy-le-Grand, selon la préfecture.

Lire aussi Sept solutions pour se protéger des crues ou les limiter

Le pic de la crue est attendu samedi 3 février dans la journée, à 5,80 mètres – la ville est protégée par un mur anticrues de 5,50 mètres, qui s’est retrouvé submergé. Les habitants avaient été tenus informés de la montée des eaux « depuis une semaine, en temps réel », témoigne Nathalie, une habitante de 45 ans. « J’ai eu le temps de ranger ma cave, mon garage. J’ai tout enlevé ». Mais des questions se posent aujourd’hui sur la régulation en amont de la rivière, la gestion des réservoirs d’eau et la densification urbaine, a déclaré la municipalité à l’Agence France-Presse.

Onze départements sont toujours en vigilance orange : l’Aube, l’Eure, la Marne, Paris, la Seine-Maritime, la Seine-et-Marne, les Yvelines, les Hauts-de-Seine, la Seine-Saint-Denis, le Val-de-Marne et le Val-d’Oise.

Carte de vigilance de Météo France samedi 3 février à 6 heures. MÉTÉO FRANCE

Des jardins potagers inondés à Elbeuf, au sud de Rouen, jeudi 1er février. La crue de la Seine a provoqué, depuis la nuit de mercredi à jeudi, l’inondation de plusieurs dizaines de maisons, majoritairement dans des caves, selon les autorités. CHARLY TRIBALLEAU / AFP

A Cléon, au sud de Rouen, le 1er février. Près de 150 personnes ont été évacuées mercredi soir en prévision de ces débordements. CHARLY TRIBALLEAU / AFP

Dans une maison inondée à Cléon, le 1er février. Le gouvernement doit « attendre la décrue » avant de pouvoir prendre un arrêté de catastrophe naturelle pour les zones concernées par les récentes inondations, a déclaré, mercredi, la secrétaire d’Etat à la transition écologique, Brune Poirson. CHARLY TRIBALLEAU / AFP

A Cléon, jeudi 1er février. La prévision pour la prochaine marée haute, prévue vendredi entre 15 heures et 16 heures à Rouen, « n’est pas meilleure. On est sur une hauteur équivalente dans le secteur, la boucle amont d’Elbeuf et le secteur de Rouen », a précisé François Bellouard, directeur départemental adjoint des territoires et de la mer sur France Bleu Seine-Maritime et Eure. CHARLY TRIBALLEAU / AFP

A Cléon, le 1er février. « Les seuils atteints sur Elbeuf, quasi autour de 11 mètres, s’approchent d’une période de retour de vingt ans. A Elbeuf, on est à 11,02 mètres tous les vingt ans », a précisé M. Bellouard. CHARLY TRIBALLEAU / AFP

A Cléon, jeudi 1er février. CHARLY TRIBALLEAU / AFP

A Orival, au sud de Rouen, le 1er février. CHARLY TRIBALLEAU / AFP

A Saint-Aubin-lès-Elbeuf, au sud de Rouen, jeudi 1er février : 49 foyers étaient privés d’électricité, et plusieurs routes étaient barrées, selon la préfecture. CHARLY TRIBALLEAU / AFP

A Cléon, jeudi 1er février. CHARLY TRIBALLEAU / AFP

A Cléon, jeudi 1er février. Une amélioration est attendue « en fin de semaine, début de semaine prochaine » avec la baisse des coefficients de marée à partir de samedi et la météo « clémente » prévue vendredi, selon le directeur départemental adjoint des territoires et de la mer. CHARLY TRIBALLEAU / AFP 110

Le Monde avec AFP",2018-02-03 00:00:00,https://img.lemde.fr/2018/02/02/294/0/3500/1750/1440/720/60/0/850b160_GFM101_FRANCE-FLOODS-_0202_11.JPG,"['en', 'pic', 'orange', 'et', 'son', 'les', 'charly', 'des', '1er', 'février', 'à', 'départements', 'toujours', 'triballeau', 'marne', 'la', 'crue', 'le', 'inondations']", 
