id,children,caption,comments_count,like_count,media_type,permalink,timestamp,skipped
17896480229105561,"{'data': [{'id': '17889216482213486'}, {'id': '17930862733583930'}, {'id': '17877262991461328'}, {'id': '17876576330407725'}, {'id': '17910811015819755'}, {'id': '17919495400636645'}]}","Miami, uma cidade luxuosa, muito apreciada por ricos e famosos, a cada ano vê mais de perto sua chance de ser submersa pelas águas do oceano. Sendo o segundo centro mais populoso da Flórida, sofre frequentemente com inundações nos bairros ao norte, mesmo quando não chove, basta apenas ser um dia de maré alta. 

Miami possui lugares planos e baixos cercados por mares crescentes, e o solo abaixo deles é formado por calcário poroso, o que significa que a água salgada do mar eventualmente está saindo do próprio solo. Apesar dos esforços das autoridades na intenção de contruir muros de contenção, em breve grandes partes da cidade podem se tornar permanentemente inabitáveis.

A guerra predominará nas últimas cenas da história terrestre. Haverá epidemias, pragas e fomes. As águas do oceano ultrapassarão seus limites. Propriedades e vidas serão destruídas pelo fogo e por inundações. Devemos estar nos preparando para as mansões que Cristo foi preparar para os que O amam (Mar, p. 172) (1897).

📸 Unsplash / Flicker

#sinais #ellenwhitefrases #oceano #mar #inundação #ograndeconflito #miami #miamibeach #salvação #fimdostempos",0,1,CAROUSEL_ALBUM,https://www.instagram.com/p/CP74n6ztHlH/,2021-06-10T10:06:22+0000,False
