,ID,event_id,article_title,article_link,article_content,publishing_date,article_image,article_keywords,article_relevance
22,22,FL-2018-000014-ARG,"Inundaciones, sequías, incendios y heladas: un clima impredecible jaquea al campo - LA NACION (Argentina)",https://www.lanacion.com.ar/economia/campo/un-clima-impredecible-jaquea-al-campo-cuales-son-los-principales-desastres-nid2109072/,"La aparición de fenómenos climáticos de gran intensidad no dejaron ni dejan de azotar a los campos. Con casi un 30% del territorio nacional en emergencia permanente, la degradación es cada vez más acuciante. “Diez años atrás estábamos bajo un sistema climático con menos eventos extremos. El clima se convirtió en un enigma, se tornó más impredecible y errático”, dijo Ernesto Viglizzo, investigador de técnicas agrícolas del INTA.

El 2017 fue un año complicado, marcado por las declaraciones de emergencias agropecuarias en todo el país. Primero fueron los incendios en La Pampa y Mendoza, allá por los meses de enero y febrero, que se repiten este año. En La Pampa se quemaron 1,3 millones de hectáreas, con pérdidas que rondaron los 1300 millones de pesos y más de mil kilómetros de alambre quemados.

La naturaleza volvía a arremeter y a hacer estragos. Llegarían después lasinundaciones que afectaron a vastas zonas del centro oeste bonaerense, La Pampa y el sur de Córdoba.

Así se apaga un incendio con un helicóptero en La Pampa

La Dirección de Estimaciones Agrícolas y Delegaciones, dependiente del Ministerio de Agroindustria, emitió un informe donde exponía las aéreas inundadas y anegadas de la zona centro del país.Buenos Aires contó con casi 1.300.000 hectáreas inundadas y con el área anegada de 3.000.000 hectáreas, en tanto la provincia de Córdoba llegó a casi 130.000 hectáreas inundadas y anegadas a más de 40.000. La Pampa tuvo 160.000 inundadas y más de 100.000 anegadas. Las provincias de Entre Ríos y Santa Fe también tuvieron numerosas zonas complicadas. Mientras la provincia mesopotámica tenía más de 70.000 hectáreas bajo el agua y más de 700.000 encharcadas, Santa Fe contaba con casi 80.000 inundadas y 30.000 de tierras anegadas.

Las inundaciones dejaron consecuencias que hoy se hacen visibles sobre todo en los campos desparejos Santiago Hafford - LA NACION

Según el informe del Ministerio de Agroindustria, la sumatoria de la superficie inundada más la anegada se ubicaba cercana al 20% en la zona de coberturas agrícolas y en un 80% en la zona de coberturas ganaderas.

Confederaciones Rurales Argentinas (CRA) informó que entre Buenos Aires y La Pampa fueron casi 6 millones de hectáreas afectadas. Hubo 21 departamentos en la provincia de Buenos Aires con una incidencia del 40% hasta el 62% de su superficie afectada, como es el caso del partido de Maipú, informaron de sde la CRA.

Pero las inundaciones no solo se localizaron en el centro del país. El mismo escenario complicado se mostró en el nordeste argentino, tanto en Chaco, Formosa como Corrientes, las lluvias rompieron récords. El año pasado, productores del norte correntino tuvieron una pérdida superior a 60.000 vacunos. Según contó a LA NACION Manuel García Olano, secretario de Agricultura de Corrientes, las pérdidas fueron muy importantes para todo el sector ganadero pero sobre todo para los pequeños productores. “La ganadería perdió un total de mil millones 795 mil pesos y la agricultura 141 millones pesos, es una pérdida total de casi 2 mil millones de pesos de la actividad agropecuaria”, sostuvo el funcionario correntino.

En Formosa hubo 5 millones de hectáreas afectadas con casi un millón de cabezas de ganado, 15.000 hectáreas pérdidas con producciones de algodón, maíz, mandioca, batata, arroz; e incluso el área forestal se vio paralizada en ese período. En el Chaco fueron casi 500 mil cabezas de ganado bovino que sufrieron por excesos hídricos, como también la producción frutihortícola.

Inundaciones en la provincia de Buenos Aires Mauro Rizzi - LA NACION

Esteban Copati, jefe del Departamento de Estimaciones Agrícolas de la Bolsa de Cereales de Buenos Aires, explicó que fueron 6 millones de hectáreas afectadas por excesos hídricos hacia fines de septiembre del 2017. “De esas 6 millones de hectáreas afectadas, una superficie aproximada de 1 millón de hectáreas era agrícola estaban sufriendo excesos hídricos ya sea en lotes implantados con cultivos de invierno (trigo o cebada) o cuadros que no estaban sembrados pero que tampoco iban a poder ingresar a la rotación con cultivos de verano”, explicó.

Pablo Ginastet, delegado de Confederación de Asociaciones Rurales de Buenos Aires y La Pampa (Carbap) en la Comisión Nacional de Emergencias y Desastres Agropecuarios, dijo a LA NACION que las hectáreas sin sembrarse fueron cercanas a las 800.000.

IMPACTO NEGATIVO EN EL COSTO PRODUCTIVO GANADERO

Si bien pareciera que el sector más perjudicado y expuesto es el agrícola, la ganadería sufrió y sufre cada vez más las inclemencias de tiempo, donde la productividad cae una vez que sucede un imprevisto. Caminos, puentes y alambrados arrasados por las corrientes de agua, falta de pasturas, bajo porcentajes de preñeces, mayor número de abortos, pérdidas de terneros por nacimientos por condiciones extremas, ventas forzadas, son algunas de las secuelas que deja esta inclemencia al sector agropecuario.

Inundaciones en la provincia de Buenos Aires Mauro Rizzi - LA NACION

En la lechería, las inundaciones producen pérdidas muy difíciles de contabilizar, el tránsito pesado de animales y maquinarias en un terreno cada vez más pantanoso y el aumento de las patologías a nivel de ubre y la presencia de infecciones podales, hacen que la rentabilidad del negocio sea cada vez menor. En los feedlot, la presencia de barro alarga los períodos de engorde y genera una pérdida directa en los márgenes de ganancias.

“La verdadera dimensión del impacto se irá sintiendo en forma escalonada, pero si tomamos solo tres de los factores: mortandades de terneros, abortos y la estimable baja de la tasa de preñez en la campaña que comienza, estamos con una pérdida de base de 300.000 terneros, que representa en kg de carne más del doble de lo exportado por cuota Hilton en el periodo 2016/2017. En términos monetarios es un impacto directo y a corto plazo de 2300 millones de pesos, es decir unos US$127 millones, y habrá que ir cargando la cuenta a medida que se vayan consolidado los demás índices,” afirmaron fuentes de CRA.

Un informe de Carbap, emitido a fin del año pasado, detallaba: “Con relación a la afectación sobre los rodeos vacunos, son 12,7 millones de cabezas en el área afectada. Estimamos que la pérdida de terneros sería de un 5%, lo que equivale a unos 200.000 terneros,” especificó el documento.

LAS HELADAS TARDÍAS Y GRANIZOS EN LAS ECONOMÍAS REGIONALES

El tiempo para las heladas corre desde mediados de mayo a fines de agosto de cada año. Para las economías regionales, si se producen más allá de esas fechas son muy perjudiciales para los cultivos. Si bien las cifras de incendios no fueron las de 2018, el daño a Mendoza llegó más tarde con las heladas tardías, donde la vitivinicultura y la frutihorticultura fueron las producciones más afectadas. En tanto, en San Juan las heladas y granizos provocaron una merma importante en sus cosechas. En Río Negro no solo las heladas perjudican los cultivos sino también las granizadas, entre enero y abril unas 2000 hectáreas fueron afectadas por granizo. Entre septiembre y diciembre unas 500 hectáreas rionegrinas, que corresponde a fruta de la cosecha 2018, sufrieron heladas tardías.

LA SEQUÍA DE NOVIEMBRE A HOY

En la primavera de 2017, otro vuelco climático, esta vez en noviembre, puso a todo el sector productivo vulnerable otra vez. La sequía venía para quedarse. En los dos últimos meses del año pasado en varias zonas del país, que hasta hacia días luchaban con sus campos llenos de agua, ahora afrontaban otro fenómeno: la sequía. Por esto, ya se recortó 100.000 hectáreas la previsión desiembra de soja de la campaña 2017/2018. Contra una previsión inicial de 18,1 millones de hectáreas, el área fue ajustada a 18 millones de hectáreas, un 6,2% menos versus el ciclo agrícola anterior.

“La realidad es que a partir de noviembre comenzaron a espaciarse las lluvias y lentamente fuimos rotando de un exceso hídrico a una sequía importante que afecta casi toda la región inundada y se extiende incluso hacia amplios sectores de Santa Fe y Entre Ríos,” explican de la Bolsa de Cereales de Buenos Aires.

La soja, en estado crítico Archivo

Para Ginestet, en noviembre dejó de llover: “Pasamos de la inundación a la sequía muy rápido. Bajó el agua en forma precipitada”, dijo.

Si bien hubo zonas de laprovincia de Buenos Aires, como Pergamino, Arrecifes, Baradero, Ramallo, Chacabuco, San Pedro, San Antonio de Areco, Capitán Sarmiento, y San Nicolás, que no tuvieron inundaciones durante el año por el buen drenaje y escurrimiento que tienen los campos, en los últimos meses sufrieron y sufren la falta de precipitaciones. Hoy casi la totalidad de la provincia de Buenos Aires está afectada hoy por la sequía. Los productores agrícolas ven una sequía inusitada.

“Hay lugares donde hoy los rindes son inciertos, no está asegurada la cosecha de soja”, sostuvo Gustavo Ferraris, investigador de INTA Pergamino y especialista en nutrición de cultivos.

El sector lechero no es ajeno a esto y padece las consecuencias de la falta de lluvias. El deterioro de los suelos por la falta de agua modifican la composición de las plantas y su contenido de lignina, por lo que pierden calidad y digestibilidad las pasturas. Con esto, la producción de leche se ve afectada con vacas en lactancia sin una buena alimentación. “Se puede substituir con silo como suplemento, pero la pastura verde no se puede remplazar,” dijeron los especialistas.

UN PROBLEMA MÁS QUE SE SUMA: LA SALINIZACIÓN

Cuando el agua se retira, con altas temperaturas y sequía prolongada, los suelos transitan un proceso de salinización. Para Roberto Casas, director del Centro para la Promoción de la Conservación del Suelo y del Agua, es un fenómeno que va creciendo, sumado a las hectáreas en Buenos Aires, hay otras regiones afectadas. Las altas temperaturas del año influyen más, porque el agua se evapora en forma rápida, sin drenar, y no da lugar a la incorporación al suelo, quedando superficies salinas, carentes de nutrientes y con poco volumen para recuperarse. “La salinización se presenta hoy, no solo en campos ganaderos, sino también en agrícolas con alta productividad.”, explicó Casas.

En suelos salinizados de Carlos Tejedor se implantó agropiro para buscar una corrección del proceso Roberto Casas

EL CAMBIO CLIMÁTICO

Según el ingeniero agrónomo y especialista en agroclimatología Eduardo Sierra se está en presencia de un período de transición entre la Fase Húmeda 2012/13 – 2016/17, que abarcó sólo cinco temporadas y se caracterizó por un predominio de condiciones húmedas, con una pérdida de más de 1,5 millones de hectáreas implantadas en campos bajos.

Los seguros agroganaderos como barrera a los fenómenos climáticos

“La campaña se inició con las inundaciones que afectaron a la provincia de Buenos Aires en la primavera de 2012, y culminaron con los intensos eventos de anegamientos, inundaciones y crecidas de los grandes ríos disparados por el “El Súper El Niño 2015/16”, cuyos efectos se prolongaron durante la campaña “El Niño 2016/17- destacó Sierra - No sería extraño que el proceso actualmente en marcha marque una transición en el estado del sistema climático sudamericano, poniendo fin a la fase húmeda que se extendió desde la campaña agrícola 2012/2013 hasta la campaña agrícola 2016/2017, dando inicio a una fase seca, que podría prolongarse a lo largo de varias campañas”.

Según el informe delBanco Mundial “Análisis Ambiental del País” (AAP), el costo de la degradación del medio ambiente en la Argentina, corresponde a un valor económico de aproximadamente el 8% del PBI. “Parte de este costo viene de la contaminación del aire que equivale aproximadamente al 1,8% del PBI, mientras que la degradación de las tierras es aproximadamente al 3,6% del PBI”, indicó el comunicado.

Para Viglizzo, las evidencias científicas disponibles indican que estos desastres tienen su antecedente en el fenómeno del cambio climático. “El calentamiento global, causante del cambio climático que afecta al planeta, ha devenido en un fenómeno exponencial que está superando las previsiones de los modelos Los excesos hídricos de la primera mitad del año 2017 no fueron predichos por los meteorólogos, y nos sorprendieron inundaciones extensivas. En algunos sitios, cuando las aguas bajaron, dejaron un residuo salino que complica a los cultivos futuros. Las sequías extensivas en la segunda mitad del año 2017, con su secuela de incendios en regiones de pastizales naturales, nos han vuelto a sorprender y, en muchos casos, sin capacidad de reacción. Paradójicamente, los incendios por sequía están conectados con el exceso de lluvias de la primera mitad de ese año, ya que las precipitaciones permitieron acumular una gran cantidad de biomasa vegetal que luego se secó y se convirtió en material altamente combustible. Es un fenómeno complejo que estamos tratando de entender”, reconoció el especialista.","Thu, 15 Feb 2018 08:00:00 GMT",https://resizer.glanacion.com/resizer/qjIXh9iIjp4cLHSvxYaSlrhvXfg=/768x0/filters:quality(80)/cloudfront-us-east-1.images.arcpublishing.com/lanacionar/VBHV3CKB3RHS7I4ZWI7QSAZF3M.jpg,"['al', 'campo', 'en', 'las', 'los', 'que', 'del', 'se', 'clima', 'hectáreas', 'y', 'impredecible', 'sequías', 'incendios', 'la', 'el', 'jaquea', 'heladas', 'inundaciones']", 
23,23,FL-2018-000014-ARG,El Conicet y la Universidad del Sur crearon una app para prevenir inundaciones en sistema de Ventania - Télam,https://www.telam.com.ar/notas/201801/244188-el-conicet-y-la-universidad-del-sur-crearon-una-app-para-prevenir-inundaciones-en-sistema-de-ventania.html,,"Thu, 25 Jan 2018 08:00:00 GMT",http://www.telam.com.ar/advf/imagenes/2018/01/5a6a2a9f5de19_400x225.jpg,"['la', 'prevenir', 'ventania', 'sistema', 'una', 'universidad', 'inundaciones', 'para', 'sur', 'y']", 
24,24,FL-2018-000014-ARG,Maś de 17.000 afectados en norte de Argentina por inundaciones - Sputnik Mundo,https://mundo.sputniknews.com/america-latina/201802051076035945-provincia-salta-inundaciones/,"Para mejorar el funcionamiento de nuestra web mostrándole las noticias y los anuncios más relevantes, recopilamos la información técnica de su cuenta de manera completamente anónima utilizando herramientas de terceros. Si desea conocer los detalles de cómo tratamos sus datos personales, puede revisar nuestra Política de privacidad. También encontrará en nuestra 'Política de cookies y de inicio de sesión automático' información detallada sobre las herramientas que utilizamos con ese fin.

Al hacer clic en 'Aceptar y cerrar', nos da su consentimiento para que recopilemos sus datos personales con el objetivo de cumplir con lo indicado anteriormente.

Puede retirar su consentimiento siguiendo los pasos que figuran en nuestra Política de privacidad.","Mon, 05 Feb 2018 08:00:00 GMT",https://cdnmundo1.img.sputniknews.com/sharing_snippet/1076035945.png?1517859644,"['privacidad', 'política', 'su', 'en', 'argentina', 'los', 'inundaciones', 'maś', 'por', 'sus', 'nuestra', 'personales', '17000', 'que', 'y', 'afectados', 'norte']", 
25,25,FL-2018-000014-ARG,En 2017 las exportaciones de lácteos cayeron 25% en volumen y 10% en valor - Infocampo,https://www.infocampo.com.ar/el-2017-fue-un-ano-terrible-para-la-lecheria-las-exportaciones-cayeron-25/,"Según el ultimo informe del Observatorio de la cadena Láctea (OCLA), en 2017 las exportaciones se contrajeron en un 25% totalizando 205.112 toneladas en enero-noviembre, casi 70.000 toneladas por debajo de las 272.428 toneladas exportadas en los primeros 11 meses de 2016. La retracción puede explicarse principalmente por tres factores:

los compradores demandaron menos, falta competitividad internacional y escasez de materia prima que persiste desde las inundaciones de mediados de 2016.

En un breve resumen, ampliamos los pormenores de esta situación:

Por países:

El descenso en las exportaciones de lácteos argentinos se puede atribuir principalmente a una fuerte caída en los envíos a tres compradores tradicionalmente grandes: Brasil, Rusia y Venezuela.

Aunque Argentina fue el mayor proveedor de leche a brasil, las exportaciones de lácteos al vecino país cayeron más de 23.000 toneladas, los envíos a Venezuela cayeron casi 16.000 toneladas y las exportaciones a Rusia se contrajeron en unas 11.000 toneladas, en comparación con el mismo período en 2016, totalizando 78.023 tn, 2.864 tn y 20.607 tn respectivamente.

Por productos:

En 2017, más de la mitad de la caída se debió a una reducción de: 36.000 toneladas de las exportaciones de leche entera en polvo, 62,903 toneladas de las 99.038 exportadas en 2016. Las exportaciones de suero también se contrajeron notablemente. Incluso la leche descremada en polvo tuvo un peor desempeño, con una caída de exportaciones de 4.000 ton.

En términos monetarios

De acuerdo con datos difundidos por el OCLA, el valor percibido por exportaciones lecheras el año pasado fue de US$ 726.774 millones y la variación de caída interanual fue de 10,7%. Argentina obtuvo en los primeros 11 meses de 2017 US$ 659,75 millones por sus exportaciones de lácteos, casi 10% menos que en el mismo período de 2016.

Por otro lado, el año pasado el país colocó sus productos lácteos a un precio promedio de us$ 3,191 por tonelada, contra los us$ 2.704 del año anterior y la suba de los valores se ubicó en 18% interanual.

La competitividad:

Si bien la menor demanda de fue en parte la culpable, también se es consciente de que la menor competitividad de la industria láctea argentina también es en parte la culpable. Los altos costos de producción y el tipo de cambio retrasado, también son los culpables, según Jorge Giraudo, Director Ejecutivo del Observatorio de la Cadena Láctea de Argentina (OCLA).

Giraudo dijo que generalmente la relación entre el mercado interno y las exportaciones de productos lácteos es generalmente 80:20. Pero el año pasado la relación fue más cercana a 88:12/13.

La producción:

En 2016, la producción de leche cayó un -12,5% en relación con la producción de 11 mil millones de litros en 2015. En 2017 y por segundo año consecutivo, la producción se mantuvo por debajo de los 10.000 millones de litros, debido principalmente a las inundaciones de abril de 2016 y enero de 2017 en las principales zonas cuencas de Santa Fe y Córdoba.

Por otro lado, a pesar de una serie de cierres de unidades productivas durante todo el año, mantener el volumen producido en alrededor 9.895 millones de litros durante 2017, habría sido gracias a una mayor productividad en establecimientos de mayor tamaño.

Los destinos:

Por destino, según el volumen de negocios, las exportaciones de lácteos de 2017 se canalizaron hacia

Brasil (37,9%); Argelia (10,6%); Rusia (9,8%); China (8,1%); Chile (6,4%); Paraguay (3,1%); Indonesia (2,6%); Uruguay (2,4%); Estados Unidos (1,8%) y, resto del mundo (15,6%).

Perspectiva

Argentina batió sus récord de exportación de lácteos en 2011, con 450.415 toneladas que se colocaron en el exterior generando divisas por us$ 1.758.654 pero, desde entonces, el negocio de exportación de lácteos se redujo prácticamente a la mitad.

Este año comenzó con mejores expectativas para el sector debido al aumento en el tipo de cambio que se produjo en enero (el dólar se valoró en $19,60 el 31 de enero) y el aumento en el precio de la leche en polvo como resultado de la sequía en Nueva Zelanda. La industria argentina se beneficiará del debilitamiento del peso, ya que esto podría mejorar la competitividad de sus productos en el extranjero.","Thu, 01 Feb 2018 08:00:00 GMT",https://www.infocampo.com.ar/wp-content/uploads/2017/09/tambo-lecheria.jpg,"['el', 'volumen', 'la', '2017', 'toneladas', 'se', 'en', 'exportaciones', 'las', 'los', 'lácteos', 'valor', '25', 'y', 'cayeron', 'por']", 
26,26,FL-2018-000014-ARG,París en alerta: no se descarta la posibilidad de un desastre natural - infobae América,https://www.infobae.com/america/mundo/2018/02/04/paris-en-alerta-no-se-descarta-la-posibilidad-de-un-desastre-natural/,"El Río Sena, desbordado

Aix en Provence (De nuestro corresponsal).– Enero de 2018: una fecha que quedará en los registros históricos franceses. Nunca había llovido tanto en en el norte de Francia, la zona en donde se halla la cuenca del río Sena que atraviesa la ciudad de París.

""Por el momento la situación está bajo control, pero no sabemos qué puede pasar"", afirma Guillaume Ferry, director de la vigilancia de Predict, la agencia que provee el servicio de información y asesoramiento de planificación de la contingencia ante catástrofes para la capital francesa.

Las aguas del Sena bajan lentamente pero las postales de la inundación en la ciudad son exactas a las que se vieron el domingo pasado, el día más crítico hasta el momento.

Mientras tanto, las lluvias en las cuencas continúan y las dudas crecen a la par de los afluentes.

Estos pequeños ríos que desembocan en el Sena harán que aumente su caudal, al menos durante una semana más. Es por eso que las autoridades están alertas y preparadas para implementar medidas que protejan personas y bienes.

Hace más de un año. la ciudad sufrió el mismo tipo de inundación, en junio de 2016.

""Continúa lloviendo en el norte de Francia, por eso es que la situación puede complicarse. Todos los ríos están muy cargados, las napas subieron y el agua no drena. Por ahora la situación está baja control, pero hay que estar muy atentos.

Infobae siguiendo la situación en París desde la agencia francesa que monitorea posibles catástrofes

En cuanto a las medidas de prevención más importantes que se tomaron -y que siguen vigentes -, se encuentra el corte de las calles que bordean el Sena, la prohibición de navegación de barcos por el río -ya que carecen de espacio para pasar por debajo de los puentes – y el cierre de una de las líneas más vitales del subte – debido a que el nivel del agua se encuentra por encima del nivel del sistema de ventilación de las estaciones. Esto provoca algunos inconvenientes en la movilidad de la ciudad, algo muy sensible ya que los problemas vinculados al transporte son la principal causa de preocupación de los parisinos. Pero los ciudadanos y los inmuebles no se verán afectados en tanto y cuanto el nivel de las aguas no vuelva a elevarse un metro por encima del actual.

""Estamos muy atentos a los datos climatológicos porque si continúa lloviendo en las cuencas, pueden desatarse los inconvenientes"", asegura Ferry.

Actualmente el caudal del río Sena es de 6 metros. ""Si llega a los 7 metros estaremos en una situación muy difícil"". La peor inundación que sufrió la ciudad de París fue en 1910 cuando el rio alcanzó los 8 metros.

Récord histórico de precipitaciones

""Si contamos desde Navidad hasta hoy, podemos decir que hemos batido el récord histórico de precipitaciones en el área de la cuenca del Sena y norte, al menos desde que se tiene registro"" (50 años). ""En un mes llovió el equivalente a 6 meses.""

En estos últimos días, Francia se ha visto afectada por 6 tormentas que cruzaron por su territorial de oeste a este, originados en el océano Atlántico. Si bien se trata de una situación extraordinaria, los expertos explican que no pueden tener certezas de si este fenómeno tiene su origen el cambio climático.

Si bien el fenómeno de las inundaciones es algo que ha azotado a la ciudad y que forma parte de los eventos que pueden ocurrir, lo extraño es que se haya repetido este fenómeno en un lapso de un año (la ocurrencia habitual es cada 20 años aproximadamente -la penúltima fue en 1982).

Esto enfrenta a los ingenieros en riesgo a un nuevo desafío lleno de incógnitas: ""Es muy difícil poder predecir qué va a pasar porque no tenemos un patrón, ni un solo antecedente para comprar con la situación. Es un fenómeno totalmente nuevo para nosotros. Todo el área alrededor de la cuenca del Sena está saturada de agua, el suelo está lleno de agua, está lleno de agua por todas partes. Nos enfrentamos a un fenómeno atípico.""

Frente a la pregunta sobre la posibilidad de que Paris enfrente una situación dramática del calibre de la gran inundación de 1910, Guillaume Ferry concluye que ""no podemos descartar nada. Todo es posible. Por eso es que debemos anticiparnos a los hechos y mantener controlados, minuto a minuto, cada tormenta, cada río y cada milímetro que entra al río para chequear los datos y estar preparados para todo.""","Sun, 04 Feb 2018 08:00:00 GMT",https://www.infobae.com/new-resizer/FDUfZUyX3o4_knYiizt5OAnzc1M=/1200x628/filters:format(jpg):quality(85)//s3.amazonaws.com/arc-wordpress-client-uploads/infobae-wp/wp-content/uploads/2018/01/29131912/2018-01-28T154752Z_1124124466_RC1EC57C1590_RTRMADP_3_FRANCE-WEATHER-FLOODS-e1517242777720.jpg,"['la', 'el', 'se', 'posibilidad', 'en', 'descarta', 'desastre', 'los', 'las', 'del', 'parís', 'que', 'alerta', 'natural', 'y', 'por']", 
