,ID,event_id,article_title,article_link,article_content,publishing_date,article_image,article_keywords,article_relevance
27,27,FL-2018-000014-ARG,Planteo de soluciones por inundaciones en la zona de la rotonda de Constitución - La Capital de Mar del Plata,https://www.lacapitalmdp.com/planteo-de-soluciones-por-inundaciones-en-la-zona-de-la-rotonda-de-constitucion/,"La concejal Cristina Coria presentó un proyecto de comunicación dirigido a Obras Sanitarias SE, vinculado a las obras necesarias para canalizar las aguas pluviales y resolver la situación de inundaciones, en sectores aledaños a la rotonda de Constitución, ante reclamos de vecinos de la zona.

“Por sus características, las obras deberían hacerse con cargo compartido en distinta medida, entre OSSE, para la instalación del conducto y obras complementarias, Emvial, para la obra de pavimentación posterior y vecinos frentistas incluidos en la cuenca”, sostuvo la edil de Cambiemos en el proyecto.

Más adelante explicó que “el conducto a instalar sería de aproximadamente trescientos metros de longitud, con sus correspondientes bocas de tormenta, y los trabajos complementarios que correspondan como movimiento de tierra, levantamiento y reposición de veredas, cordón cuneta, pavimento, etc”.

“En función de la diversidad de actores involucrados, es aconsejable extremar los contactos entre ellos y las áreas del municipio, para lograr su concreción, siendo esta una obra de escasa dimensión con bajo costo, que traería solución a los reclamos de los vecinos”, indico Coria.","Thu, 25 Jan 2018 08:00:00 GMT",https://www.lacapitalmdp.com/wp-content/uploads//2017/05/299392.jpg,"['la', 'obras', 'en', 'planteo', 'los', 'las', 'inundaciones', 'vecinos', 'para', 'zona', 'sus', 'constitución', 'rotonda', 'que', 'y', 'soluciones', 'por']", 
28,28,FL-2018-000014-ARG,Temporal en Tucumán: hay más de 70 evacuados y una persona desaparecida - Clarín.com,https://www.clarin.com/sociedad/temporal-tucuman-70-evacuados-persona-desaparecida_0_Bk5IpAirG.html,"Aún no se habían acallado los comentarios por la tormenta que cayó sobre Tucumán un par de días atrás, cuando los cielos volvieron a descargar sus aguas produciendo anegamientos, inundaciones, cortes de ruta y más de 70 evacuados en varias zonas de la provincia. Además, se busca a una persona que fue llevada por el agua.

Juan Manuel Ponce, el joven desaparecido en medio de las tormentas. (Gentileza: Periodico Móvil)

Un joven de 22 años que circulaba en su moto por una calle del vecino municipio de Tafí Viejo, debido a la correntada, perdió el equilibrio y cayó a un canal cuya correntada lo arrastró en la madrugada del domingo y aún permanece desaparecido. Juan Manuel Ponce iba con un grupo de amigos hasta que se detuvo al llegar al cruce de dos calles y el agua lo llevó. Sigue siendo buscado por bomberos de la ciudad.

“Hay evacuados en forma preventiva en diferentes lugares por cuestiones de anegamientos”, precisó el gobernador, Juan Manzur, tras la reunión del Comité de Emergencia de la provincia que monitorea el estado de los ríos y caminos tras las lluvias que comenzaron la noche del sábado y continuaron durante todo el domingo.

En Ranchillos hay 35 personas evacuadas; 30 en Arcadia, alojadas en la escuela Pedro León Cornet; en Villa Quinteros, 10 personas estaban siendo evacuadas a escuelas. Mientras que la escuela Amado Juri, del barrio Alejandro Heredia de la Capital, permanece abierta, sostuvo el director de Defensa Civil, Fernando Torres.

Fuertes tormentas causaron anegamientos y destrozos en Tucumán. (Gentileza: La Gaceta)

Este último establecimiento había sido el epicentro de la ayuda a los más afectados de la capital tucumana durante la tormenta de dos días atrás. De igual manera, en Ranchillos, que fue la zona más afectada entre el jueves y viernes, con 150 evacuados, volvieron a tener problemas, por lo que hubo que evacuar a varias familias.

La preocupación de las autoridades está puesta en los caudales de los ríos, que debido a las lluvias en la zona serrana y hasta las existentes en Catamarca han crecido fuertemente, tanto que alcanzaron la cota de los puentes de los caminos que los cruzan.

Fuertes tormentas causaron anegamientos y destrozos en Tucumán.

En la zona sur de la provincia hubo problemas en algunas ciudades, como La Invernada, donde algunas familias quedaron aisladas, pero ya fueron asistidas y no hubo evacuados. De la zona de Arcadia, también en el sur provincial, fue afectado el barrio San Roque por la crecida del río Gastona. Aunque no hubo evacuados, las aguas llegaron hasta las viviendas.

También se pidió precaución para aquellos que circulen por la ruta provincial 307 que conduce a Tafí del Valle. Aunque permanece abierta al tránsito, se la está monitoreando debido a las lluvias caídas en las montañas por las que discurre su recorrido. Se espera que el tránsito sea intenso, ya que culmina el fin de semana.

Un choque frontal en la ruta 307 dejó tres muertos y tres menores graves cerca de Tafí del Valle. (Gentileza: La Gaceta)

Por otra parte, tres adultos perdieron la vida y tres menores de edad quedaron heridos tras un choque frontal en la ruta 307, en el tramo que une El Mollar con Tafí del Valle. Las razones del accidente buscan ser determinadas pero la tormenta se estima que haya afectado la visibilidad. El incidente fue protagonizado por un Peugeot 208, que se habría dirigido hacia Tafí del Valle, y un Fiat Argo, que lo hacía en dirección contraria.

El director de Defensa Civil, Fernando Torres, advirtió que aún rige para Tucumán un ""alerta meteorológica, con pronósticos extendidos que muestran que estas condiciones climáticas persistirán hasta febrero"".

","Sun, 28 Jan 2018 08:00:00 GMT",https://images.clarin.com/2018/01/28/SJjp11nrG_600x338__1.jpg,"['la', 'el', 'persona', 'evacuados', 'hay', 'en', 'una', 'del', 'tucumán', 'las', 'los', 'desaparecida', 'se', 'temporal', 'que', 'y', 'más', 'por']", 
29,29,FL-2018-000014-ARG,Extienden la ayuda para los inundados cerca del río Bermejo - El Tribuno.com.ar,https://www.eltribuno.com/salta/nota/2018-2-15-20-34-34-extienden-la-ayuda-para-los-inundados-cerca-del-rio-bermejo,"Desde el gobierno nacional ordenaron enviar más soldados del ejército para asistir a los damnificados.

El Ministerio de Defensa sumó más efectivos del Ejército Argentino para asistir a los damnificados en las localidades situadas en los alrededores del río Bermejo, afectados por las inundaciones.

A las localidades de Santa Victoria Este, El Rosado, Aguaray y Tartagal, se sumaron San Bernardo, Alto de la Sierra y otras zonas de los alrededores del río.

Más de 30 efectivos del Batallón de Ingenieros de Montaña 5, con vehículos y botes, recorrieron 400 kilómetros en ocho horas bajo una intensa lluvia para evacuar a los habitantes de las zonas aledañas al río Bermejo.

En el centro de evacuados de El Rosado, a 20 kilómetros de Santa Victoria Este, ya hay más de 300 personas que son alojadas en las carpas del Ejército Argentino y reciben desayuno, almuerzo, merienda y cena.

Por su parte, el Regimiento de Infantería de Monte 28 continúa recibiendo a los damnificados y les brinda contención, alojamiento y racionamiento.

Con más de 38 grados de temperatura y un alto indice de humedad, los efectivos continúan cooperando para rescatar a quienes quedaron anegados en zonas próximas al río Pilcomayo, empleando botes de goma, único modo en el que pueden ingresar a esas zonas.

A raíz de la emergencia que afecta al noroeste de la provincia de Salta, cerca de 10.000 mil personas fueron ya evacuadas, con una activa participación del Ejército.

En total, 257 personas están alojadas en el centro de evacuados El Rosado, entre ellas, integrantes de las comunidades aborígenes Wichi, Quom y Toba.

De su traslado, estuvieron a cargo efectivos de los regimientos de Infantería de Monte 28 y Caballería de Exploración de Montaña 5, el Batallón de Ingenieros de Montaña 5, el Grupo de Artillería de Montaña 5, la Compañía de Comunicaciones de Montaña 5 y la Base de Apoyo Logístico local.

En este momento, el agua se encuentra en bajada, por lo que los efectivos continúan trabajando codo a codo con personal de Vialidad Nacional para reconstruir los caminos, mientras la Compañía de Comunicaciones se mantiene alerta a la conexión permanente de los enlaces para que sigan funcionando la organización y la logística en la asistencia a los damnificados.","Thu, 15 Feb 2018 08:00:00 GMT",https://us.cdn.eltribuno.com/022018/1518737568292.jpg?cw=600&ch=365,"['la', 'el', 'ayuda', 'del', 'en', 'los', 'las', 'cerca', 'río', 'montaña', 'para', 'extienden', 'bermejo', 'que', 'y', 'inundados']", 
30,30,FL-2018-000014-ARG,Temporal en Chaco: por las intensas lluvias al menos 120 personas fueron evacuadas - infobae,https://www.infobae.com/sociedad/2018/01/21/temporal-en-chaco-por-las-intensas-lluvias-al-menos-120-personas-fueron-evacuadas/,"Un temporal de lluvia y viento afectó este fin de semana a municipios del centro de Chaco, donde cayeron más 300 milímetros de agua que inundaron calles, casas y negocios.

La localidad más afectada es Roque Sáenz Peña, donde las autoridades provinciales activaron un protocolo de emergencia previsto frente a ese fenómeno meteorológico.

Al menos 120 personas fueron evacuadas y trasladados a un predio ferial, donde reciben la ayuda del Municipio y de los vecinos de la zona.

(Twitter: @LaCarancha)

(Twitter: @NeoNetMusic)

Los barrios más afectados fueron Ginés Benítez, Milenium, Santa Teresita, 713 viviendas, Tiro Federal, Puerta del Sol, Lamadrid, Reserva Este y San José.

En Sáenz Peña, la segunda ciudad en importancia de la provincia y ubicada a 160 kilómetros de Resistencia, la cantidad de lluvia caída en un corto plazo generó la evacuación inmediata de vecinos que se vieron invadidos por el agua en sus viviendas.

(Twitter: @Maryylyn230277)

(Twitter: @ercervero)

(Twitter: @LaCarancha)

El ministro de Gobierno, Justicia y Relación con la Comunidad, Martín Nievas, explicó que ""se coordinó la asistencia a los municipios y se envió agua envasada, cobertores, bolsas de arena, bombas y tanques de agua"".

Las inundaciones provocaron cortes de luz en varios sectores, ""aunque ya está trabajando la empresa provincial de energía para rehabilitar el servicio"", aseguró el funcionario.

""No estamos desbordados. Sabemos que surgirán situaciones de emergencia con personas que viven en condiciones de precariedad o que están en la costa del río, pero estamos preparados para auxiliarlos"", afirmó.

Como consecuencia de las intensas lluvias, algunos vecinos perdieron electrodomésticos, muebles y objetos personales. Además, sufrieron daños materiales en sus casas y desconocen cuando podrán regresar para retomar la vida normal.

Por su parte la Administración Provincial del Agua adelantó que ""el martes se espera que los ríos Paraná y Paraguay lleguen a su pico sobre las costas de las localidades de Isla de Cerrito, Antequera, Barranqueras, Puerto Vilelas, Puerto Eva Perón, Puerto Bermejo, La Leonesa, Las Palmas y General Vedia"".

Es justamente en esas localidades, ubicadas al este de la provincia, donde hubo abundantes precipitaciones en las últimas horas, con registros que variaron entre los 50 y 130 milímetros.

En tanto, el Servicio Meteorológico Nacional pronosticó ""mal tiempo y posibilidad de lluvias abundantes"" al menos hasta el lunes.

El sábado por la mañana en Resistencia cayeron alrededor de 70 milímetros de agua durante una hora , lo que anegó sus calles céntricas y llevó a las autoridades a suspender de forma temporaria el servicio de transporte urbano de pasajeros.

LEA MAS","Sun, 21 Jan 2018 08:00:00 GMT",https://www.infobae.com/new-resizer/Kod1_ViF4ce16LqXgCNKioq1pUo=/1200x628/filters:format(jpg):quality(85)//s3.amazonaws.com/arc-wordpress-client-uploads/infobae-wp/wp-content/uploads/2018/01/21163746/Inundacion-en-Chaco-2.jpg,"['la', 'el', 'fueron', 'del', 'en', 'se', 'las', 'intensas', 'los', 'lluvias', 'temporal', 'evacuadas', 'agua', 'personas', 'que', 'y', 'menos', 'por']", 
31,31,FL-2018-000014-ARG,Coninagro se solidarizó con las familias productoras de Chaco por las inundaciones - Infocampo,https://www.infocampo.com.ar/coninagro-se-solidarizo-con-las-familias-productoras-de-chaco-por-las-inundaciones/,"CONINAGRO lamenta los problemas que atraviesan miles de productores del Chaco, tras las torrenciales lluvias recibidas en los últimos días, las que causaron ya cuantiosas pérdidas, incluso la muerte de un productor.

“Estamos junto a los productores de Sáenz Peña, Quitilipi y Avia Terai y acompañando a nuestra federación asociada, la Unión Cooperativas Algodonera (UCAL), en las acciones inmediatas necesarias, y para gestionar la ayuda que urge en estos momentos de angustia”, comunicaron.

Vea también: Un hombre se ahogó mientras intentaba salvar al ganado de la inundación en Chaco

Desde Coninagro “destacamos el fuerte impacto negativo que esta emergencia hídrica tendrá sobre el comercio y la producción, afectando ciudades donde se gestiona y planifica la actividad rural, y esperamos que las acciones de asistencia alimentaria, sanitaria y social puedan ser amplias y alcancen a todos los afectados”.","Thu, 25 Jan 2018 08:00:00 GMT",https://www.infocampo.com.ar/wp-content/uploads/2016/11/ganado-en-islas-631-280-631-15224.jpg,"['solidarizó', 'y', 'la', 'el', 'coninagro', 'se', 'en', 'las', 'los', 'productoras', 'inundaciones', 'chaco', 'productores', 'que', 'familias', 'por']", 
32,32,FL-2018-000014-ARG,Salinización: el costo oculto del incremento de la variabilidad climática - LA NACION (Argentina),https://www.lanacion.com.ar/economia/campo/salinizacion-el-costo-oculto-del-incremento-de-la-variabilidad-climatica-nid2102142/,"Luego de las inundaciones que afectaron en 2017 a amplias zonas del centro oeste bonaerense, La Pampa y el sur de Córdoba, y ahora con la sequía en varias de esas regiones, muchos productos se preguntan por la salinización de sus suelos. Un problema en primer plano cuando, sobre todo, en los campos desparejos en su superficie todavía puede haber bajos inundados y lomas secas en su totalidad, con una enorme disparidad de humedad en los suelos.

Para Roberto Casas, director del Centro para la Promoción de la Conservación del Suelo y del Agua, perteneciente al INTA, la problemática de la salinización y la sodificación de los suelos por efecto de las oscilaciones y la composición salina de la capa freática cercana a la superficie está incrementándose en extensión e intensidad, afectando en grados diversos a millones de hectáreas de tierra.

""Solo en la provincia de Buenos Aires hay más de tres millones de hectáreas afectadas por este proceso, principalmente en el noroeste y en ambientes bajos de la depresión del Salado"", dijo a la nacion el especialista.

Vale recordar que, según un estudio publicado por la Fundación para la Educación, la Ciencia y la Cultura (Fecic) en 2015, en la Argentina existen unos 100 millones de hectáreas de suelos afectados por procesos de erosión, un incremento de 40 millones de hectáreas respecto de una estimación realizada 25 años atrás.

La cuestión hoy en discusión es cómo quedan los suelos cuando se retira el agua. Si no llueve en forma periódica, la salinización es una constante en los campos encharcados. La tierra se concentra de sal, que la lleva poco a poco a ser improductiva.

Los suelos que presentan abundancia de cloruro sódico son llamados halomorfos. En este contexto, las precipitaciones de manera continua producen un mejoramiento de los suelos que han sufrido por largos meses una inundación.

Todo esto tiene que ver con la situación actual en campos del norte de La Pampa y el oeste de la provincia de Buenos Aires. El agua decantó, pero dejó degradado el terrero con una gran acumulación de sal en la superficie del suelo, complicando a los futuros cultivos.

Según Casas, ""la intensificación de los procesos de salinización y sodificación de los suelos en relación con las oscilaciones de los niveles freáticos con aguas cargadas de sales y sodio está asociada a la variabilidad climática, principalmente a las lluvias superiores a las medias históricas"". Al respecto, Juan Balbín, presidente del INTA y productor de la zona de General Villegas, explicó que, ""si bien este fenómeno fue inevitable, esta vez el efecto del armado de canales fue interesante, porque ha facilitado la no acumulación de sales y el impacto ha sido más leve que en otros años"".

Las fuertes temperaturas del año influyen en este proceso, porque el agua se evapora en forma rápida, sin drenar, no dando lugar a la incorporación al suelo y quedando superficies salinas, carentes de nutrientes y con poco volumen para recuperarse.

""Si no llueve en forma escalonada en los próximos meses, aquellos campos que antes eran ganaderos y en los años noventa se convirtieron en agrícolas tardarían al menos alrededor de dos años en recuperarse"", señaló Balbín.

Además de las hectáreas afectadas en Buenos Aires, se suman otras regiones y provincias afectadas por este fenómeno. De hecho, la salinización hoy no solo se está viendo en los campos ganaderos ,sino también en las tierras agrícolas de alta productividad. Y afecta hoy, entre otras regiones, al norte de La Pampa, el noroeste y al norte bonaerense donde hay se presentan síntomas leves de salinización.

En este contexto, según un estudio del INTA Marcos Juárez, en los últimos cincuenta años la napa freática subió once metros, un promedio de 18 a 20 centímetros por año de ascenso. El fenómeno se da en el sudeste de la provincia de Córdoba, pero es extensivo a otras regiones de la provincia de Buenos Aires y La Pampa.

""Si bien es leve todavía, es preocupante porque son suelos ciento por ciento agrícolas, que antes carecían de este problema"", alertó Casas.

En un informe del INTA sobre manejo del agua en campos anegables, los ingenieros agrónomos Miguel Taboada y Francisco Damiano explicaron cómo el embalsamiento del agua de lluvia excedente también puede ser utilizado para mejorar la vegetación en veranos extremadamente secos y cálidos.

Las inundaciones dejaron consecuencias que hoy se hacen visibles sobre todo en los campos desparejos Santiago Hafford

Para Taboada, director del Instituto de Suelos del INTA, existen distintas técnicas disponibles para rehabilitar suelos salinos y alcalinos. Lo primordial es solucionar los excesos de agua.

""El fundamento de la hidrología es el manejo del agua en el campo y no simplemente su evacuación por medio de canales que es el concepto clásico de la hidráulica. Tiene que ver con llevar el agua en las depresiones naturales del terreno, almacenar los excedentes, dándole mayor volumen por altura con bordos, dar mayor resiliencia al sistema para ser utilizada en épocas de sequía. La estrategia es el manejo interno del agua disminuyendo el área anegable"", precisó Taboada.

Para ello, dicen los especialistas en suelos, que la construcción y el mantenimiento de las obras debe realizarse mayormente con maquinaria e implementos de tipo rural, como ser un tractor, arado de disco, pala y hoja niveladora de arrastre, zanjadora, taipera y motoniveladora, equipos usados para construir estructuras de tierra menores a 0,6 m de altura y 0,3 m de profundidad (bordos y badenes, respectivamente).

Un buen momento para iniciar los trabajos de reparación de los suelos ya deteriorados es cuando la capa freática se encuentre en profundidad, en general, coincidente con la primavera. ""La cobertura de los suelos limita el flujo de sales a superficie, manteniendo una salinidad del suelo similar o inferior a la de la capa freática, por lo cual el manejo de estos suelos debe orientarse a conseguir y mantenerlos cubiertos. Se debe aprovechar la vegetación natural existente, secándola con un herbicida. La fertilización con fósforo se visualiza como una alternativa a integrar en el paquete tecnológico para la recuperación"", remarcó Casas.

Forrajeras que toleran el exceso de sales

Según experiencias realizadas en un campo de Carlos Tejedor, Buenos Aires, en donde se implantaron variedades forrajeras que toleran la salinidad y sodicidad, con elevada actividad radical y producción de materia seca, pudo observarse que ciertas especies megatérmicas fueron las que mejor se adaptaron al ambiente.

Se destacó con un excelente comportamiento la grama rhodes, porque se adaptó a condiciones de alcalinidad. Presentó una producción de materia seca superior a las 6 toneladas por hectárea. También tuvieron un buen comportamiento el agropiro y el lotus (Lotus tenuis). En búsqueda de medidas más integradoras para la producción, el INTA considera conveniente anexar la rotación de cultivos en las lomas de los campos para así evitar la infiltración del agua hacia los bajos y también sistemas adecuados de pastoreo para disminuir el agravamiento del halomorfismo de los suelos.

“Lo importante es saber que es posible recuperar estos suelos salinizados. En primer término hay que clausurar el lote, no roturarlo, no ararlo y dejar que se instale cobertura natural sobre el mismo, especies salinas, salicornias, pelo de chancho”, dijo Roberto Casas, del INTA.

Las claves para recuperar suelos salinizados

Manejo químico

Se busca corregir el PH del suelo. El yeso agrícola es un mineral de bajo costo. Sus propiedades químicas mejoran los suelos sódicos a través de la aplicación de riego suplementario.

En campos en donde la capa freática se encuentra por debajo de una profundidad mayor, el ascenso de sales hacia la superficie es muy limitado y en un lapso mayor de tiempo, las probabilidades de que el mineral funcione son altas.

Labranza profunda. Mejora y promueve la infiltración del agua y el lavado de sales. La descompactación en los suelos, con paratill, disminuye la densidad de la tierra.

Biología del suelo

La suma de abonos orgánicos (estiércol, abono de piletón de tambo) aporta nutrientes específicos a los suelos sódicos con un deficiente estado. El costo del producto es menor, pero el transporte y la distribución del material es difícil llevarlo a cabo.

Plantas mejoradoras. Esto incluye al arroz, el maíz de Guinea y las especies megatérmicas como grama rhodes, o mijo perenne.

Manejo de la cobertura superficial. El pastoreo continuo produce suelos desnudos de vegetación. En tanto, los descansos periódicos de los lotes ayudan a la recuperación.

Prevención

El manejo de la cobertura superficial es importante para mantener la cobertura en el suelo. La siembra directa y la intersiembra son las herramientas más aptas para lograr una rápida recuperación del suelo. Esto es, para que no se siga degradando y evitar el ascenso de las sales a superficie.

También el manejo racional del pastoreo hace que se acreciente la cobertura superficial de la tierra para la prevención del ascenso de las sales.

Todas estas prácticas, aplicadas en forma integrada y no de manera aislada, tiene un rédito más efectivo.

Conforme a los criterios de Conocé The Trust Project","Sat, 20 Jan 2018 08:00:00 GMT",https://resizer.glanacion.com/resizer/yoRdH18TjShIisDLfddbdzanwDc=/768x0/filters:quality(80)/cloudfront-us-east-1.images.arcpublishing.com/lanacionar/4JSQJMBGKRBBLNFL4QMDYEFLQE.jpg,"['la', 'oculto', 'incremento', 'el', 'salinización', 'del', 'en', 'suelos', 'se', 'los', 'las', 'que', 'climática', 'y', 'variabilidad', 'costo']", 
