,ID,event_id,article_title,article_link,article_content,publishing_date,article_image,article_keywords,article_relevance
13,13,FL-2012-000075-VEN,Industria cárnica con futuro incierto - El Nuevo Diario,https://www.elnuevodiario.com.ni/nacionales/251441-industria-carnica-futuro-incierto/,"A finales de julio se vencen los contratos de compra de carne bovina que Nicaragua tiene con Venezuela, mercado al que se destina el 40% del total de las exportaciones de este rubro, sin embargo, la ansiedad inunda al sector cárnico industrial, porque aún no se negocian los nuevos contratos con dicho país, afirmó Onel Pérez, Presidente de la Cámara Nicaragüense de Plantas Exportadoras de Carne Bovina, Canicarne.

Venezuela mantiene congelados los precios desde hace tres años, lo que preocupa aún más a la industria cárnica.

Pérez explicó a El Nuevo Diario que “esto significa que estamos buscando un reajuste al precio, así como la negociación de nuevos volúmenes, un asunto que nos preocupa para la continuidad en ese mercado, ya que los contratos se vencen a finales de julio de este año. Hemos solicitado a la contraparte desde hace algún tiempo, reunirnos para resolver esto, y estamos a la espera de que nos den respuesta”.

Pasar de ALBA al TLC

Según Pérez, para garantizar la continuidad de las exportaciones, han propuesto que el convenio ALBA se transforme en un Tratado de Libre Comercio, TLC, aprovechando las buenas relaciones que actualmente existen entre los dos países, para así asegurar la continuidad de las exportaciones, no solo de la carne, sino de los otros productos negociados.

“Las compras venezolanas de carne bovina son frágiles, pues dependen de la buena voluntad política que existe entre el Presidente de Venezuela y el Presidente de Nicaragua, y es innegable que el estado de salud del presidente venezolano, Hugo Chávez, podría afectar hacia futuro”, insistió Pérez.

Según datos de Canicarne, para 2011, Venezuela representó el 35% del volumen de exportaciones de carne bovina, y en lo que va de 2012, el 44%.

La ""Vaca Loca"" asusta

El sector cárnico también ha expresado su preocupación con el mercado de Estados Unidos, que registra muy pocas transacciones para junio y julio próximos, producto de la incertidumbre en ese mercado, después de la detección de un caso de “Vaca Loca” en el estado de California, el 24 de abril recién pasado.

El fin de semana pasado, el gerente general de Carnes San Martín, Alfredo Marín, advirtió que este fenómeno está generando una caída en los precios de exportación por cabeza industrial de US$5, inicialmente, pero la tendencia es que la baja continúe hasta llegar a los US$25.

Mantienen precios

Aun así, Pérez sostiene que la industria está manteniendo los precios a los productores, a pesar de la situación en Estados Unidos y Venezuela, pagando en 2012 un 33% más que el año pasado.

Exportaciones en 2012

Al corte del lunes 14 de mayo, el Centro de Trámites de las Exportaciones, Cetrex, refiere que Nicaragua ha exportado un total de US$166.65 millones en carne bovina. A Venezuela le corresponde un total de US$78.68 millones, siendo el primer rubro de exportación a este país que ha consumido un total de 17,430 toneladas métricas de carne nica.

Estados Unidos ocupa el segundo lugar, al facturar US$61.6 millones por un total de 11,967 toneladas métricas de carne de bovino. Le sigue México, con US$8.3 millones, por una demanda de 26,592 toneladas métricas

En Centroamérica, pese a que Nicaragua tiene acuerdos comerciales como toda la región, El Salvador es el primer comprador de carne bovina nica, con US$18.5 millones facturados por 3,771 toneladas métricas.

Por su parte, Costa Rica reporta una facturación por la carne bovina nica de US$3.5 millones con 0.558 toneladas métricas, tercer producto de demanda, solo después de las naranjas frescas y el frijol.

En el acumulado del mes, Cetrex refleja que se han facturado US$17.62 millones en carne de bovino para todos los mercados, período que corresponde del primero al 14 de mayo.","Wed, 16 May 2012 07:00:00 GMT",https://assets.cdnelnuevodiario.com/legacy/1337143223_Carne.jpg,"['bovina', 'cárnica', 'el', 'incierto', 'en', 'millones', 'industria', 'carne', 'futuro', 'la', 'y', 'para', 'los', 'que']", 
14,14,FL-2012-000075-VEN,"""Debby"" abandona por fin Florida tras cinco días de azote - El Nuevo Diario",https://www.elnuevodiario.com.ni/internacionales/256085-debby-abandona-fin-florida-cinco-dias-azote/,"""Debby"" abandonó hoy por fin Florida (EU) en forma de depresión tropical, tras cinco días de azote en que provocó cantidades récord de lluvia, miles de personas sin agua ni electricidad y zonas del norte evacuadas.



El Centro Nacional de Huracanes (CNH) de EU detalló hoy en su boletín de las 15.00 GMT que el frente está ya en el Atlántico, a 145 kilómetros al este de San Agustín (Florida) y que sus vientos máximos sostenidos han disminuido hasta los 55 kilómetros por hora.





""Debby"", la primera tormenta tropical que se formó en el Golfo de México esta temporada, permaneció casi estacionaria desde que el sábado se declaró su formación, lo que dio mucho tiempo a las nubes a descargar sus lluvias.



Ello favoreció que en algunos lugares de Florida se hayan registrado lluvias récord para un mes de junio, como en el condado de Alachua, donde han caído más de 41 centímetros, algo desconocido desde que se tiene registro.



En otras zonas del estado, que en gran parte es una planicie muy próxima al nivel del mar y carece de montañas, se han llegado a acumular 60 centímetros de agua de lluvia, lo que ha provocado inundaciones que han dejado incomunicadas diversas áreas costeras del norte.



Se han reportado dos muertes

Aunque no hay confirmación oficial, se ha reportado la muerte de dos personas a causa de ""Debby"": una mujer del condado de Highlands, que falleció el domingo tras ser destruida su casa, y otra persona que murió también el domingo por un tornado.



Las grandes cantidades de agua caídas y los vientos, tendentes a formar tornados, obligaron al gobernador de Florida, Rick Scott, a declarar el lunes el estado de emergencia e incluso el presidente de EU, Barack Obama, le ofreció el martes ayuda federal.



[Te puede interesar: Tormenta tropical ""Debby"" va inundando a su paso por Florida]

Sin embargo, desde que ese día tocó tierra, ""Debby"" ha ido perdiendo intensidad, hasta convertirse en depresión tropical, y ha acelerado su velocidad de desplazamiento, lo que permitió que en la madrugada del miércoles cruzara de una vez la península de Florida.



Según el CNH su velocidad actual de desplazamiento ronda los 17 km/h, frente a los menos de 9 km/h de días previos, y se prevé que esa traslación se acelere aún más en las próximas horas.



Así, ""Debby"" ya se adentra en el Atlántico y poco a poco se espera que se disipe del todo, lo que quiere decir que lo peor para Florida ya ha pasado, aunque aún seguirá lloviendo durante horas.



Se vigila onda tropical

Las alertas ya se han suspendido y no hay ningún otro frente en la cuenca atlántica que preocupe. Sólo se vigila una onda tropical en la zona atlántica central a la altura del ecuador, que tiene un 30 % de posibilidades de convertirse en depresión, aunque aún está muy lejos de zonas pobladas.



Entre las preocupaciones que persisten en Florida está el elevado caudal de los ríos (como el de Suwannee, un 10 % más alto de lo normal), lo que ha forzado la evacuación de miles de personas, entre ellas unas 15.000 en el condado de Pasco, donde algunos residentes tuvieron que ser socorridos en embarcaciones porque sus residencias habían quedado inaccesibles por carretera.



Además, se siguen atendiendo urgencias derivadas del derribo de árboles y postes eléctricos, así como el corte parcial de carreteras secundarias por las inundaciones, especialmente en la zona oeste donde la península de Florida se une al continente.



Incluso la I-10, la única carretera interestatal que atraviesa Florida de este a oeste, permanece cortada en diversos tramos, aunque la normalidad se recupera paulatinamente en un estado muy volcado en el turismo, que también ha sufrido las consecuencias de cinco días de chaparrón continuado.



Algunos problemas causados por ""Debby""

Así, en zonas casi exclusivamente vacacionales del norte, islas como St. George están aisladas y sin suministro eléctrico ni agua.



Aunque la mayor parte de los parques de atracciones del área central de Orlando se han mantenido abiertos, la asistencia ha descendido notablemente.



En Miami, donde las lluvias casi no han cesado desde el viernes pasado, hoy amaneció con sol por primera vez y una subida de las temperaturas, aunque persistían los vientos que ha provocado cortes eléctricos en el sur del estado.



Este arranque de la temporada de huracanes en el atlántico está siendo especialmente activo: Oficialmente comenzó el 1 de junio, pero este año, antes incluso de que se iniciara la temporada, ya se habían formado dos tormentas tropicales, algo que sólo se ha observado en dos ocasiones más en la historia.



Además, desde que se tiene registro jamás se había detectado la formación de cuatro tormentas tropicales en el Atlántico antes del 1 de julio.","Wed, 27 Jun 2012 07:00:00 GMT",https://assets.cdnelnuevodiario.com/legacy/1340817531_debby.jpg,"['por', 'días', 'azote', 'florida', 'el', 'ha', 'fin', 'en', 'cinco', 'se', 'abandona', 'del', 'tras', 'las', 'la', 'y', 'debby', 'que']", 
15,15,FL-2012-000075-VEN,Los riegos secan el Jarama - El País.com (España),https://elpais.com/ccaa/2012/06/29/madrid/1340970083_635987.html,"Cauce del Jarama a la altura de San Martín de la Vega.

Los riegos han comenzado en los campos de maíz y otros cultivos de la vega del Jarama, pero este año el río madrileño está sufriendo con especial crudeza la extracción de agua. El Jarama se ha convertido en una especie de ciénaga en los términos de San Martín de la Vega y Ciempozuelos (entre la Presa del Rey y la desembocadura del Tajuña), mientras que los campos de cultivo ribereños aparecen inundados. A partir de ese punto el Jarama se recupera algo, pero no lo suficiente para aportar al Tajo, donde desemboca, el caudal habitual.

Una situación que puede complicar aún más la delicada situación del Tajo, donde la semana pasada aparecieron miles de peces muertos. Ecologistas en Acción calcula que el tramo total afectado es de unos 30 kilómetros, un entorno con zonas protegidas como el Parque Regional del Sureste. Sin embargo, la Confederación Hidrográfica del Tajo sostiene que el caudal es ""similar"" al de todos los años durante la campaña de riego. ""Se lleva regando varios meses sin que esto plantee ningún problema para los niveles de agua del río"", añaden.

“El agua baja en esta época porque comienzan los riegos que duran hasta septiembre, pero los vecinos no recuerdan un episodio de desecación tan drástico como este”, explica Antonio Martínez desde la organización Ecologista. “Hay zonas donde pierde su condición de río, porque se ha transformado en una sucesión de charcas de unos 20 centímetros de profundidad conectadas entre sí por unos hilillos de agua”, describe. Para el ecologista está claro que en estas fechas existe una situación de estrés hídrico, pero no “de emergencia”, como para que no se pueda inyectar algo de agua desde los pantanos, que presentan un buen nivel. “El Atazar, el gran almacén de agua de Madrid, está al 69% de su capacidad”, pone como ejemplo.

La disminución de nivel se comenzó a detectar hace unos 10 días. “Y de ahí ha ido a peor”. Ecologistas en Acción ha comprobado que la extracción se está realizando de una manera salvaje y sin control para los riegos en la parte de la Presa del Rey, donde se unen el Manzanares y el Jarama. De ahí parte la Real Acequia del Jarama que suministra agua de riego a San Martín, Ciempozuelos, Titulcia o Aranjuez. “Incluso hay vecinos que aseguran que el nivel de sus pozos ha subido en una semana cuatro metros, lo que demuestra que la capa freática se ha empapado de una forma completamente inusual”, añade Martínez.

Les preocupa de forma especial como puede afectar al Tajo, con el caudal muy mermado debido al trasvase Tajo-Segura, que dirige parte de las aguas de su cabecera al riego en tierras levantinas. El caudal del río en Toledo el 19 de junio, cuando amaneció sembrado de barbos y carpas muertas, era de 11,68 metros cúbicos por segundo. Desde entonces se ha producido un incremento hasta llegar a los 15,36 metros cúbicos, según la medición de ayer.

Desde la Confederación Hidrográfica del Tajo (CHT) confirman que se está soltando un 10% más de agua al cauce del río desde Bolarque, el mismo lugar desde donde parten dos inmensos tubos que abastecen el trasvase. Un lugar idílico de aguas transparentes con tono esmeralda, que según avanzan se transforman en opacas y cada vez más escasas. La CHT asegura que este incremento no tiene nada que ver con el episodio de mortandad de peces en Toledo, sino con la inyección de agua para los regantes del río Alberche (el mayor afluente del Tajo), que está previsto comience el uno de julio próximo.","Fri, 29 Jun 2012 07:00:00 GMT",https://imagenes.elpais.com/resizer/zHXG9ajCeLW_RknQ8DzBowif018=/1200x0/arc-anglerfish-eu-central-1-prod-prisa.s3.amazonaws.com/public/UGB7SEBFMZZVBW2GIZLG6RMOK4.jpg,"['agua', 'el', 'ha', 'en', 'se', 'del', 'riegos', 'secan', 'la', 'y', 'jarama', 'los', 'que']", 
16,16,FL-2012-000075-VEN,Chávez toma una droga 100 veces más fuerte que la morfina - El Nuevo Diario,https://www.elnuevodiario.com.ni/nacionales/253390-chavez-toma-droga-100-veces-mas-fuerte-que-morfina/,"El presidente venezolano, Hugo Chávez, toma un opiáceo que es “100 veces más fuerte que la morfina” para aliviar los fuertes dolores que le causa “el persistente avance del cáncer en los huesos”, reveló ayer el diario español ABC, que cita un “informe de Inteligencia”.

Además de ese medicamento, denominado “fentanilo”, los médicos también le suministran “bisfosfonato para combatir la progresión de la metástasis” y “corticosteroides para aliviar los efectos secundarios de la radiación y la quimioterapia”, indica el medio.

El periódico asegura haber tenido acceso al “último informe de Inteligencia”, elaborado a partir de “los dictámenes médicos del equipo de facultativos que atiende al mandatario de Venezuela”.

Las mismas fuentes confirman que “Chávez padece un rabdomiosarcoma, un tumor cancerígeno de los músculos que van adheridos a los huesos, con metástasis”.

Sobre el pronóstico, “al menos parte del equipo médico estima, de acuerdo con el informe de Inteligencia, que si no sucede una inesperada caída el presidente Chávez podría llegar a las elecciones presidenciales del siete de octubre”.

La candidatura de Chávez a esos comicios fue registrada el viernes en el Consejo Nacional Electoral, CNE, durante el primer día del plazo formal para que los partidos presenten a sus aspirantes.

Según el informe citado por ABC, los efectos posteriores del tratamiento al que está sometido Chávez en Cuba, que incluye radiación y quimioterapia, como fuerte dolor y gran ansiedad, son “especialmente preocupantes y en algún momento su cuerpo no será capaz de superarlos”.

Añade que los tratamientos son “para afrontar la extensión del cáncer, no para erradicarlo”. Chávez, de 57 años, se encuentra inmerso en un proceso de recuperación desde que hace casi un año se le diagnosticó la enfermedad.

El mandatario regresó el pasado 11 de mayo a Venezuela tras concluir la última etapa de la radioterapia, tratamiento que le fue prescrito tras ser sometido en febrero pasado a la operación de un nuevo tumor canceroso, recurrencia del que lo llevó a pasar por el quirófano por primera vez el 20 de junio de 2011.","Sun, 03 Jun 2012 07:00:00 GMT",https://assets.cdnelnuevodiario.com/legacy/1338697929_CHAVEZ31.jpg,"['el', 'droga', 'en', 'del', 'más', 'toma', 'morfina', 'veces', 'la', 'para', 'una', 'y', 'fuerte', 'le', 'los', 'chávez', 'que']", 
17,17,FL-2012-000075-VEN,El perro Lennox fue ejecutado pese a las súplicas por su liberación - CNN México.com,https://cnnespanol.cnn.com/2012/07/11/el-perro-lennox-fue-ejecutado-pese-a-las-suplicas-por-su-liberacion/,"(CNNEspanol.com) — Lennox, un perro considerado peligroso y que estaba en el centro de una campaña internacional para salvar su vida fue ejecutado a la medianoche del miércoles, dijo el Ayuntamiento de Belfast, de acuerdo con medios irlandeses.

Un portavoz de la ciudad dijo: «El Ayuntamiento de Belfast confirmó hoy que el perro Lennox, un pit-bull tipo terrier ilegal se ha puesto humanamente a dormir».

Mientras unas 200.000 personas clamaban en las redes sociales por su liberación, un funcionario describió a Lennox como uno de los perros más impredecibles y peligrosos que había encontrado.

El martes el primer ministro Peter Robinson sugirió que Lennox debía ser reubicados después de una campaña viral en Internet para su liberación. Su ejecución fue ordenada por la Corte de Apelaciones el mes pasado.

El personal del Ayuntamiento de Belfast ha sido objeto de intimidación por parte de algunos defensores de animales, de acuerdo con la BBC.

Un concejal recibió una amenaza de muerte por proponer la ejecución de Lennox y los trabajadores del Ayuntamiento se han convertido en el blanco de una nueva serie de intimidaciones y mensajes amenazantes.

Algunos veterinarios Irlanda del Norte dijeron que habían sido inundados con correos electrónicos de los activistas defensores de los animales.","Wed, 11 Jul 2012 07:00:00 GMT",https://cnnespanol.cnn.com/wp-content/uploads/2017/05/cnne-logo-video-bg.png,"['por', 'el', 'lennox', 'en', 'liberación', 'fue', 'pese', 'las', 'la', 'y', 'una', 'perro', 'los', 'su', 'que', 'súplicas']", 
18,18,FL-2012-000075-VEN,"Maestros, al tablero en la Copa Internacional de Ajedrez - El Universal - Cartagena",https://www.eluniversal.com.co/deportes/maestros-al-tablero-en-la-copa-internacional-de-ajedrez-80145-FXEU163530,"El ajedrez de Bolívar ya tiene talla internacional.

Tiene a la Maestra Internacional, Ingris Rivera; los Maestros Fide Carlos Manuel López e Israel Tovío y la Maestra Fide Milena Herrera.

Todos con talento, fogueo y con argumentos técnicos para conquistar medalla de oro en los Juegos Nacionales de 2012.

Ellos, desde hoy, tendrán la gran oportunidad de foguearse con los grandes en la primera Copa Internacional de Ajedrez “Ider 20 Años” y el IV torneo de Ajedrez Copa Fonducar homenaje a Ed-gardo De la Cruz.

El evento abre puertas hoy a las 5 p.m., en el salón Bernardo Caraballo del Complejo de Raquetas.

Tovío, quien ha inscrito su nombre en las tres versio-nes anterior, aseguró que se ha preparado para retener el título.

Paralelamente se realizará el torneo infanil en los pasi-llos del Centro Comercial San Felipe.

La nueva sangre del juego ciencia en Bolívar como Ru-bén Navarro, Juan Camilo Peña, Juan Pablo Pabón, Andrés Cabarcas, Daniel Mejía, entre otros, mostrarán todos sus progresos en esta disciplina, donde Bolívar siempre ha sido protagonista.

Los países que confirmaron su asistencia son: Cuba, México, España, Ecuador, Venezuela y Colombia, todos con sus jugadores que asistirán a las Olimpíadas Mundiales de Turquía, en agosto.

Donaldo Ardila, presidente de la Liga de Ajedrez de Bolívar, dijo que “es la primera vez que en Cartagena se realizará un torneo de esta calibre. Además el certamen da la posibilidad de adquirir norma de Maestro Internacional y Gran Maestro”.

El evento cuenta con el auspicio del Ider, Fonducar, Comfenalco, Iderbol y el Centro Comercial San Felipe.

Entre las figuras naciona-les sobresale el Maestro Alonso Zapata, quien dio ayer una simultánea en la Universidad de Cartagena.

Así mismo el peruano Julio Granda; los Maestros cubanos Aryam Abreu y Aramis Álva-rez.

Abreu también se la jugó en una simultánea en Comfenalco con los alumnos de esa institución.

","Thu, 14 Jun 2012 07:00:00 GMT",https://www.eluniversal.com.co/news-portlet/getogimage/82940059-9a98-45e8-a55b-571c8eecfcd7.jpg,"['copa', 'el', 'maestros', 'bolívar', 'en', 'se', 'al', 'del', 'las', 'la', 'internacional', 'y', 'tablero', 'ajedrez', 'los', 'que']", 
19,19,FL-2012-000075-VEN,Carlotta se degrada a tormenta tropical | CNN - CNN México.com,https://cnnespanol.cnn.com/2012/06/16/carlotta-se-degrada-a-tormenta-tropical/,"El huracán Carlotta se degradó a tormenta tropical este sábado en la mañana mientras avanza por la zona costera del sur de México, según informó el Centro Nacional de Huracanes (CNH) con sede en Miami.

El CNH retiró la alerta de huracán que regía de Salina Cruz a Punta Maldonado así como el aviso desde este lugar hasta Acapulco.

Por su parte el Servicio Meteorológico Nacional (SMN) de México informó que Carlotta avanza hacia el noreste del estado de Guerrero.

En su último reporte, el SMN indicó que la tormenta se encuentra a 70 kilómetros al noreste del puerto de Acapulco y continúa debilitándose al adentrarse en la región montañosa de Guerrero.

“Se recomienda extremar precauciones por inundaciones y deslaves de terreno principalmente sobre estos dos últimos estados», señaló la dependencia.

Sin embargo, la alerta de lluvias fuertes con tormentas eléctricas continúa para los estados de Guerrero y Michoacán, donde habrá un incremento de oleaje y vientos que alcanzan rachas de hasta 150 kilómetros por hora.","Sat, 16 Jun 2012 07:00:00 GMT",https://cnnespanol.cnn.com/wp-content/uploads/2017/05/cnne-logo-video-bg.png,"['por', 'el', 'smn', 'en', 'se', 'del', 'tormenta', 'la', 'y', 'tropical', 'carlotta', 'su', 'que', 'degrada']", 
20,20,FL-2012-000075-VEN,Nintendo presenta su consola 3DS XL con una pantalla de gran tamaño - CNN México.com,https://cnnespanol.cnn.com/2012/06/22/nintendo-presenta-su-consola-3ds-xl-con-una-pantalla-de-gran-tamano/,"El nuevo Nintendo 3DS XL estará disponible la segunda mitad del 2012, con un costo aproximado de 199 dólares.

Por Larry Frum

(CNN) — Después de haber llegado a la función 3D, Nintendo quiere ahora ir a algo más grande: su nueva versión Nintendo 3DS XL con pantallas de casi el doble de grandes.

El anuncio fue hecho la noche del jueves y tendrá una pantalla 90% más grande, dice Nintendo, una batería más fuerte para más tiempo de juego. También vendrá con una tarjeta SD de 4 gigabytes para el almacenamiento de juegos y aplicaciones descargables.



La nueva consola fue anunciada durante una presentación en video de Nintendo. Estará disponible en Japón y Europa en julio, y llegará a América el 19 de agosto, el mismo día que el lanzamiento del New Super Mario Bros. 2, la última versión para el 3DS.

El XL 3DS se venderá en Estados Unidos por 199 dólares, mientras que en Japón tiene un costo de 18,900 yenes (unos 235 dólares).

El anuncio llega en un momento en que Nintendo, un gigante de juego que tiene sus raíces en 1889 cuando hizo juegos de cartas, se encuentra en busca de algunas respuestas.

La consola portátil 3DS enfrentó algunos conflictos el año pasado, por lo que Nintendo se vio obligado a reducir su precio inicial después de que sus ventas no fueron las esperadas. Los críticos culparon al precio original (250 dólares) y un mercado inundado de nuevas opciones de teléfonos inteligentes y tabletas.

publicidad

La compañía registró su primera pérdida financiera en el mes de abril. Y la aparente confusión acerca de su apuesta principal, el Wii U, hizo que muchos observadores que se preguntan si Nintendo se dirige al público adecuado.

El nuevo 3DS XL es del mismo tamaño que su consola Nintendo DSi XL lanzada en 2010. Reggie Fils-Aime, presidente de Nintendo de América, dijo que la pantalla más grande para la 3DS XL facilitará más a los usuarios ver videos y películas.

«Los consumidores podrán disfrutar de la gran variedad de juegos actuales y futuros a una escala aún mayor», dijo en el video.

Nintendo también anunció varios juegos de gran nivel que son lanzados para la consola 3DS. LEGO: El Señor de los Anillos, Profesor Layton y la Máscara Milagrosa, Disney: Mickey Épico, poder de la ilusión y Scribblenauts Unlimited van a hacer su camino en la consola portátil de este año.

Namco Bandai también se hará un nuevo Super Smash Bros. para el 3DS y el Wii U. El popular juego no tiene fecha de lanzamiento previsto, y los desarrolladores dijeron que las dos versiones se están trabajando en forma simultánea.

La reacción de los jugadores en las páginas del foro de Nintendo ha sido desigual. Algunos están criticando la falta de un segundo controlador de joystick en el nuevo dispositivo, mientras que otros dicen que están contentos con la mayor duración de la batería. Muchos dicen que quieren ver cómo se ven los nuevos juegos en los dispositivos antes de dar el paso de adquirirlo.","Fri, 22 Jun 2012 07:00:00 GMT",https://cnnespanol.cnn.com/wp-content/uploads/2017/05/cnne-logo-video-bg.png,"['que', 'el', '3ds', 'en', 'se', 'tamaño', 'la', 'xl', 'una', 'presenta', 'pantalla', 'nintendo', 'y', 'los', 'su', 'gran', 'consola']", 
