,ID,event_id,article_title,article_link,article_content,publishing_date,article_image,article_keywords,article_relevance
7,7,FL-2021-000019-PER,Damnificados de inundaciones reciben ayuda de familias y organizaciones - Vatican News,https://www.vaticannews.va/es/iglesia/news/2021-02/damnificados-peru-selva-amazonica-ayuda-coronavirus-dengue.html,"Desde mediados de febrero fuertes lluvias provocaron inundaciones en la Selva amazónica peruana. Según el Centro Amazónico de Antropología y Aplicación Práctica, CAAAP, indicó que las regiones afectadas fueron: “Madre de Dios, Ucayali, Amazonas, Cusco y también la selva de Huánuco”. Las inundaciones dejaron a su paso según el Centro, “no sólo a miles de damnificados que sufren la pérdida de sus viviendas, animales y chacras; sino también muertos y personas desaparecidas”.

Ciudad del Vaticano

Aluviones, inundaciones, el dengue y el Covid-19. Es esta la realidad que está viviendo la población dela Selva amazónica peruana. Las poblaciones de la Provincia de Convención, sufrieron el lunes 15 de febrero, un aluvión que dejó un saldo de al menos dos muertos y nueve desaparecidos. Además, 13 viviendas, 2 instituciones educativas, 2 puentes peatonales, y 300 metros de carretera se vieron afectados, junto una cantidad aún indeterminada de hectáreas de cultivos y el servicio de energía eléctrica, reportó la Agencia Andina.

En Quillabamba, ha pasado una semana desde que el martes 16 de febrero, se lanzó una campaña para ayudar a las zonas afectadas. Fray Joel Chiquinta, párroco de la parroquia de la Inmaculada Concepción, en Quillabamba, Perú, expresó su satisfacción ante la solidaridad de las familias y organizaciones que se suponía en un día realizarían esta labor. Una labor, dijo el fraile que se ha extendido a toda la semana. A su parroquia, ha llegado la ayuda, la cual el fraile ha remitido a las comunidades afectadas.

De los 9 desaparecidos por las inundaciones, falta aún por encontrar un niño. En la zona del desastre, los damnificados siguen sobreviviendo al hambre, sobre todo, gracias a las ayudas recibidas, muchas capillas se han convertido en lugares de acogida.

En el sur del Perú persiste la falta de tanques de oxígeno para dar asistencia a enfermos del coronavirus. En Quillabamba han logrado una planta de oxígeno y disponen de varios galones, sin embargo, dijo Fray Chiquinta, si los casos del Covid19 aumentan tendrán también en la zona una urgente necesidad de tener más plantas de oxígeno.

Declaraciones de Fray Joel Chiquinta, párroco de la parroquia de la Inmaculada Concepción

Dengue y Covid-19. “Lloviendo sobre mojado”



Las lluvias son intensas en esta época del año, subraya el sacerdote dominico, sin embargo, en esta ocasión, eventos como el dengue y la pandemia del coronavirus están llevando al límite el sufrimiento de los pobladores. 995 casos de dengue contabilizados hasta el 15 de febrero de este año y más de 2200 casos de contagiados por Covid-19 sólo en lo que va del año, son una muestra de las dimensiones que va adquiriendo la problemática sanitaria y ambiental.

Los cultivos de café, cacao, plátano y otros han sido gravemente dañados por las lluvias y los aluviones, igualmente ha sucedido con animales de crianza como aves de corral. La población, fundamentalmente de origen quechua y de otros pueblos amazónicos ve como ante sus ojos se suman los desastres y sienten la casi imposibilidad de salir de la pobreza.","Wed, 24 Feb 2021 08:00:00 GMT",https://www.vaticannews.va/content/dam/vaticannews/multimedia/2021/02/24/2.jpg/_jcr_content/renditions/cq5dam.thumbnail.cropped.1500.844.jpeg,"['inundaciones', 'que', 'el', 'familias', 'en', 'damnificados', 'se', 'organizaciones', 'del', 'las', 'la', 'y', 'una', 'reciben', 'los', 'ayuda']", 
8,8,FL-2021-000019-PER,Piura: intensas lluvias provocaron inundaciones en distintos puntos de la región | VIDEO - El Comercio Perú,https://elcomercio.pe/peru/piura-intensas-lluvias-provocaron-inundaciones-en-distintos-puntos-de-la-region-video-nnpp-noticia/,"La región Piura se vio afectada por intensas lluvias y tormentas eléctricas registradas la noche del último martes en la cuenca media y alta de Piura, en la provincia de Ayabaca, Huarmaca y Morropón. Además, los sectores de Sullana y Tambogrande quedaron inundados, según el Servicio Nacional de Meteorología e Hidrología del Perú (Senamhi).

Uno de los distritos afectados es el de Bellavista, en la provincia de Sullana, donde el agua inundó varias calles.

#Infórmate Persiste #lluvia de moderada intensidad con descargas eléctricas en la cuenca media y alta de Piura, en la provincia de Ayabaca, Huarmaca y Morropón. Se espera que la intensidad disminuya en las proximas horas. pic.twitter.com/jT57QKWAx0 — Senamhi (@Senamhiperu) March 3, 2021

Incluso, los autos quedaron atrapados entre las aguas, obligando a los choferes a empujarlos y avanzar hacia su destino final.

Esto originó que varias localidades de esa parte del país quedaran inundadas generando preocupación en la población.

Este fue el caso de un conductor, donde se le observa junto a otro hombre haciendo esfuerzos para que su automóvil siga en marcha, luego de quedar estancado producto de la inundación.

Por otro lado, el mismo panorama se dio en la prolongación Chulucanas en el cruce con la avenida José Aguilar Santiesteban, en la provincia de Piura.

Esto originó que varias localidades de esa parte del país quedaran inundadas generando preocupación en la población

Las precipitaciones hicieron que se formen cuencas ciegas, lo que generó que vecinos de los asentamientos humanos afectados exijan el apoyo a las autoridades con motobombas.

Mientras que en el distrito de Tambogrande, las lluvias provocaron el colapso de varias viviendas en el asentamiento Nuevo Renacer y en otros sectores, según reportan los usuarios en redes sociales.

Conforme a los criterios de Saber más

VIDEO RECOMENDADO","Wed, 03 Mar 2021 08:00:00 GMT",https://elcomercio.pe/resizer/IGvvyy_gXecbrJJl_hUpWNev7Ro=/980x528/smart/filters:format(jpeg):quality(75)/cloudfront-us-east-1.images.arcpublishing.com/elcomercio/QZJOWIUDKRGMNGS5U2XP7XNAOY.jpeg,"['inundaciones', 'región', 'video', 'intensas', 'el', 'provincia', 'piura', 'lluvias', 'provocaron', 'en', 'se', 'las', 'puntos', 'la', 'y', 'varias', 'los', 'que']", 
9,9,FL-2021-000019-PER,Gobierno regional de Madre de Dios auxilia a pobladores afectados por inundaciones - Agencia Andina,https://andina.pe/agencia/noticia-gobierno-regional-madre-dios-auxilia-a-pobladores-afectados-inundaciones-834029.aspx,"Las personas afectadas permanecen albergadas en el colegio Miguel Grau del distrito de Las Piedras, provincia de Tambopata.

20:23 | Puerto Maldonado, feb. 16.





A las personas afectadas las trasladaron al colegio Miguel Grau del distrito de Las Piedras, donde permanecerán hasta que disminuya el cauce de los ríos y puedan retornar a sus domicilios.









Los primeros en ser trasladados al centro educativo fueron los pobladores de la urbanización popular de interés social (UPIS) Licenciados de las Fuerzas Armadas y Puerto Lindo. En el local escolar, Defensa Civil de Madre de Dios entregó frazadas y colchonetas; personal del Sistema de Atención Móvil de Urgencia (SAMU), así como de la Dirección Regional de Salud (Diresa) hizo un chequeo médico a los afectados.









Para garantizar la alimentación, el gobierno regional envió 300 kilos de víveres no perecibles, cocinas, ollas y platos a la institución educativa Miguel Grau. De igual manera, la municipalidad de Las Piedras envió agua mineral, mascarillas y otros productos.









Después, miembros del Ejército del Perú y obreros de la Gerencia Regional de Infraestructura de Madre de Dios colaboraron con el traslado de las pertenencias de los damnificados en unidades vehiculares del gobierno regional, Ejército y la comuna de Las Piedras.





También lea:









En otros puntos de la ciudad, como Pueblo Viejo, Isuyama, La Cachuela y La Pastora, trabajadores de diferentes gerencias y direcciones del gobierno regional ayudaron a los afectados por los embates de la naturaleza.









Vecinos del sector La Joya, igualmente, reciben ayuda de Defensa Civil de Madre de Dios, Ejército y municipalidad de Tambopata para, provisionalmente, evitar inundaciones en la carretera La Joya-Infierno. Con maquinaria, lampas y herramientas se fortalece este transitado acceso, que en épocas de lluvias es afectado.





Acumulado de lluvias





El Servicio Nacional de Meteorología e Hidrología (Senamhi) reportó que la provincia de Tambopata, donde se encuentran los sectores afectados por el desborde de los ríos, soportó un día extremadamente lluvioso y el de mayor acumulado a escala nacional, al registrar un valor de 121.4 milímetros de agua en la estación Puerto Maldonado.





Otros acumulados pluviales importantes se dieron en Manseriche (Loreto), con 62.1 milímetros; Puerto Inca (Huánuco), con 56.5 milímetros; San Ignacio (Cajamarca), con 43.6 milímetros; Rupa Rupa (Huánuco), con 41.5 milímetros; Capachica (Puno), con 30.2 milímetros; y Chugur (Cajamarca), con 26.6 milímetros.



Más en Andina: Desde mañana hasta el 21 de febrero, Agro Rural, en coordinación con los gobiernos locales y regionales, desarrollarán 29 fechas de los mercados De la chacra a la olla 2021 en 12 regiones https://t.co/1LiDsKdIUr pic.twitter.com/vsBRO101mL — Agencia Andina (@Agencia_Andina) February 17, 2021

(FIN) NDP/TMC/JOT

Loading...

Centenares de habitantes de Puerto Maldonado fueron auxiliados por el gobierno regional de Madre de Dios, luego de que sus viviendas terminaran inundadas tras desbordarse los ríos Madre de Dios y Tambopata, cuyos niveles aumentaron por el aporte de las fuertes lluvias.Publicado: 16/2/2021","Tue, 16 Feb 2021 08:00:00 GMT",https://portal.andina.pe/EDPfotografia3/Thumbnail/2021/02/16/000749996W.jpg,"['por', 'inundaciones', 'regional', 'el', 'en', 'pobladores', 'del', 'afectados', 'auxilia', 'dios', 'las', 'la', 'milímetros', 'madre', 'y', 'los', 'gobierno', 'puerto']", 
10,10,FL-2021-000019-PER,Perú. Situación de Madre de Dios: aún queda mucho por hacer - Vatican News,https://www.vaticannews.va/es/mundo/news/2021-03/inundaciones-madre-de-dios-peru-entrevista-caritas.html,"Desde mediados de febrero, fuertes lluvias azotaron la región de Madre de Dios, en el Perú, causando grandes daños materiales a los habitantes de la zona. Entrevista con el Secretario General de Cáritas Madre de Dios, Juan Carlos Navarro Vega.

Ciudad del Vaticano

Desde el 14 de febrero, fuertes lluvias provocaron grandes inundaciones en el Departamento de Madre de Dios, en el Perú. Las inundaciones provocaron los desbordes de los ríos Madre de Dios y Tambopata inundando muchas áreas campesinas, de los agricultores y también en localidades.

En entrevista con Vatican News, el Secretario General de Cáritas Madre de Dios, Juan Carlos Navarro Vega, afirmó que el reporte que dieron a conocer las autoridades, con fecha 23 de febrero afirma que son aproximadamente 15 mil personas que han sido damnificadas, afectadas por este fenómeno. Se sabe de tres mil 627 casas inundadas. En cultivos, aunque si indican tres mil, pero en la actualidad, como afirma el Secretario General, son casi 4000 hectáreas de cultivos en pérdidas: yuca, plátano, maíz y cultivos como el cacao, que se han visto afectados. También, el reporte de defensa civil reporta 14 instituciones educativas, la mayoría del sector rural y de comunidades nativas destruidas, en estos momentos son inhabitables, también hay 13 carreteras y algunos puentes que han sido destruidos, o sea que hay que reconstruir esos puentes de madera. De las 37 comunidades nativas que se encuentran en Madre de Dios 23 han sido severamente afectadas más que todo en las áreas de cultivo y algunos casos viviendas, al respecto hay una evaluación que hará Cáritas en los próximos días.

Navarro Vega afirmó que aún queda mucho por hacer con las autoridades competentes, para hacer un trabajo de “rehabilitación”,en eso, señaló, estamos coordinando con las autoridades para poder ver el tema de la post emergencia. ""Es importante la articulación que tiene que haber entre el gobierno nacional, regional, local e incluso social. Gracias a Dios no hubo víctimas humanas"", dijo..

Ayuda a región en Madre de Dios

¿Qué se está haciendo frente a esta tragedia?

El gobierno, el sábado 20 declaró en emergencia a la región Madre de Dios, el 21 llegó una comitiva del gobierno central que indicó que se apoyará a la región con 56 toneladas entre colchones, colchas, utensilios para el higiene y alimentos. Ayuda que, según Navarro Vega, ha llegado en forma paulatina, desde el 23 que llegaron los vuelos y camiones con estas cargas, procedentes de diferentes zonas del sur del país y desde Lima.

500 familias, asentadas en al menos 10 albergues temporales que se han habilitado para dar asistencia, hanrecibido esas ayudas. Allí se preparan los tres tiempos de comida, en ollas comunes. La sociedad civil también se ha organziado llevando ayuda a las familias damnificadas, y los chefs locales, están asistiendo con la preparación de platillos de “almuerzos o desayunos saludables” como le llaman., dijo el Secretario General de Cáritas, quien añadió que hasta el momento, después de casi 15 días de inundaciones, las familias siguen en los albergues, hasta que no se limpien las áreas y sus casas del lodo y escombros.

Acción de Cáritas

""Nosotros como Cáritas lo que hemos hecho desde el primer momento es asistir con alimentos para que se pueda cocinar en ollas comunes. Cáritas ha lrealizado una campaña que se hizo el sábado 20 para poder atender a las poblaciones que están en los refugios, así como a gente de otros sectores agrarios. Actualmente han entregado 300 canastas a los damnificados, queremos llegar a 500, dijo Navarro Vega, ""para poder asistir a todos los que están en los refugios y también estamos haciendo la entrega en algunos sectores agrarios que realmente han perdido gran parte sus cultivos y crianzas de animales, se habla de 22 mil animales menores que se han perdido.""","Wed, 03 Mar 2021 08:00:00 GMT",https://www.vaticannews.va/content/dam/vaticannews/multimedia/2021/03/03/6.jpg/_jcr_content/renditions/cq5dam.thumbnail.cropped.1500.844.jpeg,"['por', 'perú', 'el', 'en', 'se', 'han', 'dios', 'mucho', 'queda', 'aún', 'la', 'situación', 'madre', 'y', 'las', 'los', 'hacer', 'que']", 
11,11,FL-2021-000019-PER,Lluvias en la selva central causan desborde de riachuelos e inundación de viviendas - Agencia Andina,https://andina.pe/agencia/noticia-lluvias-la-selva-central-causan-desborde-riachuelos-e-inundacion-viviendas-835622.aspx,"Uno de los sectores más afectados es Playa Escondida, en el distrito de Pichanaqui, provincia de Chanchamayo (Junín).

17:46 | La Merced, mar. 1.





Uno de los sectores más afectados es Playa Escondida, en el distrito de Pichanaqui, provincia de Chanchamayo. Varias casas de material rústico quedaron bajo el agua y se dañaron muebles y enseres. También evidencia inundaciones la asociación de vivienda Playa Hermosa.









Personal de Defensa Civil de la municipalidad de Pichanaqui se trasladó a la zona afectada para evaluar los daños y proporcionar ayuda más adelante; por el momento se prioriza el empadronamiento de las personas perjudicadas.





En tanto, en el sector Mirador de Sangani del distrito de Perené, provincia de Chanchamayo, varias viviendas de construcción rústica resultaron afectadas por el desborde de riachuelos que se convirtieron en poco tiempo en ríos.









También lea:









Varios transportistas están a la espera de la culminación de los trabajos de rehabilitación de la vía San Luis de Shuaro-Puente Capelo, que fue afectado por el deslizamiento de rocas, tierra y árboles. Con maquinaria de Provías Nacional se trabaja en la carretera Central.









Las lluvias torrenciales provocaron, además, la inundación de calles y viviendas en el distrito de Río Negro, provincia de Satipo. El agua ingresó en gran cantidad en varios predios dejando daños materiales.





Más en Andina:

Fiscalía de Puno incauta media tonelada de marihuana en Desaguadero, tras operativo conjunto con la Dirandro?? https://t.co/JckWPQg5MV pic.twitter.com/NeHshd4QdG — Agencia Andina (@Agencia_Andina) March 1, 2021









(FIN) PTM/TMC





Loading...

Decenas de viviendas resultaron inundadas en diferentes distritos de las provincias de Chanchamayo y Satipo, en la selva central de la región Junín, tras lluvias torrenciales que se presentaron a tempranas horas de hoy, informaron fuentes locales.Publicado: 1/3/2021","Mon, 01 Mar 2021 08:00:00 GMT",https://portal.andina.pe/EDPfotografia3/Thumbnail/2021/03/01/000753514W.jpg,"['central', 'viviendas', 'el', 'provincia', 'chanchamayo', 'riachuelos', 'en', 'lluvias', 'se', 'distrito', 'selva', 'la', 'y', 'desborde', 'los', 'causan', 'inundación']", 
12,12,FL-2021-000019-PER,"Inundación en Loreto: 1294 viviendas, 5 colegios y 136 hectáreas de cultivo - Agencia Andina",https://andina.pe/agencia/noticia-inundacion-loreto-1294-viviendas-5-colegios-y-136-hectareas-cultivo-835766.aspx,"Desde el 15 de febrero, a consecuencia de las intensas lluvias se produjo el incremento del caudal y posterior desborde del río Ucayali, lo que ocasionó una inundación.

Al respecto, el Centro de Operaciones de Emergencia Regional (COER) de Loreto indicó que la Oficina de Gestión del Riesgo de Desastres de la municipalidad distrital de Padre Márquez continúa con la evaluación de daños y análisis de necesidades (EDAN).





Las autoridades locales coordinan con el gobierno regional de Loreto la entrega de bienes de ayuda humanitaria para las familias afectadas, que hicieron la limpieza de sus viviendas.





Informe técnico

El Centro de Operaciones de Emergencia (COE) del Ministerio de Educación señaló que el coordinador local de la UGEL Ucayali se trasladó a la zona a fin de hacer una evaluación en las comunidades afectadas y emitir un informe técnico sobre los daños en la infraestructura del sector.

El Indeci, a través del Centro de Operaciones de Emergencia Nacional (COEN), monitorea las 24 horas la evolución de esta emergencia y exhorta a las autoridades locales a mantener en alerta permanente sus centros de operaciones regionales y locales.



","Tue, 02 Mar 2021 08:00:00 GMT",https://portal.andina.pe/EDPfotografia3/Thumbnail/2021/03/02/000753854W.jpg,"['136', 'operaciones', 'viviendas', 'el', 'locales', 'loreto', 'en', 'del', 'cultivo', 'las', 'la', 'y', '1294', 'colegios', 'emergencia', 'hectáreas', 'que', 'inundación']", 
13,13,FL-2021-000019-PER,Junín: lluvia intensa activa quebrada y provoca inundación de calles y casas en La Merced - Agencia Andina,https://andina.pe/agencia/noticia-junin-lluvia-intensa-activa-quebrada-y-provoca-inundacion-calles-y-casas-la-merced-834719.aspx,"Gran cantidad de agua, lodo y piedras se desplazó por diferentes calles de la ciudad de La Merced, provocando inicialmente la inundación del parque Bolognesi y numerosas viviendas. , provocando inicialmente la inundación del parque Bolognesi y numerosas viviendas.





El precario sistema de desagüe y alcantarillado pluvial de la urbe colapsó, y por tanto decenas de familias se vieron afectadas y solicitaron apoyo de los bomberos y defensa civil.





También, tras la intensa precipitación pluvial, los ríos Garú y Bellavista incrementaron su caudal peligrosamente y provocaron el bloqueo de la carretera marginal.









Los propios afectados trabajaron en la limpieza de los escombros; en tanto, maquinaria de las municipalidades de Chanchamayo y Perené se trasladaron a los lugares más afectados para realizar labores de limpieza.





Más en Andina:

Emergencia en Madre de Dios: diez colegios albergan a damnificados por inundaciones ?? https://t.co/3pzGleJL2x



?? Un total de 626 personas reciben atención en estos locales escolares, destaca el @MineduPeru. pic.twitter.com/8QsF9uyXQj — Agencia Andina (@Agencia_Andina) February 22, 2021





(FIN) PTM/MAO","Mon, 22 Feb 2021 08:00:00 GMT",https://portal.andina.pe/EDPfotografia3/Thumbnail/2021/02/22/000751558W.jpg,"['por', 'merced', 'lluvia', 'en', 'se', 'parque', 'provoca', 'la', 'pluvial', 'y', 'los', 'intensa', 'junín', 'quebrada', 'tanto', 'inundación', 'provocando']", 
14,14,FL-2021-000019-PER,Lluvias intensas causaron inundación de 31 viviendas en San Martín - Agencia Andina,https://andina.pe/agencia/noticia-lluvias-intensas-causaron-inundacion-31-viviendas-san-martin-834927.aspx,"No se han reportado daños a la vida ni la salud de las personas por las precipitaciones pluviales, informó el Indeci.

Las oficinas de Gestión del Riesgo de Desastres de ambas municipalidades distritales se encuentran haciendo la evaluación de daños y análisis de necesidades (Edan), precisando que se dañó la comisaría de Campanilla y no se reportan daños a la vida y salud de las personas.









Ante esta situación, personal de los municipios distritales, junto a pobladores, trabajan en la limpieza y drenaje de las aguas de las viviendas, con apoyo de herramientas manuales. Las personas perjudicadas permanecen en sus predios.





También lea:





En tanto, el Centro de Operaciones de Emergencia Sectorial del Ministerio del Interior dio a conocer que efectivos de la comisaría de Campanilla culminaron la limpieza de la instalación policial afectada.





Más en Andina:

Proyecto palto, ejecutado por el Gobierno Regional Huánuco beneficia a 835 productores organizados de 32 comunidades https://t.co/WEjb6b6hMb pic.twitter.com/d6hj7OxYSF — Agencia Andina (@Agencia_Andina) February 23, 2021

(FIN) TMC/JOT

GRM

Loading...

Las lluvias intensas originaron inundaciones que afectaron la infraestructura de 31 viviendas y un local público en los distritos San Pablo, provincia Bellavista, y Campanilla, provincia Mariscal Cáceres, región San Martín, informó hoy el Instituto Nacional de Defensa Civil (Indeci).Publicado: 23/2/2021","Tue, 23 Feb 2021 08:00:00 GMT",https://portal.andina.pe/EDPfotografia3/Thumbnail/2021/02/23/000751934W.jpg,"['viviendas', 'intensas', 'el', 'causaron', 'en', 'lluvias', 'san', 'martín', 'se', 'del', 'las', 'la', 'y', 'campanilla', 'daños', '31', 'que', 'inundación']", 
