,ID,event_id,article_title,article_link,article_content,publishing_date,article_image,article_keywords,article_relevance
29,29,FL-2012-000075-VEN,EPN pondrá en operación naviera de bandera nica - El Nuevo Diario,https://www.elnuevodiario.com.ni/nacionales/258266-epn-pondra-operacion-naviera-bandera-nica/,"En un período no mayor a tres meses, la Empresa Portuaria Nacional, EPN, pretende tener lista una embarcación que formará parte de su primera línea naviera de bandera nicaragüense, informó el presidente de dicha institución, Virgilio Silva, durante una gira por el municipio de San Jorge, Rivas.

Exportadores tradicionales consideraron que materializar esta idea sería un gran logro para el país, ya que ahorraría “tiempo y costo” a los usuarios de este servicio.

Carne de ganado bovino, ganado en pie, leche y quesos, tabaco y café, son algunos de los productos que Nicaragua exporta hacia el mercado venezolano y que podrían salir por esta nueva línea naviera.

El funcionario de la EPN agregó que la embarcación tendrá capacidad para transportar 3,500 toneladas y servirá para exportar e importar productos entre Nicaragua y los países miembros de la Alianza Bolivariana para los Pueblos de Nuestra América, Alba.

Silva manifestó que actualmente la embarcación está en reparación y que el trabajo se hace con fondos propios de la EPN por un monto de 1.5 millones de dólares.

El presidente ejecutivo de la EPN señaló que las obras de reparación del buque se hacen en tiempo récord para inaugurarlo en el tiempo previsto y luego surcar las aguas del Mar Caribe, para sacar y traer los productos de exportación e importación entre Nicaragua, Venezuela, Cuba y otros países miembros del Alba”.

Exportadores ven ventajas

Aunque los exportadores del país tienen poca información al respecto, consideran positiva la noticia, para mejorar la entrada y salida de mercancías.

Diego Vargas, de la Comisión Nacional de Raíces y Tubérculos, de la Asociación de Productores y Exportadores de Nicaragua, dijo que el hecho de que el Estado, a través de la EPN, tenga su propia línea naviera, ayudará a optimizar costos.

“Es la primera noticia que tengo, pero cuando hay ahorros en los costos directos del producto a exportar, claro que hay ahorro. Eso tendría algún beneficio directo en el costo del transporte, que sería más barato, dijo brevemente Vargas.

Por su parte el presidente de la misma asociación, Roberto Argüello, señaló que al país le hace falta una línea naviera, lo que actualmente es una limitante para dinamizar el comercio marítimo de las exportaciones e importaciones con Venezuela, por ejemplo.

“Ahorraría costos y tiempo, porque los barcos que tocan puerto nicaragüense tardan una semana más en llegar a puerto venezolano; es más costoso y más tiempo. Sería una oportunidad para el comercio y permitiría aumentar las exportaciones. Sería de mucho beneficio”, comentó Argüello.

Agregó que quizá en un futuro esa línea naviera de la EPN le sirva a él, pues actualmente solo tiene relaciones comerciales con Puerto Rico y Estados Unidos.

El año pasado, cuando el presidente ejecutivo de la EPN dio a conocer los primeros detalles de la nueva naviera, aseguró que un año después de poner en operación el primer barco, se pondrá a funcionar un segundo navío.

Dinero quedará en manos nicas

René Blandón, presidente de la Comisión Nacional Ganadera de Nicaragua, Conagan, consideró que este proyecto, aunque no cree que sea sinónimo de ahorrar costos, espera que llegue a materializarse, pero habría que contar con un buen número de contenedores para optimizar el trabajo de la línea naviera.

La ventaja es que el dinero quedará en empresas nicaragüenses y es una más de las empresas del Alba, posiblemente. A lo mejor cobran más barato, manifestó Blandón.

No obstante, el presidente de Conagan señaló que para las exportaciones de carne hacia Venezuela, la misma empresa Alba Alimentos de Nicaragua S.A., Albalinisa, se encarga de poner los contenedores en la puerta de las plantas, por lo que ellos solamente colaboran en asuntos de logística.

El presidente de la Federación de Asociaciones Ganaderas de Nicaragua, Faganic, Solón Guerrero, dijo desconocer la información sobre la nueva naviera, pero señaló que primero se debe conocer la forma de operación, para valorar si esta línea de barcos tendrá o no ventajas.

En el pasado Nicaragua tuvo una naviera de bandera nacional, la Mamenic Line, que era propiedad de la familia Somoza. Después del triunfo de la Revolución pasó a ser la Naviera Nicaragüense, y fue declarada en quiebra tras la derrota electoral del primer gobierno de Ortega.","Thu, 19 Jul 2012 07:00:00 GMT",https://assets.cdnelnuevodiario.com/legacy/1342669280_Puerto%20Corinto%201.jpg,"['el', 'bandera', 'pondrá', 'en', 'del', 'epn', 'nica', 'naviera', 'nicaragua', 'operación', 'la', 'para', 'y', 'una', 'los', 'que']", 
30,30,FL-2012-000075-VEN,Cosep propone diálogo a ganaderos y mataderos - El Nuevo Diario,https://www.elnuevodiario.com.ni/nacionales/252281-cosep-propone-dialogo-ganaderos-mataderos/,"El Consejo Superior de la Empresa Privada, Cosep, propuso ayer servir de mediador en una mesa de diálogo entre industriales de la carne y los ganaderos, para resolver el tema del precio por res, que según este último sector debería mejorarse.

Los ganaderos exigen a la industria cárnica mantener estable el precio de C$70 por kilo en canal caliente y no disminuirlo, como lo ha hecho saber la Cámara Nicaragüense de Plantas Exportadoras de Carne Bovina, Canicarne.

El presidente del Cosep, José Adán Aguerri, señaló que la Federación de Asociaciones Ganaderas de Nicaragua, Faganic, y la Comisión Nacional Ganadera, Conagan, confirmaron su disposición de asistir a este diálogo, pero aún falta que confirme su participación Canicarne, gremio que aglutina a los mataderos del país.

No obstante, Solón Guerrero, Presidente de Faganic, y Salvador Castillo, Vicepresidente de la misma organización, señalaron no estar enterados de dicha reunión, pero dejaron claro que están en la mejor disposición de negociar con la industria.

Guerrero, por su parte, agregó que también están dando tiempo al Ministro Agropecuario y Forestal, Ariel Bucardo, a quien le han solicitado servir de garante, pero recordó que, mientras tanto, el tiempo se agota, y esto es un indicativo de que los ganaderos afiliados a Faganic empezarán a retener el ganado a los mataderos, como medida de presión, agudizando aún más problema.

Upanic participará

Según el presidente del Cosep, José Adán Aguerri, la Unión de Productores Agropecuarios de Nicaragua, Upanic, también se ofreció a mediar en el conflicto, según lo expresó el presidente de dicha organización, Manuel Álvarez.

“Lo que es evidente es que hay una preocupación de los productores en cuanto al precio, y del sector de los mataderos, en que no puede seguirse ofreciendo los precios que estaban hace mes y medio. Lo que tenemos que buscar es ese acercamiento entre los dos sectores, de tal forma que se encuentre una solución en la que ninguno de los dos salga como el sector perdedor”, señaló Aguerri.

Otro tema

El presidente del Cosep adelantó que en esta reunión también será tema de agenda el precio de la carne que paga Venezuela a Nicaragua.

Manifestó que el mercado venezolano mantiene congelado el precio de este producto que compra a Nicaragua desde hace tres años.

“El precio de la tonelada métrica de carne que se envía a Venezuela ha estado inamovible desde hace tres años, en US$4,400. El sector ganadero nos está diciendo que Venezuela este año ha estado comprando a otros países, no a Nicaragua, por encima, muy por encima de los US$4,400 la tonelada métrica. Ha habido precios que llegan a entre US$5,500 y US$5,800 la tonelada métrica”, aseguró Aguerri.

Conagan pide pláticas

Mientras tanto, el presidente de la Comisión Nacional Ganadera, Conagan, René Blandón, indicó que es necesario que las partes se arreglen para enfocarse en abordar otros temas de interés, para no poner en riesgo la sostenibilidad del sector ganadero del país y de la misma industria.

“En Estados Unidos, las bodegas --de carne-- están llenas, las plantas industriales no han podido posicionar contratos a futuro, han vendido lo que tenían con anticipación, buscamos que no se baje el precio más, y queremos una salida para ambos sectores”, señaló Blandón.

Advirtió que urge buscar mecanismos para proteger los mercados a los cuales Nicaragua exporta carne de res, que cada día ponen más trabas.

Señaló, además, que tanto la industria como los ganaderos enfrentan amenazas en los mercados hacia donde exportan, como por ejemplo Honduras y Estados Unidos, que han endurecido los requisitos a las exportaciones del ganado y de la carne nicaragüense.

“En Honduras están exigiendo que enviemos ganado con menos porcentaje de ivermectina --sustancia utilizada para el control de los parásitos externos del ganado bovino--, y en Estados Unidos, en vez de hacer un examen de E. coli, ahora serán entre cuatro y seis exámenes. Eso puede afectar a las plantas industriales, al país y a los ganaderos”, advirtió Blandón.

El presidente de Conagan agregó que ha sostenido conversaciones con el presidente de Faganic, Solón Guerrero, quien reconoció que el precio que hoy pagan los mataderos a los productores, sigue siendo un buen precio, pero que el problema es la tendencia hacia la baja.

Recordó que la industria ha venido invirtiendo un promedio de US$100,000 anuales en la compra de maquinarias, por lo que no es conveniente que la crisis se postergue ni para los ganaderos ni para los mataderos.","Thu, 24 May 2012 07:00:00 GMT",https://assets.cdnelnuevodiario.com/legacy/1337832941_Jose%20Adan%20Aguerri%20del%20cosep%20%201.jpg,"['precio', 'presidente', 'el', 'diálogo', 'propone', 'cosep', 'en', 'mataderos', 'del', 'para', 'la', 'y', 'ganaderos', 'los', 'que']", 
31,31,FL-2012-000075-VEN,"Stephen King, ¿un predicador cristiano detrás de sus historias de terror? - CNN México.com",https://cnnespanol.cnn.com/2012/06/09/stephen-king-un-predicador-cristiano-detras-de-sus-historias-de-terror/,"(CNN) — Cuando al novelista de horror Stephen King se le preguntó alguna vez por qué escribía semejantes historias tan grotescas, dijo que lo hacía porque tenía el corazón de un niño… guardado en un frasco sobre su escritorio.

Con ojos somnolientos y esa mueca de “acabo de matar al gato”, King se ve y se escucha como un novelista de horror. Pero cuando el reverendo Paul F.M. Zahl leyó varias de sus novelas descubrió algo nuevo sobre el autor: detrás del terror hay mucha fe.

Zahl dice que muchas de las afirmaciones inspiradoras de la fe cristiana se pueden encontrar en los relatos de King. El maestro del horror ha estado predicando sermones a millones de lectores a través de los años, aunque muchos de los seguidores de King no lo sepan, dice.

“La gente generalmente se inclina a pensar que Stephen King es antirreligioso porque escribe novelas de horror, pero ese un concepto totalmente erróneo”, dice Zahl, un sacerdote episcopal retirado quien ha escrito sobre la sensibilidad religiosa de King en la revista Christianity Today. «Muchos de sus libros son parábolas de la gracia en acción».

¿Desea leer una meditación poderosa sobre el amor sacrificado de Jesús? Revise como King ligó la muerte del prisionero encarcelado en el pasillo de la muerte, el gigante John Coffey cuyas iniciales son “J.C.”, con la crucifixión de Jesús en la novela El Pasillo de la Muerte. La obre de King llamada La Tormenta del Siglo es un relato espeluznante sobre el misterioso encuentro de Jesús con el demonio llamado “Legión” según el quinto capítulo del evangelio según San Marcos. Y la novela épica apocalíptica de King, Apocalipsis, la cual se lee como un relato contemporáneo del Libro de las Revelaciones combinado con un poco del Éxodo, según dice Zahl.

Zahl dice que la fe de King puede sonar ridícula. King, quien acaba de publicar su más reciente novela The Wind Through the Keyhole, ha escrito al menos 50 novelas de horror tales como Carrie y Misery.

publicidad

Sin embargo, se cuenta con un verdadero grupo literario que se dedica realmente a estudiar la sensibilidad religiosa de King. Varios pastores y autores dicen que King despliega un sofisticado enfoque de teología en sus libros y sus historias están abarrotadas de referencias bíblicas y líneas que fueron sacadas directamente de la biblia.

“Si Dios interpusiera demandas, Stephen King se enfretaría a una demanda por plagio”, dice J.M. Rawbone, un novelista inglés del género de horror que escribió un ensayo sobre los temas cristianos presentes en Apocalipsis.

King, cuyo publicista no contestó nada a una invitación hecha para llevar a cabo una entrevista, ha hablado anteriormente sobre su fe. Él mismo se describe como un cristiano en su sitio web y en otras publicaciones se ha dicho que fue criado como un puro y duro metodista al que se le enseñó a creer en el anticristo.

Algunas de sus influencias literarias son los autores cristianos. En una entrevista, King dijo que fue formado por C.S. Lewis, autor de Las Crónicas de Narnia, y por J.R.R. Tolkien, autor de El Señor de los Anillos. Tanto Lewis como Tolkien eran cristianos devotos que mezclaron la ficción con temas religiosos.

“Siempre quise contrastar la brillante y blanca luz de la verdadera bondad y piedad contra el mal”, dijo en una entrevista de 1988. “No soy un proselitista, y odio la religión organizada. Creo que es una de las raíces del verdadero mal en el mundo. Si realmente desenmascaras a satanás, probablemente encontrarás que lleve puesto un collar de clérigo”.

Sin embargo, la mejor manera de comprender la fe de King no es a través de sus palabras, si no a través de sus historias. Al menos hay tres temas bíblicos presentes en ellas.

Un niño será su guía

Cada escritor del género de horror parece que eventualmente escribirá sobre vampiros, y King no es la excepción. El misterio de Salem’s Lot es una de las novelas más populares de King. Trata sobre el intento de un vampiro de colonizar una ciudad de Nueva Inglaterra de hoy en día.

Las historias sobre vampiros tradicionalmente están llenas de simbolismos cristianos, pero King agrega otro tema bíblico a El misterio de Salem’s Lot, el cual estará presente en muchos de sus libros.

Se presenta una escena que muestra a un cura y a un vampiro paralizados uno frente al otro. El padre Callahan intenta proteger a un joven adolescente al blandir un crucifijo. El vampiro reta al cura a lanzar el crucifijo a un lado y enfrentarlo con tan sólo su fe.

El padre Callahan duda ya que su fe se ha visto diezmada por el alcoholismo y el escepticismo. El vampiro le arrebata el crucifijo de las manos al cura mientras que el joven escapa y se convierte en uno de los más ávidos enemigos del vampiro.

Cuando el reverendo David Squyres lee este pasaje de El misterio de Salem’s Lot, uno de los dichos más representativos de Jesús se aparece ante él: “… a menos que cambies y te conviertas en un niño pequeño, nunca podrás entrar al reino de los cielos”.

En el moral universo de King, los niños entienden mejor a Dios que los adultos, dice Squyres.

“El vampiro humilla al cura ya que el cura no posee verdadera fe, pero el chico si tiene realmente fe”, dice Squyres, pastor de la iglesia bautista de las Palmas, cerca de Palm Springs, California.

“El cura representa a los fariseos, que creen en las reliquias. Pero los niños y los adolescentes simplemente tienen fe. Ellos no basan su fe en instituciones. Ellos creen en el Señor”, dice Squyres, quien ha escrito sobre la sensibilidad cristiana de King en su sitio web: «talkstephenking».

Muchas de las novelas más populares de Stephen King cuentan con jóvenes heroínas motivadas solamente por la fe. Es el reflejo de un famoso pasaje del Libro de Isaías del Viejo Testamento: “y un pequeño será quien los dirija”.

En El Talismán y Eso, King muestra a héroes adolescentes quienes arriesgan sus vidas combatiendo al mal, de acuerdo a lo que dice Marylaine Block, quien escribió sobre la sensibilidad religiosa que posee King en un ensayo llamado “Algo perverso se dirige hacia acá”.

“En ambas novelas, los adultos son incapaces de entender la magnitud del mal que está a punto de envolver su mundo y destruirlo. Ellos ven las señales, pero eligen no entenderlas. Sólo los niños saben lo que está pasando y saben que depende de ellos el salvar a las personas que quieren”, escribió.

Dios puede ser cruel

La novela cristiana más explícita escrita por King es Desesperación, la cual muestra a otro héroe adolescente movido por la fe. El chico, David, se transforma por un milagro y le reza a Dios por ayuda. King representa la fe sin ironías y con reverencias.

Aunque varios pastores dicen que Desesperación cuenta con una inusual descripción de Dios que revela una importante carga teológica que se le adjudica a King. Durante el sangriento clímax de la historia, un personaje le dice al niño que “Dios es cruel”.

Esa línea llamó la atención de Kahl, el sacerdote episcopal. Se refiere a lo que él llama “la soberanía a la que Dios responde”.

Zahl dice que King representa un lado de Dios que esta entretejido en la biblia. Es un Dios cuyos ojos no están posados sobre el gorrión, si no sobre aquel otro ser divino, incomprensible, aquel que permitió que Job sufriera.

Es el mismo lado de Dios que el narrador de El Pasillo de la Muerte describe cuando recuerda la muerte del inocente John Coffey, la figura que encarna a Jesús y que jamás lastimó a nadie, pero que pereció mientras que un guardia villano continúo con vida.

Zahl subraya este pasaje de El Pasillo de la Muerte:

“Y este mismo Dios sacrificó a John Coffey, quien solo intentó hacer el bien a ciegas, tan salvajemente como un profeta del Viejo Testamento alguna vez sacrificó a un indefenso cordero.. Si sucede significa que Dios deja que suceda, y cuando decimos “no entiendo”, Dios nos responde: “No me importa”.

Zahl dice que King puede decir cosas sobre Dios en sus libros que los pastores no pueden decir en el púlpito. En las novelas de King las personas sufren mientras buscan hacer el bien.

“Los estadounidenses generalmente quieren oír que todo es terrible todo el tiempo”, dice Zahl. “Quieren controlar y manejarlo todo, y están ansiosos por todo aquello que los motive. Cuando predicas un mensaje de la biblia en donde dice que la vida es mucho más difícil y viene con una gran carga de sufrimiento, generalmente esos mensajes no son bien recibidos”.

Dios eligió lo débil

Cuando era adolescente King solía coleccionar libros de recortes que llenaba de notas del periódico que tratarán sobre los crímenes de asesinos seriales, dice Stanley Wiater, autor de El Universo Completo de Stephen King: Una Guía al mundo de Stephen King.

La madre de King desarrolló una preocupación creciente y un día le preguntó por qué conservaba el libro de recortes.

Wiater dice que King respondió: “creo que el mal existe allá afuera; quiero saber qué es, así cuando se presente lo podré reconocer y me quitaré de su camino”.

En los libros de King los personajes no pueden evadir al mal. Deberán confrontarlo y usualmente no van con la descripción de héroes convencionales.

La danza de la Muerte es otra novela que muestra el cristianismo explícitamente, ilustra este patrón. Una plaga ha arrasado con la raza humana, y un grupo de sobrevivientes sin armas son enviados a través de una visión de Dios a confrontar a una satánica figura llamada Darkman.

El grupo aparenta no tener posibilidades. Uno es un genial profesor, ya viejo, otro es un sordo mudo, y un tercero es un genial hombre con la capacidad mental de un niño. En su contra está el despiadado ejército de Darkman, los cuales literalmente crucifican a sus enemigos.

La apariencia del grupo representa otro popular tema religioso dentro de la obra de King, y que se refleja en esta línea del apóstol San Pablo del primer libro a los corintios: “Dios elige a los débies del mundo para humillar a los fuertes”.

El cura episcopal Zahl dice que muchos de los personajes de los libros de King son personajes “rotos”: físicamente frágiles, alcohólicos, discapacitados y solitarios. Incluso los villanos se rinden por compasión.

“King tiene una profunda compresión de la gracia”, dice Zhal, quien escribió La Gracia en Práctica. “Típicamente la concentra en los marginados y los fuereños quienes al final salvan el día. Dios frecuentemente obra donde las personas están en más mal estado”.

King pudo haber convertido a Zahal, pero el cura, así como otros, admite del riesgo de invitar al novelista a un púlpito.

Cuando Zahl hace mención de King en la iglesia dice que muchos piensan primero en los libros que desean mantener fuera del alcance de sus hijos adolescentes.

Aun así, hay quienes se convierten en secreto.

“La otra mitad de la congregación han leído a Stephen King, aunque puede que no deseen publicarlo a los cuatro vientos”, dice. “Ellos saben a qué me refiero. Después pasan y me dicen que están realmente emocionados que yo sepa de él”.

Los que dudan no deberían sorprenderse que las historias de King contengan temas religiosos, dice Rawbone, novelista inglés del género de horror y autor de Bunker.

La biblia está llena de terror: demonios, fantasmas, inundaciones que acaban con la humanidad y el despertar de los muertos.

“El horror bueno examina la lucha entre el bien y el mal”, dice. “La biblia es la historia de esa lucha”.

“La biblia es en muchas formas la novela de horror por excelencia”.","Sat, 09 Jun 2012 07:00:00 GMT",https://cnnespanol.cnn.com/wp-content/uploads/2017/05/cnne-logo-video-bg.png,"['dice', 'terror', 'cristiano', 'el', 'stephen', 'historias', 'en', 'del', 'predicador', 'se', 'king', 'detrás', 'la', 'y', 'los', 'sus', 'que']", 
