,ID,event_id,article_title,article_link,article_content,publishing_date,article_image,article_keywords,article_relevance
0,0,FL-2012-000075-VEN,"Calores o fríos extremos, inundaciones y sequías: ¿Qué está provocando esto? - CNN México.com",https://cnnespanol.cnn.com/2012/07/11/calores-o-frios-extremos-inundaciones-y-sequias-que-esta-provocando-esto/,"(CNN) — Un mapa de los eventos climáticos más importantes para Estados Unidos en junio se veía casi apocalíptico: el calor infernal, los incendios feroces y fuertes tormentas causan heridos, muertos y personas sin hogar.

Eso fue lo que siguió a un invierno cálido y las sequías de principio de temporada. Las noticias indican que el territorio continental de Estados Unidos experimentó sus más cálidos 12 meses desde que se iniciaron los registros en 1895.

La Administración Nacional Oceánica y Atmosférica (NOAA, por sus siglas en inglés) publicó el martes un informe en el que consideró que 2011 fue un año de clima extremo.

¿Recuerdas el huracán Irene? ¿O las inundaciones en Tailandia y el sur de China y la sequía mortal en el Cuerno de África? Las fuertes lluvias causaron deslizamientos masivos de tierra en Brasil, y gran parte de Europa sufrió una ola de calor sofocante el año pasado.

Es tentador simplificar las cosas y echarle toda la culpa al calentamiento global. Después de todo, nueve de los 10 años más calurosos a nivel mundial se han producido desde 2000, según la NOAA.

Pero el clima puede ser complicado.

El verdadero desafío es averiguar si una tormenta en particular o una inundación se debió al cambio climático o a las variables naturales, explica Chris Field, director fundador del Departamento de Ecología Global del Instituto Carnegie.

El informe de la NOAA, por ejemplo, tomó nota de algunos acontecimientos que se agravaron por otros factores. Sin embargo, el cambio climático aumentó los riesgos globales, admitió Field.

«A medida que cambia el clima, estamos cambiando las probabilidades de condiciones meteorológicas extremas», agregó. Es algo así como elevar las probabilidades de un accidente de coche cuando se está acelerando.

Las cuatro clases de fenómenos extremos —calor elevado, lluvias intensas e inundaciones, la duración y la intensidad de las sequías, y niveles del mar más altos— han cambiado en los últimos 50 años, explicó Field.

«Cada vez más estamos cargando los dados a este tipo de extremos muy dañinos», advirtió.

Pero eso no quiere decir que cada evento climático se relaciona con el aumento de las temperaturas.

El sur de Groenlandia, el norte de Rusia y el este de dos terceras partes de Norte América han sentido mayor calor en 2012, pero muchos lugares, Alaska, Mongolia y la mayor parte de Australia han tenido fríos anormales.

Si viste la final del tenis en Wimbledon, sabes que el encuentro entre Roger Federer y Andy Murray fue la primera final varonil que ha sido suspendida por la lluvia. Ha habido más frío y humedad de lo normal en los últimos meses en las islas británicas.

El noroeste de Estados Unidos también ha escapado del calor. El estado de Washington acaba de marcar su séptimo junio más frío.

«Cuando tienes un planeta que está más cercano a los niveles más cálidos, en los registros no significa que en todas las partes del mundo va a ser caluroso», dijo Jeff Masters, director de meteorología de Weather Underground.

«Estados Unidos ha tenido la mala suerte de estar en ese tipo de patrón», dijo.

Jake Crouch, un científico del clima en el Centro Nacional de Información Climática de Estados Unidos, dijo que los patrones del clima —incluyendo la corriente en chorro o los sistemas océano-atmosféricos en el Pacífico conocidos como El niño y La niña— tienen un gran efecto sobre el clima.

En 2011, dos episodios de La niña, cada uno caracterizado por temperaturas más frías que el promedio de agua en el Pacífico oriental, afectaron significativamente a los eventos climáticos, incluyendo sequías en el sur de los Estados Unidos y el norte de México, así como el este de África.

Existe un debate sobre cómo el cambio climático afecta los patrones de este tipo, pero el último reporte del clima del NOAA indicó que las olas de calor de La niña son ahora 20 veces más probables de ocurrir que hace 50 años.

Los científicos también analizaron el noviembre más cálido en Gran Bretaña en 2011, y el frío diciembre de 2010. Dijeron que diciembres fríos son ahora 50% más probabilidades de ocurrir en la actualidad en comparación con hace 50 años; mientras que los noviembres cálidos son ahora 62 veces más probables.

El informe también señala que algunos fenómenos meteorológicos, como las inundaciones de Tailandia, son influenciados por seres humanos a través de otros medios.

«A pesar de las inundaciones sin precedentes, la cantidad de lluvia que cayó en el área de ‘influencia’ en el río no era muy inusual», según el informe sobre Tailandia. «Otros factores, tales como cambios en las políticas de reservas y el aumentó en la construcción en la planicie de inundación, fueron más relevantes para la escala del desastre».

La temporada de huracanes de este 2012 ha tenido un comienzo fuerte, aunque el meteorólogo Thomas Downs de Investigaciones de Expertos sobre el Clima lo atribuyó a un calentamiento cíclico de las aguas del Atlántico.

«Hemos tenido un comienzo tremendo para el sistema. Estamos en medio de una fase de calentamiento», dijo. Las aguas más cálidas también pueden dar lugar a temperaturas más cálidas en la tierra, dijo Downs. Así puede extenderse la sequía.

Eso significa que los agricultores están sufriendo las consecuencias, por ejemplo en Estados Unidos, y los consumidores podrían estar pagando mucho más en la tienda por el maíz, soja y trigo y carne de animales criados con alimentos de maíz.

También tendrán que pagar más a las empresas de servicios públicos por el funcionamiento de aparatos de aire acondicionado en el verano. «En julio, agosto y septiembre, hay una probabilidad superior a la media de la más caliente que las temperaturas promedio», dijo Crouch.

Tal vez la gente debe acostumbrarse a temperaturas más altas. Las tendencias apuntan de esa manera, pues una ola de calor que se produce cada 20 años para el año 2080 ocurrirá cada uno o dos años, explicó Fields.

El clima extremo que el mundo está viendo ahora es un precursor más, dijo. «Hay un montón de pasos que pueden tomarse para preparar a las personas a los extremos climáticos», destacó. «Es una especie de situación que amerita una reflexión muy seria».","Wed, 11 Jul 2012 07:00:00 GMT",https://cnnespanol.cnn.com/wp-content/uploads/2017/05/cnne-logo-video-bg.png,"['del', 'está', 'la', 'inundaciones', 'por', 'los', 'esto', 'en', 'extremos', 'fríos', 'más', 'y', 'calores', 'qué', 'que', 'provocando', 'sequías', 'el', 'las']", 
1,1,FL-2012-000075-VEN,Lluvias torrenciales causan inundaciones y daños en el noroeste de Florida - CNN México.com,https://cnnespanol.cnn.com/2012/06/10/lluvias-torrenciales-causan-inundaciones-y-danos-en-el-noreste-de-florida/,"Coches intentan transitar en medio de las vías inundadas el domingo en el condado de Escambia, Florida.

Por Kara Devlin, CNN

(CNN) – Partes del noroeste de Florida, conocido como Panhandle, quedaron bajo el agua el domingo, tras una serie de lluvias torrenciales que causaron no sólo grandes inundaciones sino el daño de vías y edificios, según dijeron las autoridades locales.

Más de 50 centímetros de lluvia cayeron en las últimas 24 horas en lugares del condado Escambia, le dijo a CNN John Dosh, director de manejo de emergencias de ese condado.

La precipitación desencadenó varios problemas, con inundaciones especialmente grandes en la parte del sur del condado en la costa del Golfo de México, dijo Dosh.

Alrededor de 113 personas están en refugios debido a la tormenta, y los residentes de complejos de apartamentos de baja altura fueron ordenados a evacuar, dijo el funcionario. Pero no ha habido reportes de víctimas mortales ni heridos.

Adicionalmente, varias vías y puentes, así como numerosas casas y negocios, han sufrido daños, dijo Dosh.

publicidad

Una de las estructuras afectadas es la cárcel del condado de Escambia en Pensacola. El centro de registro del penitenciario, en donde ingresan los presos, quedó bajo 1.8 metros de agua a mediodía del sábado, según dijo Mike Ward, vocero de la oficina del sheriff del condado.

La parte principal de la cárcel, en el que están recluidos 697 presos, quedó sin electricidad durante la tormenta, dijo Ward. Pero ya se ha suministrado servicio eléctrico temporal y siguen los esfuerzos para restablecer el aire acondicionado. El vocero sigo que la seguridad en la cárcel nunca quedó comprometida.

Pero aún no terminan los problemas, en tanto puede que la lluvia no ceda pronto.

EL Servicio Meteorológico Nacional de Estados Unidos emitió una alerta de inundación para las 6 p.m. del domingo en los condados de Escambia y Santa Rosa, señalando una alta probabilidad de “inundaciones de zonas de baja altura y de pobre drenaje”.

El pronóstico en Pensacola, por ejemplo, muestra probabilidad de lluvias y posibles tormentas eléctricas a lo largo de la noche del sábado y en la mañana del lunes.

Una advertencia menos severa estará en efecto en la mañana del lunes para partes del suroeste de Alabama, el noroeste de Florida y el sureste de Misisipi, en donde se espera la caída de 7 a 15 centímetros de lluvia.

También hay “alto riesgo de fuertes corrientes” a las 7 p.m. del domingo en el mar frente a las playas de Alabama y Florida, reportó el servicio meteorológico.","Sun, 10 Jun 2012 07:00:00 GMT",https://cnnespanol.cnn.com/wp-content/uploads/2017/05/cnne-logo-video-bg.png,"['inundaciones', 'el', 'florida', 'en', 'lluvias', 'del', 'noroeste', 'las', 'la', 'y', 'dijo', 'daños', 'torrenciales', 'los', 'causan', 'escambia', 'que']", 
2,2,FL-2012-000075-VEN,Decenas de muertos por las inundaciones en Rusia - CNN México.com,https://cnnespanol.cnn.com/2012/07/07/decenas-de-muertos-por-las-inundaciones-en-rusia/,"Moscú (CNN) — Por lo menos 105 personas murieron por las inundaciones el la región de Krasnodar, en el sur de Rusia, informó este sábado el Ministerio de Emergencias.

Según el ministerio, 94 de las muertes ocurrieron en el distrito de Krymsk, nueve en Gelendzhik y dos en Novorossiisk, a orillas del Mar Negro.

El nivel del agua llegó a subir hasta siete metros de la noche a la mañana en Krymsk, según la agencia de noticias oficial Itar-Tass, mientras la gente todavía estaba durmiendo. Otros fueron rescatados por la policía después de refugiarse en tejados y árboles, agregó el informe.

También se han recuperado cadáveres en el distrito de Gelendzhik y en Novorossiisk, junto al Mar Negro, según el Ministerio de Emergencias.

(Con información de Arkady Irshenko)","Sat, 07 Jul 2012 07:00:00 GMT",https://cnnespanol.cnn.com/wp-content/uploads/2017/05/cnne-logo-video-bg.png,"['por', 'inundaciones', 'el', 'novorossiisk', 'en', 'las', 'según', 'la', 'mar', 'y', 'rusia', 'muertos', 'decenas', 'ministerio']", 
3,3,FL-2012-000075-VEN,Corea del Norte pide ayuda alimentaria para hacer frente a las inundaciones - El País.com (España),https://elpais.com/internacional/2012/08/03/actualidad/1344005740_059332.html,"La ciudad norcoreana de Anju, tras los tifones que han sacudido el país a finales de julio, que dejaron un centenar de muertos y decenas de miles de personas sin hogar. KCNA/EFE

Corea del Norte ha pedido ayuda de emergencia a la comunidad internacional para hacer frente a las lluvias torrenciales y las inundaciones que han castigado este verano al país, según ha asegurado la ONU. Pyongyang “ha solicitado que Naciones Unidas libere las existencias que tiene preparadas para casos de emergencia, incluidos comida y combustible”, después de que más de 100 personas fallecieran y 100.000 perdieran sus hogares, según ha informado la oficina del secretario general de la ONU, Ban Ki-moon. La petición se ha producido al mismo tiempo que el líder de Corea del Norte, Kim Jong-un, ha asegurado a un dirigente chino de visita en Pyongyang que su prioridad es reanimar la depauperada economía y mejorar las condiciones de vida de la población.

Responsables de la delegación de la ONU en el Norte han visitado las zonas más afectadas por las tormentas y han afirmado que hacen falta de forma urgente alimentos y un mejor acceso a agua limpia para evitar enfermedades. La situación ha agravado la falta de alimentos que sufre el país asiático, donde unos 16 millones de sus 24 millones de habitantes carecen de suficiente comida y sufren desnutrición.

Los desastres naturales castigan cada año a Corea del Norte, que experimenta desde hace décadas escasez crónica de alimentos, problemas en la gestión de la economía y el aislamiento por parte de la comunidad internacional, debido a su programa de armas nucleares. Se estima que hasta dos millones de personas han muerto de hambre en el país desde mediados de la década de 1990.

Naciones Unidas endureció las sanciones contra Pyongyang en respuesta al lanzamiento de un misil de largo alcance el pasado 13 de abril, que se estrelló al poco de despegar. El ensayo fallido dejó al país sin 240.000 toneladas de alimentos que le había prometido Estados Unidos a cambio de una moratoria en su programa de armas atómicas y de misiles. Corea del Sur ha asegurado que no piensa responder a la petición de ayuda del Norte. Los dos países vecinos siguen teóricamente en guerra, ya que el conflicto de Corea (1950-1953) concluyó con una tregua que nunca se convirtió en tratado de paz definitivo.

Kim Jong-un, que accedió al poder tras la muerte de su padre, Kim Jong-il, en diciembre del año pasado, ha tomado una serie de medidas, comenzando por el Ejército, para consolidar su poder e intentar mejorar la situación del país, uno de los más pobres del mundo. Y así se lo ha manifestado a una delegación china que ha viajado esta semana a Pyongyang, dirigida por Wang Jiarui, director del departamento internacional del Partido Comunista Chino. En un encuentro celebrado el jueves por la noche, Kim dijo a Wang que su objetivo es “desarrollar la economía y mejorar el nivel de vida de la gente para que el pueblo coreano lleve una vida feliz y civilizada”, según la agencia oficial china Xinhua.

Las declaraciones ante el enviado de Pekín son un signo de que el joven Kim puede estar planeando llevar a cabo reformas económicas profundas, lo que supondría un cambio crucial respecto a la política de su padre. Pekín ve con buenos ojos una apertura gradual de la economía norcoreana, ya que por un lado generaría oportunidades de negocio para sus empresas y, por otro, contribuiría a alejar el fantasma de inestabilidad social en el país vecino y de una huida masiva de refugiados hacia su territorio.

Ante las sanciones internacionales impuestas por sus programas nuclear y de misiles, Pyongyang se ha visto forzado a depender en gran medida de Pekín. Los dirigentes chinos han insistido con frecuencia a los norcoreanos que deben aprender las lecciones del proceso de transformación chino hacia una economía de mercado con características propias. Según algunos expertos, la visita de Wang puede ser interpretada como un apoyo del Gobierno chino a las futuras reformas norcoreanas. Pero para abrir su economía, Kim Jong-un tendrá que resolver su enfrentamiento con la comunidad internacional. Las negociaciones para el desmantelamiento de su programa de armamento nuclear están paralizadas. FIN","Fri, 03 Aug 2012 07:00:00 GMT",https://imagenes.elpais.com/resizer/wDajLKMOWnjxSZeN8g1tU1NnI80=/1200x0/arc-anglerfish-eu-central-1-prod-prisa.s3.amazonaws.com/public/7JGCPT5EKBR6WP2637H3VNS44Q.jpg,"['inundaciones', 'que', 'frente', 'el', 'norte', 'corea', 'ha', 'en', 'del', 'las', 'para', 'la', 'pide', 'y', 'una', 'su', 'hacer', 'ayuda']", 
4,4,FL-2012-000075-VEN,Letralia 269 | Noticias | Se inundó la biblioteca de la Legislatura de Buenos Aires - Letralia,https://letralia.com/269/0611biblioteca.htm,"Se inundó la biblioteca de la Legislatura de Buenos Aires

Unos 13 mil libros de la Biblioteca “Esteban Echeverría”, de la Legislatura de la capital argentina, quedaron dañados como consecuencia de una inundación en el edificio, causada por la rotura de un caño, y se calcula que algunos de los ejemplares se perderán por contacto con el agua, en tanto que otros podrían ser recuperados.

El accidente se registró a las 3:30 de la madrugada del pasado lunes 11 de junio, cuando personal de maestranza constató el ingreso del agua desde los techos de la biblioteca cuando se aprestaban a encender las calderas con las que se aclimata el edificio para cuando llegan los empleados.

Según fuentes parlamentarias, empezaron a escuchar ruidos que venían del lugar como consecuencia del desprendimiento de la mampostería por la filtración del agua, que, en principio, causó los daños en la biblioteca, pero también en oficinas de la planta baja y la Sala de Periodistas.

La salida del agua provenía de un caño del segundo piso del edificio, el cual se fisuró tras la explosión de un artefacto de calefacción que está ubicado dentro del despacho 210, que pertenece a la legisladora Lía Rueda, y que queda justo un piso por arriba de la biblioteca.

“Como balance, alrededor de 13 mil ejemplares, de los casi 35 mil, están afectados por el contacto con el agua. Algunos de ellos presentan daños irreversibles, otros probablemente puedan restaurarse mediante un plan de secado y reencuadernación”, explicó Cristian Ritondo, vicepresidente primero de la Legislatura, durante una reunión con jefes de bloques para analizar las secuelas de la inundación.

Asimismo, informó que “los libros que conforman el Tesoro de la Biblioteca, alrededor de unos 2.500, no fueron afectados por la catástrofe”, no obstante aclaró que “de todos modos y preventivamente se colocaron fundas de nylon en todas las estanterías de la sala que los contiene”.

La inundación también afectó una de las dos arañas de gran porte —con unas 100 velas de luz— y se registraron “enormes perjuicios a la madera que recubre paredes y conforma estanterías, pisos, aberturas y resto de mobiliario antiguo y vitrinas”.

Los ejemplares deteriorados fueron trasladados desde tempranas horas de la mañana a distintos sectores del edificio, y para ello se abrieron espacios que habitualmente están vedados al paso como la tribuna del recinto de sesiones, el balcón del Salón Dorado y hasta un área de la Torre del Reloj, en el quinto piso.

A la tarea de salvataje de los ejemplares se sumaron tres especialistas en recuperación de materiales dañados que trabajan en el Museo del Cabildo, Congreso de la Nación y Palais de Glace.

En tanto, la directora de la biblioteca, María Eugenia Villa, anunció que la restauración de los libros tomará por lo menos un mes, “pero la verdad es que esta época del año no ayuda para nada, por lo que nos puede demandar más tiempo”, indicó. “Hay 3 mil libros en terapia intensiva y algunos serán irrecuperables. Hay que prensarlos para llevarlos al tamaño y volumen que tenían originalmente”.

La Biblioteca Pública “Esteban Echeverría” cuenta con 32.000 ejemplares y tiene una orientación jurídico-legislativa, aunque también posee una importante bibliografía sobre la historia de la Ciudad de Buenos Aires.

Entre las colecciones compiladas en la Biblioteca se destacan la de la Legislación Antigua de los Reyes Godos de España, Las Leyes de Indias, Acuerdos del Extinguido Cabildo de Buenos Aires, Los Planos más Antiguos de Buenos Aires y el Álbum Fotográfico del Centenario de la Revolución de Mayo.

Desde el punto de vista arquitectónico, está concebida en estilo ecléctico, con un predominio de nogal italiano y roble que recubren las paredes de los dos pisos con que cuenta, donde se despliegan decenas de estanterías.

Fuentes: Clarín • Télam","Fri, 26 May 2017 15:20:14 GMT",https://letralia.com/269/biblioteca.jpg,"['por', 'el', 'en', 'se', 'del', 'buenos', 'biblioteca', 'las', 'la', 'y', 'legislatura', 'inundó', 'los', 'aires', 'que']", 
5,5,FL-2012-000075-VEN,Presidente Chávez: fabricamos los aviones no tripulados porque somos libres - Aporrea.org,https://www.aporrea.org/actualidad/n209303.html,,"Sat, 07 Jul 2012 07:00:00 GMT",,[], 
6,6,FL-2012-000075-VEN,Lluvia de críticas para estudiantes que no se querían mojar - Pueblo en Linea,http://spanish.people.com.cn/31614/7833895.html,"Lluvia de críticas para estudiantes que no se querían mojar

Actualizado a las 01/06/2012 - 16:19

Una limpiadora de la universidad las llevó en la espalda para ayudarles a cruzar una parte inundada del camino de entrada.

Palabras clave：inundación

Lluvia de críticas para estudiantes que no se querían mojar

Fuente：China Daily



Wuhan, 01/06/2012,(El Pueblo en Línea)- Una limpiadora de la universidad nunca se imaginó que el ayudar a jóvenes estudiantes a cruzar a través de una superficie inundada hasta los tobillos desataría una ola de reacciones negativas y sarcasmo hacia las muchachas.



Wu Xiuying (50), una trabajadora de limpieza en la Facultad de Medios y Comunicaciones de Wuhan, en la Universidad Normal de China Central, en la provincia de Hubei, llevó a algunas muchachas en su espalda, porque la lluvia había provocado una inundación de 10 centímetros delante del edificio de la institución.



El martes, un profesor subió a internet una serie de imágenes que muestran a una muchacha con un paraguas y libros en sus manos, mientras es llevada en la espalda de Wu.



El profesor elogió el corazón de Wu, pero la mayoría de los comentarios fueron negativos y criticaban a las estudiantes por ser demasiado débiles.



Wu no pudo ser contactada por el diario China Daily el jueves.



""Tengo tres hijos de su edad"", dijo Wu, según fue citada por el periódico Noticias Vespertinas de Wuhan.



""Cuando vi a algunas chicas paradas frente al agua y, posiblemente, llegarían tarde a clase, me ofrecí a ayudarles sin vacilar, como ayudaría a mis hijos. La próxima vez lo haría de nuevo.""



Cuando se enteró de que mucha gente culpó a las estudiantes, diciendo que eran egoístas y mimadas, Wu dijo: ""Fue mi decisión llevarlas en la espalda, y me dieron las gracias. Sólo quería ayudarlas, pero lo que hice ha traído problemas en su lugar. ¿Qué puedo hacer ahora? ""



Zhang Hui, un funcionario de la universidad, dijo que algunas estudiantes estaban tristes al enterarse de las críticas.



Muchos estudiantes varones también llevaron a sus compañeras de clase a través del agua el martes. Incluso Ma Shihao, de 61 años, profesor en la universidad, ayudó a varias estudiantes al salir del salón de clases a las 16:00.



""La gente está dispuesta a ayudar a quienes están en problemas, así que por favor entiendan sus corazones bondadosos, y muestren tolerancia a las estudiantes que recibieron su ayuda"", dijo Zhang.

","Fri, 01 Jun 2012 07:00:00 GMT",http://spanish.people.com.cn/mediafile/201206/01/F201206011559003064674181.jpg,"['su', 'estudiantes', 'el', 'lluvia', 'universidad', 'en', 'se', 'críticas', 'querían', 'las', 'para', 'la', 'y', 'una', 'mojar', 'que']", 
