,ID,event_id,article_title,article_link,article_content,publishing_date,article_image,article_keywords,article_relevance
18,18,FL-2018-000014-ARG,Punta Indio: donde el río se come el mapa de la Argentina - Clarín.com,https://www.clarin.com/viva/punta-indio-rio-come-mapa-argentina_0_Hy6cp2d8G.html,"La localidad bonaerense vivió una época de esplendor como recreo costero, con un hotel de lujo y todo. Los cambios sociales propiciaron su ocaso. Y el Río de la Plata se come su ribera.

El Hotel Argentino de Punta Indio, en la desembocadura del Río de la Plata, era la parada obligada para todos los viajeros que iban desde la Capital hacia la Costa Atlántica. Supo tener 70 habitaciones y un servicio de lujo del que gozaron políticos, artistas y familias aristocráticas desde 1934, la fecha de su construcción. Hay un mito que dice que allí se escondió oro nazi y que, incluso, estuvo escondido Adolfo Hitler. Hace varias décadas, sin embargo, el edificio ya no es el símbolo de la alta sociedad sino de la erosión costera. Desde la ventana destruida de lo que alguna vez fue su elegante restaurante, se observa hoy la vieja base de un mástil sumergida entre las olas. Fue arrastrada desde una plaza que quedaba a unos 250 metros. Todo ese trayecto ahora está bajo las aguas del Río de la Plata, que es ancho, bello y, por lo visto, algo traicionero. El agua es dulce, pero las olas son continuas: es un ambiente marino. Y, por eso, también es una auténtica rareza. Un mar dulce.



Un ceibo carcomido desde la raíz en la playa. Rubén Digilio.

La popularización de la ruta 2, que es más directa, fue relegando a Punta del Indio como destino turístico, pueblo al que se llega por la ruta 11, o el viejo camino del Gaucho, que en los tiempos de esplendor era transitado por tranvías tirados a caballo.

En algunas playas de Punta Indio, el paisaje ribereño es exuberante, con el agua marrón iluminada por el sol brillante y los juncos verdes, que las olas peinan constantemente. No llega aquí la contaminación que caracteriza al resto del frente costero del Río de la Plata en el lado argentino (aunque sí vienen plásticos nadantes de todo tipo, que se meten en la arena). Si no fuera por ello, se parecería mucho a las pinturas de la Buenos Aires colonial, en la que aparecen las lavanderas trabajando a la vera del río, entre los manchones de agua que se forman en la arena, cada vez con una forma distinta, según lo dicte el antojo de las mareas y de la luna. Es, en ese sentido, casi un viaje al pasado.

Pero en otros puntos de la localidad, el Río de la Plata parece haberse ensañado con la costa, comiéndosela a pedazos cada vez más grandes, como si tuviera angurria. Desapareció la calle que hacía las veces de costanera (se llamaba Fueginos). Y también dos calles perpendiculares más. Pero, en realidad, es tonto echarle la culpa al río. Todo lo que ha sucedido sólo se debe a una cosa: la acción del hombre.

Parado en un sector conocido como “Playa 3”, Ezequiel Calvano, el secretario de Turismo de Verónica (cabecera política del distrito), no puede creer lo que ve. Y eso que es un tipo que conoce cada palmo de la costa porque la ama. “Me causa extrañeza la rapidez con la que desapareció todo. En este lugar yo estacionaba mi auto hace sólo tres años”, dice.

En la playa, se nota una vieja cerca de madera, que ahora quedó sepultada por el agua. Rubén Digilio.

Ahora, en cambio, no queda prácticamente sitio para caminar en la arena. El río hizo encallar una boya, que parece perdida. Y los troncos de los ceibos han sido vencidos porque sus raíces fueron carcomidas por el agua. Algunos, han caído tan recientemente que todavía conservan sus flores coloradas intactas. Río adentro, se notan los palos que se colocaron para controlar el ganado y delimitar los campos. Ahora, no hay vacas: hay peces.

En el parador más popular de Punta Indio, El Pericón, es donde la erosión parecer haber avanzado con particular saña. Es justo donde está un gigante monumento al Indio Querandí, que habitaba en la zona antes de la conquista. Un monumento reciente, hecho de chatarra donada por los propios vecinos, es el homenaje a ese pueblo hoy perdido. En un día de semana de verano, el lugar está bastante concurrido, con gente tomando sol y niños jugando en la playa.

No advierten, sin embargo, que hace menos de una década, se podía instalar la sombrilla 200 metros más adelante. “Estos últimos años han sido aterradores”, dice Calvano. No sabe si estar asustado o triste.

Las ruinas del viejo Hotel Argentino. Rubén Digilio.

La teoría de los juncales. ¿Qué pasó en Punta Indio? Por empezar, hubo una ocupación del territorio no planificada y torpe, que se basó en una visión de la naturaleza que aún domina el mundo: que cualquier espacio geográfico es un lugar para explotar infinitamente. Una cantera que sirve para sacar lo que vemos como recursos útiles. Y a la que le podemos cambiar el aspecto a antojo.

Este sector del Río de la Plata se caracteriza por tener lo que se llama en la jerga técnica un “humedal intermareal”. Otros dirían solamente que se trata de juncales. Parecen plantas frágiles, pero su secreto está en la flexibilidad. Las aguas sacuden cada junco, pero todos juntos, uno al lado del otro, cumplen una función impresionante: frenan el oleaje y atrapan el sedimento. En una playa, que algunos le dicen La Escondida, donde no se han tocado los juncales, ha sucedido algo que es lo opuesto a lo que le pasó al Hotel Argentino: en vez de perder línea de costa, comenzó a ganar médano.

Los procesos erosivos podrían haberse iniciado a raíz del retiro de la vegetación natural del humedal, dice un informe.



Allí, los árboles, en vez de quedar destruidos desde la raíz, están enterrados, como si los estuvieran sofocando con arena. Y el viejo alambrado, que separaba la playa de un campo vecino, apenas se ve, aunque tenía seis hileras de alto.

Francisco Cellone ha pasado estos últimos años estudiando este tramo de la costa. Es geólogo de la Universidad Nacional de La Plata y miembro del Conicet. Junto a Eleonora Carol, realizó un estudio comparativo entre viejas fotografías aéreas de 1943, tomadas por personal de la Base Aérea de Punta Indio, e imágenes satelitales de 2013. Y confirmó lo que se ve en el terreno: un fenómeno dispar en el comportamiento de la costa. La erosión no era pareja.

El río avanzó sobre el muelle del viejo hotel de pescadores. Foto: Ruben Digilio.

El proceso de erosión empezó al menos hace 70 años. “Al analizar la relación existente entre la vegetación intermareal y los desplazamientos de la línea de costa se observa que en muchos sectores se da una coincidencia entre la presencia de vegetación y los valores positivos de la tasa de cambio (avances de la línea de costa) y viceversa, entre su ausencia y sectores fuertemente afectados por la erosión costera”, señala el estudio “Los procesos erosivos podrían haberse iniciado a raíz del retiro de la vegetación natural del humedal, desencadenando un proceso continuo que habría inhabilitado la recuperación natural de la vegetación”, agrega en el informe.



Precisamente, la zona más desarrollada de la costa es la que parece haber sufrido más. Pero hay científicos que sospechan que Punta Indio, al igual que muchos lugares de la costa de la Argentina, que llegan hasta la mismísima Tierra del Fuego, están siendo erosionados, además, por algo más determinante aún: el cambio climático.

Alerta sudestada. En Punta Indio, viven aproximadamente unas 800 personas de manera estable, aunque ese número se incrementa los fines de semana y en temporada por el turismo. Hasta 1995, dependía de la ciudad de Magdalena, famosa por su penal militar. Justamente, hay un mito popular que dice que, para construir esa carcel, en la que estuvieron presos desde el dictador Jorge Rafael Videla hasta Carlos Menem, se sacó arena de la zona y que la erosión se debe a ello.

Punta Indio y la Bahía de Samborombón están siendo afectadas por un cambio en las corrientes marinas, con un aumento de energía del tren de olas. Y esto ocurre, a su vez, porque se está tropicalizando la zona.



Jorge Codignotto, geólogo e investigador del Conicet, se ríe cuando le cuento todo esto. “Es como haber sacado un valdecito del arenero”, responde. Según explica, Punta Indio y la Bahía de Samborombón están siendo afectadas por un cambio en las corrientes marinas, con un aumento de energía del tren de olas. Y esto ocurre, a su vez, porque se está tropicalizando la zona, con el desplazamiento hacia el sur del anticliclón del Atlántico, un fenómeno que está ocurriendo desde los ‘70. Por esa razón, las sudestadas son ahora más fuertes y más frecuentes, con vientos rotados al este-nordeste.

Un trabajo realizado ya hace algunos años para la Fundación Ciudad por Vicente Barros, uno de los especialistas más destacados en cambio climático de la Argentina, indicaba: “El efecto de estas tormentas sobre las costas se ve agravado por el aumento paulatino del nivel del Río desde 1970, coincide con el incremento del número de ondas de tormenta por encima de 1,60 metros. La tendencia al aumento del nivel del Río no sólo aumentó la inundación de las áreas bajas, sino que incrementó la erosión de algunas costas, provocando su retroceso”.

En esa línea de pensamiento, Codignotto afirma: “El ascenso del nivel del mar está medido en el Río de la Plata. Esto es indiscutible”. El mar sube por el derretimiento de los glaciares en las montañas de todo el mundo, así como de las grandes superficies heladas de la Antártida y Groenlandia. Además, como el agua más caliente ocupa más espacio, los océanos también se expanden por eso. “Las tormentas cambiaron de posición. Son más intensas y frecuentes. A eso se suma la erosión”, agrega.

La combinación del mal manejo del territorio con el cambio climático hace desastres como los que se ven en Punta Indio. “Y pensar que uno ve el río tan mansito...”, reflexiona Calvano, una tarde de sol de verano. “Todo se aceleró en los últimos 5 o 10 años”, asegura. Y esto sólo recién empieza","Sun, 11 Feb 2018 08:00:00 GMT",https://images.clarin.com/2018/02/06/rkZC1puUG_600x338__1.jpg,"['el', 'la', 'come', 'se', 'punta', 'en', 'del', 'argentina', 'los', 'es', 'indio', 'río', 'por', 'donde', 'que', 'y', 'mapa']", 
19,19,FL-2018-000014-ARG,"Cruz Roja: ""La situación humanitaria es muy compleja"" por la crecida del Pilcomayo - Télam",https://www.telam.com.ar/notas/201802/247692-la-cruz-roja-advirtio-que-la-situacion-humanitaria-es-muy-compleja-por-la-crecida-del-pilcomayo.html,,"Tue, 06 Feb 2018 08:00:00 GMT",http://www.telam.com.ar/advf/imagenes/2018/02/5a79a29681c10_400x225.jpg,"['humanitaria', 'la', 'del', 'cruz', 'situación', 'pilcomayo', 'roja', 'es', 'muy', 'por']", 
20,20,FL-2018-000014-ARG,Tormentas e inundaciones sacuden el norte argentino - Diario Hoy (Argentina),https://diariohoy.net/interes-general/tormentas-e-inundaciones-sacuden-el-norte-argentino-115042,"Las constantes lluvias que castigan al norte argentino desde hace más de 48 horas provocaron desbordes de ríos e inundaciones en Tucumán, Chaco y Formosa. Esta lamentable situación obligó a evacuar a casi 2.000 familias de las diferentes provincias.

A raíz de la crecida de los ríos Paraná, Paraguay y Bermejo, en Chaco tuvieron que evacuarse un total de 1.340 viviendas en quince localidades. De todas ellas, la ciudad más afectada es la de Sáenz Peña, en la que 1.014 familias debieron ser retiradas del lugar como consecuencia de los más de 400 milímetros de agua que cayeron la última semana. En este sentido, el gobierno de dicha provincia continúa con los operativos de asistencia con la entrega de colchones, agua mineral, cobertores, bolsas de arena, frazadas y chapas, además de equipos especiales para agilizar el escurrimiento de agua.

Por su parte, en Formosa, los registros de la altura del río Paraguay obligaron a trasladar a más de setenta familias de la localidad de Puerto Pilcomayo. Ante este panorama, en la capital provincial se están realizando trabajos para proteger los sectores que pueden inundarse.

En tanto, una situación similar se vive en la provincia de Tucumán, en donde los ríos de la región aumentaron abruptamente sus caudales. En la localidad de Concepción, el desborde del Gastona trajo serias complicaciones y obligó a evacuar a cientos de personas. En San Miguel de Tucumán la situación también es crítica, ya que cuenta con varias calles inundadas, canales desbarrancados y agua que llega hasta adentro de las casas.

A raíz de este temporal, en la localidad tucumana de Tafí Viejo, un joven de 22 años cayó en un canal de desagüe y al cierre de esta edición era buscado intensamente por la policía lacustre. En este contexto, las condiciones de inestabilidad “se mantendrán al menos hasta el jueves 1º con mejoramientos temporarios”, advierte el Servicio Meteorológico Nacional (SMN) para la zona de Catamarca, Chaco, Formosa, Jujuy, La Rioja, Salta, Santiago del Estero y Tucumán.","Mon, 29 Jan 2018 08:00:00 GMT",https://diariohoy.net/adjuntos/galerias/000/290/0000290690.jpg,"['el', 'sacuden', 'la', 'este', 'argentino', 'en', 'los', 'tucumán', 'las', 'inundaciones', 'que', 'y', 'tormentas', 'más', 'norte']", 
21,21,FL-2018-000014-ARG,Tucumán: relevan daños tras las lluvias que dejaron cientos de evacuados y un muerto - Infocampo,https://www.infocampo.com.ar/relevan-danos-tras-las-intensas-lluvias-en-tucuman-que-dejaron-cientos-de-evacuados-y-un-muerto/,"El Comité de Emergencias de Tucumán informó que se encuentra realizando un relevamiento en las zonas afectadas por las intensas lluvias, que provocaron daños, evacuados y un muerto.

A continuación, reproducimos el estado de cada área:

Más información Macri visitó un campo que produce arándanos para exportación y prometió bajar alícuotas El presidente escuchó el reclamo de productores por el impuesto del 30% a las ventas externas y aseguró que ""trabajará para disminuir el costo"". Macri celebró la exportación de limones a EE.UU: “Apostamos a las economías regionales” El presidente de la Nación encabezó un acto en Tucumán por la salida del primer embarque hacia el país norteamericano. ""Es un día muy importante para la enorme familia que mueve este sector de la economía”, dijo.

Capital

-Si bien se registran anegamientos en distintas zonas, el trabajo se enfoca en la zona sur donde hay viviendas inundadas: en el barrio Alejandro Heredia se solicitó a EDET que corte el suministro eléctrico por este motivo. Se habilitó la escuela Amado Juri para albergar a los evacuados. Hasta el momento hay 150 personas alojadas en el establecimiento. A la vez, se evacuó a vecinos de la escuela Alejandro Heredia.

En la zona un hombre murió electrocutado cuando se encontraba sobre el techo de su vivienda, en avenida Democracia al 200.

-Además hay familias con agua en sus viviendas en barrios Esperanza, Ex Aeropuerto, Miguel Lillo, Tiro Federal, Alem y en avenida Martín Berho al 1.600.

-En la terminal de la línea de colectivos 6 (9 de Julio al 4.500) se registraron vecinos autoevacuados.

-El túnel de calle Mendoza se encuentra con agua y cerrado.

-En Marcos Paz al 300, en barrio Norte, se registró la caída de árboles.

-San Felipe y Santa Bárbara (altura Jujuy al 5.500) rebalsó una acequia e inundó viviendas.

En la zona sur de San Miguel de Tucumán, EDET realizó un corte de luz preventivo para evitar accidentes.

Banda del Río Salí

-Anegamiento generalizado. Están recorriendo el lugar Defensa Civil local, Bomberos Voluntarios y equipos de Obras públicas del municipio.

Alderetes

-Realizan la evacuación de 30 familias afectadas en loteo Serna, ubicado en San Martín al 600 por inundación y anegamiento. Se reportaron anegamientos en los asentamientos El Corte, Julio Abraham; barrios Jerusalem, Independencia y Villa Nueva; calles España al 300, San Martín al 300, Río Negro al 500. En esos lugares también fueron evacuados los vecinos. Se están coordinando acciones con Acción Social y Defensa Civil de Alderetes. El centro de evacuados se trasladó a la Dirección de Deportes del municipio, donde hasta el momento están alojadas unas 200 personas.

Las Talitas

-En esa ciudad cinco familias del barrio Asentamiento Sánchez sufrieron anegamientos en sus viviendas. Los Bomberos y personal del municipio estuvieron trabajando en el lugar y asistiendo a los vecinos. No reportan evacuados.

Ranchillos

-Varias zonas de la comuna del este quedaron anegadas, especialmente el centro de Ranchillos.

Los Ralos

-En esa comuna, en las inmediaciones de la oficina del Correo y barrio ex Ingenio, se registraron caída de árboles y daños en la red de alumbrado público y telefónico. Se evacuó a 10 familias.

En cuanto a los ríos del sur de la provincia, el Comité informó que el Gastona está en su cauce normal, y no se registran inconvenientes ni en Arcadia ni en Lamadrid. Mientras tanto, el Río Chirimayo aumentó considerablemente su cauce, aunque no registró inconvenientes. El río Balderrama, a la altura de Río Colorado, aumentó su caudal sin inconvenientes.","Thu, 25 Jan 2018 08:00:00 GMT",https://www.infocampo.com.ar/wp-content/uploads/2018/01/inundaciones.jpg,"['al', 'el', 'la', 'evacuados', 'muerto', 'en', 'se', 'del', 'tucumán', 'las', 'los', 'tras', 'lluvias', 'río', 'relevan', 'que', 'y', 'dejaron']", 
