,ID,event_id,article_title,article_link,article_content,publishing_date,article_image,article_keywords,article_relevance
15,15,FL-2021-000019-PER,"Conoce qué son los huaicos, inundaciones y otros eventos naturales - Agencia Andina",https://andina.pe/agencia/noticia-conoce-son-los-huaicos-inundaciones-y-otros-eventos-naturales-834901.aspx,"Terminología de Defensa Civil, elaborada por el Instituto Nacional de Defensa Civil (Indeci), repasemos cuál es el significado de los siguientes desastres o calamidades naturales. De acuerdo a la, elaborada por el Instituto Nacional de Defensa Civil (Indeci), repasemos cuál es el significado de los siguientes desastres o calamidades naturales.





Alud. Desprendimiento violento, en un frente glaciar, pendiente abajo, de una gran masa de nieve o hielo acompañado en algunos casos de fragmentos rocosos de diversos tamaños y sedimentos de diferente granulometría. Es sinónimo de avalancha.









Aluvión. Desplazamiento violento de una gran masa de agua con mezcla de sedimentos de variada granulometría y bloques de roca de grandes dimensiones. Se desplazan con gran velocidad a través de quebradas o valles en pendiente, debido a la ruptura de diques naturales y/o artificiales o desembalse súbito de lagunas, o intensas precipitaciones en las partes altas de valles y quebradas.





Arenamiento. Traslado e invasión de masas de arena (dunas) sobre la superficie terrestre y ribera litoral, por la acción de los vientos y corrientes marinas.





Avenida. Crecida del caudal de un río. En algunos lugares del país se llama localmente riada.









Derrumbe. Caída repentina de una porción de suelo, roca o material no consolidado, por la pérdida de resistencia al esfuerzo cortante y a la fuerza de la gravedad, sin presentar un plano de deslizamiento. El derrumbe suele estar condicionado a la presencia de discontinuidades o grietas en el suelo con ausencia de filtraciones acuíferas no freáticas. Generalmente ocurren en taludes de fuerte pendiente.





Desborde. Fenómeno natural que se presenta cuando el nivel del agua sube mucho en los ríos, lagunas, lagos y mar; entonces, cubre o llena zonas de tierra que normalmente son secas. Se genera, principalmente, por las lluvias intensas y persistentes. Y también por el deshielo de glaciares.





Deslizamiento. Ruptura y desplazamiento de pequeñas o grandes masas de suelos, rocas, rellenos artificiales o combinaciones de éstos, en un talud natural o artificial. Se caracteriza por presentar necesariamente un plano de deslizamiento o falla, a lo largo del cual se produce el movimiento.









Granizo. Precipitación pluvial helada que cae al suelo en forma de granos. Se genera por la congelación de las gotas de agua de una nube, principalmente cumulonimbo, sometidas a un proceso de ascenso dentro de la nube, con temperaturas bajo cero, y luego a descenso en forma de granos congelados. La dimensión del granizo varía entre 3 y 5 mm de diámetro. Cuando las dimensiones son mayores, reciben el nombre de pedrisco.





Helada. Se produce cuando la temperatura ambiental baja debajo de cero grados. Son generadas por la invasión de masas de aire de origen antártico y, ocasionalmente, por un exceso de enfriamiento del suelo durante cielos claros y secos. Es un fenómeno que se presenta en la sierra peruana y con influencia en la selva, generalmente en la época de invierno.





Huaico. Un término de origen peruano, derivado de la palabra quechua que significa quebrada, a lo que técnicamente en geología se denomina aluvión. El “huaico” o “lloclla” (el más correcto en el idioma quechua), es un tipo de aluvión de magnitudes ligeras a moderadas, que se registra con frecuencia en las cuencas hidrográficas del país, generalmente durante el período de lluvias.







Incendio forestal. Es el fuego que se extiende sin control en terreno forestal o silvestre, afectando a flora y fauna. Un incendio forestal se distingue de otros tipos de incendio por su amplia extensión, la velocidad con la que se puede extender desde su lugar de origen, su potencial para cambiar de dirección inesperadamente, y su capacidad para superar obstáculos como carreteras, ríos y cortafuegos.





Inundación. Desbordes laterales de las aguas de los ríos, lagos y mares, cubriendo temporalmente los terrenos bajos, adyacentes a sus riberas, llamadas zonas inundables. Suelen ocurrir en épocas de grandes precipitaciones, marejadas y tsunami.





Lahar. Es un flujo de sedimento y agua que se moviliza desde las laderas de volcanes. Se genera cuando el agua meteórica, la de escorrentía superficial, la del deshielo parcial de glaciares o fusión de nieve, o la acumulada en algunos cráteres formando lagos volcánicos, se mezcla con estos materiales y se desplaza transportándolos en masa por los barrancos.









Marejada. Llamada localmente maretazo, se caracteriza por una serie de ondas marinas generadas por tormentas con vientos fuertes que agitan la superficie de las aguas oceánicas, bajo ciertas condiciones de presión atmosférica y de la batimetría de las costas.





Maremoto. Onda marina generada por el desplazamiento vertical del fondo marino como resultado de un sismo, por una actividad volcánica o por el desplazamiento de grandes volúmenes de material de la corteza en las pendientes de la fosa marina.





Nevada. Precipitación de cristales de hielo, que toman diferentes formas: estrella, cristales hexagonales ranurados, etc.; existen casos en que, aun a temperaturas bajo cero, los cristales pueden estar rodeados de una delgada capa de agua líquida y cuando chocan unos con otros incrementan de tamaño en forma de grandes copos.







Oleaje. Es la fluctuación del nivel del mar que cambia entre 2 y 25 segundos, horizontalmente podemos tener distancia entre una cresta y otra cresta de 60 a 80 metros. Se genera por la fuerza de los vientos.





Sismo. Liberación súbita de energía generada por el movimiento de grandes volúmenes de rocas en el interior de la Tierra, entre su corteza y manto superior, que se propagan en forma de vibraciones a través de las diferentes capas terrestres.





Temblor. Es el movimiento sísmico con intensidad entre los grados III, IV y V de la escala de Mercalli Modificada (MM).









Terremoto. Convulsión de la superficie terrestre ocasionada por la actividad tectónica o por fallas geológicas activas. La intensidad es generalmente mayor de VI y VII grados de la escala Mercalli Modificada (MM).





Tsunami. Nombre japonés que significa “ola de puerto”. Onda marina producida por un desplazamiento vertical del fondo marino, como resultado de un terremoto superficial, actividad volcánica o deslizamiento de grandes volúmenes de material de la corteza en las pendientes de la fosa marina. Es la fase final de un maremoto al llegar a la costa.





(FIN) LZD/MAO","Thu, 25 Feb 2021 08:00:00 GMT",https://portal.andina.pe/EDPfotografia3/Thumbnail/2021/02/16/000749862W.jpg,"['del', 'la', 'naturales', 'inundaciones', 'por', 'se', 'eventos', 'son', 'los', 'huaicos', 'en', 'es', 'otros', 'y', 'qué', 'que', 'el', 'las', 'conoce']", 
16,16,FL-2021-000019-PER,"Inundaciones en Acre, Brasil afectan a más de 130.000 personas - teleSUR TV",https://www.telesurtv.net/news/brasil-inundaciones-acre-situacion-emergencia-20210220-0025.html,"El estado de Acre se encuentra en emergencia por las inundaciones, un brote de dengue y la crisis sanitaria por la pandemia.

Al menos 130.000 personas se han visto afectadas por las inundaciones en el estado brasileño de Acre producto de las crecidas de varios ríos que han afectado a la capital Rio Branco y varios municipios de la entidad.

LEA TAMBIÉN: Migrantes haitianos en Brasil reclaman paso hacia Perú

Las personas afectadas por las inundaciones han sido trasladadas a refugios temporales en escuelas, iglesias, gimnasios, campos deportivos y embarcaciones.

En el estado de Acre, norte de #Brasil, 130 mil personas de 10 ciudades fueron afectadas por las inundaciones. El gobernador decretó situación de emergencia. En las redes se movilizan con la hashtag #SOSAcre



�� Marcos Vicentti/Secom pic.twitter.com/cvlgnN3H9I — André Vieira (@AndreteleSUR) February 21, 2021

De acuerdo a las autoridades la crecida de los ríos y otras fuentes de agua han puesto en alarma a los municípios de Tarauacá, Cruzeiro do Sul, Feijó, Santa Rosa do Purus, Sena Madureira y Rodrigues Alves.

Las inundaciones se suman a la crisis sanitaria por la pandemia, al brote de dengue en la región y al problema migratorio en la frontera con Perú, ante esta situación, el gobernador de Acre, Gladson Cameli, decretó, el pasado martes la situación de emergencia en toda la entidad.

Tras la situación de emergencia, el gobernador Cameli, ha solicitado recursos y ayuda para atender a la población afectadas por las inundaciones y la crisis sanitaria.

Bela campanha do Tribunal de Justiça e do Ministério Público do nosso amado Estado do Acre #SOSAcre pic.twitter.com/GhUiGgjIZK — Gladson Cameli (@GladsonCameli) February 20, 2021

“Estamos dando a conocer la campaña que realiza la Asociación del Ministerio Público del Estado de Acre, para que con transparencia todos puedan seguir y tener acceso a la rendición de cuentas. Pedimos ayuda de todo Brasil en ese momento ”, expresó el gobernador Gladson Cameli.

El Ministerio Público de Acre inició la campaña pidiendo a la sociedad que ayude a las familias afectadas por la crisis actual. La acción destaca que las personas necesitan ropa, alimentos, abarrotes y materiales de limpieza.","Sat, 20 Feb 2021 08:00:00 GMT",https://www.telesurtv.net/__export/1613879361525/sites/telesur/img/2021/02/20/brasil_acre_twitter.jpg_1810791533.jpg,"['inundaciones', 'por', '130000', 'el', 'estado', 'en', 'personas', 'más', 'las', 'la', 'afectan', 'acre', 'y', 'brasil', 'que']", 
17,17,FL-2021-000019-PER,Junín: Centro de Salud se inunda y personal usa sus prendas personales como trapeadores [VIDEO] - RPP Noticias,https://rpp.pe/peru/junin/junin-centro-de-salud-se-inunda-y-personal-usa-sus-prendas-personales-como-trapeadores-video-noticia-1325265,"Al no tener suficientes trapeadores, el personal de salud usó mandilones para tratar de secar el piso de los ambientes inundados. | Fuente: RPP | Fotógrafo: Ada Ramos

Las lluvias en el Perú siguen causando estragos. Esta vez en el distrito de Chilca, provincia de Huancayo, región Junín, el centro de Salud de Auquimarca se inundó y, para secar los ambientes, el personal utilizó sus mandiles al no tener suficientes trapeadores, según contó la representante de los trabajadores, Inés Chávez Soto.

“A las 6:48 horas que ingresa el personal, hemos encontrado todo inundado, cinco ambientes llenos de agua (por las lluvias). De inmediato, hemos limpiado con escobas, trapeadores, mandilones para no perjudicar la atención de la población. Como hormiguitas hemos trabajado desde temprano”, dijo.

Inés Chávez Soto también denunció que la semana pasada parte del techo fue arrancado por los fuertes vientos que se registraron. El último viernes cursaron documentos a representantes de la Red de Salud Valle del Mantaro, pero no fueron atendidos. Esto provocó que las lluvias, que en esta época del año azotan a la región Junín, inunden el local.

“Hemos enviado los documentos para que hagan el cambio, pero nada. Nos dijeron que van a ver, hay muchas trabas burocráticas”, comentó.

Producto de la inundación del centro de Salud de Auquimarca, se malograron medicamentos, ya que parte del techo del área de Farmacia no existe. También se afectaron equipos de protección personal y mobiliario.

Al lugar llegaron los representantes de Defensa Civil, de la red de Salud y el gobernador de Junín, Fernando Orihuela Rojas, quien tras realizar la inspección de los ambientes se comprometió a destinar presupuesto para el mantenimiento.

Los trabajadores del centro de Salud de Auquimarca esperan que el compromiso se cumpla con prontitud, debido a que continúan las lluvias en esa parte de la región Junín.

NUESTROS PODCASTS:

- ‘Espacio Vital’: ¿La variante británica de la COVID-19 es más letal? El Dr. Elmer Huerta responde:","Wed, 10 Mar 2021 08:00:00 GMT",https://e.rpp-noticias.io/large/2021/03/10/whatsapp-video-2021-03-10-at-115059-am-1068019mp4_1068020.png,"['video', 'el', 'personales', 'prendas', 'lluvias', 'se', 'del', 'personal', 'para', 'la', 'trapeadores', 'y', 'salud', 'usa', 'los', 'sus', 'que']", 
18,18,FL-2021-000019-PER,Lluvias en Piura: Así están los asentamientos humanos de Chulucanas por inundaciones - RPP Noticias,https://rpp.pe/peru/piura/lluvias-en-piura-asi-estan-los-asentamientos-humanos-de-chulucanas-por-inundaciones-noticia-1324604,"Luego de cuatro días de constantes precipitaciones, el Ejecutivo declaró en estado de emergencia diez distritos de la región Piura, entre ellos a Chulucanas. Decenas de viviendas terminaron afectadas por el desborde de los ríos. Las familias solo piden ayuda humanitaria.","Sat, 06 Mar 2021 08:00:00 GMT",https://e.rpp-noticias.io/large/2021/03/06/portada_185018.jpg,"['por', 'inundaciones', 'viviendas', 'el', 'región', 'ríos', 'piura', 'lluvias', 'en', 'solo', 'precipitaciones', 'humanos', 'chulucanas', 'así', 'terminaron', 'los', 'piden', 'están']", 
19,19,FL-2021-000019-PER,Madre de Dios: Centro de rescate pide ayuda para reubicar a los animales tras inundaciones - RPP Noticias,https://rpp.pe/peru/madre-de-dios/madre-de-dios-centro-de-rescate-pide-ayuda-para-reubicar-a-los-animales-tras-inundaciones-noticia-1323097,"Ochenta animales tuvieron que ser evacuados del Taricaya Ecological Reserve, tras el desborde del del río Madre de Dios. | Fuente: Taricaya Ecological Reserve

Ochenta animales se quedaron sin hogar tras el desborde del del río Madre de Dios, que afectó la infraestructura del Taricaya Ecological Reserve, de la ciudad de Puerto Maldonado.

Fernando Rosemberg, propietario del albergue afectado, llevó a los animales a su casa de manera temporal, pero está en búsqueda de un lugar más adecuado.

Además, indicó que, a pesar de los esfuerzos, cuatro animales murieron a causa de la inundación.

""Al margen de la pandemia, que ya nos ha tenido en problemas. Con esta inundación estamos evacuando animales, que son susceptibles a enfermedades por el barro y la humedad en las patas. Aves que no pueden volar y se caen al barro o al agua, se nos ahogan"", dijo.

El ambientalista indicó que si bien el rio bajó su caudal, nada asegura que no se incremente otra vez, puesto que la temporada de lluvias no termina. Además, detalló que los ambientes del centro de rescate requieren ser restauradas.

La casa de Fernando Rosemberg, propietario del centro de rescate afectado, se ha convertido en el albergue temporal de los animales. | Fuente: Captura de vídeo del Facebook de Taricaya Ecological Reserve

Rosemberg explicó que su centro de rescate se sostiene por el turismo vivencial y el voluntariado, actividades paralizadas a causa de la pandemia.



""Jamás he pedido nada a nadie por esto, porque siempre he estado por mi cuenta, pero sin dinero no podemos seguir en esto. Mucha gente de Lima nos ha mandado palabras de aliento y ahora, eso nos da mucha fuerza para seguir adelante con lo que estamos haciendo"", señaló.



El centro de rescate es una organización sin fines de lucro que se dedica al rescate, rehabilitación y liberación de animales en peligro. Ahora los voluntarios solicitan apoyo través del facebook Taricaya Ecological Reserve para continuar su labor.

Newsletter Todo sobre el coronavirus

La COVID-19 ha puesto en alerta a todos. Suscríbete a nuestro newsletter Todo sobre el coronavirus, donde encontrarás los datos diarios más relevantes del país y del mundo sobre el avance del virus y la lucha contra su propagación.

EL PODER EN TUS MANOS

Doce casos de acoso político a mueres se reportaron durante la elección parlamentaria del 2020, según el Jurado Nacional de Elecciones. Sin embargo, estos actos de violencia aún no están regulados ni tienen condena específica. Especialistas analizan este delicado tema en el siguiente informe de El poder en tus manos.","Fri, 26 Feb 2021 08:00:00 GMT",https://e.rpp-noticias.io/large/2021/02/26/194219_1063436.jpg,"['del', 'tras', 'la', 'pide', 'centro', 'inundaciones', 'se', 'dios', 'los', 'en', 'animales', 'para', 'y', 'reubicar', 'que', 'el', 'taricaya', 'rescate', 'madre']", 
20,20,FL-2021-000019-PER,Piura: El drama de las familias afectadas por las inundaciones en Chulucanas - RPP Noticias,https://rpp.pe/peru/piura/piura-el-drama-de-las-familias-afectadas-por-las-inundaciones-en-chulucanas-noticia-1324581,"Familias pidieron ayuda al municipio para ser reubicadas en otra zona. | Fuente: RPP Noticias | Fotógrafo: Gustavo Guarnizo

Las intensas lluvias registradas en la región Piura vienen afectando a cientos de familias vulnerables de los distritos de Chulucanas, Morropón, La Matanza, Las Lomas, Tambogrande, Huancabamba, Canchaque, San Miguel de El Faique, Canchaque, Máncora y Querecotillo, los cuales fueron declarados en emergencia por el Ejecutivo.

RPP Noticias llegó hasta el asentamiento humano Nelson Mío, en la provincia de Chulucanas, uno de los sectores más golpeados por este desastre natural. La dirigenta de este sector, Anahí Lescano, informó que 50 viviendas terminaron inundadas la noche del viernes, tras el desborde de un dren que conduce agua al río Piura. Ante esta situación, Lescano pidió a las autoridades ayuda humanitaria para poder sobrellevar esta emergencia.

""Todo se inundó, todas las aguas se metieron a las casas. Pedimos ayuda al alcalde para que nos traiga relleno, queremos que nos ayude con techo, vivienda, esta es una zona inhabitable, lo que pedimos es que nos reubiquen, porque tenemos niños, ancianos, realmente necesitamos tener un lugar donde vivir"", expresó.



Así terminaron las viviendas en el asentamiento humano Nelson Mío, en Chulucanas, tras el desborde de las quebradas. | Fuente: RPP Noticias | Fotógrafo: Gustavo Guarnizo

Viviendo con el temor



En el asentamiento de Villa Mercedes, la señora Julia Paico Ipanaqué contó que la vivienda donde vive junto a sus hijos se inunda todos los días con las lluvias, debido a que tiene un techo de material rústico que ya no resiste más.

""Ha entrado el agua a los cuartos, nuestras calaminas están rotas, nuestra ropa, nuestras colchones, se han mojado, queremos una ayuda para poder dormir. Nos da miedo el agua, porque no tenemos adónde librarnos"", lamentó.

Según el reporte del Servicio Nacional de Metereología e Hidrología (Senamhi), la lluvia reportada en Chulucanas fue de 55.5 milímetros, lo cual activó drenes, las quebradas Sol Sol, Paccha, además de los ríos Charanal y Ñañañique.

Ante esta situación, personal del Ejército Peruano en coordinación con el municipio de Chulucanas destinó personal para atender las zonas afectadas. El alcalde distrital, Nelson Mío, indicó que no tienen retroexcavadoras ni motobombas suficientes como para ayudar a toda la población, por lo que pidió al Gobierno Central destinar un presupuesto para atender esta emergencia.



Los techos de las viviendas fueron afectadas por las lluvias. | Fuente: RPP Noticias | Fotógrafo: Gustavo Guarnizo

Newsletter Todo sobre el coronavirus

La COVID-19 ha puesto en alerta a todos. Suscríbete a nuestro newsletter Todo sobre el coronavirus, donde encontrarás los datos diarios más relevantes del país y del mundo sobre el avance del virus y la lucha contra su propagación.

NUESTROS PODCASTS:

- ‘Espacio Vital’: ¿Qué debemos saber sobre la vacuna de Novavax?","Sat, 06 Mar 2021 08:00:00 GMT",https://e.rpp-noticias.io/large/2021/03/06/545654_1066561.jpg,"['inundaciones', 'por', 'el', 'familias', 'piura', 'en', 'del', 'esta', 'las', 'afectadas', 'la', 'para', 'chulucanas', 'los', 'que', 'drama']", 
21,21,FL-2021-000019-PER,Loreto: autoridades atienden a familias por inundación que dañó más de 400 viviendas - Agencia Andina,https://andina.pe/agencia/noticia-loreto-autoridades-atienden-a-familias-inundacion-dano-mas-400-viviendas-835522.aspx,"Las inundaciones no registran daños a la vida ni a la salud de los pobladores de la zona.





El 24 de febrero, a consecuencia de las intensas precipitaciones pluviales que se presentan en la zona, se registra el incremento del caudal y posterior desborde del río Ucayali, ocasionando una inundación en las localidades Inahuaya, Ipuano, San Cristóbal y José Olaya.









En el distrito Inahuaya se afectaron las localidades de Inahuaya, Ipuano, San Cristóbal y José Olaya; mientras que en el que en el distrito de Vargas Guerra, las zonas de Daniel Alcides Carrión, Huamantullo, Dos Hermanos, Víctor Andrés Belaunde, Alfonso Ugarte, San Fernando, Florencia, Cahuide y Orellana.





Al respecto, el Centro de Operaciones de Emergencia Regional (COER) Loreto informó que se encuentra gestionando la entrega de bienes de ayuda alimentaria para ser distribuidas entre las familias afectadas. Asimismo, continúa con el seguimiento de las acciones de respuesta en la emergencia por parte de las autoridades locales.

Por su parte, la Oficina de Gestión de Riesgo de Desastres de la Municipalidad Distrital de Inahuaya ejecuta la Evaluación de Daños y Análisis de Necesidades (EDAN) y el empadronamiento de las familias afectadas. Hasta el momento se registran 147 viviendas dañadas y 12 inhabitables, así como un número aún indeterminado de daños en caminos rurales y áreas de cultivo.









También lea:









La misma tarea la ejecuta la Oficina de Gestión de Riesgo de Desastres de la Municipalidad Distrital de Vargas Guerra. A la fecha se reportan 318 viviendas afectadas y aún no se tiene la cifra de daños en caminos rurales y áreas de cultivo.













Cabe indicar que las autoridades locales continuarán con la EDAN; en tanto, coordinan con los sectores Agricultura, Salud, Educación y Transporte, a fin de que evalúen los daños en lo que respecta a su competencia. El evento no registra daños a la vida ni a la salud de los pobladores de la zona.





El Centro de Operaciones de Emergencia Nacional (COEN) brinda las siguientes recomendaciones ante la ocurrencia de lluvias e inundaciones:





-Si tiene una casa con techo de esteras protéjalo con plástico o bolsas de cemento, dándole una pendiente para la evacuación de aguas. -Si vive cerca de algún cauce, cuente con sacos de tierra o arena para evitar el ingreso de agua. Mantenga la azotea de su casa despejada y proteja el techo con una capa de concreto, con pendiente hacia el ducto de desfogue de agua. -Apoye la reubicación de familias ubicadas en las partes bajas o en los cauces de los ríos secos. -Es necesario ganar altura lo antes posible y alejarse de los cauces y laderas de los ríos por posibles desbordes o inundaciones. -Tenga presente que deslizamientos, flujos de lodo y derrumbes pueden acelerarse durante lluvias intensas. -Si va conduciendo, disminuye la velocidad, tome precauciones y no se detenga en zonas donde puede fluir gran cantidad de agua. -Con el asesoramiento de las autoridades de Defensa Civil, pueden hacer un dren o canal, con picos y lampas para que el agua de lluvia corra en lo posible por el centro de la calle y no por las fachadas. Si la calle tiene asfalto solo deje correr el agua de lluvia. -No destape los buzones y proteja las tuberías de desagüe. -El agua de lluvia con barro no debe entrar en los buzones ni en los desagües de tu casa. -No atraviese con su vehículo ni a pie los tramos inundados.









Más en Andina:

Contraloría detecta riesgos en almacenamiento de vacunas contra covid-19 en Diresa Pasco ?? https://t.co/4Fb0q0XIft pic.twitter.com/81wWdOyhca — Agencia Andina (@Agencia_Andina) February 28, 2021





(FIN) TMC





Loading...

Las autoridades locales iniciaron la atención a las familias damnificadas en los distritos Inahuaya y Vargas Guerra, provincia Ucayali, región Loreto, por el desborde del río Ucayali, debido a las intensas lluvias que se registran, y que dañó 465 viviendas dejó a otras 12 inhabitables, informó el Instituto Nacional de Defensa Civil (Indeci).Publicado: 28/2/2021","Sun, 28 Feb 2021 08:00:00 GMT",https://portal.andina.pe/EDPfotografia3/Thumbnail/2021/02/28/000753270W.jpg,"['loreto', 'la', 'daños', 'por', 'se', 'los', 'dañó', 'inundación', 'agua', 'en', 'más', 'atienden', 'y', 'que', 'viviendas', 'el', 'familias', 'autoridades', 'las']", 
