,ID,event_id,article_title,article_link,article_content,publishing_date,article_image,article_keywords,article_relevance
30,30,FL-2021-000019-PER,San Martín: reportan daños por lluvias intensas y desborde de ríos en diversos distritos - Agencia Andina,https://andina.pe/agencia/noticia-san-martin-reportan-danos-lluvias-intensas-y-desborde-rios-diversos-distritos-835567.aspx,"El informe de la oficina de Defensa Civil de San Martín , da cuenta que varios tramos de la carretera puente Colombia-Chazuta, se vieron afectados a causa de los derrumbes.









San Martín, se reportó el desborde de quebradas y ríos dejando decenas de familias damnificadas y afectadas. Indeci precisó que la creciente de las quebradas Bijuahillo y Hupianillo inundaron áreas urbanas del distrito, afectando varias viviendas, lo que movilizó a la maquinaria del gobierno local acelerar los trabajos para descolmatar el puente. Asimismo, en el distrito Sauce, provincia de, se reportó el. Indeci precisó que la creciente de las quebradas Bijuahillo y Hupianillo inundaron áreas urbanas del distrito, afectando varias viviendas, lo que movilizó a la maquinaria del gobierno local acelerar los trabajos para descolmatar el puente.





Por su parte, la Dirección Regional de Transportes y Comunicaciones informó que en el sector conocido como Mativuelo de la carretera a Chazuta se restringió el pase de vehículos por varias horas, debido a un derrumbe en la zona.





Para superar el problema, maquinaria pesada trabajó en la limpieza del tramo durante varias horas, dejando finalmente habilitada para el tránsito vehicular, con el anuncio que en cualquier momento podría ocurrir algo similar, convocando a los conductores a ser precavidos.





En Tarapoto, sectores bajos de la ciudad resultaron afectados por las lluvias intensas, varias familias solicitaron ayuda a Defensa Civil para la descolmatación de las cunetas a fin de evitar que se represen por la gran cantidad de basura acumulada.





Mientras que en el distrito de Yuracyacu, provincia de Rioja, zona del Alto Mayo, un grupo de cinco familias fue afectada con la inundación de sus viviendas. Asimismo, en el centro poblado Shucushyacu, distrito de Jepelacio (Moyobamba), el desborde de la quebrada Shatona inundó varios tramos de la carretera principal.









Las familias afectadas solicitaron ayuda a los gobiernos locales, así como la rehabilitación de algunas áreas inundables y evitar problemas posteriores, ya que se prevé que las lluvias continúen en la región San Martín. En las próximas horas se conocerá el informe general de Defensa Civil y del Centro de Operaciones de Emergencia Regional de San Martín.





Más en Andina:

¿Viajas en bus interprovincial? Toma en cuentas medidas que están vigentes desde hoy https://t.co/E10k2Ry5NU a través de @Agencia_Andina — Moisés Aylas Ortiz (@regionalesand) March 1, 2021





(FIN) ARR/MAO","Mon, 01 Mar 2021 08:00:00 GMT",https://portal.andina.pe/EDPfotografia3/Thumbnail/2021/03/01/000753365W.jpg,"['por', 'intensas', 'el', 'ríos', 'en', 'lluvias', 'san', 'martín', 'reportan', 'se', 'del', 'las', 'la', 'y', 'varias', 'los', 'diversos', 'que']", 
31,31,FL-2021-000019-PER,Perú. Puerto Maldonado: Campaña para ayudar a damnificados - Vatican News,https://www.vaticannews.va/es/iglesia/news/2021-03/peru-puerto-maldonado-vicariato-caritas-ayuda-damnificados-2021.html,"""Unidos en Solidaridad"", es el lema de la campaña que lanza el Vicariato Apostólico de Puerto Maldonado, a través de Cáritas Madre de Dios, con el fin de ayudar a los pobladores de los 9 distritos afectados por las fuertes lluvias.

Ciudad del Vaticano

Para ayudar a las 15 mil personas de Puerto Maldonado, Perú, afectadas en los últimos días por las fuertes lluvias e inundaciones debido al desbordamiento de los ríos en la región de Madre de Dios, el Vicariato Apostólico de Puerto Maldonado, a través de Cáritas, ha lanzado la campaña ""Unidos en Solidaridad"".

El objetivo de la campaña es recoger alimentos no perecederos, agua potable y productos de higiene para los 9 de los 11 distritos con dificultades en Madre de Dios. El sábado pasado, para sensibilizar a los fieles del Vicariato Apostólico, niños, jóvenes y adultos recorrieron las calles de Puerto Maldonado en bicicleta, creando un evento para recaudar fondos y comida. Al inscribirse en el evento, los participantes donaron artículos de primera necesidad. También se lanzaron anuncios en las redes sociales para promocionar la campaña de Cáritas y se promueven iniciativas diarias.

Mientras tanto, los primeros auxilios han llegado a la comunidad de ""Santa Teresita"" y a las zonas agrícolas aledañas y Cáritas Madre de Dios también ha acogido la iniciativa de Sloow Food Tambopata, liderada por el chef Roy Riquelme, que está ofreciendo desayunos y almuerzos a los evacuados.","Mon, 01 Mar 2021 08:00:00 GMT",https://www.vaticannews.va/content/dam/vaticannews/multimedia/2021/02/20/9.jpg/_jcr_content/renditions/cq5dam.thumbnail.cropped.1500.844.jpeg,"['perú', 'el', 'en', 'damnificados', 'campaña', 'maldonado', 'las', 'para', 'la', 'y', 'madre', 'los', 'ayudar', 'puerto']", 
32,32,FL-2021-000019-PER,Senamhi declara en alerta roja al río Ucayali - LaRepública.pe,https://larepublica.pe/sociedad/2021/02/23/senamhi-declara-en-alerta-roja-al-rio-ucayali/,"A través de un comunicado, Senamhi declaró en alerta roja al río Ucayali , luego de que a las 06.00 a. m. de este 22 de febrero, la estación hidrológica Contamana registrara 132.14 metros sobre el nivel del mar.

Asimismo, la institución indicó que las zonas que se verían afectadas sería las del distrito de Contamana, las localidades de Nuevo Olaya, San Pedro, Ipuano, Alto Perillo, Canelos, Nuevo Canchahuaya y Orellana en la provincia de Ucayali.

Indeci se pronunció al respecto y pidió a las autoridades realizar un plan de contigencia y prevenir a la población de un posible desborde.

“En caso de presentarse alguna emergencia por inundación, es preferible alejarse de los cables de energía eléctrica o torres de alta tensión, evitar cruzar por los ríos que hayan aumentado su caudal y mantenerse atentos a las recomendaciones de las autoridades locales”, indicó la autoridad.

134 zonas críticas en alerta por inundación y huaicos en regiones peruanas

El Instituto Geológico, Minero y Metalúrgico (Ingemmet) informó, mediante un comunicado de prensa, que 134 zonas críticas de las regiones peruanas se encuentran en alerta por deslizamientos, inundaciones y huaicos. Todo esto debido a las precipitaciones pluviales que se están registrando en la selva del país.

En el documento se puntualizó que las regiones involucradas son Amazonas (6), Ayacucho (10), Cajamarca (7), Cusco (15), Huancavelica (1), Huánuco (4), Junín (18), Loreto (11), Madre de Dios (4), Pasco (9), Puno (4), San Martín (29) y Ucayali (16).

Newsletter COVID-19 en Perú de La República

Suscríbete aquí al boletín de La República y recibe a diario en tu correo electrónico toda la información sobre el estado de emergencia y la pandemia de la COVID-19.","Mon, 22 Feb 2021 08:00:00 GMT",https://larepublica.pe/resizer/IkkHQonRQGnKZYWZycLqjpfU6xs=/1200x660/top/cloudfront-us-east-1.images.arcpublishing.com/gruporepublica/2GKLVKZOTNAF5CZXVMKZUR3Z7U.jpg,"['senamhi', 'por', 'el', 'alerta', 'declara', 'en', 'se', 'al', 'las', 'la', 'y', 'regiones', 'río', 'zonas', 'ucayali', 'que', 'roja']", 
33,33,FL-2021-000019-PER,"Madre de Dios: Inundaciones afectaron a 1,380 viviendas tras desbordes de ríos - exitosanoticias",https://exitosanoticias.pe/v1/madre-de-dios-inundaciones-afectaron-a-1380-viviendas-tras-desbordes-de-rios/,"El Gobierno Regional de Madre de Dios informó hoy que 1,380 viviendas en once distritos de la región amazónica fueron inundadas por el desborde de los ríos Tambopata ante las intensas precipitaciones pluviales.





Ante el desastre ocurrido en la región amazónica, el gobernador regional de Madre de Dios, Luis Hidalgo, pidió al Ejecutivo declararlos en estado de emergencia y enviar apoyo humanitario para las familias damnificadas. Incluso, mencionó que la situación sobrepasó las capacidades del mismo Gobierno y municipios.

“Apoyamos a los damnificados en Madre de Dios, sin embargo, todo este trabajo nos resulta insuficiente, es por ello que hemos hecho un llamado al Ejecutivo, primero para una declaratoria de estado de emergencia, situación que al parecer ya está siendo atendida y el día de hoy debe determinarse, esto nos va a permitir mover presupuestos para apoyar a todos aquellos que hoy han perdido sus viviendas, bienes, animales y cultivos”, manifestó Hidalgo.





También puedes leer: INPE se pronunció sobre fuga de recluso tras ser trasladado a una clínica en SJL

Los distritos afectados son Inambari, Tambopata, Laberinto, Las Piedras (provincia de Tambopata), Tahuamanu, Iberia (Tahuamanu), Madre de Dios, Huepetuhe y Fitzcarrald (Manu).

Asimismo, las familias afectadas vienen siendo trasladadas por lo habitantes de la zona en unas embarcaciones hacia los centros educativos habilitados, lugar donde se mantendrán por lo pronto.

“Esta crisis sumada al tema del COVID-19 ha pasado a un segundo lugar, tenemos el dengue, la crisis migratoria y las ciudades inundadas que hoy están afectando a muchas familias”, añadió.

La Defensa Civil entregó víveres, colchas, colchonetas, entre otros productos de primera necesidad para las familias que lo perdieron todo en el desastre. También se sumaron empresas del sector privado como Cáritas Madre de Dios y la Sociedad Peruana de Derecho Ambiental (SPDA), con donativos como canastas de víveres.

Más en Exitosa","Sat, 20 Feb 2021 08:00:00 GMT",https://exitosanoticias.pe/v1/wp-content/uploads/2021/02/inundaciones-en-Madre-de-Dios.jpg,"['inundaciones', 'por', 'viviendas', 'el', 'ríos', 'afectaron', 'en', 'desbordes', 'tras', 'dios', 'las', 'para', 'la', 'madre', '1380', 'y', 'que']", 
34,34,FL-2021-000019-PER,Avenidas de Talara quedan inundadas tras más de 12 horas de lluvia LRND - LaRepública.pe,https://larepublica.pe/sociedad/2021/03/09/avenidas-de-talara-quedan-inundadas-tras-mas-de-12-horas-de-lluvia-lrnd/,"Una lluvia que se prolongó por más de 12 horas se registró en la ciudad de Talara, en Piura, y causó la inundación de las principales avenidas de esta provincia y el colapso de algunas casas. Esta problemática ocasionó malestar en los ciudadanos, especialmente en transportistas y moradores.

Según reportaron los talareños, el lunes 8 de marzo la fuerte precipitación comenzó desde las 7.00 p. m., de manera ininterrumpida, hasta la mañana del día siguiente, con mayor intensidad en Pariñas, Máncora, Órganos, Lobitos, La Brea y El alto.

El Servicio Nacional de Meteorología e Hidrología del Perú (Senamhi), a través de su aviso meteorológico N.º 44 (nivel rojo), anunció precipitaciones de fuerte intensidad en Piura y otras regiones del norte del Perú.

Por otro lado, las fuertes lluvias ocasionaron la crecida inesperada del caudal el río Serrán, exactamente en el kilómetro 52 de la Vía Buenos Aires-Canchaque, lo que generó que los vehículos que intentaban cruzar hacia la sierra piurana quedaran varados.","Tue, 09 Mar 2021 08:00:00 GMT",https://larepublica.pe/resizer/tcU0DXGyLp0YrBjI9oDefBRIEI8=/1200x660/top/cloudfront-us-east-1.images.arcpublishing.com/gruporepublica/AY4JUB66IZFPDARWV6ZEL77FR4.jpg,"['quedan', 'del', 'tras', 'la', 'avenidas', 'lrnd', 'piura', 'se', 'los', 'lluvia', 'en', 'talara', 'más', 'y', 'que', 'el', 'inundadas', '12', 'las', 'horas']", 
35,35,FL-2021-000019-PER,"Tras inundaciones, niveles de ríos en Madre de Dios siguen bajando - LaRepública.pe",https://larepublica.pe/sociedad/2021/02/26/tras-inundaciones-niveles-de-rios-en-madre-de-dios-siguen-bajando/,"Luego de la devastación que causaron los desbordes de los ríos de Madre de Dios, equipos técnicos determinaron que hay una disminución considerable de los caudales de estos durante las últimas 48 horas.

Así lo determinaron especialistas del Servicio Nacional de Meteorología e Hidrología del Perú (Senamhi), Autoridad Nacional del Agua (ANA) y el Centro de Operaciones de Emergencia Regional (COER) del Gobierno Regional de Madre de Dios sumaron esfuerzos para la medición cuántica del caudal del rio Madre de Dios y un monitoreo de los factores climatológicos que azotaron a la región .

El aforamiento en el Río Madre de Dios, según los especialistas que realizaron el trabajo hídrico, mediante el equipo hidrológico denominado SONAR, incluyó cuatro repeticiones del río en ambas márgenes del caudal.

Esta medición fue efectuada con la finalidad de determinar el caudal instantáneo del río Madre de Dios.

El resultado del estudio de estas instituciones reportó que el caudal promedio es de 10.575,76 m³/S (metros cúbicos por segundo), a diferencia de los 22.719,59 m³/S que alcanzó la semana pasada.

Por otro lado, la distribución de ayuda humanitaria sigue llegando a las zonas más alejadas de la región amazónica.

El primer balance del Ejecutivo dio cuenta de que al menos 14.000 personas fueron afectadas por las inundaciones que se suscitaron luego de las fuertes lluvias que se registraron en la región, según precisó el ministro de Ambiente, Gabriel Quijandría.

El desastre afectó a diez de los 11 distritos de la región, por lo que el Gobierno emitió un decreto supremo a fin de declarar en emergencia a Madre de Dios por 60 días.","Thu, 25 Feb 2021 08:00:00 GMT",https://larepublica.pe/resizer/FnmGzHVDsAPziMX2w3rAusfTC3A=/1200x660/top/cloudfront-us-east-1.images.arcpublishing.com/gruporepublica/VXY2A5GBZFGDVDICYH3HJEJTBY.jpg,"['inundaciones', 'región', 'por', 'el', 'ríos', 'en', 'del', 'tras', 'dios', 'las', 'la', 'siguen', 'madre', 'los', 'niveles', 'que', 'bajando']", 
36,36,FL-2021-000019-PER,Hawái: todas las islas están bajo alerta de fuertes inundaciones y evacúan una localidad de emergencia | FOTOS - El Comercio Perú,https://elcomercio.pe/mundo/eeuu/estados-unidos-hawai-todas-las-islas-estan-bajo-alerta-de-fuertes-inundaciones-y-evacuan-una-localidad-de-emergencia-haleiwa-oahu-usa-eeuu-fotos-nndc-noticia/,"5 de 7

El Servicio Nacional de Meteorología reportó 33,5 centímetros de lluvias en la zona de Haiku, en la costa norte de Maui, entre las 7 de la mañana y las 3 de la tarde del lunes. Maui y todas las islas hawaianas están bajo alerta de inundaciones repentinas en medio de fuertes aguaceros que se prevé duren hasta la mañana del miércoles. (Texto: AP / Foto: Reuters).","Tue, 09 Mar 2021 08:00:00 GMT",https://elcomercio.pe/resizer/33Gp-HvYztmlzP44wuJnZAKvN68=/980x528/smart/filters:format(jpeg):quality(75)/cloudfront-us-east-1.images.arcpublishing.com/elcomercio/UTLFVCYDWBCPDJGVIBJTAHIIY4.jpg,"['inundaciones', 'todas', 'localidad', 'maui', 'mañana', 'zona', 'en', 'fotos', 'del', 'las', 'la', 'y', 'una', 'texto', 'hawái', 'islas', 'fuertes']", 
37,37,FL-2021-000019-PER,Madre de Dios: Un colegio se convierte en el hogar de cien familias que perdieron sus casas por la inundación [VIDEO] - RPP Noticias,https://rpp.pe/peru/madre-de-dios/madre-de-dios-un-colegio-se-convierte-en-el-hogar-de-cien-familias-que-perdieron-sus-casas-por-la-inundacion-video-noticia-1322356,"Adultos y niños deben formar una fila para recibir su ración de alimentos en el colegio Faustino Maldonado, donde fueron llevados tras la inundación de sus viviendas. | Fuente: Facebook | Fotógrafo: Dirección Regional Agricultura de Madre de Dios

La Institución Educativa Faustino Maldonado de la ciudad de Puerto Maldonado, región Madre de Dios, se ha convertido en el hogar de un aproximado de cién familias, cuyas viviendas quedaron bajo el agua debido a la inundación de los sectores de Pueblo Viejo y La Unión.

Las aulas de este colegio ahora son dormitorios para niños, adultos y ancianos. Mientras que en el patio forman largas filas para recibir su ración de alimentos.

Mirian Guerra, una de las damnificadas, contó que hace muchos años que no vivían algo similar. “La situación es algo que no esperábamos, esta inundación ha regresado después de muchos años. Mi vivienda está inundada, mis cosas están flotando, mis artefactos no sirven”.

Ella dijo que para evitar que esta situación se repita el Estado se comprometió a reubicar a las familias en una zona más segura, que no sea tan fácil de inundarse.

“Ayer hemos conversado con el ministro del Ambiente, Gabriel Quijandría, para una reubicación. Somos más de mil familias en total. Se que muchos hemos crecido aquí y tenemos cariño, pero estamos dispuestos a irnos a otro lado. Ellos (las autoridades) ya se han comprometido a hacerlo”, dijo.



Una de las damnificadas por el desborde de los ríos descansa apoyada en una baranda junto a la poca ropa que pudo llevar consigo el día de la inundación. | Fuente: Facebook | Fotógrafo: Dirección Regional de Agricultura de Madre de Dios

Mirian Guerra, que ahora pasa sus días en el centro educativo, agradeció a las autoridades por darles un lugar en donde puedan dormir y comer junto a sus familiares.

“Gracias a la directora del colegio, al director regional de Educación y al gobernador por abrir las puertas para que nos alberguen”, indicó.

La Dirección Regional de Agricultura informó, a través de sus redes sociales, que dichas familias (400 personas) de Pueblo Viejo son albergadas en 36 aulas de esta institución y que les entregaron mascarillas, útiles de aseo e insumos para la desinfección.

Defensa Civil de Madre de Dios entregó víveres para una olla común, colchonetas, mosquiteros y sábanas. También se instaló un tópico para evaluar la salud de los albergados.

Mientras tanto a la I. E. Huerto Infantil, fueron llevados 30 personas, entre niños y adolescentes del Centro de Acogida Residencial Básico ""Virgen Peregrina "" del INABIF, ubicado en Las Piedras, que también se inundó.

El colegio Faustino Maldonado de la región de Madre de Dios luce así; con ropa secando en sus barandas, familias durmiendo en sus aulas y ollas comunes en sus patios. | Fuente: RPP | Fotógrafo: José Huamaní

Newsletter Todo sobre el coronavirus



La COVID-19 ha puesto en alerta a todos. Suscríbete a nuestro newsletter Todo sobre el coronavirus, donde encontrarás los datos diarios más relevantes del país y del mundo sobre el avance del virus y la lucha contra su propagación.

NUESTROS PODCAST

¿Qué debemos tener en cuenta al momento de leer el plan de gobierno de los candidatos presidenciales a pocas semanas de las elecciones 2021? Especialistas consultados para El Poder En Tus Manos nos comentan a qué debemos prestar atención para entender estos documentos.","Mon, 22 Feb 2021 08:00:00 GMT",https://e.rpp-noticias.io/large/2021/02/22/481248_1061754.jpg,"['por', 'video', 'el', 'en', 'se', 'del', 'las', 'perdieron', 'la', 'para', 'madre', 'hogar', 'y', 'sus', 'que', 'inundación']", 
38,38,FL-2021-000019-PER,Piura: Una familia construye muros por temor a posible desborde del río - RPP Noticias,https://rpp.pe/peru/piura/piura-una-familia-construye-muros-por-temor-a-posible-desborde-del-rio-noticia-1324933,"La señora Rosa Coronado y su familia han optado por medidas de prevención en su vivienda y no ser afectados por las lluvias. | Fuente: RPP Noticias | Fotógrafo: Vanesa Jiménez

La familia Coronado More levantó muros de contención en algunas puertas y portones de su vivienda, en el distrito de Castilla, de la provincia de Piura, región del mismo nombre, por temor a un posible desborde del río Piura debido a las fuertes lluvias que se registran y a la paralización de obras de las defensas ribereñas.

La señora Rosa Coronado recordó a RPP Noticias que el desborde del río Piura del 2017 los sorprendió en horas de la madrugada y no pudieron retirar su vehículo ni otros enseres. Por eso, decidieron ""anticiparse"" y construir muros de contención de concreto para evitar que el agua entre a su casa en caso se registre una inundación.

“Tuvimos problemas porque el agua de las lluvias entró en la casa (en 2017). En las partes principales solo llegó a 10 centímetros, pero en la cochera si malogró el carro. Por eso, esta vez hemos tomado esas medidas de prevención”, señaló.

La ciudadana pidió a las autoridades una solución y agilizar la construcción de las defensas ribereñas que, según comentó, se encuentran con un 40% de avance.

En Castilla, otras personas dueños de locales cercanos a la ribera del río han empezado a colocar sacos de arena como medida de prevención ante un posible desborde del río Piura a causa de las fuertes lluvias.

El último viernes, cinco grúas que realizaban trabajos, fueron cubiertas por el agua debido al aumento del caudal del río por las lluvias. A esto se le suma que los trabajos tampoco se han podido reanudar debido a las precipitaciones en la región Piura.

Las autoridades han colocado geobolsas y geomembranas para intentar evitar que el agua siga afectando el avance de la obra.

De esta forma los vecinos de , en Piura, protegen sus viviendas de las inundaciones que puedan afectarlos por la intensas lluvias. | Fuente: RPP | Fotógrafo: Vanesa Jiménez.

NUESTROS PODCAST

""Espacio vital"": Estudios en Sudáfrica probaron que la vacuna contra la Covid-19 de Novavax no es eficaz contra la variante del virus descubierto en dicho país. ¿Todas las vacunas desarrolladas han presentado los mismos resultados?","Tue, 09 Mar 2021 08:00:00 GMT",https://e.rpp-noticias.io/large/2021/03/08/203120_1067267.jpg,"['por', 'temor', 'posible', 'el', 'muros', 'piura', 'en', 'se', 'del', 'familia', 'las', 'la', 'y', 'una', 'río', 'desborde', 'su', 'que']", 
39,39,FL-2021-000019-PER,Ingemmet: lluvias en la costa y sierra norte del país ponen en alerta a 115 zonas críticas - Diario Perú21,https://peru21.pe/peru/ingemmet-lluvias-en-la-costa-y-sierra-norte-del-pais-ponen-en-alerta-a-115-zonas-criticas-nnpp-noticia/,"Un total de 115 zonas críticas son las que se encuentran en alerta ante los deslizamientos, huaicos e inundaciones que podrían producirse como consecuencia de las constantes precipitaciones pluviales que se registran en la costa y sierra norte del país. Dicha información fue emitida por el Instituto Geológico, Minero y Metalúrgico (Ingemmet) mediante sus redes sociales.

La información, según se indicó, es en base al aviso meteorológico 044 del Servicio Nacional de Meteorología e Hidrología del Perú (Senamhi) cuya vigencia es del 07 al 09 de marzo del 2021.

El #Ingemmet informa que 115 zonas críticas se encuentran en alerta, por deslizamientos, huaicos e inundaciones, debido a las precipitaciones pluviales que se están registrando en la costa y sierra norte del país.



🗞 Nota de prensa 👉 https://t.co/FGgrd0FF9e pic.twitter.com/Mt5Nx4obge — INGEMMET (@IngemmetPeru) March 9, 2021

Ante ello, el Ingemmet generó la alerta 033/2021 donde se han identificado 115 zonas críticas por movimientos en masa e inundaciones que podrían afectar a la población y sus viviendas.

Estas zonas críticas se encuentran en distintas regiones del país, como por ejemplo, en Cajamarca existen 70; otras 7 en La Libertad (7); mientras que en Lambayeque hay 11. En la región Piura se han identificado 20 y 7 en Tumbes.

El Ingemmet también señaló que existe un aproximado de 71,587 habitantes que podrían ser perjudicados y 15,525 posibles viviendas afectadas.

Por ello, dejó en claro que es importante que las autoridades regionales y locales tomen acción y adviertan a los pobladores sobre estas posibles emergencias.

VIDEO RECOMENDADO

El gremio de transporte interprovincial anunció un paro para el 16 de marzo. Un total de 10 000 buses y 100 000 camiones paralizarán sus servicios a nivel nacional. (Fuente: América TV)

TE PUEDE INTERESAR","Tue, 09 Mar 2021 08:00:00 GMT",https://peru21.pe/resizer/eolRNjU-4yJh-iyAe-wqrYV0NxU=/980x528/smart/filters:format(jpeg):quality(75)/cloudfront-us-east-1.images.arcpublishing.com/elcomercio/NXMLSBKNFNFBNPXGW3AUG5Y5EI.jfif,"['por', 'norte', 'en', 'lluvias', 'se', 'del', 'ingemmet', 'las', 'ponen', 'la', 'y', 'zonas', 'país', 'sierra', 'que']", 
