,ID,event_id,article_title,article_link,article_content,publishing_date,article_image,article_keywords,article_relevance
0,0,FL-2021-000019-PER,Perú declara emergencia por inundaciones en Madre de Dios - BNamericas,https://www.bnamericas.com/es/noticias/peru-declara-emergencia-por-inundaciones-en-region-madre-de-dios,"El Gobierno peruano declaró estado de emergencia por un período de 60 días en la Región Madre de Dios luego de graves inundaciones que hasta el lunes habían causado daños a infraestructura y obligado a 15.000 personas a abandonar sus hogares.

Unas 1.500 viviendas quedaron inundadas sin electricidad ni agua, mientras que 3.000ha de terrenos agrícolas se vieron afectadas, según el Ministerio del Ambiente.

El titular de la cartera, Gabriel Quijandría, señaló que el Ejército llevaría ayuda humanitaria a la zona, según la agencia estatal de noticias Andina.

DAÑO A INFRAESTRUCTURA

Las intensas lluvias, que provocaron el desborde de varios ríos, dejaron 13 carreteras inundadas, 17 puentes dañados y otros 3 inutilizados.

Adem[as, 22 escuelas se vieron afectadas por el temporal y 14 fueron declarados no aptas para uso. También se informó que 11 centros de salud se vieron afectados por el desborde de los ríos.



","Mon, 22 Feb 2021 08:00:00 GMT",https://cdnimg.bnamericas.com/roLAyAVLujvWtNhsAQDTKAHZZfgpVsbsrCHcPvoaJsTpmTqOhqZdCaYQKhHeuuzY.jfif,"['por', 'perú', 'inundaciones', 'el', 'vieron', 'inundadas', 'ríos', 'declara', 'en', 'se', 'dios', 'según', 'la', 'madre', 'emergencia', 'y', 'que']", 
1,1,FL-2021-000019-PER,"LLuvias e inundaciones en la Amazonia peruana, miles de damnificados",https://www.bnamericas.com/es/noticias/peru-declara-emergencia-por-inundaciones-en-region-madre-de-dios,"Diversas regiones amazónicas son escenario en estos días de decenas de desastres naturales a causa de las lluvias que están afectando a la región, con serias consecuencias para la población local.

Ciudad del Vaticano



Fuertes lluvias están afectando a la selva amazónica peruana en los últimos días, especialmente en el sur del país andino, poniendo en serio riesgo a la población local. Así lo informa el Centro Amazónico de Antropología y Aplicación Práctica, CAAAP, indicando que las regiones “Madre de Dios, Ucayali, Amazonas, Cusco y también la selva de Huánuco vienen enfrentando inundaciones, huaicos y derrumbes, dejando no sólo a miles de damnificados que sufren la pérdida de sus viviendas, animales y chacras; sino también muertos y personas desaparecidas”.

Según refiere el CAAAP, en Madre de Dios, las autoridades ordenaron ayer la evacuación de la población que vive en las zonas aledañas a las riberas de los ríos Tambopata y Madre de Dios, luego de que se registrara el nivel 8 de alerta del río Madre de Dios. Las principales zonas afectadas se encuentran en el distrito de Tambopata, en el mismo Puerto Maldonado. Especialmente delicada es la situación en el distrito de Laberinto en donde la crecida del río Inambari inundó también varias viviendas de la comunidad nativa Boca Inambari, entre otras comunidades afectadas, además de la capital del distrito.

Perdidas de viviendas y de vidas

En similar situación se encuentran las localidades de Quillabamba, Huánuco, Ucayali, Amazonas, La Convención, donde se señalan episodios dramáticos desde hace dos semanas, con pérdida de viviendas, chacras, electricidad, destrucción de puentes e interrupciones de carreteras. En la ciudad de Quillabamba, la caída de un huaico el lunes pasado dejó al menos dos muertos y ocho desaparecidos, según reportó la Agencia Andina. Por su parte, la Oficina de Gestión del Riesgo de Desastres del Municipalidad Distrital de Yanajanca (Huánuco), señala que hasta el momento se reportan 38 personas damnificadas.",2021-02-25 00:00:00,https://www.vaticannews.va/content/dam/vaticannews/multimedia/2021/02/19/La-convencion-en-Cusco.jpg/_jcr_content/renditions/cq5dam.thumbnail.cropped.1500.844.jpeg,"['inundaciones', 'viviendas', 'el', 'en', 'lluvias', 'damnificados', 'amazonia', 'del', 'se', 'las', 'peruana', 'la', 'y', 'madre', 'miles', 'que']", 
2,2,FL-2021-000019-PER,Gobierno decreta estado de emergencia en Madre de Dios debido a inundaciones,https://www.bnamericas.com/es/noticias/peru-declara-emergencia-por-inundaciones-en-region-madre-de-dios,"El Poder Ejecutivo, a través del Decreto Supremo N° 030-2021-PCM, declaró el estado de emergencia en el departamento de Madre de Dios debido a las intensas precipitaciones pluviales que inundaron 1.380 viviendas.

Minutos antes, el gobernador regional, Luis Hidalgo, se pronunció a través de Facebook sobre el desborde de los ríos y pidió al Ejecutivo enviar apoyo humanitario para las familias.

“Apoyamos a los damnificados en Madre de Dios, sin embargo, todo este trabajo nos resulta insuficiente, es por ello que hemos hecho un llamado al Ejecutivo, primero para una declaratoria de estado de emergencia, situación que al parecer ya esta siendo atendida y el día de hoy debe determinarse, esto nos va a permitir mover presupuestos para apoyar a todos aquellos que hoy han perdido sus viviendas, bienes, animales y cultivos”, comentó Hidalgo.

“Esta crisis sumado al tema del COVID-19 ha pasado a un segundo lugar, tenemos el dengue, la crisis migratoria y las ciudades inundadas que hoy están afectando a muchas familias”, añadió.

Daños en la región

La Dirección de Vivienda, Construcción y Saneamiento de Madre de Dios, reportó también 1.071 casas sin servicio de agua y otras 751 sin energía eléctrica. Los distritos afectados son Inambari, Tambopata, Laberinto, Las Piedras (provincia de Tambopata), Tahuamanu, Iberia (Tahuamanu), Madre de Dios, Huepetuhe y Fitzcarrald (Manu).

Como parte de las actividades de rescate, las personas afectadas son trasladadas por los habitantes de la zona en botes, hacia centros educativos habilitados como refugios temporales.

Autoridades solicitan ayuda logística para poder atender a todos los damnificados (Foto: Municipalidad de Tambopata)

Ayuda

Por otra lado, Hidalgo destacó que hay varias iniciativas de ayuda por personas e instituciones solidarias, quienes han iniciado la campaña “Unidos en Solidaridad” liderada por Caritas Madre de Dios y con el apoyo de la Iglesia Católica.

Asimismo, Defensa Civil entregó víveres, colchas, colchonetas, entre otros productos de primera necesidad a las familias afectadas que ya se encuentran instaladas en los colegios.

Finalmente, el Centro de Operaciones de Emergencia Regional (COER) de Madre de Dios, se pronunció y reportó que la inundación actual supera a la ocurrida el pasado enero del 2014.

Conforme a los criterios de Saber más

VIDEO RECOMENDADO

Malhechores viralizan la violencia, alardean de su poder criminal. Según la Policía Nacional, las bandas extranjeras estarían intentando mantener el control de diferentes zonas. (Fuente: América TV)

TE PUEDE INTERESAR















",2021-02-20 22:43:11-05:00,https://elcomercio.pe/resizer/ItoR1kh518mBBUfpRzb3ceDO6N8=/980x528/smart/filters:format(jpeg):quality(75)/cloudfront-us-east-1.images.arcpublishing.com/elcomercio/VWUJPZBKNBHUNDE7GIL3BP5VNQ.jpg,"['inundaciones', 'por', 'el', 'estado', 'en', 'dios', 'las', 'la', 'madre', 'emergencia', 'y', 'los', 'decreta', 'gobierno', 'que', 'debido']", 
3,3,FL-2021-000019-PER,Madre de Dios: Intensas lluvias y desbordes de ríos inundan varios sectores de la región,https://www.bnamericas.com/es/noticias/peru-declara-emergencia-por-inundaciones-en-region-madre-de-dios,"Muchas viviendas resultados afectadas con las intensas lluvias que se registran en Madre de Dios. | Fuente: RPP Noticias | Fotógrafo: Cortesía

Decenas de viviendas, predios agrícolas y vías intransitables en los sectores La Pastora, El Triunfo y Barrionuevo de la provincia de Tambopata, así como inundaciones en los distritos de Madre de Dios y Laberinto, fueron las afectaciones que se registraron por las intensas lluvias presentadas en la región Madre de Dios.

Ante esta situación, el director regional de Defensa Civil, Edgar Cáceres Gallegos, informó que el Gobierno Regional de Madre de Dios solicitará la declaratoria de emergencia debido a las intensas lluvias, las cuales a la fecha han afectado a más de 600 personas, según indicó.

“Ir a evaluar en estas condiciones, no se puede ingresar hasta los lugares donde efectivamente están algunas de las familias (…). Lamentablemente no son muy alentadores los pronósticos que nos alcanza Senamhi, por lo menos hoy día todo el departamento está en esta condición”, detalló.

Cáceres Gallegos agregó que, debido a estas lluvias que se registran desde hace 3 días, se produjo el incremento y desborde de los ríos Madre de Dios, Tahuamanu y el de Inambari; lo cual afectó a las viviendas de las zonas ubicadas en la ribera.

Por el momento las familias que resultaron damnificadas están albergadas en colegios de la ciudad de Puerto Maldonado donde reciben ayuda humanitaria.

En tanto, las autoridades regionales pidieron a los alcaldes entregar la data respectiva de las familias afectadas y así poder determinar las acciones a seguir.

Newsletter Todo sobre el coronavirus

La COVID-19 ha puesto en alerta a todos. Suscríbete a nuestro newsletter Todo sobre el coronavirus, donde encontrarás los datos diarios más relevantes del país y del mundo sobre el avance del virus y la lucha contra su propagación.

Así lucen las calles de los diferentes sectores que se inundaron por las lluvias que se registran desde hace tres días. | Fuente: RPP Noticias | Fotógrafo: Cortesía",2021-02-19 15:43:06-05:00,https://e.rpp-noticias.io/large/2021/02/19/044604_1060720.jpg,"['senamhi', 'región', 'el', 'ríos', 'en', 'lluvias', 'se', 'sectores', 'las', 'provocan', 'la', 'y', 'madre', 'los', 'que', 'varios']", 
4,4,FL-2021-000019-PER,Inundaciones por desborde de ríos en Madre de Dios dejan 2000 afectados,https://www.bnamericas.com/es/noticias/peru-declara-emergencia-por-inundaciones-en-region-madre-de-dios,"Señaló que se han comunicado con las municipalidades de Madre de Dios para que envíen su evaluación de daños y análisis de necesidades. En tanto, se ha proporcionado víveres, colchonetas, calaminas, artículos de primera necesidad a los damnificados.





Ante esa situación, el gobernador regional de Madre de Dios, Luis Hidalgo, solicitó al Gobierno central la declaratoria de emergencia para poder movilizar los recursos.





Por su parte, el director regional de Agricultura, Alfredo Herrera, manifestó que el agro ha sido uno de los sectores más afectados, en especial las familias que se asientan en las proximidades de las riberas de los ríos y las quebradas.





Dijo que alrededor de 2,000 hectáreas de cultivos de arroz, maíz, plátano, yuca, cacao, cítricos y otros de las provincias de Tahuamanu y Tambopata se han perdido.





El funcionario indicó que se coordina con el Ministerio de Desarrollo Agrario y Riego para activar el apoyo inmediato del seguro agrario catastrófico.



",,https://portal.andina.pe/EDPfotografia3/Thumbnail/2021/02/19/000751080W.jpg,"['por', 'inundaciones', 'regional', 'se', 'dios', 'dejan', '2000', 'los', 'su', 'en', 'afectados', 'para', 'y', 'que', 'el', 'ríos', 'las', 'madre', 'desborde']", 
5,5,FL-2021-000019-PER,Lluvias en Perú: ¿Cuál es la situación de las regiones afectadas por inundaciones y desbordes de ríos? - RPP Noticias,https://rpp.pe/peru/actualidad/lluvias-en-peru-cual-es-la-situacion-de-las-regiones-afectadas-por-inundaciones-y-desbordes-de-rios-lambayeque-piura-tumbes-cajamara-huanuco-junin-noticia-1325302,"En el distrito de Íllimo algunas viviendas de la zona urbana se vieron severamente afectadas por las lluvias. | Fuente: RPP Noticias | Fotógrafo: Abraham Ibáñez

Es época de lluvias en el Perú moderadas e intensas, de ríos cargados y centros poblados y ciudades afectadas. En la última semana, hay afectaciones en diferentes regiones del país, familias damnificadas, cultivos dañados y pérdida de ganado.

Según el último aviso del Servicio Nacional de Metereología e Hidrología (Senamhi), entre el miércoles y el jueves se esperan lluvias moderadas, principalmente en la costa norte, pero también en la sierra centro y sur. Además, de lluvias en la selva norte.

Pero no solo eso, también hay advertencia en las zonas de la sierra centro y norte, y selva alta norte que, al presentar ""suelos saturados"" debido a las lluvias en el Perú registradas en los últimos días, hay posibilidad de activación de quebradas.

Según el Centro Nacional de Estimación, Prevención y Reducción del Riesgo de Desastres (CENEPRED), las regiones de la sierra con riesgo alto son Áncash, Cajamarca, Huancavelica, Huánuco, Junín, La Libertad, Lima y Pasco. Mientras que las de la selva son Huánuco, Pasco, Puno y San Martín.

En esta nota, haremos un repaso de los daños que están ocurriendo en las diversas regiones del país.

Lambayeque

Las intensas lluvias registradas en la zona altoandina y costera de la región Lambayeque han ocasionado un incremento en el caudal de los ríos de los diferentes valles de la región.

En el distrito de Chongoyape, debido al aumento del caudal, el tránsito por la carretera Chiclayo - Chota (Cajamarca) se encuentra limitado. Con un cargador frontal, la Municipalidad Distrital de Chongoyape apoyó el pase de pobladores con urgencias médicas por el tramo de la quebrada Juana Ríos.

En el distrito de Oyotún (provincia de Chiclayo), más de 600 familias de siete caseríos empezaron a recibir ayuda humanitaria luego de quedar aisladas por el incremento del caudal del río Zaña, que arrastró el puente artesanal Sorronto.

En declaraciones a RPP Noticias, la subprefecta distrital, Juana Mendoza, dijo que se gestiona la colocación de un puente provisional para que la población pueda trasladarse sin problemas, debido a que la siguiente vía de comunicación se encuentra a 5 kilómetros de distancia, en el distrito de Nueva Arica. Debido a esto, los vecinos se tuvieron que trasladar en cámaras inflables.

Además, en el sector San Miguel - Vista Alegre, tres viviendas se vieron afectadas por la activación de la quebrada Esperanza, la cual trajo piedras y lodo que ingresó a las casas y arrasó con algunos cultivos y animales. También se afectaron hectáreas de cultivo de arroz.

En tanto, en el valle La Leche, los distritos de Túcume, Pacora e Íllimo han reportado inundaciones en la parte urbana. En algunos casos, el agua ha ingresado a las viviendas y negocios, por lo que se ha pedido el apoyo de motobombas.

En Íllimo, 150 comerciantes del mercado perdieron sus productos tras una lluvia que cayó por 12 horas. Los vendedores tuvieron que salir del estadio donde funcionada un mercado temporal desde hace seis meses para vender en la calle.

Cultivos de arroz terminaron cubiertos con el agua de la lluvia que cayó sobre el distrito de Oyotún. | Fuente: RPP Noticias | Fotógrafo: Leonardo Muñoz

Agricultores arriesgan sus vidas al trasladar sus productos porque no hay transitabilidad y se están perdiendo cultivos. | Fuente: RPP Noticias | Fotógrafo: Eder Maza

Piura: Lluvias con niveles superiores a los 50 milímetros

En Piura, las lluvias van dejando más de 7 mil personas afectadas y 1 878 damnificadas, según el último reporte del Instituto Nacional de Defensa Civil.

Las cifras indican que 626 viviendas quedaron destruidas y otras 2 mil 429 afectadas debido a las precipitaciones. También se registraron daños en 4 instituciones educativas, 12 centros de salud y 10 mil 760 metros de carreteras.

Por su parte, el Senamhi informó que las lluvias en Piura alcanzaron niveles superiores a los 50 milímetros por hora, principalmente en las provincias de Huancabamba y Sullana.

En el centro poblado de Malingas, distrito de Tambogrande, provincia de Piura, más de 300 parcelas donde se cosecha limón y cacao están en riesgo de perderse por las lluvias, según alcaldesa de Malingas, Jesús María García, quien indicó que los agricultores no están trasladando sus productos porque no hay transitabilidad y se están perdiendo sus cultivos.

""Sino le hallamos solución al problema, los agricultores no van a poder vender sus productos y van a tener una pérdida económica. Lo que tenemos que resolver es no paralizar la transitabilidad de los agricultores. Mientras ellos tengan una buena vía via y transitable, ellos van a poder mover sus poructos. Si no la tienen, pierden"", dijo la alcaldesa.

Las lluvias produjeron varios desbordes del río Jequetepeque y causaron daños en carreteras y puentes. | Fuente: RPP Noticias | Fotógrafo: Municipalidad Distrital de Yonán

Cajamarca

En la región Cajamarca, los distritos de Namora y Matara (provincia de Cajamarca), Oxamarca (Celendín), además de San Marcos, Cajabamba y San Ignacio se encuentran con alerta roja durante 24 horas por la amenaza de desbordes debido a las precipitaciones, informó Defensa Civil.

Jorge Torres, director del área de Defensa Nacional del Gobierno Regional de Cajamarca, informó que las lluvias produjeron varios desbordes del río Jequetepeque y causaron daños en carreteras y puentes.

Además, se reportaron familias afectadas por el desborde de quebradas en el distrito de Yonán, perteneciente a la provincia de Contumazá.

Con la ayuda de una motobomba evacuaron las aguas de lluvia estancadas en el centro de salud de Zarumilla. | Fuente: RPP Noticias

Tumbes

Unas 150 familias del asentamiento humano Corazón Valiente en la provincia de Zarumilla resultaron afectados con las inundaciones tras las lluvias registradas en los últimos días así lo informó Víctor La Matta Vidarte, subprefecto de dicha provincia.

El funcionario visitó las zonas afectadas donde la población pide la ayuda para evacuar las aguas estancadas que a la vez son un foco infeccioso para la proliferación de los zancudos y temen contraer el dengue.

Además, las intensas lluvias de la noche del último lunes y la madrugada del martes dejaron más de 120 viviendas afectadas en el barrio Bellavista, informó Mic Zárate Espinoza, subgerente de Defensa Civil de la Municipalidad Provincial de Tumbes. En la zona, se registra también el colapso del sistema de drenaje y el afloramiento de las aguas servidas poniendo en riesgo la salud pública, denunciaron los vecinos.

Asimismo, el personal de Defensa Civil acudió con motobombas para evacuar las aguas en el establecimiento de salud de Zarumilla, el cual resultó también inundado.

Frente a la crítica situación, las autoridades locales reunidas en el Centro de Operaciones de Emergencia Regional (COER), solicitaron la declaratoria de emergencia tras reportarse que el desborde del río Tumbes arrasó con 700 hectáreas de sembríos de arroz y plátano.

Subprefecto visitó las zonas afectadas donde la población pide la ayuda para evacuar las aguas estancadas que son un foco infeccioso para la proliferación del dengue. | Fuente: RPP Noticias

Personal de salud tuvo que retirar el agua de lluvia que ingreso a los consultorios. | Fuente: RPP Noticias

Junín



Pero no solo las lluvias en el Perú afectan al norte. En Junín, el centro de Salud de Auquimarca, distrito de Chilca, provincia de Huancayo, región Junín, reportó una inundación en el área de estacionamiento. Y el mismo personal de salud tuvo que usar sus mandiles para secar el agua.

Inés Chávez Soto, representante de los trabajadores, contó que la lluvia también daño medicamentos, un mueble del área de Psicología y equipos de protección.

La técnica en enfermería refirió que no es la primera vez que las lluvias afectan el centro de salud. Por ello, el último viernes cursaron documentos a representantes de la Red de Salud del Valle del Mantaro, pero, señaló, no fueron atendidos.

Hasta este lugar llegaron representantes de Defensa Civil, de la Red de Salud y el gobernador de Junín, Fernando Orihuela Rojas, quien tras realizar la inspección de los ambientes, se comprometió a destinar presupuesto para el mantenimiento.

Población cruza el río desafiando la corriente pues el puente peatonal fue afectado en el distrito de Mariano Dámaso Beraun de Huánuco. | Fuente: RPP Noticias

Huánuco: Huaico destruye viviendas y puente

Al menos nueve viviendas fueron destruidas y un puente peatonal fue afectado en el distrito de Mariano Dámaso Beraun, provincia de Leoncio Prado, región Huánuco, según el reporte de la Dirección Regional de Defensa Civil.

“Las fuertes lluvias han activado una quebrada y ha rebalsado todo, los pobladores han perdido sus casas y todas sus cosas”, señaló Carlos Zabaleta de la Cruz, secretario técnico de la Municipalidad Provincial de Leoncio Prado (región Huánuco).

Así también, casi un kilómetro de la trocha carrozable que comunica a la localidad de Tambillo fue destruido. Y en la zona, el sistema de agua potable también resultó afectado.

Carlos Zabaleta contó que el huaico arrastró a una persona unos 50 metros, aunque luego, afortunadamente, fue rescatada.

Las familias damnificadas fueron evacuadas y las municipalidades de Mariano Dámaso Beraun y de Leoncio Prado les entregaron ayuda humanitaria.

También se destruyó casi un kilómetro de la trocha carrozable que comunica a la localidad de Tambillo. | Fuente: RPP Noticias

NUESTROS PODCAST

Más de un millón de especies se encuentran en peligro de extinción y en un par de décadas habrá consecuencias irreparables en el medio ambiente a nivel mundial. ¿Cómo afecta al Perú este tema? ¿Qué efectos negativos traerá el cambio climático en nuestro país? Descúbralo en el siguiente podcast.","Wed, 10 Mar 2021 08:00:00 GMT",https://e.rpp-noticias.io/large/2021/03/10/quebrada-maningas-1068380mp4_1068381.png,"['por', 'perú', 'el', 'ríos', 'piura', 'lluvias', 'en', 'del', 'se', 'las', 'la', 'regiones', 'y', 'situación', 'los', 'tumbes', 'que']", 
6,6,FL-2021-000019-PER,Emergencia en Perú: 15.000 personas evacuadas por graves inundaciones - AS,https://as.com/videos/2021/02/24/actualidad/1614180494_309747.html,"PERÚ

Situación de emergencia en la región peruana Madre de Dios. Las fuertes lluvias torrenciales han hecho estragos en esta reserva natural de la amazonía peruana. Más de 15.000 personas han tenido que ser desplazadas. Se ha tenido que proceder al rescate de animales que habitaban en las granjas. Más de 1.500 personas siguen sin luz ni agua.","Wed, 24 Feb 2021 08:00:00 GMT",https://as01.epimg.net/videos/imagenes/2021/02/24/actualidad/1614180494_309747_1614180855_noticia_normal.jpg,"['por', 'perú', 'inundaciones', 'evacuadas', 'en', 'personas', 'tenido', 'graves', 'han', 'más', 'las', 'peruana', 'la', 'emergencia', 'torrenciales', 'que', '15000']", 
