ID,event_id,article_title,article_link,article_content,publishing_date,article_image,article_keywords,article_relevance,category
239,FL-2020-000182-CHN,长江委专家解读今年长江汛情 - 新华网,http://www.xinhuanet.com/2020-07/20/c_1126263036.htm,"图集

新华社武汉7月20日电（记者李思远）“长江2020年第2号洪水”正在演进发展。与“1号洪水”相比，这次上游洪水来势更猛，中下游面临的防汛形势也更复杂。水利部长江水利委员会20日召开新闻通气会，就目前长江汛情和水旱灾害防御的焦点问题进行解析。水利专家表示，主汛期以来，长江流域降雨与常年同期相比明显偏多，降雨量排名1961年以来第1位。但由于早期底水较低、洪水调度科学等原因，目前长江中下游的洪水小于1998年。

据长江委介绍，进入主汛期以来，长江流域降雨出现由少转多的转折变化，与常年同期相比明显偏多。统计数据显示，6月1日至7月17日，长江流域降雨量较同期偏多4成，排名1961年以来第1位。其中，长江中下游降雨量较同期偏多6成，排名1961年以来第1位。尤其是7月上旬，长江中下游旬降水量较同期均值偏多1.6倍，与7月整月历年平均雨量相当，较1998年同期偏多2.3倍；鄱阳湖水系旬雨量较同期均值偏多3.1倍，较7月历年均值偏多6成，较1998年同期偏多7.5倍。

长江委水旱灾害防御局局长胡向阳说，降雨还呈现过程频繁、强度大、持续时间长、雨区重叠度高的特点。6月1日以来，长江流域共发生9次明显降雨过程，而且基本无间歇，直接导致长江流域发生超警以上洪水涉及河流多、分布范围广。共计226站发生超警戒以上洪水，涉及河流143条，其中超警戒水位171站，超保证水位29站，超历史水位26站。

据介绍，长江中下游干流及两湖出口控制站水位主汛期迅速上升，普遍迎来9米至11米的涨幅。但整体上看，2020年长江中下游洪水、中下游干流水位均低于1998年，局部地区比如鄱阳湖湖区及尾闾水位超过了1998年。

值得注意的是，洪水期间，水利部门联合调度长江流域控制性水库群拦洪削峰、充分运用洲滩民垸行洪，有效减轻了洪水影响。比如在“1号洪水”发生发展时，三峡水库连“踩”5次“刹车”，下泄流量从3.5万立方米/秒降至1.9万立方米/秒，最大削峰率为34%；在刚刚发生的“2号洪水”现峰时，最大削峰率为46%。

长江委表示，截至目前，长江中下游的洪水小于1998年，但并不意味着就可以放松警惕。长江流域即将进入“七下八上”的关键期，特别是今年西太平洋副热带高压整体偏弱，位置也不稳定，流域水雨情还在演变发展，具有很大不确定性。结合目前已发生的汛情及后期预测分析，初步判断，长江流域的汛情仍可能进一步发展，未来防洪形势依然严峻，需要高度重视流域汛情的实时变化，加强汛情的滚动预报预警，进一步强化流域防洪工程和非工程防御措施综合运用。

另据水文气象部门初步分析，7月下旬，长江上游、汉江及中游干流附近仍将有强降雨过程，上述地区降雨量将较常年同期偏多2成左右。8月份，长江上游干流偏北地区降雨偏多，可能会出现局地洪涝或山洪灾害现象。

相关链接：

报告！我是长江2号洪水","Mon, 20 Jul 2020 07:00:00 GMT",,"['图集新华社武汉7月20日电记者李思远长江2020年第2号洪水正在演进发展与1号洪水相比这次上游洪水来势更猛中下游面临的防汛形势也更复杂水利部长江水利委员会20日召开新闻通气会就目前长江汛情和水旱灾害防御的焦点问题进行解析水利专家表示主汛期以来长江流域降雨与常年同期相比明显偏多降雨量排名1961年以来第1位但由于早期底水较低洪水调度科学等原因目前长江中下游的洪水小于1998年据长江委介绍进入主汛期以来长江流域降雨出现由少转多的转折变化与常年同期相比明显偏多统计数据显示6月1日至7月17日长江流域降雨量较同期偏多4成排名1961年以来第1位其中长江中下游降雨量较同期偏多6成排名1961年以来第1位尤其是7月上旬长江中下游旬降水量较同期均值偏多16倍与7月整月历年平均雨量相当较1998年同期偏多23倍鄱阳湖水系旬雨量较同期均值偏多31倍较7月历年均值偏多6成较1998年同期偏多75倍长江委水旱灾害防御局局长胡向阳说降雨还呈现过程频繁强度大持续时间长雨区重叠度高的特点6月1日以来长江流域共发生9次明显降雨过程而且基本无间歇直接导致长江流域发生超警以上洪水涉及河流多分布范围广共计226站发生超警戒以上洪水涉及河流143条其中超警戒水位171站超保证水位29站超历史水位26站据介绍长江中下游干流及两湖出口控制站水位主汛期迅速上升普遍迎来9米至11米的涨幅但整体上看2020年长江中下游洪水中下游干流水位均低于1998年局部地区比如鄱阳湖湖区及尾闾水位超过了1998年值得注意的是洪水期间水利部门联合调度长江流域控制性水库群拦洪削峰充分运用洲滩民垸行洪有效减轻了洪水影响比如在1号洪水发生发展时三峡水库连踩5次刹车下泄流量从35万立方米秒降至19万立方米秒最大削峰率为34在刚刚发生的2号洪水现峰时最大削峰率为46长江委表示截至目前长江中下游的洪水小于1998年但并不意味着就可以放松警惕长江流域即将进入七下八上的关键期特别是今年西太平洋副热带高压整体偏弱位置也不稳定流域水雨情还在演变发展具有很大不确定性结合目前已发生的汛情及后期预测分析初步判断长江流域的汛情仍可能进一步发展未来防洪形势依然严峻需要高度重视流域汛情的实时变化加强汛情的滚动预报预警进一步强化流域防洪工程和非工程防御措施综合运用另据水文气象部门初步分析7月下旬长江上游汉江及中游干流附近仍将有强降雨过程上述地区降雨量将较常年同期偏多2成左右8月份长江上游干流偏北地区降雨偏多可能会出现局地洪涝或山洪灾害现象相关链接报告我是长江2号洪水', '长江委专家解读今年长江汛情新华网']", ,none
240,FL-2020-000182-CHN,众志成城抗击1号洪水 - 新华网,http://www.xinhuanet.com/local/2020-07/07/c_1126203816.htm,"图集

记者探访长江防汛重点区域 众志成城 抗击1号洪水

受近期强降雨影响，长江2020年第1号洪水7月2日在上游形成。鉴于当前长江流域的汛情，长江水利委员会自7月4日12时起将长江水旱灾害防御Ⅳ级应急响应提升至Ⅲ级。长江水利委员会水文局7月6日15时继续发布洪水黄色预警，提请长江中下游干流沿线、洞庭湖湖区、鄱阳湖湖区、水阳江等地有关单位和公众注意防范。

长江流域大型水利枢纽、重点堤防水库等如何积极应对汛情挑战？记者近日在三峡大坝和洞庭湖湖区、鄱阳湖湖区等长江流域防汛重点区域进行了采访。

7月6日，受暴雨影响，安徽省宣城市宁国市胡乐老街被洪水淹没，16名群众被困。其中一名老人腿部有伤，无法行走，受现场条件所限，消防救援人员跨过围墙，小心翼翼地将老人从家中转移到皮划艇。历时5个小时，所有受困群众均被转移到临时安置点。丁怡婷 丁 亚摄影报道

三峡大坝——

拦洪削峰，缓解下游压力

每年汛期都是三峡集团流域枢纽管理中心水库部、长江电力梯级调度中心最为忙碌的时期，今年6月长江流域入汛以来，极端降雨事件频发，区域性暴雨洪水重于常年，长江上游乌江流域2020年第1号洪水早在6月下旬就已形成。

7月1日早上6点，长江电力梯调中心气象预报值班员李波用冷水洗了把脸，便急匆匆从值班公寓走向办公楼，开启了新一天的气象会商。值班周期内，预报员基本一周不能回家，早上6点半进入工作状态，一直持续到晚上10点，用他们的话说：“整个汛期想的、念的都是流量、雨量。”

在正式上班前，王祥和水文预报同事已经开始了子流域的流量预报、内部会商讨论。随后，来不及休息调整，他们与水文气象部门开展了当天的第一轮会商，讨论洪水过程、峰现时间、具体量级。在7、8月主汛期，谁也不敢掉以轻心。

当晚8点，据预测，夜间乌江、三峡区间东段将出现大雨。晚9点，长江电力梯调中心水文预报团队全体人员紧急与水文气象部门开展了第二轮会商，确定7月2日将形成洪峰为5.3万立方米每秒的洪水，并编制出洪水调度方案。

根据长江委调度令、调度方案，调度值班人员必须要回答两道防洪度汛专业题：一道题是根据出库流量和机组过流能力，计算出大坝泄水量；另一道题是综合考虑各深孔的运行条件，选择合适的深孔及方式进行泄洪。经过测算和校核，梯调中心调度台最终下达三峡大坝6号、8号深孔闸门开启指令。

本轮洪水，三峡水库最大拦蓄量为1.8万立方米每秒，拦蓄水量近16亿立方米。

洞庭湖——

精密监测，助力防汛决策

进入主汛期以来，作为湖南岳阳城陵矶水文站城陵矶（七里山）断面负责人，张民肩上的担子重了不少。

洞庭湖对长江中游水量起着巨大的调蓄作用，长江水在荆江段从松滋、太平、藕池、调弦四口分泄入洞庭，再从城陵矶口回到长江，这一吞一吐之间，就可削峰平洪。因此，城陵矶入长江口水的流速流量，是上下游防汛决策的重要依据。

“以前水位稳定、水流平缓时，每两到三天测一次流速。”但5月28日以来，长江和洞庭湖水位进入快速上涨期，一个月左右的时间，江湖水位已经上涨了9米多，现在每天至少要测一次。

在仪器的指引下，船沿着固定的断面，从这头跑到对岸，再折返回来，各测一次。张民认真地收集数据。“两项数据的精度差，要在2%以内。”张民告诉记者，长江水利委员会水文局会密切跟踪数据的采集，要是数据没有按点送达，水文局预报中心就会来电询问情况，海事、沿线及上下游防洪调度部门也等着数据做决策参考。

7月6日的数据同5日相比，几乎没变化——19700立方米每秒，但站点监测到洞庭湖水位已超警戒水位0.43米，且还在继续上涨，说明长江的顶托作用在持续。在洪峰逐渐靠近之际，张民收集的数据将提示防汛部门绷紧神经，守护好人民群众的生命财产安全。

目前，为了更好地掌握汛期洞庭湖来水情况，长江水利委员会水文中游局岳阳分局加大了监测力度，原来一些只需巡测无需人员常驻的水文站，都派了人24小时值守。留在城陵矶的人员一下子减少10多个，每人的排班都是满满当当，张民索性和几名同事住在分局里，全天候待命，“这里走两步就到监测点，哪怕半夜有突发情况，提着电脑就能赶过去。”

鄱阳湖——

昼夜巡堤，力保万无一失

暴雨叠加，江湖并涨。全揽长江江西段152公里岸线和鄱阳湖近2/3水域面积的九江市，防汛压力不小。7月6日深夜两点，鄱阳湖湖口水文站水位涨至19.50米，与警戒水位持平，达到洪水编号标准。依据相关规定，鄱阳湖2020年第1号洪水形成。

看到手机中弹出的即时快报，正在鄱阳湖大堤上摸黑查险的周楠不由得心中一紧。周楠是江西九江湖口县水利局干部，自7月1日以来，他已在距鄱阳湖湖口仅300多米的双钟堤上坚守了6个昼夜。

“宁可‘十防九空’，也要万无一失，确保江湖两‘全’是我们的使命。”周楠深一脚浅一脚地踩在泥泞中，对每一处隐患点都查得格外仔细，全长1.38公里的巡检路线，走一趟下来近两个小时，这样的巡查，每天昼夜各两次。

7月3日上午10点左右，周楠在例行巡堤时突遇险情，双钟堤背水面出现3处大小不一的渗水点，浊流喷涌而出。若不及时处理，细沙随水带出后将掏空堤脚，引发堤坝下陷，甚至出现溃口。

封堵管涌，事不宜迟。周楠迅速上报险情，并制定了应急抢险方案。20多名工人和3辆满载粗砂、碎石的卡车第一时间抵达现场。在周楠的指挥下，工人们先在渗水点底层铺设了宽约1米、长约5米、厚度达20厘米的粗砂，而后又分别铺设了两层大小不一的碎石。两个多小时后，险情就被初步控制。

九江市濂溪区和湖口县共有39公里长江岸线和62公里鄱阳湖岸线，是此次应对长江1号洪水的重点区域。7月3日18时，江西省防汛抗旱指挥部启动防汛Ⅳ级应急响应。截至目前，九江市濂溪区和湖口县共计安排1300余人驻堤开展巡查，740余人的应急抢险队已进入24小时待命状态，防汛物资仓库储备草袋3万条、编织袋35万条、编织布17万平方米，各类防汛物资价值320万元。（记者 范昊天 申智林 戴林峰）","Tue, 07 Jul 2020 07:00:00 GMT",,"['丁', '抗击1号洪水新华网', '范昊天', '戴林峰', '图集记者探访长江防汛重点区域', '申智林', '抗击1号洪水受近期强降雨影响长江2020年第1号洪水7月2日在上游形成鉴于当前长江流域的汛情长江水利委员会自7月4日12时起将长江水旱灾害防御ⅳ级应急响应提升至ⅲ级长江水利委员会水文局7月6日15时继续发布洪水黄色预警提请长江中下游干流沿线洞庭湖湖区鄱阳湖湖区水阳江等地有关单位和公众注意防范长江流域大型水利枢纽重点堤防水库等如何积极应对汛情挑战记者近日在三峡大坝和洞庭湖湖区鄱阳湖湖区等长江流域防汛重点区域进行了采访7月6日受暴雨影响安徽省宣城市宁国市胡乐老街被洪水淹没16名群众被困其中一名老人腿部有伤无法行走受现场条件所限消防救援人员跨过围墙小心翼翼地将老人从家中转移到皮划艇历时5个小时所有受困群众均被转移到临时安置点丁怡婷', '亚摄影报道三峡大坝拦洪削峰缓解下游压力每年汛期都是三峡集团流域枢纽管理中心水库部长江电力梯级调度中心最为忙碌的时期今年6月长江流域入汛以来极端降雨事件频发区域性暴雨洪水重于常年长江上游乌江流域2020年第1号洪水早在6月下旬就已形成7月1日早上6点长江电力梯调中心气象预报值班员李波用冷水洗了把脸便急匆匆从值班公寓走向办公楼开启了新一天的气象会商值班周期内预报员基本一周不能回家早上6点半进入工作状态一直持续到晚上10点用他们的话说整个汛期想的念的都是流量雨量在正式上班前王祥和水文预报同事已经开始了子流域的流量预报内部会商讨论随后来不及休息调整他们与水文气象部门开展了当天的第一轮会商讨论洪水过程峰现时间具体量级在78月主汛期谁也不敢掉以轻心当晚8点据预测夜间乌江三峡区间东段将出现大雨晚9点长江电力梯调中心水文预报团队全体人员紧急与水文气象部门开展了第二轮会商确定7月2日将形成洪峰为53万立方米每秒的洪水并编制出洪水调度方案根据长江委调度令调度方案调度值班人员必须要回答两道防洪度汛专业题一道题是根据出库流量和机组过流能力计算出大坝泄水量另一道题是综合考虑各深孔的运行条件选择合适的深孔及方式进行泄洪经过测算和校核梯调中心调度台最终下达三峡大坝6号8号深孔闸门开启指令本轮洪水三峡水库最大拦蓄量为18万立方米每秒拦蓄水量近16亿立方米洞庭湖精密监测助力防汛决策进入主汛期以来作为湖南岳阳城陵矶水文站城陵矶七里山断面负责人张民肩上的担子重了不少洞庭湖对长江中游水量起着巨大的调蓄作用长江水在荆江段从松滋太平藕池调弦四口分泄入洞庭再从城陵矶口回到长江这一吞一吐之间就可削峰平洪因此城陵矶入长江口水的流速流量是上下游防汛决策的重要依据以前水位稳定水流平缓时每两到三天测一次流速但5月28日以来长江和洞庭湖水位进入快速上涨期一个月左右的时间江湖水位已经上涨了9米多现在每天至少要测一次在仪器的指引下船沿着固定的断面从这头跑到对岸再折返回来各测一次张民认真地收集数据两项数据的精度差要在2以内张民告诉记者长江水利委员会水文局会密切跟踪数据的采集要是数据没有按点送达水文局预报中心就会来电询问情况海事沿线及上下游防洪调度部门也等着数据做决策参考7月6日的数据同5日相比几乎没变化19700立方米每秒但站点监测到洞庭湖水位已超警戒水位043米且还在继续上涨说明长江的顶托作用在持续在洪峰逐渐靠近之际张民收集的数据将提示防汛部门绷紧神经守护好人民群众的生命财产安全目前为了更好地掌握汛期洞庭湖来水情况长江水利委员会水文中游局岳阳分局加大了监测力度原来一些只需巡测无需人员常驻的水文站都派了人24小时值守留在城陵矶的人员一下子减少10多个每人的排班都是满满当当张民索性和几名同事住在分局里全天候待命这里走两步就到监测点哪怕半夜有突发情况提着电脑就能赶过去鄱阳湖昼夜巡堤力保万无一失暴雨叠加江湖并涨全揽长江江西段152公里岸线和鄱阳湖近23水域面积的九江市防汛压力不小7月6日深夜两点鄱阳湖湖口水文站水位涨至1950米与警戒水位持平达到洪水编号标准依据相关规定鄱阳湖2020年第1号洪水形成看到手机中弹出的即时快报正在鄱阳湖大堤上摸黑查险的周楠不由得心中一紧周楠是江西九江湖口县水利局干部自7月1日以来他已在距鄱阳湖湖口仅300多米的双钟堤上坚守了6个昼夜宁可十防九空也要万无一失确保江湖两全是我们的使命周楠深一脚浅一脚地踩在泥泞中对每一处隐患点都查得格外仔细全长138公里的巡检路线走一趟下来近两个小时这样的巡查每天昼夜各两次7月3日上午10点左右周楠在例行巡堤时突遇险情双钟堤背水面出现3处大小不一的渗水点浊流喷涌而出若不及时处理细沙随水带出后将掏空堤脚引发堤坝下陷甚至出现溃口封堵管涌事不宜迟周楠迅速上报险情并制定了应急抢险方案20多名工人和3辆满载粗砂碎石的卡车第一时间抵达现场在周楠的指挥下工人们先在渗水点底层铺设了宽约1米长约5米厚度达20厘米的粗砂而后又分别铺设了两层大小不一的碎石两个多小时后险情就被初步控制九江市濂溪区和湖口县共有39公里长江岸线和62公里鄱阳湖岸线是此次应对长江1号洪水的重点区域7月3日18时江西省防汛抗旱指挥部启动防汛ⅳ级应急响应截至目前九江市濂溪区和湖口县共计安排1300余人驻堤开展巡查740余人的应急抢险队已进入24小时待命状态防汛物资仓库储备草袋3万条编织袋35万条编织布17万平方米各类防汛物资价值320万元记者', '众志成城']", ,none
