ID,event_id,article_title,article_link,article_content,publishing_date,article_image,article_keywords,article_relevance,category
74,FL-2017-000062-TWN,西藏江达县遭强降雨大货车被冲走高楼倒塌江中 - 新浪网,https://news.sina.com.cn/c/nd/2017-07-10/doc-ifyhwefp0350644.shtml,"原标题：西藏昌都江达县遭强降雨 大货车被冲走 整栋高楼倒塌江中

连日来，西藏东部的昌都市境内普降大雨，持续时间较长，部分时段和地区甚至暴雨，导致河水猛涨，其中江达县一栋居民楼垮塌，河边一辆大货车被冲走，多处国道乡道中断。

在灾情比较严重的江达县，流经县城的字曲河因强降雨上涨迅猛，7月8日，河边的五层楼房，地基被洪水掏空出现垮塌。好在，在出现险情之前，江达县已提前疏散了楼内居民，没有人员伤亡。

一辆停放在河岸的东风大货车，因河岸被洪水冲垮而掉进洪水里，好在当时车上没有司乘人员。记者今天从江达县了解到，从6月开始持续下雨，这几天更是出现强降雨，今天降雨已停。目前从江达县到昌都市区的国道317已经抢通，但是全县还有67条农村公路57.8公里被冲毁，24座桥梁受损。目前正在抢通中。强降雨还导致部分电线杆损毁，部分乡村停电，现在电力正在抢修中。

面对灾情，昌都市委、市政府高度重视、非常关心，要求卡若区、江达、类乌齐高度重视，第一时间组织全县干部职工、驻地部队、群众开展抗洪抢险工作，对沿河居住的居民和有地质灾害隐患地带的人员第一时间进行疏散安置，保证群众和住户的人身安全，安排部署各乡（镇）开展好洪水监测和地质灾害排查工作，对出现的灾害第一时间开展自救工作。

江达县地图

昌都市水利局党组书记副局长：发现灾情比较大，隐患比较严重的我们都派了专人蹲守观察，发现问题及时组织群众安全撤离。

责任编辑：刘光博","Mon, 10 Jul 2017 07:00:00 GMT",http://n.sinaimg.cn/news/crawl/20170710/flgZ-fyhwret0477746.jpg,"['大货车被冲走高楼倒塌江中', '整栋高楼倒塌江中连日来西藏东部的昌都市境内普降大雨持续时间较长部分时段和地区甚至暴雨导致河水猛涨其中江达县一栋居民楼垮塌河边一辆大货车被冲走多处国道乡道中断在灾情比较严重的江达县流经县城的字曲河因强降雨上涨迅猛7月8日河边的五层楼房地基被洪水掏空出现垮塌好在在出现险情之前江达县已提前疏散了楼内居民没有人员伤亡一辆停放在河岸的东风大货车因河岸被洪水冲垮而掉进洪水里好在当时车上没有司乘人员记者今天从江达县了解到从6月开始持续下雨这几天更是出现强降雨今天降雨已停目前从江达县到昌都市区的国道317已经抢通但是全县还有67条农村公路578公里被冲毁24座桥梁受损目前正在抢通中强降雨还导致部分电线杆损毁部分乡村停电现在电力正在抢修中面对灾情昌都市委市政府高度重视非常关心要求卡若区江达类乌齐高度重视第一时间组织全县干部职工驻地部队群众开展抗洪抢险工作对沿河居住的居民和有地质灾害隐患地带的人员第一时间进行疏散安置保证群众和住户的人身安全安排部署各乡镇开展好洪水监测和地质灾害排查工作对出现的灾害第一时间开展自救工作江达县地图昌都市水利局党组书记副局长发现灾情比较大隐患比较严重的我们都派了专人蹲守观察发现问题及时组织群众安全撤离责任编辑刘光博', '西藏江达县遭强降雨', '大货车被冲走', '原标题西藏昌都江达县遭强降雨']", ,flood
75,FL-2017-000062-TWN,吉林暴雨永吉遭洪水淹城|吉林|洪水|淹城 - 新浪网,http://news.sina.com.cn/o/2017-07-14/doc-ifyiaewh9159142.shtml,"民房被淹在洪水中 苍雁 摄

中新网吉林7月14日电 题：吉林暴雨 永吉遭洪水淹城

中新网记者 苍雁

7月14日，60岁的刘德满拎着铁锹在自家的屋里向外清淤。他指着墙上一条尚未消失的水痕告诉中新网记者：洪水来时，几乎将整个房间淹没。

“洪水是从山上下来的，突然之间就冲进院子了。我爬上房顶，看整个社区里都是水，房子全淹没了。”刘德满说，在其他居民的帮助下，他们转移了行动不便的老人和孩子。

全力救援 朱柳 摄

7月13日夜至14日凌晨，吉林省中部地区普降大暴雨，此轮降水最大点降雨量发生在永吉县春登站。

暴雨在13日晚引发特大洪水灾害，导致永吉县全域全方位受灾，道路桥梁中断，农作物受损严重。据官方初步统计，全县受灾人口26万人，倒损房屋2970户7500余间。截至14日12时，全县已转移人口7.5万人。

14日早8时，记者前往永吉灾区。在接近县政府中心附近的巴虎村，大量民居被洪水淹没。有村民企图靠近自家民宅，无奈大水仍未消退，村民只好站在河堤上。

全力救援 朱柳 摄

所有民用车辆已被禁止进入县城。记者徒步前往途中，所见商铺的一层大多遭洪水袭击，一些商家拿着工具正自行清淤。街边有两辆车被洪水冲击已经叠在一起。整个县城内大型机械车辆不停运转，多部门联合进行灾后工作。

位于县城商圈的几家金店店员说，在洪水中丢失大量金饰品。“都被大水冲走了，还有一些玉器。”

全力救援 苍雁 摄

“受灾最严重的就是河北社区，几乎所有的房屋都被冲毁了。”刚刚从河北社区蹒跚而下的居民吕巍告诉记者，从山上突然奔流而下的洪水将河北社区变成一片汪洋。

“回家看看，家里的大门已经塌了，墙也塌一半。水还很大，根本过不去。”刚刚回家查看情况的邵健说，当晚21时，接到撤离的通知后，他和邻居们纷纷赶到临时在永吉十中设立的安置点。

位于北山脚下的河北社区，大部分房屋已经倒塌、破损，路上遍及瓦砾石块，湍急的河水仍从断裂的路面上流过，夹裹着树枝等杂物。

至14日上午，洪水仍未完全消退。 苍雁 摄

夏淑春是没能被及时疏散的村民之一。“晚上7点多水就进院了，我爬到院里的大树上，待到半夜12点。”夏淑春一家两口，丈夫在长春打工，发生洪灾时，家里只有她一个人。“后来我从树上跳到房顶，直到凌晨四点多，才从房顶下来。”由于停水停电，网络不通，夏淑春仍未能和丈夫取得联系。

截至记者发稿时，降水过程已停止，永吉地区积水水位逐渐下降，官方组织的抢险救援正在展开。(完)","Fri, 14 Jul 2017 07:00:00 GMT",http://n.sinaimg.cn/translate/20170714/_3Sd-fyiavtv6737042.jpg,"['摄夏淑春是没能被及时疏散的村民之一晚上7点多水就进院了我爬到院里的大树上待到半夜12点夏淑春一家两口丈夫在长春打工发生洪灾时家里只有她一个人后来我从树上跳到房顶直到凌晨四点多才从房顶下来由于停水停电网络不通夏淑春仍未能和丈夫取得联系截至记者发稿时降水过程已停止永吉地区积水水位逐渐下降官方组织的抢险救援正在展开完', '永吉遭洪水淹城', '吉林暴雨', '苍雁7月14日60岁的刘德满拎着铁锹在自家的屋里向外清淤他指着墙上一条尚未消失的水痕告诉中新网记者洪水来时几乎将整个房间淹没洪水是从山上下来的突然之间就冲进院子了我爬上房顶看整个社区里都是水房子全淹没了刘德满说在其他居民的帮助下他们转移了行动不便的老人和孩子全力救援', '民房被淹在洪水中', '朱柳', '苍雁', '摄受灾最严重的就是河北社区几乎所有的房屋都被冲毁了刚刚从河北社区蹒跚而下的居民吕巍告诉记者从山上突然奔流而下的洪水将河北社区变成一片汪洋回家看看家里的大门已经塌了墙也塌一半水还很大根本过不去刚刚回家查看情况的邵健说当晚21时接到撤离的通知后他和邻居们纷纷赶到临时在永吉十中设立的安置点位于北山脚下的河北社区大部分房屋已经倒塌破损路上遍及瓦砾石块湍急的河水仍从断裂的路面上流过夹裹着树枝等杂物至14日上午洪水仍未完全消退', '题吉林暴雨', '摄中新网吉林7月14日电', '摄所有民用车辆已被禁止进入县城记者徒步前往途中所见商铺的一层大多遭洪水袭击一些商家拿着工具正自行清淤街边有两辆车被洪水冲击已经叠在一起整个县城内大型机械车辆不停运转多部门联合进行灾后工作位于县城商圈的几家金店店员说在洪水中丢失大量金饰品都被大水冲走了还有一些玉器全力救援', '永吉遭洪水淹城中新网记者']", ,flood
76,FL-2017-000062-TWN,榆林洪灾百年一遇县城防洪标准偏低-新华网 - 新华网,http://news.xinhuanet.com/politics/2017-08/03/c_1121423254.htm,"图集

2017年7月28日，子洲县三川口镇，镇中心的集市里一片泥泞，一位小女孩在泥水中趟水而行。摄影/记者 彭子洋

7月28日，决口后的清水沟水库。记者 高敏 摄

2017年7月28日，子洲县三川口镇，一户人家在屋檐下摆了十二个器皿接雨水。摄影/记者 彭子洋

2017年7月28日，子洲县三川口镇，经营鞋店的常女士价值15万的鞋子在洪灾那晚被水淹了过半。摄影/记者 彭子洋

7月26日洪灾过后，陕西省榆林市子洲县城淤泥堆积，一片狼藉。

子洲县水务局是积水最严重的地方之一，一楼办公室的设施和文件都被泥浆灌注，直到8月1日仍未清理完毕。

一场从7月25日晚持续到26日凌晨的特大暴雨，侵袭了陕西省榆林市绥德县、子洲县多个县区。大暴雨引发黄河中游右岸一级支流无定河、无定河支流大理河的超历史洪水，洪水被当地官方定为百年一遇级别。

据了解，大理河绥德站7月26日5时5分洪峰流量3160立方米每秒，超过1960年有实测资料以来的最大流量2450立方米每秒。

子洲县城遭遇洪灾后，供水水源清水沟水库在7月26日凌晨发生漫溢，于当日13时50分决口。

陕西省防汛抗旱总指挥部（下称陕西省防办）总工程师陈文军告诉新京报记者，突发暴雨强度大，加上子洲和绥德两县防洪标准偏低，尤其是发生决口的清水沟水库其实主要用于抽水蓄水，没有溢洪道，“严格讲不具备水库的调洪功能。”

洪灾之后

7月30日中午，天已经放晴，记者来到子洲县城二道街。灾后卫生防疫工作已经开始。临街的商铺主人，一边忙着从店中铲出泥水倾倒，一边在门外用已近乎泥浆的水勉强清洗店内物品。

自来水公司的净化水管道在7月26日凌晨因洪水损坏，造成停水。之后，县城居民的饮用水主要来自购买和社会各界捐助的矿泉水。从26日下午开始，居民前往救援物资发放点，便可领取矿泉水和生活用水。

每天从9:30至17:00，45辆送水车在全县人口比较集中的33个供水点供水，送水车容量为每车10吨，送完水后，前往40分钟车程外的米脂县取水。

目前两县城区已分别有多个物资发放点。每到吃饭时间，城中居民随意走到一处吃饭的点，便有人招呼来吃碗热乎的饭菜或面条。

年轻女孩杨雪（化名）在一家宾馆做前台，最近一直靠矿泉水生活，爱美的她已经5天没有好好洗脸，至多掬一把清水随意洗洗。洗漱用过的水，还得留着继续冲马桶。

开小饭馆的李玉梅夫妇，居住的地下室在洪灾当天被淹透了，用水泵抽水三天，又雇了七八个人用水桶将污泥一桶桶提出后，才算做好初步清理。

居民韩静（化名）每天在单位救灾、清理淤泥，只能靠周边邻居在中午送水时帮忙接两桶，而家中也还在停电，她家住在12层，每天需等待丈夫回来之后提上楼去，“现在最大的困难是没水，每天在单位救灾，却连自己家里都救不了。”

子洲县仅有两家县级医院，县医院遭遇洪灾后，一楼的医疗设备全部损坏，陷入瘫痪，7月26日中午，县医院70多名病人全部转入子洲县中医院。目前，共有150张床位的中医院，在病房和楼道都加了床，将原来的旧床和50张陪护椅，全部拿来“临时凑合”，才够安置283名病人。

中医院用水依然短缺。医院原有的两口自备井每天可提供15吨用水，其余依靠拉水车每天送来的30至40吨水，医院只得分时段供水、尽量节约，“尽量不洗脸，不洗衣服，以保证医疗用水。”院长张嘎告诉记者，他自己从26日洪灾开始，直到8月1日才第一次洗了脸，洗脸水是前几日下雨时用水桶接的雨水。

7月25日晚，张嘎模仿电视中用钢架绑着石块防洪的办法，就地取材，与三十几名员工一起找来隔壁水果店30个方形塑料水果篮，里面装满砖块，将被褥铺在下面，包好装着砖块的水果篮，一个一个叠起来，筑起了一道1.5米高的“人造防洪堤”，共用了200多条被褥。

决口的清水沟水库旁，张家寨村村民张顺利的水泥预制场被夷为平地。厂里的楼板或被推入河中，或被折断，一台东风牌大车、两辆拖拉机、三台搅拌机……机器全部毁坏，另有5间作住宿和办公用的彩钢房、一间砖砌的灶房和一间库房，全部夷为平地。

“人安全就好，其他不想了。”回想起来，洪水时三个工人都站在自己的身边，他觉得特别庆幸。

这几天，他在帮全村统计损失，写成材料上报。村里为三四百名无家可归的灾民办起了就餐点，他还自己上阵，和其他六七位村民一起做了厨师。

榆林市民政局统计，截至2017年7月29日20时，洪涝灾害共造成该市9个县区405486人受灾，其中紧急转移安置人口84542人（含紧急避险），因灾死亡12人失踪1人，其中绥德6人、子洲6人、子洲失踪1人；因灾倒塌房屋514户1092间，严重损坏房屋2398户7121间，一般损坏房屋4519户12299间，直接经济损失约47.33亿元。","Thu, 03 Aug 2017 07:00:00 GMT",,"['高敏', '彭子洋2017年7月28日子洲县三川口镇经营鞋店的常女士价值15万的鞋子在洪灾那晚被水淹了过半摄影记者', '图集2017年7月28日子洲县三川口镇镇中心的集市里一片泥泞一位小女孩在泥水中趟水而行摄影记者', '彭子洋7月28日决口后的清水沟水库记者', '摄2017年7月28日子洲县三川口镇一户人家在屋檐下摆了十二个器皿接雨水摄影记者', '榆林洪灾百年一遇', '彭子洋7月26日洪灾过后陕西省榆林市子洲县城淤泥堆积一片狼藉子洲县水务局是积水最严重的地方之一一楼办公室的设施和文件都被泥浆灌注直到8月1日仍未清理完毕一场从7月25日晚持续到26日凌晨的特大暴雨侵袭了陕西省榆林市绥德县子洲县多个县区大暴雨引发黄河中游右岸一级支流无定河无定河支流大理河的超历史洪水洪水被当地官方定为百年一遇级别据了解大理河绥德站7月26日5时5分洪峰流量3160立方米每秒超过1960年有实测资料以来的最大流量2450立方米每秒子洲县城遭遇洪灾后供水水源清水沟水库在7月26日凌晨发生漫溢于当日13时50分决口陕西省防汛抗旱总指挥部下称陕西省防办总工程师陈文军告诉新京报记者突发暴雨强度大加上子洲和绥德两县防洪标准偏低尤其是发生决口的清水沟水库其实主要用于抽水蓄水没有溢洪道严格讲不具备水库的调洪功能洪灾之后7月30日中午天已经放晴记者来到子洲县城二道街灾后卫生防疫工作已经开始临街的商铺主人一边忙着从店中铲出泥水倾倒一边在门外用已近乎泥浆的水勉强清洗店内物品自来水公司的净化水管道在7月26日凌晨因洪水损坏造成停水之后县城居民的饮用水主要来自购买和社会各界捐助的矿泉水从26日下午开始居民前往救援物资发放点便可领取矿泉水和生活用水每天从930至170045辆送水车在全县人口比较集中的33个供水点供水送水车容量为每车10吨送完水后前往40分钟车程外的米脂县取水目前两县城区已分别有多个物资发放点每到吃饭时间城中居民随意走到一处吃饭的点便有人招呼来吃碗热乎的饭菜或面条年轻女孩杨雪化名在一家宾馆做前台最近一直靠矿泉水生活爱美的她已经5天没有好好洗脸至多掬一把清水随意洗洗洗漱用过的水还得留着继续冲马桶开小饭馆的李玉梅夫妇居住的地下室在洪灾当天被淹透了用水泵抽水三天又雇了七八个人用水桶将污泥一桶桶提出后才算做好初步清理居民韩静化名每天在单位救灾清理淤泥只能靠周边邻居在中午送水时帮忙接两桶而家中也还在停电她家住在12层每天需等待丈夫回来之后提上楼去现在最大的困难是没水每天在单位救灾却连自己家里都救不了子洲县仅有两家县级医院县医院遭遇洪灾后一楼的医疗设备全部损坏陷入瘫痪7月26日中午县医院70多名病人全部转入子洲县中医院目前共有150张床位的中医院在病房和楼道都加了床将原来的旧床和50张陪护椅全部拿来临时凑合才够安置283名病人中医院用水依然短缺医院原有的两口自备井每天可提供15吨用水其余依靠拉水车每天送来的30至40吨水医院只得分时段供水尽量节约尽量不洗脸不洗衣服以保证医疗用水院长张嘎告诉记者他自己从26日洪灾开始直到8月1日才第一次洗了脸洗脸水是前几日下雨时用水桶接的雨水7月25日晚张嘎模仿电视中用钢架绑着石块防洪的办法就地取材与三十几名员工一起找来隔壁水果店30个方形塑料水果篮里面装满砖块将被褥铺在下面包好装着砖块的水果篮一个一个叠起来筑起了一道15米高的人造防洪堤共用了200多条被褥决口的清水沟水库旁张家寨村村民张顺利的水泥预制场被夷为平地厂里的楼板或被推入河中或被折断一台东风牌大车两辆拖拉机三台搅拌机机器全部毁坏另有5间作住宿和办公用的彩钢房一间砖砌的灶房和一间库房全部夷为平地人安全就好其他不想了回想起来洪水时三个工人都站在自己的身边他觉得特别庆幸这几天他在帮全村统计损失写成材料上报村里为三四百名无家可归的灾民办起了就餐点他还自己上阵和其他六七位村民一起做了厨师榆林市民政局统计截至2017年7月29日20时洪涝灾害共造成该市9个县区405486人受灾其中紧急转移安置人口84542人含紧急避险因灾死亡12人失踪1人其中绥德6人子洲6人子洲失踪1人因灾倒塌房屋514户1092间严重损坏房屋2398户7121间一般损坏房屋4519户12299间直接经济损失约4733亿元', '县城防洪标准偏低新华网']", ,none
77,FL-2017-000062-TWN,欧洲百余年来防洪卓有成效--人民网环保频道 - 人民网,http://env.people.com.cn/n1/2018/0606/c1010-30040689.html,"科技日报北京6月5日电 （记者张梦然）根据英国《自然・通讯》杂志近日发表的一项环境学研究，自1870年以来，洪水淹没面积和受灾人数在整个欧洲都有所增加，但相关的经济损失和死亡人数有所下降。

洪灾是威胁人类生存的十大自然灾害之一，除了给农业带来重大损失外，还会造成工业以及人类生命财产的损失。

此次，荷兰代尔夫特理工大学科学家多梅尼克・帕珀洛特尼及其同事，利用了欧洲自然灾害历史分析数据库对洪灾进行深入分析，该库涵盖了1870年至2016年的全部数据。他们检查了自1870年以来的1564次洪水事件及其对生命和财产的影响，发现整个欧洲被洪水淹没的地区面积增加了。同期欧洲总人口显著增加（130%），城市人口增幅更大（1000%）。

尽管如此，在1950年之前，洪水造成的死亡人数一直呈逐渐下降趋势（每年1.4%）。而在1950年至2016年间，每年减少4.3%。在财产方面呈现出类似的趋势，在1950年到2016年年间，尽管欧洲的整体财富增长了2000%，但洪水造成的经济损失却下降了，每年最大降幅为2.6%。

不过，研究人员也提醒说，以上是全欧洲的整体趋势，各个国家之间仍存在差异。另外，较小规模的洪水往往报告不足，因而可能对本地财产损失的趋势判断造成影响。

在同时刊登的评论文章中，世界银行研究人员布莱登・琼曼指出，为了控制洪水并减轻其经济影响，需要实施有效的适应策略，将防洪基础设施、基于自然的解决方案和风险融资计划综合起来。

(责编：初梓瑞、庄红韬)","Wed, 06 Jun 2018 07:00:00 GMT",http://env.people.com.cn/NMediaFile/2019/0408/MAIN201904081506416317828486795.jpg,"['科技日报北京6月5日电', '欧洲百余年来防洪卓有成效生态人民网', '记者张梦然根据英国自然通讯杂志近日发表的一项环境学研究自1870年以来洪水淹没面积和受灾人数在整个欧洲都有所增加但相关的经济损失和死亡人数有所下降洪灾是威胁人类生存的十大自然灾害之一除了给农业带来重大损失外还会造成工业以及人类生命财产的损失此次荷兰代尔夫特理工大学科学家多梅尼克帕珀洛特尼及其同事利用了欧洲自然灾害历史分析数据库对洪灾进行深入分析该库涵盖了1870年至2016年的全部数据他们检查了自1870年以来的1564次洪水事件及其对生命和财产的影响发现整个欧洲被洪水淹没的地区面积增加了同期欧洲总人口显著增加130城市人口增幅更大1000尽管如此在1950年之前洪水造成的死亡人数一直呈逐渐下降趋势每年14而在1950年至2016年间每年减少43在财产方面呈现出类似的趋势在1950年到2016年年间尽管欧洲的整体财富增长了2000但洪水造成的经济损失却下降了每年最大降幅为26不过研究人员也提醒说以上是全欧洲的整体趋势各个国家之间仍存在差异另外较小规模的洪水往往报告不足因而可能对本地财产损失的趋势判断造成影响在同时刊登的评论文章中世界银行研究人员布莱登琼曼指出为了控制洪水并减轻其经济影响需要实施有效的适应策略将防洪基础设施基于自然的解决方案和风险融资计划综合起来责编初梓瑞庄红韬']", ,flood
