ID,event_id,article_title,article_link,article_content,publishing_date,article_image,article_keywords,article_relevance,category
0,FL-2017-000062-TWN,新疆哈密特大暴雨引发洪水致20人遇难8人失踪 - 新华网,http://www.xinhuanet.com/local/2018-08/04/c_1123221263.htm,"新华社乌鲁木齐8月3日电（记者刘兵、杜刚）3日，新疆维吾尔自治区抢险救灾指挥部公布了哈密特大暴雨引发洪水灾害的损失情况：7月31日6时至9时30分，哈密市伊州区沁城乡小堡区域短时间内集中突降特大暴雨，1小时最大降雨量达到110毫米（当地历史最大年降雨量52.4毫米），引发洪水。据统计，灾害造成20人遇难、8人失踪，8700多间房屋及部分农田、公路、铁路、电力和通信设施受损。

另外，由于涌入射月沟水库（小型水库、库容678万立方米）的洪峰流量合计达1848立方米/秒，远远超过该水库300年一遇校核洪水标准（537立方米/秒），造成水库迅速漫顶并局部溃坝。

灾情发生后，新疆维吾尔自治区党委和政府主要领导立即对抢险救灾工作作出部署，并成立抢险救灾指挥部。抢险救灾指挥部前线工作组综合组负责人李忠介绍，灾情发生后，哈密市组织当地党员干部、武警官兵、医卫人员等3000多人全力开展抢险救灾工作，转移安置受灾群众，不惜代价搜救失踪人员。目前，已转移安置群众5583名。临时安置点内搭建了救灾帐篷，配齐了生活必需品，确保受灾群众有住处、有饭吃、有水喝、有衣穿、有伤病能及时医治。

自治区和当地紧急调运帐篷570顶、床560张、棉被1950套、雨衣雨鞋130套、饮用水450件、各类食品3100余箱，以及药品等其他相关物资，运往灾区，发放到灾区群众手中，保障灾区群众的正常生活。应急管理部紧急组织调拨1000顶棉帐篷、3000张折叠床、6000床（件）衣被、2000块苫布、2000套折叠桌椅、10台场地照明灯等中央物资，支持地方做好受灾群众紧急转移安置和过渡期生活救助等工作。

在受灾的沁城乡城西村、城东村等地，记者看到部分受灾村民已在当地党委和政府组织下开始自救，将家中的床褥、家具搬出晾晒。同时，当地卫生防疫、交通、电力等部门也在积极恢复灾区的正常生活。当地疾病预防控制中心的医疗团队正在挨家挨户消毒，并给村民普及灾后传染病防控知识，同时，防疫人员还对死亡的牲畜进行消毒无害化处理并掩埋。

目前，灾区群众情绪稳定，因洪水冲断的道路均已恢复畅通，停运的主要电力线路及变电站已恢复运行，受损通信设施全部修复，恢复正常通讯。","Sat, 04 Aug 2018 07:00:00 GMT",,"['新华社乌鲁木齐8月3日电记者刘兵杜刚3日新疆维吾尔自治区抢险救灾指挥部公布了哈密特大暴雨引发洪水灾害的损失情况7月31日6时至9时30分哈密市伊州区沁城乡小堡区域短时间内集中突降特大暴雨1小时最大降雨量达到110毫米当地历史最大年降雨量524毫米引发洪水据统计灾害造成20人遇难8人失踪8700多间房屋及部分农田公路铁路电力和通信设施受损另外由于涌入射月沟水库小型水库库容678万立方米的洪峰流量合计达1848立方米秒远远超过该水库300年一遇校核洪水标准537立方米秒造成水库迅速漫顶并局部溃坝灾情发生后新疆维吾尔自治区党委和政府主要领导立即对抢险救灾工作作出部署并成立抢险救灾指挥部抢险救灾指挥部前线工作组综合组负责人李忠介绍灾情发生后哈密市组织当地党员干部武警官兵医卫人员等3000多人全力开展抢险救灾工作转移安置受灾群众不惜代价搜救失踪人员目前已转移安置群众5583名临时安置点内搭建了救灾帐篷配齐了生活必需品确保受灾群众有住处有饭吃有水喝有衣穿有伤病能及时医治自治区和当地紧急调运帐篷570顶床560张棉被1950套雨衣雨鞋130套饮用水450件各类食品3100余箱以及药品等其他相关物资运往灾区发放到灾区群众手中保障灾区群众的正常生活应急管理部紧急组织调拨1000顶棉帐篷3000张折叠床6000床件衣被2000块苫布2000套折叠桌椅10台场地照明灯等中央物资支持地方做好受灾群众紧急转移安置和过渡期生活救助等工作在受灾的沁城乡城西村城东村等地记者看到部分受灾村民已在当地党委和政府组织下开始自救将家中的床褥家具搬出晾晒同时当地卫生防疫交通电力等部门也在积极恢复灾区的正常生活当地疾病预防控制中心的医疗团队正在挨家挨户消毒并给村民普及灾后传染病防控知识同时防疫人员还对死亡的牲畜进行消毒无害化处理并掩埋目前灾区群众情绪稳定因洪水冲断的道路均已恢复畅通停运的主要电力线路及变电站已恢复运行受损通信设施全部修复恢复正常通讯', '新疆哈密特大暴雨引发洪水致20人遇难8人失踪新华网']", ,flood
1,FL-2017-000062-TWN,通讯：洪水退去满目疮痍——探访日本暴雨重灾区-新华网 - 新华网,http://www.xinhuanet.com/world/2018-07/11/c_1123110265.htm,"图集

新华社日本冈山县７月１１日电 通讯：洪水退去 满目疮痍——探访日本暴雨重灾区

新华社记者王可佳

河中漂着残木，车辆翻倒在路旁，民宅严重损毁，道路、房屋、车辆上覆盖着厚厚的泥土……在日本暴雨重灾区之一的冈山县，洪水席卷过的痕迹随处清晰可见。

持续多日的暴雨导致日本多地出现洪水及泥石流等灾害，现已造成１５８人遇难。１０日，记者来到冈山县仓敷市真备町，这里曾因河流泛滥引发大规模洪水。现在洪水退去，灾区满目疮痍。

连日的暴雨曾造成仓敷市一带河流水位急剧上升，小田川大面积溃堤，真备町许多房屋被冲毁，水深最高达３米左右。暴雨导致冈山县５０多人死亡，其中大部分遇难者来自这一地区。

当地铁路受洪水影响部分路段停运，记者只能中途改乘出租车前往。途经小田川的干流高粱川时，当地出租车司机松本说，河中水位较前两天已经大幅下降，预报未来几天是晴天。记者看到，河流沿岸与中央仍有残木，零星几辆汽车翻倒在路旁，多条道路因塌陷等问题禁止通行。

一路上救护车、消防车及自卫队的卡车等车辆来来往往，救援人员在路边搭起的帐篷中研究搜救方案。受暴雨影响，包括冈山县在内的日本多地仍有超过５０人下落不明。消防人员告诉记者，救援队正抓紧时间继续搜索失踪人员，并加紧修复堤坝。

在真备町受灾严重的区域，大水完全退去，道路、房屋、车辆等都被盖上一层厚厚的泥土。在当地一间规模较大的超市，不少员工在酷暑中将超市内满是泥泞的商品货架一一搬出室外，浑身大汗淋漓。现场还有多辆挖掘机和卡车在协助清理作业。

超市人事部的小笠原说，灾情最严重时，大水曾漫过超市的２层，员工们都跑到屋顶避难，所幸无人受伤。店内大部分商品被毁，超市本身的经济损失目前难以估算。另一名员工告诉记者，该超市在这一地区共有５家店铺受到暴雨及洪水影响，损失惨重。

真备町部分民宅严重损毁、变形，门窗玻璃碎裂，不少家具被冲出房屋倒挂在树上。受灾居民已开始清理房屋，把被洪水浸泡过的家具、用品堆放在屋外。当地居民椎野告诉记者，以前下过暴雨后水深不过膝盖，而这次洪水超过自家二层以上，他在此生活了７７年，如此凶猛的洪水是第一次遇到。

目前当地仍大范围断水、断网，手机信号也不稳定。椎野说，自来水已经恢复，但水质差无法直接饮用。一家人白天回来清理满屋淤泥，晚上则借住在周边地区的亲戚家中。“只有几个家人在清理，几周甚至一两个月内都难以复原，现阶段回家是不敢想的，唯有走一步算一步吧。”椎野无奈地说。","Wed, 11 Jul 2018 07:00:00 GMT",,"['通讯洪水退去', '满目疮痍探访日本暴雨重灾区新华社记者王可佳河中漂着残木车辆翻倒在路旁民宅严重损毁道路房屋车辆上覆盖着厚厚的泥土在日本暴雨重灾区之一的冈山县洪水席卷过的痕迹随处清晰可见持续多日的暴雨导致日本多地出现洪水及泥石流等灾害现已造成１５８人遇难１０日记者来到冈山县仓敷市真备町这里曾因河流泛滥引发大规模洪水现在洪水退去灾区满目疮痍连日的暴雨曾造成仓敷市一带河流水位急剧上升小田川大面积溃堤真备町许多房屋被冲毁水深最高达３米左右暴雨导致冈山县５０多人死亡其中大部分遇难者来自这一地区当地铁路受洪水影响部分路段停运记者只能中途改乘出租车前往途经小田川的干流高粱川时当地出租车司机松本说河中水位较前两天已经大幅下降预报未来几天是晴天记者看到河流沿岸与中央仍有残木零星几辆汽车翻倒在路旁多条道路因塌陷等问题禁止通行一路上救护车消防车及自卫队的卡车等车辆来来往往救援人员在路边搭起的帐篷中研究搜救方案受暴雨影响包括冈山县在内的日本多地仍有超过５０人下落不明消防人员告诉记者救援队正抓紧时间继续搜索失踪人员并加紧修复堤坝在真备町受灾严重的区域大水完全退去道路房屋车辆等都被盖上一层厚厚的泥土在当地一间规模较大的超市不少员工在酷暑中将超市内满是泥泞的商品货架一一搬出室外浑身大汗淋漓现场还有多辆挖掘机和卡车在协助清理作业超市人事部的小笠原说灾情最严重时大水曾漫过超市的２层员工们都跑到屋顶避难所幸无人受伤店内大部分商品被毁超市本身的经济损失目前难以估算另一名员工告诉记者该超市在这一地区共有５家店铺受到暴雨及洪水影响损失惨重真备町部分民宅严重损毁变形门窗玻璃碎裂不少家具被冲出房屋倒挂在树上受灾居民已开始清理房屋把被洪水浸泡过的家具用品堆放在屋外当地居民椎野告诉记者以前下过暴雨后水深不过膝盖而这次洪水超过自家二层以上他在此生活了７７年如此凶猛的洪水是第一次遇到目前当地仍大范围断水断网手机信号也不稳定椎野说自来水已经恢复但水质差无法直接饮用一家人白天回来清理满屋淤泥晚上则借住在周边地区的亲戚家中只有几个家人在清理几周甚至一两个月内都难以复原现阶段回家是不敢想的唯有走一步算一步吧椎野无奈地说', '图集新华社日本冈山县７月１１日电', '满目疮痍探访日本暴雨重灾区新华网']", ,none
2,FL-2017-000062-TWN,上游洪水来袭下游鱼蟹死亡，泄洪为何变泄污？ - 新华网,http://www.xinhuanet.com/2018-09/17/c_129955220.htm,"在安徽宿州市埇桥区的夏桥闸，流经的方河水浑浊发黑，水面上漂浮着杂物，散发着刺鼻的臭味（9月1日手机拍摄）。 新华社记者沈汝发摄

新华社南京９月１７日电 题：上游洪水来袭下游鱼蟹死亡，泄洪为何变泄污？



新华社“新华视点”记者沈汝发、秦华江、夏鹏

“今年水调和，螃蟹长势喜人，本来准备大赚一笔。”江苏省泗洪县渔民朱德俊说，“现在投入这么多钱全部打了水漂。”

中秋将至，中国第四大淡水湖——洪泽湖的渔民本来满怀喜悦，准备迎接螃蟹丰收。但８月２６日，大量突如其来的上游污水涌入洪泽湖，鱼蟹在很短时间死亡，打碎了渔民们的期待。

洪泽湖污染事件发生后，环保部门立即对污水来源进行调查。监测结果显示，洪泽湖主要入湖河流中，新濉河、新汴河入境水质均为劣Ｖ类。江苏和安徽两地的环保部门经会商一致认定，初步原因是由于上游泄洪夹带污水造成。

螃蟹鱼虾短时间死亡，对洪泽湖生态系统危害较大

“８月２５日，少量污水流入洪泽湖。２６日凌晨，大量污水涌来，整个河道都是黑的。”江苏省泗洪县临淮镇党委书记王志明说，“污水又快又猛，渔民毫无办法，只能眼睁睁看着螃蟹、鱼虾在很短时间死亡。”

朱德俊是临淮镇胜利村人。胜利村全村基本都是渔民，以养殖螃蟹和鳜鱼为生。往年这个时候，大家都忙着准备螃蟹上市，但如今，看着船上、地上堆着的大量死螃蟹和死鱼虾，渔民们欲哭无泪。

渔民孙有折算了一笔账：１４０多亩塘大概能收３０００公斤螃蟹，一公斤１００元，就是３０万元，纯利润２０万元，加上鳜鱼，一年３０万元不成问题。泗洪县委书记王晓东说，截至目前，已造成２．５万多人受灾，水产受灾面积９．２５万亩，直接经济损失２．３４亿元。

胜利村党支部书记刘兵告诉记者，这几年螃蟹养殖市场好，大家将之前赚的钱又投进去扩大再生产，许多渔民还向银行贷了款，现在不仅多年的积蓄泡了汤，有的还欠了债。

此次污染导致湖中４个国控断面监测点水质全部超标。泗洪洪泽湖湿地国家级自然保护区管理处副主任鄢化雨说，这次污水从新濉河、新汴河进入洪泽湖，正好经过保护区的西核心区，对湿地生态系统影响较大。

在马家河边上的河南开封市精细化工产业集聚区，不断有黑色的污水排入马家河（视频截图，9月2日摄）。 新华社记者夏鹏摄

追溯污水源头：上游河水污染严重

为了弄清污水的来源，记者分两路与环保、水利、公安相关部门的工作人员沿河而上，在安徽、河南两省看到，部分河流污染严重。

在安徽宿州市埇桥区的夏桥闸，流经的方河水浑浊发黑，水面上漂浮着杂物，散发着刺鼻的臭味。附近村民说：“以前可以舀水做饭吃，发洪水后黑得像酱油一样。”在方河上游，一位渔民养殖的黑鱼、鳜鱼、草鱼等因污染全部死亡。

在安徽淮北市烈山区陈路口闸，流经的雷河同样污染严重。记者沿着这条河沟看到，附近是烈山经济开发区刘庄工业园，一些工厂埋在地下的管道通向河沟。当地村民指着附近的一条河沟说，这里的污水排放到雷河里，里面连泥鳅都养不活。

在安徽濉溪县，位于县城中心的萧濉新河河水黄中发黑，水面上漂着死鱼，臭味令人作呕。

在河南境内，记者看到惠济河的一条支流马家河污染严重，乳白色、黄色、绿色及黑色的物质交替出现。马家河边上就是开封市精细化工产业集聚区，沿线不仅有各种生活污水管，还有畜禽养殖场及集聚区的排管，不断有黑色的污水排入马家河。

开封市鼓楼区一家企业位于马家河边。记者在现场看到，不断有乳白色液体从这家企业方向向河内排入，与周边的水体呈鲜明对比。

在安徽淮北市烈山经济开发区刘庄工业园，一些工厂埋在地下的管道通向河沟（9月1日手机拍摄）。 新华社记者沈汝发摄

“洪水走廊”沦为“污水走廊”，环境保护合作协议成一纸空文

“我们是典型的‘洪水走廊’，开挖了很多河道，让上游洪水下泄。”泗洪县水利局局长刘晓永说，下游费心费力治理变成绿水，上游污水一下泄，下游就变成污水了。

记者调查了解到，虽然上游对污水水质早有了解，泄洪时却未通知下游。江苏宿迁、安徽宿州等８个地级市２０１２年签订的《关于环境保护合作协议》成了一纸空文。

根据协议约定，上游城市提闸放水应提前２４小时向下游城市通报，内容包括水质、水量、水文等情况，汛期应急提闸放水应提前６小时向下游通报。上游城市提闸放水应提前采取污染防治措施，综合考虑上下游水质情况，并对下游水质影响进行评估，严禁以泄污为目的进行提闸放水。

“这次污水导致大量鱼蟹死亡的一个重要原因，就是溶解氧太低。上游境内的国控自动监测点监测数据显示，８月１８日１９时以后，水体中溶解氧从正常值降到了零点几，一直持续到２８日中午。”江苏省渔业技术推广中心总工程师张永江说，在这一关键期，下游没有收到任何信息。

渔民们说，螃蟹已经养了６个多月，如果上游提前通知，他们可以将螃蟹、鱼虾捞一部分、卖一部分、转移一部分，不至于全部死亡。

在与江苏会商时，安徽环保部门和宿州、泗县等政府负责人坦承，紧急泄洪时未通知下游；将对下游受灾群众开展救助，并将加强协商，给予资金补偿。

淮安和宿迁两市２０１６年制定的《洪泽湖生态环境保护规划文本》提到，由于上游河南、安徽以及徐州地区的污水团不定期下泄，使得入湖河流污染严重，洪泽湖每年都要发生数次污染事故。

“洪水走廊”为何沦为“污水走廊”？泗洪县委常委、政法委书记张敏说，上游食品、制药、化工等企业较多，有些污水处置不到位，积攒起来，一旦台风时大水漫灌，雨水、污水全部流入河中，借着洪水滚滚而下。

“此次洪泽湖污染事件，再次敲响了跨界污染的警钟。”生态环境部南京环境科学研究所研究员李维新说，目前流域内各地的监管系统自成体系，各管一段，构建跨界污染预警和应急联动机制迫在眉睫。江苏省生态文明研究与促进会副理事长胡和林认为，应厘清政府责任，建立省际之间生态补偿机制，既形成刚性约束，又给予治污动力。

在江苏省泗洪县洪泽湖畔，渔民用船清运死亡的螃蟹（8月30日手机拍摄）。 新华社记者沈汝发摄","Mon, 17 Sep 2018 07:00:00 GMT",,"['新华社记者沈汝发摄', '新华社记者沈汝发摄洪水走廊沦为污水走廊环境保护合作协议成一纸空文我们是典型的洪水走廊开挖了很多河道让上游洪水下泄泗洪县水利局局长刘晓永说下游费心费力治理变成绿水上游污水一下泄下游就变成污水了记者调查了解到虽然上游对污水水质早有了解泄洪时却未通知下游江苏宿迁安徽宿州等８个地级市２０１２年签订的关于环境保护合作协议成了一纸空文根据协议约定上游城市提闸放水应提前２４小时向下游城市通报内容包括水质水量水文等情况汛期应急提闸放水应提前６小时向下游通报上游城市提闸放水应提前采取污染防治措施综合考虑上下游水质情况并对下游水质影响进行评估严禁以泄污为目的进行提闸放水这次污水导致大量鱼蟹死亡的一个重要原因就是溶解氧太低上游境内的国控自动监测点监测数据显示８月１８日１９时以后水体中溶解氧从正常值降到了零点几一直持续到２８日中午江苏省渔业技术推广中心总工程师张永江说在这一关键期下游没有收到任何信息渔民们说螃蟹已经养了６个多月如果上游提前通知他们可以将螃蟹鱼虾捞一部分卖一部分转移一部分不至于全部死亡在与江苏会商时安徽环保部门和宿州泗县等政府负责人坦承紧急泄洪时未通知下游将对下游受灾群众开展救助并将加强协商给予资金补偿淮安和宿迁两市２０１６年制定的洪泽湖生态环境保护规划文本提到由于上游河南安徽以及徐州地区的污水团不定期下泄使得入湖河流污染严重洪泽湖每年都要发生数次污染事故洪水走廊为何沦为污水走廊泗洪县委常委政法委书记张敏说上游食品制药化工等企业较多有些污水处置不到位积攒起来一旦台风时大水漫灌雨水污水全部流入河中借着洪水滚滚而下此次洪泽湖污染事件再次敲响了跨界污染的警钟生态环境部南京环境科学研究所研究员李维新说目前流域内各地的监管系统自成体系各管一段构建跨界污染预警和应急联动机制迫在眉睫江苏省生态文明研究与促进会副理事长胡和林认为应厘清政府责任建立省际之间生态补偿机制既形成刚性约束又给予治污动力在江苏省泗洪县洪泽湖畔渔民用船清运死亡的螃蟹8月30日手机拍摄', '上游洪水来袭下游鱼蟹死亡泄洪为何变泄污新华网', '新华社记者夏鹏摄追溯污水源头上游河水污染严重为了弄清污水的来源记者分两路与环保水利公安相关部门的工作人员沿河而上在安徽河南两省看到部分河流污染严重在安徽宿州市埇桥区的夏桥闸流经的方河水浑浊发黑水面上漂浮着杂物散发着刺鼻的臭味附近村民说以前可以舀水做饭吃发洪水后黑得像酱油一样在方河上游一位渔民养殖的黑鱼鳜鱼草鱼等因污染全部死亡在安徽淮北市烈山区陈路口闸流经的雷河同样污染严重记者沿着这条河沟看到附近是烈山经济开发区刘庄工业园一些工厂埋在地下的管道通向河沟当地村民指着附近的一条河沟说这里的污水排放到雷河里里面连泥鳅都养不活在安徽濉溪县位于县城中心的萧濉新河河水黄中发黑水面上漂着死鱼臭味令人作呕在河南境内记者看到惠济河的一条支流马家河污染严重乳白色黄色绿色及黑色的物质交替出现马家河边上就是开封市精细化工产业集聚区沿线不仅有各种生活污水管还有畜禽养殖场及集聚区的排管不断有黑色的污水排入马家河开封市鼓楼区一家企业位于马家河边记者在现场看到不断有乳白色液体从这家企业方向向河内排入与周边的水体呈鲜明对比在安徽淮北市烈山经济开发区刘庄工业园一些工厂埋在地下的管道通向河沟9月1日手机拍摄', '题上游洪水来袭下游鱼蟹死亡泄洪为何变泄污新华社新华视点记者沈汝发秦华江夏鹏今年水调和螃蟹长势喜人本来准备大赚一笔江苏省泗洪县渔民朱德俊说现在投入这么多钱全部打了水漂中秋将至中国第四大淡水湖洪泽湖的渔民本来满怀喜悦准备迎接螃蟹丰收但８月２６日大量突如其来的上游污水涌入洪泽湖鱼蟹在很短时间死亡打碎了渔民们的期待洪泽湖污染事件发生后环保部门立即对污水来源进行调查监测结果显示洪泽湖主要入湖河流中新濉河新汴河入境水质均为劣ｖ类江苏和安徽两地的环保部门经会商一致认定初步原因是由于上游泄洪夹带污水造成螃蟹鱼虾短时间死亡对洪泽湖生态系统危害较大８月２５日少量污水流入洪泽湖２６日凌晨大量污水涌来整个河道都是黑的江苏省泗洪县临淮镇党委书记王志明说污水又快又猛渔民毫无办法只能眼睁睁看着螃蟹鱼虾在很短时间死亡朱德俊是临淮镇胜利村人胜利村全村基本都是渔民以养殖螃蟹和鳜鱼为生往年这个时候大家都忙着准备螃蟹上市但如今看着船上地上堆着的大量死螃蟹和死鱼虾渔民们欲哭无泪渔民孙有折算了一笔账１４０多亩塘大概能收３０００公斤螃蟹一公斤１００元就是３０万元纯利润２０万元加上鳜鱼一年３０万元不成问题泗洪县委书记王晓东说截至目前已造成２５万多人受灾水产受灾面积９２５万亩直接经济损失２３４亿元胜利村党支部书记刘兵告诉记者这几年螃蟹养殖市场好大家将之前赚的钱又投进去扩大再生产许多渔民还向银行贷了款现在不仅多年的积蓄泡了汤有的还欠了债此次污染导致湖中４个国控断面监测点水质全部超标泗洪洪泽湖湿地国家级自然保护区管理处副主任鄢化雨说这次污水从新濉河新汴河进入洪泽湖正好经过保护区的西核心区对湿地生态系统影响较大在马家河边上的河南开封市精细化工产业集聚区不断有黑色的污水排入马家河视频截图9月2日摄', '新华社记者沈汝发摄新华社南京９月１７日电', '在安徽宿州市埇桥区的夏桥闸流经的方河水浑浊发黑水面上漂浮着杂物散发着刺鼻的臭味9月1日手机拍摄']", ,none
