ID,event_id,article_title,article_link,article_content,publishing_date,article_image,article_keywords,article_relevance,category
162,FL-2018-000068-CHN,长江流域洪水超警戒线 “三峡大坝”不起作用？ - 自由亚洲电台,https://www.rfa.org/mandarin/yataibaodao/huanjing/hj-07252019120355.html,"近期，中国南方因受持续强降雨影响，377条河流发生超过警戒线以上洪水。号称“固若金汤”的三峡大坝似乎并没有在今年发挥其“可抵御百年一遇特大洪水”的作用。那么，在中国斥巨资建造这个备受争议的大坝后，为什么洪灾依旧频发？

中国官方媒体日前引述水利部官员表示，今年入汛以来，全国共出现23次强降雨过程，导致18个省（区、市）377条河流发生超过警戒线以上洪水，较1998年以来同期超警河流数量偏多近八成。

目前，长江中下游干流及两湖、黄河上中游、太湖及西江水位较常年同期偏高0.10-5.10米。其中，长江干流九江江段及鄱阳湖湖口超过警戒线0.32-0.52米。

旅居德国的著名水利专家王维洛博士向记者解释道：“1998年的洪水是百年不遇的洪水，而今年洪水的水位则是超过了98年百年不遇的洪水的水位。”

值得注意的是，对比1998年发生的长江洪水，这次更为严重的洪水却没有引发中国当局的更大重视。

台湾中央社25日的报道提到，直至星期三长江中下游干流全线以及两湖控制站水位退至警戒水位以下后，官方媒体才透露说部分流域水位曾超过警戒线13天。

长江江苏南京段水位持续超越警戒线（Public Domain）

另外本台早前曾报道，中国珠江、湘江及长江流域连日暴雨引发洪灾，湘江下游发生超50年一遇特大洪水。灾民发出的视频中，有房屋倒塌，铁轨路基被冲毁、河上漂浮着尸体。面对这些灾难性场面，中国大部分媒体只作低调处理。官媒也只是报道官员如何指挥抢险救灾，却未提及受灾情况。

王维洛博士告诉记者，类似的情况也出现在1998年大洪水后的一年。

“99年夏天的时候，长江江堤上却是静悄悄的。99年的洪水只比98年的稍微小了一点点，从洪水来看，两边是差不多的。这就说明，只要中央重视这洪水，这洪水就大、重要，抗灾成绩就辉煌。”

据了解，中国作为目前世界上拥有水坝最多的国家，2009年拥有的水坝数量达8.7万座。1994年在反对声浪下开始兴建的长江三峡大坝是当今世界最大的水利发电工程。

自2003年投运以来，外界对于这座号称可以“抵御百年一遇特大洪水”的大坝的防御功能一直抱有怀疑。以今年的特大洪灾为例，三峡大坝似乎就没有对抗洪起到特别的作用。

长江安徽安庆段超过警戒水位（Public Domain）

致力于环保的中国非营利组织横断山研究会会长杨勇接受本台记者采访时说：“水库放水的流量肯定是比自然的降水流量大，特别是所有水库都进行泄洪的话，洪峰的峰值就会很高，这样一来就人为加大三峡水库的压力。如果根据不同汛期的状况和降雨的状况来进行措施泄洪、调控，这样就会减缓三峡大坝的防洪压力。”

王维洛博士认为，洪水是河流和自然界新陈代谢的现象，人为原因才是造成洪灾频发的罪魁祸首。

“国家防总今年5月开会就预测入汛后，长江中下游可能会有洪水，但当局所强调的防洪水灾害的首要任务是保证水库大坝能够安全地度过汛期。建大坝是用来防洪的，怎么现在成保护重点了？雨下大了，先储蓄了，后来发现再蓄坝就不安全了，就连着自然洪水和存储的洪水一起放下来，人为增大了洪水的流量。水不能蓄在高的地方，那样会有危害。很多的事情都是因为人占了水的空间。”

在南方强降雨持续的情况下，杨勇担心如果长江上游和中下游的洪峰叠加，汛情有加重的可能。他希望，相关部门能继续关注天气趋势预报，做好防范措施，以度过这次的汛期。

（记者：韩洁 责编：申铧 网编：洪伟）","Thu, 25 Jul 2019 07:00:00 GMT",https://www.rfa.org/mandarin/yataibaodao/huanjing/hj-07252019120355.html/hj725.jpg/@@images/image,"['长江流域洪水超警戒线', '责编申铧', '近期中国南方因受持续强降雨影响377条河流发生超过警戒线以上洪水号称固若金汤的三峡大坝似乎并没有在今年发挥其可抵御百年一遇特大洪水的作用那么在中国斥巨资建造这个备受争议的大坝后为什么洪灾依旧频发中国官方媒体日前引述水利部官员表示今年入汛以来全国共出现23次强降雨过程导致18个省区市377条河流发生超过警戒线以上洪水较1998年以来同期超警河流数量偏多近八成目前长江中下游干流及两湖黄河上中游太湖及西江水位较常年同期偏高010510米其中长江干流九江江段及鄱阳湖湖口超过警戒线032052米旅居德国的著名水利专家王维洛博士向记者解释道1998年的洪水是百年不遇的洪水而今年洪水的水位则是超过了98年百年不遇的洪水的水位值得注意的是对比1998年发生的长江洪水这次更为严重的洪水却没有引发中国当局的更大重视台湾中央社25日的报道提到直至星期三长江中下游干流全线以及两湖控制站水位退至警戒水位以下后官方媒体才透露说部分流域水位曾超过警戒线13天长江江苏南京段水位持续超越警戒线public', '网编洪伟', 'domain另外本台早前曾报道中国珠江湘江及长江流域连日暴雨引发洪灾湘江下游发生超50年一遇特大洪水灾民发出的视频中有房屋倒塌铁轨路基被冲毁河上漂浮着尸体面对这些灾难性场面中国大部分媒体只作低调处理官媒也只是报道官员如何指挥抢险救灾却未提及受灾情况王维洛博士告诉记者类似的情况也出现在1998年大洪水后的一年99年夏天的时候长江江堤上却是静悄悄的99年的洪水只比98年的稍微小了一点点从洪水来看两边是差不多的这就说明只要中央重视这洪水这洪水就大重要抗灾成绩就辉煌据了解中国作为目前世界上拥有水坝最多的国家2009年拥有的水坝数量达87万座1994年在反对声浪下开始兴建的长江三峡大坝是当今世界最大的水利发电工程自2003年投运以来外界对于这座号称可以抵御百年一遇特大洪水的大坝的防御功能一直抱有怀疑以今年的特大洪灾为例三峡大坝似乎就没有对抗洪起到特别的作用长江安徽安庆段超过警戒水位public', '三峡大坝不起作用', 'domain致力于环保的中国非营利组织横断山研究会会长杨勇接受本台记者采访时说水库放水的流量肯定是比自然的降水流量大特别是所有水库都进行泄洪的话洪峰的峰值就会很高这样一来就人为加大三峡水库的压力如果根据不同汛期的状况和降雨的状况来进行措施泄洪调控这样就会减缓三峡大坝的防洪压力王维洛博士认为洪水是河流和自然界新陈代谢的现象人为原因才是造成洪灾频发的罪魁祸首国家防总今年5月开会就预测入汛后长江中下游可能会有洪水但当局所强调的防洪水灾害的首要任务是保证水库大坝能够安全地度过汛期建大坝是用来防洪的怎么现在成保护重点了雨下大了先储蓄了后来发现再蓄坝就不安全了就连着自然洪水和存储的洪水一起放下来人为增大了洪水的流量水不能蓄在高的地方那样会有危害很多的事情都是因为人占了水的空间在南方强降雨持续的情况下杨勇担心如果长江上游和中下游的洪峰叠加汛情有加重的可能他希望相关部门能继续关注天气趋势预报做好防范措施以度过这次的汛期记者韩洁']", ,flood
163,FL-2018-000068-CHN,澳大利亚暴雨引发百年一遇洪水--人民网环保频道 - 人民网,http://env.people.com.cn/n1/2019/0221/c1010-30851705.html,"原标题：澳大利亚暴雨引发百年一遇洪水

据悉，澳大利亚昆士兰州北部近日遭遇强降雨，一些地区一天内的降水量超过400毫米，引发了118年来最强洪水。昆士兰州丹特里河的水位涨到了12.6米，打破了之前最高水位值。多个地区发布了洪水警报，汤斯维尔地区学校和儿童看护中心已经关闭。警方呼吁市民留在家中，避免可能的危险，而地势较低地区的居民由于洪水威胁，需要向安全地方转移。

洪水不仅影响了人们的生活，也给珊瑚礁带来了威胁。据法新社报道，詹姆士库克大学（James Cook University）的科学家日前表示，洪水导致数百公里海岸线的若干条河流泛滥，使得泥沙等沉淀物附着在大堡礁上，不仅降低了海水品质，而且遮蔽了珊瑚礁所需要的阳光，更为珊瑚礁的食用者提供了养分。

詹姆士库克大学研究员华特・豪斯（Jane Waterhouse）说，珊瑚礁和海草需要光线来维持其生长和健康。连日降雨后又出现无风天气，意味着混浊水质暂时无法散去。重灾区的珊瑚礁受到“窒息”而死的威胁。位于昆士兰省北方的伯德金河（Burdekin）河口，在外海出现约100公里长的咖啡色漂浮物。华特・豪斯说：“如果那些漂浮物继续留在那里，很快就可能导致当地部分珊瑚系统死亡。”

(责编：施麟、贺迎春)","Thu, 21 Feb 2019 08:00:00 GMT",http://env.people.com.cn/NMediaFile/2019/0328/MAIN201903280901273436073368047.jpg,"['澳大利亚暴雨引发百年一遇洪水生态人民网', '原标题澳大利亚暴雨引发百年一遇洪水据悉澳大利亚昆士兰州北部近日遭遇强降雨一些地区一天内的降水量超过400毫米引发了118年来最强洪水昆士兰州丹特里河的水位涨到了126米打破了之前最高水位值多个地区发布了洪水警报汤斯维尔地区学校和儿童看护中心已经关闭警方呼吁市民留在家中避免可能的危险而地势较低地区的居民由于洪水威胁需要向安全地方转移洪水不仅影响了人们的生活也给珊瑚礁带来了威胁据法新社报道詹姆士库克大学james', 'cook', 'university的科学家日前表示洪水导致数百公里海岸线的若干条河流泛滥使得泥沙等沉淀物附着在大堡礁上不仅降低了海水品质而且遮蔽了珊瑚礁所需要的阳光更为珊瑚礁的食用者提供了养分詹姆士库克大学研究员华特豪斯jane', 'waterhouse说珊瑚礁和海草需要光线来维持其生长和健康连日降雨后又出现无风天气意味着混浊水质暂时无法散去重灾区的珊瑚礁受到窒息而死的威胁位于昆士兰省北方的伯德金河burdekin河口在外海出现约100公里长的咖啡色漂浮物华特豪斯说如果那些漂浮物继续留在那里很快就可能导致当地部分珊瑚系统死亡责编施麟贺迎春']", ,flood
164,FL-2018-000068-CHN,“新疆三峡”主体完工叶尔羌河流域将告别千年水患 - 新华网,http://www.xinhuanet.com/local/2019-09/05/c_1124964819.htm,"叶尔羌河流域将告别千年水患 建设中的叶尔羌河阿尔塔什水利枢纽（8月24日无人机拍摄）。新华社发（李建锋 摄）

新华社乌鲁木齐9月5日电（记者关俏俏、赵戈）一项根治新疆千年水患的重大民生工程——叶尔羌河阿尔塔什水利枢纽大坝近日封顶，高耸的坝体矗立于喀喇昆仑山河谷，抵挡波涛汹涌的洪水，这意味着叶尔羌河流域将彻底告别千年水患。

记者从中核集团新华水力发电有限公司了解到，阿尔塔什水利枢纽工程是国家“十三五”期间100个重大项目之一，总投资109.86亿元，将在保证塔里木河生态供水条件下，发挥防洪、灌溉、发电等综合利用功能。

作为新疆有史以来规模最大的水利枢纽工程，加之具有高地震烈度、高坝、高边坡以及坝基百米级深厚覆盖层等世界性设计施工难题，阿尔塔什水利枢纽工程被业内专家称为“新疆的三峡工程”。

全长1289公里的叶尔羌河发源于喀喇昆仑山，流域内有400万人口，灌溉总面积超过650万亩，是新疆最大、全国第四大灌区，也是新疆洪灾最多的河流。千百年来，叶尔羌河水患一直对沿岸各族人民的生产生活构成严重威胁。时常发生的融雪型、暴雨型、“溃坝型”洪水，以极高的起涨速率和高洪峰值闻名世界。

每年汛期，叶尔羌河流域九成以上的农村劳动力都要参与防洪，物资投入数以亿计，多数又被冲毁，年复一年。为了抗击洪水，仅和田地区莎车县每年投入防洪工地的青壮年男劳力就达10.4万人。

为了解决千年水患，国家将阿尔塔什水利枢纽工程作为重大民生项目加以推进。阿尔塔什水库大坝等主要建筑物设计洪水标准为1000年一遇，校核洪水为10000年一遇。工程建成后，将彻底解决叶尔羌河千年水患，每年减少大量防洪投入，同时还将提供清洁能源，改变南疆三地州电力短缺状况，改善流域生态环境，推动南疆经济社会可持续发展。

叶尔羌河流域将告别千年水患 阿尔塔什水电站首台机组定子顺利吊装（9月1日摄）。新华社发（李建锋 摄）

叶尔羌河流域将告别千年水患 建设中的叶尔羌河阿尔塔什水利枢纽大坝（9月2日摄）。新华社发（李建锋 摄）","Thu, 05 Sep 2019 07:00:00 GMT",,"['叶尔羌河流域将告别千年水患新华网', '建设中的叶尔羌河阿尔塔什水利枢纽8月24日无人机拍摄新华社发李建锋', '新疆三峡主体完工', '摄叶尔羌河流域将告别千年水患', '阿尔塔什水电站首台机组定子顺利吊装9月1日摄新华社发李建锋', '摄新华社乌鲁木齐9月5日电记者关俏俏赵戈一项根治新疆千年水患的重大民生工程叶尔羌河阿尔塔什水利枢纽大坝近日封顶高耸的坝体矗立于喀喇昆仑山河谷抵挡波涛汹涌的洪水这意味着叶尔羌河流域将彻底告别千年水患记者从中核集团新华水力发电有限公司了解到阿尔塔什水利枢纽工程是国家十三五期间100个重大项目之一总投资10986亿元将在保证塔里木河生态供水条件下发挥防洪灌溉发电等综合利用功能作为新疆有史以来规模最大的水利枢纽工程加之具有高地震烈度高坝高边坡以及坝基百米级深厚覆盖层等世界性设计施工难题阿尔塔什水利枢纽工程被业内专家称为新疆的三峡工程全长1289公里的叶尔羌河发源于喀喇昆仑山流域内有400万人口灌溉总面积超过650万亩是新疆最大全国第四大灌区也是新疆洪灾最多的河流千百年来叶尔羌河水患一直对沿岸各族人民的生产生活构成严重威胁时常发生的融雪型暴雨型溃坝型洪水以极高的起涨速率和高洪峰值闻名世界每年汛期叶尔羌河流域九成以上的农村劳动力都要参与防洪物资投入数以亿计多数又被冲毁年复一年为了抗击洪水仅和田地区莎车县每年投入防洪工地的青壮年男劳力就达104万人为了解决千年水患国家将阿尔塔什水利枢纽工程作为重大民生项目加以推进阿尔塔什水库大坝等主要建筑物设计洪水标准为1000年一遇校核洪水为10000年一遇工程建成后将彻底解决叶尔羌河千年水患每年减少大量防洪投入同时还将提供清洁能源改变南疆三地州电力短缺状况改善流域生态环境推动南疆经济社会可持续发展叶尔羌河流域将告别千年水患', '摄', '建设中的叶尔羌河阿尔塔什水利枢纽大坝9月2日摄新华社发李建锋', '叶尔羌河流域将告别千年水患']", ,flood
165,FL-2018-000068-CHN,查玉祥：救群众于滔滔洪水中的人民卫士--时政--人民网 - 人民网,http://politics.people.com.cn/n1/2019/0808/c1001-31284349.html,"原标题：查玉祥：救群众于滔滔洪水中的人民卫士

【为了民族复兴・英雄烈士谱】

新华社沈阳8月5日电（记者李铮）凝神望着坚固的小凌河堤坝，穿过旁边的高楼大厦，查洪烈仿佛看到了56年前滔滔洪水中的父亲。和最亲的人虽素未谋面，但父亲的鲜血已流淌在查洪烈的血脉，一直激励她38年的从警生涯。

2018年，55岁的查洪烈从锦州市公安局公交分局办公室主任岗位上退休了，依依不舍地脱下穿了38年的警服。作为荣立个人三等功2次、获评优秀公务员10次的人民警察，查洪烈说：“父亲用自己的生命挽救了群众的生命，身穿警服这38年，我唯有勤奋工作告慰父亲，擦亮我们两代人头顶的警徽。”

查玉祥，1941年出生，生前是辽宁省锦州市公安局凌河分局凌安派出所民警。

1963年7月20日，辽西遭遇百年不遇特大暴雨，锦州的小凌河、女儿河洪水成灾，水漫堤坝，一片汪洋。锦州市内多处路段被淹，房倒屋塌，群众被困。

查玉祥所在的凌安派出所辖区是锦州城区人口密集的低洼地带，共有3000多户、1万多名居民，一旦发生洪灾，后果不堪设想。20日早10点，最担心的事发生了，小凌河溃堤，汹涌的洪水咆哮着涌向地势低洼的龙江南街。

查玉祥曾是一名无数次出入火海抢救人民群众生命财产的消防卫士，他主动向领导请求承担引导疏散辖区居民撤离的任务，随后和民警黄广成冒着狂风暴雨，在过膝的水里艰难地向险地跋涉，他们挨家挨户敲门呼唤，转移群众。在他的疏导下，绝大多数群众都顺利撤离到了安全地带。

这时查玉祥发现人群中没有刘大妈的身影，那个无儿无女的革命烈士遗孀，他立即奔向刘大妈的房子。进到屋内他发现刘大妈正在炕上抱着一个大木箱，她哭着说：“这些东西我得带着啊……”查玉祥忙说：“等水退了，你缺啥我给你备，咱先走，只要人在就啥都不愁。”可是大妈还是不愿放手。这时洪水夺门而入，眼看着没过了炕沿，千钧一发之际，查玉祥一把背起了刘大妈朝门外奔去，就在他们离开屋子不到20米时，刘大妈家的房顶被暴雨冲塌了。刘大妈安全了，又冷又饿的查玉祥才感受到体力透支，泡在水里的双腿已经快失去知觉。

此时他突然想到西边还居住着一位老人，不过去看看心中总是不安。在路上他遇到了民警胡振兴，胡振兴知道查玉祥水性不好，对他喊道：“那边水太深了，你快往回走。”可是查玉祥担心那户人家，就和胡振兴彼此搀扶着并肩往前走。暴雨倾盆而下，水位仍在不断上涨，水流湍急而浑浊，水下什么情况完全看不清。突然，他俩脚下一空，一同陷入了深处，两个人瞬间被水淹没了。等胡振兴从水中挣扎上来时，却寻不见查玉祥的身影，年轻的查玉祥被湍急的洪水夺去了宝贵的生命。

年仅22岁，查玉祥就这样穿着警服走了，留给父母、妻子巨大的悲痛，而妻子腹中已有了两人的骨肉。

得知查玉祥牺牲的消息后，近千名群众自发为他送行，锦州市公安局追授他“五好人民警察”荣誉称号，随后，查玉祥被批准为革命烈士。

女儿出生时，妈妈张凤兰给她取名查洪烈，寓意“洪水中的英烈”。

1980年，查洪烈光荣加入警察队伍。从警38年来，遇到困难她总是迎难而上，从内勤文书到外勤打扒窃，乃至抓捕犯罪嫌疑人，她总是巾帼不让须眉，出色地完成任务，深受上级和同事称赞。

从1992年开始，查洪烈的母亲和丈夫接连患重病，她将眼泪压在心底，以超乎寻常的毅力，支撑全家闯过了一个又一个难关。查洪烈说，英雄父亲的大无畏精神一直感染着我，我把事业和生活上的一切收获都看作是对父亲的告慰。热爱事业、热爱生活、不怕困难、顽强拼搏是这个家庭永远传承的精神力量。

《光明日报》（ 2019年08月08日 04版）

(责编：曹昆)","Thu, 08 Aug 2019 07:00:00 GMT",,[], ,none
