,Id,title,source URL,body,time,keywords,country,data source,language
1104,FL-2017-000017-PAK,Army fails to contain floods in Pakistan - WION,https://www.wionews.com/south-asia/army-fails-to-contain-floods-in-pakistan-320281,"The citizens of Pakistan who voted for Prime Minister Imran Khan are now regretting their decision after seeing his inability to handle difficult situations.

Heavy rains in the last three days have killed at least 58 people in Pakistan. The rains exposed Sindh capital Karachi's poor drainage system with several critical junctions flooded.

In response, Imran Khan enlisted the generals of the Pakistan army to clean up gutters.

I have asked the NDMA Chairman to go to Karachi immediately and start the clean up in the aftermath of the rain.  Imran Khan (@ImranKhanPTI) July 29, 2020 

The National Disaster Management Authority (NDMA) said the northwestern province of Khyber-Pakhtunkhwa was the worst-hit where 19 people were killed.

Another 12 died in the southern province of Sindh, while 10 died in Gilgit-Baltistan, eight in Punjab, eight in Balochistan and one in Pakistan-occupied Kashmir, according to the NDMA, adding that another 15 people were injured.

It said that 158 houses were fully destroyed and another 128 partially damaged across the county.

The Army took up relief work in Sindh, one of the worst hit ares. They said a rescue operation was done in Dadu district where 20 villages were inundated.

People in Faisalabad were so furious with the hollow promises of the elected candidates of their region that they put their picture over sewages.

Citizens put pictures of elected members on gutters after sewerage system destroyed in Faisalabad, Pakistan.#ThursdayThoughts#Pakistan pic.twitter.com/WQa4i7rOMU  Madiha Abid Ali (@MadihaAbidAli) August 13, 2020 

Streets of Lahore look the same and rains in Karachi almost turned fatal.

Lieutenant general Muhammad Afzal, a graduate of the national defense university in Islamabad, served the Pakistani army before he was appointed chairman of Pakistan's disaster management authority.

He was in charge of the entire operation. However, his shawdy work was exposed when the streets of the country returned to their original condition in two weeks despite the clean-up.",2020-08-13 07:00:00+00:00,"['contain', 'rains', 'khan', 'imran', 'army', 'pakistan', 'system', 'fails', 'streets', 'floods', 'ndma', 'work', 'sindh']",Pakistan,news article,English
462,Drought_Ghana_2017_April,"As tensions rise with Russia, U.S. colleges still pay for Snowden speeches - Yahoo Finance",https://finance.yahoo.com/news/snowden-paid-speeches-colleges-amid-russia-tensions-103054930.html,"A poster for the Ohio State University event.

Last November, former NSA contractor Edward Snowden was beamed in from somewhere in Russia to address a crowd of Ohio State University students.

“Democracy only works for all of us when we all work to uphold the system,” Snowden, appearing on a giant video screen, told the sold-out crowd of about 1,700. “The letters of the constitution are not going to jump off the page and protect your rights. People give those letters strength.”

The university paid $30,000 through an American speakers’ bureau to digitally host Snowden, one of his largest known contracts to date, according to documents obtained by Yahoo Finance. The Ohio State event was one of a series of speeches that have netted Snowden — who is still a fugitive in the eyes of the U.S. government — well over $200,000 in the past two years, as Yahoo News first reported last year. He has continued to give paid speeches, including at U.S. colleges, in 2017.

The ongoing speaking contracts come at a time when Snowden’s fate and influence are more uncertain than ever. A campaign by Snowden’s supporters to win him a pardon was rebuffed by the outgoing Obama White House, and new President Donald Trump previously labeled him a “terrible traitor.”

Moreover, Snowden’s efforts to present himself as an Internet privacy pioneer are now complicated by an American political environment colored by increasing wariness and hostility toward Snowden’s host since June 2013: Russian President Vladimir Putin.

The July 31, 2013, document granting Snowden asylum in Russia for one year.

‘It definitely looks bad’

In January, U.S. intelligence agencies publicly asserted that the Kremlin executed an elaborate influence campaign aimed at hurting the candidacy of Putin foe Hillary Clinton and boosting the candidacy of Putin admirer Donald Trump. (U.S. agencies are also investigating contacts between Trump campaign aides and Russian officials.)

“There is no question that there has been a dramatic shift in the surveillance debate in the U.S. since the Russian hacking of the 2016 presidential election,” Marc Rotenberg, president of the Electronic Privacy Information Center (EPIC) and adjunct professor of law at Georgetown University, told Yahoo Finance in an email.

Story continues

EPIC is currently attempting to compel the office of the director of national intelligence to release its complete assessment on Russia’s election interference. Rotenberg noted that the debate ignited by Snowden’s advocacy has given way to considerations of Russian meddling.

“Snowden raised important questions about the scope of U.S. government surveillance,” Rotenberg said. “And his efforts led to reforms, including passage of the Freedom Act. And he continues to make good arguments for legal control of surveillance authority. But now the focus is on understanding and preventing cyberattacks on democratic institutions. Without democratic institutions, it is not possible to enforce the rule of law.”

Russian President Vladimir Putin meets with Barack Obama at the G-20 Leaders Summit in Hangzhou, China, in September 2016. (Alexei Druzhinin/AFP/Getty Images)

Snowden’s speaking events highlight his peculiar situation as a 33-year-old former U.S. intelligence contractor being paid hundreds of thousands of dollars from speaking contracts — some from public American colleges — while living under guard at an undisclosed location in the territory of a resurgent adversary.

“It definitely looks bad that he’s over there in Russia,” Chris Weber, a cybersecurity expert who co-authored the 2002 book Privacy Defended and supports more transparency about government surveillance, told Yahoo Finance. “It could be damaging to privacy advocates and to all of the progress that has been made since his original revelations, because he is still in Russia and there’s a lot of tension.”

Weber, who has been writing about U.S. government surveillance since before the 2001 passage of the Patriot Act, which expanded the government’s authority to conduct the kind of surveillance Snowden exposed, noted that it’s reasonable to wonder whether Snowden could be manipulated as part of a larger game.

“He turned the lens around for a brief period so that we could look in the mirror,” Weber said. “Now that lens has been turned back around,” Weber added, noting that Snowden’s mysterious living situation “kind of invalidates things for a lot of people.”

‘Foreign interference is a common thing’

Snowden, for his part, has given mixed messages about his view of political tensions between Moscow and Washington.

He has sometimes been publicly critical of the Kremlin’s invasions of Internet privacy and its crackdowns on dissidents through tweets sent out to more than 3 million Twitter followers. Snowden and his supporters contend that these comments show he is not a Russian tool, as some critics claim.

This content is not available due to your privacy preferences. Update your settings here to see it.

This content is not available due to your privacy preferences. Update your settings here to see it.

But he has also downplayed Russia’s election meddling, taking a “so-what-if-they-did” attitude toward the Russian activities.

“All countries are doing this,” Snowden told the CeBIT technology conference in Germany on March 21. “The Russians are interfering in our elections. The Chinese are interfering in our elections. The Germans are interfering in our elections! In a very light, very polite way in their case. … Foreign interference is a common thing.”

Snowden later asked: “If elections have been interfered with throughout history, why did it actually matter this time?”

Snowden’s CeBIT talk also included praise of WikiLeaks, which published emails during the US presidential campaign that were stolen by Russian hackers and published CIA hacking tools in early March 2017. Russian state media outlets such as RT and Sputnik used Snowden’s comments to argue that the U.S. lacked evidence of Russian election tampering and to promote WikiLeaks’ actions.

Adam Schiff, the ranking member of the House Intelligence Committee, which has been investigating the Russian activities connected to the election, called them an “assault on our democratic institutions.” The House intelligence committee released an unclassified report on Snowden in December that called him “a serial exaggerator and fabricator” and alleged: “Since Snowden’s arrival in Moscow, he has had, and continues to have, contact with Russian intelligence services.”

,/p>

On March 22, Snowden signaled support for claims by the Trump White House that incidental collection of Trump transition staffers’ communications amounted to spying by the U.S. government under former President Barack Obama. Ironically, one of Snowden’s tweets on the subject was retweeted by Michael Cohen, Trump’s personal lawyer.

Trump's personal lawyer retweets Snowden.

‘Compelled to support his livelihood’

Ohio State University paid Gotham Artists $30,000 to host Snowden via video chat for 90 minutes on Nov. 30, 2016. Emails obtained by Yahoo Finance do not show exactly how the event came about.

The Ohio Union Activities Board “brainstorms ideas and receives suggested speakers, events and activities from a number of agencies that they work with regularly,” Ohio State Public Relations Director Benjamin Johnson told Yahoo Finance. “Our students became interested in Snowden in connection with the movie starring Joseph Gordon-Levitt.”

The money came from the student activity fee, a fund that charges $37.50 each semester to all undergraduate, graduate and professional students enrolled at Ohio State’s Columbus campus. At least one Ohio State student disagreed with the arrangement.

“What bothers me the most is having no choice but to be put in the unethical position of paying someone with … criminal charges pending against him,” fourth-year student Robin Smith wrote in a letter to the school paper. “OSU students, whether you agree or disagree with Snowden’s actions, we all have been compelled to support his livelihood.”

This content is not available due to your privacy preferences. Update your settings here to see it.

On June 14, 2013, Snowden was charged in a Justice Department criminal complaint with theft of government property and two violations of the U.S. Espionage Act for disclosing classified communications. Thus far, the U.S. has chosen to refrain from targeting his financial livelihood through actions such as sanctions by the U.S. Treasury, executive orders, or specific law enforcement mechanisms.

“It appears that so far the U.S. government’s approach has been one of diplomacy and a focus on extradition as opposed to traditional legal weapons that might be used against criminals in other cases,” Jonathan Schanzer, a former U.S. Treasury analyst and current vice president of research at the Foundation for Defense of Democracies, told Yahoo Finance.

‘Social engineering the next generation’

Snowden began speaking at U.S. colleges with a video chat at Harvard in January 2015. Promotional material from Open Mic Productions, an events production company that promotes Snowden speeches exclusively on YouTube and Twitter, touts the positive receptions he has received on college campuses.

“At campuses across North America, including Harvard, University of Chicago, McGill, University of Arizona, Columbia, University of Iowa, Stanford and others, he has received rave reviews and standing ovations,” the brochure states.

Snowden is the only speaker that Open Mic Productions lists as a client.

A person close to Snowden previously told Yahoo News last year that the American made more than $200,000 between September 2015 and August 2016 through digital appearances organized by the American Program Bureau. Three contracts during that time were signed with public U.S. colleges — the universities of Iowa, Colorado, and Arizona — totaling $79,000.

“There is nothing remotely improper about Edward Snowden making a living by speaking to global audiences about surveillance and democracy,” Snowden’s primary US lawyer Ben Wizner, who coordinates the appearances, told Yahoo last fall.

Jeremiah Talamantes, president of the cybersecurity company RedTeam Security, sees a clear strategy in Snowden speaking to colleges (beyond the lucrative contracts).

“There’s a reason he’s speaking at universities,” Talamantes told Yahoo Finance. “It’s almost as if … he’s social engineering the next generation.”

Talamantes, an expert on social engineering to target specific people with influence operations, said American students are an ideal audience for Snowden.

“Who are you targeting? … He’s talking to these very impressionable folks,” Talamantes said. “If I were to inspire a movement, the first place I would go to is universities and start from the grassroots. It’s pretty clear to me in terms of what he’s trying to do.”

Snowden appearing with writer Ron Suskind at the University of Colorado on Feb. 16, 2016. (Patrick Campbell/University of Colorado)

So far in 2017, Snowden has spoken to three colleges — the University of Waterloo in Canada, the University of Pittsburgh, and Middlebury College in Vermont — in addition to addressing several tech conferences. Amid the geopolitical tensions, Snowden’s statements about U.S. surveillance are especially provocative to Washington.

“These programs were never about terrorism,” Snowden told Middlebury students on March 16, repeating a line he first used in December 2013, referring to the mass surveillance programs he exposed. “They are about economic espionage, diplomatic manipulation and social control. We should never permit them to say they are saving our lives if they can’t show evidence that they are.”

The University of Pittsburgh paid an unspecified amount to host Snowden, emphasizing that payment was “provided to the agency representing Snowden rather than directly to the speaker.” The Middlebury Student Government Association, which invited Snowden, told Yahoo Finance that the organization is “obligated by contract [to] not share any information about our agreement with Mr. Snowden.”

Michael Isikoff contributed to this report.

Michael B. Kelley is on Twitter and can be reached at mbkelley@protonmail.com

OSU Edward Snowden Contract by Michael Kelley on Scribd

This content is not available due to your privacy preferences. Update your settings here to see it.

Read more:

In exile, Edward Snowden rakes in speaking fees while hoping for a pardon

Inside the bizarre $1 million Russian novel behind Oliver Stone’s ‘Snowden’",2017-04-11 07:00:00+00:00,"['speeches', 'russia', 'russian', 'told', 'rise', 'surveillance', 'pay', 'colleges', 'snowden', 'president', 'university', 'state', 'snowdens', 'privacy', 'speaking', 'tensions']",Ghana,news article,English
1103,FL-2017-000017-PAK,Why is Karachi drowning and could we have prevented it? - Euronews,https://www.euronews.com/green/2020/09/07/why-is-karachi-drowning-and-could-we-have-prevented-it-,"Anmol Irfan is a writer, feminist, and founder of Perspective Magazine. Here she shares her views on how the largest city in Pakistan should not have ignored warnings about the climate crisis.

Karachi is drowning.

Over the last week, torrential rains have ravaged Pakistans cosmopolitan hub. Breaking records of over 90 years, the city has been flooded as its systems and infrastructure find themselves unable to cope with the unprecedented amount of rainfall.

But how much does this have to do with climate change?

The citys inability to deal with rain isnt exactly a revelation - previous years have seen monsoon seasons cause substantial damage. But this year, its a crisis like never before. Chief Minister Murad Ali Shah has reported 63 deaths in rain related incidents already, while entire residential areas and markets have been submerged, causing millions of rupees worth of damage to houses and businesses.

The onslaught of such a disaster has come as a shock to locals who wonder why officials didnt put preventative measures in place, with full knowledge that the rainy season was coming.

Its not something thats happened recently. This has been 30-40 years in the making, explains Vice Chairman of the Lahore Development Authority, SM Imran. The neglect of Karachis development is cited as the main reason behind the citys current crisis. Despite the citys importance to Pakistans economy and development, sustainable growth of the city has never been a political priority, he adds.

As roads collapse and sewage systems overflow, questions are arising as to where years worth of taxpayers money has gone. Residents of various areas in the city are experiencing three-day long power shortages and stagnant water blocking the streets.

Did Karachi ignore the warnings?

Karachis situation is a glaring example of what can happen when climate change warnings and sustainable growth are neglected - in favour of political optics and superficial development.

In a country that has faced significant damage in the past due to droughts, this influx of rain could have been a game changer. But instead, a lack of preparation has turned what should have been years worth of water storage into a city-wide economic disaster.

To make matters worse, the drainage system which collapsed in DHA, supposedly the posh area of the city, was built in 2007 and residents were charged for it.

Floods are ravaging the city of Karachi. AFP

A lack of preparation has turned what could have been years worth of water storage into a city-wide economic disaster

Moving forward, it is imperative we understand exactly where the problem lies. The lost lives and flooding are horrific enough - but the damage they have caused may not be fixed for years to come.

Pakistans already debt-ridden economy will now have to face the harrowing consequences of redoing entire sewage systems, rehabilitating thousands of people and businesses and possibly risk losing their main port city.

How will the city recover?

This years disaster has proven that there is no time to be lost. Priorities need to be set in order for changes to be made. Instead of focusing on other aspects of infrastructure that contribute very little to the citys growth, Imran believes the focus now needs to be on water conservation and treatment.

For Imran, Israel is a good example we can learn from. Its Ashkelon facility provided for 70 per cent of the countrys water demands through a process of seawater desalination. A city that craved rainfall is now richer in water resources. This just shows that we can harness the effects of climate change in our favour, if we know how to. Whats needed now is a complete overhaul of what we thought our future would be, explains Imran.

Karachi has been labelled resilient many times over the years. But as the city descends into worse conditions, its resilience is no longer a compliment but an excuse. No longer can this idea of resilience be used to ignore its exacerbating problems.

One possible solution is for local governments to do more than just pass bills. Many now believe that programmes should be put in place to teach employees how best to reuse water and treat rubbish.

Currently though, political solutions seem too little too late, and citizens are stepping up to rehabilitate the city themselves.

Citizens are coming to the rescue

Among the many initiatives taken over by relief workers and organisations, is Saturday Welfare Group (SWG). What started as a group of friends wanting to provide rehabilitation to marginalised communities in Pakistan has grown into a powerful initiative that steps up in times of crisis.

Everyone is equal who is contributing to or working for welfare, is their motto.

A resident of Defence Housing Authority (DHA) protests against failure to fix drainage pipes. AFP

It's a motto that couldnt be more fitting with the situation Karachi now finds itself in. Both within the country and among the Pakistani diaspora, fundraising is at an all-time high. Its a testament to the idea that there are people who want change, and are ready to work for it - they just need an opportunity. Development in Karachi should be carried out on a much more equal scale, and perhaps those truly working for change will finally get the attention they deserve.

Recovery will be a long road, and hopefully when political action begins to reflect the needs of the hour, it will be up to residents to play their role as well. Pollution and littering is a major problem the city struggles with. As trash from the streets finds its way into drainage pipes, it blocks the very waterways that are meant to save the city from such disasters. Conservation initiatives need to be better understood.

This is a responsibility that lies with the educated strata of society, who have the power and resources to implement these initiatives and make them accessible to the masses. Feigning ignorance over harmful habits and actions is no longer a valid excuse.",2020-09-07 07:00:00+00:00,"['development', 'political', 'city', 'climate', 'change', 'water', 'damage', 'worth', 'drowning', 'karachi', 'prevented', 'citys']",Pakistan,news article,English
55,DR-2015-000134-SOM,"Food Assistance Outlook Brief, September 2015 - World - Reliefweb",https://reliefweb.int/report/world/food-assistance-outlook-brief-september-2015,"PROJECTED FOOD ASSISTANCE NEEDS FOR MARCH 2016

This brief summarizes FEWS NET’s most forward-looking analysis of projected emergency food assistance needs in FEWS NET coverage countries. The projected size of each country’s acutely food insecure population (IPC Phase 3 and higher) is compared to last year and the recent five-year average and categorized as Higher ( p), Similar ( u), or Lower ( q). Countries where external emergency food assistance needs are anticipated are identified. Projected lean season months highlighted in red indicate either an early start or an extension to the typical lean season. Additional information is provided for countries with large food insecure populations, an expectation of high severity, or where other key issues warrant additional discussion. Analytical confidence is lower in remote monitoring countries, denoted by “RM”. Visit www.fews.net for detailed country reports.",2015-09-26 07:00:00+00:00,"['outlook', 'lean', 'season', '2015', 'world', 'food', 'insecure', 'assistance', 'needs', 'countries', 'lower', 'projected', 'brief', 'higher']",Somalia,news article,English
