,Id,title,source URL,body,time,keywords,country,data source,language
716,FL-2016-000114-EGY,Rising Sea Levels Threaten Egypt’s Alexandria - VOA Learning English,https://learningenglish.voanews.com/a/rising-sea-levels-threaten-egypt-s-alexandria/5067579.html,"Rising sea levels are threatening parts of the Egyptian coastal city of Alexandria.

Alexander the Great established the city more than 2,000 years ago. In that time, it has survived invasions, fires and earthquakes.

But, Alexandria now faces severe flooding from rising waters blamed on climate change.

Alexandria is Egypt’s second largest city, with more than 5 million people. It is also an important port and home to about 40 percent of Egypt’s industrial activity. The city is surrounded on three sides by the Mediterranean Sea and sits next to a lake.

Officials have built concrete barriers in the sea in an effort to reduce the force of waves. A severe storm in 2015 flooded large parts of the city. At least six people were killed in the flooding, which also caused the collapse of many homes.

In the late 1940s and 50s, Alexandria was a popular place for writers and artists from Egypt and other countries. Today, more than 60 kilometers of waterfront make Alexandria a top summer vacation spot. However, many of the city’s most famous beaches are already showing signs of damage.

The United Nations has warned that worldwide sea levels could rise by 0.98 meters by 2100, with “serious implications for coastal cities, deltas and low-lying states.”

Egypt’s Ministry of Water Resources and Irrigation said the sea level rose by an average of 1.8 millimeters each year until 1993. Over the next 20 years, it rose by 2.1 millimeters a year. Since 2012, however, the rate became 3.2 millimeters each year.

Measurements show that the land on which Alexandria is built is also sinking at about the same rate. This is expected to increase the risk of dangerous flooding.

A 2018 research study predicted that up to 734 square kilometers of the Nile Delta could be under water by 2050. People living in low-lying areas are already experiencing problems.

A 52-year-old resident of the Shatby neighborhood, Abu Randa, said he has repaired his three-story home twice since the 2015 floods. “We know it is risky. We know that the entire area will be underwater, but we have no alternative,” he told The Associated Press.

Sayed Khalil is a 67-year-old fisherman living in the el-Max neighborhood, where hundreds of people were forced to leave their homes after the flooding in 2015. He said homes have flooded with seawater every winter in recent years. “It is hard to imagine that el-Max will be here in a few decades,” Khalil said. “All these houses might vanish. The area you see now will be an underwater museum.”

The government built sea defenses to protect the neighborhood, but people who live there say it has not made a big difference. “Every year the waves are much stronger than the previous year,” said Abdel-Nabi el-Sayad, a 39-year-old fisherman. “We did not see any improvement. They just forced people to leave.”

Some of the city’s archaeological treasures are also threatened. Among them is the citadel of Qaitbay, a fortress built in the Middle Ages on the ruins of the ancient Pharos lighthouse in the central harbor.

Ashour Abdel-Karim is head of Egypt’s General Authority for Shores Protection. He said the citadel is especially at risk. Powerful waves continue to push against the structure’s foundation. Officials were forced to build a long line of concrete sea barriers that can be seen from the downtown waterfront area known as the Corniche.

The Egyptian government has put aside more than $120 million for the barriers and other protective measures along the shore, Abdel-Karim said. He added that without barriers, parts of the Corniche and other buildings near the shore would be damaged. If that happens, he said, repairs could cost nearly $25 billion.

I’m Bryan Lynn.

The Associated Press reported on this story. Bryan Lynn adapted the report for VOA Learning English. Mario Ritter Jr. was the editor.

We want to hear from you. Write to us in the Comments section, and visit our Facebook page.

________________________________________________________________

Words in This Story

concrete – n. a hard substance used in building

implication – n. a result or effect

delta – n. a low, flat area of land where a river divides into smaller rivers and goes into the sea

alternative – n. one of two or more things to choose between

vanish – v. disappear

fortress – n. a castle or other strong building built to defend a place

foundation – n. the part of a building that sits under the ground to support it",2019-09-07 07:00:00+00:00,"['threaten', 'sea', 'area', 'n', 'alexandria', 'waves', 'rising', 'city', 'barriers', 'parts', 'built', 'egypts', 'levels', 'neighborhood']",Egypt,news article,English
933,FL-2021-000021-IND,Uttarakhand govt says 'will investigate all aspects of glacier burst' - Mint,https://www.livemint.com/news/india/uttarakhand-govt-says-will-investigate-all-aspects-of-glacier-burst-11613446147104.html,"The Uttarakhand government will create a department to investigate the cause of the glacier burst that led to flash floods, state irrigation minister Satpal Maharaj said on Monday.

""All angles (related to the Chamoli glacier burst) should be investigated. We will form a department in our ministry to monitor and study all the glaciers through satellite,"" said Maharaj.

Also Read | Inside the five-year battle food companies have fought to resist stricter labelling norms

""We are concerned over the way glaciers are melting and the tidal wave created in the mountains. The plutonium pack that was kept to monitor China's movement should also be investigated,"" he added.

Speaking about a lost plutonium pack in the region, the minister said: ""Orders were made to place plutonium pack to monitor China's movement at the borders. We request the government to investigate the pack too.""

In 1965 a plutonium pack was lost while installing a radar system on the summit of Nanda Devi mountain in Uttarakhand. Environmental experts worry that if glacier breaks in Chamoli cause any damage to this plutonium pack, it could lead to severe nuclear radiation pollution in the waters.

Maharaj further stated that the railway projects in the area are safe.

""As the water in the Srinagar dam was depleted, the debris flowing to the dam came to halt, keeping the railway projects safe,"" he said.

A few days ago, scientists who are investigating the flood said that the incident took place after a Himalayan glacier from a remote peak fell into the water.

""In the flash flood incident, scientists have observed a rockfall from a height of 5,600 meters. Since that support from the bottom had fallen, glacier fell down. The area has very steep slope into the mountain region,"" said the director of Wadia Institute of Himalayan Geology.

Meanwhile, the death toll in the incident had reached 58 with 11 more bodies being discovered from Tapovan tunnel in Joshimath of Chamoli district. As many as 146 people are yet to be found.

Indo-Tibetan Border Police personnel along with National Disaster Response Force and other sister agencies have been conducting search and rescue operation in Chamoli district.

A glacier burst in the Tapovan-Reni area of Chamoli District of Uttarakhand last week led to massive flooding in the Dhauliganga and Alaknanda rivers and damaged houses and the nearby Rishiganga power project.

Share Via

Subscribe to Mint Newsletters * Enter a valid email * Thank you for subscribing to our newsletter.",2021-02-16 08:00:00+00:00,"['glacier', 'govt', 'chamoli', 'pack', 'plutonium', 'monitor', 'aspects', 'incident', 'area', 'burst', 'scientists', 'uttarakhand', 'investigate']",India,news article,English
637,Drought Sri Lanka,Piaggio to challenge Bajaj in city 3-Wheelers - Business Standard,https://www.business-standard.com/article/companies/piaggio-to-challenge-bajaj-in-city-3-wheelers-113031200446_1.html,"Piaggio Vehicles, the Pune-based scooter and light commercial vehicle manufacturer, is entering the city three wheeler market with its new product Ape City, to challenge market leader Bajaj Auto.

The subsidiary of Italian Piaggio & C s.p.a has launched the new class of city-centric passenger three wheelers under the Ape City brand. The company is aiming to upset Bajaj Auto's dominance in the three wheeler segment.

The city three-wheeler market, whose sales are dictated by state governments based on the number of permits issued for most centers, is about 150,000 units per year. Piaggio is aiming to have 15-20% market share in this segment by end of this calendar year.

The Ape City costs Rs 1.10 lakh for petrol, Rs 1.23 lakh for LPG and Rs 1.25 lakh for CNG (ex-Maharashtra). Piaggio presently has a market share of 31% in the passenger three wheeler space while Bajaj Auto leads with a share of 50%.

Other players in the passenger segment includes Mahindra & Mahindra, Atul Auto, TVS Motors and Scooters India. The segment has grown by 9% to 370,868 units during the period April-January this year as against 340,032 units sold same period last year.

Ravi Chopra, chairman and managing director, Piaggio Vehicle said, ""We were not present in the market segment which required alternate fuels like petrol, CNG and LPG. So we developed a compact fuel-efficient three wheeler for urban passenger movement."" Many city regulations require three wheelers to be powered by cleaner fuels like CNG or LPG.

The three-wheelers will be built at the company's manufacturing plant in Baramati, Maharashtra which has an installed capacity of over 250,000 for three-wheelers.

Bajaj Auto sales in this segment rose to 186,420 units, a growth of 15% in the reported period as against 162,062 units sold in the same segment last year. While Piaggio reported a growth of four% at 110,943 units.

The total three wheeler sales (goods and passenger) in the April-January period stood at 450,645 units, an increase of five% as compared to 428,764 units sold in the same period last year.

Bajaj remains the market leader in the total domestic three-wheeler segment with a share of 42% followed by Piaggio with a share of 34%. Mumbai-based M&M remains the third biggest player in the segment with a share of 12%.

Piaggio is also targeting the export market with this new product with at least 50,000 units in the next 18-20 months. The export segment is about 300,000 units per year presently with the company hoping to begin shipments to Sri Lanka, Bangladesh, Africa and Latin America in the next few months.",2013-03-12 07:00:00+00:00,"['sold', 'city', 'share', 'segment', 'wheeler', 'period', 'market', 'bajaj', '3wheelers', 'challenge', 'passenger', 'units', 'piaggio']",Sri Lanka,news article,English
1062,FL-2020-000207-NGA,28 states at risk of flood - Agency - Premium Times,https://www.premiumtimesng.com/news/more-news/395058-28-states-at-risk-of-flood-agency.html,"No fewer than 102 local government areas in 28 states are at risk of flooding, according to the 2020 Annual Flood Outlook (AFO), released by the Nigeria Hydrological Survey Agency (NIHSA) on Thursday.

The states include the states of Rivers, Cross River, Delta, Lagos, Ondo, Bayelsa, Sokoto, Kogi, Niger, Kaduna, Gombe, Adamawa, Benue, FCT, Nasarawa, Delta, Oyo, Ogun, Osun, Ekiti, Ebonyi, Edo, Abia, Anambra, Imo, Borno, Kano and Kebbi.

At the Official Presentation of the outlook in Abuja, the Minister of Water Resources, Suleiman Adamu, noted that the outlook was a fallout from the devastating effect of the 2012 flood in the country.

He said the purpose of the outlook was to present probable flood scenarios for this year and to disseminate information to all, especially in flood-prone areas and further reduce resultant effects.

He said flood is one of the most frequent natural disasters in Nigeria with devastating impact on the poor and vulnerable populations who live along river banks and rely on flood plains for livelihoods.

He said although the flood outlook had shown that 2020 floods might not be as severe as previous years, it was important for all stakeholders to carry out an aggressive awareness campaign for preparedness.

It is pertinent to note that the impending flooding season with COVID-19 presents a fight against two threats; on one hand, the ongoing coronavirus pandemic and on the other hand, the likelihood of an active 2020 flood season.

The 2020 flood projections will as expected vary from moderate to severe flooding in most parts of the country.

Overall, the flood level may not be as severe as previous years, but it is a certainty that our rivers will exceed flood level and many will be inundated again this year.

The minister said as always, flooding was associated with increased risk of infections when the displaced persons were high and polluted water sources, added that it was important for all stakeholders to prepare earnestly.

READ ALSO:

He added that part of the intervention to promote hygiene was the recently signed Executive Order 009 by the President Muhammadu Buhari aimed at ending Open Defecation by 2025.

Many state governors have bought into this idea, the ministry declared emergency in the water and sanitation sector to encourage hand washing and put in place the National WASH Response Committee for COVID -19, he said.

The minister also commended the efforts of NIHSA in the development of a new Flood Mobile App, saying that it would add practical value to water managers and for overall disaster risks management.

The NIHSAs Director-General, Clement Nze, said the 2020 AFO would go beyond borders and defer all barriers to reach the needy in providing information on early flood warnings required for mitigating risks in the country.

Mr Nze noted that the need to carry out aggressive sensitisation and awareness campaigns on consistent clearing of all waterways and maintenance of dams and reservoirs to ensure free flow of water in drainages.

The D-G said the Flood Mobile App would also be used to give actual daily flood situations to everyone, especially those at the rural areas through the use of SMS services.

The new Flood Mobile App is designed to be of practical value to the Water Managers, Technical Experts, Disaster Risk Managers, Policy Makers and Flood Forecasting Community for flood prevention and for enhancing flood early warning systems in Nigeria.

(NAN)

ADVERTISEMENT",2020-05-28 07:00:00+00:00,"['water', 'flooding', 'flood', 'mobile', 'outlook', '2020', 'states', 'minister', '28', 'agency', 'risk', 'severe']",Nigeria,news article,English
587,DR-2011-000121-CHN,Gov't accused GPSU of plot to disrupt country - Stabroek News,https://www.stabroeknews.com/2011/09/11/news/guyana/gov%E2%80%99t-accused-gpsu-of-plot-to-disrupt-country/,"The Government of Guyana in early 2006 believed that the Guyana Public Service Union (GPSU) was planning to disrupt the country with the aid of the “Buxton resistance group” according to former US Ambassador Roland Bullen.

In a February 15, 2006 cable to Washington, titled ‘Labour struggles to unify as GOG seizes initiative,’ Bullen said the information was provided to the embassy by high ranking officials in the Office of the President.

Bullen, describing the prevailing labour issues that existed at that time, said that underlying those issues was a political context of “suspicion and division within the labor movement in Guyana, much of it deeply personal.”

At that time the GPSU was in an ongoing struggle for government salary arbitration, although Bullen noted that government condemned the union’s actions as politically motivated.

“[Name of the official] provided EconOff a briefing paper ostensibly based on information received from dissident members of the GPSU that alleges that union is planning to disrupt the country with the support of ‘the Buxton resistance group’ in the coming months,” Bullen said in the cable.

The statement provided by the official also alleged that the US Diaspora was “financing arrangements in the hopes that the GPSU can act along the lines of the political strikes of the 1960s.”

“While the credibility of such claims is uncertain, this sentiment is indicative of the long history of suspicion that clouds labour unions in Guyana,” Bullen noted.

He said during the meeting with embassy officials, the OP official also insisted that the GPSU missed a “golden opportunity” for compromise 18 months before, when its President Patrick Yarde apparently undermined negotiations with the Office of the President by blasting President Bharrat Jagdeo on an a television talk show.

For his part, Yarde, Bullen said, accused the government of heavy-handedness in its handling of the union’s demonstrations to date. Yarde labeled the heavy police presence along the GPSU’s February 8, 2005 march route as a “blatant act of intimidation” and blamed it for the low turnout. Yarde also insisted that he received word from private sector sources that President Jagdeo had said he would just as soon eliminate the GPSU if he could find a way to do so.

At the time GPSU had announced a second lunchtime march planned for the same route on February 15, 2005. Yarde had stated his commitment to non-violent industrial action, and the prospects of major civil disruption seemed unlikely to Bullen for several reasons.

“First, the low turnout at the previous march, be it due to intimidation or a lack of coordination within the public service union, suggests the mandate for major industrial action on the part of the PSU’s membership is weak,” he said

Bullen felt at the time that the wage increase seemed to have “undercut the union’s efforts to mobilize its sagging membership.”

Yarde had observed that resource constraints may limit the GPSU’s ability to sustain action along the lines of the 57-day strike in 1999, after which the union lost its ability to automatically collect membership dues as an agency shop.",2011-09-11 07:00:00+00:00,"['country', 'accused', 'bullen', 'guyana', 'labour', 'disrupt', 'provided', 'yarde', 'union', 'govt', 'gpsu', 'plot', 'official', 'unions', 'president']",China,news article,English
162,FF-2016-000062-IDN,Floods in Bengal - Media India Group,https://mediaindia.eu/business-politics/floods-in-bengal/,"Floods in Bengal

Is the state ready for the heavy downpour?

Business & Politics News - India & You

Criss-crossed by several rivers, including the mighty Ganges, West Bengal has traditionally been vulnerable to heavy floods each year. With the Monsoon knocking its door, is the state better prepared this year?

After two years of deficient rains, the India Meteorological Department (Met) has forecast that this year the monsoons would be higher than usual, about 106 of the average. The news was bound to bring cheer to hundreds of millions of farmers around the country whose crops have been ruined for two years running due to scanty or untimely rains. Yet, there would be some trepidation as well, especially in states that are particularly vulnerable to heavy floods even during a year with average rains.

West Bengal is one such state, which has floods even when rest of the country cries out for rains as it happened in 2015 when despite a 14 pc deficit in rains, severe floods in 12 districts of West Bengal affected around 3.7 million people.

West Bengal has 37,660 sq. km flood prone area while the total geographical area of the state is 88,752 sq. km. The flood problems of the state are different in different regions. Along with the Ganges, the rivers Teesta, Torsa, Jaldhaka and Raidak flow through the districts of Jalpaiguri and Cooch Behar. They originate either in the neighbouring country of Bhutan or the state of Sikkim and flows down to West Bengal before reaching Bangladesh. While in some places excessive monsoons bring serious flash floods, dam breaks have also caused catastrophic flooding in Bengal. Neutralising flood risks have always been a daunting task for the government in the history, will it deliver this year?

Barely a month after Mamata Banerjee took oath as the Chief Minister for the second time, after having scored a thumping win in the elections; the Met forecasts spread panic in the closed door meetings of the new government. The West Bengal state government alarmed by the onset of monsoon is planning measures to limit floods and its consequent annihilation.

DVC aids flood management

The government formed two dedicated flood control rooms — one in North Bengal and another in the south and two senior officials have been posted at the DVC (Damodar Valley Corporation) headquarters to monitor the situation. The control rooms would ensure that the government is forewarned on the release of water from the dams. Moreover, the top state bureaucrats will be meeting every day at Nabanna (the state secretariat of West Bengal) and monitor the government’s response to heavy monsoons this year.

Chief Minister Mamata Banerjee blamed DVC for floods in some parts of the state last year. The government had alleged that sudden release of water from DVC dams without proper intimation had caused loss of lives and livestock. However, the Damodar Valley Corporation, this year has assured West Bengal government of support and better co-ordination with regard to release of water from its dams as in heavy monsoon situations which are likely to trigger floods.

Other measures

Apart from these measures, the irrigation department has identified 145 kilometres of vulnerable river embankments and dams. While the restoration work has already begun, the government is also keeping a close watch on the other river banks especially in the rural areas.

According to sources, the state government is also discussing disaster measures with national and international NGOs such as the Red Cross Society, Bharat Sevashram and St John Ambulance services. The disaster management department has reportedly dispatched teams and relief materials to the flood-prone districts of the state. However, speculations are still lingering about political prejudice and foul play with regard to distribution of flood relief in remote areas.",2016-06-17 07:00:00+00:00,"['group', 'rains', 'bengal', 'flood', 'dams', 'vulnerable', 'west', 'floods', 'state', 'india', 'water', 'heavy', 'media']",India,news article,English
1057,FL-2020-000207-NGA,National Weather Service Calls for Valley Rain and Mountain Snow - Newstalkkgvo,https://newstalkkgvo.com/national-weather-service-calls-for-valley-rain-and-mountain-snow/,"A couple of days of sunshine have given way to a cold front heading into western and northwestern Montana, according to the National Weather Service Office in Missoula,

Meteorologist Luke Robinson said there could be significant rain in some areas around west central Montana.

We are looking at some rain moving into the area starting mid week to the end of the week, said Robinson. This week we are looking at some pretty good soaking rains, particularly in southwest Montana and west central Montana. We will see the rivers and streams rising but right now we're not really anticipating any impacts from it.

Robinson said the cold front will bring accompanying snow to the higher mountain areas.

This system is moving in, it's going to be relatively cold, so we're actually looking at some accumulating snow in the mountains, he said. Those cooler temperatures will cut off all the hot mountain snow melt that we've had the past few days and most of the rise in the rivers and streams will be coming from mid to low level moisture coming into the area.

Robinson said people who live in areas that usually flood in the spring may be nervous to see the river levels rising.

It could be more of just a nervous thing, right now, he said. We're looking at the cresting below flood stage, and that will be sometime Thursday or Friday. But right now we're not expecting any flooding at this at this point.

Robinson said there is a winter weather watch that stretches from Eureka southward all the way to Helena, with rain and gusty winds expected in western Montana.",2021-05-18 16:44:25+00:00,"['rain', 'snow', 'calls', 'service', 'montana', 'looking', 'west', 'mountain', 'week', 'right', 'national', 'cold', 'western', 'valley', 'weather']",Nigeria,news article,English
