,Id,title,source URL,body,time,keywords,country,data source,language
125,DR-2015-000134-SOM,"US-China battle over the Ogaden Basin, different powers emerge to play in the same old field - Waagacusub Media",http://waagacusub.net/articles/988/US-China-battle-over-the-Ogaden-Basin-different-powers-emerge-to-play-in-the-same-old-field,"Ethiopia is set to be a natural gas producer by 2018, pumping about 40 billion gallons annually, according to Mr. Geming. In may 2012, the Late Ethiopian dictator, Meles Zenawi, declared that Ethiopia would pump up gas out of the Ogaden in one year's time. That didn't happen. According to Wikipedia entry, the first exploration in the basin was undertaken by Standard Oil in 1920[2] More recent exploration by Tenneco resulted in the discovery of an estimated 68 million cubic metres (2.4 billion cubic feet) of gas in 1974.[2] China proposed to establish its own military base in O'bock , Djibouti near Bab al-Mandab straight, the strategic southern entrance to the Red Sea and the gateway to the Suez Canal. China understands the void of the Horn's old client ,Russia, and the importance of the Horn in terms of penetrating the Continent throughout Somalia's territorial waters, however, China is pursuing the same approach that led the failure of the Soviet Union instead of establishing itself a permanent position on the Indian and the Red Sea. China failed in Libya and South Sudan and will likely fail if it does not put all its efforts with Somalia and Somali speaking populations in the Horn amid to participate in the recourse of a strong central Somali government in Mogadishu. China will then have the upper hand and have a chance to avail its health and strong relationship with Somalis in the Horn, in doing so, it will get abundant natural resources including the country's untapped oil and gas reserves if she needs to be a superpower. Saudi Arabia and Israel met to discuss a number of international issues and they revealed that they had been in secret discussions for a year. In the discussion, they stated their interest in regard of the Ogaden oil and gas in Eastern parts of Occupied-Ogaden. Anwar Eshki, a retired major general in the Saudi armed forces, said in his speech about the Middle East and the Horn of Africa on June 4, 2015 that the Ogaden basin will unite the Horn of Africa under the Ethiopia"" (TPLF leadership). The source further said that Saudi Ben Laden Group could build a bridge across the Red Sea linking Yemen to Djibouti.Israel and Saudi would then be able to exploit the natural reserves in Ogaden."" Both Israel and Saudi Arabia have failed to learn the hostilities between the Somali ethnic population in Occupied-Ogaden and Ethiopian highlanders from Tigray and Amhara, an historical enmity that goes back the years of the Somali Adal Empire and Abyssinia's Aksumite Empire (14th Century-16th century). The book of ""Futuh Al-Habasha: The Conquest of Abyssinia"" would open their eyes if they wanted to learn the history of the Horn of Africa and the Ogaden region crisis.



Human rights abuses in the Ogaden region The massacres in the Ogaden have been described as ""genocide"" by the Genocide Watch. Rights Groups the likes, Human Rights Watch and Amnesty International accuse Ethiopia of heinous crimes and human rights violations in its military operation in the Horn of Africa's Ogaden region. The government denied the allegations yet unwilling to collaborate with a fact-finding Mission from the UN Human Rights body on its research for the human rights abuses allegedly committed by its soldiers stationed in Ogaden region. Over the last seven years, the Ethiopian government has initiated a genocidal campaign against the Ogadeni civilian population. The Ethiopian Defense Forces are using a systematic policy of intimidation, rape, assault and detention and deportation against Ogadeni civilians. Ten of thousands of people have fled to refugee camps in Kenya, Somalia, Djibouti, Eritrea and Yemen. According to the Genocide watch, The Ethiopian Army's counter-insurgency campaign in Ogaden has included numerous war crimes and crimes against humanity. The Ethiopian government's policy in Ogaden is to suppress all demands for autonomy from Ogadenis. It has included gradual stationary of the population in IDP Camps-a policy Genocide Watch calls Genocide by attrition. The army has imposed an economic blockade on many towns and villages in the Ogaden. The government has restricted access of water, food and other necessities. Food is being used as a weapon of war. Massacres, torture, rape and disappearances are prevalent in the Ogaden region. Women and children are the most vulnerable groups to suffer abuses and violence. They are accused of being relatives of ONLF members. Thousands of people have been arrested without any charges and held in the notorious prisons in Ethiopia and Jail Ogaden particularly.

The TPLF-led regime imposed a ban on all international media and most of the aid workers including International Red Cross and doctors without borders had expelled the region.

The regime arrested and detained dozens of people that their relatives are outside of Ogaden. The Security forces ordered their return or they will remain in custody. Ethiopia executed catholic priests , subjugated Sidamas, Gambellas, Afars, Benishanguls and more than 40 million Oromos. Despite all these, it is silenced and never discussed the war and human rights violations in Ogaden and other places publicly. Mass refugees movements and UNHCR's involvement to support them

Hundreds of thousands fled from Ogaden region for the result of the forgotten war in Ogaden region. Dhabaab, Kenya alone hosts 100, 000 Ogadenis that fled from the war-torn region of Ogaden. Among of them are protracted refugees that UNHCR has been feeding since the 80s. While hundreds of them live in a number of other refugee camps in East Africa including Djibouti's Ali-Addeh, Eritrea's Emkulu Camp, among others. It is six decades conflict that the United Nations has failed to solve and even its humanitarian arm, UNHCR Yemen is wondering how to help several hundred Ogadeni political refugees currently caught up in the Yemen conflict to get a safer place.



According to the Director of the Royal African Society, Richard Dowden, in 1991 and 1992, The UN Refugee Agency did nothing for the Ogadeni refugees that found themselves in Ethiopia after they had escaped from their camps in Somalia-where they sought refuge during the Somalia -Ethiopia war over the control of the Ogaden in 1977-78. The UN allowed Ogadeni refugees mostly women and children to die in its camps inside Ethiopia's Ogaden region after the Derg regime rejected to accept them as ""classified returnees"" because of their Somali ethnicity -making among the highest ever recorded death rate. That incident did at least result in a change of the UNHCR mandate. The scenario is the same, UNHCR's protection counselling office in Sana'a sees considerable security threats for the lives of Ogadenis and others amid at Saudi-led bombardment and economic sanctions. Moreover, the office wanted to provide cash assistance to those lost their jobs since last March despite under-funding and to expedite dozens of families that referred to U.S, EU, Canada and Australia. Sweden and France were able to take in several families since last March. Even though, the UN office managed to contribute one time food-aid to some of the urban refugees in Sana'a last month since March , the humanitarian Agency needs to open its doors and build trust in terms of giving solace or receiving applications from those in dire straits that wanted to talk to UNHCR for the purpose of : Following up on their cases, reporting a protection problem, seeking material and medical assistance or to those willing to be considered their cases for resettlement since they could not return to their homelands due to well-founded fear of persecution and their hosted nation of Yemen is on war.

Both UNHCR Senior Officials based in Geneva and Aden aware of those hundred Ogadeni families in Kharez Camp-registered with the UN as refugees from Somalia-but have a different status. Among of them are survivors from the little known Banbalaayo massacres of 1991 and 1992. As a source from Rebecca Hinchey's research titled, ""Ogaden- A state of Decay"" reads: ""Banbalaayo, roughly translated means 'desert of hell'- thousands of Ogaden refugees-mostly women and children died in Hiiraan Province, South of Somalia when their camp came under attack, the Ogadenis showered with thousands of bullets. Many fell to the ground, died or dying, Those that did not try to run but their only option was to cross the river behind them. Only a few were able to swim. Some men survived, but almost all the women and children drowned."" The resumption of that past experience is one of their main concerns now. Dozens of families displaced in Sana'a and other parts of Yemen while others are wandering throughout Yemen.



http://www.cfr.org/development/regional-challenges-opportunities-view-saudi-arabia-israel/p36615 http://www.genocidewatch.org/ethiopia.html http://www.2merkato.com/news/alerts/4105-poly-gcl-to-drill-additional-gas-well-in-calub-ogaden http://onlf.org/?p=111 http://www.sudantribune.com/spip.php?article37909 http://allafrica.com/stories/201402230077.html http://www.2merkato.com/news/alerts/3588-ethiopia-and-djibouti-agreed-to-construct-oil-pipeline http://addisfortune.net/articles/ministry-of-mines-signs-agreement-with-chinese-firm-for-ogaden-gas-reserves/ https://www.youtube.com/watch?v=3naxSdtNcEw&t=129 http://capitalethiopia.com/index.php?option=com_content&view=article&id=3930:chinese-company-to-construct-oil-gas-pipeline-stretching-from-ethiopia-to-djibouti-&catid=54:news&Itemid=27 http://www.ethiojobs.net/company/64509/POLY-GCL-Petroleum-Investments-Limited-Ethiopian-Branch/ http://www.africa-energy.com/ethiopia-delonex-moves-into-ogaden-basin-blocks http://landdestroyer.blogspot.ca/2014/10/terrorism-and-turmoil-us-containment-of.html#more http://www.vice.com/read/the-bog-barons-0000287-v21n4 http://www.hrw.org/sites/default/files/reports/eastafrica1008web.pdf",2015-10-06 07:00:00+00:00,"['war', 'ethiopian', 'emerge', 'yemen', 'horn', 'uschina', 'rights', 'refugees', 'play', 'battle', 'ethiopia', 'region', 'field', 'powers', 'basin', 'different', 'ogaden', 'old', 'ogadeni']",Somalia,news article,English
1510,FL-2020-000038-EGY,50-year-old Nile dam altered lives - Northwest Arkansas Democrat-Gazette,https://www.nwaonline.com/news/2021/jan/17/50-year-old-nile-dam-altered-lives/,"MANIAL SULTAN, Egypt -- Yassin Saeed remembers when the Nile's annual flooding drenched his village in the years before the construction of the Aswan High Dam. Now, former flood lands are green fields year-round.

""Our lives were very hard,"" said the 76-year-old Egyptian, recounting how his father, his brothers and other farmers had to use the traditional felucca sailboats to harvest the corn crops in the flooded fields.

The area was flooded at least a third of the year; the villagers would erect mud barriers to prevent waters from reaching their homes. Then came the dam, which officially opened on Jan. 15, 1971.

Built in the 1950s and 1960s under the country's leader, the charismatic Gamal Abdel-Nasser, the Soviet Union helped in its construction after the United States and Britain withdrew financial support.

Their withdrawal was a factor in Nasser's subsequent decision to nationalize the Suez Canal, taking it from British and French companies. He planned to use canal revenue to finance the dam. Egyptians hailed it as the moment when their country finally threw off decades of imperialist control, and Nasser was called a patriot.

The move angered France and Britain. They, along with Israel, invaded and briefly took the canal in the 1956 Mideast war. But the United States and the Soviet Union ordered them to pull back, in what was seen across the Arab world as a defining victory for Nasser and Arab nationalism.

The dam's construction changed the very landscape of Egypt. It spared the farmers from seasonal droughts and flooding, and generated electricity, spurring Egypt's rapid development. For years, the dam served as the main source of power for the country, which has recently needed to invest in other sources to meet the needs of its booming population.

""It is the greatest Egyptian project since the time of the pharaohs,"" said Abbas Sharaky, a water resources professor at Cairo University, describing how the Nile was tamed.

The river is formed by its two tributaries, the Blue Nile, originating from Lake Tana in Ethiopia and the White Nile, from Lake Victoria in Uganda. The tributaries meet in central Sudan from where the Nile winds northward through Egypt and flows into the Mediterranean Sea.

The project ensured an adequate water supply all year, Sharaky said. In the 1980s, a prolonged drought dropped the Nile to its lowest level since 1913 south of the dam, and upstream countries faced drought and famine. But Egypt was spared. Lake Nasser, created by the dam, provided an alternative source of water.

Today, as Egypt marks 50 years of the Aswan Dam, it is embroiled in stormy negotiations with Sudan and Ethiopia to resolve a long-running dispute over another massive dam, one that Ethiopia is building on the Blue Nile, the main tributary of the Nile.

Ethiopia hopes its dam, now more than three-quarters complete, will generate electricity critical to help pull millions of its people out of poverty. Egypt, which relies almost entirely on the Nile to supply water for agriculture and its 100 million-strong population, fears a devastating effect if the Ethiopian dam is operated without taking its needs into account.

Despite the numerous benefits it brought, the Aswan High Dam also had negative side-effects. It increased the salt content of the soil used to grow food, holding back the rich silt that acted as a fertilizer, and drove thousands of villagers from their Nile Valley homes.

Some 50,000 Nubian people were subjected to forced resettlement in 1963 and 1964, to vacate the area where Lake Nasser, which covers 2,000 square miles, was created.

The world paid little attention to the displacement of the Nubians, who were moved to 44 new villages north of Aswan, but many still dream of returning to land along the lake, near their original homes.

There was, however, international uproar over antiquities dating to the times of the pharaohs that were endangered by the dam's encroaching reservoir. In 1960, the UNESCO issued an international appeal to save the temples of Abu Simbel, one of the country's most popular tourist attractions and a priceless treasure. More than 113 countries responded with funds or expertise at the time.

The temples were moved piece by piece to higher ground.

HOLD FILE - In this Jan. 15, 1971 file photo, water flows into the Aswan high dam after the inauguration ceremony in Aswan, Egypt. Egyptians are marking 50 years since the inauguration of the Nile dam, a massive feat of construction that has shaped the course of modern-day Egypt. It spared it from seasonal droughts and flooding, and generated electricity. (AP Photo, File)

FILE - In this April 1964 file photo, Workers are shown during construction of the Aswan High Dam over the river Nile in Egypt. Egyptians are marking 50 years since the inauguration of the Nile dam, a massive feat of construction that has shaped the course of modern-day Egypt. It spared it from seasonal droughts and flooding, and generated electricity. (AP Photo, File)

Yassin Saeed 76, an Egyptian farmer sits on a plot of land in the town of Atfih, Giza, Egypt, Tuesday, Jan. 12, 2021. Saeed remembers when the Nile’s annual flood drenched his village in the years before the construction of Aswan High Dam. Then came the dam, which officially opened after more than a decade of construction on January 15, 1971. Since then, crops grow year-round, but it also displaced members of the country's Nubian minority and had a lasting environmental impact on the region. (AP Photo/Nariman El-Mofty)

FILE - this May 7 , 2018 file photo, shows the high dam in Aswan, Egypt. Egyptians are marking 50 years since the inauguration of the Nile dam, a massive feat of construction that has shaped the course of modern-day Egypt. It spared it from seasonal droughts and flooding, and generated electricity, but it also displaced members of the country's Nubian minority and had a lasting environmental impact on the region. (AP Photo/Nariman El-Mofty, File)

A boat is moored on the Nile river in Atfih town, Giza, Egypt, Tuesday, Jan. 12, 2021. Egyptians are marking 50 years since the inauguration of the Aswan High Dam, a massive feat of construction that has shaped the course of modern-day Egypt. It spared it from seasonal droughts and flooding, and generated electricity, but it also displaced members of the country's Nubian minority and had a lasting environmental impact on the region. (AP Photo/Nariman El-Mofty)",2021-01-17 08:00:00+00:00,"['egypt', 'seasonal', 'lives', 'high', 'construction', 'spared', 'nile', 'dam', 'flooding', 'altered', 'aswan', 'electricity', '50yearold']",Egypt,news article,English
1487,FL-2019-000179-CAN,Back road to hope: Migrants flood Canada at remote NY outpost - BurlingtonFreePress.com,https://www.burlingtonfreepress.com/story/news/2017/08/09/back-road-hope-migrants-flood-canada-remote-ny-outpost/553716001/,"WILSON RING

Associated Press

CHAMPLAIN, N.Y. - They have come from all over the United States, piling out of taxis, pushing strollers and pulling luggage, to the end of a country road in the north woods.

Where the pavement stops, they pick up small children and lead older ones wearing Mickey Mouse backpacks around a ""road closed"" sign, threading bushes, crossing a ditch, and filing past another sign in French and English that says ""No pedestrians."" Then they are arrested.

Seven days a week, 24 hours a day, migrants who came to the U.S. from across the globe — Syria, Congo, Haiti, elsewhere — arrive here where Roxham Road dead-ends so they can walk into Canada, hoping its policies will give them the security they believe the political climate in the United States does not.

""In Trump's country, they want to put us back to our country,"" said Lena Gunja, a 10-year-old from Congo, who until this week had been living in Portland, Maine. She was traveling with her mother, father and younger sister. ""So we don't want that to happen to us, so we want a good life for us. My mother, she wants a good life for us.""

The passage — just across Lake Champlain and a little north of Burlington, Vermont — has become so crowded this summer that Canadian police set up a reception center on their side of the border. The center is in the Quebec community of Saint-Bernard-de-Lacolle, about 30 miles south of Montreal, or almost 300 miles north of New York City.

It includes tents that have popped up in the past few weeks, where migrants are processed before they are turned over to the Canada Border Services Agency, which handles their applications for refuge.

The Royal Canadian Mounted Police are adding electricity and portable toilets. A Canadian flag stands just inside the first tent, where the Mounties search the immigrants they've just arrested and check their travel documents. They are also offered food. Then shuttle buses take the processed migrants to their next destination. Trucks carry their luggage separately.

The Canadian military said Wednesday that about 100 soldiers began arriving to prepare a site for tents to accommodate almost 500 people. The soldiers will also install lighting and heating equipment.

How this spot, not even an official border crossing, became the favored place to cross into Canada is anyone's guess. But once migrants started going there, word spread on social media.

Under the 2002 Safe Country Agreement between the United States and Canada, migrants seeking asylum must apply to the first country they arrive in. If they were to go to a legal port of entry, they would be returned to the United States and told to apply there.

But, in a quirk in the application of the law, if migrants arrive in Canada at a location other than a port of entry, such as Roxham Road, they are allowed to request refugee status there.

Many take buses to Plattsburgh, New York, about 20 miles (32 kilometers) south. Some fly there, and others take Amtrak. Sometimes taxis carry people right up to the border. Others are let off up the road and have to walk, pulling their luggage behind them.

Used bus tickets litter the pavement, their points of origin mostly blurred by rain that fell on nights previous. One read ""Jacksonville.""

One Syrian family said they flew into New York City on tourist visas and then went to Plattsburgh, where they took a taxi to the border.

The migrants say they are driven by the perception that the age of Republican President Donald Trump, with his ban on travelers from certain majority-Muslim countries, means the United States is no longer the destination of the world's dispossessed. Taking its place in their minds is the Canada of Prime Minister Justin Trudeau, a member of his country's Liberal Party.

Most of the people making the crossing now are originally from Haiti. The Trump administration said this year it planned to end in January a special humanitarian program enacted after the 2010 earthquake that gave about 58,000 Haitians permission to stay temporarily in the U.S.

Walking toward the border in a group on Monday, Medyne Milord, 47, originally of Haiti, said she needs work to support her family.

""If I return to Haiti, the problem will double,"" she said. ""What I hope is to have a better life in Canada.""

Jean Rigaud Liberal, 38, said he had been in the United States for seven months and lived in Florida after he left Haiti. He learned about Roxham Road from Facebook and said he thinks ""Canada will be better than America.""

""We are not comfortable in America,"" said Liberal. ""We are seeking a better life; we don't want to go back to Haiti.""

On the New York side, U.S. Border Patrol agents sometimes check to be sure the migrants are in the United States legally, but they said they don't have the resources to do it all the time.

Besides, said Brad Brant, a special operations supervisor for the U.S. Border Patrol, ""our mission isn't to prevent people from leaving.""

Small numbers continue to cross into Canada elsewhere, but the vast majority take Roxham Road. U.S. officials said they began to notice last fall, around the time of the U.S. presidential election, that more people were crossing there.

Francine Dupuis, the head of a Quebec government-funded program that helps asylum seekers, said her organization estimates 1,174 people overall crossed into Quebec last month, compared with 180 in July 2016. U.S. and Canadian officials estimated that on Sunday alone, about 400 people crossed the border at Roxham Road.

""All they have to do is cross the border,"" Dupuis said. ""We can't control it. They come in by the hundreds, and it seems to be increasing every day.""

Canada said last week it planned to house some migrants in Montreal's Olympic Stadium. It could hold thousands, but current plans call for only 450.

In most cases, once the migrants are in Canada they are released and can live freely while their claims for refugee status are processed, which can take years. Meanwhile, they are eligible for public assistance.

Brenda Shanahan, the Liberal Party member of Parliament who represents the area, visited the site Monday. She is proud of her country for being willing to take in the dispossessed, she said, but there is no guarantee they will be able to stay in Canada.

""It's not a free ticket for refugee status, not at all,"" Shanahan said.

Opposition Conservative lawmaker Michelle Rempel said the Trudeau government lacks a plan to deal with the illegal crossings, even though a summer spike had been anticipated.

""All that we have heard is that we are monitoring the situation,"" she said. ""The government needs to come up with a plan right away to deal with this.""

It will further backlog a system in which some refugees are already waiting 11 years for hearings, Rempel said. Canadians will question the integrity of the immigration system if the ""dangerous trend"" of illegal crossings continues, she said.

Trudeau himself recently said his country has border checkpoints and controls that need to be respected.

""We have an open compassionate country, but we have a strong system that we follow,"" he said. ""Protecting Canadian confidence in the integrity of our system allows us to continue to be open, and that's exactly what we need to continue to do.""

Inancieu Merilien, originally of Haiti, moved to the United States in 2000 but crossed into Canada late last month. U.S. authorities, he said, are trying to scare Haitians by refusing to guarantee they'll be able to stay.

""There's a big difference here. They welcomed us very well,"" he said after leaving the Olympic Stadium to begin looking for a home in Montreal's large Haitian community. ""They're going to give us housing in apartments. I hope everything goes well.""

Contributing: AP writers Rob Gillies in Toronto, Evens Sanon in Port-au-Prince, Haiti, and Patrick Lejtenyi in Montreal.",2017-08-09 07:00:00+00:00,"['migrants', 'states', 'outpost', 'united', 'road', 'ny', 'canada', 'flood', 'country', 'roxham', 'border', 'canadian', 'haiti', 'remote', 'hope']",Canada,news article,English
