,Id,title,source URL,body,time,keywords,country,data source,language
352,FL-2021-000025-AUS,Floods pile pressure on Australia to rethink climate adaptation - Thomson Reuters Foundation,https://news.trust.org/item/20210325225707-a7fl6/,"As climate change impacts worsen, Australia's population is exposed to more severe floods, droughts and bushfires, while action to protect people and their homes lags

* Severe floods have pummelled several parts of the country

* Climate change hiking threats fast, including from bushfires

* Government now working on new climate resilience plan

By Michael Taylor

March 26 (Thomson Reuters Foundation) - Australia, now battling its worst floods in more than half a century, has failed to adapt fast enough to the growing threats it faces from the impacts of climate change, with its people now suffering the effects of ""wilful ignorance"", analysts warned.

Heavy rains hit several parts of the country this week, sweeping away houses, roads and livestock and cutting off entire towns in the east. Dangerous flash floods killed two people and more than 40,000 people were forced to flee their homes.

""They call Australia 'disaster alley' because we've got a bit of everything,"" said Karl Mallon, CEO of Sydney-based Climate Valuation, which advises homeowners and buyers on climate and extreme weather risks.

As global warming accelerates, it is bringing fiercer storms, floods and heatwaves, more severe droughts and a growing risk of bushfires to Australia.

""It's a shame on us that we haven't tackled this already... We've got every incentive and the money to do it, it's just that we're not looking at it,"" Mallon told the Thomson Reuters Foundation.

Despite knowing about climate change since the 1980s, Australia continues to build homes in floodplains, he noted.

The problem is often rooted in ""wilful ignorance"", he said, citing government reliance on land taxes, builders and developers putting profits before safety from climate threats, and homeowners seeking to minimise insurance payments.

Property buyers are given little information on flood risks, either by local government or banks and insurers, Mallon said.

""Sometimes the first time they find out is when they get hit - and they say 'I didn't know I was in a flood zone',"" he added.

Richie Merzian, climate and energy programme director at think-tank The Australia Institute, said so far the approach to adapting to climate change impacts has been disjointed between federal, state and council levels, curbing resilience.

""The federal government seems allergic to any mention of climate change which hampers smart policy responses,"" he said.

'SELF-COMBUSTING MANURE'

Last year's bushfires - which Prime Minister Scott Morrison dubbed Australia's ""black summer"" - killed more than 30 people, destroyed wildlife and razed over 24 million hectares (59 million acres).

When the crisis hit, Morrison's deputy was reported to have partly blamed ""self-combusting piles of manure"".

Meanwhile, the health of Australia's Great Barrier Reef, the world's most extensive and spectacular coral reef ecosystem, is in a critical state and deteriorating as climate change heats up the waters where it lies, conservation groups say.

""The first thing is to acknowledge that climate impacts will get worse and that 'one-in-100-years' type events will become more common, and we need to plan for that reality,"" said Cam Walker, campaigns coordinator at Friends of the Earth Australia.

To deal with the risks, a region-based approach to adaptation should be crafted that allows for joined-up responses between different levels of government and communities, he said.

Mallon said government, mortgage lenders and insurers needed to offer homeowners incentives to upgrade and better protect their properties, ensuring roofs are stronger against storms and flood barriers built around high-risk buildings.

At a municipal level, increased drainage, better sea walls and modern fire-fighting equipment would help, he added.

To reduce damage from bushfires, he advised at-risk property owners to clear guttering of flammable materials, install sprinklers and shutters that keep out embers, and use fire-retardant paint.

NATIONAL ADAPTATION PLAN

Australia has sophisticated weather monitoring systems and has been able to issue flood warnings and evacuate those in harm's way, potentially saving thousands of lives, said Merzian at The Australia Institute.

But despite the country's vulnerability to climate impacts, the government has been slow to conduct a national climate assessment or prepare a National Adaptation Plan, he said.

In January, Australia's environment minister committed to produce a new climate resilience and adaptation strategy this year, which it is due to publish before the COP26 U.N. climate talks in November.

As part of the initiative, Canberra said it would invest an initial A$12.9 million ($9.8 million) to prepare for disasters.

Protecting and restoring wetlands, mangroves and forests would help shield communities from floods and storms, while more trees in cities would also ease the effects of heat, green groups say.

Changing crops and tilling practices, and introducing livestock breeds that can tolerate drier conditions, are other options to combat droughts, said Will Steffen, a climate scientist at the Australian National University.

But conservative governments have been reluctant to change well-established practices in the agriculture and construction sectors, he said, adding that climate change has become ""a partisan political issue"".

BAND-AIDS ON BULLET-HOLES

Environmentalists say Australia is its own worst enemy due to its continued reliance on coal-fired power, which makes it one of the world's largest carbon-emitters per capita.

Green groups have long lobbied the government to ditch fossil fuels and set a goal to become carbon-neutral by 2050 - so far with little success.

""The government's failure to significantly cut emissions puts Australia and the Pacific region at risk of more fires, floods and cyclones,"" said Martin Zavan, campaigner at Greenpeace Australia Pacific.

""When it comes to adaptation, you can't put a band-aid on a bullet-hole and expect it to get better,"" he added.

Friends of the Earth's Walker noted that Australia had produced 240 reports on natural disasters since 1920, but citizens were still suffering the consequences.

""Adaptation without (emissions) mitigation means surrender on the issue of climate change,"" he said.

($1 = 1.3153 Australian dollars)

Read more:

The 86-year-old nun backing Australia's teen-led climate suit

Pandemic delays leave many nations facing climate action catch-up in 2021

Climate change lengthens Australian summers by 50% - study

(Reporting by Michael Taylor @MickSTaylor; editing by Megan Rowling. Please credit the Thomson Reuters Foundation, the charitable arm of Thomson Reuters, that covers the lives of people around the world who struggle to live freely or fairly. Visit http://news.trust.org)

Our Standards: The Thomson Reuters Trust Principles.",2021-03-26 07:00:00+00:00,"['change', 'climate', 'thomson', 'floods', 'adaptation', 'australia', 'rethink', 'bushfires', 'million', 'pile', 'australias', 'impacts', 'pressure']",Australia,news article,English
1172,FL-2016-000114-EGY,Egypt archaeologists stunned after draining flooded tomb: 'Never found anything like it' - Express.co.uk,https://www.express.co.uk/news/world/1190397/egypt-flooded-tomb-gebel-el-silsila-tony-robinson-channel-5-great-pyramid-sphinx-spt,"Egypt: Researchers make incredible discovery in flooded tomb

top stories direct to your inbox SUBSCRIBE Invalid email Sign up to receive our rundown of the day'sdirect to your inbox When you subscribe we will use the information you provide to send you these newsletters. Sometimes they'll include recommendations for other related newsletters or services we offer. Our Privacy Notice explains more about how we use your data, and your rights. You can unsubscribe at any time.

Tony Robinson visited Gebel el-Silsila to meet with archaeologist John Ward for his new Channel 5 show “Egyptian Tomb Hunting,” who had uncovered what he believed to be an entrance to a hidden chamber. The hole, which scaled down more than 20 feet, was completely filled with water. Unsure on the source of the pool, the pair used pumps in a bid to get a look at what could be hiding inside.

After crawling on their hands and knees through a thick layer of mud, they got to a huge chamber, with another door awaiting them ahead. Mr Robinson asked: “Look at it, what do you reckon would be in there?” Before Mr Ward responded: “I don’t know, it’s totally different to any of our tombs that we’ve found in Silsila. “If that secondary chamber is another burial, we’re not talking about 50-60 people plus.""

The archaeologists uncovered an amazing find

Mr Ward found this flooded hole

In all my years of finding pottery, I’ve never found anything like this Tony Robinson

Mr Robinson was stunned by the tomb, adding: “And all their bits and pieces are mixed in beneath our knees, like human soup. “The idea that so many people might be down here is pretty eerie, and some of them at least must have been of real status. “This chamber has been carefully chiselled out, and this doorway beautifully finished.” The pair began excavating the tomb, getting completely covered in dirt in the process. Mr Ward told viewers: “What’s intriguing me is that the ceiling is vaulted, it has got an arch to it. JUST IN: 'The spy in the BBC’ How undercover Nazi sent coded messages over national radio

The pair headed down

Below they found a huge tomb

They pumped the water out of the tomb

In the corner a piece of history was found

“But as the water level inside the chamber goes down, there’s a discovery in the very far corner. “Looks like a handle, it’s a pot, a big, big pot, it’s a huge pot, look how far it goes [back]. “I’m fairly sure we’ve discovered a large amphora, I can even feel the rounded bottom, it must be at least two foot tall. “In all my years of finding pottery, I’ve never found anything like this, it’s like a huge whale.” Mr Ward then explained how incredible the find was, adding: “It would have held some kind of food substance that was buried with the dead.

The sites of ancient Egypt

Trending",2019-10-17 07:00:00+00:00,"['flooded', 'egypt', 'draining', 'ward', 'huge', 'water', 'stunned', 'chamber', 'pot', 'mr', 'look', 'pair', 'robinson', 'tomb', 'archaeologists']",Egypt,news article,English
1866,FL-2021-000038-KEN,MOROCCO: IFC finances studies on the recovery of industrial waste in Tangier - AFRIK 21,https://www.afrik21.africa/en/morocco-ifc-finances-studies-on-the-recovery-of-industrial-waste-in-tangier/,"In Morocco, the management of industrial waste remains very sensitive. The Cherifian kingdom produces 1.5 million tonnes of industrial waste each year, of which about 350,000 tonnes are identified as hazardous. According to the Moroccan authorities, only 23% of this waste is recycled in the kingdom, yet it is very harmful to humans and the environment.

The General Confederation of Moroccan Enterprises (CGEM) of Tangier-Tetouan-Al Hoceima (TTA) and five associations representing investors in the Tangier Export Processing Zone, the industrial zones of Gzenaya, Mghogha and Al Majd, as well as the Tangier Automotive City free zone, want to improve industrial waste management in Morocco. On April 15th, 2021, these key players in the Moroccan economy launched studies for the recovery of industrial waste in the Kingdom.

Read Also Urban sanitation, a major challenge for sustainable cities in Africa

Initially, the waste management project will be deployed in Tangier, the second largest economic hub in Morocco after the city of Casablanca. The initiative, implemented by a specialised international office, will make it possible to define the best model for managing this type of waste for the city of Tangier. This model can then be applied to other cities in Morocco. The studies, which will last four months, will also promote the development of a circular economy around industrial waste, thus creating employment opportunities for young Moroccans.

IFC funding

The studies on industrial waste management in Tangier are being financed by the International Finance Corporation (IFC), a subsidiary of the World Bank Group responsible for financing the private sector. The results of the investigations will also be used by waste management companies, such as Suez, that wish to invest or set up in Morocco. In this North African kingdom, the French group manages the waste produced in the factories of car manufacturers PSA and Renault.

In March 2021, the local subsidiary of the French environmental giant Suez Maroc also won the contract to manage the waste of the Moroccan Tobacco Company (SMT). This new contract will run for two years.

Inès Magoum",2021-04-20 07:00:00+00:00,"['city', 'waste', 'moroccan', 'ifc', 'finances', 'recovery', 'zone', 'management', 'kingdom', 'tangier', 'studies', 'industrial', 'morocco']",Kenya,news article,English
2186,FL-2017-000155-VNM,Four storms in one month: Cyclone Molave threatens Vietnam - The New Humanitarian,https://www.thenewhumanitarian.org/maps-and-graphics/2020/10/27/asia-vietnam-flood-october-cyclone,"BANGKOK

Cyclone Molave  the fourth tropical cyclone to threaten Vietnam this month  is barrelling towards the countrys central coast, worsening severe floods and landslides that have inundated parts of the region for weeks.

Vietnamese authorities are rushing to evacuate half a million people before Molave makes a projected 28 October landfall, packing wind speeds topping 110 kilometres per hour. The country is already struggling with intense floods and landslides that have killed at least 130 people and damaged a quarter of a million homes.

The Vietnamese Red Cross has already warned that 160,000 people may need food aid over the next six months, but that figure could rise after Molave makes landfall and its impact becomes more clear.

Aid groups say parts of Vietnam are seeing their worst floods and landslides in two decades. Disasters are common during Asias various monsoon seasons, but this months flurry of storms has aggravated conditions, with weeks of extended heavy rainfall.

Parts of Laos and Cambodia are also submerged. And Thailand is projecting that Molave's rains will hit the countrys north and northeast.

Before threatening Southeast Asias Mekong region, Cyclone Molave uprooted some 25,000 people in the Philippines earlier this week.

Read more -> In Vietnam, floods warn of climate change risks to come

il/ag",2020-10-27 07:00:00+00:00,"['threatens', 'vietnam', 'flooded', 'landfall', 'storms', 'landslides', 'makes', 'region', 'month', 'floods', 'months', 'parts', 'million', 'cyclone', 'molave']",Vietnam,news article,English
2002,FL-2017-000017-PAK,May 21: a day of special significance for China and Pakistan - Daily Times,https://dailytimes.com.pk/758734/may-21-a-day-of-special-significance-for-china-and-pakistan/,"May 21, 2021 is a day of special significance for the Peoples Republic of China and the Islamic Republic of Pakistan. As the Chinese old saying goes, Even mountains and seas cannot distance people with common aspirations. 70 years ago, China and Pakistan joined hands overpass the Karakoram Mountains to formally establish diplomatic relations. The past 70 years have witnessed the two countries sharing weal and woe. The time-tested China-Pakistan friendship now sets exemplary for state-to-state relations, and is strategic asset for both countries, most dearly cherished by the two peoples.

Similar histories brought us close to each other. Both China and Pakistan are developing countries and have similar experiences in getting rid of foreign aggression and seeking independence. At such critical times, be it when New China endeavored to break the external blockade and open up a new prospect for diplomacy, or when Pakistan stood up to crises to defend national dignity, we have always been there for each other.

Similar ideas guide us stand shoulder to shoulder. China and Pakistan are the backbones in maintaining regional peace and stability. The two countries firmly defend multilateralism, free trade and win-win cooperation, commit to improving the global governance system, and support increasing the representation and voice of developing countries in international affairs. China and Pakistan always respect the diversity of civilizations, and advocate the vision of exchanges rather than estrangement, mutual learning rather than conflict, and coexistence rather than seeking superiority.

Common interests deepen our cooperation. The China-Pakistan Economic Corridor (CPEC) is an important pilot project of the Belt and Road Initiative. 46 projects have been completed or under construction, with a total investment of US$25.4 billion. The CPEC successfully helped Pakistan solve the power shortage that has plagued it for decades, established the main traffic line from north to south, and revitalized Gwadar Port to become a regional trade hub. China has been Pakistans largest trading partner for six consecutive years and largest source of FDI for seven consecutive years.

The tests of crisis reconfirms our common choice. The two peoples are always the first to lend a helping hand to each other when the other side is in trouble. When Wenchuan earthquake hit China in 2008, and when flood plagued Pakistan in 2010, both sides supported each other with full efforts. After the outbreak of Covid-19 pandemic, the governments, armies and all walks of life of the two countries have rendered mutual assistance, and carried out close cooperation in fields of emergency supplies, Covid-19 prevention experiences-sharing, vaccine research and development, thus setting a model for international cooperation against the pandemic.

2021 is a year of great significance for both China and Pakistan. China celebrates the 100th anniversary of the founding of the Communist Party of China and is implementing the 14th Five-Year Plan to embark on a new journey of modernization. Pakistan is making every effort to develop its economy and realize the Naya Pakistan vision proposed by Prime Minister Imran Khan, providing us with new opportunities for China-Pakistan cooperation. Standing at a new historic starting point, the two countries should further implement the important consensus reached by our leaders, continue to deepen the iron-clad friendship between China and Pakistan, and jointly build a closer China-Pakistan Community of Shared Future in the New Era.

China will continue to put Pakistan on the top agenda of its diplomacy, and firmly support Pakistan to maintain sovereign independence and territorial integrity, and exert a greater constructive role in international and regional affairs. We will continue to provide Pakistan support of medical supplies and vaccines within our capacity until Pakistan completely defeats the pandemic. Following the principle of mutual benefit, win-win cooperation, opening-up and inclusiveness, China will work with Pakistan to boost high-quality development of the CPEC, focus more on industry, agriculture, science and technology and peoples livelihood, so as to develop Pakistans manufacturing industry and increase employment and income of its people. China will continue to work closely with Pakistan to deepen the friendship between the two peoples, especially the young generation. We will endeavor to carry forward the China-Pakistan iron-clad friendship for another 70 years, enhancing the all-weather friendship and all-dimensional cooperation, and work together to uplift China-Pakistan bilateral relations to a new level with a brighter future.

Last but not the least, on behalf of the Embassy of China in Pakistan, I would like to extend my sincere gratitude and great respect to Pakistani friends from all circles who care about and support the development of our bilateral relations.

Chin-Pak Dosti Zindabad!

The writer is the Ambassador of Peoples Republic of China in Pakistan",2021-05-21 02:15:34+00:00,"['significance', 'work', 'support', 'cooperation', 'china', 'pakistan', '21', 'friendship', 'special', 'countries', 'continue', 'chinapakistan', 'peoples', 'day']",Pakistan,news article,English
97,DR-2015-000134-SOM,Piper Perabo Shares Experiences Of Visiting Syrian Refugees In Greece - Look To The Stars,https://www.looktothestars.org/news/14385-piper-perabo-shares-experiences-of-visiting-syrian-refugees-in-greece,"Piper Perabo – in partnership with WhoSay and the International Rescue Committee – recently visited Syrian refugees in Greece, and has written about her experiences.

Piper Perabo meets refugees who have landed on the Greek island of Lesbos

Credit/Copyright: ZEpaminondas/IRC

“A few weeks ago, I went to Greece with the International Rescue Committee — (the IRC) — a global humanitarian aid , relief, and development nongovernmental organization — to help out in any way I could,” she wrote. ""The Greek island of Lesbos is the closest to the shores of Turkey, so thousands of people arrive on these flimsy, rubber boats each day. On Lesbos, both refugees and inhabitants need all the help they can get.

“During the few days I was there, the IRC staff, along with local officials and volunteers, helped register more than 15,000 people. But that’s not all they did. They greeted incoming boats, organized buses for people traversing the mountain roads, cleaned the transit camp, and provided shelter and assistance to the most vulnerable — all the while treating people with dignity and humanity.

“What stood out to me most was just how incredibly patient and full of good will the Greek people and the refugees were after all they have been through. I got to know dozens of them during my time on the island and was moved by their kindness, sheer determination, and concern for one another.”

To read the full blog, click here.",2015-10-13 07:00:00+00:00,"['help', 'shares', 'island', 'irc', 'international', 'visiting', 'perabo', 'refugees', 'experiences', 'rescue', 'lesbos', 'greek', 'piper', 'syrian', 'greece']",Somalia,news article,English
