,Id,title,source URL,body,time,keywords,country,data source,language
1395,FL-2019-000179-CAN,Canada: extreme floods show climate threat as experts warn of further tumult - The Guardian,https://www.theguardian.com/world/2019/apr/30/canada-flooding-quebec-montreal-justin-trudeau-climate-change,"News footage showed people boating where they once walked, homes and cars filled with muddy water, volunteers searching for lost pets. Thousands of people in eastern Canada have been forced from their homes as heavy rains and meltwater cause unprecedented flood evacuations.

One of the worst-hit areas was a Montreal suburb where more than 6,000 people were evacuated after a dike burst on Sunday. A further 3,000 people were evacuated in other parts of Quebec, and in Ontario and New Brunswick, hundreds more are waiting out the floods in hotels and shelters.

“This year’s flooding is very extreme,” said Ursule Boyer-Villemaire, an associate professor at the Université du Québec à Montréal who specializes in disaster management and climate resilience planning.

Climate change means that catastrophic flooding will only become more common, but experts say the events of the past week highlight the fact that Canada has still not done enough to prepare for such disasters.

The current mass evacuations have forced Canadian politicians at every level to confront this dramatic evidence of climate change in a federal election year. Speaking on Sunday night, Justin Trudeau, the prime minister, suggested that using federal money to help relocate communities affected by flooding was a possibility. “Once we secure the situation through this spring flooding season, we will have to have significant reflections and conversations on how we move forward,” he said, according to the Canadian Press.

This is not the first time Quebec has seen large-scale flooding: in 2017, Quebec rivers reached similar levels.

The fact that two so-called “hundred-year floods” occurred so close together has climate preparedness experts concerned.

Rapid temperature increases in spring and huge variation in the amount of precipitation, two factors in the flood, are related to climate change, said Laura Coristine, a biologist at the University of British Columbia.

Rescue and relief operations in Sainte-Marthe-sur-le-Lac. Photograph: Sebastien St-Jean/AFP/Getty Images

But Canada has done little to prepare for flooding that is likely to become even more common as the planet continues to warm, she said. “Responding to disaster is going to be a lot more expensive than being proactive in vulnerable sites.”

Ontario’s premier, Doug Ford, whose government has fought hard against the imposition of a country-wide carbon tax aimed at curbing emissions, toured flooded areas near the Ottawa River on Friday night. According to the Canadian Press, Ford did not explicitly mention climate change but did say “something is going on and we have to be conscious of it”.

Meanwhile, the leaders of Quebec and New Brunswick, the other affected provinces, are starting to talk about permanently relocating communities in flood-prone areas.

That is not a simple thing to consider, said political scientist Daniel Henstra, an associate professor at the University of Waterloo who studies flooding in Canada: when a similar strategy was tried in Calgary after 2013 flooding, only 30% of homeowners in a high-risk flood area took the offered buyout so they could move.

Currently, Quebec is offering residents C$200,000 (US$150,000) to move, but that may not even cover the mortgage for many.

There are some other options, Henstra said, such as building flood barriers to keep the water in the river. “These types of barriers are really expensive to install and maintain,” he said “and they cause environmental impacts downstream.” A more widely adopted strategy, globally speaking, is just to plan for flooding and keep people from building in flood plains.

More extreme attempts to get them to move, such as mandating a buyout, could be politically damaging, but that might be what it takes to get everyone out of a flood-prone area, said Henstra. “These are the kind of tough decisions we’re facing,” he says, “and we’re just at the beginning of having those hard conversations.”",2019-04-30 07:00:00+00:00,"['change', 'water', 'warn', 'threat', 'quebec', 'floods', 'canada', 'tumult', 'climate', 'flood', 'extreme', 'university', 'canadian', 'flooding', 'experts', 'henstra']",Canada,news article,English
42,DR-2014-000109-CHN,Celebrating The Work Of Robin Williams | Here & Now - WBUR,https://www.wbur.org/hereandnow/2014/08/12/celebrating-robin-williams,"Comedy star Robin Williams died yesterday at age 63. Sheriff's officials say he committed suicide by hanging himself in his San Francisco Bay Area home.

Here & Now's Jeremy Hobson listens back to some of Williams' great roles in films including “Dead Poets Society,” “Mrs. Doubtfire,” “The Birdcage,” “Aladdin” and “Good Morning, Vietnam,” as well as the TV series “Mork & Mindy.”",2014-08-12 07:00:00+00:00,"['vietnam', 'tv', 'yesterday', 'robin', 'williams', 'work', 'suicide', 'series', 'say', 'star', 'celebrating', 'society', 'sheriffs']",China,news article,English
1779,FL-2021-000030-IDN,Innovative technologies to combat flooding in England through £150 million fund - Yahoo News UK,https://uk.news.yahoo.com/innovative-technologies-combat-flooding-england-210000507.html,"Innovative technologies involving flood alert apps and “sponge” road surfaces will be deployed across England as part of a new project aiming to combat flooding.

The Department for Environment, Food and Rural Affairs (Defra) has announced a £150 million funding package to be shared between 25 local schemes aiming to improve waterway defences and coastal resilience.

This is part of the Government’s new Flood and Coastal Resilience Innovation Programme – an effort to develop and test new approaches to tackling coastal erosion and mainland flooding – and will be managed by the Environment Agency.

Flooding in Whitley Bay, North Tyneside (Owen Humphreys/PA)

A wide range of approaches tailored to local communities will be trialled, including the restoration of sub-tidal habitats like kelp beds, oyster reefs and sea grass near South Tyneside, and an app to warn residents about the threat of groundwater in Buckinghamshire.

Artificial intelligence and new sensor technology to detect rising water levels will be used in Northumberland, and in Cornwall sand dunes will be protected and saltmarshes restored.

In Slough, the Chinese “sponge city” concept will be deployed, which is the use of permeable roads to soak up surface water, along with natural vegetation to improve drainage.

Environment minister Rebecca Pow said the Government has pledged to invest £5.2 billion in 2,000 new flood and coastal defences over the next six years, adding that “long-term approaches to improve communities’ resilience” is vital in the face of climate change.

She said: “These 25 projects will not only help to inform future approaches to prepare communities for flooding and coastal change across the country, but also help reinforce the UK’s position as a world leader in innovation and new technology as we build back better.”

Emma Howard Boyd, chair of the Environment Agency, said the project is “extremely exciting” and could be replicated on a larger scale around the world if successful.

She said: “The innovation programme is extremely exciting as it begins to put new aspects of the national flood and coastal erosion risk strategy to the test.

Story continues

“What we learn will inform our approach to the climate crisis in the coming decades and it’s something to tell our international partners about at Cop26.

“I’m particularly interested in the projects that test the ability of nature-based projects to generate revenue.

“If successful, these could be scaled up by private finance around the world, helping to prepare for climate shocks, restore nature and create jobs.”",2021-03-28 07:00:00+00:00,"['england', 'projects', 'communities', 'coastal', 'climate', 'approaches', 'innovation', '150', 'flooding', 'fund', 'flood', 'world', 'million', 'technologies', 'combat', 'improve', 'environment', 'innovative']",India,news article,English
941,DR-2011-000121-CHN,Book review: 'Grand Pursuit' by Sylvia Nasar - Los Angeles Times,https://www.latimes.com/books/la-xpm-2011-sep-11-la-ca-sylvia-nasar-20110911-story.html,"Grand Pursuit

The Story of Economic Genius

Sylvia Nasar

Simon & Schuster: 559 pp., $35

Advertisement

Today’s economy may seem the bleakest in recent memory: plunging consumer confidence, slumping home prices, a stubbornly high unemployment rate. But as Sylvia Nasar reminds us in “Grand Pursuit: The Story of Economic Genius,” in 1933 a full 25% of the nation was out of work, suicides were rising sharply, and stocks were trading at one-fifth of their 1929 prices.

Then, as now, public leaders struggled with solving the spiraling economic crisis. In 1934, President Franklin Delano Roosevelt met with John Maynard Keynes, a British economist known for his love of art, his taste in young men and his brilliant if controversial theories. He urged the president to spend more on stimulus programs to shake the country out of its stupor. At a New York dinner the next evening, Keynes told some of his colleagues that every dollar spent by the government — deficit or no — would have a great effect on the nation’s economy.

“Were the seven wonders of the world built by thrift?” he once asked. “I doubt it.”

Keynes and his theory about the benefits of deficit spending still resonate today, as is evident by the debate over the Obama administration’s stimulus program. The exploits of Keynes — he bullied Britain’s National Gallery into buying hundreds of modernist paintings from a fire-sale auction in Paris on the eve of World War I, securing a Cezanne and two Delacroix for himself — would be enough to fill a book. But Keynes is just one of the economists Nasar features in “Grand Pursuit.”

Beginning her book in the era of Charles Dickens, “when the specter of hunger was stalking England,” Nasar takes us through the times that influenced economic thinkers and the theories they put forth. We see Marx — a lazy procrastinator who impregnates his wife and a housekeeper in the same year — walking through the streets of London with his generous, patient sponsor Engels, “their extreme myopia and the sulfurous yellow London fog obscur[ing] everything more than a foot ahead.”

We also see Joseph Schumpeter, who theorized that entrepreneurs were the key to economic progress and who had a habit of challenging university librarians to duels and arriving at lectures in jodhpurs. Beatrice Potter Webb, who advanced the idea of a welfare state and advocated for a government safety net, arrived at that conclusion only after a failed love affair with Joseph Chamberlain, the father of a future British prime minister. Alfred Marshall, a founder of modern economics, wore a handlebar mustache and took up knitting during an illness, and discovered, Nasar writes, that businesses didn’t just exist to produce a profit for their owners. He realized they were also meant to “produce higher living standards for consumers and workers.”

It is the quirks and personalities of these economic thinkers that bring “Grand Pursuit” to life. Nasar argues that the details of their personal successes and failures — along with the weighty history revolving around them — inspired their individual conclusions about how the system works.

But the book can seem at times like just a grab bag of different economists, countries and ideas. In “A Beautiful Mind,” Nasar’s 1998 biography of John Nash Jr. that was made into a movie and nominated for a Pulitzer Prize, the author focused in depth on one man’s theories and personal life. In “Grand Pursuit,” Nasar tries to tackle dozens of men and women, and at times the book gets confusing as different characters — Milton Friedman, for example — wander in and out of chapters. Chapters on Indian economist Amartya Sen and on Joan Robinson’s adulation of the communist governments of Russia and China feel superfluous, making the reader want to jump back to the early 20th century, which Nasar paints more vividly.

Advertisement

Still, through Nasar’s ambitious storytelling, we see Western society evolve from one in which most people live in poverty to one in which government tries to grapple with unemployment and inflation and raise the standard of living for all. If Nasar puts perhaps too much emphasis on the influence of early economic thinkers — who after all were observing conditions rather than creating them — she does show how fully the profession has become entwined with the way governments run. We see the rise of economic forecasting in her pages, as well as the increasing influence of figures like Keynes on leaders like Roosevelt. The number of economists in Washington, D.C., she says, shot up from 100 in 1930 to 5,000 by 1938.

Much of “Grand Pursuit” may be a reminder that as bad as things seem now, they have been worse — much worse — and that those difficult times can shed light on what is happening today. Economists have always tried to come up with theories about how to stimulate flaccid economies. The reader finishes Nasar’s book wondering what brilliant and quirky thinker may fill in the next chapters of our economic history and come up with an idea that shakes our current economy out of its funk.

alana.semuels@latimes.com",2011-09-11 07:00:00+00:00,"['review', 'economic', 'pursuit', 'keynes', 'times', 'grand', 'sylvia', 'thinkers', 'book', 'theories', 'economists', 'nasar']",China,news article,English
2048,FL-2017-000017-PAK,"Record Rains, Urban Flooding Woes Continue in Karachi - Voice of America",https://www.voanews.com/south-central-asia/record-rains-urban-flooding-woes-continue-karachi,"ISLAMABAD - Parts of Pakistan's commercial hub, Karachi, continued to be submerged Monday, days after record-breaking rainfall caused heavy flooding.

""Normal rainfall in Karachi in the month of August is 68 millimeters (6.8 centimeters). This year, we have recorded 587.5 millimeters (58.75 centimeters) so far,"" said Muhammad Riaz, the director general of Pakistan's Meteorological Department.

Last Thursday, the city received more than 23 centimeters of rain, the highest on record in a single day.

FILE - A man wades through the flooded street during monsoon rain, in Karachi, Pakistan, Aug. 27, 2020.

Residents in the port city posted cellphone footage of houses destroyed, streets resembling rivers, cars and motorcycles floating, and people swimming.

""What we have witnessed in Karachi today was apocalyptic in some ways. The true hurt & damage will be visible after the water recedes. Nothing but devastation,"" resident Fakhr e Alam tweeted along with cellphone video of his neighborhood, where water covered almost half the walls and gates of surrounding houses.

This was 26th street DHA Karachi, my neighborhood....this is why I was worried about my family, my father. What we have witnessed in Karachi today was apocalyptic in some ways. The true hurt & damage will be visible after the water recedes. Nothing but devastation. #KarachiRain pic.twitter.com/loWHBQ1rZC  Fakhr-e-Alam (@falamb3) August 27, 2020

Another video shot from inside a car showed the bottom part of the steering wheel submerged.

The flooding severely hampered movement, including for emergency vehicles.

""My Uncle in Karachi had a heart attack this evening and relatives and neighbors tried everything from trying to drive him to physically carrying him on their shoulders to get to the hospital, but they couldn't make it on time and he passed away,"" Fatima Akram Hayat said in a tweet.

Residents complained of sewage on the streets and in water tanks. Power was out in several areas for days amid sweltering heat and humidity. The outage also caused disruptions in cellphone service, interrupting emergency management and leaving citizens out of touch with loved ones.

In some cases, the electricity cables broke, causing fears of electrocution.

""Few residents located in these zones have also requested us not to power up supply since it may be a safety hazard for them,"" tweeted Karachi's electricity provider, K-Electric.

FILE - Men push a truck through a flooded road during monsoon rain, in Karachi, Pakistan, Aug. 25, 2020.

Meanwhile, authorities said another weather system was hovering over Sindh province, increasing the likelihood of more rains in the coming days.

The large metropolis, considered to be Pakistan's economic lifeline, has faced problems of overcrowding and unplanned development since the country's independence in 1947.

""[A] very large majority of its population lives in informal settlements in poorly designed housing with inadequate services,"" according to a 2017 working paper, titled, ""Drivers of climate change vulnerability at different scales in Karachi.""

Much of the city's planning woes have been exacerbated over the decades due to corruption coupled with political rivalries among local, provincial and federal governments.

Parts of Karachi are owned by the federal government. In addition, local and provincial governments have set up parallel structures of service delivery, like trash pickup, diluting resources.

FILE - People with their motorbikes wade through the flooded road in Karachi, Pakistan, Aug. 27, 2020.

""We need to clearly understand who is responsible for what. Until the municipal functions are divided between the federal and provincial governments, problems of delivery will remain,"" Murtaza Wahab, the spokesman for Sindh government, told local news channel Geo News.

According to the working paper, bad governance and development shortcomings in Karachi ""have created vulnerabilities at different scales that are likely to exacerbate the impacts of climate change-related weather events taking place within the city and elsewhere in the country.""

Development professional Zaigham Khan said overcrowding and slum developments were a result of the city absorbing the social and economic problems of the entire country.

""If there is terrorism in FATA (erstwhile tribal area), locals move to Karachi. When there is war in Afghanistan, the most refugees arrive in Karachi. When there are floods in the country, the affected go to Karachi. If there is insurgency in Balochistan, locals escape to Karachi. If there are no jobs in southern Punjab, the preferred refuge is Karachi,"" he said.

Like other metropolitan cities of the world, he said, Karachi needs to be managed by a strong municipal government and an empowered mayor, but he added that local politics intervened in the execution of such an idea.",2020-08-31 07:00:00+00:00,"['woes', 'rains', 'city', 'problems', 'local', 'record', 'pakistan', 'water', 'rain', 'pakistans', 'flooded', 'flooding', 'karachi', 'urban', 'continue', 'provincial']",Pakistan,news article,English
