,Id,title,source URL,body,time,keywords,country,data source,language
2029,FL-2017-000017-PAK,Mangoes from Vietnam and Cambodia impacting Chinese local industry - FreshPlaza.com,https://www.freshplaza.com/article/9322453/mangoes-from-vietnam-and-cambodia-impacting-chinese-local-industry/,"Recently, a ceremony celebrating the first shipment of Cambodian fresh mango exports to China was held in Phnom Penh, the capital of Cambodia. It is reported that the first shipment of 80 tons of fresh mangoes departed from Phnom Penh Port, and will arrive in China by sea via Ho Chi Minh Port, Vietnam. It is expected that 100,000 tons of Cambodian mangoes will enter the Chinese market this year. Although the volume is not large compared with China's local production, they will still impact the Chinese mango market, as the production of the entire Hainan Province this year is expected to be only about 800,000 tons, and these extra 100,000 tons will directly lead the price of local mangoes to fall.

At the same time, the consumer market in Cambodia is in severe oversupply. The market price is low, but the product quality is high, coupled with the yearly export quota of 500,000 tons, they surely will impress their rivals with strong competitiveness.

China is the world's second-largest mango exporter, with a yearly production of more than 2.4 million tons. They also import fresh mangoes from 10 countries and regions, including India, Pakistan, the Philippines, Australia, Vietnam, Peru, and most recently Cambodia.

Mango market in 2021

Many regions in southern China are key mango-producing areas, such as Hainan, Guangdong, Guangxi, and Yunnan. The production in Guangxi alone this year reached 800,000 tons. In March, when products from Hainan became available, the highest purchase price reached 7 yuan per half a kilo. From May, with products flooding the market, prices fell. Just as prices of mangoes from Hainan started to fall, mangoes from Guangdong became available and were about to flood the market. It is understood that the yearly production in Guangxi this year will also reach 800,000 tons.

Local growers in Guangxi said that due to the uncertainty in the international market, there are much fewer orders for export compared with previous years. The taste of mangoes from Baise, Guangxi is as good as those from Vietnam, and products from Guangxi can leverage their advantages in pricing.

Current status of Chinese mango cultivation

At present, among the varieties grown in China, many are mid-late and late varieties. The variety structure is not varied, making the harvesting period in various regions short and the market window concentrated, leading to high sales pressure. In certain markets, the pressure of competition is high, and the ability to withstand risks is low, therefore influencing the prices.

In recent years, the production in Hainan and Guangdong provinces has also gradually increased. The slight decline in mango prices this year is mainly due to weather and market factors. On the one hand, since March this year, the temperature in southern regions has risen sharply, helping plant and fruit growth, leading to a bumper harvest, resulting in oversupply. On the other hand, the pressure of competition in the industry has increased, and a large number of traders are involved in the business, which has led to the fall in wholesale prices.

Moreover, due to large imports, the price of imported mangoes has also fallen. At present, two-thirds of mangoes on the market are Gaolemi and golden mangoes from Vietnam. Due to cheaper rent and lower labor costs, although Vietnamese mangoes are imported, their prices are still lower than those of Chinese mangoes. The invasion of Cambodian mangoes has also brought headaches to Chinese mango traders.

Source: Wanguohui",2021-05-20 11:58:40+00:00,"['production', 'impacting', 'tons', 'mango', 'mangoes', 'local', 'hainan', 'regions', 'cambodia', 'industry', 'vietnam', 'market', 'guangxi', 'chinese']",Pakistan,news article,English
623,Drought Sri Lanka,Sri Lankan Accused of Leading Attacks Preached Slaughter. Many Dismissed Him. - The New York Times,https://www.nytimes.com/2019/04/25/world/asia/sri-lanka-attacks-mastermind.html,"Whether Mr. Zaharan found the Islamic State or the Islamic State found him, they seemed inextricably drawn to each other. In other places, like Indonesia and the Philippines, the Islamic State has been adept at taking Islamic radicals with local grievances and enlisting them in the global slipstream of terror.

By 2017, Mr. Zaharan and his followers were targeting a Sufi sect in Kattankudy, accusing its members of being infidels, even though Sufis are fellow Muslims who practice a mystical form of the faith. After the Sufis in Kattankudy handed out packets of rice to the poor, an action that Mr. Zaharan regarded as trying to buy hungry converts, he grabbed a sword and charged the crowd.

The police said they tried to arrest Mr. Zaharan and one of his brothers, but they escaped.

About 10 of his followers were detained, however, including his father and other relatives. Surprisingly for a small group from a distant part of Sri Lanka, the detained members of National Thowheeth Jama’ath managed to get a high-profile lawyer from Colombo to represent them.

H.M. Ameer, a member of the Sufi community, said that he and other Sufis had repeatedly contacted the police to warn about Mr. Zaharan’s extremism. They sent a thick file to Colombo. But there was little result, Mr. Ameer said. His assessment echoed complaints from recent days that Sri Lankan authorities failed to act on repeated warnings from overseas intelligence agencies about Mr. Zaharan planning a catastrophic attack.

On Thursday, Sufis in Kattankudy received a warning from the Sri Lankan criminal investigation department that their holy places might be targeted on Friday by militants associated with Mr. Zaharan who are still on the run.

Looking out on soldiers guarding the Badhriyyah Jumah Mosque where he and other Sufis worship, Mr. Ameer shook his head.

“We warned them that this man was vehemently spreading Wahhabism and that he was calling for jihad,” he said. “It was out in the open, clear as day. Nothing was done.”",2019-04-25 07:00:00+00:00,"['slaughter', 'places', 'islamic', 'state', 'lankan', 'dismissed', 'ameer', 'sufis', 'attacks', 'sri', 'sufi', 'mr', 'accused', 'zaharan', 'leading', 'preached', 'kattankudy']",Sri Lanka,news article,English
2387,FL-2017-000067-BRA,"Flooding in Brazil, Peru Displaces Thousands and More Rain Is on the Way | The Weather Channel - Articles from The Weather Channel | weather.com - The Weather Channel",https://weather.com/news/news/2021-02-25-brazil-peru-flooding-thousands-displaced,"At a Glance At least 10 cities in the Brazilian state of Acre have been submerged by floodwaters.

The Acre River in Rio Branco climbed 6.5 feet above flood stage.

Brazilian President Jair Bolsonaro visited the area on Wednesday.

More than 120,000 people have been displaced by flooding that has inundated several cities in the Amazon rainforest, and more rain is expected.

The state of Acre, in northwest Brazil, on the border with Peru, declared a state of disaster in 10 cities after rivers overflowed their banks, the Associated Press reported.

More than 4,000 families were evacuated in Sena Madureira, one of the worst-hit cities, the AP also said.

In the state capital of Rio Branco, the Acre River reached almost 52 feet, more than 6.5 feet above flood stage, according to BBC News Brazil. Floodwaters reached at least a dozen neighborhoods.

(MORE: Hundreds of Houston's Beloved Bats Fell Victim To Freezing Temperatures)

Images from around the state show rescue personnel helping people from their flooded homes and delivering food and other supplies.

The flooding comes as Acre is dealing with the COVID-19 pandemic. The state has reported 55,881 cases of infection by the new coronavirus, according to acre.com. At least 975 people have died because of the pandemic.

Advertisement In addition, more than 10,000 people in Acre have contracted dengue since the beginning of the year, the AP reported.

SPONSORED: 25% off Anthropologie sale

Acre's Gov. Gladson Cameli warned that dengue and other mosquito-borne diseases are likely to spread more aggressively once floodwaters recede.

Brazilian President Jair Bolsonaro visited Acre on Wednesday to view the disaster firsthand.

Across the border in Peru, more than 4,000 homes have been damaged by flooding in the Madre de Dios region, according to floodlist.com. The government has declared a state of emergency for the region.

Since mid-February, heavy rain has caused flooding and mudslides in several regions of Peru, floodlist.com reported.

The border area of Peru and Brazil has received above-average rainfall over the past month, according to the Climate Prediction Center. More rain is expected in the area for the next week.

The Weather Company’s primary journalistic mission is to report on breaking weather news, the environment and the importance of science to our lives. This story does not necessarily represent the position of our parent company, IBM.",2021-02-25 08:00:00+00:00,"['peru', 'border', 'rain', 'brazil', 'cities', 'way', 'flooding', 'state', 'according', 'acre', 'displaces', 'feet', 'thousands']",Brazil,news article,English
2424,FL-2017-000067-BRA,WATCH: Thousands of Rare Turtle Hatchlings Flood Banks of River in Brazil - News18,https://www.news18.com/news/buzz/watch-thousands-of-rare-turtle-hatchlings-flood-banks-of-river-in-brazil-3193763.html,"Hundreds and thousands of Giant South American River turtle hatchlings flooded the river banks of Brazil earlier this week as some hailed it as a Tsunami of turtles. The video was posted by the Wildlife Conservation Society (WCS) that showed myriad turtle hatchlings whose scientific name is Podocnemis expansa. According to WCS, the turtle babies were emerging from a sandy beach in a protected area along the Purus River, which is a tributary of the Amazon River in Brazil.

The video has garnered over 20.5 k views on Twitter as netizens express their awe. One of the users commented, “A tsunami we all would like to see…,” while others congratulated the WCS conservationists for this awesome scene.

TURTLE TSUNAMI! @TheWCS releases incredible footage of mass hatching of locally endangered turtle: https://t.co/apenzRSzxd pic.twitter.com/KhA1aQsNYc— WCS Newsroom: #EarthStrong (@WCSNewsroom) December 14, 2020

The mass coming out of these turtles took place in the Reserva Biológica do Abufari (Abufari Biological Reserve) where animal conservationists from WCS Brazil have been monitoring adult females. The conservationists have been keeping a track of adult female turtles and their nests before, during, and after the birth of the hatchlings. The study is being conducted to improve the management and protection of this endangered species, which has been impacted by trafficking of their meat and eggs.

According to the WCS Brazil press release, the conservationists say the emergence occurred over several days during which period, around 71,000 hatchlings emerged in a day alone, while another 21,000 and few emerged days later.

WCS Brazil quoted Camila Ferrara, their Aquatic Turtle Specialist, who said that for the endangered giant South America river turtle, birth is an explosion of life as the video suggests quite clearly.

However, Camila also pointed out that it is one of their most fragile times as well. The mass birth is a way of increasing survival and the synchronization of birth allows these species to travel together to the river to start their new life.

The Giant South American river turtle is the largest freshwater turtle in Latin America. It can grow up to three and a half feet that is almost 1.07 meters and they can weigh upto 200 pounds that is 90 kilograms. These species of turtles play a crucial ecological role in nature as they disperse seeds that eventually help regenerate vegetation along river corridors around the Amazon basin.

WCS Brazil leads the project of conservation of these turtles in collaboration with ICMBIO and are sponsored by Fundação o Boticário. The Wildlife Conservation Society is a non-governmental organization (NGO) that is based out of Bronx Zoo in New York City in the United States. The NGO aims to conserve the world's largest wild places in 14 priority regions.",2020-12-19 08:00:00+00:00,"['hatchlings', 'watch', 'wcs', 'tsunami', 'rare', 'brazil', 'birth', 'flood', 'turtle', 'river', 'video', 'turtles', 'banks', 'conservationists', 'thousands']",Brazil,news article,English
1504,FL-2020-000038-EGY,Egypt sends two planes carrying manufactured bakeries to flood-stricken Sudan - Egypt Independent - Egypt Independent,https://egyptindependent.com/egypts-armed-forces-dispatch-two-military-airplanes-carrying-semi-automatic-manufactured-bread-production-lines-to-sudan/,"The Egyptian Armed Forces on Monday dispatched two military planes carrying bread-producing facilities to Khartoum on October 2.

The bakeries are intended to help ease the county’s ongoing bread shortage, which is due in part to severe flooding that began in July.

Egyptian technicians accompanying the bread production lines will train Sudanese teams to efficiently use the equipment according to operating standards.

The Egyptian and Sudanese teams will install the bakeries in Sudan’s most affected areas.

In September, Egypt sent multiple planes loaded with large quantities of food and medical supplies to Sudan, as well as a team of 20 physicians, nurses, and epidemic control specialists, to help the Sudanese people facing the disaster.

Sudan’s devastating floods began when continuous heavy rainfall caused the Nile River to reach its highest level in over a century.

The Sudanese government declared a nationwide state of emergency over the flooding, and quickly formed a crisis response committee to help mitigate its impact.

The country’s flood crisis has left 102 people dead, dozens injured, and over 100,000 homes destroyed.

Edited translation from Al-Masry Al-Youm",2020-10-06 07:00:00+00:00,"['floodstricken', 'carrying', 'crisis', 'bakeries', 'sudanese', 'egypt', 'manufactured', 'egyptian', 'planes', 'bread', 'sudan', 'teams', 'flooding', 'help', 'began', 'sends']",Egypt,news article,English
2170,FL-2011-000132-UGA,"Kasese Floods: Victims worried about education, health - Uganda - ReliefWeb",https://reliefweb.int/report/uganda/kasese-floods-victims-worried-about-education-health,"By Julius Luwemba

Currently, Kanyangeya primary school is hosting over 98 households. The area LCI chairperson, Deogracious Isemamba said the school premises and toilets are now being used by a large community.

KASESE - Following the outbreak of floods and landslides that ravaged several areas of mountainous Kasese district, residents continue to express worry over the next course of education after several schools were washed away.

Allan Kambale a resident of Namuhuga ward in Bulembia said schools such as Bulembia primary school, Kilembe and Royal ranges secondary schools, were greatly affected by the floods, whereas others cannot be accessed after several roads and bridges were damaged.

Currently, Kanyangeya primary school is hosting over 98 households. The area LCI chairperson, Deogracious Isemamba said the school premises and toilets are now being used by a large community.

""Even if the school lock-down is lifted soon, pupils will have nowhere to study from unless an alternative area is gazetted for resettlement,"" Isemamba reasoned.

Similar concerns were raised by Rehema Aryema who decried the inevitable pressure on surviving school-premises, saying, learners are bound to meet a big challenge on how to resume studies when the lock-down is lifted.

In May this year, Kasese was hit by disastrous floods. The floods started on May 7 and peaked on the morning of May 10. Another disaster followed on May 21, in areas of Mpondwe-Bwera, where flash floods and landslides further destroyed bridges and infrastructure, leading to the death of more than 10 people.

The current flooding started with river Nyamwamba bursting its banks in areas of Kasese municipality sweeping away Kyanjuki-Katiri bridge and Kilembe mines hospital infrastructure. Simultaneous floods also occurred along rivers of Lhubiriha in Bukonzo west with impacts in the sub-counties of Kitholhu, Karambi and Mpondwe-Lhubiriha town council while river Nyamugasani in Bukonzo East had impacts in the Sub-counties of Kyondo, Kyarumba and Kisinga.

River Mubuku floods, on the other hand, had impacts on the communities of Maliba, Bugoye and Karusandara. Equally affected, were town councils of Ibanda-Kyanya, Kisinga and Mubuku.

Health services still a challenge

Asinet Kabugho recounts the incident of flooding which left several communities cut-off from each other. Some pregnant mothers remained stuck up in the hilly areas and couldn't access medical services.

""The situation was only mitigated by a certain group of volunteers who transported affected people in ambulances,"" Kabugho recollects.

After the nearest Kilembe mines hospital premises were damaged by floods, medical services were shifted to premises of St. Micheal Kindergarten and at Catholic social centre (Karitus hall) in Kasese town.

Dr Edward Wefula the hospital superintendent calls for an urgent alternative water source, mortuary, incinerator, placenta pit and more toilets, saying, the new premises were not designed for a hospital.

However, Sr. Teopista Basemera the Kilembe hospital senior administrator, expressed hope of having more structures with a 200-bed capacity.

Malteser International a worldwide humanitarian relief agency, through the prime minister's office and the ministry of health, committed relief and recovery aid worth sh868m for the period of 3months since May 12.

According to Laura Beutler the technical coordinator for emergency medical services under Malteser, as of May 13, over 39,000 people had been affected by the floods.

""We have made more than 1,317 transferals out of which, 171 babies were successfully delivered from complicated pregnancies,"" noted Laura, adding that, eight of the born babies, were delivered from within ambulances.

She hence expressed a need to build capacity in pre-hospital care, where a formidable team of residents and health workers can be trained to administer first aid before or while transferring a patient to the hospital.

For over 3months of rescue and providing relief support, Malteser trained and passed out 23 Kasese residents in providing emergency medical services among which include, first aid and ambulance operations.

""We are striving to establish an Emergency Medical Services project in Kasese so that people can respond by themselves and activate support in an immediate and structured way,"" noted Laura.

She, however, expressed fear over the possible outbreak of diseases especially the COVID-19. She said the preventive measures are largely missing at all settlement camps.

The population of the people in camp is high, the implementation of the COVID-19 SOPs is hard. Social distancing and hand washing are hard to implement.",2020-08-03 07:00:00+00:00,"['worried', 'health', 'medical', 'areas', 'kilembe', 'victims', 'services', 'kasese', 'affected', 'floods', 'uganda', 'premises', 'school', 'hospital', 'education']",Uganda,news article,English
1356,FL-2019-000084-IND,"John Abraham, Raina & Sehwag do their bit for Assam, encourage fans to donate - Economic Times",https://economictimes.indiatimes.com/magazines/panache/assam-flood-john-abraham-raina-sehwag-devastated-encourage-fans-to-donate/articleshow/70272203.cms,"The floods in Assam need urgent attention!! Contribute to CM Relief Fund A/c Name: Chief Minister's Relief Fund As… https://t.co/lkG4yqLENh — John Abraham (@TheJohnAbraham) 1563374546000

Extremely devasted by all the news coming in from #Assam and other parts of India. It’s heartbreaking to read abou… https://t.co/N0FSZVOi5V — PRIYANKA (@priyankachopra) 1563338254000

Devastated by the current flood conditions in #Assam & other parts of India. My thoughts with those affected. Toget… https://t.co/No3Ge6SgDm — Suresh Raina🇮🇳 (@ImRaina) 1563354034000

Assam, Bihar ,Uttar Pradesh ,Tripura are reeling with floods. It’s time we stand up and support every state. — Virender Sehwag (@virendersehwag) 1563286502000

Absolutely heartbreaking to know about the devastation by floods in Assam.All affected, humans or animals,deserve s… https://t.co/fMQ2bTtuBd — Akshay Kumar (@akshaykumar) 1563358501000

Flood situation in our state Assam is very critical, 30 out of 33 districts are currently affected. So i would like… https://t.co/c4QAxOmLMZ — Hima MON JAI (@HimaDas8) 1563262318000

As the state of Assam faces the wrath of a flood, the country has been making every possible effort to support its people. Following in their footsteps, B-town celebrities and cricketers are stepping forward to offer a helping hand. While some are making donations to the Chief Minister's relief fund, others are encouraging their fans to do the same. Actor John Abraham , actress Priyanka Chopra and former cricketer Virender Sehwag and Suresh Raina are tweeting a word of encouragement to their fans.The 'Satyamev Jayate' actor, while sharing the bank account details of CM's relief fund, mentioned that the state needs urgent attention.He wrote, ""The floods in Assam need urgent attention!! Contribute to CM Relief FundA/c Name: Chief Minister's Relief Fund AssamA/c no: 35969660230 (SBI), Secretariat BranchIFSC: SBIN0010755PAN: AAATC4667KContribute through cheque or demand draft""Chopra, who is also the brand ambassador of the Assam tourism, expressed how devastated she feels because of the damage the state suffered. She wrote, ""Extremely devasted by all the news coming in from #Assam and other parts of India. It’s heartbreaking to read about the displacement and loss of life. My prayers with those affected.""Raina and Sehwag seemed to share the same emotion as the 'Bajirao Mastaani' actress.Earlier on Wednesday, actor Akshay Kumar donated Rs 2 crore to the state relief fund. Sprinter Hima Das too, announced that she donated half of her month's pay to the relief fund. She also encouraged big corporates to come forward and make their contribution. Assam flood affected 27 districts, claimed 27 lives and affected 57 lakh people till date.",2019-07-18 07:00:00+00:00,"['john', 'relief', 'fund', 'raina', 'abraham', 'affected', 'ministers', 'state', 'encourage', 'donate', 'urgent', 'sehwag', 'fans', 'assam', 'floods', 'bit', 'parts']",India,news article,English
2408,FL-2017-000067-BRA,Heavy rains and floods leave dozens dead in southeastern Brazil - CNN,https://www.cnn.com/2020/01/27/americas/rains-floods-minas-gerais-brazil-intl/index.html,"(CNN) At least 44 people have been killed after heavy rains hit southeastern Brazil, the country's Civil Defense force said Monday.

Around 13,000 people have been affected by the floods in the southeastern Brazilian state of Minas Gerais, with thousands forced out of their homes. A number of people remain missing, according to the defense force.

Authorities in Minas Gerais declared a state of emergency in 47 cities on Sunday. By Monday, the number of cities in a state of emergency had risen to more than 100, Brazil's state-run news agency Agencia Brasil said.

While in India on Monday, Brazilian President Jair Bolsonaro announced that members of the Armed Forces have been mobilized to the area to help address the emergency.

A truck rides along a flooded street after the overflowing of the Das Velhas River in Sabara, Belo Horizonte.

Minas Gerais Governor Romeu Zema, who flew over the region on Sunday, said the most severely affected areas were those where people lived in informal and precarious housing.

Read More",2020-01-27 08:00:00+00:00,"['brazilian', 'brazil', 'floods', 'dozens', 'minas', 'affected', 'state', 'dead', 'rains', 'leave', 'southeastern', 'number', 'cities', 'defense', 'emergency', 'gerais']",Brazil,news article,English
