,Id,title,source URL,body,time,keywords,country,data source,language
1374,FL-2019-000084-IND,"Flood in Assam turns grim again, hits 7 lakh - Deccan Herald",https://www.deccanherald.com/national/east-and-northeast/flood-in-assam-turns-grim-again-hits-7-lakh-749441.html,"Flood situation turned grim again in Assam affecting nearly another seven lakh people in the past 24-hours and caused six more deaths.

Heavy rains in western Assam and neighbouring Bhutan surged water level in the Brahmaputra and at least six other rivers, leaving another one lakh people homeless.

The Army was called in for rescue operation in Nalbari district and nearly 150 persons including 60 women marooned in floodwater were rescued by army personnel. ""Incessant heavy downpour in Nalbari district resulted in the breach of an embankment of Pagladiya river. Immediately, a highly trained and well-equipped flood relief column of the Army was mobilised and arrived at the Balitara village and rescued 150 people,"" defence spokesperson based here, Lt.Col P Khongsai said.

According to the daily flood bulletin issued by Assam State Disaster Management Authority (ASDMA), 410 new villages came under the grip of floods in the last 24-hours. A total of 34,82,170 people in 2, 933 villages in 20 districts still remained affected by floods on Wednesday.

Six new deaths due to floods were reported from Nalbari, Barpeta, Dhubri and Morigaon (3) districts taking the flood-related death toll to 75 so far.

118 deaths due to JE

Assam reported four new deaths due to Japanese Encephalitis on Wednesday taking the death toll to 118 since June 28. The state has reported 521 JE positive cases so far. The four deaths were reported from Goalpara, Jorhat, Lakhimpur and Sivasagar districts, said a bulletin issued by the state health department.",2019-07-24 07:00:00+00:00,"['reported', 'nalbari', 'flood', 'hits', 'grim', 'deaths', 'districts', 'turns', 'state', 'army', 'assam', 'floods', 'villages', 'lakh']",India,news article,English
1022,Drought Sri Lanka,The “Fracking” Revolution Comes to China – The Diplomat - the Diplomat,https://thediplomat.com/2013/03/the-fracking-revolution-comes-to-china/,"With some predicting China will import 79% of its oil by 2030, could domestic shale gas extraction help China meet its energy needs?

Advertisement

As shale gas fever sweeps through Beijing, analysts are looking at the costs and benefits of extracting what is increasingly a controversial source of energy. But for China, with its growing middle class, the immediate and long-term demand for energy has the potential to spark a revolution in shale gas before sufficient and safe technological know-how and regulations are developed.

A very vocal debate continues to rage in the U.S. and Europe as to the environmental consequences of shale gas extraction. Meanwhile, China’s National Oil Companies (NOCs) continue to purchase and buy into North American oil and gas companies with specific expertise in shale gas extraction. For better or worse, China’s shale gas revolution looks set to be thrust into the public spotlight, both at home and abroad.

Extracting shale gas is tricky. Shale, a sedimentary rock that is typically highly porous and has low permeability, traps hydrocarbons as it is formed. To remove the gas, shale formations must be stimulated, most commonly using hydraulic fracturing, or “fracking.” The technique involves pumping water, sand and chemicals at high pressure into the shale formation, cracking the rock and allowing the gas to be released to the surface. The 1 to 3 million gallons of water that are pumped into the shale formation must then either be recycled or pumped into water disposal wells in subsurface rock formations.

In addition to these skill-intensive practices, the extraction process also demands three-dimensional seismic surveying, which evaluates potential subsurface resources, and horizontal drilling technology. Both demand expertise and experience, yet the capability of most companies outside of North America, including China’s National Oil Companies (NOCs), to safely and effectively perform such high-tech extraction is limited.

The emergence of shale gas is a game changer. Countries that have traditionally relied on hydrocarbon exports for political clout (the Persian Gulf, Russia, Venezuela) will inevitably lose some of their petro power. Europe could become less energy dependent on Russian supply by importing liquid natural gas (LNG) from North America and by exploiting the potentially significant shale gas deposits in Poland and other countries. Australia, which has significant deposits and much of the pre-existing infrastructure to begin extraction, could see its clout in the energy politics of the region increase– forcing a significant redraft of Canberra’s “Australia in the Asian Century” White Paper.

Enjoying this article? Click here to subscribe for full access. Just $5 a month.

In effect, the “shale revolution” signals the end of the peak oil debate. New technology means new resources, which in turn could mean a new geopolitical map. However the mere presence of the resources doesn’t mean that their extraction in the short-term is viable, a problem China knows all too well.

China’s oil fields are drying up. The International Energy Agency’s (IAE) World Energy Outlook for 2010 predicts China will import 79% of its oil by 2030, a figure that demonstrates the pressing need for China to develop new energy sources. Enter shale gas and the “unconventionals.”

Diplomat Brief Weekly Newsletter N Get briefed on the story of the week, and developing stories to watch across the Asia-Pacific. Get the Newsletter

Estimates of China’s shale gas resources differ. China’s Ministry of Land and Resources estimates reserves of 886 trillion cubic feet (tcf), while the U.S. Energy Information Administration puts the country’s resources at 1,275 tcf. The upper estimates would mean China sits atop more shale gas than the U.S. and Canada combined. According to China’s 12th Five-Year Plan, by 2015 China should be extracting 6.5 billion cubic meters of shale gas per year, with a view of producing 100 billion cubic meters by 2020. China’s goal is to meet 10 percent of the country’s energy demands from shale gas the same year. To successfully meet the goal, China’s oil and gas industry needs to bridge its large knowledge deficit. Despite some progress, recent successes in domestic extraction technology have been modest.

Advertisement

Under the Shale Gas Development Plan for 2011-2015, shale gas has been labeled by the Ministry of Land and Resources as a separate mineral from conventional hydrocarbons. This move frees shale resources from the clutches of “the big three;” Chinese state-owned majors – China National Petroleum Corporation (CNPC), China Petroleum & Chemical Corporation (Sinopec) and China National Offshore Oil Corporation (CNOOC) – allowing Beijing to redistribute exploration contracts. Importantly, the move encourages competition among state-owned majors, local enterprises and foreign companies.

China’s NOCs, while not state-run, benefit from state financing. Their capital flows during the global downturn in 2008 gave them the flexibility to expand globally. For China’s NOCs, establishing partnerships with other international oil companies allows them to diversify risks and gain technical know-how through the supply chain.

At home and abroad China is making waves. The opening of a recent tender to foreign companies demonstrates the extent to which the often go-it-alone Chinese Communist Party feels it needs to secure a rapid and successful energy boom. Royal Dutch Shell, Chevron, Exxon Mobil and British Petroleum are all jointly surveying the key provinces of Sichuan and Guizhou with local companies. As part of the new tender, other joint ventures are expected to follow.

Flush with state financing, China’s NOCs have in recent years begun buying up stakes in North American energy companies and their subsidiaries. Some of their recent buy-ins have been the purchase of Nexen and a stake in Devon Energy Corp, one of the founders of shale gas extraction. Such purchases allow China’s NOCs to absorb expertise. While this in itself isn’t enough to meet their energy needs, it is a step toward building capacity for China’s NOCs in shale gas exploration and extraction.

China’s NOCs have been known to employ a “market-for-resources strategy,” whereby access to China’s market is granted to a resource holder in exchange for imports of resources from that country. This now looks to be morphing into a “market-for-know-how strategy.” In the early stages of coal bed methane exploration in China, foreign groups contributed 70 percent of the funding. With already significant foreign involvement, the shale gas industry looks set to emulate this model.

However, the all-important extraction process of shale gas, hydraulic fracturing, just as its name suggests, needs water – and large amounts of it. So while shale could provide energy, it will require large volumes of water that will be costly both to consume and to recycle. Water scarcity remains a key concern for the Chinese government, while water pollution is an increasing worry for the Chinese public. One recent report noted that already “up to 40 percent of China’s rivers were seriously polluted” and “20 percent were so polluted their water quality was rated too toxic even to come into contact with.”

Enjoying this article? Click here to subscribe for full access. Just $5 a month.

Experts warn that China will face growing water shortages in coming years. Water-intensive industries such as mining are competing for increasingly scarce water sources. Low rainfall in the northwest of the country, where much of the shale is believed to be, means these areas will have to rely on limited and finite groundwater. In the face of these shortages, China established a special 25 million USD fund for a cloud seeding program in 2012 to operate in “areas prone to drought and haze.” Water can be transported into China’s northwest via pipeline but that would be costly and require significant new infrastructure, such as desalination plants and pipelines that would likely need to stretch across the country for thousands of kilometers – a similar feat to the 4,200 km Xijiang to Shanghai gas pipeline.

Shale gas has approximately half the carbon content of coal. For China, the replacement of coal for gas in power generation could reduce emissions and pollution. It would kill two birds with one big stone, as criticism grows over the country’s pollution levels both in air and water. However, some warn that shale gas may also reduce investment in renewable energy sources.

Advertisement

In the U.S., environmental concerns dominate the debate. Public concern over water contamination and the release of harmful gases during shale gas extraction are gaining increasing media attention. This has been exacerbated by claims that research commissioned by industry-friendly lobby groups in the U.S., such as the American Petroleum Institute and the American Natural Gas Alliance, have muddied the water on the environmental impact of shale gas extraction. However, according to an IAE report, Golden Rules for a Golden Age of Gas, the environmental risks inherent in the process can be easily mitigated. The report outlines the “golden rules” required to address the environmental and social impact of developments in unconventional gas. It predicts that major risks can be decreased and safety improved if the cost of drilling and completing of a shale gas well is increased by 7 percent.

A dozen or more chemicals may be added to the water and sand pumped into a shale-gas well, including radioactive tracers that help assess the formation and relevant fractures. While these tracers are strictly monitored under guidelines handed down by the Nuclear Regulatory Commission in the U.S., in China the regulations may be less stringent. In addition, other radioactive material may be dislodged in the fracking process and may have to be disposed of from flowback water.

If strict regulations are not in place to seal the well from leaching, aquifers and ground water may become contaminated by run-off chemicals, methane or radioactive minerals displaced in the process. A 2011 US Environmental Protection Agency (EPA) report suggests that fracking may have resulted in the contamination of ground water.

Recent and successful protests in China to stop the construction of a chemical plant in Ningbo demonstrate growing public concern about some government-backed developments. The October 2012 protests followed other victories to stop the construction of petrochemical plants in Xiamen and Dalian. In Dalian, some 10,000 protesters took to the streets. With a growing middle-class, increasing internet and social media access, and more public involvement and activism in key local concerns, the government and local authorities will likely have to be accommodating of public displeasure in order to maintain stability as China grows. A Tiananmen-style alternative appears unlikely as it could backfire, both at home and abroad.

If the current hype proves correct and gas prices remain strong, China’s shale gas could be just the energy boom that Beijing seeks. It could allow China to meet its ambitious growth targets. As many commentators have suggested, however, shale gas may prove less of a blessing and more of a “resource curse,” spelling environmental disaster and nationwide instability. Either way, as Sino-American partnerships are forged and shale gas extraction in China ventures into unchartered waters, one thing is certain: The world will be watching.

Elliot Brennan is Editor and Project Coordinator at the Institute for Security and Development Policy, Stockholm, Sweden.",2013-03-24 07:00:00+00:00,"['comes', 'nocs', 'china', 'gas', 'revolution', 'water', 'oil', 'energy', 'resources', 'extraction', 'shale', 'chinas', 'fracking']",Sri Lanka,news article,English
1769,FL-2021-000030-IDN,Indonesian Professor Warns Against Attempts To 'Make West Sumatra Implement Sharia' Law - Christianity Daily,http://www.christianitydaily.com/articles/11310/20210329/indonesian-professor-warns-against-attempts-to-make-west-sumatra-implement-sharia-law.htm,"In an event last week organized by the Ugla Mentawai Simariuriu Foundation, in collaboration with IMMJ and several alliances of Mentawai Youth/Student Organizations, respected professor Ade Armando from the University of Indonesia warns that there could be hidden motives behind the proposition to turn West Sumatra Province into the Special Region of Minangkabau.

In his webinar titled, ""Discourse of MINANGKABAU SPECIAL REGIONS, Threats or Blessings?"" Professor Armando laid his suspicion on the proposed separation and autonomy of a new province in West Sumatra. He thinks that those advocating for it are ""from the radical Islamic circles...who want to make West Sumatra like Aceh, an autonomous region that implements Sharia law,"" the International Christian Concern reported.

The professor argued that these radical Islamists are following a narrative that will subject Minangkabau ethnicity under the Sharia law according to what they believe from the Book of Allah, hence the proposed name, ""Special Region of Minangkabau"" instead of ""Special Region of West Sumatra.""

Armando's conjecture isn't groundless as seen in the enforcement of Sharia law in schools in Padang City where teachers obliged their non-Muslim students to wear the hijab. Women in regions under the Islamic law will be vulnerable to such discriminatory regulations and other future policies. He and other speakers from last week's workshop are urging people native to the Sumatra region to oppose the proposition by speaking up and by doing everything they can to stop its implementation.

Juniator Tulius, an anthropologist from Mentawai, also surmises that if given consideration, the proposed MINANGKABAU SPECIAL AREA would discount the principle of a peaceful co-existence among diverse groups. Its regional effect including the future treatment of women and religious minorities could have far-reaching impacts at a national level.

""We remain alert to all developments in the West Sumatra region. A lot of information will appear in the media that we need to monitor to what extent there is an attempt to legalize it as a MINANGKABAU SPECIAL REGION,"" he said.

Fortunately, the critical discourse analysis on the possible expansion of the Sharia Regional Regulations in West Sumatra concludes that a proposition grant will affect the quality of democracy in West Sumatra.

""For most scholars and experts in Indonesia, the presence of religious-based regional regulations is claimed to be one of the sources of fertilizing the seeds of intolerance at the provincial level. As the second most productive region to produce Sharia regional regulations in Indonesia, the position of the province of West Sumatra is like a fire in the husk which over time will create a greater potential for conflict,"" the study said.

Religious reasons aside, the threat of terrorism is also felt in the island of Sumatra. ICC reports that from March 19 to March 21, the Densus 88 Anti-terror unit in Indonesia had arrested 18 suspected terrorists in North Sumatra in a silent operation.

The unit seized several items as evidence of their propaganda including 31 charity boxes used in swindling the unsuspecting people to fund their unscrupulous activities.",2021-03-29 07:00:00+00:00,"['professor', 'minangkabau', 'warns', 'law', 'regulations', 'indonesia', 'indonesian', 'implement', 'region', 'sumatra', 'regional', 'attempts', 'sharia', 'special', 'west']",India,news article,English
117,DR-2015-000134-SOM,The Basis of Supply Chain Competitiveness - IndustryWeek,https://www.industryweek.com/planning-forecasting/basis-supply-chain-competitiveness,"Please Enable Cookies

www.industryweek.com is using a security service for protection against online attacks. The service requires full cookie support in order to view this website.

Please enable cookies on your browser and try again.",2018-07-30 05:49:55+00:00,"['protection', 'try', 'support', 'security', 'stackpath', 'requires', 'websiteplease', 'enable', 'using', 'service', 'view']",Somalia,news article,English
1370,FL-2019-000084-IND,"As Millions In Assam Continue To Struggle, This MLA Is Out On The Roads, Providing Free Food And Medicine ... - Indiatimes.com",https://www.indiatimes.com/news/india/as-millions-in-assam-continue-to-struggle-this-mla-is-out-on-the-roads-providing-free-food-and-medicine-to-flood-victims-372272.html,"Even as the floodwaters continue to recede, lakhs of people who were affected by the Assam floods are struggling to survive.

Many don't have a house to go back to or have nothing left at their homes to feed their families. It is expected to take months before normalcy return to the state.

As people are struggling to survive, a politician is doing his bit to provide some relief to at least some of the flood victims.

Mrinal Saikia/ Facebook

Mrinal Saikia, the BJP MLA from Khumtai constituency has been leading a one-of-a-kind mission for the past couple of weeks.

Saikia is hitting the road with his customized vehicle which can be used as a 'mobile kitchen'. Since July 13, Saikia has been travelling to flood-affected places, where he cook hot meals for the flood victims on his mobile kitchen and often use small boats to distribute among the needy.

Mrinal Saikia/ Facebook

According to Saikia, he has already fed more than 15,000 people and has no plans to slow down. Speaking about him distributing cooked food, Saikia said he decided to do so as most of the people still had no means to cook the rice and daal at home.

Saikia who had done a similar served last year too said that he had prepared for the floods this year well in advance and had collected the relief materials.

Mrinal Saikia/ Facebook

It is not just rice and daal that Saikia has on his customized vehicle, it also has emergency medicines which is high in demand in the flood-affected regions, but are in short supply.

Another initiative that Saikia has undertaken is to distribute paddy sapling among rice farmers who lost their crop in the recent floods.

Mrinal Saikia/ Facebook

Seeing his dedicated work, more people including volunteers are joining Saikia's mission to help the needy.

More than 57 lakh people in over 4,600 villages have been affected by floods so far of which 1.51 lakh are taking shelter in 816 relief camps.",2019-07-28 07:00:00+00:00,"['struggling', 'flood', 'mla', 'floods', 'lakh', 'mission', 'relief', 'kitchen', 'saikia', 'medicines', 'vehicle', 'need', 'free', 'mobile', 'victims', 'politicians', 'food', 'provides', 'assam', 'rice']",India,news article,English
