,Id,title,source URL,body,time,keywords,country,data source,language
256,FF-2012-000189-IDN,Alexander as Zulqarnain - The Express Tribune,https://tribune.com.pk/story/467252/alexander-as-zulqarnain,"There is, in rural Mandi Bahauddin district, a few kilometres from Phalia town, a village marked as Helan in the Atlas of Pakistan. The ‘a’ is pronounced as in ‘father’ and the ending is nasal as it would be in French. The village is known for a tomb dating to the reign of Akbar the Great . In May 2000, I paused there, met a local ‘historian’ and learned that the word was a mispronunciation of Helen!Now, it was well known that Helen of Troy , said the man, was the wife of Alexander the Macedonian. When she died, Alexander ordered this tomb. Inside, sits an ornate sandstone sarcophagus radiant with flowing curvilinear forms and calligraphy that tells us that the tomb is the last resting place of some Ali Beg. But that did not matter to my new friend.Later, in nearby Mong, the village that takes its name from the Scythian King Maues (1century BCE), known as Moga in Punjabi, I got another educational boost. Seeing that I was on the trail of Alexander, a rather contrary sort of middle-aged man took me under his wing. He spoke of the Macedonian’s victory over Raja Paurava (Greek: Porus) with admirable pride and how folks named their sons after the Macedonian. I asked if folks ever named a son after Paurava, he being one of our own. Pat came an angry, “Kyon? O koi Musalman cee?” Islam being nearly a millennium in the future, Raja Paurava was certainly no Muslim. But then neither was Alexander. On another similar occasion, my interlocutor burst out with an incredulous half-question, half-statement, “Alexander was Hindu?”Interestingly, even semi-educated persons in Pakistan cannot imagine a religion like the Greeks had, with a large pantheon of mostly fun-loving gods. They are caught in a mental box with four names — Islam, Hinduism, Christianity and a very distant and vague Judaism. No other religion appears on their radar.This man in Mong was smarter, however. He countered with the statement that Alexander was mentioned in the Holy Quran. The king we so desperately want to turn into Alexander is the Quranic Zulqarnain whose name means ‘Two-Horned’. He travelled across the great expanse of the world, ruled over a vast kingdom and was responsible for locking away the dreaded nation of Gog and Magog behind a rubble wall steeped in molten lead. This king, we read, travelled to the rising and setting places of the sun. That is, his sway extended across much of the known world of his time.But scripture does not reveal anything beyond this short reference. Now, there were two famous world-conquering kings in history who wore horns on their helmets. Cyrus the Great (ruled BCE 549-529) of Persia and, 200 years later, Alexander of Macedonia. Indeed, the latter’s depiction on coinage with diadem and ram’s horns is very well known.Now, both were great conquerors, therefore, either could be Zulqarnain. But mark: Cyrus established a kingdom only marginally smaller than Alexander’s.This kingdom lasted 200 years until Alexander unravelled it and became master of it. Alexander’s kingdom was larger. His governors presided on the affairs of men from Thrace (Bulgaria) through the Scythian steppes on the northern shores of the Black Sea, to the banks of the Jaxartes (Syr) River (in Uzbekistan) and across the entire Persian Empire, Afghanistan, Punjab and Sindh to Babylon. But it was a short-lived empire, lasting just over a decade until Alexander’s death in 322 BCE.So, really, which king was it that scripture refers to as the ‘Two-Horned’? If greatness were a measure in terms of longevity of kingdom, I would vote Cyrus. However, Alexander who did indeed embody traits that could arguably be termed ‘great’ left behind a kingdom that did not last beyond his own lifetime.But we, in Pakistan, embrace him. We stretch the words of scripture to make Zulqarnain fit into Alexander’s shoes. We do this only because he, an outsider, defeated a king of Punjab who, unfortunately, was a Hindu. We disregard the fact that Raja Paurava (of whose greatness of character I have written earlier in this column) was a Hindu because he predated Islam.Published in The Express Tribune, November 18, 2012.",2012-11-17 08:00:00+00:00,"['alexander', 'king', 'zulqarnain', 'paurava', 'known', 'kingdom', 'scripture', 'tomb', 'great', 'village']",India,news article,English
994,Drought Sri Lanka,Dalit man alleges attack at Sivaganga village - The Hindu,https://www.thehindu.com/news/cities/Madurai/dalit-man-alleges-attack-at-sivaganga-village/article4814049.ece,"A man belonging to Pudhirai Vannar, a scheduled caste community, who had applied for drought relief was allegedly abused and attacked by a cooperative union secretary at Satharasankottai in Sivaganga district on Tuesday.

Vettai Villan (50), who originally hails from Ponnali at Satharasankottai in Sivaganga district, was allegedly evicted from his village by members belonging to the dominant castes in 2004 following an incident of caste discrimination.

Since then Vettai villan and his family were living in Vavval Thottam near Uthangudi in Madurai. His son V. Murugan, a former member of Tamil Nadu Pudhirai Vannar Welfare Board in Madurai, has moved the Madras High Court demanding retrieval of their house and land.

The Dalit family on Thursday staged a novel protest in Madurai — the family carrying a head load of firewood, earthen pots and stove marched towards the office of Inspector General of Police, symbolically suggesting that they were evicted forcefully.

Murugan said that on the day of incidence, Vettai Villan had gone to Satharasankottai to claim drought relief for his land (Patta No: 673) (Survey No: 219/9A).

He was allegedly attacked and abused in his caste name stating that “you are not in the village; how could we give relief money.”

The aggrieved Dalit had met the Village Administrative Officer but was again abused there as the latter was facing a High Court case filed by the former’s son. The land which belonged to Murugan’s family had been allegedly usurped by an intermediate caste family in Ponnali.

While they were marching to the IGP’s office, police intercepted them near Matuthavani Integrated Bus Stand and took them to the office. The family members submitted a petition demanding the police to arrest the persons who had abused them under Scheduled Castes and Scheduled Tribes, Prevention of Atrocities Act, 1989.",2013-06-14 07:00:00+00:00,"['allegedly', 'abused', 'attack', 'village', 'dalit', 'office', 'man', 'villan', 'alleges', 'satharasankottai', 'relief', 'sivaganga', 'caste', 'family', 'scheduled']",Sri Lanka,news article,English
1360,FL-2019-000084-IND,"Situation report on Flood/Heavy Rainfall in Assam, Bihar, Maharashtra, Rajasthan and Kerala as on 29th July 2019 at 1800 Hrs - India - ReliefWeb",https://reliefweb.int/report/india/situation-report-floodheavy-rainfall-assam-bihar-maharashtra-rajasthan-and-kerala-29th,"Ministry of Home Affairs

Disaster Management Division

(National Emergency Response Centre)

1. Forecast

i. IMD

• 29 July (Day 1): Heavy to very heavy rainfall with extremely heavy falls very likely at isolated places over Chhattisgarh and Gujarat state; Heavy rainfall at a few places with very heavy rainfall at isolated places over Konkan & Goa; Heavy to very heavy rainfall at isolated places over Coastal Karnataka, Telangana, Odisha, Vidarbha, Madhya Pradesh & West Rajasthan and heavy rainfall at isolated places over Interior Karnataka, Coastal Andhra Pradesh & Yanam, Madhya Maharashtra, Marathawada, Arunachal Pradesh, Andaman & Nicobar Islands, East Rajasthan and Assam & Meghalaya.

• 30 July (Day 2): Heavy to very heavy rainfall with extremely heavy falls very likely at isolated places over Chhattisgarh; Heavy to very heavy rainfall at isolated places over Telangana, Madhya Maharashtra, Gujarat state, Vidarbha, Madhya Pradesh & Assam & Meghalaya and heavy rainfall at isolated places over Coastal Karnataka, Konkan & Goa, Marathawada, Odisha, Rajasthan,

Arunachal Pradesh and Nagaland, Manipur, Mizoram & Tripura.

ii. CWC

• In Assam rivers Jiabharali, Kushiyara, Dhansiri and Brahmaputra. In Bihar rivers Burhi Gandak, Bagmati, Mahananda, Adhwara and Kosi. In Chhattisgarh river Indravathi continue to flow in SEVERE SITUATION (above danger level).

• In Assam river Dhansiri and Brahmaputra are in rising trend, Jiabharali,

Kushiyara are flowing in steady/Falling trend. In Bihar all rivers are in steady/ falling trend. In Chhattisgarh river Indravathi are in rising trend.

2. Deployment of NDRF

NDRF has deployed 17 Teams in Assam, 19 in Bihar, 08 in Maharashtra, 03 in Kerala and 03 in Rajasthan. Total 137 teams of NDRF are deployed/ pre-positioned in different part of country in flood prone areas.

The weather in the State of Bihar is clear/ partly cloudy. There is no rain in the State of Assam.

4. Status of State Disaster Response Fund (SDRF): An amount of ₹ 251.55 crores has been released to State of Assam under SDRF during this year & ₹ 417.37 crores has been release to State of Bihar.",2019-07-30 07:00:00+00:00,"['kerala', 'madhya', 'rajasthan', 'maharashtra', 'heavy', 'places', 'state', 'isolated', 'assam', 'pradesh', 'hrs', 'floodheavy', 'bihar', 'report', 'chhattisgarh', 'situation', 'india', 'rainfall']",India,news article,English
1965,FL-2020-000207-NGA,Nigeria: Food Security Threatened As Floods Destroy Farms - AllAfrica.com,https://allafrica.com/stories/202009030184.html,"Fear of food crisis is heightening in Nigeria following massive floods that are ravaging crop farms in many parts of the country.

Many farmlands were reportedly destroyed by floods in Kebbi, Zamfara, Niger, Rivers, C/Rivers, Sokoto, Bauchi and some parts of Kwara State.

Rice and maize farmlands were most affected and farmers fear this could further hike the prices of the staple food in the country.

A Daily Trust market survey showed that prices of food items are already going up in the market.

In Kano, a 100kg of maize now costs N20,000, N22,000 in Benue, N24, 000 in Abuja and as high as N25,000 in Lagos State.

The same size of maize sold between N9, 000 and N11, 000 last year across the country.

Also, 100kg of local rice now costs N55,000 in Kano, N58,000 in Abuja, while prices of beans range from N22,000 to N24, 000 per 100kg depending on the market and state.

- The warnings -

The Nigeria Hydrological Services Agency (NIHSA) had warned that the current water level in the Middle Niger of the Niger Basin portends some level of concern for Nigeria as there could be a likelihood of river flooding in the states contiguous to River Niger.

The states, according to the Agency, are Kebbi, Niger, Kwara, Nasarawa, Kogi, Anambra, Delta, Edo, Rivers and Bayelsa.

The Director-General of the agency, Engr. Clement Onyeaso Nze said the country through Kebbi State might be flooded beginning from September 6

Reports from Kebbi had shown that several hectares of rice farms were washed away by flood and similar incidence was also reported in some parts of Zamfara, Sokoto, Bauchi, Kwara, Cross Rivers, Rivers and Niger states.

The incident is already a source of concern for stakeholders in the food sector as they are expressing fears that if the ugly trend continues, there might be food crisis in the country.

In Kebbi State, over 500,000 hectares of farmlands were reported to have been destroyed by flood.

The Chairman of the State Emergency Management Agency, Sani Dododo, who announced the incident said rice farms accounted for about 450,000 of the hectares while the remaining 50,000 were for other crops.

- Farmers narrate ordeal -

It was reported that farmers in Kebbi State lost over N5 billon to the flood.

A victim and female rice farmer in the state, Lubabatu Bunza, said she lost about 16,000 hectares to the recent flood in the state.

Also, Mallam Isa Ahman, another victim from Patigi LGA of Kwara State, said early last month, flood washed away about six hectares of his rice farm and four hectares of his maize farm.

The farmer said he obtained a loan from a commercial bank and invested on the farm, saying it would be difficult to repay the loan.

Many of the affected farmers in Kebbi and Niger states said they got their inputs from the Anchor Borrowers' Programme of the federal government and wondered how they would be able to repay the loans.

President of the All Farmers Association of Nigeria (AFAN), Architect Ibrahim Kabiru, said even though it would be difficult to ascertain the damages done to the farms by the flood across the country, the trend portents a great danger ahead.

He said the flood-affected rice, maize, sorghum and other crops in the affected states.

According to him, the situation was being worsened by the insecurity in the rural areas where the farms are located.

The farmers' leader had earlier warned that bandits were preventing farmers from accessing their farms, which he said was a dangerous pointer to food security.

Mr. Mathew Ajayi, a food security expert told Daily Trust on phone yesterday that already the country was nearing food crisis as this could be seen in the skyrocketing prices of food items across the country.

""It is obvious that we are approaching a serious food crisis considering the rising prices of food items across the country.

""And now look at the flood ravaging the farms' couple with the bandits chasing away farmers from their farms,"" he said.

Alhaji Muktar Umar, a farmer and local rice miller in Sabo-Wuse, Niger State, told Daily Trust on phone Wednesday that the country might experience serious rice crisis this year because of the flood incidence and security challenges threatening the farmers.

""From my experience as a farmer, I know many people go into rice farming this year but the farms are being washed away by the flood.

""Many farmers can no longer go to their farms now, most especially here in Niger State,"" he said.

- Buhari orders release of food items from reserves -

President Muhammadu Buhari said Wednesday that the flood disaster in Kebbi State had exposed the country to a major setback in the efforts to boost local food production.

Buhari, in a statement by his spokesman, Garba Shehu, expressed concerns over the heavy floods that took a number of lives, submerged thousands of hectares of farmlands and houses, destroying farm produce and personal belongings in the affected communities.

The president said: ""I am particularly sad over this incident because it is a setback to our efforts to boost local rice production as part of measures to stop food importation.

""Kebbi State is the focal point of our policy to produce rice locally as part of this administration's commitment to agricultural revival, which suffered relative neglect in favour of food importation.

""With the loss of six lives and still counting; thousands of hectares of land flooded and estimated economic losses of more than one billion naira by rice farmers in Kebbi State, we face a major setback in our efforts to boost local food production.

""This bad news couldn't have come at a worse time for our farmers and other Nigerians who looked forward to a bumper harvest this year in order to reduce the current astronomical rise in the costs of food items in the markets.""

The president, while sympathising with the bereaved families and farmers affected by the devastating floods, assured that ""we are going to work closely with the Kebbi State government in order to bring relief to the victims.""

In another statement yesterday by Shehu, Buhari expressed the concern of his administration about the sudden spiral of food prices at a time when the economy was already mired in a slowdown occasioned by the global coronavirus situation.

Buhari, however, assured Nigerians that the situation was transient.

He said his administration had already begun looking and putting in place measures to ameliorate the situation.

""While Providence has been kind to us with the rains and as such an expectation that a bumper harvest would lead to crashing of food prices and ease the burdens on the population, the government's concern is that the exploitative market behaviour by actors has significantly increased among traders in the past few years and may make any such relief a short-lived one.

""This year has indeed tested us in ways that globalisation has never been tested since the turn of the century.

""These challenges have disrupted lives and supply chains all over the world and Nigeria has not been spared.

""The effect has been deeply felt in the delays encountered in the procurement of raw materials for local production of fertilizer (damaging standing crops before harvest) and the speculative activities by a number of rice processors who are ready to pay for paddy at any price to keep their mills running non-stop.

""But of all these problems, the most worrisome is the activities of ""corrupt"" middlemen (with many of them discovered to be foreigners) and other food traders who serve as the link between farmers and consumers found to be systematically creating an artificial scarcity so that they can sell at higher prices.

""In dealing with these problems, the administration has, in line with its ease of doing business mantra, avoided imposing stockholding restrictions in order not to discourage investments in modern warehousing and cold storage.

""The president has just approved the release of food items from the strategic reserves, including 30,000 tons of maize to animal feeds producers to ease the high cost of poultry production.

""President Buhari's administration has raised some of these issues with the various food producer associations involved, particularly those of rice and other grains.

Close Sign up for free AllAfrica Newsletters Get the latest in African news delivered straight to your inbox Top Headlines Nigeria By submitting above, you agree to our privacy policy. Success! Almost finished... We need to confirm your email address. To complete the process, please follow the instructions in the email we just sent you. Error! Error! There was a problem processing your submission. Please try again later.

""With their cooperation, the high food prices should soon be a thing of the past.

""In addition, investments in the agro-allied sector by the private sector will significantly increase domestic production of farming inputs especially fertilizer, further crash prices, create employment and ease the pressure on our foreign reserves.

""One of these major investments is the Dangote Fertilizer plant, which is projected to come on stream by the 4th quarter of 2020,"" the president said.

- Experts suggest ways out -

The National President of All Farmers Association of Nigeria (AFAN), Arc. Ibrahim Kabiru noted that to mitigate the effect of these calamities on the food system or food security, farmers should be encouraged to embark on full-scale dry season farming, which could lead to all-year-round farming

He advised that government should expand the nation's irrigable lands by investing more in water resources.

He also advised farmers to quickly plant alternative crops that require little time to mature in order to mitigate the crisis.

He said government at all levels could support such farmers with seeds and other inputs.

""Whereupon the time left for the rainy season cannot be sufficient for any crop, some form of compensation commensurate to the ascertained loss could be given to the affected farmers,"" he advised.

The farmer's leader urged his members to insure their farms, adding that the association is already working with National Agricultural Insurance Company (NAIC) to that all farmers insure their farms.

The women leader of the Kebbi State Rice Farmers Association of Nigeria (RIFAN), Lubabatu Usman Kamba suggested that the way out for some of the challenges was for the farmers to be provided with good knowledge of forecasting the planting season.

She said flooding has been the farmers' biggest nightmare, adding that they could only be addressed with good forecasting knowledge on when and where to plant the crops, which she said was currently lacking because of the near absence of extension service workers.",2020-09-03 07:00:00+00:00,"['farmers', 'niger', 'food', 'kebbi', 'security', 'floods', 'farms', 'prices', 'threatened', 'nigeria', 'destroy', 'rice', 'hectares', 'state']",Nigeria,news article,English
1458,FL-2019-000179-CAN,'Urgent action needed' to preserve wetlands and mitigate flood risk: report - CTV News,https://www.ctvnews.ca/canada/urgent-action-needed-to-preserve-wetlands-and-mitigate-flood-risk-report-1.4099915,"The Insurance Bureau of Canada is calling for “urgent action” when it comes to preserving Canada’s wetlands as a way of limiting flood risk.

A new report, issued Tuesday in partnership with the Intact Centre and the International Institute for Sustainable Development, indicates restoring ponds and wetlands can be a more cost-friendly and effective way of preventing flooding than man-made alternatives, such as dams or levies.

“Often, we overthink solutions,” Craig Stewart, the IBC’s vice-president of Federal Affairs, told CTV News. “We have a lot out there already buffering us from harm. In terms of our coastal wetlands, our inland wetlands, our forests, we need to be doing a better job of protecting these in the places where they protect us.”

Flooding has become a growing issue in the country. Insurance loses from extreme weather in Canada -- primarily flooding -- averaged $405 million annually from 1983-2008, but has since skyrocketed to $1.8 billion annually over the last decade.

In some areas of the country, maintaining or restoring waterways and wetlands has already proven economically beneficial.

In Gibsons, B.C., about 46 kilometres northwest of Vancouver, ponds are saving the community up to $4 million in annual rainfall storage. Meanwhile, in Manitoba, a restored wetland is helping save the surrounding area roughly $3.7 million annually in flood prevention and water filtration.

Despite the apparent benefits of maintaining Canadian wetlands, they are disappearing to development at staggering rates. According to the IBC, southern Ontario has lost 72 per cent of its wetlands to construction, while the southern Okanagan region of British Columbia has lost 85 per cent.

Both regions have been hit with costly flooding thus far in 2018.

In May, British Columbia’s southern interior was hit with catastrophic flooding that lasted several days. Torrential rain mixed with melting snow from the mountains forced thousands of people to evacuate and damaged hundreds of homes in the process.

In early August, a flash flood in Toronto submerged cars and flooded basements, leaving an estimated $80 million worth of damages in its tracks.

Anne Hammill, director of the Resilience Program at the International Institute for Sustainable Development, says wetland areas can also be effective in protecting urban areas from flooding.

“The vegetated lands can help buffer and sort of prevent water from moving as quickly and accumulating in places that are greater risk,” she said.

The federal government has committed $2 billion to build traditional infrastructure and restoring natural protections. In the Paris Agreement, it acknowledged the ability of natural ecosystems to protect against extreme weather.

The IBC says if the government truly intends to uphold its international promises, time is of the essence.

“If Canada remains committed to the Sendai Framework and the Paris Agreement, it needs to act now, in innovative and unprecedented ways, before it cannot act at all,” the report states.

With a report from CTV’s Vanessa Lee in Montreal",2018-09-18 07:00:00+00:00,"['international', 'preserve', 'action', 'report', 'risk', 'needed', 'development', 'million', 'canada', 'urgent', 'mitigate', 'flood', 'southern', 'restoring', 'wetlands', 'flooding']",Canada,news article,English
