,conversation_id,created_at,date,time,timezone,user_id,username,name,tweet,Manual Labels,Auto Label,language,urls,Unnamed: 13,photos,hashtags,link
9783,1.32e+18,2020-11-02 04:50:45 India Standard Time,02-11-2020,4:50:45,530,159418155.0,rockfmnews,Rock FM News,"Lancashire Police say they’re receiving an increased volume of calls in relation to flooding in the Ribble Valley Area. They advise avoiding areas of Chipping, Waddington and Sawley as conditions are currently dangerous and there are a number of road closures #Lancashire #floods  https://t.co/IAAGerPYhY",flood,,en,[],,['https://pbs.twimg.com/media/Elxj-jVXEAEVle_.jpg'],"['lancashire', 'floods']",https://twitter.com/RockFMNews/status/1323042321768894464
9784,1.32e+18,2020-11-02 04:48:29 India Standard Time,02-11-2020,4:48:29,530,251695880.0,dobrinich75,Dobrinich Channel,#Flooding #Vietnam #Weather #Floods VIETNAM BRACES FOR ANOTHER 20 PLUS INCHES  https://t.co/Fwzu7hJ99O via @YouTube,flood,,en,['https://youtu.be/DVYZExM46nU'],,[],"['flooding', 'vietnam', 'weather', 'floods']",https://twitter.com/dobrinich75/status/1323041751116980224
9785,1.32e+18,2020-11-02 03:43:35 India Standard Time,02-11-2020,3:43:35,530,9.58e+17,thelightmom,Mariah Cecilia 🇵🇭,Thank you Philippine Red Cross Batangas!  Praying everyone gets rescued and no one is left behind. #BatangasCity #bagyongrolly #RollyPH #floods,flood,,en,[],,[],"['batangascity', 'bagyongrolly', 'rollyph', 'floods']",https://twitter.com/thelightmom/status/1323025422339121152
9786,1.32e+18,2020-11-02 02:41:25 India Standard Time,02-11-2020,2:41:25,530,7.11e+17,chriscartw83,Christopher Cartwright,"Misery on the way , with AGW  Global warming predicted to cause an 8-fold increase in megastorms like #Goni  #ClimateCrisis #hurricane  #climatechange #GlobalWarming #GretaThunberg #wildfires  #floods #flooding   https://t.co/t4bHoDm5IM",none,,en,['https://yaleclimateconnections.org/2020/11/super-typhoon-goni-slams-into-philippines-as-strongest-landfalling-tropical-cyclone-on-record/'],,[],"['goni', 'climatecrisis', 'hurricane', 'climatechange', 'globalwarming', 'gretathunberg', 'wildfires', 'floods', 'flooding']",https://twitter.com/chriscartw83/status/1323009774758301700
9787,1.32e+18,2020-11-02 02:36:21 India Standard Time,02-11-2020,2:36:21,530,2903859174.0,californiadds,California DDS,"A #disaster could happen at any moment like #wildfires, #earthquakes &amp; #floods. When we all do our part, we keep more people safe!   1⃣ Get Official Alerts  2⃣ Make A Plan 3⃣ Pack A Go-Bag  4⃣ Build A Stay Box 5⃣ Help Friends and Neighbors   For more info:  https://t.co/PsO1GjVcDI  https://t.co/OleQ1sw8tM",none,,en,['http://bit.ly/3afRp5U'],,['https://pbs.twimg.com/media/ElxFN3gU0AAePq1.jpg'],"['disaster', 'wildfires', 'earthquakes', 'floods']",https://twitter.com/CaliforniaDDS/status/1323008498532192256
9788,1.32e+18,2020-11-02 02:11:44 India Standard Time,02-11-2020,2:11:44,530,1.05e+18,leejenksmb1,Lee Jenkinson he/him,Careful a free flood warnings/flood alerts out there locally in north lancs and south Cumbria this evening #floods,flood,,en,[],,[],['floods'],https://twitter.com/leejenksmb1/status/1323002303893409800
9789,1.32e+18,2020-11-02 01:25:28 India Standard Time,02-11-2020,1:25:28,530,7.11e+17,chriscartw83,Christopher Cartwright,"#russia , and #CO2 emissions ,and #ecocide  Is big oil part of the solution ?  you bet ...NOT   #ClimateCrisis #hurricane  #climatechange #GlobalWarming #GretaThunberg #wildfires  #floods #flooding   https://t.co/PTUhFBK70T",none,,en,['https://www.theguardian.com/world/2020/nov/01/russia-rules-out-cutting-fossil-fuel-production-in-next-few-decades'],,[],"['russia', 'co2', 'ecocide', 'climatecrisis', 'hurricane', 'climatechange', 'globalwarming', 'gretathunberg', 'wildfires', 'floods', 'flooding']",https://twitter.com/chriscartw83/status/1322990660610334730
9790,1.32e+18,2020-11-02 01:11:32 India Standard Time,02-11-2020,1:11:32,530,20071828.0,danwebstergolf,Dan Webster,Don’t need to worry about Boris closing golf courses - this weather will do that !!  #biblical #washedout #floods,none,,en,[],,[],"['biblical', 'washedout', 'floods']",https://twitter.com/DanWebsterGolf/status/1322987156256788481
9791,1.32e+18,2020-11-02 00:52:26 India Standard Time,02-11-2020,0:52:26,530,1874798778.0,thehansindiaweb,The Hans India,"Hyderabad: Flood-hit forced to return home, in boats #Floods #OsmanNagar #Heavyrains  https://t.co/zuz63owdIn",flood,,en,['https://www.thehansindia.com/news/cities/hyderabad/hyderabad-flood-hit-forced-to-return-home-in-boats-654202?utm_campaign=pubshare&utm_source=Twitter&utm_medium=1874798778&utm_content=auto-link&utm_id=139'],,[],"['floods', 'osmannagar', 'heavyrains']",https://twitter.com/TheHansIndiaWeb/status/1322982349743685632
9792,1.32e+18,2020-11-02 00:44:17 India Standard Time,02-11-2020,0:44:17,530,223381899.0,rajarathnareddy,Raja Rathna Reddy,#Vfx #vfxartist #maya #houdinifx  #houdini #redshift3d  #rnd  #learning #india #cg #Rbd #watersimulation #floods #vellum  #slover #fluidsimulation  https://t.co/wxMqROQy7v,none,,und,['https://www.instagram.com/tv/CGupAjqAOOv/?igshid=17kv8rb6s5ptd'],,[],"['vfx', 'vfxartist', 'maya', 'houdinifx', 'houdini', 'redshift3d', 'rnd', 'learning', 'india', 'cg', 'rbd', 'watersimulation', 'floods', 'vellum', 'slover', 'fluidsimulation']",https://twitter.com/RAJARATHNAREDDY/status/1322980299433668608
9793,1.32e+18,2020-11-02 00:30:15 India Standard Time,02-11-2020,0:30:15,530,9.62e+17,ethoslifestyle,EthosLifestyle,"Deluged by #floods, America’s ‘oldest city' struggles to save landmarks from #climatecrisis  St Augustine, #Florida, was founded in 1565 by Spanish explorers. #Flooding has been a threat for centuries and is worsening with #sealevelrise   https://t.co/jIkqmjiM1P #ethoslifestyle",flood,,en,['https://www.theguardian.com/us-news/2020/oct/28/st-augustine-florida-floods-climate-crisis'],,[],"['floods', 'climatecrisis', 'florida', 'flooding', 'sealevelrise', 'ethoslifestyle']",https://twitter.com/EthosLifestyle/status/1322976766076555272
9794,1.32e+18,2020-11-02 00:22:48 India Standard Time,02-11-2020,0:22:48,530,19489239.0,jerusalem_post,The Jerusalem Post,"Israel's Meteorological Service issued a travel warning today, saying heavy #rain is expected over the coming day. Flash #floods and large clumps of hail have been falling in the northern Judean Desert, blocking Route 90 to eilat  Report by @IdanzonshineE   https://t.co/aV9zj5c9YZ",flood,,en,['https://www.jpost.com/israel-news/heavy-thunderstorms-hail-hit-southern-israel-flash-floods-expected-647674'],,[],"['rain', 'floods']",https://twitter.com/Jerusalem_Post/status/1322974893466619913
9795,1.32e+18,2020-11-02 00:16:10 India Standard Time,02-11-2020,0:16:10,530,1.32e+18,galojabiye,Mohamed Burale,"Disasters like #volcanic,#floods and generally #GlobalWarming occur in this world so #dolnultrump to be re-elected is like those disasters I mentioned above.",none,,en,[],,[],"['volcanic', 'floods', 'globalwarming', 'dolnultrump']",https://twitter.com/Galojabiye/status/1322973222359412740
9796,1.32e+18,2020-11-02 00:10:11 India Standard Time,02-11-2020,0:10:11,530,1.17e+18,climateactiong1,Climate Action Group,"By @tangem2009  Images from the city of #Ndjamena, Chad on 31 Oct.20 #Floods is causing #havoc, homes &amp; Livelihoods destroyed. Urgent need for  #assistance.  Need to factor in Climate change in urban planning @_Africa24 @UNHABITAT @Refugees @PrsidenceduTcha @auggwi  https://t.co/RpjYNmMD1Y",flood,,en,[],,"['https://pbs.twimg.com/media/Elwjv-mXUAAo2cq.jpg', 'https://pbs.twimg.com/media/ElwjwlNXUAEeO22.jpg']","['ndjamena', 'floods', 'havoc', 'assistance']",https://twitter.com/ClimateActionG1/status/1322971718118506499
9797,1.32e+18,2020-11-02 00:00:00 India Standard Time,02-11-2020,0:00:00,530,236338186.0,envagencynw,Env Agency NW,"Flood water can contain hidden dangers such as lifted manhole covers, sharp objects and chemicals. Don’t walk through flood water it’s not worth the risk.  Check your local flood risk at:  https://t.co/uGQ4g6RGOV #Floods #Flooding #PrepareActSurvive  https://t.co/7TlljJXHZc",none,,en,['https://flood-warning-information.service.gov.uk/warnings'],,[],"['floods', 'flooding', 'prepareactsurvive']",https://twitter.com/EnvAgencyNW/status/1322969154261979136
9798,1.32e+18,2020-11-01 23:50:57 India Standard Time,01-11-2020,23:50:57,530,1.24e+18,nijamtoday,NijamToday,తెలంగాణకు కేంద్రం రూ.224.50 కోట్లు వరద సహాయం    #CentralAssistance for #Telangana #Floods #Rs224Crores   https://t.co/txUCizh1Jz  https://t.co/xWqZIpa9zQ,,,te,['https://nijamtoday.com/2020/11/01/rs-224-50-cr-central-floods-assistance-to-telangana/'],,['https://pbs.twimg.com/media/ElwfKs6VcAAaAWo.png'],"['centralassistance', 'telangana', 'floods', 'rs224crores']",https://twitter.com/NijamToday/status/1322966874859036672
9799,1.32e+18,2020-11-01 23:50:54 India Standard Time,01-11-2020,23:50:54,530,118122877.0,ait_news,Thailand News,Philippines Battered by Year’s Strongest Typhoon Goni  https://t.co/VIql2owcpi #Floods #Philippines,flood,,en,['https://wp.me/p1onxg-irj'],,[],"['floods', 'philippines']",https://twitter.com/AIT_News/status/1322966863702302720
9800,1.32e+18,2020-11-01 23:15:00 India Standard Time,01-11-2020,23:15:00,530,236338186.0,envagencynw,Env Agency NW,Please take care as driving conditions maybe hazardous.   Listen to traffic reports for advice &amp; any disruptions locally.  https://t.co/uGQ4g6RGOV     #PrepareActSurvive #StaySafe #Floods  https://t.co/Gj8FpEX0Eh,none,,en,['https://flood-warning-information.service.gov.uk/warnings'],,[],"['prepareactsurvive', 'staysafe', 'floods']",https://twitter.com/EnvAgencyNW/status/1322957828034711556
9801,1.32e+18,2020-11-01 23:04:29 India Standard Time,01-11-2020,23:04:29,530,138347068.0,thesiasatdaily,The Siasat Daily,"Rains, natural; floods, manmade--Hyderabad walks from prediction to perdition -  https://t.co/00S9Wl56EP  . #Hyderabad #Rains #Floods",flood,,en,['https://bit.ly/3kNJOA3'],,[],"['hyderabad', 'rains', 'floods']",https://twitter.com/TheSiasatDaily/status/1322955184373485571
9802,1.32e+18,2020-11-01 22:45:05 India Standard Time,01-11-2020,22:45:05,530,1.16e+18,incsweeney,"Sweeney Insurance Agency, Inc","You may not be able to stop #floods from wreaking havoc, but #insurance can manage some of the financial loss.  https://t.co/dJMEN7NRLJ",none,,en,['https://myf.mg/bwDl'],,[],"['floods', 'insurance']",https://twitter.com/IncSweeney/status/1322950302144888832
9803,1.32e+18,2020-11-01 22:45:04 India Standard Time,01-11-2020,22:45:04,530,1.12e+18,cfpcorbin,"Corbin Oliver, CFP®, AIF®, RICP®","You may not be able to stop #floods from wreaking havoc, but #insurance can manage some of the financial loss.  https://t.co/3ogNMDgu9S",none,,en,['https://myf.mg/bwD0'],,[],"['floods', 'insurance']",https://twitter.com/CfpCorbin/status/1322950295513636864
9804,1.32e+18,2020-11-01 22:33:00 India Standard Time,01-11-2020,22:33:00,530,236338186.0,envagencynw,Env Agency NW,"In a #flood: gather essential items (like water, blankets, a torch, first aid kit, essential medication and food) and put them out of the way of flood water to keep dry.   Check your flood risk:  https://t.co/uGQ4g6A5Xn #PrepareActSurvive #SafetyFirst #floods  https://t.co/OZhNbkaLiV",none,,en,['https://flood-warning-information.service.gov.uk/warnings'],,[],"['flood', 'prepareactsurvive', 'safetyfirst', 'floods']",https://twitter.com/EnvAgencyNW/status/1322947258908844032
9805,1.32e+18,2020-11-01 22:31:13 India Standard Time,01-11-2020,22:31:13,530,1295644771.0,kiely_hannah,Hannah Kiely,#Lockdown2 #level5 #day11. Days like this feel like the end of the world #rain #floods #winter #swans it’s like #noahsark #November2020  https://t.co/p05n46Qpka,none,,en,[],,['https://pbs.twimg.com/media/ElwNGvxWkAE_jtD.jpg'],"['lockdown2', 'level5', 'day11', 'rain', 'floods', 'winter', 'swans', 'noahsark', 'november2020']",https://twitter.com/kiely_hannah/status/1322946810227367940
9806,1.32e+18,2020-11-01 21:15:14 India Standard Time,01-11-2020,21:15:14,530,7.11e+17,chriscartw83,Christopher Cartwright,"3 millions square kms of ice missing   And zeke, glen, michael tell us ""all will be fine"" ...Wow  What will happen if #methane kicks in?   #ClimateCrisis #hurricane  #climatechange #GlobalWarming #GretaThunberg   #floods #flooding",none,,en,[],,[],"['methane', 'climatecrisis', 'hurricane', 'climatechange', 'globalwarming', 'gretathunberg', 'floods', 'flooding']",https://twitter.com/chriscartw83/status/1322927689188151302
9807,1.32e+18,2020-11-01 21:14:09 India Standard Time,01-11-2020,21:14:09,530,9.89e+17,ythisnews,Y This News,"Following the outrage of people affected by recent #floods and more so deprived of from #cash relief being taken up off late, #government has decided today to continue #relief distribution in order to provide succor to all those leftover affected families.  https://t.co/3GIzZPnVxX",none,,en,['https://ythisnews.com/relief-to-continue-as-usual-but-government-reserves-the-date/'],,[],"['floods', 'cash', 'government', 'relief']",https://twitter.com/YTHISNEWS/status/1322927415811739648
9808,1.32e+18,2020-11-01 20:49:01 India Standard Time,01-11-2020,20:49:01,530,9.89e+17,ythisnews,Y This News,"As per the instructions of the Chief Minister,  #KCR, the Chief Secretary #SomeshKumar today offered to provide #Cash Relief to all leftover families in the city affected by #floods. #Breakingnews #ythisnews #Hyderabad   https://t.co/9OUSn499XJ",flood,,en,['https://ythisnews.com/cash-relief-to-all-left-over-families-cs/'],,[],"['kcr', 'someshkumar', 'cash', 'floods', 'breakingnews', 'ythisnews', 'hyderabad']",https://twitter.com/YTHISNEWS/status/1322921091082285056
9809,1.32e+18,2020-11-01 19:45:00 India Standard Time,01-11-2020,19:45:00,530,236338186.0,envagencynw,Env Agency NW,Please keep up-to-date with the latest information in your area.   See our latest #flood warnings (updated every 15 minutes): :  https://t.co/uGQ4g6RGOV #Floods #PrepareActSurvive  https://t.co/wZde3bqDeP,none,,en,['https://flood-warning-information.service.gov.uk/warnings'],,[],"['flood', 'floods', 'prepareactsurvive']",https://twitter.com/EnvAgencyNW/status/1322904979867271168
9810,1.32e+18,2020-11-01 19:25:06 India Standard Time,01-11-2020,19:25:06,530,7.11e+17,chriscartw83,Christopher Cartwright,The sadly usual images of devastation after a Cat5 hurricane.  #ClimateCrisis #hurricane  #climatechange #GlobalWarming #GretaThunberg   #floods #flooding  #Goni  https://t.co/bSF6RZGYtk,none,,en,[],,"['https://pbs.twimg.com/media/ElviWSYWoAI5sYZ.jpg', 'https://pbs.twimg.com/media/ElviWSiXEAEvsUe.jpg']","['climatecrisis', 'hurricane', 'climatechange', 'globalwarming', 'gretathunberg', 'floods', 'flooding', 'goni']",https://twitter.com/chriscartw83/status/1322899973483147277
9811,1.32e+18,2020-11-01 18:59:04 India Standard Time,01-11-2020,18:59:04,530,1.1e+18,extremeweathers,Extreme Weather and Natural Disasters,#NaturalDisasters #Flooding  #Vietnam  #Floods  #QuangNam #Naturaldisasters [Natural Disasters] Flooding in Vietnam continues. Floods washed away homes in Quang Nam. Наводнение во Вьетнаме продолжается. Наводнения смыли дома в Куанг Наме.  https://t.co/vZMe9gYtaM через @YouTube,flood,,und,['https://youtu.be/cHDHoDF4s88'],,[],"['naturaldisasters', 'flooding', 'vietnam', 'floods', 'quangnam', 'naturaldisasters']",https://twitter.com/ExtremeWeathers/status/1322893419463741441
9812,1.32e+18,2020-11-01 17:50:23 India Standard Time,01-11-2020,17:50:23,530,211168764.0,skinshere,pure creativity!,"Conwy valley, north Wales floods friday. #NorthWales #floods #conwy #Yorkshire #Wales  https://t.co/ET9q2DX4sY",flood,,en,[],,"['https://pbs.twimg.com/media/ElvM0R4XYAEloxF.jpg', 'https://pbs.twimg.com/media/ElvM0pqWMAE2D8h.jpg', 'https://pbs.twimg.com/media/ElvM1BzXYAAhPjx.jpg', 'https://pbs.twimg.com/media/ElvM1euXUAAN4NG.jpg']","['northwales', 'floods', 'conwy', 'yorkshire', 'wales']",https://twitter.com/skinshere/status/1322876138151157760
9813,1.32e+18,2020-11-01 17:45:07 India Standard Time,01-11-2020,17:45:07,530,89711639.0,trf_climate,TRF Climate,"Super typhoon #Goni weakened after barrelling through southern part of Philippines' main island of Luzon, with officials reporting at least four deaths, power supply outages, infrastructure damage and flash #floods #RollyPH  https://t.co/VNWihtQvwh",flood,,en,['https://tmsnrt.rs/2Jq9m8K'],,[],"['goni', 'floods', 'rollyph']",https://twitter.com/TRF_Climate/status/1322874811538903044
9814,1.32e+18,2020-11-01 17:35:08 India Standard Time,01-11-2020,17:35:08,530,978604706.0,copernicuseu,Copernicus EU,"🌊 Dynamic coastal areas change at small scale due to coastal interventions, wave storms or river #floods.   📊 @CMEMS_EU helps by providing useful data for water quality forecasting and more!  Check out the use case here  https://t.co/JuOj8NMX5f #EUSpace  https://t.co/gC5N1gt9Wh",none,,en,['http://ow.ly/BKrj50zfFvn'],,['https://pbs.twimg.com/media/ElvJV6rWMAQmMtc.jpg'],"['floods', 'euspace']",https://twitter.com/CopernicusEU/status/1322872299578662912
9815,1.32e+18,2020-11-01 17:33:19 India Standard Time,01-11-2020,17:33:19,530,1.29e+18,telugu24_in,Telugu24,#musicdirector #MMKeeravani #sings #song #telanganapolice #TSGovt #TelanganaPoliceForce #PoliceEfforts #DGPMahender #CPAnjaneekumar #floods #helps #policeservices #citizens #appreciates #Policeduty #filmnagar #telugu24news    https://t.co/uHc9wK8Jfr,none,,und,['https://bit.ly/368dx0L'],,[],"['musicdirector', 'mmkeeravani', 'sings', 'song', 'telanganapolice', 'tsgovt', 'telanganapoliceforce', 'policeefforts', 'dgpmahender', 'cpanjaneekumar', 'floods', 'helps', 'policeservices', 'citizens', 'appreciates', 'policeduty', 'filmnagar', 'telugu24news']",https://twitter.com/telugu24_in/status/1322871840943951873
9816,1.32e+18,2020-11-01 17:15:00 India Standard Time,01-11-2020,17:15:00,530,1.23e+18,bengalurulive_,Thebengalurulive/ಬೆಂಗಳೂರು ಲೈವ್,"Siddaramaiah writes to CM, reiterates special Assembly session demand to discuss flood situation   https://t.co/U1C7N0gQNX  #Bangalore #Bengaluru #Karnataka #LeaderofOpposition @Siddaramaiah #session #Assembly #unprecedented #havoc #rains #floods @siddaramaiah @BSYBJP",flood,,en,['https://thebengalurulive.com/siddaramaiah-writes-to-cm-reiterates-special-assembly-session-demand-to-discuss-flood-situation/'],,[],"['bangalore', 'bengaluru', 'karnataka', 'leaderofopposition', 'session', 'assembly', 'unprecedented', 'havoc', 'rains', 'floods']",https://twitter.com/bengalurulive_/status/1322867231185866757
9817,1.32e+18,2020-11-01 17:07:59 India Standard Time,01-11-2020,17:07:59,530,1.27e+18,thainewsroom,ThaiNewsroom.com,Heavy forest runoffs flooded Na Di district of Prachin Buri province and some hotels causing tourists to run out of their rooms in panic. #Thailand #ThailandNews #Floods Read Thai Newsroom Report  https://t.co/mf8stFqV8E,flood,,en,['https://thainewsroom.com/2020/11/01/chaos-as-forest-runoff-floods-popular-resort/'],,[],"['thailand', 'thailandnews', 'floods']",https://twitter.com/thainewsroom/status/1322865464909787136
9818,1.32e+18,2020-11-01 17:00:27 India Standard Time,01-11-2020,17:00:27,530,255925055.0,apo_source,APO Group English,"African Development Bank Group approves $440,000 emergency relief assistance for flood victims in South Sudan and Sudan @AfDB_Group @Akin_Adesina #SouthSudan #Sudan #Floods #Relief #Fund #Humanitarian #Banking #Africa  https://t.co/rOWSeY0kfY",flood,,en,['https://bit.ly/2HXrmq0'],,[],"['southsudan', 'sudan', 'floods', 'relief', 'fund', 'humanitarian', 'banking', 'africa']",https://twitter.com/APO_source/status/1322863568887418901
9819,1.32e+18,2020-11-01 16:59:05 India Standard Time,01-11-2020,16:59:05,530,1054559816.0,dstaikova,Dimitrinka  Staikova,"#MEDIA CONFIRMATION OF : “#TSUNAMI #floods streets along Turkey’s coast after huge #earthquake battered #Turkey and #Greece”, “…#meteor impact has been caught on camera as the object crashed into Earth along the #Armenian-#Turkish border” and...  https://t.co/Ux4LeKX2o3",flood,,en,['https://tmblr.co/Z2TWxmZAxiL3ui00'],,[],"['media', 'tsunami', 'floods', 'earthquake', 'turkey', 'greece', 'meteor', 'armenian', 'turkish']",https://twitter.com/DStaikova/status/1322863226007203842
9820,1.32e+18,2020-11-01 16:59:04 India Standard Time,01-11-2020,16:59:04,530,1054559816.0,dstaikova,Dimitrinka  Staikova,"#MEDIA CONFIRMATION OF : “#TSUNAMI #floods streets along Turkey’s coast after huge #earthquake battered #Turkey and #Greece”, “…#meteor impact has been caught on camera as the object crashed into Earth along the #Armenian-#Turkish border” and “Turkey’s…  https://t.co/NVmDJMRz9Q",flood,,en,['https://uselection2020psychic.wordpress.com/2020/11/01/media-confirmation-of-tsunami-floods-streets-along-turkeys-coast-after-huge-earthquake-battered-turkey-and-greece-meteor-impact-has-been-caught-o/'],,[],"['media', 'tsunami', 'floods', 'earthquake', 'turkey', 'greece', 'meteor', 'armenian', 'turkish']",https://twitter.com/DStaikova/status/1322863222316277765
9821,1.32e+18,2020-11-01 16:53:25 India Standard Time,01-11-2020,16:53:25,530,4437973997.0,stoyankastaikov,Stoyanka Staikova,"#MEDIA CONFIRMATION OF : “#TSUNAMI #floods streets along Turkey’s coast after huge #earthquake battered #Turkey and #Greece”, “…#meteor impact has been caught on camera as the object crashed into Earth along the #Armenian-#Turkish border” and “Turkey’s…  https://t.co/f7twEUA95p",flood,,en,['http://hottestnewspredictionsdimitrinkastaikova2013.home.blog/2020/11/01/media-confirmation-of-tsunami-floods-streets-along-turkeys-coast-after-huge-earthquake-battered-turkey-and-greece-meteor-impact-has-been-caught-o/'],,[],"['media', 'tsunami', 'floods', 'earthquake', 'turkey', 'greece', 'meteor', 'armenian', 'turkish']",https://twitter.com/StoyankaStaikov/status/1322861799314804742
9822,1.32e+18,2020-11-01 16:53:24 India Standard Time,01-11-2020,16:53:24,530,1054559816.0,dstaikova,Dimitrinka  Staikova,"#MEDIA CONFIRMATION OF : “#TSUNAMI #floods streets along Turkey’s coast after huge #earthquake battered #Turkey and #Greece”, “…#meteor impact has been caught on camera as the object crashed into Earth along the #Armenian-#Turkish border” and “Turkey’s…  https://t.co/VKYEK0pOdy",flood,,en,['http://hottestnewspredictionsdimitrinkastaikova2013.home.blog/2020/11/01/media-confirmation-of-tsunami-floods-streets-along-turkeys-coast-after-huge-earthquake-battered-turkey-and-greece-meteor-impact-has-been-caught-o/'],,[],"['media', 'tsunami', 'floods', 'earthquake', 'turkey', 'greece', 'meteor', 'armenian', 'turkish']",https://twitter.com/DStaikova/status/1322861794877202432
9823,1.32e+18,2020-11-01 16:53:07 India Standard Time,01-11-2020,16:53:07,530,4437973997.0,stoyankastaikov,Stoyanka Staikova,"#MEDIA CONFIRMATION OF : “#TSUNAMI #floods streets along Turkey’s coast after huge #earthquake battered #Turkey and #Greece”, “…#meteor impact has been caught on camera as the object crashed into Earth along the #Armenian-#Turkish border” and “Turkey’s…  https://t.co/gWob2cWCjz",flood,,en,['http://psychicnews.home.blog/2020/11/01/media-confirmation-of-tsunami-floods-streets-along-turkeys-coast-after-huge-earthquake-battered-turkey-and-greece-meteor-impact-has-been-caught-o/'],,[],"['media', 'tsunami', 'floods', 'earthquake', 'turkey', 'greece', 'meteor', 'armenian', 'turkish']",https://twitter.com/StoyankaStaikov/status/1322861726031818753
9824,1.32e+18,2020-11-01 16:53:06 India Standard Time,01-11-2020,16:53:06,530,1054559816.0,dstaikova,Dimitrinka  Staikova,"#MEDIA CONFIRMATION OF : “#TSUNAMI #floods streets along Turkey’s coast after huge #earthquake battered #Turkey and #Greece”, “…#meteor impact has been caught on camera as the object crashed into Earth along the #Armenian-#Turkish border” and “Turkey’s…  https://t.co/otbrhUmvng",flood,,en,['http://psychicnews.home.blog/2020/11/01/media-confirmation-of-tsunami-floods-streets-along-turkeys-coast-after-huge-earthquake-battered-turkey-and-greece-meteor-impact-has-been-caught-o/'],,[],"['media', 'tsunami', 'floods', 'earthquake', 'turkey', 'greece', 'meteor', 'armenian', 'turkish']",https://twitter.com/DStaikova/status/1322861722873614336
9825,1.32e+18,2020-11-01 16:52:48 India Standard Time,01-11-2020,16:52:48,530,4437973997.0,stoyankastaikov,Stoyanka Staikova,"#MEDIA CONFIRMATION OF : “#TSUNAMI #floods streets along Turkey’s coast after huge #earthquake battered #Turkey and #Greece”, “…#meteor impact has been caught on camera as the object crashed into Earth along the #Armenian-#Turkish border” and “Turkey’s…  https://t.co/DA84iV238u",flood,,en,['http://clairvoyantdimitrinkastaikova.home.blog/2020/11/01/media-confirmation-of-tsunami-floods-streets-along-turkeys-coast-after-huge-earthquake-battered-turkey-and-greece-meteor-impact-has-been-caught-o/'],,[],"['media', 'tsunami', 'floods', 'earthquake', 'turkey', 'greece', 'meteor', 'armenian', 'turkish']",https://twitter.com/StoyankaStaikov/status/1322861647296262146
9826,1.32e+18,2020-11-01 16:52:46 India Standard Time,01-11-2020,16:52:46,530,1054559816.0,dstaikova,Dimitrinka  Staikova,"#MEDIA CONFIRMATION OF : “#TSUNAMI #floods streets along Turkey’s coast after huge #earthquake battered #Turkey and #Greece”, “…#meteor impact has been caught on camera as the object crashed into Earth along the #Armenian-#Turkish border” and “Turkey’s…  https://t.co/yZrXoV4imJ",flood,,en,['http://clairvoyantdimitrinkastaikova.home.blog/2020/11/01/media-confirmation-of-tsunami-floods-streets-along-turkeys-coast-after-huge-earthquake-battered-turkey-and-greece-meteor-impact-has-been-caught-o/'],,[],"['media', 'tsunami', 'floods', 'earthquake', 'turkey', 'greece', 'meteor', 'armenian', 'turkish']",https://twitter.com/DStaikova/status/1322861635908771840
