,conversation_id,created_at,date,time,timezone,user_id,username,name,tweet,Manual Labels,Auto Label,language,urls,Unnamed: 13,photos,hashtags,link
9501,1.32e+18,2020-11-07 02:43:29 India Standard Time,07-11-2020,2:43:29,530,1.3e+18,tetovaonline,Tetova Online,Flooding in Valencia and Alicante #Inundaciones #Floods #Valencia #Alicante  https://t.co/0tJFHbz316 via @YouTube   #Inundaciones #Floods #Valencia  #Alicante #Spain,flood,,en,['https://youtu.be/TXHeMm1j18o'],,[],"['inundaciones', 'floods', 'valencia', 'alicante', 'inundaciones', 'floods', 'valencia', 'alicante', 'spain']",https://twitter.com/TetovaOnline/status/1324822234423316482
9502,1.32e+18,2020-11-07 02:30:06 India Standard Time,07-11-2020,2:30:06,530,7.27e+17,bagaluesunab,Caribbean disaster,Remains of Hurricane #Eta dumped more torrential rain across large parts of Central America on Friday after days of devastating #floods and landslides that killed dozens of people  https://t.co/MiAjkHsRKv,flood,,en,['https://tmsnrt.rs/3p439Qa'],,[],"['eta', 'floods']",https://twitter.com/BagalueSunab/status/1324818867819085826
9503,1.32e+18,2020-11-07 02:13:50 India Standard Time,07-11-2020,2:13:50,530,89711639.0,trf_climate,TRF Climate,Remains of Hurricane #Eta dumped more torrential rain across large parts of Central America on Friday after days of devastating #floods and landslides that killed dozens of people  https://t.co/6DSRVNdD2E,flood,,en,['https://tmsnrt.rs/3p439Qa'],,[],"['eta', 'floods']",https://twitter.com/TRF_Climate/status/1324814772056051714
9504,1.32e+18,2020-11-07 01:38:24 India Standard Time,07-11-2020,1:38:24,530,2903859174.0,californiadds,California DDS,"A #disaster could happen at any moment like #wildfires, #earthquakes &amp; #floods. When we all do our part, we keep more people safe!   1⃣ Get Official Alerts  2⃣ Make A Plan 3⃣ Pack A Go-Bag  4⃣ Build A Stay Box 5⃣ Help Friends and Neighbors   For more info:  https://t.co/PsO1GjVcDI  https://t.co/Vrk1IqcL1d",none,,en,['http://bit.ly/3afRp5U'],,['https://pbs.twimg.com/media/EmKn5-NVoAAvWCi.jpg'],"['disaster', 'wildfires', 'earthquakes', 'floods']",https://twitter.com/CaliforniaDDS/status/1324805857868046336
9505,1.32e+18,2020-11-07 00:54:05 India Standard Time,07-11-2020,0:54:05,530,1.16e+18,watchourcity,WatchOurCity.com,(AP News) Eta back to sea as Central America tallies damages and dead  https://t.co/5veNVItFjk #AccidentsAndDisasters #Caribbean #CentralAmerica #DiseasesAndConditions #EnvironmentAndNature #Floods #ForeignAid,none,,en,['https://watchourcity.com/ap-news/eta-back-to-sea-as-central-america-tallies-damages-and-dead/?utm_campaign=twitter&utm_medium=twitter&utm_source=twitter'],,[],"['accidentsanddisasters', 'caribbean', 'centralamerica', 'diseasesandconditions', 'environmentandnature', 'floods', 'foreignaid']",https://twitter.com/WatchOurCity/status/1324794704932835328
9506,1.32e+18,2020-11-07 00:45:03 India Standard Time,07-11-2020,0:45:03,530,9.87e+17,tedstromwealth,Tedstrom Wealth Advisors,"You may not be able to stop #floods from wreaking havoc, but #insurance can manage some of the financial loss.  https://t.co/V1fUccmfZa",none,,en,['https://myf.mg/byVM'],,[],"['floods', 'insurance']",https://twitter.com/TedstromWealth/status/1324792431846502400
9507,1.32e+18,2020-11-07 00:34:41 India Standard Time,07-11-2020,0:34:41,530,66000964.0,ertsar,ERT SEARCH & RESCUE,"ETA EMERGENCY: Right now, the rescue and evacuation of the people in the sector ""La Lima, Cortés"" continues, (due to the floods left by the #TropicalEta Depression)   #Floods #Rescue #FloodResponse",flood,,en,[],,[],"['tropicaleta', 'floods', 'rescue', 'floodresponse']",https://twitter.com/ERTSAR/status/1324789822586822659
9508,1.32e+18,2020-11-06 23:17:06 India Standard Time,06-11-2020,23:17:06,530,7.79e+17,arcatierraint,ONG Arca Tierra NGO,#RainWaterCollector  #NGO #ArcaTierra proposes its model of #rain water collector connected to #underground aquifers of the city to avoid #floods and shortages  We presented it at the international congress of #water   See how to build #sustainablecities  https://t.co/gu6dTBChwJ  https://t.co/jmw6SsADJE,none,,en,['https://ongarcatierra.wixsite.com/inicio/curso-3-purificar-aire-agua-oceanos'],,['https://pbs.twimg.com/media/EmKHj8kXgAEannt.jpg'],"['rainwatercollector', 'ngo', 'arcatierra', 'rain', 'underground', 'floods', 'water', 'sustainablecities']",https://twitter.com/arcatierraint/status/1324770294964342786
9509,1.32e+18,2020-11-06 22:31:18 India Standard Time,06-11-2020,22:31:18,530,4778325732.0,hyderabadmpost,Hyderabadmorningpost-City News,"Listen to Mr. Nagaraj Bakka, Swachh Bharat Abhiyan, #Malkajgiri of how they Collected Rs.7000-8000 from each house in January &amp; after 2 months another 5000 from each house.  He says: during the recent #floods #HyderabadFloods, the water entered the houses to a level of 6-7 fee...  https://t.co/J0sfpoeuZj",none,,en,[],,['https://pbs.twimg.com/media/EmJ9FAEVcAA1pz-.jpg'],"['malkajgiri', 'floods', 'hyderabadfloods']",https://twitter.com/Hyderabadmpost/status/1324758769465614337
9510,1.32e+18,2020-11-06 22:13:27 India Standard Time,06-11-2020,22:13:27,530,145243831.0,unosat,UNOSAT,"#Floods in the #Philippines  In Albay &amp; Camarines Sur Provinces, as of 6 Nov.: 🔹~120km² of lands appear to be flooded (📉-120km² since 1st Nov.) 🔹~ 80,000 people are potentially exposed  ➡️ https://t.co/QCdJuJw9wb  #Goni #RollyPH  https://t.co/j7YfmEvnKy",flood,,en,['https://unitar.org/maps/map/3170'],,['https://pbs.twimg.com/media/EmJ4z7FXIAAfm-f.jpg'],"['floods', 'philippines', 'goni', 'rollyph']",https://twitter.com/UNOSAT/status/1324754278272163840
9511,1.32e+18,2020-11-06 21:41:27 India Standard Time,06-11-2020,21:41:27,530,1.23e+18,yash030697,Yash,#dogs  #Floods   Help stray animals too 👇👇  https://t.co/lKAEnqeW6t,none,,en,['https://youtu.be/Z4OoNn1yf6k'],,[],"['dogs', 'floods']",https://twitter.com/yash030697/status/1324746226684755969
9512,1.32e+18,2020-11-06 21:36:08 India Standard Time,06-11-2020,21:36:08,530,8.33e+17,minerva_datalab,Minerva's Data Lab,honduras_flooding_eta_nov3.ipynb - Colaboratory #sentinel for #floods  https://t.co/uvoOtWs9bG,flood,,en,['https://colab.research.google.com/drive/1wP0PBLVlKQ_BnCr8pcNOHpZv1TEAPk1y?usp=sharing'],,[],"['sentinel', 'floods']",https://twitter.com/Minerva_DataLab/status/1324744887661678596
9513,1.32e+18,2020-11-06 21:33:09 India Standard Time,06-11-2020,21:33:09,530,380816669.0,alcisgeo,AlcisGeo,"Extensive #deforestation in #Afghanistan has had multiple social, environmental and economic implications for millions of Afghans, including increasing vulnerability to various natural disasters such as #floods, avalanches and landslides. #EnvConflictDay  https://t.co/iauYr7aBOk",none,,en,[],,['https://pbs.twimg.com/media/EmJvxhLX0AsUTzU.jpg'],"['deforestation', 'afghanistan', 'floods', 'envconflictday']",https://twitter.com/AlcisGeo/status/1324744138579972096
9514,1.32e+18,2020-11-06 21:26:51 India Standard Time,06-11-2020,21:26:51,530,4427415808.0,dada_bze,Dada 🇧🇿,God help us all.... #Eta #Belize #Floods  https://t.co/NymHVyNGxs,flood,,en,[],,"['https://pbs.twimg.com/media/EmJuUSDWoAAH1BS.jpg', 'https://pbs.twimg.com/media/EmJuUgQXEAA-ssa.jpg', 'https://pbs.twimg.com/media/EmJuUrUXEAE0e-w.jpg', 'https://pbs.twimg.com/media/EmJuUznXYAs5AW9.jpg']","['eta', 'belize', 'floods']",https://twitter.com/dada_bze/status/1324742552793305089
9515,1.32e+18,2020-11-06 21:24:25 India Standard Time,06-11-2020,21:24:25,530,574347534.0,rpallanuk,Richard Allan,Global #climate &amp; health hazards @PHE_uk bulletin: #HurricaneEta impacts central America; #TyphoonGoni hits Philippines; flash #floods in Singapore + Thailand &amp; damaging hail in Australia  https://t.co/zcla4J2p8P  https://t.co/1Q68DJSF88,flood,,en,['http://www.met.reading.ac.uk/~sgs02rpa/extreme.html#201106'],,"['https://pbs.twimg.com/media/EmJqkSkW0AA5WBX.jpg', 'https://pbs.twimg.com/media/EmJqkSiXEAEPb6Z.jpg', 'https://pbs.twimg.com/media/EmJrtuCXIAILR59.jpg']","['climate', 'hurricaneeta', 'typhoongoni', 'floods']",https://twitter.com/rpallanuk/status/1324741939892203522
9516,1.32e+18,2020-11-06 21:22:33 India Standard Time,06-11-2020,21:22:33,530,96718576.0,theglobalherald,The Global Herald,Contemporary Drivers of #Conflict and Insecurity - #UN ... -  https://t.co/6dnFVGxZ6b - #Banks #Change #Climate #ClimateChange #Competition #COVID19 #Development #Emergency #Floods #Inequality #Pandemic #PrimeMinister #Resources #Risk #Saint #Security #UnitedNations #Weather,none,,en,['https://theglobalherald.com/news/contemporary-drivers-of-conflict-and-insecurity-un-deputy-secretary-general/'],,[],"['conflict', 'un', 'banks', 'change', 'climate', 'climatechange', 'competition', 'covid19', 'development', 'emergency', 'floods', 'inequality', 'pandemic', 'primeminister', 'resources', 'risk', 'saint', 'security', 'unitednations', 'weather']",https://twitter.com/TheGlobalHerald/status/1324741469618479104
9517,1.32e+18,2020-11-06 21:20:54 India Standard Time,06-11-2020,21:20:54,530,1227019398.0,signalert,SIGNALERT,"#floods and #tsunamis are cause of very heavy #pollutions of ground water and soils by spreading and mixing all pollutants sources ripped out from their original places, including, cars, trucks, boats, planes, tanks, also by breaking pipes.  https://t.co/yc3XBUOjmr",none,,en,['https://www.linkedin.com/posts/undrr_tsunamis-are-rare-events-but-there-have-at-activity-6730407158669746177-B1Zl'],,[],"['floods', 'tsunamis', 'pollutions']",https://twitter.com/Signalert/status/1324741053111509001
9518,1.32e+18,2020-11-06 21:10:17 India Standard Time,06-11-2020,21:10:17,530,1945979065.0,oneindiabengali,Oneindia Bengali,"ফের বন্যার ভ্রুকুটি তামিলনাড়ুতে, ত্রাণকার্যের জন্য যুদ্ধকালীন তৎপরতায় চলছে আগাম প্রস্তুতির কাজ #TamilNadu #flood #Floods    https://t.co/deuq8gQDKQ",,,bn,['https://bit.ly/32k5FrK'],,[],"['tamilnadu', 'flood', 'floods']",https://twitter.com/OneindiaBengali/status/1324738381398487041
9519,1.32e+18,2020-11-06 20:29:37 India Standard Time,06-11-2020,20:29:37,530,472375710.0,lennayuso,Lenn ✨🌻💎,Aerial shots of #sanignacio #Cayo #Belize as #floods keep getting worse and #Eta is close to Belize. #EtaBelize #flooding #rain  https://t.co/jiGZFLFvhw,flood,,en,[],,"['https://pbs.twimg.com/media/EmJhNs2XYAEsAfG.jpg', 'https://pbs.twimg.com/media/EmJhN9eXEAE_M-3.jpg', 'https://pbs.twimg.com/media/EmJhOyrXEAA2Fpj.jpg']","['sanignacio', 'cayo', 'belize', 'floods', 'eta', 'etabelize', 'flooding', 'rain']",https://twitter.com/LennAyuso/status/1324728150065106944
9520,1.32e+18,2020-11-06 20:00:12 India Standard Time,06-11-2020,20:00:12,530,3030504268.0,rgs_ibghe,RGS-IBG Higher Ed,"“Extreme events like #bushfires and #floods are rarely related in a simple way to general trends in #climate” – Keith Richards (@CamUniGeography) for #TheGJ, now #openaccess and in Early View  https://t.co/eAt4BHAZaj  https://t.co/NnAVxihVEX",none,,en,['http://orlo.uk/uo9Ov'],,['https://pbs.twimg.com/media/EmJaf1HXIAExYpE.png'],"['bushfires', 'floods', 'climate', 'thegj', 'openaccess']",https://twitter.com/RGS_IBGhe/status/1324720745499549699
9521,1.32e+18,2020-11-06 19:49:50 India Standard Time,06-11-2020,19:49:50,530,1416535898.0,bobghosn,Bob Ghosn,"Are you still watching @cnn? In #DRCongo the #RedCross volunteers distributed shrlter kits and other essential items to communities affected by #Floods in #Sake  At moments of need, @crrdc1 volunteers are always here to help. We @IFRC_DREF are happy to support thanks to @eu_echo  https://t.co/DXiGhXNhvq",flood,,en,[],,"['https://pbs.twimg.com/media/EmJYGN8XgAAlwZe.jpg', 'https://pbs.twimg.com/media/EmJYGz4X0AAYH_A.jpg', 'https://pbs.twimg.com/media/EmJYHYAXIAItO-4.jpg', 'https://pbs.twimg.com/media/EmJYHjiXIAImjiD.jpg']","['drcongo', 'redcross', 'floods', 'sake']",https://twitter.com/BobGhosn/status/1324718135052820480
9522,1.32e+18,2020-11-06 19:24:29 India Standard Time,06-11-2020,19:24:29,530,2430905582.0,redcrescent,Türk Kızılay International,"We are with you, rain or shine. 🇸🇩🇹🇷  After the #floods in #Sudan destroyed their homes, we supported families living in tents with food parcels📦 .  https://t.co/vlNBMnTTSt",flood,,en,[],,"['https://pbs.twimg.com/media/EmJSURHXEAEtuqj.jpg', 'https://pbs.twimg.com/media/EmJSURsX0AE7P-R.jpg', 'https://pbs.twimg.com/media/EmJSURUWMAAZ3Vq.jpg', 'https://pbs.twimg.com/media/EmJSURfWoAELtcr.jpg']","['floods', 'sudan']",https://twitter.com/RedCrescent/status/1324711756690792452
9523,1.32e+18,2020-11-06 19:20:10 India Standard Time,06-11-2020,19:20:10,530,370100339.0,janebrook76,Jane Brook,Fog and floods. Atmospheric and magical #york #floods #fog #beautiful @itvweather @bbcweather @Hudsonweather  https://t.co/7L1Rhx4cGo,none,,en,[],,"['https://pbs.twimg.com/media/EmJRUM1WMAELIR_.jpg', 'https://pbs.twimg.com/media/EmJRUM2WoAAYPgi.jpg', 'https://pbs.twimg.com/media/EmJRUNaW0AIyrxD.jpg']","['york', 'floods', 'fog', 'beautiful']",https://twitter.com/janebrook76/status/1324710669820825600
9524,1.32e+18,2020-11-06 19:20:01 India Standard Time,06-11-2020,19:20:01,530,8.64e+17,mydglobal,Leann HC,"""...we all need to do our share to be prepared."" Are you ready? Get your guide today.   https://t.co/vADdh8yRgA  #naturaldisaster #wildfire #floods #earthquake  https://t.co/6dn7dUO0d9",none,,en,['https://amzn.to/3cGbrrw'],,['https://pbs.twimg.com/media/EmJRTL8WoAE1-el.jpg'],"['naturaldisaster', 'wildfire', 'floods', 'earthquake']",https://twitter.com/MYDglobal/status/1324710632520884225
9525,1.32e+18,2020-11-06 18:06:05 India Standard Time,06-11-2020,18:06:05,530,3592336280.0,syedakbartoi,Syed Akbar,"#Hussainsagar lake: The table⬇️shows the extent of #encroachment on the #original #waterspread area of the iconic #lake. Had these encroachments not there, there would not have been #flash #floods in parts of #Khairatabad &amp; #Somajiguda. #HyderabadRains2020  https://t.co/1tekRyd9mp",none,,en,[],,['https://pbs.twimg.com/media/EmI_KqRVoAAJMtX.jpg'],"['hussainsagar', 'encroachment', 'original', 'waterspread', 'lake', 'flash', 'floods', 'khairatabad', 'somajiguda', 'hyderabadrains2020']",https://twitter.com/SyedAkbarTOI/status/1324692025455697920
9526,1.32e+18,2020-11-06 18:00:58 India Standard Time,06-11-2020,18:00:58,530,2381891834.0,shakeelgs_utats,Md Shakeel Ahmed Gen. Sec. UTA-TS,@ECISVEEP Requesting to Extend the enrollment dates of GRADUATES MLC VOTERS dates as Telangana State suffers a lot of difficulties in during earlier alloted period #Floods #covid_19 #heavyrainfallls atleast for fortnight... I @ShakeelGS_UTATS,flood,,en,[],,[],"['floods', 'covid_19', 'heavyrainfallls']",https://twitter.com/ShakeelGS_UTATS/status/1324690737372409856
9527,1.32e+18,2020-11-06 17:49:02 India Standard Time,06-11-2020,17:49:02,530,282091864.0,jamintl,JAMINTL,"JAM is assisting vulnerable, flood-affected communities through emergency food assistance, shelter and nutrition outreaches in #SouthSudan   #Floods #Africa #EmergencyResponse  https://t.co/1VBCJ1IAKM",flood,,en,[],,['https://pbs.twimg.com/media/EmI8egGWMAIfpnZ.jpg'],"['southsudan', 'floods', 'africa', 'emergencyresponse']",https://twitter.com/JAMINTL/status/1324687737182658562
9528,1.32e+18,2020-11-06 17:34:59 India Standard Time,06-11-2020,17:34:59,530,1.32e+18,hazardandhope,Hazard + Hope,We're thrilled to announce the release of our first episode which looks at 'What makes up flood water?'    https://t.co/u4edf2UtlV  We've created this to raise awareness of the significant threat that flood water can pose.  #flood #flooding #floods #floodwater #notjustmuddywater,none,,en,['https://youtu.be/MoMI6c27uOE'],,[],"['flood', 'flooding', 'floods', 'floodwater', 'notjustmuddywater']",https://twitter.com/HazardandHope/status/1324684198507126785
9529,1.32e+18,2020-11-06 17:10:09 India Standard Time,06-11-2020,17:10:09,530,2394657106.0,hancloke,Hannah Cloke,Really looking forward to the #ReadingClimateFestival 🌧️🌊 I'll be answering your questions on #floods &amp; #climate on 13 November ⤵️,none,,en,[],,[],"['readingclimatefestival', 'floods', 'climate']",https://twitter.com/hancloke/status/1324677949472296961
9530,1.32e+18,2020-11-06 16:51:09 India Standard Time,06-11-2020,16:51:09,530,2590835076.0,nh_india,National Herald,"Youth Congress leader #MohammadHarisNalapad had launched a unique solution seeking campaign #LetsTakeCharge’ , where he invited youngsters to share their ideas to improve infrastructure in #Karnataka and #Bengaluru that were hard hit by #floods recently  https://t.co/DNjPoJVa3c",flood,,en,['https://www.nationalheraldindia.com/national/lets-take-charge-karnataka-youth-congress-receives-20k-suggestions-for-infrastructure-improvement'],,[],"['mohammadharisnalapad', 'letstakecharge', 'karnataka', 'bengaluru', 'floods']",https://twitter.com/NH_India/status/1324673167487623168
9531,1.32e+18,2020-11-06 16:30:43 India Standard Time,06-11-2020,16:30:43,530,142316146.0,leeoconnor79,Lee O'Connor,https://t.co/dSd2SZojtr BIBA welcomes the report into the experiences of many residents and businesses affected by last year’s floods and shares the ambition to work with stakeholders  #BIBA #Floods #Insurance,none,,en,['http://ow.ly/oCI550CcayF'],,[],"['biba', 'floods', 'insurance']",https://twitter.com/LeeOConnor79/status/1324668025933619200
9532,1.32e+18,2020-11-06 16:14:16 India Standard Time,06-11-2020,16:14:16,530,3184796214.0,unfpa_vietnam,UNFPA Viet Nam,"VOV Traffic News: At least 5.5 million people have been affected by #floods in Central #Vietnam, including more than 1,3 million women of #reproductive age. UNFPA provides USD540,000 for #Dignity Kits and other essential supplies &amp; services for women:  https://t.co/DTyRGepTpC  https://t.co/2slRuYgdJj",flood,,en,['https://bit.ly/3eALuKX'],,"['https://pbs.twimg.com/media/EmIl6MEVoAMloIW.jpg', 'https://pbs.twimg.com/media/EmImanxUcAIslU_.jpg', 'https://pbs.twimg.com/media/EmImvlOVgAI9dtu.jpg', 'https://pbs.twimg.com/media/EmImvlXVoAE-vhs.jpg']","['floods', 'vietnam', 'reproductive', 'dignity']",https://twitter.com/unfpa_vietnam/status/1324663888734904320
9533,1.32e+18,2020-11-06 15:14:16 India Standard Time,06-11-2020,15:14:16,530,89711639.0,trf_climate,TRF Climate,"More than 70 people reported killed across Central America due mostly to mudslides brought by storm #Eta, and hundreds stranded on rooftops or cut off by #floods  https://t.co/MdSfE23Nkx",flood,,en,['https://tmsnrt.rs/2U0SLdu'],,[],"['eta', 'floods']",https://twitter.com/TRF_Climate/status/1324648786828951552
9534,1.32e+18,2020-11-06 14:50:45 India Standard Time,06-11-2020,14:50:45,530,4628763076.0,floodalliance,Zurich Flood Resilience Alliance,Learn how @mercycorps_uk have supported local governments in Nepal to develop climate smart and risk informed plans that increase #resilience to the #pandemic as well as natural hazards like #floods in new blog from @sazzannpn and @Yokookura01 👉  https://t.co/DAyUC8OFfw  https://t.co/au3lyWuMpO,none,,en,['https://floodresilience.net/blogs/strengthening-community-resilience-in-times-of-covid-19'],,['https://pbs.twimg.com/media/EmITlEJW0AEhYOM.jpg'],"['resilience', 'pandemic', 'floods']",https://twitter.com/floodalliance/status/1324642869047603200
9535,1.32e+18,2020-11-06 14:43:07 India Standard Time,06-11-2020,14:43:07,530,892995073.0,ifrcafrica,IFRC Africa,"#SouthSudan #floods have affected nearly one million people.    @SSRCS has been #onthefrontline, bringing essential household items to families affected by #flooding including in Bor, South Sudan. #FridayMotivation  https://t.co/vH31ouVE4t",flood,,en,[],,['https://pbs.twimg.com/media/EmIRu-9WMAEE2vl.jpg'],"['southsudan', 'floods', 'onthefrontline', 'flooding', 'fridaymotivation']",https://twitter.com/IFRCAfrica/status/1324640947779571720
9536,1.32e+18,2020-11-06 14:40:51 India Standard Time,06-11-2020,14:40:51,530,1.23e+18,10tvn,10Tv News,గోదావరికి వరదలొచ్చిన ఆగని పోలవరం పనులు..  #PolavarmProject #Floods #Godavari #AndhraPradesh    https://t.co/aUmjLlAbOG,,,te,['https://10tv.in/polavaram-works-still-working-even-floods-from-godavari/'],,[],"['polavarmproject', 'floods', 'godavari', 'andhrapradesh']",https://twitter.com/10tvN/status/1324640376766959618
9537,1.32e+18,2020-11-06 14:36:01 India Standard Time,06-11-2020,14:36:01,530,1377339774.0,saado_ssd,SAADO,"08:229, 031:086 &amp; Alt-4516M #SAADO`s WGFS in Jiech-Ayod submerged in #Floods. The WGFS was established to provide women and girls with safer place in order to access services, info &amp; much needed psychosocial &amp; peer support. The floods &amp;  hyacinth stampedes operations #UNFPA #SSOT  https://t.co/EsS0x21Rok",none,,en,[],,"['https://pbs.twimg.com/media/EmIQAE_XYAEFgua.jpg', 'https://pbs.twimg.com/media/EmIQAFWXYAQqzXt.jpg', 'https://pbs.twimg.com/media/EmIQAFjXgAE3YoA.jpg']","['saado', 'floods', 'unfpa', 'ssot']",https://twitter.com/SAADO_SSD/status/1324639163854049280
9538,1.32e+18,2020-11-06 14:30:00 India Standard Time,06-11-2020,14:30:00,530,55186601.0,nst_online,New Straits Times,"#NSTnation ""There will be no cramped halls as an entire school will be utilised as a relief centre. Some families will use its classrooms.""    https://t.co/OQ3SBTTyo1  #Pahang #Floods #Monsoon #SOP",none,,en,['https://www.nst.com.my/news/nation/2020/11/638668/new-normal-evacuation-centres'],,[],"['nstnation', 'pahang', 'floods', 'monsoon', 'sop']",https://twitter.com/NST_Online/status/1324637647126597637
9539,1.32e+18,2020-11-06 14:00:04 India Standard Time,06-11-2020,14:00:04,530,898507447.0,intelligentins,Intelligent Insurer,none,flood,,en,['https://bit.ly/3k3zsuX'],,[],"['insurance', 'floods', 'protection']",https://twitter.com/intelligentins/status/1324630114940919808
9540,1.32e+18,2020-11-06 13:13:07 India Standard Time,06-11-2020,13:13:07,530,140791698.0,mixdevil66,MIX,"New Technology May Save #Venice From Future Devastating #Floods. MOSE, a flooding defense system that creates a temporary dam, can prevent devastating floods that frequently create damage in Venice.  https://t.co/P1eH181sli  https://t.co/v92s9r0lkm",flood,,en,['https://mymodernmet.com/mose-system-venice-flooding/'],,"['https://pbs.twimg.com/media/EmH9QTYXYAEoW-z.png', 'https://pbs.twimg.com/media/EmH9S_uWkAAcxJE.png']","['venice', 'floods']",https://twitter.com/mixdevil66/status/1324618300018614272
9541,1.32e+18,2020-11-06 12:42:27 India Standard Time,06-11-2020,12:42:27,530,253615321.0,alexwitzleben,Alex von Witzleben,Storm Eta leaves many dozens dead across Central America  https://t.co/blrkkJtkgp #flooding #floods #ClimateActionNow #ClimateChangeIsreal #ClimateEmergency #ClimateCrisis #GretaThunberg,flood,,en,['https://www.theguardian.com/world/2020/nov/05/storm-eta-leaves-many-dozens-dead-across-central-america?CMP=Share_AndroidApp_Other'],,[],"['flooding', 'floods', 'climateactionnow', 'climatechangeisreal', 'climateemergency', 'climatecrisis', 'gretathunberg']",https://twitter.com/AlexWitzleben/status/1324610582268518401
9542,1.32e+18,2020-11-06 12:33:06 India Standard Time,06-11-2020,12:33:06,530,147156224.0,frakara,francesco cara,"Category 4 #HurricaneEta has unleashed torrential rains throughout #CentralAmerica  causing widespread #Floods, devastating #mudslides and nearly 100 #deaths in #Guatemala #Honduras #Nicaragua #CostaRica @ClimateReality #ClimateCrisis  https://t.co/H6gdpmlfwU",flood,,en,['https://www.nytimes.com/2020/11/05/world/americas/eta-guatemala-mudslides-central-america.html'],,[],"['hurricaneeta', 'centralamerica', 'floods', 'mudslides', 'deaths', 'guatemala', 'honduras', 'nicaragua', 'costarica', 'climatecrisis']",https://twitter.com/frakara/status/1324608228844601344
9543,1.32e+18,2020-11-06 12:00:56 India Standard Time,06-11-2020,12:00:56,530,1309973761.0,oakarservices,Oakar Services,Use  https://t.co/8k5NxuRsIT Enterprise Time analysis feature to analyse the impacts of natural calamities over time.  #Floods #earthquake #BlackFriday  https://t.co/C40Oa6W6dD,none,,en,['http://M.App'],,['https://pbs.twimg.com/media/EmHsc_LXIAA1LNa.jpg'],"['floods', 'earthquake', 'blackfriday']",https://twitter.com/OakarServices/status/1324600135662346240
9544,1.32e+18,2020-11-06 11:52:34 India Standard Time,06-11-2020,11:52:34,530,220826105.0,axolotcat,Enrique Velasco,#rural #floods,none,,und,[],,[],"['rural', 'floods']",https://twitter.com/AxolotCat/status/1324598030000148482
9545,1.32e+18,2020-11-06 11:37:15 India Standard Time,06-11-2020,11:37:15,530,8.29e+17,wfp_southsudan,WFP South Sudan,"#HappeningNow: @WFP providing food assitance to people affected by floods in Jonglei, taking refuge in Mangalla. The host communities are also receiving assitance.  #SSOT #Floods  https://t.co/VRdHbs5U9w",flood,,en,[],,"['https://pbs.twimg.com/media/EmHm52MXgAAqQma.jpg', 'https://pbs.twimg.com/media/EmHm52nXgAASnWA.jpg']","['happeningnow', 'ssot', 'floods']",https://twitter.com/WFP_SouthSudan/status/1324594175719968768
9546,1.32e+18,2020-11-06 11:18:45 India Standard Time,06-11-2020,11:18:45,530,1.16e+18,qazetaz1,Qazetaz,Dozens dead as Eta wreaks waterlogged havoc on Central America  https://t.co/C2I3n1j9lo   #CentralAmerika #disaster #floods #NaturalDisaster,flood,,en,['https://qazet.az/headlines/world-en/212124/'],,[],"['centralamerika', 'disaster', 'floods', 'naturaldisaster']",https://twitter.com/qazetaz1/status/1324589517223923712
